datetime,headline,summary,source,url,categories,tags,api_source
2025-06-11T20:52:29,"Bitcoin Could Rally Toward $115,000 Amid Positive US Data and Bullish Technical Signals","Bitcoin’s technical indicators and favorable US economic data are setting the stage for a potential rally towards $115,000. Investor sentiment has surged to a seven-month peak, supported by a bullish",coinotag,https://en.coinotag.com/bitcoin-could-rally-toward-115000-amid-positive-us-data-and-bullish-technical-signals/,"BTC|BUSINESS|MARKET|TRADING","Analysis|Bitcoin|News|BTC|Core",cryptocompare
2025-06-11T20:50:59,"Alarming: Strategy Bitcoin Holdings May Undermine BTC’s Safe-Haven Status, Sygnum Warns","BitcoinWorld Alarming: Strategy Bitcoin Holdings May Undermine BTC’s Safe-Haven Status, Sygnum Warns Are the massive Bitcoin holdings of Strategy (formerly MicroStrategy) a double-edged sword? While their aggressive accumulation strategy has certainly put Bitcoin on the map for corporate treasuries, a recent Sygnum Bitcoin report suggests this very approach could introduce risks that challenge one of Bitcoin’s most touted characteristics: its potential as a safe-haven asset. Understanding Strategy’s Massive Strategy Bitcoin Holdings Strategy, led by Michael Saylor, has become synonymous with corporate Bitcoin adoption. Their strategy is clear: accumulate as much Bitcoin as possible. They are currently the largest corporate holder of BTC, holding a staggering 582,000 BTC. This represents nearly 3% of Bitcoin’s maximum supply of 21 million coins. Their stated goal is even more ambitious, reportedly aiming to own up to 5% of the total BTC supply. This level of concentration in the hands of a single, publicly traded company is unprecedented in the cryptocurrency space. It raises questions about the potential impact on market dynamics and Bitcoin’s perception among different types of investors, especially institutional ones and, as Sygnum points out, potentially central banks looking for reserve assets. How Does the MicroStrategy Bitcoin Strategy Work? Strategy hasn’t simply bought Bitcoin with spare cash. Their MicroStrategy Bitcoin strategy involves several sophisticated, and some might say aggressive, financial maneuvers. Sherwood’s analysis highlights two key methods: Leveraging Convertible Debt: Strategy has repeatedly issued convertible senior notes (a type of debt that can be converted into company stock under certain conditions). The funds raised from this debt are then primarily used to purchase more Bitcoin. This allows them to acquire BTC without diluting existing shareholders immediately, but it adds leverage to their balance sheet tied directly to Bitcoin’s price performance and their own stock price. Utilizing Stock Momentum: During Bitcoin bull runs, Strategy’s stock price often performs exceptionally well, trading at a premium partly due to its large BTC holdings. Strategy has capitalized on this by selling stock or using its elevated valuation to facilitate further debt issuance for more BTC purchases. This approach is designed for rapid accumulation during favorable market conditions, but it inherently links the fate of Strategy’s balance sheet and its ability to service or convert its debt directly to the volatile price movements of Bitcoin and its own stock. Could This Corporate Bitcoin Strategy Threaten BTC’s Safe-Haven Status? This is the core concern highlighted in the Sygnum Bitcoin report. A safe-haven asset is typically defined as an investment that is expected to retain or increase in value during times of market turbulence or economic uncertainty. Gold is a traditional example. Sygnum researchers argue that Strategy’s highly leveraged and concentrated Corporate Bitcoin strategy introduces a systemic risk factor for Bitcoin itself. Here’s why: Forced Selling Risk: The Sygnum report points out a critical vulnerability in Strategy’s structure. If Bitcoin’s price experiences a significant and prolonged decline, and concurrently Strategy’s stock price drops below the conversion price of its outstanding convertible notes, the structure could ‘crack’. This scenario could potentially force Strategy to sell a portion of its substantial Bitcoin holdings to meet debt obligations or avoid insolvency. Impact of Large Sales: A forced sale of hundreds or thousands of Bitcoin by the single largest corporate holder could have a material negative impact on Bitcoin’s price, exacerbating a downturn. Perception Shift: The possibility of a major holder being forced to sell due to financial engineering tied to market downturns is contrary to the idea of an asset being a stable store of value or a hedge against crisis. It suggests that a significant portion of BTC supply is held in a precarious financial structure, making Bitcoin appear less like a ‘safe’ haven and more like a leveraged speculation vehicle, at least regarding this large block of supply. This concern is particularly relevant when considering Bitcoin’s potential adoption as a reserve asset by more conservative entities like central banks or large institutional treasuries, who prioritize stability and low counterparty risk. What Does the Sygnum Bitcoin Report Mean for Investors? The Sygnum report doesn’t necessarily suggest Bitcoin is a bad investment, but it highlights a specific risk vector introduced by the scale and financing methods of Strategy’s holdings. For investors, it’s an important point to consider: Concentration Risk: A significant portion of Bitcoin’s circulating supply is concentrated in one corporate entity with leveraged financing. Liquidation Risk: While not guaranteed, the potential for forced selling exists under specific adverse market conditions. Impact on Narrative: The incident, should it occur, could damage the narrative of Bitcoin as a purely decentralized, uncorrelated safe haven, potentially slowing broader institutional adoption. It’s a reminder that even in a decentralized asset like Bitcoin, the actions and financial health of major participants can have significant implications. Conclusion: Navigating the Implications of Large Strategy Bitcoin Holdings Strategy’s bold Corporate Bitcoin strategy has been a major story in the crypto world, driving interest and demonstrating a potential use case for corporate treasuries. However, as the Sygnum Bitcoin report carefully outlines, the method of accumulation, particularly the reliance on leveraged debt, introduces a systemic risk. The sheer scale of Strategy Bitcoin holdings means that any distress selling could have a noticeable impact on the market, potentially undermining the very narrative of Bitcoin as a reliable safe haven, especially for risk-averse entities. While Bitcoin’s fundamental properties remain, the financial structures built around large holdings like Strategy’s add layers of complexity and potential vulnerability that investors should be aware of. To learn more about the latest crypto market trends, explore our article on key developments shaping Bitcoin price action. This post Alarming: Strategy Bitcoin Holdings May Undermine BTC’s Safe-Haven Status, Sygnum Warns first appeared on BitcoinWorld and is written by Editorial Team",bitcoinworld,https://bitcoinworld.co.in/strategy-bitcoin-holdings-sygnum/,"BTC|BUSINESS|FIAT|MARKET|TRADING","Crypto News|BITCOIN|Microstrategy|safe haven|strategy|Sygnum",cryptocompare
2025-06-11T20:43:47,"GameStop Raising Another $1.75B for Potential Bitcoin Purchases","GameStop Raising Another $1.75B for Potential Bitcoin Purchases $BTC #Bitcoin",coinotag,https://en.coinotag.com/breakingnews/gamestop-raising-another-1-75b-for-potential-bitcoin-purchases/,"BTC","",cryptocompare
2025-06-11T20:43:33,"GameStop Raising Another $1.75B for Potential Bitcoin Purchases","GameStop (GME), the embattled video game retailer turned meme stock, announced Wednesday a $1.75 billion convertible senior note offering. Proceeds will be used at least in part for ""making investments in a manner consistent with GameStop’s Investment Policy,"" per a company press release . Said investment policy is to add bitcoin as a treasury reserve asset, according to a March release from the company. Today's offering, only open to qualified institutional buyers, includes an option for purchasers to buy an additional $250 million in notes within two weeks of the initial issuance,. The notes carry no regular interest and will mature in June 2032 unless they are converted or repurchased earlier. Following the March announcement of the bitcoin treasury strategy, GameStop raised $1.3 billion through another convertible note offering. The company subsequently purchased 4,710 bitcoin for roughly $500 million during May. GME shares were lower by 10% in after hours trading.",coindesk,https://www.coindesk.com/business/2025/06/11/gamestop-raising-another-175b-for-potential-bitcoin-purchases,"BTC|BUSINESS|FIAT|REGULATION|SPONSORED","Finance|GameStop|Bitcoin|News",cryptocompare
2025-06-11T20:41:49,"Crypto King in the Shadows: Satoshi Clocks in Among Top 10 Wealthiest Individuals","As of Wednesday, June 11, 2025, the latest figures show that Satoshi Nakamoto has officially joined the ranks of the world’s ten wealthiest individuals—all thanks to a treasure trove of just over 1 million BTC, valued at today’s exchange rate. $119B and Counting: Bitcoin’s Mysterious Founder Climbs the Wealth Ladder Bitcoin’s elusive creator—the still-anonymous mind",bitcoin.com,https://news.bitcoin.com/crypto-king-in-the-shadows-satoshi-clocks-in-among-top-10-wealthiest-individuals/,"BTC|EXCHANGE","Crypto News|Bitcoin (BTC)|Satoshi Nakamoto",cryptocompare
2025-06-11T20:40:59,"US Spot Bitcoin ETF Inflows: $427M Surge Signals Strong Market Confidence","BitcoinWorld US Spot Bitcoin ETF Inflows: $427M Surge Signals Strong Market Confidence Exciting news from the world of digital asset investments! The US spot Bitcoin ETF market experienced a significant boost on June 10th, recording substantial net inflows. This positive trend continues, highlighting growing investor interest and confidence in Bitcoin as an asset class accessible through traditional financial instruments. What’s Driving the Latest US Spot Bitcoin ETF Inflows? After a period of outflows, the fact that US spot Bitcoin ETF products are seeing consecutive days of net inflows is a notable shift. This latest surge, totaling $427.88 million on June 10th, suggests renewed positive sentiment among investors. Several factors could be contributing to this: Bitcoin Price Action: Recent price stability or upward movement in Bitcoin can often correlate with increased interest in ETFs. Macroeconomic Outlook: Shifts in the broader economic landscape, such as inflation data or central bank policies, can influence investor appetite for alternative assets like Bitcoin. Institutional Interest: Large financial institutions continue to explore and allocate capital to Bitcoin, often utilizing the regulated ETF structure. Market Sentiment: Overall positive news or developments within the crypto space can boost confidence and encourage investment. These inflows indicate that capital is actively flowing into these regulated investment vehicles, providing traditional investors with an easier way to gain exposure to Bitcoin’s price movements. Breaking Down the Bitcoin ETF Inflows Data Let’s look at the specifics of the Bitcoin ETF inflows for June 10th. The data, compiled by analyst Trader T, shows a clear picture of which funds are attracting the most capital. While the total net inflow was impressive, the contributions varied among the different issuers. Here’s a snapshot of the activity: ETF Ticker Issuer Net Inflow/Outflow (Millions USD) IBIT BlackRock +$333.51 FBTC Fidelity +$67.07 ARKB ARK Invest +$20.25 BTCO Invesco +$7.65 BITB Bitwise -$0.60 Other US Spot Bitcoin ETFs Various $0.00 As the table shows, BlackRock’s IBIT fund was the clear leader, accounting for the vast majority of the day’s inflows. Fidelity’s FBTC also saw significant positive movement, followed by ARKB and BTCO. Only Bitwise’s BITB registered a minor net outflow, while others remained unchanged for the day. Leading the Pack: Why IBIT and Other Bitcoin ETFs Are Attracting Capital The strong performance of funds like IBIT and FBTC in attracting capital isn’t surprising. These are products offered by major financial institutions with extensive distribution networks and brand recognition. Investors often gravitate towards issuers they trust and are familiar with. The structure of these Bitcoin ETFs offers several benefits to investors: Accessibility: They trade on traditional stock exchanges, making them easy to buy and sell through standard brokerage accounts. Regulation: Being regulated financial products provides a level of oversight and investor protection not always found when buying Bitcoin directly on crypto exchanges. Convenience: Investors don’t need to worry about managing private keys or setting up digital wallets. While the benefits are clear, potential challenges exist, such as management fees and tracking error (though many US spot Bitcoin ETFs have relatively low fees, especially initially). However, the consistent inflows into the leading funds suggest that for many, the benefits currently outweigh these considerations. Understanding the Impact on the Crypto Market The sustained inflow into Bitcoin ETFs has a tangible impact on the broader Crypto market . When investors buy shares in a spot Bitcoin ETF, the issuer typically buys an equivalent amount of actual Bitcoin to back those shares. This creates consistent buying pressure on the underlying asset. Increased demand for Bitcoin, driven in part by these ETF purchases, can contribute to positive price momentum. Furthermore, strong ETF inflows can signal broader mainstream and institutional acceptance of Bitcoin, improving overall market sentiment. While the Crypto market is influenced by many factors, including macroeconomic news, technological developments, and regulatory updates, the performance of the US spot Bitcoin ETFs has become a key indicator to watch. Their ability to consistently attract capital from traditional finance is a significant bullish signal for Bitcoin and the wider digital asset space. Summary: A Positive Signal for Bitcoin’s Future The net inflow of over $427 million into US spot Bitcoin ETF products on June 10th is more than just a daily statistic; it represents a continuation of positive momentum and reinforces the growing acceptance of Bitcoin within traditional finance. Led by strong contributions to IBIT and other major funds, these inflows demonstrate healthy demand and investor confidence. As Bitcoin ETF inflows persist, they provide a steady source of buying pressure and act as a crucial bridge between conventional investment portfolios and the dynamic Crypto market , hinting at a promising trajectory for digital asset adoption. To learn more about the latest crypto market trends, explore our article on key developments shaping Bitcoin institutional adoption. This post US Spot Bitcoin ETF Inflows: $427M Surge Signals Strong Market Confidence first appeared on BitcoinWorld and is written by Editorial Team",bitcoinworld,https://bitcoinworld.co.in/us-spot-bitcoin-etf-inflows-11/,"BTC|BUSINESS|FIAT|MARKET|TRADING","Crypto News|BITCOIN|Crypto Investment|ETFs|financial markets|spot Bitcoin ETF",cryptocompare
2025-06-11T20:37:46,"Nigerian SEC Issues Warning Over Crypto Bridge Exchange Amid Withdrawal Fee Concerns on Bitcoin Holdings","The Nigerian Securities and Exchange Commission (SEC) has issued a stern warning against Crypto Bridge Exchange (CBEX) for operating without regulatory approval, raising significant concerns about investor protection and market",coinotag,https://en.coinotag.com/nigerian-sec-issues-warning-over-crypto-bridge-exchange-amid-withdrawal-fee-concerns-on-bitcoin-holdings/,"BTC|BUSINESS|EXCHANGE|MARKET|REGULATION","News|BTC",cryptocompare
2025-06-11T20:32:22,"Crypto Kidnapping Shocker: NYC Duo Pleads Not Guilty in Bitcoin Torture Plot","William Duplessie and John Woeltz pleaded not guilty to charges stemming from the shocking crypto kidnapping and torture case of an Italian national in New York City’s SoHo neighborhood last month, on Wednesday in Manhattan criminal court. Suspects Deny Role In Crypto Kidnapping Plot Appearing in handcuffs and jumpsuits , the two crypto investors entered their plea of not guilty on charges of assault, kidnapping, unlawful imprisonment, and criminal possession of a weapon in the high-profile crime on June 11. Despite lawyers for Duplessie and Woeltz attempting to see their clients placed on a $1 million bond, the purported crypto fraudsters will remain behind bars until their next hearing on July 15. The duo is alleged to have held and abused the unidentified victim against his will, going as far as binding, shocking, cutting, and threatening the man with a gun in a bid to gain access to his Bitcoin at a luxury Manhattan townhouse in May. Prosecutors argue that both Duplessie and Woeltz also threatened to kill the Italian resident’s family after they lured him to New York City on May 6. New Video Emerges Of Victim In Alleged House Of Horrors In spite of the charges, recently released footage of the victim in question—a former business partner of Duplessie and Woeltz—appearing to walk around the apartment openly has raised eyebrows among skeptics, who claim the behavior is inconsistent with someone being held captive. 2 men plead not guilty in NYC crypto kidnapping and torture case https://t.co/L90iAqeyH4 pic.twitter.com/8cVVd27HJ3 — 1010 WINS on 92.3 FM (@1010WINS) June 11, 2025 “Victims of abuse are not always going to act the way we expect them to,” prosecutor Sania Khan said. Mayor Eric Adams’ name has also been drawn into the scandal, with two officers, both of whom are members of his private security detail, placed on modified duty after having driven the victim from the airport to his captors’ home. “Every city employee is expected to follow the law, including our officers, both on and off duty,” the mayor’s office said in a statement. “We are disturbed by these allegations, and as soon as it came to our attention, the officers were placed on modified duty.” The post Crypto Kidnapping Shocker: NYC Duo Pleads Not Guilty in Bitcoin Torture Plot appeared first on Cryptonews .",cryptonews,https://cryptonews.com/news/nyc-crypto-kidnapping-suspects-plead-not-guilty/,"BTC|BUSINESS|REGULATION","Blockchain News|News|Bitcoin|Kidnapping|New York",cryptocompare
