datetime,headline,summary,source,url,categories,tags,api_source
2025-06-11T20:20:59,"IREN Convertible Notes: Strategic $450M Capital Raise Announced","BitcoinWorld IREN Convertible Notes: Strategic $450M Capital Raise Announced In a significant move for the digital asset infrastructure sector, IREN, the Nasdaq-listed Bitcoin mining firm formerly known as Iris Energy, has unveiled ambitious plans to raise substantial capital. The company is looking to secure a staggering $450 million through a private offering of IREN convertible notes . This strategic financial maneuver aims to fuel the company’s growth and expansion in the competitive Bitcoin mining landscape. The offering targets qualified institutional investors, indicating a sophisticated approach to securing funding. This type of fundraising is common in various industries but is becoming increasingly relevant within the dynamic world of crypto capital raising . Let’s dive deeper into what this means for IREN and the broader market. Understanding IREN Convertible Notes: What Are They? So, what exactly are convertible senior notes , and why would a company like IREN choose this route for fundraising? At its core, a convertible note is a type of debt instrument that includes an option for the holder to convert the debt into equity (company shares) at a predetermined price or under specific conditions. They are ‘senior’ notes, meaning they rank higher than other types of debt in the event of liquidation, offering a degree of security to the investors. Here’s a simple breakdown: Hybrid Instrument: It’s a blend of debt (like a loan with interest payments) and equity (like owning stock). Conversion Option: Investors can choose to convert the debt into IREN shares, often when the stock price rises above a certain level. Seniority: Provides a higher claim on assets compared to subordinated debt if the company faces financial distress. Private Offering: The notes are being offered directly to a select group of qualified institutional investors, not the general public. For IREN, this structure offers flexibility. It provides immediate cash flow like traditional debt but carries the potential to reduce future debt obligations if the notes are converted into equity. It also allows the company to raise significant capital without immediately diluting existing shareholders, although dilution is a potential outcome upon conversion. Why This Move Matters for Crypto Capital Raising The crypto capital raising environment is constantly evolving. As companies in the sector mature, they explore diverse funding mechanisms beyond initial coin offerings (ICOs) or simple equity rounds. Raising $450 million through convertible senior notes highlights the growing sophistication and access to traditional financial markets for established crypto-adjacent businesses like Bitcoin miners. This significant raise demonstrates institutional investor confidence, not just in IREN specifically, but also in the long-term prospects of the Bitcoin mining industry. Building and operating large-scale mining infrastructure requires massive upfront investment in hardware, power capacity, and facilities. Traditional debt can be restrictive, while pure equity raises can be highly dilutive from day one. Convertible notes offer a middle ground, potentially attracting investors who want downside protection (as debt holders) but also upside potential (through conversion to equity) if IREN performs well. This trend of utilizing complex financial instruments for crypto capital raising could set a precedent for other large-scale operations in the blockchain space, indicating a maturation of the industry’s funding strategies. How Does This Impact IREN Stock and Bitcoin Mining Stocks? Investors in Bitcoin mining stocks are keenly watching how companies like IREN finance their operations and growth. A $450 million raise is substantial and will undoubtedly influence perceptions of IREN stock . Potential Positive Impacts: Funded Expansion: The capital provides IREN with the resources to significantly expand its mining capacity, acquire more efficient hardware, or secure better power deals, potentially increasing its Bitcoin production and revenue. Improved Financial Health: Having a large cash reserve can improve the company’s balance sheet and operational flexibility. Market Confidence: A successful large-scale raise, especially from institutional investors, can signal market confidence in IREN’s business model and future. Potential Negative Impacts & Considerations: Future Dilution: While not immediate, the conversion of notes into equity will increase the number of outstanding shares, potentially diluting the value of existing shares. Interest Payments: IREN will need to make regular interest payments on the notes, which is an ongoing operational cost. Market Conditions: The terms of the conversion are tied to IREN stock performance. If the stock price doesn’t reach the conversion threshold, the notes remain debt that must eventually be repaid. The announcement also included plans for ‘capped call transactions’. This is a common strategy used in conjunction with convertible note offerings. A capped call is essentially an option purchased by the company (IREN) from financial institutions. It helps to increase the effective conversion price of the notes and reduce the potential share dilution if the stock price rises significantly above the conversion price. It also helps manage potential cash payouts if the notes are settled in cash rather than stock upon conversion or maturity. For the broader landscape of Bitcoin mining stocks , this raise by a peer like IREN could be seen as a positive signal about the sector’s access to capital, or it could intensify competition if the funds are used for aggressive expansion. Digging Deeper into the Convertible Senior Notes While the specific terms of IREN’s convertible senior notes offering (like the interest rate, maturity date, and conversion price) haven’t been fully disclosed in the initial announcement, understanding the typical structure provides valuable insight. Typically, these notes have a fixed interest rate paid periodically (e.g., semi-annually) and a set maturity date when the principal must be repaid if not converted. The conversion price is crucial – it’s the stock price at which the investor can swap their debt for a predetermined number of shares. This price is usually set at a premium to the current market price of IREN stock at the time of the offering. The ‘senior’ aspect is important for investors as it means these notes rank higher than other unsecured debt but below secured debt in the company’s capital structure. This seniority provides a layer of safety compared to holding common stock. The success of this offering hinges on attracting qualified institutional investors who see value in IREN’s growth potential and are comfortable with the hybrid debt-equity nature of the notes. Their participation is a strong vote of confidence in IREN’s operational strategy and future profitability in the volatile Bitcoin mining market. Benefits for IREN: Why Convertible Notes Now? IREN likely opted for convertible senior notes for several compelling reasons: Access to Capital: The most obvious benefit is securing a large sum ($450M) needed for significant expansion and operational scaling. Potentially Lower Interest Rates: Convertible debt often carries a lower interest rate than traditional non-convertible debt because investors gain the potential upside from equity conversion. Deferred Dilution: Unlike a direct stock offering, dilution only occurs if and when the notes are converted, typically when the stock price is higher. Flexibility: Provides a financing option that bridges the gap between pure debt and pure equity. Potential Challenges and Risks Despite the benefits, this move isn’t without potential challenges: Market Volatility: The value of the conversion option is tied to IREN stock performance, which is influenced by the volatile Bitcoin price and broader market conditions. Interest Burden: Regular interest payments add to operational costs. Put Options: Sometimes, these notes include put options allowing investors to demand early repayment under certain conditions, potentially creating liquidity issues for IREN. Complexity: Convertible notes are more complex than straight debt or equity, requiring careful management and understanding by both the company and investors. Actionable Insights for Investors For those tracking Bitcoin mining stocks or holding IREN stock , here are some key takeaways: Monitor Use of Funds: Watch for IREN’s announcements on how the $450 million will be specifically deployed. Expansion plans, hardware purchases, and power contracts will be crucial indicators. Observe Stock Performance: The conversion terms are tied to the stock price. Track how the market reacts to this news and IREN’s performance relative to the likely conversion price. Understand Dilution Risk: Be aware that future conversion could increase the share count, potentially impacting earnings per share. Assess Market Context: Consider this raise within the broader context of crypto capital raising trends and the competitive landscape of Bitcoin mining. Conclusion: A Strategic Leap for IREN IREN’s plan to raise $450 million through IREN convertible notes marks a significant strategic step. It provides the company with substantial capital to pursue growth opportunities in the competitive Bitcoin mining sector. While offering benefits like access to funds and potential deferred dilution, it also introduces complexities and risks associated with debt obligations and future equity conversion. This move is not just important for the future of IREN stock but also serves as an interesting case study in the evolving landscape of crypto capital raising , demonstrating how established players are utilizing sophisticated financial instruments to fuel their ambitions. The success of this initiative will depend on IREN’s execution, market conditions, and the continued health of the Bitcoin mining industry. To learn more about the latest crypto market trends, explore our article on key developments shaping Bitcoin price action. This post IREN Convertible Notes: Strategic $450M Capital Raise Announced first appeared on BitcoinWorld and is written by Editorial Team",bitcoinworld,https://bitcoinworld.co.in/iren-convertible-notes-raise/,"BTC|BUSINESS|MARKET|MINING|TRADING","Crypto News|bitcoin Mining|Capital raising|Convertible notes|Crypto Investment|IREN",cryptocompare
2025-06-11T20:16:12,"US Senate votes 68–30 to move the GENIUS Act forward, a bill to regulate stablecoins","The U.S. Senate took a major step toward regulating stablecoins on Wednesday, voting 68 to 30 to end debate on the Guiding and Establishing National Innovation for U.S. Stablecoins Act, or GENIUS Act. That procedural move, known as invoking cloture, clears the way for an imminent final vote. Cloture is a key step in the Senate’s process. By invoking cloture, lawmakers limit further debate and prepare to move directly to a final vote on the bill. Senate Banking Committee Chair Tim Scott, R-S.C., who helped craft the legislation, hailed the vote as a victory for both innovation and national security. Speaking on the Senate floor before the vote, Scott said, “Let me be clear, this did not happen by accident. It happened because we led. To those who said Washington could not act, to those who doubted bipartisanship — let’s prove them wrong.” The bill’s Senate lead sponsor, Senator Bill Hagerty, said on the floor that the legislation “takes a common-sense, bipartisan approach to regulating stablecoins,” as Politico reported . Several democrats opposed the bill A handful of Democrats, including Minority Leader Chuck Schumer of New York, Senator Amy Klobuchar of Minnesota and Senator Elizabeth Warren of Massachusetts, opposed the bill. Others, such as Senator Ruben Gallego of Arizona, joined Republicans in supporting it. Majority Leader John Thune (R-S.D.) said on the floor that “it’s time to move forward and pass this legislation.” He further added that stablecoins actually protect the US national security against threats. Under the GENIUS Act, stablecoins would have to be fully backed by U.S. dollars or comparably liquid assets. Issuers with more than $50 billion in market value would face annual independent audits. The bill would also tighten rules on stablecoins issued abroad. On Monday, President Donald Trump’s advisers signaled their support. In a statement of administration policy, they said, “If S. 1582 were presented to the President in its current form, his senior advisors would recommend that he sign it into law.” Trump has publicly expressed a desire to have stablecoin legislation on his desk before August. With cloture secured, Senate leaders aim to hold the final vote on Monday, unless they agree to speed up or extend debate. If the Senate approves the GENIUS Act , its journey will move to the House of Representatives, where lawmakers have already advanced their own proposal. In May, the House Financial Services Committee approved the Stablecoin Transparency and Accountability for a Better Ledger Economy Act by a vote of 32 to 17. That bill has yet to reach the full House floor. Senate and House versions differ on how to split oversight between federal and state regulators, and on how to handle major foreign issuers like Tether. Lawmakers from both chambers will need to work out those details in a conference before sending a unified bill to the president. An initial cloture attempt failed in May This is not the first time the Senate has sought to end debate on the GENIUS Act. In May, an initial cloture attempt failed to attract any Democratic votes. A week later, the Senate tried again and passed cloture by 66 to 32. Opponents have raised several objections over time, including concerns about foreign-issued stablecoins, anti–money laundering standards, and the possibility of large corporations issuing their own tokens. Some critics have also pointed to President Trump’s growing ties to crypto ventures—one of which recently launched its own stablecoin. Trump and his family have been active in digital assets. They issued memecoins shortly before his 2025 inauguration. His affiliated firm, World Liberty Financial, rolled out a new stablecoin this year, and Trump Media has discussed building a multibillion-dollar Bitcoin reserve. Those developments have fueled debate about whether a stablecoin bill should stand alone or be combined with broader crypto market reforms. On Tuesday evening, the House Financial Services Committee approved a wider crypto market structure bill by a vote of 32 to 19. Democrats on that panel proposed numerous amendments aimed at curbing conflicts of interest tied to the president. Earlier the same day, the House Agriculture Committee gave its nod to the measure by a vote of 47 to 6. KEY Difference Wire helps crypto brands break through and dominate headlines fast",cryptopolitan,https://www.cryptopolitan.com/genius-stablecoin-bill-passed-key-vote-and-moved-forward-in-senate/,"BTC|FIAT|MARKET|REGULATION|USDT","Regulation|United States",cryptocompare
2025-06-11T20:15:06,"Bitcoin Shows Potential Bullish Momentum Amid Cooling US CPI and Market Gains","Bitcoin, Ethereum, and XRP exhibit strong bullish momentum following the latest US Consumer Price Index (CPI) report indicating easing inflation pressures. The cooling US CPI has sparked optimism across the",coinotag,https://en.coinotag.com/bitcoin-shows-potential-bullish-momentum-amid-cooling-us-cpi-and-market-gains/,"BTC|ETH|MARKET|TRADING|XRP","Analysis|News|BTC|ETH|XRP",cryptocompare
2025-06-11T20:10:59,"Bitcoin Treasury Strategy Receives Massive $11B Boost from The Blockchain Group","BitcoinWorld Bitcoin Treasury Strategy Receives Massive $11B Boost from The Blockchain Group In a significant move highlighting growing corporate interest in digital assets, French firm The Blockchain Group has secured substantial funding to accelerate its innovative Bitcoin treasury strategy . This development signals a bold step by a publicly traded company to integrate Bitcoin directly into its financial reserves, potentially setting a precedent for others in the traditional finance sector. What is The Blockchain Group’s Ambitious Plan? According to reports, The Blockchain Group has received shareholder approval to raise an astounding €10 billion, equivalent to approximately $11 billion. This massive crypto funding initiative is specifically earmarked for immediate Bitcoin (BTC) acquisitions. The core objective is to fuel the company’s ‘Bitcoin Treasury Company’ strategy. This strategy isn’t just about holding Bitcoin; it’s a long-term vision focused on consistently increasing the amount of BTC held per share over time, effectively linking the company’s value proposition more closely to the performance and accumulation of Bitcoin. The approval for such a significant capital raise dedicated to a digital asset strategy underscores a profound belief in Bitcoin’s long-term value and its role as a potential store of value and treasury reserve asset. It positions The Blockchain Group among a select few publicly listed companies globally that have made Bitcoin a central part of their corporate finance strategy. Why Are Companies Pursuing a Bitcoin Treasury Strategy? The concept of holding Bitcoin on a corporate balance sheet gained significant traction following pioneering moves by companies like MicroStrategy. The rationale behind this Bitcoin treasury strategy often includes several key drivers: Inflation Hedge: Bitcoin’s fixed supply and decentralized nature are seen by proponents as a potential hedge against inflationary pressures on traditional fiat currencies. Store of Value: Believed to be ‘digital gold’, Bitcoin offers a non-sovereign, censorship-resistant store of value that is easily transferable globally. Potential Appreciation: Companies anticipate that Bitcoin’s value will increase over the long term due to increasing adoption and scarcity, potentially boosting shareholder value. Balance Sheet Diversification: Adding a non-correlated asset like Bitcoin can diversify corporate reserves away from traditional cash and financial instruments. Industry Leadership: For companies in the blockchain or technology sector, holding Bitcoin can signal alignment with the digital asset space and attract investors interested in this market. The Blockchain Group ‘s decision to pursue aggressive Bitcoin acquisition with a significant capital injection highlights the increasing confidence among some corporate leaders in Bitcoin’s role in future financial landscapes. How Does This $11B Blockchain Investment Impact the Market? A capital raise of this magnitude, specifically for Bitcoin acquisition , is substantial even in the volatile crypto market. While $11 billion won’t be deployed all at once, the intent to acquire a large amount of BTC over time could provide consistent buying pressure. This kind of institutional-scale blockchain investment demonstrates conviction and could potentially influence market sentiment, encouraging other companies to explore similar strategies or at least take the digital asset space more seriously. It’s important to consider the potential impacts: Increased Demand: Large, sustained buying from a single entity can contribute to upward price pressure, assuming supply remains constant or tightens. Market Sentiment: Corporate adoption, especially on this scale, can legitimize Bitcoin as an asset class for traditional investors and corporations. Liquidity: While $11B is large, the Bitcoin market has significant daily trading volume, so the acquisitions are likely to be managed to minimize market disruption. Shareholder Confidence: For The Blockchain Group , the success of this strategy will heavily rely on Bitcoin’s performance and market acceptance. This move by The Blockchain Group is a clear indicator that crypto funding is not just for startups anymore; established companies are leveraging it for strategic asset accumulation. What Are the Potential Challenges and Considerations? While the potential benefits of a Bitcoin treasury strategy are appealing, there are significant challenges and considerations that companies undertaking such a plan must address: Price Volatility: Bitcoin is known for its extreme price swings. Holding significant amounts exposes the company’s balance sheet to this volatility, which could impact earnings and shareholder perception. Regulatory Uncertainty: The regulatory landscape for cryptocurrencies is still evolving in many jurisdictions, which could introduce risks related to compliance, taxation, and asset classification. Security Risks: Storing large amounts of Bitcoin requires robust security measures to prevent theft or loss due to hacking or operational errors. This is a critical aspect of any large-scale Bitcoin acquisition plan. Accounting Treatment: The accounting rules for digital assets are still developing, which can make reporting complex and potentially impact financial statements. Public Perception: While some investors may applaud the move, others might view it as speculative or risky, potentially affecting the company’s stock price. For The Blockchain Group , navigating these challenges will be crucial to the long-term success of their Bitcoin treasury strategy . The scale of their planned blockchain investment amplifies both the potential rewards and the risks involved. Actionable Insights for Investors and Businesses The decision by The Blockchain Group provides valuable insights: For Investors: This event highlights the increasing institutional interest in Bitcoin. Investors should monitor companies that are actively adopting digital assets into their strategies. It also reinforces the narrative of Bitcoin as a potential long-term store of value. For Businesses: Companies should evaluate their own treasury strategies in light of the evolving financial landscape. While aggressive Bitcoin acquisition might not be suitable for all, understanding digital assets and blockchain technology is becoming increasingly important. Exploring smaller allocations or different crypto assets might be a starting point. The availability of significant crypto funding for strategic initiatives is a trend worth noting. This move by The Blockchain Group serves as a case study in leveraging significant blockchain investment for a focused digital asset strategy. Conclusion: A Bold Bet on Bitcoin’s Future The Blockchain Group ‘s successful securing of $11 billion in crypto funding marks a pivotal moment for the company and a notable development in the corporate adoption of digital assets. Their commitment to a long-term Bitcoin treasury strategy , aiming for consistent Bitcoin acquisition per share, is a bold statement about their belief in Bitcoin’s future potential and its role as a corporate reserve asset. While the path ahead involves navigating volatility and regulatory landscapes, this significant blockchain investment positions The Blockchain Group as a key player exploring innovative corporate finance strategies in the digital age. It’s a clear signal that the integration of Bitcoin into traditional financial structures is accelerating. To learn more about the latest Bitcoin trends, explore our article on key developments shaping Bitcoin institutional adoption . This post Bitcoin Treasury Strategy Receives Massive $11B Boost from The Blockchain Group first appeared on BitcoinWorld and is written by Editorial Team",bitcoinworld,https://bitcoinworld.co.in/bitcoin-treasury-strategy-funding/,"BLOCKCHAIN|BTC|BUSINESS|MARKET|REGULATION","Crypto News|BITCOIN|BLOCKCHAIN|CRYPTOCURRENCY|Funding|Investment",cryptocompare
2025-06-11T20:10:56,"Michael Saylor Suggests Bitcoin Could Reach $1 Million Amid Institutional Demand and Regulatory Shifts","Michael Saylor forecasts Bitcoin’s price soaring to $1 million, driven by institutional demand and the cryptocurrency’s inherent scarcity. He highlights the pivotal role of regulatory advancements and corporate accumulation in",coinotag,https://en.coinotag.com/michael-saylor-suggests-bitcoin-could-reach-1-million-amid-institutional-demand-and-regulatory-shifts/,"BTC|TRADING","Bitcoin|News|BTC",cryptocompare
2025-06-11T20:06:18,"U.S. Senate advances stablecoin bill supported by crypto industry","More on Crypto Bitcoin Trading Volume Surpasses 3-Day Average, Signalling Strong Buyer Conviction (Technical Analysis) Bitcoin: Tweezer Bottom Indicates A Reversal Is Possible (Technical Analysis) How Bitcoin Is Becoming A Cornerstone Of American Economic Policy This is still the most hated V-shaped rally - Tom Lee Bakkt includes bitcoin, other digital assets in updated investment policy",seekingalpha,https://seekingalpha.com/news/4457380-us-senate-advances-stablecoin-bill-supported-by-crypto-industry?utm_source=cryptocompare.com&utm_medium=referral&feed_item_type=news,"BTC|MARKET|REGULATION|TRADING","USDT-USD|USDC-USD",cryptocompare
2025-06-11T20:04:51,"Elon Musk and Trump Dispute Over Spending Bill May Affect Bitcoin Market and Tech Subsidies","Elon Musk and former President Donald Trump have clashed publicly over a GOP-led Congressional spending bill, sparking concerns about the future of government subsidies for Musk’s companies. This dispute underscores",coinotag,https://en.coinotag.com/elon-musk-and-trump-dispute-over-spending-bill-may-affect-bitcoin-market-and-tech-subsidies/,"BTC|MARKET|REGULATION","Bitcoin|News|BTC",cryptocompare
