datetime,headline,summary,source,url,categories,tags,api_source
2025-06-11T20:00:39,"Bitcoin to $1M? – Michael Saylor dismisses crypto winter claims","Michael Saylor predicts Bitcoin's rise to $1M, citing institutional interest and supply scarcity.",ambcrypto,https://ambcrypto.com/bitcoin-to-1m-michael-saylor-dismisses-crypto-winter-claims/,"BTC","Bitcoin|BTC Trading View|News|News 1|Social|Trading View|ambcrypto",cryptocompare
2025-06-11T20:00:31,"Morgan Stanley Predicts New All-Time Highs for S&P 500 Amid Weaker US Dollar, Better Earnings Revisions, Incoming Fed Rate Cuts and More","Investment banking giant Morgan Stanley believes the S&P 500 will not revisit its April lows and instead rally to new all-time highs within a year. Morgan Stanley’s global head of corporate credit research, Andrew Sheets, says in a new CNBC interview that he sees the S&P 500 surging by nearly 8% in 2026, powered by a favorable macroeconomic backdrop. According to Sheets, the stock market appears to have digested US recession odds and is poised to steadily climb higher in the coming months. “We think the inflation data will pick back up a little bit, we do think growth is going to slow some. But importantly, we think the equity market is forward-looking and we think the equity market is going to look ahead to a better rate of change. We’ve already started to see some of the earnings revision numbers incrementally get better. We think that the dollar has been weak. We think it continues to be weak. That’s a tailwind for earnings. So we think the market is going to see better earnings revisions. Already, we think we’ve kind of priced [in] a recession, priced [in] the usual drawdown back in the April lows. So a better rate of change, better trend on earnings revisions, tailwind from a weaker dollar should help S&P earnings hold up. The Fed’s going to be cutting over the next 12 months. We don’t expect a recession. Usually when that happens, the multiple doesn’t decline. And so that’s why we think the S&P can move up to 6,500 by the middle of next year.” As of Tuesday’s close, the S&P 500 is trading at 6,038 points. Follow us on X , Facebook and Telegram Don't Miss a Beat – Subscribe to get email alerts delivered directly to your inbox Check Price Action Surf The Daily Hodl Mix Disclaimer: Opinions expressed at The Daily Hodl are not investment advice. Investors should do their due diligence before making any high-risk investments in Bitcoin, cryptocurrency or digital assets. Please be advised that your transfers and trades are at your own risk, and any losses you may incur are your responsibility. The Daily Hodl does not recommend the buying or selling of any cryptocurrencies or digital assets, nor is The Daily Hodl an investment advisor. Please note that The Daily Hodl participates in affiliate marketing. Generated Image: Midjourney The post Morgan Stanley Predicts New All-Time Highs for S&P 500 Amid Weaker US Dollar, Better Earnings Revisions, Incoming Fed Rate Cuts and More appeared first on The Daily Hodl .",dailyhodl,https://dailyhodl.com/2025/06/11/morgan-stanley-predicts-new-all-time-highs-for-sp-500-amid-weaker-us-dollar-better-earnings-revisions-incoming-fed-rate-cuts-and-more/,"BTC|BUSINESS|FIAT|MARKET|TRADING","Trading|Morgan Stanley|News|s&p 500|stock market|trading",cryptocompare
2025-06-11T20:00:00,"Early Bitcoin Adopter Says XRP Is About to Retire Your Entire Bloodline","A long-standing cryptocurrency investor, known online as Pumpius, has made a striking claim regarding the future of XRP. According to his recent post on X, current XRP holders may be on the brink of acquiring generational wealth. He argues that those who have remained committed to the asset could soon see life-changing returns, potentially securing long-term financial stability for their families. Long-Term Confidence in XRP’s Trajectory Pumpius, who has been active in the Bitcoin space since 2013, maintains that XRP’s current valuation does not reflect its long-term potential. While the token has yet to reach its previous all-time high, he believes the asset remains significantly undervalued and still presents a unique opportunity for outsized returns, especially for early participants in the ecosystem. His optimism is shared by other prominent voices in the financial space. Linda Jones, a financial analyst and author, previously shared similar sentiments, citing views from a U.K.-based fund manager who also considers XRP one of the most promising assets for building long-term wealth. If you understand what’s happening right now with $XRP… You’re not just early — You’re about to retire your entire bloodline. Generational wealth is loading. Don’t flinch. Don’t fold. — Pumpius (@pumpius) June 10, 2025 XRP’s Historical Performance and Investor Sentiment Despite lagging behind Bitcoin’s recent surge , where BTC briefly traded above $110,000, XRP has maintained relative price stability, currently sitting at approximately $2.29. This plateau may frustrate some investors, especially when compared to the more aggressive movements seen in other assets. However, those advocating for XRP remain focused on its long-term potential rather than short-term price fluctuations. Supporters often reference XRP’s sharp rally from late 2024 to early 2025 as evidence of its ability to generate high returns. In November 2024, XRP was priced around $0.49; by January 2025, it had surged to $3.40, a gain of over 590%. Investors holding 100,000 XRP during that period would have seen their holdings increase in value from $49,000 to $340,000. We are on twitter, follow us to connect with us :- @TimesTabloid1 — TimesTabloid (@TimesTabloid1) July 15, 2023 The Debate Over a “Life-Changing” Price Point The conversation surrounding XRP’s potential has also led to debate about what price level truly constitutes financial transformation. Influencer “The Bearable Bull” recently suggested that $8 per token is a key milestone that could validate the patience of long-term holders. At that price, an investment of $55,000 in XRP would be worth over $200,000, an outcome some view as significant, though not necessarily life-altering for all. Others in the community believe that higher targets are required for meaningful wealth creation. For example, some speculative investors continue to project an eventual price of $1,000 per token. However, analysts like CryptoGuard’s Matthew Brienen have cautioned that reaching such a valuation may take several years, if not a decade, and is far from guaranteed. While the asset remains below its all-time high and its growth trajectory is uncertain, prominent investors and analysts continue to express confidence in its long-term potential. The optimism surrounding XRP’s future continues to fuel investor interest. Disclaimer : This content is meant to inform and should not be considered financial advice. The views expressed in this article may include the author’s personal opinions and do not represent Times Tabloid’s opinion. Readers are urged to do in-depth research before making any investment decisions. Any action taken by the reader is strictly at their own risk. Times Tabloid is not responsible for any financial losses. Follow us on Twitter , Facebook , Telegram , and Google News The post Early Bitcoin Adopter Says XRP Is About to Retire Your Entire Bloodline appeared first on Times Tabloid .",timestabloid,https://timestabloid.com/early-bitcoin-adopter-says-xrp-is-about-to-retire-your-entire-bloodline/,"BTC|BUSINESS|TRADING|XRP|RESEARCH","Cryptocurrency|News|XRP",cryptocompare
2025-06-11T19:55:01,"Payments Giant Stripe To Acquire Crypto Wallet Provider Privy Following $1,000,000,000 Purchase of Stablecoin Firm: Report","Payments platform Stripe has announced its acquisition of a crypto wallet provider shortly after closing a $1 billion deal to purchase the stablecoin firm Bridge. In a post on the social media platform X, crypto wallet company Privy says it’s been bought out by Stripe, a firm that provides payment infrastructure for businesses. “Today, we’re proud to announce that Stripe is acquiring Privy. We couldn’t be more excited. Privy will continue as an independent product – but now we’ll move faster, ship more, and serve you even better, so you can stay focused on your users.” Earlier this year, Stripe completed its purchase of stablecoin issuer Bridge, the company behind USDB , a programmable dollar-pegged crypto asset backed by a combination of cash and money market funds held by BlackRock. As stated by Zach Abrams, co-founder of Bridge, at the time, “We closed our acquisition with Stripe! Together we’re scaling digital dollars to businesses everywhere. Stablecoins aren’t the future- they’re already transforming how people move money today.” Earlier this month, Stripe reportedly was in talks with unnamed banks regarding their potential use of stablecoins. Stripe co-founder and president John Collison said that banks seem eager to work with dollar-pegged digital assets. “In the conversations we have with them, they’re very interested. This is not something that banks are just kind of brushing away or treating as a fad. Banks are very interested in how they should be integrated with stablecoins into their product offerings as well.” Follow us on X , Facebook and Telegram Don't Miss a Beat – Subscribe to get email alerts delivered directly to your inbox Check Price Action Surf The Daily Hodl Mix Disclaimer: Opinions expressed at The Daily Hodl are not investment advice. Investors should do their due diligence before making any high-risk investments in Bitcoin, cryptocurrency or digital assets. Please be advised that your transfers and trades are at your own risk, and any losses you may incur are your responsibility. The Daily Hodl does not recommend the buying or selling of any cryptocurrencies or digital assets, nor is The Daily Hodl an investment advisor. Please note that The Daily Hodl participates in affiliate marketing. Featured Image: Shutterstock/DEYASA_346 The post Payments Giant Stripe To Acquire Crypto Wallet Provider Privy Following $1,000,000,000 Purchase of Stablecoin Firm: Report appeared first on The Daily Hodl .",dailyhodl,https://dailyhodl.com/2025/06/11/payments-giant-stripe-to-acquire-crypto-wallet-provider-privy-following-1000000000-purchase-of-stablecoin-firm-report/,"BLOCKCHAIN|BTC|BUSINESS|MARKET|REGULATION","Fintech|banks|blackrock|bridge|Crypto|News|payments|Privy|stablecoins|stripe|USDB",cryptocompare
2025-06-11T19:45:38,"Forget Bitcoin: Publicly Traded Firm Building $500 Million Crypto Treasury With FET","Publicly traded fitness products company Interactive Strength plans to buy Fetch.ai tokens over the next 12 months for product integration.",decrypt,https://decrypt.co/324698/publicly-traded-firm-building-500-million-fet-treasury,"BTC|MARKET|REGULATION|FET","|Markets",cryptocompare
2025-06-11T19:30:49,"Ripple CEO Garlinghouse Admits He Was Wrong About Dogecoin","At Ripple Apex, the company’s flagship gathering for developers and partners, Ripple president Monica Long and chief executive Brad Garlinghouse took the stage for an unscripted fireside chat that quickly zeroed in on one of the industry’s most polarizing sub-sectors: meme coins. In an exchange that mingled candor with contrition, Garlinghouse acknowledged that his once-unyielding dismissal of Dogecoin no longer holds. Dogecoin Forces Ripple CEO To Backtrack The session began with the moderator’s binary provocation—meme coins, overrated or underrated?—to which Long replied that, taken at face value, many are “outright scams,” yet their speculative magnetism has nevertheless “miraculously become real functioning markets.” Long credited the phenomenon with seeding vital infrastructure—wallets, capital, developer mind-share—that she likened to Ethereum’s own 2016–2017 ICO surge. “There’s a lasting impact from meme coins,” she said. The Ripple CEO offered what he called “the other side” of the argument. “I think meme coins are generally maybe grossly overrated,” he said, framing most of them as “not sustainable” projects that amplify regulatory skepticism. He contrasted that short-term gambling impulse with what he described as Ripple’s “long arcs of time” approach. Yet the conversation turned when Garlinghouse revisited Dogecoin, a target of his past derision. “For people who have followed some of my public statements, I used to really speak not so kindly towards Dogecoin,” he admitted. “I was just like, Dogecoin? It literally was created as a lark… it is literally a pile of shit as the logo.” His original objection, he explained, was that an asset conceived as parody could not credibly represent an industry courting institutional capital: “If we’re trying to engage institutions and build those bridges between traditional finance and decentralized finance… Dogecoin isn’t representing us well.” What changed his mind was not a newfound appreciation for the token’s fundamentals but the market reality forged by Elon Musk’s relentless advocacy . “Where I agree with Monica, and I think I got wrong, is Elon Musk willed Dogecoin into so much liquidity that it’s not going away,” the Ripple CEO conceded. “It’s part of the ecosystem. It plays a role.” Even with that reversal, Garlinghouse made clear that most meme-coin launches remain “get-rich-quick rug pulls” that “reflect badly on those of us in the industry trying to build real products for real customers.” He cited US Senator Elizabeth Warren ’s focus on negative use cases as a political example of how hype-driven projects can taint the wider field. Pressed to nominate a single meme that captures crypto’s “chaos or brilliance,” Garlinghouse did not hesitate: “Doge. It is both the chaos and the brilliance.” Musk’s influence, he said, demonstrated how “liquidity begets liquidity,” underscoring the difficulty newcomers face in replicating Dogecoin’s network effects amid today’s “explosion” of imitators. Long, for her part, maintained that even dubious tokens serve as experimental sandboxes that, over time, strengthen underlying blockchains. Garlinghouse ultimately stuck with his “overrated” verdict for meme coins as a category, yet his concession on Dogecoin—effectively elevating it from punchline to permanent fixture—marked a notable shift for the CEO of a company long positioned at the institutional end of the spectrum. At press time, Dogecoin traded at $0.201.",bitcoinist,https://bitcoinist.com/ripple-ceo-wrong-about-dogecoin/,"AAVE|ADA|ALTCOIN|ASIA|ATOM|AVAX|AXS|BCH|BLOCKCHAIN|BTC|BUSINESS|COMMODITY|COMP|DOGE|DOT|ETC|ETH|EXCHANGE|FIAT|FIL|LINK|LTC|LUNA|LUNC|MANA|MARKET|MATIC|MINING|REGULATION|SHIB|SOL|SPONSORED|TECHNOLOGY|TRADING|TRX|UNI|USDT|WALLET|XLM|XMR|XRP|XTZ|ZEC|ZRX|OTHER|RESEARCH|APT|ARB|BITTENSOR|BNB|CRO|WIF|FDUSD|HBAR|ICP|IMX|INJ|LDO|MNT|NEAR|NOT|PEPE|SUI|TON|USDC|AR|FLOKI|ONDO|BGB|BONK|BRETT|RUNE|FET|PYTH|SEI|FLR|JUP|BSV|AGX|ENS|ZK|WLD|XAUT|CAKE|OM|APE|LPT|HNT|XDC|FTT|BTG|PEOPLE|MOG|PYUSD|AXL|MEME|RAY|SSV|ARKM|ETHFI|MX|AIRDROP|TOKEN SALE|FORKS|TOKEN LISTING AND DELISTING|ADMINISTRATIVE EVENTS","Crypto News|Brad Garlinghouse|Doge|doge price|dogecoin|Dogecoin news|dogecoin price|ripple|ripple news",cryptocompare
2025-06-11T19:28:36,"Analyst says GameStop's stock is still overpriced because traders hope to sell it to someone else at a higher price","GameStop is still being pumped like it’s got something real behind it, but the only thing holding it up is a line of people praying they can flip their shares to someone dumber. That’s the whole strategy. There’s no big plan, no actual growth, just blind hope and overpriced stock. According to Wedbush’s Michael Pachter, who put out a note on Wednesday, GameStop has no clear direction. He said, “Despite a complete lack of a clear strategy, GameStop has consistently capitalized on the existence of ‘greater fools’ willing to pay more than twice its asset value for its shares — and so far, they’ve been correct.” This came after the company’s Tuesday earnings showed a drop in first-quarter revenue, which was expected because people are buying games online, not walking into stores. But instead of fixing their core business, GameStop took a wild detour, buying 4,710 bitcoins worth over half a billion dollars. It’s copying the same move MicroStrategy made, but here’s the problem: MicroStrategy is a tech company with actual value. GameStop is not. Buying Bitcoin isn’t a business strategy Michael thinks this Bitcoin plan makes no sense. He wrote, “It is difficult to understand why any investor would be willing to pay more than 2x cash value for the possibility of GameStop converting more of its cash into Bitcoin.” GameStop’s stock is already trading at 2.4 times its actual cash, which means it’s way overvalued. There’s no way putting more money into crypto is going to make it worth even more. Investors who believe in Bitcoin can just buy the coin or an ETF themselves. They don’t need GameStop as the middleman. CEO Ryan Cohen claimed the move was about macroeconomic fears. He said Bitcoin’s limited supply and decentralization could help the company hedge against bigger risks. That doesn’t explain how a video game chain plans to survive while turning into a crypto treasury. Bitcoin might be solid, but it’s not a business model for a retail company that’s bleeding relevance. Michael didn’t hold back. He doubled down on his underperform rating and gave GameStop a 12-month target of $13.50 — that’s 55% lower than the $30.15 close on Tuesday. He broke that down to $12.50 in cash per share and $1 for the company’s business itself. “GME shares trade at a level that overlooks the many challenges ahead,” he said . GameStop is using Bitcoin like a smokescreen, but there’s still no real answer for why it exists as a retail business today. They didn’t lay out any future direction. They didn’t explain how they plan to compete with digital game downloads. They just dropped a crypto bomb and left everyone to figure it out. Greater fool theory is doing the heavy lifting Every part of this situation is built on the greater fool theory. That’s the idea that you can make money off a worthless or overvalued asset, not because it’s good, but because someone else might buy it from you for even more. It only works as long as you find a bigger fool. Once that chain breaks, the last one holding the asset is stuck with it. That’s exactly what’s happening here. Investors aren’t buying GameStop because they believe in the company. They’re betting they can flip their shares for a profit. They think someone else will see the price go higher and jump in, even though the business underneath hasn’t improved. The problem is that this can’t last forever. Once people realize the stock price is disconnected from reality, the sell-off starts. And when that happens, the shares will crash back down to something closer to what the business is actually worth — maybe less. Everyone who bought in late gets burned. Everyone who sold earlier walks away with the money. Michael’s breakdown shows how fragile the whole thing is. GameStop is leaning on crypto and the hope that its loyal army of speculative traders sticks around. But even that crowd has limits. And if the company keeps dodging its real problems, the last fools in line are going to pay for it. Cryptopolitan Academy: Tired of market swings? Learn how DeFi can help you build steady passive income. Register Now",cryptopolitan,https://www.cryptopolitan.com/gamestop-valuation-relies-on-greater-fool/,"BTC|BUSINESS|MARKET|REGULATION|TRADING","Economy|BTC|GameStop",cryptocompare
2025-06-11T19:27:07,"Major Binance Whales May Have Signaled Bitcoin’s Direction — Here Are Their Moves","Cryptocurrency analytics firm CryptoQuant has published a remarkable assessment of the current state of Bitcoin. According to the firm’s analysts, the behavior of whales on Binance shows that Bitcoin has proven its resilience again by holding above $100,000. According to CryptoQuant data, when Bitcoin approaches or surpasses all-time highs, Binance whales typically send large amounts of BTC to the exchange in an attempt to book profits. These moves are reflected in sharp increases in inflow volumes to the exchange. Analysts recall that during the peak period in early 2024, Binance saw over $5.3 billion in BTC inflows, while in previous cycle peaks, these figures reached $8.45 billion and $7.24 billion. It is stated that such large inflows are usually followed by short- or medium-term corrections. Related News: BREAKING: Coinbase Unleashes Listing Storm - Announcements Coming One After Another - Here's the Latest Altcoin They've Chosen However, the situation is different in the current situation. According to the latest data, BTC inflows to Binance are only around $3 billion and this figure continues to decrease. This shows that whales are currently avoiding selling and continue to hold on to their Bitcoins in anticipation of higher profits. CryptoQuant analysts argue that this attitude of Binance whales should not be ignored: “Considering the impact that these whale entries could have on the market, the current stance of Binance whales clearly signals a bullish trend.” *This is not investment advice. Continue Reading: Major Binance Whales May Have Signaled Bitcoin’s Direction — Here Are Their Moves",bitcoinsistemi,https://en.bitcoinsistemi.com/major-binance-whales-may-have-signaled-bitcoins-direction-here-are-their-moves/,"ALTCOIN|BTC|EXCHANGE|MARKET|BNB","Analysis|Bitcoin|News",cryptocompare
2025-06-11T19:20:11,"Bitcoin May Benefit from Lower CPI and Tariff Rollbacks Amid Economic and Fed Rate Uncertainties","The recent US Consumer Price Index (CPI) report and tariff rollbacks between the US and China have positively influenced the cryptocurrency market, signaling renewed investor optimism. Despite ongoing economic uncertainties",coinotag,https://en.coinotag.com/bitcoin-may-benefit-from-lower-cpi-and-tariff-rollbacks-amid-economic-and-fed-rate-uncertainties/,"ASIA|BTC|BUSINESS|MARKET|TRADING","News|BTC|JOE",cryptocompare
2025-06-11T19:15:59,"Bitcoin, ETH price coil after inflation cools and US-China tariffs roll back","Bitcoin, ETH price coil after inflation cools and US-China tariffs roll back $ETH #ETH",coinotag,https://en.coinotag.com/breakingnews/bitcoin-eth-price-coil-after-inflation-cools-and-us-china-tariffs-roll-back/,"BTC|ETH|TRADING","",cryptocompare
2025-06-11T19:15:59,"Cryptocurrency Market Surges: Bitcoin Holds Steady as Ethereum Gains and Solana Awaits ETF Approval","Bitcoin holds steady while Ethereum breaks critical levels, drawing increased investor interest. Solana pushes through volatility, boosting expectations with potential ETF approval on the horizon. Continue Reading: Cryptocurrency Market Surges: Bitcoin Holds Steady as Ethereum Gains and Solana Awaits ETF Approval The post Cryptocurrency Market Surges: Bitcoin Holds Steady as Ethereum Gains and Solana Awaits ETF Approval appeared first on COINTURK NEWS .",cointurken,https://en.coin-turk.com/cryptocurrency-market-surges-bitcoin-holds-steady-as-ethereum-gains-and-solana-awaits-etf-approval/,"BTC|BUSINESS|ETH|MARKET|SOL","Technical Analysis",cryptocompare
2025-06-11T19:15:50,"Bitcoin, ETH price coil after inflation cools and US-China tariffs roll back","Lower CPI and tariff rollbacks boost crypto’s outlook despite economic concerns and Fed rate uncertainty.",cointelegraph,https://cointelegraph.com/news/crypto-prices-rise-inflation-cools-us-china-trade-deal?utm_source=rss_feed&utm_medium=rss&utm_campaign=rss_partner_inbound,"BTC|ETH|TRADING","",cryptocompare
2025-06-11T19:11:29,"Tom Lee Mulls Roughed-Up Semler Scientific for 'Granny Shot' Portfolio","The recent wave of companies adding bitcoin to their balance sheets has not yielded universally positive results. Semler Scientific (SMLR), a medical technology firm that pivoted into bitcoin treasury strategy, has seen its stock fall over nearly 50% in 2025 to nearly the level it was at a bit more than one year ago when it first began to accumulate BTC. The company’s premium to its net asset value (NAV), often referred to as multiple-to-NAV (mNAV), has dropped below 1x. On a basic share count basis, its market cap sits at approximately $420 million compared to bitcoin holdings valued around $491 million (4,449 BTC), putting its NAV ratio at just 0.859x, according to Strategy-Tracker . The mNAV being below 1.0 is crucial as Semler's main mechanism for accumulating bitcoin is to raise capital via share sales. However, for the share sale strategy to be accretive to shareholders, the stock must trade at a premium to the value of the company’s bitcoin holdings. With the share price at or below NAV, issuing new shares would dilute existing shareholders without adding proportional value, effectively halting the company’s ability to pursue further bitcoin accumulation under the current strategy. Bitcoin bull Tom Lee, Head of Research at Fundstrat, however, views Semler Scientific as an opportunity in his firm's ""Granny shot"" research portfolio . Granny shot refers to an unconventional way of shooting free throws in basketball and Fundstrat's Granny Shot (GRNY) portfolio is meant to emphasize the firm's unusual approach to research.",coindesk,https://www.coindesk.com/markets/2025/06/11/tom-lee-mulls-roughed-up-semler-scientific-for-granny-shot-portfolio,"BTC|BUSINESS|MARKET|TRADING|RESEARCH","Markets|Eric Semler|Semler scientific|News",cryptocompare
