datetime,headline,summary,source,url,categories,tags,api_source
2025-07-21T04:58:50,"Institutional Crypto Demand Could Influence Bitcoin’s Stability Amid Growing Market Integration","🚀 Are You Chasing New Coins? Catch the newest crypto opportunities. Be the first to buy, be the first to win! Click here to discover new altcoins! Institutional crypto demand",coinotag,https://en.coinotag.com/institutional-crypto-demand-could-influence-bitcoins-stability-amid-growing-market-integration/,"BTC|ETH|MARKET|ALTCOIN","Bitcoin|Ethereum|News|BTC|Core|ETH",cryptocompare
2025-07-21T04:54:21,"Bitcoin’s Minor Pullback from $123K ATH, Bullish Pennant Indicates $137K Target in Line","Bitcoin (BTC) experienced a potential deeper pullback during Asia trading hours on Monday, after consolidating near $117,000. The crypto is currently just below last week’s all-time high of $123,000 and is retracing, trading just above $118,000 at the time of writing. Bitcoin has displayed a bullish pennant pattern following a strong vertical rally to $123K. A pennant or a flag formation in July indicates the impending continuation of a strong upward price movement. “This pattern typically signals a continuation move — bulls are taking a breather before the next leg up,” a trader wrote on X . “A big breakout with volume could send us soaring to new heights!” #Bitcoin Bull Pennant unfolding perfectly #BTC remains on track for the $137,000 target. pic.twitter.com/zJvmIlq902 — Titan of Crypto (@Washigorira) July 19, 2025 BTC Latest Rally Reflects Institutional Maturation Bitcoin’s current price action seems to reflect genuine institutional adoption through regulated vehicles like exchange-traded funds (ETFs). Last week’s rally was primarily fueled by optimism surrounding “crypto week” in the U.S. Congress, concluding on Friday with President Trump signing the country’s first-ever major crypto legislation into law . One of the most significant catalysts has been the institutional adoption shift, rather than retail speculation, says Werner Brönnimann, Investment Manager at AMINA Bank. Speaking to Cryptonews, Brönnimann said that the drive is primarily by institutional capital rather than retail-led manias of previous cycles. “The market is seeing sustained inflows from pension funds and corporate treasuries, not social media-driven FOMO. The growing institutional focus explains why Bitcoin continues to capture the majority of crypto inflows.” Key Market Participants Driving Crypto Growth Despite Bitcoin’s minor 24-hour decline, several key market announcements have signalled ongoing bullish momentum. For instance, Michael Saylor on Saturday hinted at a new Bitcoin accumulation strategy for his largest corporate BTC holder Strategy, using the phrase “Stay humble, stack sats.” Further, 58 companies have been stacking 7.7k BTC in just one week. Between July 14 to 19, 4 new treasuries were launched with 817 BTC, and 21 companies added 6,873 BTC. Week 29 – #Bitcoin Treasury Strategy Updates July 14-19 saw 58 announcements – ~7.7k BTC – 4 new treasuries launched with 817 BTC – 17 future treasuries announcements – BSTR could launch with ~44.2k BTC! – 21 companies added 6,873 BTC – 11 plans to buy more BTC, $47… pic.twitter.com/Q9J2l6FYB0 — NLNico (@btcNLNico) July 19, 2025 Nearly 98% of BTC addresses are currently in profit, showing continued bullish sentiment. In the past seven days, large transactions totalled $236.5 billion. Elsewhere, analysts suggest that ongoing interest in Ethereum and other layer 1 tokens has continued to attract institutional attention. The post Bitcoin’s Minor Pullback from $123K ATH, Bullish Pennant Indicates $137K Target in Line appeared first on Cryptonews .",cryptonews,https://cryptonews.com/news/btc-bullish-pennant-indicates-137k-target-in-line/,"BTC|TRADING|REGULATION|MARKET|ASIA","Bitcoin News|Bitcoin ATH|Bitcoin market",cryptocompare
2025-07-21T04:39:00,"Ripple’s Strategy May Influence XRP’s Market Role Amid IPO and Regulatory Developments","🚀 Are You Chasing New Coins? Catch the newest crypto opportunities. Be the first to buy, be the first to win! Click here to discover new altcoins! Ripple’s strategic moves",coinotag,https://en.coinotag.com/ripples-strategy-may-influence-xrps-market-role-amid-ipo-and-regulatory-developments/,"XRP|MARKET|BTC|ETH|ALTCOIN","News|Ripple|BTC|ETH|XRP",cryptocompare
2025-07-21T04:27:29,"Institutional Demand Fuels Bitcoin and Ethereum Strength Amid Uncertain Small Altcoin Prospects","🚀 Are You Chasing New Coins? Catch the newest crypto opportunities. Be the first to buy, be the first to win! Click here to discover new altcoins! Institutional investment continues",coinotag,https://en.coinotag.com/breakingnews/institutional-demand-fuels-bitcoin-and-ethereum-strength-amid-uncertain-small-altcoin-prospects/,"BTC|ETH|ALTCOIN","BTC|ETH",cryptocompare
2025-07-21T04:25:18,"Unleashing Power: How Institutional Crypto Demand Fuels Bitcoin & Ethereum’s Ascent","BitcoinWorld Unleashing Power: How Institutional Crypto Demand Fuels Bitcoin & Ethereum’s Ascent Are you wondering what’s truly driving the recent impressive gains in the cryptocurrency market? Look no further than the powerful wave of institutional crypto demand . This isn’t just about individual investors anymore; major players are stepping in, reshaping the landscape for Bitcoin (BTC) and Ethereum (ETH) in ways we haven’t seen before. Why is Institutional Crypto Demand Surging? The cryptocurrency market has always been known for its volatility, but recent trends suggest a significant shift. What’s behind this growing appetite from large institutions? According to Min Jung, a research analyst at Presto Research, a key factor is the increasing recognition of digital assets as legitimate long-term investments. This isn’t a speculative gamble for these entities; it’s a strategic allocation. Maturity of the Market: As regulatory frameworks evolve and infrastructure improves, the crypto market becomes more accessible and less risky for institutional players. Inflation Hedging: In an era of economic uncertainty, Bitcoin, often dubbed “digital gold,” is seen as a potential hedge against inflation, attracting corporate treasuries. Diversification: Adding cryptocurrencies to a traditional portfolio offers diversification benefits, potentially enhancing returns and reducing overall risk. Growing Ecosystem: The expansion of decentralized finance (DeFi), NFTs, and blockchain technology makes the underlying assets like Ethereum more appealing for their utility. These factors collectively contribute to a robust foundation of institutional crypto demand , indicating a deeper integration of digital assets into the global financial system. How is Bitcoin Benefiting from Institutional Crypto Demand? Bitcoin, the pioneer cryptocurrency, continues to lead the charge. Min Jung highlights that BTC is maintaining its position near all-time highs, primarily due to sustained interest from institutional investors. These aren’t just any investors; we’re talking about crypto treasury firms and other large-scale entities that typically adopt a long-term holding strategy. What does this mean for the market? Aspect Impact of Institutional Demand on Bitcoin Price Stability Long-term holders reduce selling pressure, contributing to a more stable price floor. Reduced Volatility While short-term fluctuations can occur from profit-taking, institutional conviction dampens extreme downside movements. Increased Legitimacy Corporate adoption enhances Bitcoin’s credibility as a mainstream asset. Market Depth Large capital injections create deeper liquidity pools, making large trades less disruptive. According to The Block, this sustained influx of institutional crypto demand suggests that a significant near-term sell-off for Bitcoin is unlikely. However, Jung wisely cautions that some short-term volatility might arise from older wallets engaging in profit-taking after recent price breakouts. This is a natural market dynamic and not necessarily indicative of a weakening trend. Is Ethereum Also Seeing Strong Institutional Crypto Demand? Absolutely! While Bitcoin often grabs the headlines, Ethereum is experiencing its own powerful surge in institutional momentum. Jung points out a significant trend: more and more publicly traded companies are integrating ETH into their corporate reserves. This move signifies a growing recognition of Ethereum’s utility beyond just a store of value, particularly its role as the backbone for a vast ecosystem of decentralized applications. A remarkable indicator of this robust institutional crypto demand for Ethereum comes from the performance of spot ETH exchange-traded funds (ETFs). The Block reported that these ETFs have recently achieved record-setting net inflows, even surpassing Bitcoin ETFs on certain days. This is a compelling testament to the rising institutional confidence in Ethereum’s long-term potential and its fundamental value proposition. Key drivers for Ethereum’s institutional appeal include: Ecosystem Dominance: Ethereum hosts the largest number of decentralized applications (dApps), including DeFi protocols and NFT marketplaces, making its native token (ETH) essential for interacting with these platforms. Staking Rewards: The transition to Ethereum 2.0 (now known as the Consensus Layer) and its proof-of-stake mechanism offers attractive staking yields, appealing to institutions seeking passive income. Technological Innovation: Ongoing upgrades and scaling solutions promise to enhance Ethereum’s efficiency and reduce transaction costs, further cementing its position as a leading blockchain platform. The growing institutional interest in Ethereum underscores its evolving role from a speculative asset to a foundational technology, driving significant institutional crypto demand . Navigating Potential Short-Term Volatility While the long-term outlook appears strong due to sustained institutional crypto demand , it’s crucial for investors to remain aware of potential short-term fluctuations. As Min Jung noted, instances of profit-taking from “older wallets” – addresses that have held Bitcoin or Ethereum for extended periods – can introduce temporary volatility after significant price rallies. These are typically individuals or early adopters cashing in on substantial gains, not institutions signaling a loss of confidence. Actionable Insight: For long-term investors, such pullbacks can represent buying opportunities rather than reasons for concern. Maintaining a diversified portfolio and employing dollar-cost averaging can help mitigate the impact of short-term price swings. The Unstoppable March of Institutional Crypto Demand The current landscape of the cryptocurrency market is undeniably shaped by the increasing embrace of digital assets by large institutions. The sustained institutional crypto demand for both Bitcoin and Ethereum is not merely a fleeting trend but a fundamental shift in how traditional finance views and integrates these innovative assets. From corporate treasuries to spot ETFs, the evidence points to a robust and growing conviction in the long-term value and utility of BTC and ETH. While the crypto market will always have its share of volatility, the deep pockets and long-term horizons of institutional investors provide a powerful stabilizing force. This growing adoption suggests a future where cryptocurrencies are not just niche investments but integral components of global financial portfolios, driven by an ever-strengthening wave of institutional crypto demand . To learn more about the latest explore our article on key developments shaping Bitcoin and Ethereum institutional adoption. Frequently Asked Questions (FAQs) Q1: What is institutional crypto demand? A1: Institutional crypto demand refers to the growing interest and investment in cryptocurrencies like Bitcoin and Ethereum by large organizations, such as asset management firms, hedge funds, corporate treasuries, and publicly traded companies, rather than individual retail investors. Q2: Why are institutions investing in Bitcoin and Ethereum? A2: Institutions are investing due to several factors, including the potential for high returns, diversification benefits for their portfolios, a perceived hedge against inflation (especially for Bitcoin), and the growing utility and ecosystem development of platforms like Ethereum. Q3: Does institutional demand make crypto less volatile? A3: While institutional demand can provide a more stable foundation due to long-term holding strategies, it doesn’t eliminate volatility entirely. Short-term profit-taking from older wallets or broader market sentiments can still lead to price fluctuations. However, it tends to reduce the likelihood of extreme sell-offs. Q4: What are spot ETH ETFs and why are they important? A4: Spot ETH ETFs (Exchange-Traded Funds) allow investors to gain exposure to Ethereum’s price without directly owning the cryptocurrency. Their record-setting inflows indicate significant institutional confidence and provide an accessible, regulated avenue for traditional investors to participate in the Ethereum market. Q5: What are “older wallets” in the context of crypto volatility? A5: “Older wallets” refer to cryptocurrency addresses that have held Bitcoin or Ethereum for a significant period. When prices surge, owners of these wallets might sell a portion of their holdings to realize profits, which can lead to temporary increases in selling pressure and short-term price volatility. Did you find this analysis insightful? Share this article with your friends, colleagues, and fellow crypto enthusiasts on social media! Help us spread the word about the exciting developments driven by institutional crypto demand . This post Unleashing Power: How Institutional Crypto Demand Fuels Bitcoin & Ethereum’s Ascent first appeared on BitcoinWorld and is written by Editorial Team",bitcoinworld,https://bitcoinworld.co.in/institutional-crypto-demand-surge/,"ETH|BTC|MARKET|BUSINESS|TRADING","Crypto News|BITCOIN|Crypto Market|ETFs|ETHEREUM|institutional demand",cryptocompare
2025-07-21T04:22:54,"[LIVE] Crypto News Today: Latest Updates for July 21, 2025 – Bitcoin Holds $118.5K, ETH Tops $3.7K as Bullish Momentum Spills into Altcoins","Bitcoin remains stable near $118,500 while ETH surged nearly 4% to trade above $3,800 at one point before dipping to $3,760, buoyed by increasing institutional adoption. XRP , BNB, and Solana notched modest gains of more than 2%, joining a broader upswing across the altcoin market. XRP recently set a new all-time high, fueled by momentum from recent progress on U.S. crypto legislation. But what else is happening in crypto news today? Follow our up-to-date live coverage below. The post [LIVE] Crypto News Today: Latest Updates for July 21, 2025 – Bitcoin Holds $118.5K, ETH Tops $3.7K as Bullish Momentum Spills into Altcoins appeared first on Cryptonews .",cryptonews,https://cryptonews.com/news/live-crypto-news-today-latest-updates-for-july-21-2025/,"BTC|ETH|ALTCOIN|TRADING|MARKET","Industry Talk|Bitcoin|Ethereum|Market",cryptocompare
