datetime,headline,summary,source,url,categories,tags,api_source
2025-05-27T14:30:00.000Z,"What is a cryptocurrency mixer and how does it work?","Cryptocurrency mixers explained              A cryptocurrency mixer is a specialized service designed to increase the privacy and anonymity of blockchain transactions. Unlike traditional financial transactions, which are private by default, most cryptocurrencies such as Bitcoin (BTC) and Ether (ETH) operate on public blockchains. This means every transaction is permanently recorded and accessible to anyone, making it possible for blockchain analysts or malicious actors to trace the flow of funds between wallets.A crypto mixer’s primary function is to break the link between the sender’s wallet and the recipient’s wallet. It does so by pooling together coins from many users and then redistributing them in a way that makes it difficult to track which coins went where. Think of it like a digital version of shuffling cards in a deck. After mixing, your cryptocurrency is returned to you or a recipient’s address, but it’s “cleaned” of any direct transaction history.This privacy-enhancing feature is why some people rely on mixers, especially those seeking to keep their financial activities confidential in an open-ledger world.                  How does a crypto mixer work?              To understand a crypto mixer, it’s useful to compare it to the concept of money laundering in traditional finance, albeit with legal and ethical nuances. The process of “mixing” is essentially designed to obscure the origin and destination of coins.Here’s a typical workflow of how a cryptocurrency mixer operates:Deposit: You send your cryptocurrency to the mixer’s wallet address. Multiple users do the same, creating a large pool of coins.Mixing/shuffling: The mixer’s system pools and shuffles these coins together, breaking any visible connection between deposited and withdrawn funds.Redistribution: After mixing, the service sends back an equivalent amount of coins to your specified address, but these aren’t the same coins you deposited. They come from the pooled coins of all participants.Fees: The mixer usually deducts a small fee, generally ranging from 1% to 3%, to cover operational costs.This process effectively disrupts blockchain analysis, making it extremely difficult for anyone to trace the coins back to their original owners.                  Types of cryptocurrency mixers              Not all mixers are created equal. They can broadly be divided into two categories: centralized and decentralized mixers.Centralized mixersCentralized mixers are the most common and operate similarly to traditional services. You send your coins to a company or entity that controls the mixing process, and then they send back “clean” coins after mixing. These services are relatively easy to use, often providing a simple user interface.However, centralized mixers require you to trust the service operator with your coins, at least temporarily. This introduces risks such as:The mixer could be a scam and disappear with your funds.It could be hacked, exposing users’ data and coins.The operator may keep logs that could compromise your privacy.Decentralized mixersDecentralized mixers use blockchain technology and smart contracts to automate the mixing process without a trusted third party. They rely on cryptographic methods such as zero-knowledge proofs to mix coins in a trustless environment. Users pool their coins into a smart contract, which then redistributes coins in a way that ensures privacy.Advantages of decentralized mixers include:No central point of failure or custody risk.Higher privacy because no single party controls the funds.Often more resistant to regulatory crackdowns.Did you know? The DOJ indicted four Russians for operating crypto mixers Blender.io and Sinbad.io, yet failed to show they knowingly laundered illicit funds. The indictment relies heavily on vague forum posts and lacks concrete evidence of criminal intent or ties to US commerce, raising serious doubts about its strength in court.                  Real-world cases involving mixers and scams              Unfortunately, the privacy offered by crypto mixers has also attracted criminals. The very anonymity that protects innocent users can also shield illicit activities, leading to widespread misuse.Crypto mixers have been linked to ransomware attacks, dark web marketplaces, fraud and drug trafficking. Criminals often use these services to “clean” proceeds from illegal transactions and hide their tracks from law enforcement.A notable example is ChipMixer, a service seized by Europol in 2023 for allegedly facilitating money laundering for dark web markets and ransomware groups. Authorities dismantled the platform’s infrastructure over alleged money laundering, seizing four servers, 1,909.4 BTC (about $210 million as of May 26, 2025) and seven TB of data across 55 transactions.Mixers have also been involved in laundering stolen funds from cryptocurrency exchange hacks. The complexity of these transactions makes it difficult for investigators to recover stolen assets.In February 2025, Bybit, a major cryptocurrency exchange, suffered a significant security breach resulting in the theft of about $1.5 billion worth of cryptocurrencies. The attackers, attributed to the Lazarus Group, a North Korean state-sponsored hacking organization, employed various crypto mixers, including Wasabi, CryptoMixer, Railgun and Tornado Cash, to launder portions of the stolen assets. Despite efforts to trace the funds, a significant portion remains unaccounted for, highlighting the challenges posed by mixers in cybersecurity investigations.                  Are crypto mixers legal?              The legal status of cryptocurrency mixers depends largely on the jurisdiction and context of their use.Most governments impose strict Anti-Money Laundering (AML) and Counter-Terrorist Financing regulations on financial services, including digital currency services. Mixers, by their nature, complicate AML compliance because they obscure transaction trails.For instance,In the European Union, the 5th Anti-Money Laundering Directive (5AMLD) includes digital currency providers under its regulatory scope, requiring them to perform KYC checks and report suspicious activity.In the United States, FinCEN classifies cryptocurrency mixers as money transmitters, requiring registration and compliance with AML regulations. Unlicensed mixers can face severe penalties and criminal charges.Legal uses vs misuseUsing a mixer for privacy reasons is not inherently illegal. However, if mixers are used to launder proceeds from crimes, authorities will prosecute offenders. Similarly, operating a mixer without appropriate licenses or regulatory oversight can be illegal.If you choose to use a mixer, make sure you understand the legal implications in your country and avoid any activity that could be linked to money laundering or fraud.Did you know? Crypto mixer transactions are still taxable. Using a mixer doesn’t hide gains from tax authorities; failing to report them can trigger audits or penalties. Always keep records and understand your local tax obligations.                  How to stay safe and avoid scam-linked mixers              If you decide to use a cryptocurrency mixer, your safety and security should be paramount. Here are some essential tips to avoid scams and legal troubles:Choose reputable mixers: Conduct thorough research. Look for mixers with good reviews, transparent operations and clear compliance policies.Avoid unknown or suspicious services: Steer clear of mixers linked to scams, hacks or regulatory actions.Check for licensing and compliance: Prefer mixers that comply with AML/KYC regulations, especially if you are a business or high-value user.Understand fees and timelines: Be clear on the fees involved and the expected time for your funds to be returned after mixing.Use hardware wallets and strong security practices: Always safeguard your private keys and use hardware wallets to minimize risks.Stay updated on regulations: Laws surrounding crypto mixers evolve rapidly. Staying informed will help you avoid inadvertent legal violations.",Cointelegraph,https://cointelegraph.com/explained/what-is-a-cryptocurrency-mixer-and-how-does-it-work?utm_source=rss_feed&utm_medium=rss&utm_campaign=rss_partner_inbound,"","",finnhub
2025-05-27T14:24:34.000Z,"Bitcoin 2024 conference sparked 30% price crash — Can bulls escape this year?","Key points:Bitcoin rebounds from another support retest, but fears over a Nashville conference-induced comedown are growing.The biggest Bitcoin gathering tends to accompany BTC price weakness.BTC price action can and will continue to experience drawdowns of 10-20%, analysis stresses.Bitcoin (BTC) circled $110,000 at the May 27 Wall Street open amid concerns over a 30% BTC price crash.BTC/USD 1-hour chart. Source: Cointelegraph/TradingViewBitcoin “market memory” may recall 2024 crashData from Cointelegraph Markets Pro and TradingView showed BTC/USD recovering after its latest support retest around $107,000.As large-volume traders took advantage of the volatility, market commentators turned to potential risk factors, these coming from multiple sources.Uncertainty over US trade tariffs and the return of Wall Street after the Memorial Day holiday combined with the ghost of BTC price losses from a year ago.In July 2024, the Bitcoin 2024 Conference in Nashville, Tennessee formed the basis for snap downside in early August which took BTC/USD down 30% from $70,000 to $49,000.Now, with the same event getting underway for 2025, some wondered whether the market would experience an unwelcome sense of deja-vu.“The sustained elevation in near-term vols suggests that traders are positioning around headline risk ahead of the Bitcoin Conference in Las Vegas, scheduled for 27 to 29 May. Focus is already building around the event’s speaker line-up, which includes JD Vance, Michael Saylor, Donald Trump Jr., and Eric Trump,” trading firm QCP Capital wrote in its latest bulletin to Telegram channel subscribers.“Last July’s Nashville Bitcoin Conference offers a useful analogue. At the time, a keynote by President Trump coincided with a sharp spike in 1-day implied vols above 90, followed by a swift reversal and a nearly 30% decline in BTC within two days. That episode continues to shape market memory.”BTC/USD 1-day chart. Source: Cointelegraph/TradingViewA 30% retracement from current levels would put Bitcoin back at $77,000 — around the area in which it set a multimonth bottom in April.Continuing, crypto trader, analyst and entrepreneur Michaël van de Poppe reiterated that the drop from $110,000 to the mid-$70,000 range had already happened once before.“Corrections do happen and they'll continue to happen,” he told X followers on May 26, arguing that a correction of up to 20% “shouldn't disappoint you.”As Cointelegraph reported, various sources have suggested that the Bitcoin bull market is in its final innings before a protracted trend reversal.Liquidity “magnet” offers $106,000 targetTackling short-term price action, popular trader Daan Crypto Trades was among those using exchange order book liquidity to identify potential targets.Related: BTC price seeks $155K 'trigger' — 5 things to know in Bitcoin this week“The longer price hovers around this price region, the thicker the liquidity clusters above and below will become,” he summarized on the day alongside data from monitoring resource CoinGlass.  “There's a big liquidity cluster down at ~$106K and quite a few sitting from $111K and up. Keep an eye out for when price taps either of this regions as those usually act as a magnet when price is close.”BTC liquidation heatmap. Source: CoinGlassCoinGlass itself showed the first chunk of ask liquidity being taken into the start of the US trading session.This article does not contain investment advice or recommendations. Every investment and trading move involves risk, and readers should conduct their own research when making a decision.",Cointelegraph,https://cointelegraph.com/news/bitcoin-2024-conference-sparked-30-btc-price-crash-bulls-escape-this-year?utm_source=rss_feed&utm_medium=rss&utm_campaign=rss_partner_inbound,"","",finnhub
2025-05-27T14:11:04.000Z,"Russian national arrested in South Korea for attempted crypto robbery","South Korean authorities have arrested one of three Russian nationals accused of an attempted robbery during a fake crypto deal in Seoul. The suspects allegedly lured Korean investors to a hotel, where they tried to steal 1 billion won (approximately $730,000) in cash.The Gangseo Police Precinct in Seoul detained a man in his 20s in Busan on May 27, according to a report by local news outlet JoongAng Daily. The suspect faces charges of assault and attempted robbery. The other two suspects reportedly fled South Korea shortly after the incident.According to investigators, the robbery attempt occurred on May 21 at a hotel in Seoul’s Gangseo District. The suspects posed as participants in a peer-to-peer crypto transaction and invited 10 Korean men to the hotel.Two were called to the room while the others waited in the lobby. Inside the room, the suspects — wearing protective vests — ambushed the victims with a replica handgun and a telescopic baton, tying their hands with cable ties.Related: Another suspect to surrender in NYC crypto torture case: ReportsPolice seize weapons, launch global manhuntPer the report, one of the victims managed to escape and raise the alarm, prompting the suspects to flee without the cash. Police responded to an emergency call and found one man bleeding in the lobby.Officers discovered a cache of equipment in the suspects’ hotel room, including a replica firearm, batons, vests and a money counter. Police suspect the robbery had been carefully planned.A request to prevent the suspects from leaving the country was filed the next morning, but two had already departed. “We have requested assistance from Interpol to track down the suspects who fled overseas,” a police official reportedly said.Authorities are now questioning the detained suspect and preparing to seek a pretrial detention warrant.Related: Crypto investor loses $2.6M in stablecoins in double phishing scamRise in crypto crime incidentsThe incident comes amid a recent uptick in crypto-related violent crimes, including kidnapping and ransom cases.A Manhattan crypto investor faces serious charges after allegedly kidnapping and torturing an Italian man in a bid to extract access to digital assets.Source: Mario NawfalOn May 13, the family of Pierre Noizat, the co-founder and CEO of French crypto exchange Paymium, was targeted in an attempted kidnapping.In response, executives and investors in the crypto industry are increasingly seeking personal security services. On May 18, private firm Infinite Risks International reported a rise in requests for bodyguards and protection contracts from high-profile figures in the crypto space.Magazine: TradFi is building Ethereum L2s to tokenize trillions in RWAs: Inside story",Cointelegraph,https://cointelegraph.com/news/russian-arrested-south-korea-attempted-crypto-robbery?utm_source=rss_feed&utm_medium=rss&utm_campaign=rss_partner_inbound,"","",finnhub
2025-05-27T13:24:33.000Z,"Solana may be a memecoin ‘one-trick pony’ — Standard Chartered","Layer-1 blockchain Solana may be evolving into a “one-trick pony” for memecoin generation and trading, according to a recent Standard Chartered report.According to a May 27 Standard Chartered research report shared with Cointelegraph, Solana “dominates in areas that demand high-volume, low-transaction-cost solutions” due to its design prioritizing fast and cheap transaction confirmation. The report suggested that this has had an unintended consequence:“So far, this has been mostly in memecoin trading, which accounts for the majority of activity on Solana (as measured by ‘GDP’, which is application revenue).”Standard Chartered said the memecoin frenzy served as a stress test for Solana’s scalability but came with drawbacks due to the volatility and speculative nature of such assets. As memecoin trading volumes decline, the bank warned that Solana may struggle to maintain momentum.  Related: Migos Instagram account hacked in apparent blackmail bid on Solana co-founderMemecoin trading passed its peakThe report said Solana-based memecoin activity is past its peak, and “declining usage and trading ‘cheap’ are not a good mix.” The bank suggested that Solana should expand into other sectors that require processing large volumes of transactions cheaply and quickly.Solana decentralized exchange volume. Source: Standard CharteredPer the report, those sectors could include high-throughput financial apps and traditional consumer apps such as social media. Still, scaling such applications may take years, according to the bank, with dire consequences for Solana:“As a result, we expect Solana to underperform Ethereum over the next two to three years, before catching up, at least in real terms.”Standard Chartered’s crypto target prices. Source: Standard CharteredSolana: Solana following Bitcoin? Network activity, chart pattern point to $300 SOL priceSolana’s edge is fadingSolana has long positioned itself as a fast and inexpensive layer-1 blockchain with smart contract support, competing directly with Ethereum. However, that edge may be narrowing.  Average transaction fees on Solana and Arbitrum. Source: Standard CharteredEthereum layer-2 platforms have caught up with Solana in terms of average transaction cost since the Dencun network upgrade in March 2024. This shift has put pressure on Solana’s value proposition as the cheapest high-throughput blockchain. Standard Chartered acknowledged that Ethereum’s modular design, which separates data availability, execution and consensus, has allowed it to scale more efficiently while preserving decentralization:“The modular approach allows Ethereum to scale transactions at a low cost (post-Dencun upgrade) while maintaining the security benefits of a highly decentralised mainnet blockchain.”Magazine: Memecoins are ded — But Solana ‘100x better’ despite revenue plunge",Cointelegraph,https://cointelegraph.com/news/solana-a-memecoin-one-trick-pony-standard-chartered?utm_source=rss_feed&utm_medium=rss&utm_campaign=rss_partner_inbound,"","",finnhub
2025-05-27T13:19:38.000Z,"How to research altcoins using ChatGPT and Grok","Investments in the fast-paced cryptocurrency market require real-time insights and efficient research. With thousands of projects emerging or disappearing, you need innovative ways to separate signal from noise. AI solutions such as ChatGPT and Grok could benefit you as your research assistant, reducing research time and delivering actionable information. This article discusses how to use both platforms to make better decisions regarding investment in altcoins.How to share content with ChatGPT and GrokBoth ChatGPT 4o and Grok 3 allow you to share content in three ways. You can simply paste content in the text box with inverted commas and write your prompt. Alternatively, you can upload a document from your local drive or Google Drive on ChatGPT 4o. If you are working with Grok 3, you could upload a file from your local drive or connect a file on Google Drive and Microsoft Drive to the AI platform.On both ChatGPT 4o and Grok 3, you can paste a link in the text box and write a prompt for the AI engine.Use ChatGPT 4o and Grok 3 to analyze complex data and draw quick conclusionsChatGPT 4o excels at processing and simplifying extensive and often fragmented information. Altcoin projects tend to have extensive white papers and technical documentation. It takes time to get through all the information, analyze it, and draw conclusions. With ChatGPT 4o and Grok 3, you can easily get the information you need without spending hours reading the content. You can use the AI platforms for:Summarizing extensive documentation: You could get a quick summary of vast information that might go into thousands of words, using a prompt like “Summarize this document in plain English with pros, cons and use cases.”Analyzing tokenomics: You could ask the AI platforms for the altcoin project’s breakdown of inflation, token distribution and staking models. For example, you could use a prompt such as “Explain the tokenomics of [Altcoin Name] and its impact on price.” Deconstructing roadmaps: Projects often publish unrealistic roadmaps that are hard to implement. AI platforms could quickly analyze the relevancy of roadmaps and suggest to you what you could expect of them. You could use prompts like, “What are the most realistic milestones in this roadmap for 2025?”Spotting red flags: The goal is not just to understand but to spot red flags, such as overpromising, vague goals or lack of technical updates. Did you know? ChatGPT is trained on vast crypto data sets and can explain trends, decode memes, or simplify DeFi tools — even if you are just starting your crypto learning journey.Ask for competitive comparisons on ChatGPT 4o and Grok 3ChatGPT 4o and Grok 3 can be valuable tools for quickly comparing different cryptocurrency projects. To begin with, state the names of the cryptocurrencies you want to compare. Also mention the criteria such as use case, consensus process, tokenomics and development activities. For example, you can use the prompt, “Create a table comparing Solana and Avalanche in terms of transaction speed, fees and developer adoption.” Here is a response from ChatGPT 4o:And this is Grok 3’s response for the same prompt:AI tools typically use tables or bullet points for an answer. You can also ask additional questions to delve deeper into topics like security, scalability and partnerships. This allows for more efficient evaluation of many projects without the need to search through multiple sources.To get a market-layer view on ChatGPT 4o, you can use the prompt: “Create a table of five layer-1 altcoins with higher throughput than Ethereum and evaluate their adoption metrics.” Here is the output of ChatGPT 4o:Grok 3 gave the following response using the same prompt:These comparisons help you map out where each altcoin stands relative to its peers and whether it offers a genuine edge.Did you know? Elon Musk’s Grok chatbot was built with a rebellious tone. It excels at quickly pulling crypto insights directly from social chatter, perfect for memecoin hunters.Find info about developer activityDeveloper traction is a dependable indicator of an altcoin’s long-term potential. Use ChatGPT 4o and Grok 3 to find information about overall growth in development activity, surges after certain upgrades, developer count and contributions, commit activity, network upgrades and challenges before developers.You could use prompts like:“What has been the developer activity trend on [Project ] over the last 6 months?”You can also request ecosystem breakdowns with prompts like:“List top DeFi projects built on Arbitrum with TVL over $10 million.”ChatGPT 4o generated the following response for this prompt:Here is Grok 3’s response for the same prompt:ChatGPT 4o and Grok 3 can synthesize data points from multiple sources and give you a cleaner picture faster than manual web browsing. You could track sudden price spikes with a prompt like:“In 100 words, write why is $RNDR trending right now?”Here is ChatGPT 4o’s response for this prompt:This is Grok 3’s response for the same prompt:Grok 3 is particularly useful for monitoring real-time sentiment and news. Grok 3 is ideal for real-time analysis of trends, especially on X, where crypto narratives form quickly. Grok 3 will pull recent posts, mentions and news threads to explain the momentum. It can monitor influencer sentiment.For deeper and quicker research, you can use ChatGPT 4o and Grok 3 together.Don’t just trust the bots — verify the alphaAI tools like ChatGPT 4o and Grok 3 offer powerful support in the altcoin research process, enabling faster analysis, broader comparisons and streamlined access to information. However, even advanced AI models can occasionally misinterpret data or miss contextual nuances. As such, it is essential to treat their responses as a starting point — not a final answer.When using these tools, take the time to compare outputs, evaluate the sources referenced, and cross-check insights against real-world data. Discrepancies between ChatGPT and Grok responses should prompt further investigation, not automatic preference.Ultimately, these platforms are most effective when used to enhance critical thinking and research efficiency rather than replace human judgment.In a fast-moving industry like Web3, effective research requires diligence, curiosity and verification. By applying these principles, you can make more confident and informed investment decisions in the altcoin space.This article does not contain investment advice or recommendations. Every investment and trading move involves risk, and readers should conduct their own research when making a decision.",Cointelegraph,https://cointelegraph.com/news/how-to-research-altcoins-using-chatgpt-and-grok?utm_source=rss_feed&utm_medium=rss&utm_campaign=rss_partner_inbound,"","",finnhub
