datetime,headline,summary,source,url,categories,tags,api_source
2025-05-28T06:50:24.000Z,"MicroStrategy Stock Performance: Unstoppable MSTR Outpaces All 74 Crypto ETFs YTD","BitcoinWorld MicroStrategy Stock Performance: Unstoppable MSTR Outpaces All 74 Crypto ETFs YTD In a fascinating twist for digital asset investors, MicroStrategy stock performance has stolen the spotlight this year, achieving a feat many might find surprising. According to Nate Geraci, CEO of the U.S.-based wealth management firm The ETF Store, the company formerly known as Strategy has significantly outperformed every single one of the 74 crypto-related exchange-traded funds (ETFs) tracked year-to-date. Understanding the Surprising MicroStrategy Stock Performance MicroStrategy (MSTR) is widely recognized not just as a business intelligence software company, but increasingly, as the largest corporate holder of Bitcoin (BTC). This strategic pivot has tightly linked the company’s stock performance to the volatile world of cryptocurrency. While many investors seeking crypto exposure might turn to dedicated Crypto ETFs, MSTR’s stock has proven to be a more potent vehicle for gains in the current market cycle, at least so far this year. Nate Geraci’s observation, shared on X, highlights a significant trend: despite the proliferation of regulated investment products designed to track cryptocurrencies, a single company’s stock, heavily invested in Bitcoin, has managed to lead the pack. This includes funds specifically designed for leverage, such as the MSTR ETF (MSTX), which aims to track 2x the performance of MicroStrategy’s stock itself – yet, even this leveraged vehicle lagged behind the underlying MSTR shares. Why is MSTR vs Crypto ETFs Showing Such a Disparity? The outperformance of MicroStrategy stock compared to a broad spectrum of Crypto ETFs can be attributed to several factors: Concentrated Bitcoin Exposure: MSTR’s strategy is laser-focused on accumulating Bitcoin. While many crypto ETFs offer exposure to a basket of digital assets or Bitcoin futures, MSTR provides a more direct, albeit leveraged through its corporate structure, play on the price movement of the leading cryptocurrency. Investor Perception and Flow: For many investors, particularly institutional ones, buying MSTR stock is seen as a relatively accessible and regulated way to gain significant exposure to Bitcoin without directly holding the asset or navigating the complexities of various crypto ETF structures. This consistent demand can drive the stock price. Business Operations Multiplier: While Bitcoin holdings are the primary driver of recent MSTR performance, the company still has an operational business. The market valuation of MSTR often reflects not just the value of its Bitcoin treasury, but also a premium placed on the company as a unique investment vehicle, potentially amplifying gains during bullish crypto cycles. ETF Structure and Fees: Crypto ETFs have varying structures (spot, futures, baskets) and come with management fees. These factors, along with potential tracking errors or diversification across less performing assets within a basket ETF, can dilute or lag the performance compared to a single, highly focused stock like MSTR during a strong Bitcoin rally. The Role of MicroStrategy as a Bitcoin Corporate Holder MicroStrategy pioneered the strategy of holding significant amounts of Bitcoin on its corporate balance sheet. Led by Michael Saylor, the company has aggressively acquired BTC, making it the most prominent Bitcoin Corporate Holder globally. This commitment has transformed MSTR into a de facto Bitcoin investment vehicle for many, influencing its market valuation far beyond its core software business. This unique position means that when Bitcoin’s price surges, MSTR’s stock tends to react strongly, often with amplified volatility compared to Bitcoin itself or diversified crypto funds. The market essentially values MSTR based heavily on its per-share Bitcoin holdings, plus a premium (or sometimes a discount) related to its operational business and debt used for acquisitions. What Does This Mean for Crypto ETF Performance and Investors? The fact that MSTR has outperformed 74 different Crypto ETFs highlights the diverse and sometimes complex landscape of digital asset investing: Not All Crypto Exposure is Equal: This performance gap underscores that different investment vehicles offering ‘crypto exposure’ can yield vastly different results due to structure, fees, underlying assets, and market dynamics. Due Diligence is Crucial: Investors considering crypto-related investments must look beyond just the ‘crypto’ label. Understanding the specific strategy, holdings, fees, and structure of an ETF – or the unique nature of a stock like MSTR – is vital. MSTR’s Unique Position: MSTR isn’t a typical tech stock anymore, nor is it a typical ETF. Its performance is a testament to its specific, high-conviction Bitcoin accumulation strategy and the market’s reaction to it. While Nate Geraci’s data point is compelling for year-to-date performance, it’s crucial for investors to remember that past performance is not indicative of future results. The dynamics that favored MSTR in the recent period could shift. Actionable Insights for Navigating MSTR and Crypto ETFs Given the insights from the recent Crypto ETF Performance data, here are some points for investors to consider: Understand Your Goal: Are you seeking broad crypto market exposure, specific Bitcoin exposure, or a leveraged play? Your goal should dictate your investment vehicle. Evaluate Structure and Risk: MSTR comes with corporate risk, debt risk (from borrowing to buy BTC), and stock market volatility in addition to Bitcoin price risk. ETFs have risks related to tracking error, counterparty exposure (especially futures ETFs), and management fees. Compare Fees: ETF expense ratios can eat into returns over time. While MSTR doesn’t have an explicit management fee like an ETF, its operational costs and debt financing have implications. Diversification: Relying heavily on a single stock like MSTR for crypto exposure concentrates risk. Crypto ETFs, even basket ones, can offer some level of diversification within the digital asset space, though this didn’t guarantee outperformance this year. Stay Informed: Follow experts like Nate Geraci and analyze the underlying drivers of performance for both individual stocks and ETFs. The story of MicroStrategy stock performance outpacing a wide array of Crypto ETFs this year serves as a powerful reminder that the path to digital asset exposure is multifaceted and requires careful consideration. Conclusion: A Surprising Leader in the Crypto Investment Race Nate Geraci’s observation that MicroStrategy (MSTR) stock has outperformed all 74 tracked crypto ETFs year-to-date is a significant data point in the evolving narrative of cryptocurrency investing. It underscores the unique position MicroStrategy holds as a Bitcoin Corporate Holder and the market’s current appetite for this specific type of leveraged Bitcoin exposure through a public company structure. While Crypto ETF Performance offers regulated and varied ways to access the digital asset market, MSTR’s concentrated bet on Bitcoin has delivered superior returns in the recent bullish environment. Investors should use this information to deepen their understanding of the different vehicles available, weigh the associated risks and benefits, and make informed decisions aligned with their own investment strategy. To learn more about the latest crypto market trends, explore our article on key developments shaping Bitcoin institutional adoption. This post MicroStrategy Stock Performance: Unstoppable MSTR Outpaces All 74 Crypto ETFs YTD first appeared on BitcoinWorld and is written by Editorial Team",bitcoinworld,https://bitcoinworld.co.in/microstrategy-stock-outpaces-etfs/,"BTC|BUSINESS|MARKET|TECHNOLOGY|TRADING","Crypto News|BITCOIN|Crypto ETFs|investing|Microstrategy|MSTR",cryptocompare
2025-05-28T06:47:52.000Z,"Bitcoin Bull Market Breakdown: This is Where BTC Price Is Going Next?","The post Bitcoin Bull Market Breakdown: This is Where BTC Price Is Going Next? appeared first on Coinpedia Fintech News The cryptocurrency market today has shown a minor uptick of 0.22% to the current milestone at $3.43 trillion. Trading activity remains strong, with the volume at $129 billion, which has surged 19.59% overnight. Talking about sentiments of marketers, the Fear & Greed Index stands at a greed driven score of 68. However, the Altcoin Season Index at 23/100 indicates that Bitcoin remains the dominant force in the market. While Bitcoin continues to hold a firm grip on the market, the short-term volatility still puzzles not one but many. In this analysis, we see how Bitcoin has been doing behind the scenes, that is, onchain wise, and also explore Bitcoin price analysis for the short-term. Smart DCA and Holder Cost Basis Reflect Bullish Strength? As per the analysis by Axel , the ongoing Bitcoin bull cycle has seen a clear execution of the Smart Dollar-Cost Averaging (DCA) strategy. All four buy triggers identified through cost-basis analysis have led to positive returns on investment, justifying the effectiveness of DCA in volatile markets. He highlights that the toughest buy point was Trigger #1, executed near the bear market bottom at $16k. Recent data from CryptoQuant further supports this bullish structure. Since Bitcoin reached the $97k mark, the realized cost basis for both short-term and long-term holders has started to climb higher. In particular, the 7-day rate of change for long-term holders has hit a cycle high, signaling strong conviction and reduced profit-taking from experienced investors. Bitcoin Price Analysis Bitcoin price today is at $108,969.44, with a 0.16% daily and 1.45% weekly gain. The market cap stands at $2.16 trillion, backed by a 24-hour volume of $53.17 billion. Intraday price fluctuations remain tight, with a low of $108,445.43 and a high of $110,744.21. Technical indicators from the 4H chart show the RSI hovering around 49.85, reflecting a neutral momentum, while the price trades near the SMA-9, hinting at short-term consolidation before the next directional move. That being said, we can expect a move toward a new ATH around $113k, after a clean close above the current all-time high. If you are a hodler, you cannot miss out on our Bitcoin (BTC) price prediction 2025, 2026-2030! FAQs Is it a good time to buy Bitcoin now? Current on-chain metrics and Smart DCA triggers suggest it is a favorable environment for long-term accumulation. What is Bitcoin price today? Bitcoin price today is changing hands at $108,969.44 with a daily gain of 0.16%. Is altcoin season approaching? Not yet. The Altcoin Season Index is at 23/100, indicating Bitcoin is still outperforming the broader altcoin market.",coinpedia,https://coinpedia.org/price-analysis/bitcoin-bull-market-breakdown-this-is-where-btc-price-is-going-next/,"ALTCOIN|BTC|BUSINESS|MARKET|TRADING","Price Analysis|Bitcoin",cryptocompare
