datetime,headline,summary,source,url,categories,tags,api_source
2025-07-18T00:57:16,"Thumzup Media Corporation to Invest $250 Million in Bitcoin and Major Cryptocurrencies for Portfolio Diversification","🚀 Are You Chasing New Coins? Catch the newest crypto opportunities. Be the first to buy, be the first to win! Click here to discover new altcoins! Nasdaq-listed Thumzup Media",coinotag,https://en.coinotag.com/breakingnews/thumzup-media-corporation-to-invest-250-million-in-bitcoin-and-major-cryptocurrencies-for-portfolio-diversification/,"BTC|DOGE|ETH|LTC|SOL","BTC|DOGE|ETH|LTC|SOL|USDC|XRP",cryptocompare
2025-07-18T00:42:52,"Trump Officials Possibly Hold Millions in Bitcoin as Crypto Stocks Rise Amid Regulatory Developments","🚀 Are You Chasing New Coins? Catch the newest crypto opportunities. Be the first to buy, be the first to win! Click here to discover new altcoins! Nearly 70 former",coinotag,https://en.coinotag.com/trump-officials-possibly-hold-millions-in-bitcoin-as-crypto-stocks-rise-amid-regulatory-developments/,"BTC|ALTCOIN","News|BTC",cryptocompare
2025-07-18T00:30:26,"Is That Right? US Senator Says Crypto Could ‘Blow Up’ Financial System","A bill moving through Congress could reshape how big companies sell their shares. Senator Elizabeth Warren of Massachusetts warned that the CLARITY Act might let firms dodge long‑standing rules. Related Reading: If You’re Wealthy, 1 Bitcoin Should Already Be In Your Wallet, Expert Says Based on reports, the measure would shift certain tokens onto a “mature” blockchain and hand oversight to the CFTC instead of the SEC. Warren Warns Of A Regulatory Loophole According to Warren, the bill’s text would let any company listed on the NYSE put its stock on a qualifying blockchain. At that point, companies could escape SEC registration. She said that could “blow up the value of the NYSE” by cutting out investor protections. Under the draft, token sales using a functional chain still count as fundraising, but tokenized shares may slip free of SEC checks. She wants to limit US companies (Amazon, Meta, GE) to protect the “US economy” / NYSE? Not against NYSE, but it’s just one company, fully owned by ICE, market cap: ~$100 billion. Amazon market cap: $2.40 trillion. NYSE ≠ economy. All companies = economy. https://t.co/6Xo6QVgL1p — CZ 🔶 BNB (@cz_binance) July 17, 2025 Companies could raise money without filing the same forms. They would not need to share audited reports or follow proxy rules. Retail investors might face hidden risks if their favorite blue‑chip stock suddenly shifts on‑chain. Crypto Week Sees Multiple Bills This week in Washington is packed. The House Agriculture Committee and the House Financial Services Committee both cleared the CLARITY Act. It now heads toward the Senate, where approval is not guaranteed. (Update – On Wednesday, the GOP-led US House navigated crucial procedural checkpoints for crypto reform, just a day after President Donald Trump stepped in to keep the effort alive—clearing the path for America’s inaugural federal digital-asset statute. Those approvals came on the heels of more than nine hours of behind‑closed‑doors negotiations, as party leaders courted skeptics uneasy about the bill’s design.) US President Donald Trump said he expects these bills to land on his desk after Senate votes. Representative Andy Harris noted that the House Freedom Caucus plans to meet soon to add CBDC language into the CLARITY draft. Large parts of the market are watching closely. Token classification under one agency or another could shift billions in trading volume overnight. Related Reading: Massive Whale Profits $15 Million—Now Betting Big On Ethereum To Crash Industry Voices Split On Regulation Ripple CEO Brad Garlinghouse pointed out that over 55 million US citizens now use crypto. He cited a $3.4 trillion market cap and urged a clear framework to secure the industry’s future. On the other side, Americans for Financial Reform warned that the bill would curb the SEC’s powers to guard retail investors. They said it is more deregulatory than FIT21 from 2024, raising risks of scams and theft. SEC Commissioner Hester Peirce has said token rules should not remove securities‑law coverage where it belongs. Representatives Maxine Waters and Angie Craig also voiced concerns that the legislation favors big crypto players over everyday investors. Featured image from Meta, chart from TradingView",newsbtc,https://www.newsbtc.com/bitcoin-news/is-that-right-us-senator-says-crypto-could-blow-up-financial-system/,"REGULATION|BUSINESS|MARKET|BTC|TOKEN SALE","Bitcoin News|bitcoin|btcusd|CBDC|CLARITY Act|crypto|Genius Act|Sen. Warren|Stablecoins|Trump",cryptocompare
2025-07-18T00:07:33,"Tether Mints 2 Billion USDT, Sending $1 Billion to Binance Amid Rising Institutional Demand and Bitcoin Price Recovery","🚀 Are You Chasing New Coins? Catch the newest crypto opportunities. Be the first to buy, be the first to win! Click here to discover new altcoins! Tether’s recent minting",coinotag,https://en.coinotag.com/tether-mints-2-billion-usdt-sending-1-billion-to-binance-amid-rising-institutional-demand-and-bitcoin-price-recovery/,"USDT|BTC|BNB|EXCHANGE|TRADING","News|ARKM|BTC|USDT",cryptocompare
2025-07-18T00:06:20,"James Wynn Expands BTC Short Position to $16.77M Amid Ongoing Increase","🚀 Are You Chasing New Coins? Catch the newest crypto opportunities. Be the first to buy, be the first to win! Click here to discover new altcoins! James Wynn has",coinotag,https://en.coinotag.com/breakingnews/james-wynn-expands-btc-short-position-to-16-77m-amid-ongoing-increase/,"BTC|ALTCOIN","BTC",cryptocompare
2025-07-18T00:00:48,"Bitcoin Treasuries Soar: Unveiling the Astounding H1 2025 Crypto Market Shift","BitcoinWorld Bitcoin Treasuries Soar: Unveiling the Astounding H1 2025 Crypto Market Shift The first half of 2025 has painted a fascinating picture of the cryptocurrency landscape, one dominated by two powerful forces: Bitcoin and stablecoins. A recent report from K33 sheds crucial light on these shifting dynamics, revealing a significant surge in Bitcoin treasuries held by public companies and a remarkable expansion in the overall stablecoin supply . This isn’t just a fleeting trend; it signals a profound evolution in how institutions and individuals perceive and utilize digital assets. Why Are Corporate Bitcoin Treasuries Exploding? According to the K33 report, public companies made a colossal move in H1 2025, adding nearly 245,000 BTC to their balance sheets. This isn’t merely an increase in volume; the number of firms embracing Bitcoin as a treasury asset nearly doubled, soaring from 70 to 134 across 27 countries. The United States, predictably, leads this charge, demonstrating a growing conviction among corporate giants in the long-term value proposition of the world’s leading cryptocurrency. But why are companies making such a bold shift? Several factors are at play: Inflation Hedge: In an era of persistent inflationary concerns, Bitcoin is increasingly viewed as a digital gold, offering a potential hedge against the devaluation of fiat currencies. Balance Sheet Diversification: Forward-thinking companies are looking beyond traditional assets to diversify their treasury holdings, recognizing Bitcoin’s uncorrelated nature to conventional markets. Institutional Adoption: As more large institutions, payment processors, and investment funds embrace Bitcoin, the perceived risk decreases, making it more palatable for corporate treasuries. Future-Proofing: Holding Bitcoin can be seen as a strategic move to align with the future of finance, positioning companies at the forefront of digital innovation. This surge in Bitcoin treasuries underscores a maturing market where institutional confidence is not just a buzzword, but a tangible reality shaping corporate financial strategies globally. The Stablecoin Supply Surge: A Pillar of Crypto Stability? While Bitcoin’s institutional embrace captures headlines, the quiet but relentless growth of the stablecoin supply is equally significant. The K33 report highlights an impressive $38 billion increase in stablecoin supply during H1 2025. These digital assets, pegged to fiat currencies like the US dollar, play a pivotal role in the broader crypto ecosystem. Stablecoins serve multiple critical functions: Trading Pairs: They are the primary trading pairs for most cryptocurrencies, facilitating seamless and efficient transactions across exchanges without the need to convert back to fiat. Decentralized Finance (DeFi): Stablecoins are the backbone of the DeFi ecosystem, enabling lending, borrowing, and yield farming activities with reduced volatility risk. Remittances and Payments: Their stability and speed make them attractive for cross-border payments and remittances, offering a cheaper and faster alternative to traditional banking rails. Safe Haven: During periods of market volatility, traders often convert their volatile crypto assets into stablecoins, using them as a temporary safe haven. The consistent expansion of the stablecoin supply signals robust activity within the crypto economy, reflecting increased liquidity and utility across various applications. It suggests a growing comfort level with digital dollars as a medium of exchange and value storage. Altcoin Performance: A Clear Sign of Crypto Market Dominance In stark contrast to the bullish narratives surrounding Bitcoin and stablecoins, the K33 report reveals a challenging period for most altcoins. Out of the top 50 alternative cryptocurrencies, a mere nine managed to post gains in H1 2025. This divergence paints a clear picture of the prevailing crypto market dominance by Bitcoin and the increasing preference for stable, liquid assets. This performance disparity highlights a ‘flight to quality’ phenomenon. When market sentiment becomes cautious, or when major catalysts like institutional adoption are in play, capital tends to consolidate into Bitcoin, perceived as the most secure and established digital asset. Many altcoins, often lacking the same level of liquidity, institutional backing, or proven use cases, struggle to attract investment in such an environment. For investors, this trend underscores the importance of understanding market cycles and the varying risk profiles within the crypto space. While altcoins can offer explosive growth potential, they also carry significantly higher risk, especially when Bitcoin asserts its dominance. What Lies Ahead? The H2 Bitcoin Outlook Despite the mixed performance across the board, the K33 report offers an optimistic perspective on the Bitcoin outlook for the second half of 2025. Historically, H2 has often proven stronger for Bitcoin, and several potential catalysts could fuel further growth: Spot ETF Approvals: Continued progress and potential approvals of new Bitcoin spot ETFs in various jurisdictions could unlock massive institutional capital, providing a fresh wave of demand. Regulatory Clarity: As governments worldwide work towards establishing clearer regulatory frameworks for cryptocurrencies, this increased certainty can attract more traditional investors and corporations. Post-Halving Dynamics: While the halving occurred in 2024, its full impact on supply shock and price discovery often plays out in the subsequent year, influencing the H2 Bitcoin outlook . Macroeconomic Factors: Global economic shifts, interest rate policies, and geopolitical events can continue to drive demand for decentralized, scarce assets like Bitcoin. The report suggests that the groundwork laid in H1 2025, particularly with the surge in Bitcoin treasuries , sets a strong foundation for what could be a compelling second half of the year for the flagship cryptocurrency. Actionable Insights for Navigating the Evolving Crypto Landscape The K33 report provides valuable insights for anyone involved in the crypto market. Here are some actionable takeaways: Focus on Fundamentals: The institutional adoption of Bitcoin and the utility of stablecoins highlight the importance of fundamental strength and real-world use cases. Diversify Wisely: While Bitcoin and stablecoins dominate, a diversified portfolio can still include carefully selected altcoins with strong technology and active communities, but with a clear understanding of their higher risk profile. Stay Informed on Regulation: Regulatory developments will continue to be a major market driver. Keeping abreast of these changes is crucial for anticipating market shifts. Consider Long-Term Holdings: The increasing corporate adoption of Bitcoin suggests a long-term bullish sentiment that individual investors might consider mirroring for a portion of their portfolio. Conclusion: A Maturing Market Led by Bitcoin and Stability The first half of 2025 has unequivocally demonstrated Bitcoin’s strengthening position as a legitimate treasury asset for public companies and the indispensable role of stablecoins in facilitating the broader crypto economy. While altcoin performance lagged, this period has solidified Bitcoin’s crypto market dominance , hinting at a more mature and discerning market. With a promising H2 Bitcoin outlook driven by potential ETF approvals and regulatory clarity, the stage is set for continued evolution and potential growth in the digital asset space. The trends of H1 2025 serve as a powerful reminder of where institutional and individual capital is flowing, shaping the future of finance one digital asset at a time. To learn more about the latest crypto market trends, explore our article on key developments shaping Bitcoin institutional adoption. This post Bitcoin Treasuries Soar: Unveiling the Astounding H1 2025 Crypto Market Shift first appeared on BitcoinWorld and is written by Editorial Team",bitcoinworld,https://bitcoinworld.co.in/bitcoin-treasuries-double-surge/,"BTC|MARKET|ALTCOIN|TRADING|FIAT","Crypto News|BITCOIN|Crypto Market|institutional adoption|Market Analysis|Stablecoins",cryptocompare
2025-07-18T00:00:12,"Ethereum beats Bitcoin in July – How long can ETH stay ahead?","Ethereum’s strong ETF inflows and dominance recovery suggest a possible shift in market leadership.",ambcrypto,https://ambcrypto.com/ethereum-beats-bitcoin-in-july-how-long-can-eth-stay-ahead/,"ETH|BTC|ALTCOIN|MARKET","Altcoin|Bitcoin|BTC Trading View|Ethereum|News|News 1|Social|Trading View|ambcrypto",cryptocompare
