datetime,headline,summary,source,url,categories,tags,api_source
2025-07-14T21:30:30,"Bitcoin’s ‘High-Beta Safe Haven’ Status Validated in Macro Uncertainty: Bitfinex","Bitcoin shattered records this week, surging to an all-time high of over $123,000 and cementing its position as the world’s fifth-largest asset by market capitalization. Report Says Structural Demand Outpaces Issuance as Bitcoin Scales New Highs Bitfinex analysts report bitcoin’s explosive 12.3% breakout from its January peak was fueled by aggressive bidding from short-term holders",bitcoin.com,https://news.bitcoin.com/bitcoins-high-beta-safe-haven-status-validated-in-macro-uncertainty-bitfinex/,"BTC|EXCHANGE|MARKET","Crypto News|Bitcoin (BTC)|Bitcoin Price|BitFinex",cryptocompare
2025-07-14T21:26:10,"ChatGPT’s 42-Signal SUI Analysis Flags $4.20 Breakout from Cup and Handle Pattern","ChatGPT’s AI model processed 42 live indicators, revealing breakout bullish momentum as SUI surges +12.01% to $3.9091 following Bitcoin’s historic $123K ATH , with institutional backing from VanEck and Lion Group driving a symmetrical triangle breakout. SUI is trading above all EMAs with a massive 192.24% volume surge to $2.76 billion, as a cup and handle pattern targets 2-3x appreciation. Exceptional momentum emerges , with the price 22.4% above the 200-day EMA ( $3.0335 ) while the RSI hits overbought 72.19 territory, indicating a potential pullback before continuation. The market cap exploded to $13.45 billion, up 11.31%, with AltRank soaring to 10 and Galaxy Score reaching 80 as institutional positioning accelerates ahead of the $4.00 resistance test. The following analysis synthesizes ChatGPT’s 42 real-time technical indicators, institutional backing developments, cup and handle formations, and ecosystem expansion to assess SUI’s 90-day trajectory amid Bitcoin’s historic rally catalyst and altcoin season acceleration. Technical Explosion: Cup and Handle Confirms Breakout Power SUI’s current price of $3.9091 reflects an exceptional +12.01% daily gains, demonstrating explosive breakout momentum from symmetrical triangle consolidation. The massive $0.5139 intraday range represents 13.1% of the current price, indicating institutional accumulation and retail FOMO convergence during Bitcoin’s historic rally catalyst. RSI at 72.19 enters overbought territory without reaching extreme levels, suggesting strong underlying momentum with potential for a short-term pullback before continuation. Source: TradingView This positioning indicates a sustainable breakout rather than a speculative spike, though a healthy consolidation around $3.50-$3.60 would strengthen the technical foundation. The cup and handle formation provides clear 2-3x upside targets with pattern measurements suggesting easy appreciation toward $6.00-$8.00 levels. MACD indicators show exceptional bullish momentum with a positive histogram at 0.0413, confirming an acceleration phase rather than an ending. Institutional Validation: VanEck and Lion Group Drive Adoption Institutional backing from VanEck and Lion Group provides unprecedented validation for SUI’s technological advantages and ecosystem potential. VanEck’s involvement is particularly important given its leadership in crypto ETF development and institutional product creation for traditional finance integration. SHEESH $SUI just got added to a $600 million treasury strategy Not by a DAO Not by a crypto-native fund But by a publicly listed TradFi derivatives firm @LionGroupLGHL (NASDAQ: LGHL) just secured a $600M facility to build out a next-gen crypto treasury. And what… pic.twitter.com/cbzJDWnt3C — eye zen hour (@eyezenhour) June 18, 2025 Lion Group’s participation demonstrates Asian institutional recognition of SUI’s scalability advantages over existing layer- 1 alternatives. The institutional backing creates sustainable demand dynamics beyond speculative trading, with professional investors providing predictable accumulation patterns supporting price stability. Bitcoin Rally Catalyst: $123K ATH Drives Altcoin Season Bitcoin’s historic surge to $123K ATH creates optimal conditions for altcoin appreciation as institutional capital flows into high-performance layer- 1 alternatives. Bitcoin breaks explosive $123K ATH wiping out $1.3B shorts as CZ calls it ""just a fraction"" while $BTC becomes world's fifth-largest asset at massive $2.39T market cap. #Bitcoin #ATH https://t.co/BLwoKKLlj9 — Cryptonews.com (@cryptonews) July 14, 2025 SUI’s positioning as a technological leader with institutional backing makes it the primary beneficiary of Bitcoin-driven altcoin rotation patterns. The altcoin season catalyst provides fundamental support for SUI’s technical breakout, with Bitcoin’s rally validating cryptocurrency infrastructure investments and driving institutional exploration of scalable blockchain alternatives. This macro environment supports sustained appreciation rather than temporary speculation. Historical Context: Recovery Toward January ATH Levels SUI’s 2025 performance demonstrates strong resilience following January’s $5.36 all-time high peak. The subsequent correction through February ( $4.80-$5.00 ), March ( $4.30-$4.90 ), and April’s sharp decline to $1.71 established key support levels that held during recent recovery. Source: TradingView May’s volatile recovery attempt ( $3.19-$4.13 ) and June’s continued weakness ( $2.81-$3.37 ) created optimal accumulation opportunities that institutional investors capitalized on ahead of current breakout momentum. The 85% recovery from April lows demonstrates SUI’s resilience and institutional confidence. Current price action represents a 27% discount to January all-time highs, providing attractive positioning for continued appreciation toward previous resistance levels while maintaining exceptional 967% gains from 2023 lows, demonstrating long-term value creation. Support & Resistance: EMA Strength Confirms Bullish Structure Immediate support emerges at today’s low around $3.4878 , reinforced by strong EMA cluster support between $3.0335-$3.1567 . This confluence provides an exceptional technical foundation during any pullbacks, with price trading 20-22% above all major EMAs, confirming extraordinary bullish momentum. The EMA positioning demonstrates institutional accumulation success with price above all moving averages, indicating sustained uptrend validation. Support at $3.50-$3.60 would provide a healthy consolidation opportunity while maintaining breakout momentum integrity. Source: TradingView Resistance begins immediately at today’s high around $4.0017 , followed by key psychological resistance at $4.20-$4.50 . Breaking above $4.50 would trigger cup and handle pattern completion, targeting $6.00+ with potential extension toward $10.00 during continued altcoin season momentum. Market Metrics: Exceptional Volume Validates Breakout SUI maintains a $13.45 billion market capitalization with an extraordinary 24-hour trading volume of $2.76 billion , representing a massive 192.24% surge. The volume-to-market cap ratio of 20.49% indicates exceptional institutional and retail participation, validating breakout authenticity rather than speculative manipulation. Source: CoinMarketCap The explosive volume surge to 87.97M SUI confirms institutional accumulation acceleration ahead of technical resistance breakout attempts. This volume pattern supports continued momentum rather than exhaustion, with professional participation providing sustainability. Circulating supply of 3.45 billion SUI represents 34.5% of the total 10 billion maximum supply, providing controlled tokenomics appealing to institutional treasury management while maintaining scarcity dynamics supporting long-term appreciation. Social Sentiment: Community Euphoria Builds Momentum LunarCrush data reveals exceptional community engagement with AltRank soaring to 10 , indicating top-tier social performance relative to other cryptocurrencies. A Galaxy Score of 80 reflects positive sentiment momentum building around institutional backing and technical breakout confirmation. Social dominance of 1.9% with 3.08 million total engagements demonstrates SUI’s ability to capture considerable attention during breakout periods. The 86% positive sentiment reflects community enthusiasm around cup and handle formations and institutional validation developments. Recent social themes focus on 2-3x appreciation targets, institutional backing validation, and technological superiority narratives. Are you ready for the next $SUI wave? pic.twitter.com/oTh34a8Vma — Crypto Rand (@crypto_rand) July 14, 2025 Community discussions emphasize SUI’s positioning as a premier layer- 1 alternative during Bitcoin rally periods and altcoin season acceleration. 90-Day SUI Price Forecast Cup and Handle Completion (Bull Case – 50% Probability) Successful breakout above $4.007 resistance, combined with continued institutional backing, could drive appreciation toward $6.00-$8.00 , representing 54-105% upside. This scenario requires sustained volume above 70M SUI daily and continuation of Bitcoin rally momentum supporting altcoin season dynamics. Source: TradingView Technical targets include $4.298 , $5.387, and $6.00 based on cup and handle pattern measurements and institutional flow projections. Overbought Consolidation (Base Case – 35% Probability) A healthy pullback from overbought RSI levels toward $3.50-$3.60 could extend 4-6 weeks while institutional positioning develops gradually. This scenario allows technical indicators to reset while maintaining breakout momentum integrity and EMA support structure. Support at the EMA cluster around $3.10-$3.20 would likely hold during consolidation, with volume normalizing around 40-50M SUI daily. Source: TradingView This sideways action provides additional accumulation opportunities while preserving uptrend structure for eventual continuation. Technical Correction (Bear Case – 15% Probability) Breaking below EMA support at $3.15 could trigger a deeper correction toward $2.80-$3.00 , representing a 24-28% downside. This scenario would require broader market weakness or institutional demand disappointment affecting breakout sustainability. Source: TradingView The strong institutional backing and technological fundamentals limit extreme downside scenarios, with major support at $2.80-$3.00 providing a foundation for future recovery cycles during continued ecosystem development. SUI Forecast: Technological Excellence Meets Institutional Revolution SUI’s current positioning reflects the convergence of technological leadership, institutional validation, and technical breakout momentum during optimal market conditions. The 42-signal analysis reveals that the cryptocurrency is positioned at the forefront of layer- 1 blockchain adoption and is a beneficiary of the altcoin season. The cup and handle formation with institutional backing establishes precedent for professional adoption of high-performance blockchain infrastructure. Combined with Bitcoin’s $123K rally catalyst and exceptional volume validation, these developments create compelling appreciation scenarios. Looking forward, the $4.20 resistance breakthrough represents the definitive catalyst for SUI’s next major appreciation wave toward $6.00-$8.00 targets. The post ChatGPT’s 42-Signal SUI Analysis Flags $4.20 Breakout from Cup and Handle Pattern appeared first on Cryptonews .",cryptonews,https://cryptonews.com/news/sui-breakout-chatgpt-flags-4-20-cup-handle-signal/,"TRADING|SUI|MARKET|BTC|ALTCOIN","Price Analysis|ChatGPT|SUI",cryptocompare
2025-07-14T21:11:52,"Wall Street Piles Up Ethereum: ETH Price Warms Up for $4k Next","The post Wall Street Piles Up Ethereum: ETH Price Warms Up for $4k Next appeared first on Coinpedia Fintech News The demand for Ethereum (ETH) has gone up through the roof in recent times, led by Wall Street corporations. After more than a year trailing Bitcoin ( BTC ) in net cash inflows, on-chain data analysis shows that long-term investors have favored Ether. Ethereum Records Renewed Demand for Long-term Investors For instance, the U.S. spot Ether ETFs, led by BlackRock’s ETHA, recorded the highest weekly cash inflow, of about $908 million, since their inception. As a result, the U.S. spot Ether ETFs extended their multi-week streak of cash inflows, whereby the cohorts have recorded over $2.7 billion in net cash inflows for the past four months. The demand for Ether by corporations has also skyrocketed in the recent past. For instance, BitMine, a publicly traded company, announced on Monday that its Ether holding has surpassed $500 million. After closing a $250 million private placement, BitMine increased its ETH bath to 163,142 coins. ”We are pleased that we added significantly to our ETH treasury just 3 days after closing our private placement,” Jonathan Bates, CEO of BitMine, noted . “Clearly Wall Street is getting ‘ETH-pilled.” Midterm Targets for ETH Price After consolidating in a choppy mode for the past two months, Eth price recently broke out beyond $3k for the first time since January 2025. The large-cap altcoin, with a fully diluted valuation of about $363 billion, has since signaled bullish sentiment. $ETH – Consolidate, form a new support, then higher. This is the most bullish way to go higher even though impatient people just want one giant candle. pic.twitter.com/qdr59RHXJV — IncomeSharks (@IncomeSharks) July 14, 2025 From a technical analysis standpoint, Ether price is aiming for $3,400 next with the pathway towards $4k more clear. Furthermore, the weekly MACD indicator has flashed bullish sentiment after the MACD line recently crossed above the zero line amid increasing bullish histograms.",coinpedia,https://coinpedia.org/price-analysis/wall-street-piles-up-ethereum-eth-price-warms-up-for-4k-next/,"ETH|TRADING|BTC|BUSINESS|MARKET","Price Analysis|Ethereum",cryptocompare
2025-07-14T21:02:08,"Big Bitcoin Foe US Giant Vanguard May Actually Be a BTC Fan – Data Revealed","Vanguard, the $10 trillion asset management giant known for its harsh criticism of cryptocurrencies, has ironically become one of the institutions with the most indirect exposure to Bitcoin. Although the company does not invest directly in Bitcoin, thanks to the logic of index funds, it has become the investor with the largest share in Strategy shares, one of the symbolic names of the crypto market. Vanguard holds about 8% of Strategy's publicly traded Class A shares, or more than 20 million shares. This percentage propelled Vanguard to the top shareholder position in the fourth quarter, surpassing Capital Group, according to data compiled by Bloomberg from regulatory filings. These shares are held by dozens of Vanguard funds, ranging from indices tracking small- and mid-cap companies to value, growth, and momentum strategies. Related News: There is a New Development About Terra (LUNA) Founder Do Kwon - The Phrase “Productive Discussions” is Used for the First Time - Here are the Details Vanguard management has maintained a clear stance against cryptocurrencies. CEO Tim Buckley has described Bitcoin as “speculative and lacking in economic value, unsuitable for long-term portfolios.” He also barred Bitcoin ETFs from trading on his platform when they launched in the US in 2024. “It's hard to imagine how they could fit into a truly long-term portfolio,” Buckley said. Strategy, formerly known as MicroStrategy, became the first public company to invest heavily in Bitcoin since 2020. Led by Michael Saylor, the company funds its Bitcoin purchases by both borrowing and issuing stock. Since then, the company's shares have increased by approximately 3,400%. As the largest individual shareholder, Michael Saylor holds approximately 20 million shares, making him the world's largest institutional Bitcoin holder with over $70 billion in Bitcoin reserves. “This is a strong signal that Bitcoin is increasingly being accepted by the traditional financial community as a legitimate reserve asset,” Saylor said of Vanguard's large holdings. *This is not investment advice. Continue Reading: Big Bitcoin Foe US Giant Vanguard May Actually Be a BTC Fan – Data Revealed",bitcoinsistemi,https://en.bitcoinsistemi.com/big-bitcoin-foe-us-giant-vanguard-may-actually-be-a-btc-fan-data-revealed/,"BTC|BUSINESS|MARKET|FIAT|LUNA","Bitcoin|News",cryptocompare
2025-07-14T21:00:49,"Grayscale Begins IPO Process Amid Regulatory Debate","Grayscale Investments has taken a significant step toward becoming a publicly listed company. The company has submitted a confidential draft registration statement (Form S-1) to the U.S. Securities and Exchange Commission (SEC). The filing officially starts the process for Grayscale to sell its shares to the public through an IPO, possibly. This comes at a necessary time, as U.S. lawmakers meet in Washington for Crypto Week to discuss new rules for digital assets. Grayscale Takes A Confidential Step Toward the Public Market Grayscale’s IPO plan is still in the early stages. The asset manager submitted the draft under the JOBS Act. This allows the firm to keep specific details private while the SEC reviews the application. So far, Grayscale has not shared how many shares it will offer or at what price. Grayscale said in a statement that the IPO will only happen after the SEC finishes its review and if market conditions are right. Meanwhile, Grayscale is not alone. Other crypto firms like Kraken, Gemini, and OKX are also preparing to go public. This push comes after Circle went public in June, and its market value has soared past $62 billion since listing. Crypto Week is Poised to Bring Regulatory Focus Grayscale’s IPO news comes just as Crypto Week begins in Washington, running from July 14 to July 18. During this time, the U.S. House of Representatives will come together to review and vote on several bills related to cryptocurrencies. These talks are expected to cover stablecoins, market structure, and the broader role of crypto in the U.S. financial system. These discussions are expected to shape the future of the crypto industry. They may also affect how large firms like Grayscale approach compliance and future growth. Grayscale’s decision to move forward with an IPO during this time shows confidence in its long-term plans, even as regulatory questions remain. With Bitcoin recently reaching an all-time high of over $123,000, investor interest in crypto is renewed, adding urgency to regulatory talks. Grayscale Moves Forward with IPO After ETF Wins Grayscale’s confidential IPO filing was also shortly after the company received approval to converits its Digital Large Cap Fund (GDLC) into an exchange-traded fund (ETF). The SEC had initially missed its deadline to approve or reject Grayscale’s request, before eventually approving it. This comes after some big wins for Grayscale. In 2024, the company got approval to turn its Bitcoin Trust into a spot ETF. In May 2025, its Ethereum Trust also moved closer to becoming an ETF, showing more progress for crypto investment options. Grayscale’s move to go public marks a significant moment not only for the company but also for the broader crypto market. By joining public markets, Grayscale hopes to raise funds, expand its business, and offer more ways for investors to access digital assets. The post Grayscale Begins IPO Process Amid Regulatory Debate appeared first on TheCoinrise.com .",thecoinrise,https://thecoinrise.com/grayscale-begins-ipo-process-amid-regulatory-debate/,"MARKET|REGULATION|BUSINESS|BTC|EXCHANGE","Blockchain News|Grayscale",cryptocompare
