datetime,headline,summary,source,url,categories,tags,api_source
2025-07-14T23:58:07,"Bitcoin Accumulation Trends Suggest Renewed Retail and Institutional Interest Amid Mixed Whale Activity","Recent on-chain data from Glassnode reveals a resurgence in Bitcoin accumulation among smaller wallets holding less than 1 BTC, signaling a shift in market sentiment. Meanwhile, mid-tier institutional investors continue",coinotag,https://en.coinotag.com/bitcoin-accumulation-trends-suggest-renewed-retail-and-institutional-interest-amid-mixed-whale-activity/,"BTC|MARKET|BUSINESS","Analysis|Bitcoin|News|BTC",cryptocompare
2025-07-14T23:50:40,"Silent 14-Year Bitcoin Whale Moves 40,000 BTC to New Addresses in Massive Transfer","On July 15, data from EmberCN revealed a significant movement involving a long-dormant Bitcoin whale, previously inactive for 14 years and holding approximately 80,000 BTC. The entity transferred a total",coinotag,https://en.coinotag.com/breakingnews/silent-14-year-bitcoin-whale-moves-40000-btc-to-new-addresses-in-massive-transfer/,"BTC","BTC",cryptocompare
2025-07-14T23:49:31,"Bitcoin Captures Wall Street’s Attention and Sparks Financial Curiosity","Bitcoin draws significant attention in the financial markets with its recent rise. High inflows into crypto ETFs contribute to Bitcoin's upward price trend. Continue Reading: Bitcoin Captures Wall Street’s Attention and Sparks Financial Curiosity The post Bitcoin Captures Wall Street’s Attention and Sparks Financial Curiosity appeared first on COINTURK NEWS .",cointurken,https://en.coin-turk.com/bitcoin-captures-wall-streets-attention-and-sparks-financial-curiosity/,"BTC|MARKET|TRADING","Bitcoin (BTC)",cryptocompare
2025-07-14T23:42:36,"Vanguard Group Becomes Largest Shareholder in Bitcoin Strategy with Over 20 Million Shares","Vanguard Group, known for its cautious stance on cryptocurrencies, has emerged as the largest shareholder in Strategy, accumulating over 20 million shares. This significant investment signals a notable shift in",coinotag,https://en.coinotag.com/breakingnews/vanguard-group-becomes-largest-shareholder-in-bitcoin-strategy-with-over-20-million-shares/,"BTC","BTC",cryptocompare
2025-07-14T23:30:00,"Spanish Lawmakers Want Cryptoassets to Carry ‘Traffic Light’ Risk Warnings","A group of Spanish lawmakers wants the country’s financial top regulator to force crypto to carry “traffic light”-style risk warnings. The Spanish news agency EFE (via MSN ) reported that the Sumar group of MPs wants the National Securities Market Commission (CNMV) to use the system for retail investors. The group says that the system would let users “clearly and visually” identify the type of asset they are purchasing. Sumar has sent a written proposal to the regulator. The group complained that a “significant portion” of tokens traded on crypto exchange platforms “lack material backing or any underlying value.” Spanish lending giant BBVA said it won approval to launch Bitcoin and Ether trading, integrating crypto into everyday banking. #BBVA #CryptoTrading https://t.co/ifB7FxuUV8 — Cryptonews.com (@cryptonews) March 10, 2025 Traffic Light Crypto Warnings Coming to Spain? The parliamentary group also wants to rename cryptoassets like Bitcoin (BTC) and Ethereum (ETH) . It proposes using terms like “crypto bets” or “unbacked assets.” The lawmakers justified their request by explaining that coins “do not grant their owners any rights to tangible assets or have any connection to productive activities.” The traffic light warning system would see the CNMV apply one of three labels to each cryptoasset on an exchange or bank’s investing platform. The regulator would give a green light to cryptoassets that are registered, supported, and supervised. These coins would also need to demonstrate stable market performance. It would use yellow for cryptoassets that have “limited backing” or display moderate volatility. An orange light would identify “unsupervised” coins with high risk levels. And a final red label would be reserved for “speculative assets with no identified issuer or material backing.” Europe’s markets regulator criticized crypto oversight in Malta for falling short in several areas related to an unidentified entity it authorized https://t.co/BQrJYufB9B — Bloomberg (@business) July 10, 2025 Crypto Concentrates Wealth, Say Lawmakers Sumar said it is wary of “extreme forms of fictitious capital that do not generate value, but rather generate volatility, inequality, and wealth concentration.” Carlos Martín Urriza, the Sumar spokesperson for Economy and Finance, said policymakers should protect retail investors from assets that are not backed by a verified asset or collateral. Carlos Martín Urriza, the Sumar spokesperson for Economy and Finance. (Source: elDiarioes/YouTube) He added that crypto trading is often more similar to betting than to investing. Furthermore, Sumar wants the CNMV to force banks and exchanges to ensure their customers read pre-purchase information on cryptoassets before allowing them to buy coins. This should apply regardless of a token’s individual classification, Sumar said. It added that these mandatory warnings must be clearly summarized and contain visual elements. Sumar suggested that the CNMV use prominent warning systems. It said the regulator should base its models on those already used in sectors such as gambling or tobacco sales. Restrict Access to AI-powered Trading, MPs Urge Sumar lawmakers also want to create specific regulations for algorithmic trading pools. And the group wants to restrict retail investors’ access to trading platforms that use AI or algorithms. Sumar is a left-wing coalition comprising 20 parties that was first formed to run in the July 2023 general elections. Although it does not have a representation in the Senate, it has 31 lawmakers in the lower house, the Congress of Deputies. It makes up one of the 11 political blocs in Prime Minister Pedro Sánchez’s ruling coalition. Prime Minister Pedro Sánchez in the Spanish parliament’s lower house chamber. (Source: lamoncloa.gob.es/Ministry of the President/Government of Spain) This year has seen some of Spain’s largest banks move into the crypto sector as the popularity of coins continues to grow on the Iberian Peninsula. The post Spanish Lawmakers Want Cryptoassets to Carry ‘Traffic Light’ Risk Warnings appeared first on Cryptonews .",cryptonews,https://cryptonews.com/news/spanish-lawmakers-want-cryptoassets-to-carry-traffic-light-risk-warnings/,"TRADING|BTC|BUSINESS|MARKET|REGULATION","Blockchain News|Regulation|Spain",cryptocompare
2025-07-14T23:17:21,"Crypto Price Prediction Today 14 July – XRP, Pepe, Cardano","With crypto daddy Bitcoin ($BTC) reaching unprecedented price levels, just this morning UTC it notched a new all-time high of $122,838, market sentiment among traders has rapidly become bullish. Simultaneously, numerous top-tier altcoins and the best meme coins —such as TRON, Sui Network, Solana, Pepe, Trump, SPX6900, and FartCoin—have recorded fresh highs in recent months, reinforcing the perspective that both sectors still hold substantial growth opportunities. As anticipation builds for the next major bull run, investors are zeroing in on select crypto assets that could potentially eclipse their prior all-time price highs. Ripple (XRP): Cross-Border Payments Crypto Arguably Price Performer of the Year Ripple’s XRP continues to strengthen its position as a key connector between traditional banking infrastructures and blockchain-based remittance networks. Its capability to allow near-instant global transactions at minimal fees has attracted notable institutional interest. The United Nations has even recognised XRP as a feasible solution for transferring funds internationally without reliance on traditional intermediaries. After enduring years of legal challenges with the U.S. Securities and Exchange Commission (SEC), Ripple secured a pivotal legal victory in 2023 when a court ruled that retail sales of XRP did not constitute securities transactions. The SEC officially dropped the case in 2025, ending the four-year litigation. This outcome solidified XRP’s standing within the industry, creating an important regulatory benchmark for the wider crypto market. Investor confidence surged following this development, driving XRP’s price up by over 464% within a year, outperforming Bitcoin’s 103% gain over the same period. XRP faces stiff resistance at its current level of around $3, but it’s likely to smash through this as arguably the biggest success story among the billion cap altcoins. Earlier this year, a bullish flag pattern formed across its support and resistance lines, suggesting the possibility of a surge towards $3.50 this summer, surpassing its previous peak of $3.40 set in January 2018. Pepe ($PEPE): Meme Coin Giant Targets Fresh Record Highs Pepe ($PEPE) has carved out its place among the top three meme coins, driven by the meme’s cultural popularity and strong market performance. Inspired by Matt Furie’s iconic cartoon frog, $PEPE has generated massive returns for early investors and now ranks among the top three meme tokens, with a market valuation exceeding $4.6 billion. pic.twitter.com/jR6ycgAYjc — Elon Musk (@elonmusk) April 9, 2025 Launched in April 2023, Pepe triggered a wave of copycat tokens, though none have managed to match its momentum or staying power. Its rise gained further traction when Elon Musk briefly adopted a Pepe-themed profile picture on X (formerly Twitter). Currently priced around $0.00001235, $PEPE has posted gains of 23% in the past week, although it is still approximately 56% below its all-time high of $0.00002803 set in late 2024, technical analysts observed a falling wedge pattern in Q1, a formation typically indicative of an incoming upward price breakout. The Relative Strength Index (RSI) has reached 65, indicating strengthening bullish momentum, suggesting limited further potential gains for $PEPE through the week as it is close to 70, which typically signals an over-priced asset, triggering a selloff. If macroeconomic and geopolitical conditions remain stable, Pepe may embark on another major rally before summer ends. Cardano ($ADA): Can This Eco-Friendly Crypto Set New Price Highs in 2025? Interest in Cardano ($ADA) is on the rise, bolstered by institutional backing and positive technical indicators. Like XRP and Solana, Cardano was named by Donald Trump as a possible reserve crypto asset for inclusion in a proposed U.S. Strategic Bitcoin Reserve. Founded in 2014 by Ethereum co-founder Charles Hoskinson, Cardano is acclaimed for its research-driven development model and energy-efficient Proof-of-Stake (PoS) consensus, which spurred Ethereum’s own transition from Proof-of-Work to PoS. With a market capitalisation of $27.4 billion, ADA would need to more than triple in value to surpass Solana and challenge Ethereum’s market dominance. In the last seven days, Cardano outperformed Bitcoin during the market-wide rally, adding 27% to its price while Bitcoin only grew 12%. Current projections suggest ADA could climb from its present price of $0.76 to nearly $2 by mid-year. More bullish forecasts anticipate a full recovery to its previous all-time high of $3.09, marking a rebound from its 75.5% drop since September 2021. Strong support levels and a bullish flag formation observed between November and April hint at continued upside potential, although ADA’s RSI has strayed into overbought territory at 72, which means traders will be doing a spot of profit-taking that could depreciate the price over the week. The next immediate level of resistance is at $1.15, but ADA enjoys strong support in the $0.85 to $0.90 range. Seeking the Next Explosive Altcoin? Snorter ($SNORT) Presale Offers a Low-Cost Entry Opportunity Identifying high-potential crypto projects before they become mainstream often delivers the largest returns. While established altcoins maintain their grip on the market, emerging tokens are pioneering fresh avenues for growth. One such promising project is Snorter ($SNORT) , a hybrid meme token and trading bot operating on Solana, with plans to expand across chains in subsequent phases. Integrated directly into Telegram, Snorter provides real-time market insights within chat environments. With transaction fees as low as 0.85%, Snorter undercuts rivals such as BonkBot, Maestro, and Trojan. Its diverse feature set includes MEV-protected swaps, copy trading tools, anti-rug pull measures, and limit order sniping, offering users an all-in-one trading solution. Investor interest has been gaining momentum rapidly, with the presale having raised over $1.6 million so far. Its staking system offers yields of up to 207% APY, incentivising early adopters. Whether you are a seasoned trader or exploring meme coins for the first time, Snorter positions itself as a comprehensive platform to navigate today’s fast-paced crypto markets. Keep up with Snorter on X , Instagram , or join the presale on the Snorter website . The post Crypto Price Prediction Today 14 July – XRP, Pepe, Cardano appeared first on Cryptonews .",cryptonews,https://cryptonews.com/news/crypto-price-prediction-today-14-july-xrp-pepe-cardano/,"TRADING|ADA|XRP|MARKET|BTC","Price Analysis|Cardano|Pepe|XRP",cryptocompare
2025-07-14T23:01:44,"Cardano (ADA) Breaks Key Resistance, Analysts Consider Potential Rally Toward $1.20","Cardano (ADA) has broken through a critical resistance level, signaling potential for a significant rally as market momentum strengthens. Analysts highlight a possible surge toward $1.20 if ADA sustains its",coinotag,https://en.coinotag.com/cardano-ada-breaks-key-resistance-analysts-consider-potential-rally-toward-1-20/,"ADA|TRADING|BTC|FLOW|MARKET","News|ADA|BTC|FLOW",cryptocompare
