datetime,headline,summary,source,url,categories,tags,api_source
2025-07-14T22:50:01,"Bitcoin Accumulation Surge: Small Wallets Unleash Powerful Market Momentum","BitcoinWorld Bitcoin Accumulation Surge: Small Wallets Unleash Powerful Market Momentum Are you curious about the subtle shifts happening beneath the surface of the cryptocurrency market? Recent data from Glassnode, a leading on-chain analysis firm, reveals a fascinating development: smaller BTC wallets , those holding less than 1 Bitcoin, are once again leading the charge in Bitcoin accumulation . This comes after a brief period of selling, signaling a potential change in market sentiment and investor behavior. Understanding the Latest Trends in Bitcoin Accumulation The cryptocurrency market is a dynamic ecosystem, constantly influenced by the actions of various participants. While the headlines often focus on institutional movements or price volatility, the collective behavior of individual investors can often provide crucial insights. Glassnode’s latest report, shared on X, highlights a significant return to buying among the smallest BTC wallets . This segment, often dubbed ‘shrimps’ or ‘crabs’ in the crypto community, represents individual retail investors who are slowly but steadily adding to their Bitcoin holdings. For a month prior, these smaller wallets had shown a tendency to sell, perhaps taking profits or reacting to broader market uncertainties. Their return to accumulation suggests renewed confidence or a belief in Bitcoin’s long-term potential. This grassroots buying power, though individually small, can collectively form a substantial force, influencing overall supply dynamics. Let’s break down the observed behaviors across different wallet sizes, as reported by Glassnode: Wallets holding less than 1 BTC: These small investors are back in accumulation mode after a month of selling, indicating a renewed bullish sentiment from the retail sector. Wallets holding 1,000 to 10,000 BTC: Often referred to as ‘whales’ or ‘institutions’, these entities continue to demonstrate strong buying power. They are emerging as a major driving force, absorbing supply and potentially setting the stage for future price movements. Wallets holding more than 10,000 BTC: These ‘super whales’ are showing a tendency towards selling. This could be profit-taking, rebalancing portfolios, or a strategic move based on their vast market insights. Wallets holding 100 to 1,000 BTC: Interestingly, this mid-tier group is currently the most aggressive in selling. This might indicate a tactical divestment, perhaps anticipating a dip or rotating into other assets. What Does This On-Chain Analysis Really Tell Us? On-chain analysis involves examining data directly from a blockchain’s public ledger. Unlike traditional market analysis that relies on price charts and trading volumes, on-chain data provides a transparent view of actual transactions, wallet movements, and network activity. This unique insight allows us to understand the true behavior of market participants, rather than just their expressed sentiment. For instance, tracking Bitcoin accumulation patterns across different wallet cohorts gives us a clearer picture of who is buying and selling. When small BTC wallets are accumulating, it often signifies growing grassroots adoption and belief in Bitcoin’s long-term value. Conversely, large institutional buying (like the 1,000-10,000 BTC cohort) can indicate significant capital inflows and conviction from sophisticated investors. The beauty of on-chain analysis lies in its ability to reveal the underlying supply and demand dynamics. It helps us answer questions like: Are new users entering the market, or are existing holders just moving coins around? Is significant capital flowing into or out of the asset? What is the conviction level of different investor groups? Are long-term holders selling, or are short-term speculators dominating the market? This data is invaluable for anyone trying to navigate the often-opaque world of digital assets, offering a window into real-time market sentiment and strategic positioning. How Does Whale Activity Influence Crypto Market Trends ? The term ‘whale’ in the crypto world refers to individuals or entities holding a very large amount of a particular cryptocurrency. Their actions, often referred to as whale activity , can have a disproportionate impact on crypto market trends due to the sheer volume of assets they control. In the current scenario, we see a fascinating dichotomy: Mid-tier whales (1,000-10,000 BTC) are buying strongly: This cohort includes institutional players, large funds, and high-net-worth individuals. Their continued accumulation suggests a strong belief in Bitcoin’s future price appreciation. This consistent demand from significant players can act as a floor during pullbacks and fuel upward momentum. Super whales (over 10,000 BTC) are selling: While seemingly contradictory to the mid-tier whales, this could be a strategic move. Super whales often have access to deeper market insights and might be rebalancing portfolios, taking profits after significant runs, or even preparing for larger, more strategic entries later. Their selling might contribute to short-term price pressure, but it doesn’t necessarily indicate a bearish long-term outlook. It could simply be smart portfolio management. The interplay between these different categories of whale activity is crucial. When smaller investors (less than 1 BTC) and large institutions (1,000-10,000 BTC) are both accumulating, it creates a broad base of demand, from retail enthusiasm to institutional conviction. This broad-based buying can be a powerful indicator of a healthy, maturing market. However, the selling pressure from the largest and mid-tier whales (100-1,000 BTC and >10,000 BTC) introduces an element of caution, reminding us that even in bullish environments, significant profit-taking or rebalancing can occur. Understanding these distinct behaviors helps us appreciate the complexity of crypto market trends . It’s not just about price; it’s about the underlying flow of capital and the strategic decisions of diverse market participants. What Are the Implications for Future Crypto Market Trends ? The return of small BTC wallets to Bitcoin accumulation , coupled with sustained buying from mid-tier whales, paints a compelling picture for future crypto market trends . This widespread accumulation, from the smallest retail investor to significant institutional players, suggests a robust demand side for Bitcoin. Potential Benefits: Stronger Price Floors: Consistent buying from diverse groups can create stronger support levels for Bitcoin’s price, making significant downturns less likely. Increased Market Confidence: When both retail and institutional players are accumulating, it signals broader confidence in the asset, attracting more participants. Reduced Volatility (Long-Term): As more Bitcoin moves into long-term holding wallets, the circulating supply available for trading decreases, potentially leading to less volatile price swings over time. Decentralized Demand: Demand coming from a wide range of wallet sizes indicates a healthier, more decentralized market structure, less reliant on a few large players. Potential Challenges/Considerations: Whale Selling Pressure: The selling by super whales (>10,000 BTC) and the most aggressive selling from the 100-1,000 BTC cohort could introduce short-term selling pressure, potentially capping immediate upside. Market Liquidity: If too much Bitcoin is accumulated and held, it could reduce market liquidity, potentially leading to sharper price movements on smaller trades. Macroeconomic Factors: While on-chain data is powerful, it doesn’t operate in a vacuum. Broader macroeconomic conditions, regulatory changes, and global events can still significantly influence the market regardless of accumulation patterns. This dynamic interplay of different investor behaviors is what makes the crypto market so captivating. It’s a constant dance between supply and demand, long-term vision, and short-term opportunism. Actionable Insights for Navigating the Market So, what can you take away from this intricate web of on-chain analysis and whale activity ? Don’t Underestimate Retail: The return of small BTC wallets to accumulation is a powerful signal. It suggests a renewed grassroots interest and belief in Bitcoin, which historically has been a strong foundation for bull runs. Observe the Whales, But Understand Their Nuances: Not all whale activity is the same. While some large entities are selling, others are aggressively buying. This indicates different strategies and time horizons among major players. Don’t panic if you see some large sales; look at the broader picture of accumulation across different tiers. Long-Term View vs. Short-Term Volatility: The underlying Bitcoin accumulation trend, especially from small and mid-tier wallets, points towards a strong long-term outlook. However, expect continued volatility as large holders may still take profits or rebalance. Utilize On-Chain Tools: If you’re serious about understanding market dynamics, explore platforms that offer on-chain analysis . They provide invaluable data that goes beyond simple price charts. Diversify and Manage Risk: Even with positive accumulation trends, the crypto market remains volatile. Always ensure your portfolio is diversified and that you’re investing only what you can afford to lose. The current market landscape, characterized by robust Bitcoin accumulation from smaller wallets and significant institutional buying, suggests a healthy and growing underlying demand. While super whales selling might create temporary headwinds, the broader picture points towards a resilient asset gaining traction across various investor segments. Keep an eye on these trends, as they often precede significant movements in the market. To learn more about the latest Bitcoin accumulation trends, explore our article on key developments shaping Bitcoin’s price action and institutional adoption. This post Bitcoin Accumulation Surge: Small Wallets Unleash Powerful Market Momentum first appeared on BitcoinWorld and is written by Editorial Team",bitcoinworld,https://bitcoinworld.co.in/bitcoin-wallets-accumulation-surge/,"BTC|MARKET|TRADING|BUSINESS|BLOCKCHAIN","Crypto News|BITCOIN|Crypto|Market Analysis|On-chain|Wallets",cryptocompare
2025-07-14T22:48:04,"Coinbase Stock Hits Record High Alongside Bitcoin as Analysts Highlight 'Growth Runway'","Argus Research said in a new note that the expected passing of the GENIUS Act will likely act as an “impetus for growth” for Coinbase.",decrypt,https://decrypt.co/330112/coinbase-hits-record-high-bitcoin-analysts-highlight-growth,"EXCHANGE|BTC|BUSINESS|MARKET|RESEARCH","|Markets",cryptocompare
2025-07-14T22:40:05,"Bitcoin’s Astonishing Ascent: Why Profit-Taking at $123K Signals a Healthy Market","BitcoinWorld Bitcoin’s Astonishing Ascent: Why Profit-Taking at $123K Signals a Healthy Market The cryptocurrency world is abuzz with speculation as Bitcoin continues its remarkable journey, pushing boundaries and reaching new psychological milestones. Imagine a scenario where Bitcoin surges to an incredible $123,000 – a dream for many, but also a trigger for a natural market phenomenon: profit-taking . This isn’t a sign of weakness, but rather a healthy recalibration in the dynamic Bitcoin ecosystem, often leading to temporary dips before further upward movement. Let’s delve into what happens when such peaks are reached and how the market truly reacts. Understanding Bitcoin Profit-Taking at Key Levels When Bitcoin achieves significant price milestones, like the hypothetical $123,000 mark, it naturally triggers a wave of selling pressure. This phenomenon, known as profit-taking , occurs as investors who bought at lower prices decide to realize their gains. According to insights from analysts like CryptoQuant’s Tarekonchain, an increase in exchange inflows—meaning more Bitcoin is moved onto exchanges, typically for selling—is a clear signal of this activity. It’s a fundamental aspect of any mature financial market. For Bitcoin, these moments are crucial for several reasons: Liquidation of Gains: Investors, especially short-term traders, lock in profits, ensuring capital rotation. Market Rebalancing: It allows new capital to enter at slightly lower prices, fostering broader participation. Testing Support Levels: Brief corrections help identify strong support levels for future rallies, building market confidence. While some might view increased selling as bearish, it’s often a sign of a liquid and active market. It’s the market’s way of breathing out before taking a deeper breath, preparing for the next leg up. Navigating the Crypto Market: Short-Term Swings vs. Long-Term Conviction The broader crypto market is a fascinating interplay of various investor types, each with different objectives. On one hand, you have short-term traders who thrive on volatility, aiming to capitalize on rapid price swings. Their activities often contribute to the immediate selling pressure observed during profit-taking events. On the other hand, a significant portion of the market is composed of long-term holders, often referred to as ‘HODLers’. What’s remarkable is the steadfastness of these long-term holders. Despite the temptation to sell at peak prices, their conviction in Bitcoin’s future potential remains unshaken. Data consistently shows that these strong hands tend to hold onto their assets, viewing any short-term dips as minor fluctuations in a larger, upward trajectory. This unwavering commitment provides a crucial bedrock of stability, preventing profit-taking from spiraling into a prolonged downturn. It’s this underlying strength that often ensures overall bullish momentum persists even after significant price milestones. The Unwavering Influence of Bitcoin ETF Inflows A relatively new, yet profoundly impactful, dynamic in the Bitcoin landscape is the consistent influx of capital through spot Exchange-Traded Funds (ETFs). These ETF inflows represent a gateway for institutional investors and traditional finance players to gain exposure to Bitcoin without directly holding the asset. Their participation has fundamentally altered market dynamics, providing a steady stream of demand that often counteracts selling pressure from profit-taking. Consider the implications: Institutional Validation: ETFs lend credibility and legitimacy to Bitcoin as an asset class, opening doors for broader adoption. Sustained Demand: Unlike retail investors who might sell off quickly, institutional buying through ETFs tends to be more consistent and less reactive to minor price movements. Liquidity and Depth: Increased participation from large entities enhances market liquidity and depth, making it more resilient to sudden shocks and improving price discovery. Even as individual investors take profits, the continuous appetite from institutional funds via ETFs acts as a powerful counterbalance, absorbing much of the sell-side pressure and reinforcing the bullish narrative for Bitcoin. Is a Bitcoin Market Correction Inevitable? And How to Prepare While the long-term outlook for Bitcoin remains robust, the question of whether a market correction is inevitable after reaching a peak like $123,000 is a valid one. Historically, corrections are a natural and healthy part of any bull market. They allow the market to cool down, shake out over-leveraged positions, and consolidate before the next leg up. A ‘brief correction’ as mentioned by analysts is not a crash, but rather a necessary recalibration. How can investors navigate these periods? Dollar-Cost Averaging (DCA): Instead of trying to time the market, consistently invest a fixed amount over time. This strategy helps mitigate the impact of volatility and average out your purchase price. Risk Management: Never invest more than you can afford to lose. Set clear profit targets and stop-loss levels to protect your capital. Focus on Fundamentals: Remember Bitcoin’s core value proposition – decentralization, scarcity, and growing adoption. These underlying strengths are what drive long-term growth, not short-term price fluctuations. Stay Informed: Keep an eye on on-chain metrics, institutional flows, and macroeconomic factors that can influence market sentiment. A healthy market corrects; it doesn’t just go up in a straight line. These dips can be opportunities for those with a long-term vision and a disciplined investment approach. Conclusion The journey of Bitcoin to monumental figures like $123,000 is undoubtedly exciting, and the subsequent profit-taking is a natural, even beneficial, market response. Far from signaling a reversal, these temporary pullbacks, supported by robust ETF inflows and the unwavering conviction of long-term holders, actually reinforce the underlying strength of the crypto market . Understanding these dynamics is key to navigating the volatility and appreciating the persistent bullish momentum. While a brief market correction may occur, the foundational elements for Bitcoin’s continued growth remain firmly in place, paving the way for future milestones. To learn more about the latest Bitcoin trends, explore our article on key developments shaping Bitcoin’s institutional adoption and future price action. This post Bitcoin’s Astonishing Ascent: Why Profit-Taking at $123K Signals a Healthy Market first appeared on BitcoinWorld and is written by Editorial Team",bitcoinworld,https://bitcoinworld.co.in/bitcoin-profit-taking-market/,"MARKET|BTC|TRADING|BUSINESS|EXCHANGE","Crypto News|BITCOIN|CRYPTOCURRENCY|Investment|Market Analysis|trading.",cryptocompare
2025-07-14T22:38:00,"US Regulators May Allow Banks to Custody Bitcoin Under Existing Compliance Frameworks","US federal banking regulators have officially authorized banks to provide custody services for Bitcoin and other crypto-assets, marking a pivotal step in integrating digital assets within traditional finance. This joint",coinotag,https://en.coinotag.com/us-regulators-may-allow-banks-to-custody-bitcoin-under-existing-compliance-frameworks/,"BTC","News|BTC|Core",cryptocompare
2025-07-14T22:32:09,"Odell Beckham Jr. Says He’s Still Smiling After Taking His $4.25M Salary in Bitcoin in 2021","After revealing back in 2021 that he’d take his entire salary in bitcoin, Odell Beckham Jr. is feeling pretty good about that choice in 2025. On Monday, as BTC punched through to a fresh all-time high, Beckham took a victory lap, saying it was “safe to say we still happy with our decision.” OBJ’s Bitcoin",bitcoin.com,https://news.bitcoin.com/odell-beckham-jr-says-hes-still-smiling-after-taking-his-4-25m-salary-in-bitcoin-in-2021/,"BTC","Crypto News|Bitcoin (BTC)|Cryptocurrency",cryptocompare
2025-07-14T22:31:55,"US Agencies Highlight Potential Liability Risks for Banks Custodying Bitcoin Amid Regulatory Shifts","US federal agencies have issued a joint document outlining the risks banks face when custodying crypto assets, emphasizing compliance and liability concerns. The guidance highlights the need for banks to",coinotag,https://en.coinotag.com/us-agencies-highlight-potential-liability-risks-for-banks-custodying-bitcoin-amid-regulatory-shifts/,"BTC|USDC|XRP","News|Ripple|BTC|CYBER|USDC|XRP",cryptocompare
2025-07-14T22:30:20,"Tron Becomes USDT Powerhouse – 2025 Minting Already 38% Above Previous Records","Tron has been in a sustained uptrend since March and continues to gain strength as the broader crypto market enters a bullish phase. Riding the momentum of renewed investor confidence and institutional interest, Tron’s growth stands out, particularly due to its dominant role in stablecoin infrastructure. One of the most compelling indicators of this rise is the explosive growth in USDT supply on the Tron network. As of now, the total amount of USDT issued on the network has surpassed $80 billion, marking a new milestone for the blockchain. What makes this figure even more impressive is the pace at which it’s growing. In just the first half of 2025, over $22 billion worth of USDT (TRC20) has already been minted—far exceeding the full-year totals for both 2023 and 2024, which each saw around $16 billion. This dramatic increase highlights Tron’s efficiency and appeal as a low-cost, high-speed settlement layer for stablecoin transactions. The data points to rising demand from both retail and institutional users seeking scalable, cost-effective blockchain infrastructure. As USDT activity intensifies, Tron’s role as a core layer of crypto’s financial system appears more secure than ever, and its price trend is following suit. Institutional-Scale USDT Mints Signal Tron’s Strength According to CryptoQuant data shared by top analyst Darkfost, 2025 has marked a major turning point for Tron’s role in the stablecoin economy. One particularly striking development is the emergence of three separate $2 billion USDT mints on the network this year alone—a pattern entirely absent in 2024. These high-volume issuances are typically associated with large-scale institutional demand or major infrastructural deployments, highlighting the growing trust in Tron as a foundational layer for stablecoin activity. Historically, 2021 remains the record year for USDT issuance on the network, with more than $46 billion minted throughout the year. However, 2025 is already closing in on that benchmark, with over $22 billion minted just by mid-year. If this pace continues, Tron is on track to surpass its all-time high, signaling a level of adoption and transactional utility not seen before. This sustained momentum reveals more than just transactional volume—it showcases a structural evolution in how stablecoins are used and where. Tron’s low fees, high throughput, and seamless USDT integrations make it an ideal platform for both retail users and large players handling billions in stablecoins. The explosive growth in 2025 underscores a deeper industry trend: stablecoins are cementing themselves as core components of crypto’s financial architecture, and Tron is quickly becoming the preferred settlement layer. With infrastructure, scale, and demand aligning, Tron’s position at the heart of the stablecoin revolution appears stronger than ever, and the continued presence of institutional-scale mints confirms that confidence is only accelerating. TRX Holds Above $0.30 After Breakout The 12-hour chart for TRX/USDT shows a clear bullish structure, with Tron holding firmly above the $0.30 level after a strong breakout in early July. This marks a continuation of the uptrend that began in March, with the price making higher lows and higher highs over the past four months. Currently trading around $0.3026, TRX remains well above its key moving averages—50 SMA ($0.2821), 100 SMA ($0.2787), and 200 SMA ($0.2658)—all of which are sloping upward. This alignment reflects sustained bullish momentum and confirms that buyers are firmly in control. The recent surge in volume alongside the price breakout adds further conviction to the rally. The breakout above $0.30 is particularly significant as it clears a psychological resistance level that had capped TRX since late 2024. Holding this zone as support in the coming sessions would strengthen the case for continuation toward higher targets in the $0.32–$0.34 range. Featured image from Dall-E, chart from TradingView",bitcoinist,https://bitcoinist.com/tron-becomes-usdt-powerhouse-2025-minting-already-38-above-previous-records/,"ETH|MARKET|BTC|FIAT|ADA|TRADING|DOGE|REGULATION|ALTCOIN|BUSINESS|BLOCKCHAIN|ZRX|TOKEN SALE|XRP|TREASURY|SPONSORED|SOL|EXCHANGE|BNB|USDT|ALGO|BCH|PYUSD|TRX","Altcoin News|tron|TRON (TRX)|Tron news|Tron USDT|Tron USDT minting|Trong price|trx|TRXUSDT",cryptocompare
2025-07-14T22:29:26,"Cryptocurrency Market Faces Short-Term Oscillations","Bitcoin's rally has not reached its peak, despite recent market activity. Trading volumes increased but remain below previous market surges. Continue Reading: Cryptocurrency Market Faces Short-Term Oscillations The post Cryptocurrency Market Faces Short-Term Oscillations appeared first on COINTURK NEWS .",cointurken,https://en.coin-turk.com/cryptocurrency-market-faces-short-term-oscillations/,"MARKET|TRADING|BTC","Cryptocurrency News",cryptocompare
2025-07-14T22:13:50,"Satoshi-Era Bitcoin Whale Moves Another $2.42 Billion, What's Happening?","This whale is actively moving billions in Bitcoin for the second time after 14 years of dormancy",utoday,https://u.today/satoshi-era-bitcoin-whale-moves-another-242-billion-whats-happening,"BTC","Bitcoin|BTC",cryptocompare
