datetime,headline,summary,source,url,categories,tags,api_source
2025-07-14T20:10:08,"Bitcoin Holdings: Genius Group’s Strategic Move to 180 BTC Unlocks Future Growth","BitcoinWorld Bitcoin Holdings: Genius Group’s Strategic Move to 180 BTC Unlocks Future Growth In a bold move that continues to turn heads in both the education and cryptocurrency sectors, AI-driven education firm Genius Group has significantly expanded its Bitcoin holdings . This isn’t just another transaction; it’s a strategic declaration from a company known for its forward-thinking approach. As the digital asset landscape evolves, companies like Genius Group are showcasing a profound shift in corporate treasury management, signaling a new era of financial foresight. Why is Genius Group Bitcoin Investment Growing? Genius Group, an innovative force in the AI-driven education space, recently announced an increase in its Bitcoin (BTC) reserves. According to reports, including a notable update from @btcNLNico on X, the company acquired an additional 32 BTC, pushing its total holdings to an impressive 180 BTC. This latest acquisition is not an isolated event but rather a consistent step towards a much larger ambition: Genius Group has openly stated its long-term goal to accumulate up to 1,000 BTC. This commitment raises a compelling question: why is an education technology company, traditionally focused on learning and development, making such a substantial bet on a volatile asset like Bitcoin? The answer lies in their vision for the future. Genius Group positions itself at the intersection of innovation and practicality, and for them, Bitcoin represents more than just a speculative asset. It’s viewed as a strategic store of value, a hedge against inflation, and a testament to their embrace of cutting-edge technologies. Their investment strategy aligns with their core mission of preparing individuals for a rapidly changing world, where digital assets are becoming increasingly relevant. Decoding Genius Group’s Expanding Bitcoin Holdings The progression of Genius Group’s Bitcoin holdings illustrates a deliberate and calculated approach to treasury diversification. Starting with an initial foray into the crypto market, the company has consistently added to its reserves, demonstrating conviction in Bitcoin’s long-term value proposition. The recent increase to 180 BTC is a significant milestone, putting them among a growing list of public companies holding substantial amounts of the leading cryptocurrency. Consider the scale of their ambition: aiming for 1,000 BTC. At current market valuations, this represents a multi-million dollar commitment. This isn’t merely a speculative play; it suggests a belief in Bitcoin’s role as a foundational digital asset for future economies. For Genius Group, these holdings could serve multiple purposes: Long-term Value Preservation: Protecting corporate capital from inflationary pressures. Innovation Alignment: Reflecting their brand as a forward-thinking, tech-savvy entity. Balance Sheet Strength: Potentially enhancing their financial position as Bitcoin appreciates over time. This systematic accumulation speaks volumes about the company’s confidence in Bitcoin’s trajectory and its integration into the global financial system. The Rising Tide of Institutional Bitcoin Adoption : Is This the New Norm? Genius Group’s increasing Bitcoin holdings are part of a broader, undeniable trend: the surge in institutional Bitcoin adoption . What was once considered a niche, speculative asset is now firmly on the radar of corporate treasuries, hedge funds, and even sovereign wealth funds. Companies like MicroStrategy pioneered this movement, demonstrating that a significant portion of corporate reserves could be converted into BTC. Tesla, Block (formerly Square), and various investment firms have followed suit, each for their own strategic reasons. Several factors are driving this wave of adoption: Inflationary Concerns: With global quantitative easing and rising inflation, traditional fiat currencies are losing purchasing power. Bitcoin, with its capped supply, is increasingly seen as a robust inflation hedge. Digital Gold Narrative: Bitcoin’s characteristics—decentralization, scarcity, and immutability—have solidified its reputation as ‘digital gold,’ a safe haven asset in an uncertain economic climate. Regulatory Clarity (Emerging): While challenges remain, increasing regulatory frameworks in major economies are providing more clarity and confidence for institutional investors. Technological Advancement: The maturing infrastructure around Bitcoin, including improved custody solutions and institutional-grade trading platforms, makes it easier for companies to acquire and manage BTC. The embrace of Bitcoin by entities like Genius Group suggests that what was once a fringe investment is steadily becoming a mainstream component of diversified corporate financial strategies. Crafting a Winning Corporate BTC Strategy : Lessons from Genius Group For companies considering a similar path, Genius Group’s approach offers valuable insights into developing a robust corporate BTC strategy . It’s not just about buying Bitcoin; it’s about integrating it thoughtfully into the company’s financial framework and long-term vision. Here are key considerations: Clear Rationale: Define why Bitcoin fits your company’s objectives. Is it a treasury reserve asset, an innovation play, or part of a broader digital transformation? Phased Accumulation: Instead of a single large purchase, a phased accumulation strategy can help mitigate volatility risks and allow for dollar-cost averaging. Genius Group’s incremental purchases demonstrate this. Robust Custody Solutions: Secure storage is paramount. Companies must choose between self-custody (requiring significant internal expertise) or third-party institutional custodians. Transparency and Communication: Publicly announcing holdings, as Genius Group has done, builds trust and clarity for shareholders and the market. Long-Term Horizon: Bitcoin’s volatility means a short-term trading strategy can be risky. A long-term holding period, often spanning years, is typically advised for corporate treasuries. Genius Group’s consistent execution of its stated goal to reach 1,000 BTC serves as a blueprint for strategic, patient, and conviction-driven corporate investment in digital assets. Beyond the Classroom: AI Education Crypto Investment The intersection of AI education crypto investment might seem unconventional at first glance, but for Genius Group, it makes perfect sense. As an AI-driven education firm, their core business is about preparing individuals for the future of work and life. This includes understanding emerging technologies, digital economies, and new financial paradigms. By investing in Bitcoin, Genius Group isn’t just managing its treasury; it’s embodying the very principles it teaches: Innovation and Adaptability: Demonstrating a willingness to embrace new technologies and adapt to evolving financial landscapes. Future-Proofing: Investing in assets that are poised to play a significant role in the digital future. Practical Application of Knowledge: Showing how theoretical understanding of digital assets translates into real-world strategic financial decisions. This synergy suggests a deeper philosophy at play. An AI education company investing in crypto signifies a belief that digital assets are not just for traders or tech enthusiasts, but are becoming fundamental to global commerce and personal finance, requiring a new level of understanding and strategic engagement. A Genius Move for the Future Genius Group’s continued expansion of its Bitcoin holdings to 180 BTC, with an ambitious target of 1,000 BTC, marks a significant milestone in the ongoing narrative of corporate Bitcoin adoption. This strategic move by an AI-driven education firm underscores a growing recognition of Bitcoin’s potential as a long-term store of value and a vital component of a forward-looking treasury strategy. It reflects a profound understanding of the evolving digital economy and positions Genius Group not just as an educational leader, but also as a pioneer in innovative corporate finance. As more institutions follow suit, the path laid by companies like Genius Group will undoubtedly contribute to Bitcoin’s continued integration into the global financial mainstream. To learn more about the latest Bitcoin trends, explore our article on key developments shaping Bitcoin institutional adoption. This post Bitcoin Holdings: Genius Group’s Strategic Move to 180 BTC Unlocks Future Growth first appeared on BitcoinWorld and is written by Editorial Team",bitcoinworld,https://bitcoinworld.co.in/genius-group-bitcoin-strategy/,"BTC|REGULATION|TREASURY|FIAT|BUSINESS","Crypto News|BITCOIN|corporate investment|CRYPTOCURRENCY|Digital Assets|genius group",cryptocompare
2025-07-14T20:03:28,"U.S. Crypto Regulations This Week: Banks Given Green Light to Custody Crypto Ahead of Key Legislation Voting","The post U.S. Crypto Regulations This Week: Banks Given Green Light to Custody Crypto Ahead of Key Legislation Voting appeared first on Coinpedia Fintech News The United States lawmakers are preparing for important votings on several crypto-related bills this week. Later this week, the House of Representatives will vote on the market structure bill in addition to the GENIUS Act. If the House passes the GENIUS Act without any changes as approved by the Senate, the bill will be forwarded to President Donald Trump to be signed into law. The House will also vote on bills that address the crypto market structure and CBDC, which will then be returned to the Senate for the final vote. Banks Can Now Custody Customers’ Crypto Assets On Monday, the Federal bank regulatory agencies – the Federal Deposit Insurance Corporation, the Federal Reserve Board, and the Office of the Comptroller of the Currency – issued a joint statement on crypto-asset safekeeping by banking organizations. According to the joint statement, banks can now offer custody services to their customers for crypto assets such as Bitcoin. The agencies highlighted that banks must comply with existing banking regulations while dealing with customers’ crypto assets. “Banking organizations may provide safekeeping for crypto-assets in a fiduciary or a non-fiduciary capacity. Banking organizations that provide crypto-asset safekeeping in a fiduciary capacity must comply with 12 CFR 9 or 150, as applicable, state laws and regulations, and any other applicable legal provisions, such as the instrument that created the fiduciary relationship,” the announcement noted . Market Impact The clear crypto legislations and regulations amid the ongoing bullish sentiment will play a crucial role in onboarding more investors. Already, the Bitcoin and wider crypto market have recorded significant bullish sentiment fueled by the notable proliferation of institutional investors. According to TD Cowen, the investment banking and financial services arm of TD Securities, the Bitcoin price is well-positioned to reach $155,000 by December 2025 and a base case of $128k. However, the bank issued a downside target of about $55k, which could happen if BTC price consistently closes below the established support/resistance range between $109k and $111,872.",coinpedia,https://coinpedia.org/news/u-s-crypto-regulations-this-week-banks-given-green-light-to-custody-crypto-ahead-of-key-legislation-voting/,"REGULATION|BTC|MARKET|TRADING|FIAT","News|Bitcoin|Crypto news|Crypto Regulations",cryptocompare
2025-07-14T20:01:23,"Dave Portnoy says ‘just shut up and buy Bitcoin’ as he reveals $5 million bet","Barstool Sports founder Dave Portnoy has offered a reflection on his investing approach, admitting that, for all the debate and analysis, simply buying Bitcoin ( BTC ) might have been the smarter move all along. Portnoy shared that he talks with his financial advisor daily about stocks, only to confess they may have been overthinking it. All the back-and-forth, he suggested, might have distracted them from the obvious Bitcoin play, he said in an X post on July 14. His remarks hinted at a sense of frustration with traditional investing strategies that can leave investors second-guessing while the crypto market surges ahead. The investor’s comments follow Bitcoin’s strong run, which has seen the cryptocurrency climb from under $100,000 to a new record high above $123,000. As of press time, Bitcoin was in a consolidation mode, trading at $119,889, up 0.6% in the last 24 hours. Bitcoin seven-day price chart. Source: Finbold Describing the market as “rip city,” Portnoy noted that the rally has left many traders watching from the sidelines. Even though he holds over $5 million in crypto on Kraken, he admitted it still feels like it might not be enough. “I talk to my finance guy every day about stocks. We should’ve just shut up and bought Bitcoin. Forget everything else. If you are going to trade crypto, you might as well do it because it’s just rip city,” he said. Portnoy’s investment journey Though now known for his enthusiasm for crypto, Portnoy’s investing journey began with stocks in 2019. He became famous for his unpredictable style, once picking Raytheon Technologies (NYSE: RTX) by pulling letters from a Scrabble bag for a $200,000 bet. He has also made big wagers on companies like Tesla (NASDAQ: TSLA ), despite its recent challenges . Notably, Portnoy’s relationship with Bitcoin has been rocky, having often bought at the wrong time; however, he has continued to experiment with other assets, such as XRP . His crypto adventures haven’t been without controversy. Back in February, Portnoy lost about $170,000 worth of SOL when he mistakenly bought an illiquid LIBRA token, thinking it was linked to Argentina’s President Javier Milei’s meme coin. Featured image via Shutterstock The post Dave Portnoy says ‘just shut up and buy Bitcoin’ as he reveals $5 million bet appeared first on Finbold .",finbold,https://finbold.com/dave-portnoy-says-just-shut-up-and-buy-bitcoin-as-he-reveals-5-million-bet/,"BTC|MARKET|TRADING|BUSINESS|EXCHANGE","Cryptocurrency news|Bitcoin|cryptocurrency|Dave Portnoy|investing",cryptocompare
2025-07-14T20:00:26,"$122,000 And Climbing: Bitcoin Sets New Record As ETFs Drive Demand","Bitcoin rose above the $122,000 mark on Monday. According to data from CoinGecko, prices briefly topped that level before pulling back slightly. The jump comes in the face of strong inflows into spot bitcoin ETFs and growing institutional interest. Traders watched as the largest cryptocurrency by market cap set yet another record. Related Reading: Kiyosaki Awaits The Next Bitcoin Sale: ‘My Fellow Pigs And I Are Feasting’ Bitcoin ETFs Explode Based on reports, Bitcoin ETFs saw $1.20 billion flow in on Thursday alone. That was the biggest single‑day haul of 2025. Last week, QCP Capital said institutional flows into spot BTC ETFs topped $2 billion. These numbers suggest big players are betting on more upside. Open interest on futures now exceeds $43 billion. Funding rates on perpetual contracts are climbing too, showing crowded long positions. US President Donald Trump has voiced his support for clearer crypto rules. And on Monday, the US House of Representatives began debating a package of crypto bills aimed at giving firms more certainty. Companies have been adding bitcoin to their treasuries, with some corporate holdings rising by double‑digit percentages this year. According to BTSE COO Jeff Mei, longer‑term institutional buyers are driving prices higher. He forecasted that bitcoin could hit $125K “in the next month or two.” Mei also warned that trade disputes with the EU, Mexico and other partners might cause dips, but said buyers are holding firm. Rising Demand From Big Players Trading desks and crypto exchanges say they have seen fresh corporate orders. Some firms are buying blocks of 100 BTC or more at a time. Others are using dollar‑cost averaging to ease in gradually. Even smaller funds are boosting allocations, pushing aggregate demand higher. With every new all‑time high, more headlines appear and more investors pay attention. That creates a feedback loop: rising prices attract inflows, which lift prices further. It the entire price history of Bitcoin was a fruit, what fruit would you say it was? pic.twitter.com/FPEU1bUvnf — Peter Brandt (@PeterLBrandt) July 13, 2025 Technical Warning Signs Emerge Meanwhile, veteran trader Peter Brandt caught attention over the weekend with his “banana” chart. He sketched bitcoin’s entire price history as a curved arc. The top of that arc sits near current levels, hinting at a ceiling where past rallies ended in sharp drops. Parabolic moves have a habit of reversing quickly. In just seven days, Bitcoin climbed from about $108K to over $122K—roughly a 14% rise. High funding rates and record open interest signal froth, and that often precedes pullbacks. Related Reading: XRP To Hit $4 This Week? This Crypto Expert Thinks So Watch For Pullbacks And Breakouts Traders now face two scenarios. If institutional buyers keep adding, new highs may follow and $125K could fall within reach. But if ETF purchases slow or leveraged longs get squeezed, a 10–20% correction would not be surprising. Featured image from Vecteezy, chart from TradingView",newsbtc,https://www.newsbtc.com/news/122000-and-climbing-bitcoin-sets-new-record-as-etfs-drive-demand/,"BTC|MARKET|TRADING|BUSINESS|REGULATION","Cryptocurrency Market News|bitcoin|btc|btcusd|crypto|etf|Trump",cryptocompare
2025-07-14T22:25:29,"US Federal agencies outline key risks for banks eyeing crypto custody","One risk facing banks that custody crypto is the potential for liability if crypto assets are lost, according to three US financial agencies.",Cointelegraph,https://cointelegraph.com/news/fdic-agencies-crypto-custodial-risks-banks?utm_source=rss_feed&utm_medium=rss&utm_campaign=rss_partner_inbound,"","",finnhub
2025-07-14T21:52:20,"Congress opens crypto bill debate with claims of ‘GOP giveaway’ to industry","Discussions in the House Committee on Rules opened with crypto bills, but quickly shifted to the Department of Defense Appropriations Act.",Cointelegraph,https://cointelegraph.com/news/crypto-bill-debate-congress-regulations?utm_source=rss_feed&utm_medium=rss&utm_campaign=rss_partner_inbound,"","",finnhub
2025-07-14T20:52:12,"Solana catches up to competitors as tokenized assets soar 140% in 2025","Solana ranks fourth among blockchains by tokenized asset market share, trailing Ethereum, ZKSync Era, and narrowly behind Aptos.",Cointelegraph,https://cointelegraph.com/news/solana-tokenized-assets-soar-2025?utm_source=rss_feed&utm_medium=rss&utm_campaign=rss_partner_inbound,"","",finnhub
2025-07-14T20:40:00,"Bitcoin hits new highs, gains stability and scale in its institutional era: Will it last?","From volatile outsider to financial base layer, Bitcoin is entering a new era—driven not by retail hype, but by the long-term logic of professional capital.",Cointelegraph,https://cointelegraph.com/news/bitcoin-hits-new-highs-gains-stability-and-scale-in-its-institutional-era-will-it-last?utm_source=rss_feed&utm_medium=rss&utm_campaign=rss_partner_inbound,"","",finnhub
2025-07-14T20:16:11,"Coinbase seeks public records from Oregon gov’t on crypto ‘flip-flop’","Known by many in the industry for filing records requests with the US government over crypto policies, Coinbase has filed a lawsuit against Oregon state officials.",Cointelegraph,https://cointelegraph.com/news/coinbase-public-records-oregon-governor-lawsuit?utm_source=rss_feed&utm_medium=rss&utm_campaign=rss_partner_inbound,"","",finnhub
2025-07-14T19:39:25,"Bitcoin charts, market cycle history hint at 15% short-term push to $138K","Bitcoin looks poised for an extended rally to $138,000 according to market cycle history and the current weekly trend.",Cointelegraph,https://cointelegraph.com/news/bitcoin-charts-market-cycle-history-hint-at-15percent-short-term-push-to-dollar138k?utm_source=rss_feed&utm_medium=rss&utm_campaign=rss_partner_inbound,"","",finnhub
2025-07-14T19:32:09,"Kazakhstan wealth fund, gold, FX reserves to be invested in crypto — Report","Kazakhstan’s central bank is drawing on lessons from Norway, the US and Middle East in developing its crypto strategy.",Cointelegraph,https://cointelegraph.com/news/kazakhstan-crypto-reserve-strategy-norway-us-model?utm_source=rss_feed&utm_medium=rss&utm_campaign=rss_partner_inbound,"","",finnhub
2025-07-14T18:06:45,"US Crypto Week kicks off with &#039;Dictator&#039; stablecoin amendment on the table","The House of Representatives is set to vote on three crypto-related pieces of legislation before Congress goes on recess.",Cointelegraph,https://cointelegraph.com/news/genius-act-stablecoins-amendments-crypto-bills?utm_source=rss_feed&utm_medium=rss&utm_campaign=rss_partner_inbound,"","",finnhub
2025-07-14T18:00:00,"Redefining global trade infrastructure: TradeOS joins Cointelegraph Accelerator","Global commerce stack TradeOS becomes the latest participant of Cointelegraph Accelerator.",Cointelegraph,https://cointelegraph.com/news/redefining-global-trade-infrastructure-tradeos-joins-cointelegraph-accelerator?utm_source=rss_feed&utm_medium=rss&utm_campaign=rss_partner_inbound,"","",finnhub
2025-07-14T17:36:01,"Price predictions 7/14: SPX, DXY, BTC, ETH, XRP, BNB, SOL, DOGE, ADA, HYPE","Bitcoin holds above $120,000 as corporate crypto treasury building and robust spot BTC ETF buying continue to support the new price range.",Cointelegraph,https://cointelegraph.com/news/price-predictions-7-14-spx-dxy-btc-eth-xrp-bnb-sol-doge-ada-hype?utm_source=rss_feed&utm_medium=rss&utm_campaign=rss_partner_inbound,"","",finnhub
2025-07-14T17:16:39,"OKX joins Paxos’ USDG network as stablecoin push intensifies","Launched in November 2024, the USDG stablecoin has a total circulating supply of around $356 million.",Cointelegraph,https://cointelegraph.com/news/okx-joins-paxos-usdg-network-stablecoin?utm_source=rss_feed&utm_medium=rss&utm_campaign=rss_partner_inbound,"","",finnhub
2025-07-14T16:30:56,"Crypto market cap hits $3.8T all-time high, may soon surpass UK’s GDP","If the crypto market were a country, it would be the seventh-biggest in GDP terms behind the United States, China, Germany, Japan, India and the United Kingdom.",Cointelegraph,https://cointelegraph.com/news/crypto-market-cap-hits-3-8t-all-time-high-may-soon-surpass-uk-gdp?utm_source=rss_feed&utm_medium=rss&utm_campaign=rss_partner_inbound,"","",finnhub
2025-07-14T16:19:56,"METABORA Partners with LINE NEXT to Distribute Web3 Games via Mini Dapp","METABORA becomes core partner in web3 game development for LINE NEXT’s Dapp Portal BORA Utility to Expand through in-game payments and gas abstraction Implementation SEONGNAM, South Korea, July 14, 2025 /PRNewswire/ — METABORA (Co-CEOs Lim Young-Jun and Choi Se-hoon), a global casual game developer and blockchain project operator, today announced a strategic partnership with LINE NEXT … Continue reading ""METABORA Partners with LINE NEXT to Distribute Web3 Games via Mini Dapp""",Cryptocurrency News,https://cryptocurrencynews.com/crypto/metabora-partners-with-line-next-to-distribute-web3-games-via-mini-dapp/,"","",finnhub
2025-07-14T15:10:00,"How one Nasdaq firm raised $51.5M in 72 Hours, just to buy Bitcoin","KindlyMD raised $51.5 million in just 72 hours to fuel its transformation into a Bitcoin-first public company.",Cointelegraph,https://cointelegraph.com/explained/how-one-nasdaq-firm-raised-515m-in-72-hours-just-to-buy-bitcoin?utm_source=rss_feed&utm_medium=rss&utm_campaign=rss_partner_inbound,"","",finnhub
2025-07-14T15:05:28,"&#039;Don&#039;t get trapped!&#039; Bitcoin price analysis sees dip with $118.8K in focus","Bitcoin is overdue a support retest, and order-book liquidity points to a trip below $119,000 next — will the market punish late buyers?",Cointelegraph,https://cointelegraph.com/news/don-t-get-trapped-bitcoin-price-analysis-sees-dip-118-8k-in-focus?utm_source=rss_feed&utm_medium=rss&utm_campaign=rss_partner_inbound,"","",finnhub
2025-07-14T15:00:00,"Money never sleeps, and Wall Street is waking up","Wall Street 3.0 replaces legacy systems and gatekeepers with tokenized equity, global inclusion and real-time trading, ushering in a new era of financial democratization and efficiency.",Cointelegraph,https://cointelegraph.com/news/wall-street-3-0?utm_source=rss_feed&utm_medium=rss&utm_campaign=rss_partner_inbound,"","",finnhub
2025-07-14T14:47:08,"Trump memecoin made $172M for crypto exchanges — Report","Crypto exchanges listed the TRUMP memecoin four days after its launch on average, compared to 129 days for other major memecoins, Reuters found.",Cointelegraph,https://cointelegraph.com/news/crypto-exchanges-172m-trump-memecoin-trading-fees?utm_source=rss_feed&utm_medium=rss&utm_campaign=rss_partner_inbound,"","",finnhub
2025-07-14T14:27:32,"It&#039;s Crypto Week: These are the key dates to watch","US House leaders have designated this week as “crypto week,” during which lawmakers will vote on three major digital asset bills. Here's what to expect.",Cointelegraph,https://cointelegraph.com/news/crypto-week-key-dates-genius-clarity?utm_source=rss_feed&utm_medium=rss&utm_campaign=rss_partner_inbound,"","",finnhub
2025-07-14T14:15:19,"Why crypto millionaires are moving to the UAE (these 5 reasons explain everything)","The UAE is attracting a global wave of crypto millionaires with zero-tax profits, regulatory clarity and elite residency perks.",Cointelegraph,https://cointelegraph.com/news/why-crypto-millionaires-are-moving-to-the-uae?utm_source=rss_feed&utm_medium=rss&utm_campaign=rss_partner_inbound,"","",finnhub
