datetime,headline,summary,source,url,categories,tags,api_source
2025-06-23T11:56:07,"Why is XRP Price Dropping?","The post Why is XRP Price Dropping? appeared first on Coinpedia Fintech News The XRP price has dropped below $ 2 for the first time in over 12 weeks. In the last 24 hours alone, XRP slipped by 2% to $1.99, sparking concerns among investors and XRP enthusiasts. This 2.18% decline yesterday adds to a 7.93% drop since June 19, when XRP was priced at $2.17. At one point, XRP even touched $1.90, raising fears of a deeper correction. But experts suggest the problem isn’t with XRP itself. Why Did XRP Drop This Week? Analysts believe the XRP price fall isn’t about weak fundamentals but rather a result of broader market-wide pressure. According to Versan Aljarrah , co-founder of Black Swan Capitalist, the recent drop reflects overall market volatility, not a failure in XRP’s utility or use case. “XRP is simply following broader market sentiment,” he explained. Geopolitical Tensions Rock the Crypto Market The global crypto market is currently bearish . Over the last 24 hours, it has dropped by 2.6% , affecting nearly all major assets. Here’s a quick snapshot of this week’s top losers: Bitcoin: -4.9% Ethereum: -14% XRP: -8.3% Solana: -14.7% Dogecoin: -14% Cardano: -15.7% Sui & BCH: -20.3% each The Israel-Iran conflict is believed to be the main trigger. The Israel-Iran Conflict and Its Ripple Effects On June 22, the U.S. bombed three key Iranian nuclear sites, marking the most aggressive Western military action against Iran since 1979. In retaliation, Iran launched missiles at Israel and threatened U.S. bases in the Middle East. Iran’s parliament has also voted to shut down the Strait of Hormuz, a critical oil passage. Oil Prices Surge – Crypto Takes a Hit The conflict has sent oil prices soaring: Brent Crude: +3% WTI Futures: 5-month high If oil prices climb to $100–$150 per barrel, as some analysts warn, it could lead to global inflation, lower liquidity, and a crypto sell-off. Rising energy costs also hurt Bitcoin mining profitability, adding further pressure to the market. .article-inside-link { margin-left: 0 !important; border: 1px solid #0052CC4D; border-left: 0; border-right: 0; padding: 10px 0; text-align: left; } .entry ul.article-inside-link li { font-size: 14px; line-height: 21px; font-weight: 600; list-style-type: none; margin-bottom: 0; display: inline-block; } .entry ul.article-inside-link li:last-child { display: none; } Also Read : XRP Holders Are ‘Cosmic Royalty’ Leading a Global Financial Shift , Can XRP Bounce Back? Analysts Say Yes Despite the short-term drop, some analysts remain bullish on XRP. Expert EGRAG Crypto predicts XRP could hit: $6.70 $13 Even $27 if historic trends repeat Over the past year, XRP has gained 310.4%, outperforming even Bitcoin and Ethereum. Supporters argue its real value lies in its utility, not market noise. Final Thoughts XRP’s fall below $2 may feel alarming, but market analysts urge caution. The decline appears to be part of a broader correction in the crypto market, driven by geopolitical and macroeconomic shocks. As always, short-term volatility doesn’t erase long-term potential—especially for utility-driven assets like XRP. .article_register_shortcode { padding: 18px 24px; border-radius: 8px; display: flex; align-items: center; margin: 6px 0 22px; border: 1px solid #0052CC4D; background: linear-gradient(90deg, rgba(255, 255, 255, 0.1) 0%, rgba(0, 82, 204, 0.1) 100%); } .article_register_shortcode .media-body h5 { color: #000000; font-weight: 600; font-size: 20px; line-height: 22px; text-align:left; } .article_register_shortcode .media-body h5 span { color: #0052CC; } .article_register_shortcode .media-body p { font-weight: 400; font-size: 14px; line-height: 22px; color: #171717B2; margin-top: 4px; text-align:left; } .article_register_shortcode .media-body{ padding-right: 14px; } .article_register_shortcode .media-button a { float: right; } .article_register_shortcode .primary-button img{ vertical-align: middle; width: 20px; margin: 0; display: inline-block; } @media (min-width: 581px) and (max-width: 991px) { .article_register_shortcode .media-body p { margin-bottom: 0; } } @media (max-width: 580px) { .article_register_shortcode { display: block; padding: 20px; } .article_register_shortcode img { max-width: 50px; } .article_register_shortcode .media-body h5 { font-size: 16px; } .article_register_shortcode .media-body { margin-left: 0px; } .article_register_shortcode .media-body p { font-size: 13px; line-height: 20px; margin-top: 6px; margin-bottom: 14px; } .article_register_shortcode .media-button a { float: unset; } .article_register_shortcode .secondary-button { margin-bottom: 0; } } Never Miss a Beat in the Crypto World! Stay ahead with breaking news, expert analysis, and real-time updates on the latest trends in Bitcoin, altcoins, DeFi, NFTs, and more. .subscription-options li { display: none; } .research-report-subscribe{ background-color: #0052CC; padding: 12px 20px; border-radius: 8px; color: #fff; font-weight: 500; font-size: 14px; width: 96%; } .research-report-subscribe img{ vertical-align: sub; margin-right: 2px; } Subscribe to News var templateIds = ""6""; var listOfSubscribed = []; function subscribed_popupmodal(template_id) { var templateId = '6'; getAllSubscriberCategoryList([templateId]); var subcribemodal = window.parent.document.getElementById('subscribe-modal-design'); if (subcribemodal) { var modalContent = ` Never Miss a Beat in the Crypto World! Stay informed and gain the edge you need to navigate the crypto world. Select your subscription now Daily Get real-time crypto news, market insights, and blockchain updates. Weekly Stay updated with major trends, funding news, and price analysis. Monthly Receive a detailed report with market analysis and expert predictions. Subscribe Now `; subcribemodal.innerHTML = modalContent; } subscribe_unsubscribe_status(template_id); //getAllSubscriberCategoryList(template_id); } function toggleSubscription(subscription, template_id) { var subscriptionCheckbox = document.getElementById(subscription + '_' + template_id); var li = document.getElementById(subscription + 'Selected_' + template_id); if (subscriptionCheckbox.checked) { li.classList.add('active'); } else { li.classList.remove('active'); } } function getAllSubscriberCategoryList(getcategoryId) { jQuery.ajax({ url: 'https://coinpedia.org/wp-admin/admin-ajax.php', type: 'GET', data: { action: 'subscribe_api_ajax_request', apiurl: '/app/email_newsletter/list', }, success: function(response) { var result = JSON.parse(response.message); if (result.status === true) { var idstosubscribed = [] // Populate listOfSubscribed with subscribed category IDs result.message.forEach(listofcategory => { if (listofcategory.subscribe_status === 1) { if (!listOfSubscribed.includes(listofcategory._id)) { listOfSubscribed.push(listofcategory._id); } if (!idstosubscribed.includes(listofcategory.news_cp_category_row_id)) { idstosubscribed.push(listofcategory.news_cp_category_row_id); } } }); idstosubscribed.forEach(id => { var subscribeButton = document.getElementById('subscribe_' + id); var unsubscribeButton = document.getElementById('unsubscribe_' + id); if (subscribeButton && unsubscribeButton) { subscribeButton.style.display = 'none'; unsubscribeButton.style.display = 'block'; var showDownloadReport = document.getElementById('download_report'); if (showDownloadReport) { showDownloadReport.style.display = 'block'; } } }); } }, error: function(xhr, status, error) { console.error('Error:', error); } }); } function subscribe_unsubscribe_status(getcategoryId) { var elementTounsubscribe = parent.document.getElementById('unsubscribe_' + getcategoryId); var elementTosubscribe = parent.document.getElementById('subscribe_' + getcategoryId); jQuery.ajax({ url: 'https://coinpedia.org/wp-admin/admin-ajax.php', type: 'POST', data: { action: 'subscribe_api_ajax_request', apiurl: '/app/email_newsletter/list?category_row_id=' + getcategoryId, }, success: function(response) { var result = JSON.parse(response.message); if (result.status === true) { parent.jQuery('.skeliton-loader-block').hide(); var hasSubscribeStatusOne = false; result.message.forEach(subscribeStatus => { if (listOfSubscribed.includes(subscribeStatus._id) && subscribeStatus.subscribe_status === 1) { hasSubscribeStatusOne = true; } if (subscribeStatus.notification_type === 3) { parent.document.getElementById('monthlySelected_' + getcategoryId).style.display = 'block'; parent.document.getElementById('monthly_' + getcategoryId).setAttribute('data-id', subscribeStatus._id); if (subscribeStatus.subscribe_status === 1) { parent.document.getElementById('monthly_' + getcategoryId).checked = true; } } else if (subscribeStatus.notification_type === 2) { parent.document.getElementById('weeklySelected_' + getcategoryId).style.display = 'block'; parent.document.getElementById('weekly_' + getcategoryId).setAttribute('data-id', subscribeStatus._id); if (subscribeStatus.subscribe_status === 1) { parent.document.getElementById('weekly_' + getcategoryId).checked = true; } } else if (subscribeStatus.notification_type === 1) { parent.document.getElementById('dailySelected_' + getcategoryId).style.display = 'block'; parent.document.getElementById('daily_' + getcategoryId).setAttribute('data-id', subscribeStatus._id); if (subscribeStatus.subscribe_status === 1) { parent.document.getElementById('daily_' + getcategoryId).checked = true; } } if (subscribeStatus.subscribe_status === 1) { listOfSubscribed.push(subscribeStatus._id); } }); if (hasSubscribeStatusOne) { elementTosubscribe.style.display = 'none'; elementTounsubscribe.style.display = 'block'; } else { elementTosubscribe.style.display = 'block'; elementTounsubscribe.style.display = 'none'; } } }, error: function(xhr, status, error) { console.error('Error:', error); } }); } function logSelectedSubscriptions(categoryid) { var unsubscribemodal = document.querySelector('.unsubscribed-popup-modal .modal'); var subscribedmodal = document.querySelector('.subscribed-popup-modal .modal'); unsubscribemodal.innerHTML=''; subscribedmodal.innerHTML=''; var selectedSubscriptions = []; var storeCheckedId = []; var checkboxes = document.querySelectorAll('#subscription-options-' + categoryid + ' input[type=""checkbox""]'); var errorMessage = document.getElementById('error-message-select'); // Use a Set to handle unique data-ids var uniqueSubscribedIds = new Set(listOfSubscribed); checkboxes.forEach(function(checkbox) { var dataId = parseInt(checkbox.getAttribute('data-id')); if (checkbox.checked) { selectedSubscriptions.push(checkbox.id); storeCheckedId.push(dataId); } else { uniqueSubscribedIds.delete(dataId); // Remove unchecked data-id } }); // Update listOfSubscribed with unique values listOfSubscribed = Array.from(uniqueSubscribedIds); var selectedSubscriptionsString = selectedSubscriptions.join(', '); var concatinateSubscribeId = [...new Set(storeCheckedId.concat(listOfSubscribed))]; var categoryData = { 'subscribed_categories': concatinateSubscribeId }; var requestSubscriberData = { action: 'handle_dynamic_api_request_with_headers', security: '23e61b819f', endpoint: '/app/email_newsletter/update_categories', token: '', data: categoryData }; jQuery.ajax({ url: 'https://coinpedia.org/wp-admin/admin-ajax.php', type: 'POST', data: requestSubscriberData, beforeSend: function(xhr) { xhr.setRequestHeader('X-Requested-With', 'XMLHttpRequest'); }, success: function(response) { try { response = response.data; if (storeCheckedId.length === 0) { var unsubcribedPopUpmodal = ` You’ve Unsubscribed Successfully We're sorry to see you go! Your subscription has been canceled. If you change your mind, you can re-subscribe anytime. Thank you for being part of our community! `; unsubscribemodal.innerHTML = unsubcribedPopUpmodal; document.querySelector('#subscribe-modal-design .modal').style.display = 'none'; unsubscribemodal.style.display = 'block'; unsubscribemodal.classList.remove('hide'); unsubscribemodal.classList.add('show'); document.getElementById('subscribe_' + categoryid).style.display = 'block'; document.getElementById('unsubscribe_' + categoryid).style.display = 'none'; var showDownloadReport = document.getElementById('download_report'); if (showDownloadReport) { showDownloadReport.style.display = 'none'; } } else { var subscribedPopupModal = ` Thank you for subscribing! Thank you for subscribing to our crypto and blockchain newsletter! You’ll now receive the latest news, insights, and updates straight to your inbox. Welcome to our community! `; let selectedSubscriptionsArray = selectedSubscriptionsString.split(','); let subscribedCategories = selectedSubscriptionsArray.map(subscription => subscription.split('_')[0]); let subscribedCategoriesString = subscribedCategories.join(', '); subscribedmodal.innerHTML = subscribedPopupModal; if (document.getElementById('selectidname')) { document.getElementById('selectidname').textContent = subscribedCategoriesString; } document.querySelector('#subscribe-modal-design .modal').style.display = 'none'; subscribedmodal.style.display = 'block'; subscribedmodal.classList.remove('hide'); subscribedmodal.classList.add('show'); document.getElementById('subscribe_' + categoryid).style.display = 'none'; document.getElementById('unsubscribe_' + categoryid).style.display = 'block'; var showDownloadReport = document.getElementById('download_report'); if (showDownloadReport) { showDownloadReport.style.display = 'block'; } } } catch (e) { console.error('Error parsing response:', e); } }, }); } function closeModal(template_id) { var modalId = template_id; var modal = document.querySelector('#' + modalId); // Using querySelector to find the modal if (modal) { modal.classList.add('hide'); modal.classList.remove('show'); setTimeout(function() { modal.style.display = 'none'; }, 500); } else { console.warn('Modal not found:', modalId); } } function closeunsubscribemodal() { var unsubscribemodal = document.querySelector('.unsubscribed-popup-modal .modal'); if (unsubscribemodal) { unsubscribemodal.classList.add('hide'); unsubscribemodal.classList.remove('show'); } setTimeout(function() { unsubscribemodal.style.display = 'none'; }, 500); } function closesubscribemodal() { var subscribedmodal = document.querySelector('.subscribed-popup-modal .modal'); setTimeout(function() { subscribedmodal.style.display = 'none'; }, 500); if (subscribedmodal) { subscribedmodal.classList.add('hide'); subscribedmodal.classList.remove('show'); } } function withoutLoginClicked(withoutlogin_id) { localStorage.setItem('subscribe_without_Login', 'true'); localStorage.setItem('subscribe_clicked_id', withoutlogin_id); } document.addEventListener('DOMContentLoaded', function() { const subscribewithoutData = localStorage.getItem('subscribe_without_Login'); const subscribe_clicked_cat_id = localStorage.getItem('subscribe_clicked_id'); // Function to get cookies function getCookie(name) { let value = ""; "" + document.cookie; let parts = value.split(""; "" + name + ""=""); if (parts.length == 2) return parts.pop().split("";"").shift(); } // Get user token from cookies const userToken = getCookie('user_token'); if (subscribewithoutData === 'true' && userToken) { // Call the modal function with the category ID subscribed_popupmodal(subscribe_clicked_cat_id); // Remove the flag and category ID from localStorage localStorage.removeItem('subscribe_without_Login'); localStorage.removeItem('subscribe_clicked_id'); } }); /************************** update susbcriber content **************************** */ function initializeSubscriptionButton() { var initialListItems = document.querySelectorAll('.subscription-options input[type=""checkbox""]'); initialListItems.forEach(function(item) { console.log(item.checked, 'Initial Checkbox checked status'); }); var listItems = document.querySelectorAll('.subscription-options li'); if (listItems.length === 0) return; var anyActive = false; listItems.forEach(function(item) { var checkbox = item.querySelector('input[type=""checkbox""]'); if (checkbox) { if (checkbox.checked) { item.classList.add('active'); anyActive = true; // Set anyActive to true } else { item.classList.remove('active'); // Remove 'active' class if checkbox is unchecked } } }); } function updateButtonText(anyActive) { var subscribeButtonSpan = document.querySelector('.subscribe-submit .changeBtnText'); if (subscribeButtonSpan) { if (anyActive) { subscribeButtonSpan.textContent = 'Subscribe Now'; } else { subscribeButtonSpan.textContent = 'Unsubscribe'; } } } function updateSubscriptionButton() { var listItems = document.querySelectorAll('.subscription-options li'); if (listItems.length === 0) return; var anyActive = false; listItems.forEach(function(item) { var checkbox = item.querySelector('input[type=""checkbox""]'); if (checkbox) { if (checkbox.checked) { item.classList.add('active'); anyActive = true; // Set anyActive to true } else { item.classList.remove('active'); // Remove 'active' class if checkbox is unchecked } } }); // Update the button text based on whether any list item has the 'active' class updateButtonText(anyActive); } document.addEventListener('click', function(event) { var clickedItem = event.target.closest('.subscription-options li'); if (clickedItem) { var checkbox = clickedItem.querySelector('input[type=""checkbox""]'); if (checkbox) { checkbox.checked = !checkbox.checked; updateSubscriptionButton(); } } }); FAQs How is XRP performing today? As of today, June 23, 2025, XRP is trading around $2.01, down about 1.5% from yesterday. It has slipped below $2 recently due to broader market pressures and geopolitical tensions. How low can XRP price go in 2025? While many analysts are bullish, some predictions for XRP’s low in 2025 range from $1.40 (based on a bearish technical analysis) to around $1.70-$1.85, especially if broader market conditions worsen or regulatory uncertainties persist. Is XRP a good investment in 2025? Yes, XRP remains a promising 2025 investment due to strong fundamentals, stablecoin use, and potential ETF listings.",coinpedia,https://coinpedia.org/news/2025-06-23-why-is-xrp-price-dropping/,"BTC|COMMODITY|MARKET|TRADING|XRP","News|Ripple (XRP)",cryptocompare
2025-06-23T11:54:50,"BTC Sees Massive 1255.80 BTC Net Inflow on CEX with Bitfinex Leading Deposits","According to the latest data from Coinglass, centralized exchanges (CEX) witnessed a significant net inflow of 1255.80 BTC over the last 24 hours, underscoring increased institutional activity in the Bitcoin",coinotag,https://en.coinotag.com/breakingnews/btc-sees-massive-1255-80-btc-net-inflow-on-cex-with-bitfinex-leading-deposits/,"BTC|EXCHANGE|FLOW","BTC|FLOW",cryptocompare
2025-06-23T11:54:27,"Is XRP price going to crash again?","XRP price risks a possible 41% plunge to $1.18 if a descending triangle pattern is confirmed on the charts.",cointelegraph,https://cointelegraph.com/news/is-xrp-price-going-to-crash-again?utm_source=rss_feed&utm_medium=rss&utm_campaign=rss_partner_inbound,"ALTCOIN|BTC|FIAT|MARKET|REGULATION|SOL|TRADING|XRP|RESEARCH","will XRP drop further|XRP price analysis|Ripple price analysis|SEC vs Ripple|XRP analysis",cryptocompare
2025-06-23T11:47:43,"Crypto funds extend inflows streak to 10 weeks, BTC sees $15.1B YTD boom","Crypto funds extended their positive streak to ten consecutive weeks with $1.24 billion in inflows. The year-to-date inflows reached a record $15.1 billion despite geopolitical uncertainties and US holiday trading interruptions affecting weekly momentum patterns. Bitcoin dominates asset flows with $12.7 billion YTD performance According to CoinShares data, Bitcoin leads cryptocurrency investment flows with $1.114 billion in weekly inflows and $2.379 billion month-to-date. This brings the year-to-date totals to $12.7 billion across $151.998 billion in assets under management. The performance marks Bitcoin’s second consecutive week of positive inflows despite recent price corrections. Ethereum recorded its ninth consecutive week of inflows totaling $124 million, with month-to-date flows reaching $1.003 billion and year-to-date inflows of $2.430 billion. The sustained inflow streak brings cumulative totals to $2.2 billion since the run began. This marks the longest period of continuous inflows since mid-2021 across $14.292 billion in assets under management. Source: CoinShares Short Bitcoin products experienced minor outflows of $1.4 million weekly and $1.8 million month-to-date, with year-to-date outflows reaching $8.7 million across $96.6 million in total assets. Multi-asset products faced outflows of $5.76 million weekly and $16.99 million month-to-date, though maintaining positive year-to-date flows of $58.02 million. Altcoins attracted modest inflows, with Solana recording $2.78 million weekly and $2.98 million month-to-date, totaling $85.83 million year-to-date. XRP followed with $2.69 million weekly inflows, $10.55 million month-to-date, and $268.7 million year-to-date across $1.205 billion in assets under management. United States leads regional flows The United States dominated regional cryptocurrency investment flows with $1.253 billion in weekly inflows, $3.371.6 billion month-to-date, and $14.292.6 billion year-to-date across $134.684.8 billion in assets under management. This performance accounts for the majority of global digital asset investment activity during the period. Canada recorded positive flows with $20.9 million weekly inflows, $42.8 million month-to-date, and $177.8 billion year-to-date across $6.097.8 billion in assets under management. Germany contributed $10.9 million in weekly inflows, $99.2 million month-to-date, and $918.8 million year-to-date, with $5.976.1 billion in total assets. Source: CoinShares Australia maintained modest positive momentum with $16.6 million weekly inflows, $32.4 million month-to-date, and $139.6 million year-to-date across $176.6 million in assets under management. Brazil showed mixed performance with $9 million weekly outflows and $26.4 million month-to-date outflows, though maintaining $34.8 million in positive year-to-date flows. Regional outflows occurred in Hong Kong with $32.6 million weekly outflows, $129.8 million month-to-date outflows, and $56.1 million year-to-date outflows across $595.3 million in assets. Switzerland recorded $7.7 million weekly outflows, though maintaining $29.8 million month-to-date inflows and $255.5 million year-to-date outflows across $5.781.7 billion in assets. Sweden faced $14.9 million weekly outflows, $39.4 million month-to-date outflows, and $196.6 million year-to-date outflows. Altcoins attract selective institutional interest Sui recorded mixed performance with $8.5 million weekly outflows despite $3.3 million month-to-date inflows and $102.66 million year-to-date flows across $246.66 million in assets under management. Litecoin maintained steady progress with $0.21 million weekly inflows, $0.15 million month-to-date, and $5.96 million year-to-date across $185.4 million in total assets. Cardano attracted $0.34 million in weekly inflows, $0.37 million month-to-date, and $9.42 million year-to-date flows across $95.48 million in assets under management. Chainlink recorded $0.6 million weekly inflows, $1.0 million month-to-date, and $23.33 million year-to-date across $68.64 million in total assets. Other cryptocurrency products combined contributed $2.75 million in weekly inflows and $5.9 million month-to-date, though experiencing $509.33 million in year-to-date outflows across $404.77 million in assets under management. This category includes various smaller altcoin investment vehicles that have faced mixed investor sentiment throughout 2025. Total cryptocurrency investment product flows reached $1.239 billion weekly, $3.388 billion month-to-date, and $15.105 billion year-to-date across $176.263 billion in combined assets under management. The data shows continued institutional adoption despite geopolitical uncertainties and holiday trading interruptions that affected momentum during the latter half of the reporting week. Cryptopolitan Academy: Tired of market swings? Learn how DeFi can help you build steady passive income. Register Now",cryptopolitan,https://www.cryptopolitan.com/crypto-fund-inflows-10-week-streak-bitcoin-leads/,"ADA|ALTCOIN|BTC|ETH|SOL","News|ADA|BTC|ETH|SOL|XRP",cryptocompare
