datetime,headline,summary,source,url,categories,tags,api_source
2025-06-23T12:59:14,"US Government Warns Veer Chatel May Flee Before Sentencing in $245 Million Bitcoin Heist Case","The U.S. government is actively opposing the release of 19-year-old Veer Chatel, who pled guilty to orchestrating a $245 million Bitcoin heist through sophisticated social engineering tactics. Recent court documents",coinotag,https://en.coinotag.com/us-government-warns-veer-chatel-may-flee-before-sentencing-in-245-million-bitcoin-heist-case/,"BTC","News|BTC",cryptocompare
2025-06-23T12:56:08,"Teen Has 'Strong Incentives to Flee' After Pleading Guilty to $245M Bitcoin Heist, Gov Says","The government argued that Veer Chatel’s co-conspirators could help him to flee the country to prevent him testifying against them.",decrypt,https://decrypt.co/326468/teen-has-strong-incentives-to-flee-after-pleading-guilty-to-245m-bitcoin-heist-gov-says,"BTC","|Law and Order",cryptocompare
2025-06-23T12:55:38,"Saylor's Strategy adds 245 Bitcoins, pushing BTC holdings to 592,345","Strategy continues its Bitcoin accumulation streak with an additional 245 Bitcoin purchase valued at $26 million. The firm’s corporate Bitcoin treasury approach maintains momentum despite recent market volatility affecting unrealized gains across the company’s cryptocurrency holdings. Strategy has acquired 245 BTC for ~$26.0 million at ~$105,856 per bitcoin and has achieved BTC Yield of 19.2% YTD 2025. As of 6/22/2025, we hodl 592,345 $BTC acquired for ~$41.87 billion at ~$70,681 per bitcoin. $MSTR $STRK $STRF $STRD https://t.co/bnE0OC9kEv — Michael Saylor (@saylor) June 23, 2025 Strategy adds 245 Bitcoins at $105,856 average price Strategy acquired 245 Bitcoins for approximately $26.0 million at an average price of $105,856 per Bitcoin, according to Michael Saylor’s announcement on X. This latest purchase brings the company’s total Bitcoin holdings to 592,345 BTC as of the acquisition date. The company’s Bitcoin treasury execution has achieved a Bitcoin yield of 19.2% year-to-date for 2025 and has maintained positive performance metrics despite recent market volatility . Strategy’s total Bitcoin acquisition cost reaches approximately $41.87 billion across all purchases, with an average cost basis of $70,681 per Bitcoin. The recent acquisition occurred at a price point above Strategy’s historical average. This shows the company’s consistent approach of accumulating Bitcoin during various market conditions throughout 2025. Bitcoin’s current price is at $101,181.34, down 1.46% over 24 hours, and 5.18% over seven days according to market data. The cryptocurrency has experienced downward pressure over recent trading sessions, affecting the unrealized value of recent corporate purchases. Recent purchases show unrealized losses amid Bitcoin price drop Strategy’s recent Bitcoin acquisitions face unrealized losses as BTC price has declined from recent highs. The June 16 purchase of 610,100 Bitcoins at $104,080 shows unrealized losses of $27,811,269.50, down 2.65% from the purchase price. The June 9 acquisition of 81,045 Bitcoins at $105,426 shows $4,438,888.78 in unrealized losses, declining 4.03%. Earlier June purchases continue showing negative performance, with the June 2 acquisition at $106,495 down $3,749,202.48 or 4.99%. May purchases also face losses, with the May 26 acquisition at $106,237 showing $20,248,643.90 in unrealized losses, down 4.74%. The May 19 purchase at $103,498 reflects $16,981,711.05 in unrealized losses, declining 2.22%. Source: Saylortracker Bitcoin’s recent price action shows consistent downward momentum,with the cryptocurrency trading at $101,181.34, down 5.18% over the past seven days. The decline affects Strategy’s recent acquisitions purchased at higher price levels. However, the company’s overall portfolio maintains positive returns due to its lower average cost basis of $70,681 per Bitcoin across all holdings. Strategy maintains 592,345 Bitcoin treasury despite market volatility Strategy’s Bitcoin holdings total 592,345 BTC acquired for approximately $41.87 billion at an average cost basis of $70,681 per Bitcoin. The company’s treasury continues to add to its position despite current market conditions showing Bitcoin trading below recent purchase prices. The corporate Bitcoin accumulation maintains Strategy’s position among the largest institutional Bitcoin holders globally. With an average cost basis well below current market prices, the overall portfolio preserves substantial unrealized gains despite recent purchase timing challenges. The continued accumulation playbook follows Michael Saylor’s consistent approach of dollar-cost averaging into Bitcoin positions regardless of short-term price movements. Strategy’s methodology focuses on long-term Bitcoin adoption rather than tactical market timing considerations. He has also maintained steady purchase schedules through various market cycles and volatility periods. KEY Difference Wire helps crypto brands break through and dominate headlines fast",cryptopolitan,https://www.cryptopolitan.com/strategy-adds-245-bitcoin-btc-hits-592345/,"BTC|MARKET|REGULATION|TRADING|STRK","Bitcoin|BTC|MSTR|STRD|STRF|STRK",cryptocompare
2025-06-23T12:54:03,"Market Analysis Report (23 Jun 2025)","Bitcoin Bounces as Oil Retreats Despite U.S.-Iran Tensions Over Hormuz | Japan’s Metaplanet Buys $117M in Bitcoin, Bringing Holdings to Over 11,000 BTC | Grant Cardone’s $5.1B Real Estate Firm Buys 1,000 Bitcoin",cryptocompare,https://www.cryptocompare.com/email-updates/daily/2025/jun/23/,"ASIA|BTC|COMMODITY|ETH|MARKET","Bitcoin|Ethereum|Daily Crypto News|Cryptocurrency",cryptocompare
2025-06-23T12:50:51,"Texas Bitcoin Reserve: Strategic Move with SB 21 Solidifies Crypto Leadership","BitcoinWorld Texas Bitcoin Reserve: Strategic Move with SB 21 Solidifies Crypto Leadership A significant development is unfolding in the heart of the United States, one that could reshape the landscape of state-level asset management and technological adoption. Texas, long a leader in energy and innovation, has taken a bold step into the future of finance by officially establishing a strategic Texas Bitcoin Reserve . This move, solidified by the signing of Senate Bill 21 (SB 21), signals a growing acceptance and potential integration of digital assets into traditional government frameworks. Understanding SB 21 Texas: What Does the Bill Do? At its core, SB 21 Texas creates the legal framework necessary for the state to explore and potentially implement direct government investment in Bitcoin. While the initial news reports might sound straightforward, the implications of this legislation are multifaceted. The bill doesn’t necessarily mandate immediate large-scale purchases but rather establishes a fund and sets the stage for future action. It provides the statutory authority for state entities to consider holding Bitcoin as a strategic asset. Key aspects typically covered in such legislation include: Establishing a Fund: Creating a dedicated fund or account where digital assets like Bitcoin could be held. Defining Permissible Investments: Specifying the types of digital assets allowed (in this case, Bitcoin is explicitly mentioned). Setting Management Guidelines: Outlining how such assets would be acquired, stored securely, managed, and potentially liquidated. Mandating Studies or Reports: Often, initial legislation requires further study into the feasibility, risks, and benefits before large-scale implementation. The passage of SB 21 Texas represents a formal acknowledgment by the state government of Bitcoin’s growing importance and its potential role beyond just a speculative asset. It positions Bitcoin as something worthy of consideration within a state’s strategic financial planning. Why is Texas Positioned to Become a Texas Crypto Hub? Texas hasn’t just stumbled into the cryptocurrency space; it has actively cultivated an environment conducive to its growth. The signing of SB 21 is a natural progression for a state already making significant strides in the industry. Several factors contribute to Texas’s ambition to become a prominent Texas Crypto Hub : Energy Resources: Abundant and relatively low-cost energy, particularly from renewable sources and natural gas that would otherwise be flared, makes Texas an attractive location for energy-intensive Bitcoin mining operations. Favorable Regulatory Stance: Texas regulators and lawmakers have generally adopted a supportive or at least open-minded approach to blockchain and digital assets, contrasting with stricter stances elsewhere. Tech and Innovation Focus: Texas has a strong history of fostering technological innovation, from its roots in the oil industry to its burgeoning tech sector in cities like Austin. Cryptocurrency fits into this narrative. Political Will: Governor Abbott and other state leaders have publicly expressed interest in and support for the cryptocurrency industry, seeing it as a way to attract investment and jobs. Establishing a Texas Bitcoin Reserve through SB 21 Texas sends a clear signal to crypto businesses, investors, and innovators worldwide: Texas is serious about digital assets and aims to be at the forefront of this technological revolution. This strategic move reinforces its image as a leading Texas Crypto Hub . Exploring the Vision: Government Bitcoin Investment The concept of Government Bitcoin Investment at a state level is still relatively new and sparks considerable debate. What is the strategic thinking behind a state holding Bitcoin? Proponents often cite several potential benefits: Potential Benefits of Government Bitcoin Investment: Inflation Hedge: Bitcoin is often viewed by proponents as a potential hedge against inflation and the devaluation of fiat currencies due to its fixed supply. Holding a portion of state assets in Bitcoin could be seen as a way to preserve purchasing power over the long term. Asset Diversification: Adding a non-correlated asset like Bitcoin to a state’s reserve portfolio could potentially reduce overall portfolio risk and enhance returns, similar to how large institutions and corporations are exploring diversification into digital assets. Attracting Investment and Talent: A state actively involved in Government Bitcoin Investment signals its commitment to the future of finance, potentially attracting innovative companies and skilled workers in the blockchain and crypto sectors. Pioneering State-Level Adoption: By being among the first states to formally establish a Bitcoin reserve, Texas positions itself as a leader in exploring new financial technologies and asset classes for public funds. Supporting the Local Industry: State investment could indirectly support the Texas-based crypto industry, including miners and technology providers. This potential Government Bitcoin Investment moves beyond simply being crypto-friendly; it suggests a potential active participation in the asset class itself, aiming to reap direct benefits for the state’s treasury. Navigating the Challenges and Considerations While the prospects are exciting for proponents, Government Bitcoin Investment also comes with significant challenges that the framework established by SB 21 Texas will need to address: Challenges and Considerations: Volatility: Bitcoin is known for its price swings. A state holding significant amounts would need robust strategies to manage this volatility and potential public scrutiny during downturns. Security: Storing large quantities of Bitcoin securely requires specialized knowledge and infrastructure to protect against hacks, theft, and loss of private keys. Regulatory Landscape: While Texas may be friendly, the overall U.S. regulatory environment for cryptocurrencies is still evolving, which could impact the management and reporting requirements for state-held assets. Public and Political Opinion: Investing taxpayer money in a volatile and sometimes controversial asset like Bitcoin could face political opposition and public skepticism. Custody and Management: Developing secure, transparent, and accountable methods for acquiring, holding, and potentially selling Bitcoin for a state government is a complex operational challenge. Valuation and Accounting: Determining the value of Bitcoin holdings for state accounting purposes and reporting can be complicated. Effective Bitcoin Legislation like SB 21 Texas must lay the groundwork for addressing these challenges, likely involving detailed studies, expert consultation, and clear guidelines for risk management and security protocols for the Texas Bitcoin Reserve . Global and National Context: Is Government Bitcoin Investment Becoming a Trend? Texas is not operating in a vacuum. The idea of Government Bitcoin Investment or exploring digital assets at a state or national level is gaining traction globally. El Salvador famously adopted Bitcoin as legal tender and holds it on its balance sheet. Other countries and sub-national entities are exploring various levels of engagement, from accepting crypto for taxes to studying reserve possibilities. Within the U.S., while no other state has yet established a formal reserve fund like the one proposed by SB 21 Texas , several states and cities are exploring crypto-friendly policies, blockchain technology adoption, and even pilot programs for accepting crypto payments. Texas’s move sets a precedent for other states considering similar Bitcoin Legislation . This broader trend indicates a shift in how governments perceive digital assets, moving from outright skepticism to a more nuanced exploration of their potential economic and strategic benefits. The Texas Bitcoin Reserve is a prominent example of this evolving perspective. What This Means for the Future of the Texas Crypto Hub The establishment of the Texas Bitcoin Reserve via SB 21 Texas is more than just a symbolic gesture. It’s a concrete step that could have lasting impacts on the state’s economy and its position within the global digital asset landscape. For businesses in the crypto space, this legislation enhances Texas’s appeal as a place to operate and invest. A state government actively engaging with Bitcoin signals stability and a forward-thinking approach that can attract capital and talent. It reinforces Texas’s status as a leading Texas Crypto Hub . For Texas residents, while direct impacts may not be immediate, a successful strategic reserve could potentially contribute to the state’s financial health over the long term. It also places Texas at the cutting edge of financial innovation, potentially leading to new job opportunities and economic growth related to the digital asset sector. The implementation details following SB 21 Texas will be crucial. How the reserve is funded, managed, and secured will determine its ultimate success and influence. However, the legislative foundation is now firmly in place for Texas to explore Government Bitcoin Investment in a structured manner. Conclusion: Texas Solidifies Its Digital Asset Ambitions Governor Greg Abbott’s signing of SB 21 Texas marks a pivotal moment for the state and the broader cryptocurrency industry. By establishing a strategic Texas Bitcoin Reserve , Texas is not only creating a mechanism for potential Government Bitcoin Investment but is also reinforcing its commitment to becoming a dominant Texas Crypto Hub . This move reflects a forward-looking strategy aimed at asset diversification, attracting innovation, and potentially hedging against economic uncertainties. While challenges remain, the passage of this significant piece of Bitcoin Legislation demonstrates Texas’s determination to be a leader in the evolving digital financial landscape. To learn more about the latest Bitcoin trends, explore our article on key developments shaping Bitcoin institutional adoption. This post Texas Bitcoin Reserve: Strategic Move with SB 21 Solidifies Crypto Leadership first appeared on BitcoinWorld and is written by Editorial Team",bitcoinworld,https://bitcoinworld.co.in/texas-bitcoin-reserve-sb21/,"BLOCKCHAIN|BTC|FIAT|REGULATION|TECHNOLOGY","Crypto News|BITCOIN|CRYPTOCURRENCY|Legislation|SB-21|Texas",cryptocompare
2025-06-23T12:50:00,"Strategy adds a modest $26M worth of bitcoin in past week","More on Strategy Strategy: Don't Bet On A U.S. Dollar Crisis, As It's Highly Unlikely (Upgrade) Strategy: Debt Is Now Unsustainable (Rating Downgrade) Strategy's 3rd Preferred: Why STRD Is The Genius Gear In Its Bitcoin Accumulation Engine Crypto stocks see decline in short interest for second straight month Strategy acquired $1.05B worth of bitcoin last week",seekingalpha,https://seekingalpha.com/news/4460748-strategy-adds-a-modest-26m-worth-of-bitcoin-in-past-week?utm_source=cryptocompare.com&utm_medium=referral&feed_item_type=news,"BTC|FIAT|STRK","MSTR|BTC-USD|STRK|STRF",cryptocompare
2025-06-23T12:48:08,"Corporate Companies Continue to Buy Bitcoin! Norwegian Offshore Mining Company Prepares to Buy Bitcoin! Here Are the Details","Green Minerals AS, a pioneer in deep-sea mining and sustainable mineral extraction, announced today that it has adopted the Bitcoin Treasury Strategy. The company positions this move as the first step in its overall blockchain strategy. Green Minerals Announces Adoption of Norway's First Bitcoin Treasury Strategy With this strategic decision, Green Minerals aims to reduce its dependence on traditional fiat assets and protect its balance sheet in a global economic environment where high inflation and geopolitical uncertainties are increasing. “A strong balance sheet is more important than ever at a time of such monetary policy expansion. Bitcoin’s decentralized and inflation-resistant nature offers a powerful alternative to traditional money.” Green Minerals plans to make Bitcoin treasury the core asset in a financing plan of up to $1.2 billion with its partners. This goal coincides with the company’s first HEDSM (Hedge-Enabled Digital Strategy Model) to be launched within the framework of the “Responsible Production Partnership”. The company also plans to collaborate with expert advisors to conduct Bitcoin purchases in a “transparent and secure framework.” In this context, a new performance indicator, “Bitcoin per share (BTC/share),” will be introduced. This will provide investors with a system that will directly track the value of the digital asset falling on their shares. Green Minerals plans to leverage blockchain technology not only in the financial arena, but also in areas such as supply chain transparency, certification of mineral origins, and operational efficiency. By integrating this technology throughout the value chain, the company aims to pioneer future regulations and maintain its competitiveness in the sector. Green Minerals has announced that it aims to make its first Bitcoin purchase in the next few days. The company has pledged to be transparent about every stage of the process. With this strategic move, Green Minerals not only consolidates its leadership in sustainable mining, but also takes a pioneering stance in the financial and technological fields. *This is not investment advice. Continue Reading: Corporate Companies Continue to Buy Bitcoin! Norwegian Offshore Mining Company Prepares to Buy Bitcoin! Here Are the Details",bitcoinsistemi,https://en.bitcoinsistemi.com/corporate-companies-continue-to-buy-bitcoin-norwegian-offshore-mining-company-prepares-to-buy-bitcoin-here-are-the-details/,"BLOCKCHAIN|BTC|MINING|REGULATION|TECHNOLOGY","Bitcoin|News",cryptocompare
2025-06-23T12:47:44,"Anthony Pompliano’s ProCap to Go Public in $1B Bitcoin Treasury SPAC Deal","Anthony Pompliano is taking his bitcoin-native financial platform ProCap BTC public through a $1 billion merger with Columbus Circle Capital Corp. I (CCCM), a special-purpose acquisition company (SPAC) sponsored by an affiliate of Cohen & Company. The transaction, announced Monday, positions the new entity, ProCap Financial, Inc., as one of the largest bitcoin treasuries ever to hit public markets. In what’s being called the largest initial fundraise for a public bitcoin BTC treasury company to date, ProCap raised $550 million in preferred equity and secured $225 million in convertible notes, giving future shareholders immediate exposure to bitcoin through a structure designed to acquire BTC ahead of the deal's close. Led by Pompliano, a well-known investor and vocal bitcoin advocate, ProCap aims to operate at the intersection of digital assets and traditional finance. The company plans to generate profit not just by holding BTC but by actively deploying its bitcoin balance sheet across yield-generating strategies that mitigate risk and capitalize on crypto-financial infrastructure. ""The legacy financial system is being disrupted by bitcoin,"" Pompliano said in a statement. ""ProCap Financial represents our solution to the increasing demand for bitcoin-native financial services among sophisticated investors."" The merger values the combined entity at up to $1 billion, depending on the final bitcoin purchase price at closing. ProCap’s BTC assets will be custodied until the transaction completes, giving investors near-instant BTC exposure without waiting for the company to go public. The transaction is expected to close before the end of 2025, pending SEC review and shareholder approval. The Financial Times first reported that Pompliano was set to become the CEO of ProCap BTC, and that the company was planning to raise $750 million to acquire bitcoin. Read more: Anthony Pompliano Set to Head $750M Bitcoin Investment Vehicle: FT",coindesk,https://www.coindesk.com/business/2025/06/23/anthony-pomplianos-procap-to-go-public-in-1b-bitcoin-treasury-spac-deal,"BTC|BUSINESS|MARKET|REGULATION|SPONSORED","Finance|FastNews|Anthony Pompliano|Bitcoin Treasury Reserve Asset|IPOs|SPACs|News",cryptocompare
