datetime,headline,summary,source,url,categories,tags,api_source
2025-06-23T11:45:03,"Trader Issues Warning to Bitcoin Top-Callers, Says BTC Still in Stage One Uptrend – Here’s What He Means","A closely followed crypto analyst believes that it’s very unlikely that Bitcoin ( BTC ) has already printed a bull market top at $110,000. In a new video update, crypto strategist Cheds tells his 49,800 YouTube subscribers that Bitcoin’s long-term uptrend remains strong as the price of BTC trades above multiple moving averages on the weekly chart. According to the analyst, Bitcoin is just taking a breather after climbing from its 2025 low of around $74,000. “I think it’s hard to call a top here… How can you call a top? Look at this weekly chart. It’s by definition a stage one uptrend in a sense that it’s price above a rising EMA (exponential moving average) 8, and with this incredible price distance to a rising MA (moving average) 200, and a pretty good slope to the rising 200 as well. So there’s plenty of strength. There’s no way to call the top yet. We certainly know we’re consolidating.” Source: Cheds/YouTube In 2021, Bitcoin cratered after failing to take out the $69,000 level twice. The loss in bullish momentum triggered a bear market that sent BTC down to $16,000. For now, Cheds outlines levels to watch as Bitcoin consolidates. “$88,500 for me is the last level that needs to hold should $96,000 get tested and fail. And it’s a zone, not a number… Any kind of top now is not based on available information.” At time of writing, Bitcoin is trading for $101,957. Follow us on X , Facebook and Telegram Don't Miss a Beat – Subscribe to get email alerts delivered directly to your inbox Check Price Action Surf The Daily Hodl Mix Disclaimer: Opinions expressed at The Daily Hodl are not investment advice. Investors should do their due diligence before making any high-risk investments in Bitcoin, cryptocurrency or digital assets. Please be advised that your transfers and trades are at your own risk, and any losses you may incur are your responsibility. The Daily Hodl does not recommend the buying or selling of any cryptocurrencies or digital assets, nor is The Daily Hodl an investment advisor. Please note that The Daily Hodl participates in affiliate marketing. Generated Image: Midjourney The post Trader Issues Warning to Bitcoin Top-Callers, Says BTC Still in Stage One Uptrend – Here’s What He Means appeared first on The Daily Hodl .",dailyhodl,https://dailyhodl.com/2025/06/23/trader-issues-warning-to-bitcoin-top-callers-says-btc-still-in-stage-one-uptrend-heres-what-he-means/,"BTC|BUSINESS|MARKET|TRADING","Bitcoin|Trading|BTC|Cheds Trading|Crypto|News|trading",cryptocompare
2025-06-23T11:45:00,"Unicoin to Buy Majority Stake in Diamond Lake, Will Launch Altcoin Treasury Strategy","Crypto firm Unicoin has agreed to buy a 51% stake in Diamond Lake Minerals, a firm specializing in digital assets, setting the stage for a strategic rebrand and a shift into altcoin treasury. The deal, which was announced on Monday, will see Diamond Lake Minerals renamed to DiamondLake and refocussed on building a cryptocurrency treasury business. That effort is inspired by Strategy’s bitcoin BTC-heavy corporate treasury strategy but swaps BTC for emerging altcoins. Shares of Diamond Lake Minerals’ were last trading at $3.96, suggesting the deal could be worth above $70 million. The acquisition is expected to close within 20 days, pending standard conditions. Unicoin CEO Alex Konanykhin framed the move as a bet on the future of cryptocurrencies. He cited legislative shifts like the recent passage of the Guiding and Establishing National Innovation for U.S. Stablecoins (GENIUS) Act through the country’s Senate as catalysts that could unlock altcoin potential. ""We believe the same results achieved with Bitcoin can be replicated at a fraction of the cost in the alt-coin segment,” Konanykhin said. DiamondLake’s CEO Brian J. Esposito called the deal “historic,” emphasizing the company’s long-standing ambition to bring tokenization into the core of public market investment strategies. The new company will focus on tokenizing real-world assets and making them accessible to everyday investors. The acquisition comes roughly a month after the U.S. Securities and Exchange Commission (SEC) sued Unicorn and three of its executives, including Konanykhin, for allegedly raising over $100 million in a “massive securities fraud.” The agency claims Unicoin misled investors by inflating real estate valuations and promoting outsized, unrealistic returns, such as a 9 million percent gain, through aggressive marketing campaigns. The SEC is seeking disgorgement and civil penalties. Konanykhin has dismissed the charges as “blatantly false,” and suggested the SEC is still going after crypto firms, even after the regulator dropped cases against firms including Coinbase, Kraken, and Uniswap. He rejected a proposed settlement meeting in April, calling the SEC’s terms “unacceptable.” In a letter to shareholders, he argued that Unicoin had complied with U.S. regulations and accused the regulator of inflicting “multi-billion-dollar damages” through its probe.",coindesk,https://www.coindesk.com/business/2025/06/23/unicoin-to-buy-majority-stake-in-diamond-lake-will-launch-altcoin-treasury-strategy,"ALTCOIN|BTC|BUSINESS|EXCHANGE|REGULATION","Finance|Unicoin|acquisition|Exclusive|News",cryptocompare
2025-06-23T11:44:14,"Why Is Crypto Down Today? – June 23, 2025","The crypto market is down today. Ten of the top 100 coins have seen increases over the past 24 hours. Moreover, the cryptocurrency market capitalization has decreased by 2.8% over the past day, now standing at $3.23 trillion, compared to Friday’s $3.37 trillion. The total crypto trading volume is at $161 billion, back to the typical levels. TL;DR: The crypto market has seen a notable drop over the weekend; BTC and ETH dropped around 1% over the past day each; At one point, BTC fell below the psychologically relevant $100,000 level; The probability of BTC ending 2025 above $200,000 has dropped to 3.5%; This is not over yet, analysts say, as market braces for instability; The market may experience additional hits. Crypto Winners & Losers All the top 10 coins per market cap are down today. Bitcoin (BTC) fell by 0.7%, now trading at $101,924, nearing the psychologically relevant $100,000 mark. This is also the smallest decrease in this category. Also, Ethereum (ETH) fell by 1%, changing hands at $2,251. This is the category’s second-smallest drop. XRP (XRP) saw the highest decrease in this category of 2.6% to the price of $2.02. Moreover, ten of the top 100 coins saw their prices increase in the same period. The best performer is Story (IP) , with the only double-digit increase of 11.6% to $3.06. At the same time, Filecoin (FIL) fell the most, followed by Toncoin (TON) . They’re down 3.9% and 3.8% to $2.12 and $2.75, respectively. Speaking of XRP, Bloomberg analysts recently placed the odds of an XRP spot ETF approval at 95% . The timing of these approvals/launches is more uncertain. Could be something we're talking about in the next month or two. Or it could be something that waits until October or later. Matter of when not if For Bloomberg clients, the note can be read here: https://t.co/PBdquFWPVn — James Seyffart (@JSeyff) June 20, 2025 Meanwhile, recent geopolitical shocks triggered immediate market reactions . Investors began moving into traditional safe-haven assets like gold and the US dollar. Bitcoin sold off all day & made up more than half of its losses in the last 30 minutes. Trump's announcement of direct US involvement in the Middle East marked the local bottom. pic.twitter.com/02Uxuqe21d — Joe Consorti (@JoeConsorti) June 22, 2025 This Isn’t Over: Market Braces for Instability Dr. Sean Dawson, Head of Research at decentralized onchain options AI-powered platform, Derive.xyz , commented that the surge in short-term implied volatility (IV) confirms the market is bracing for more instability. Volatility markets are telling us this isn’t over. “Amid mounting geopolitical pressure, we’re seeing classic risk-off behavior with falling prices, spiking volatility, and a pullback in upside positioning,” Dawson says. At one point, BTC has pulled back from $104,300 to $100,300. At the same time, there was also spike in short-term implied volatility by 10% to 45%. This happened as traders began pricing in fresh risk. Moreover, ETH plunged nearly 14% from $2,550 to $2,200, along with a 15-point jump in 7-day IV to 83%. This reflects increased downside hedging and uncertainty, Dawson says. “Ethereum’s double-digit loss and volatility spike to 83% show just how fast risk can unravel when leverage is high,” he adds. Source: Derive.xyz, Amberdata Without a clear de-escalation trigger, the company expects more cautious positioning and subdued momentum in the month ahead, the Head of Research notes. Dawson notes that the BTC options market is currently “scaling back on optimism.” The probability of BTC ending 2025 above $200,000 has dropped to 3.5%. The chance of it surpassing $150,000 in that same period fell to 11%. “Bulls are losing conviction as geopolitical risk and macro headwinds overshadow halving optimism and ETF flows.” At the same time, the likelihood of BTC closing below $80,000 remains unchanged at 20%. All these percentages “show the options market leaning defensive. Traders aren’t betting big on upside right now.” Levels & Events to Watch Next At the time of writing, BTC trades at $101,924. At one point over the past day, the coin saw a sharp drop from the intraday high $102,739 and below the psychologically critical $100,000 mark to $98,467. It has recovered somewhat since. Over the past 7 days, we have seen a decrease of 4.5% from the intraweek high of $108,771. Bitcoin Price Chart. Source: TradingView At the same time, Ethereum is currently trading at $2,251. The price saw a daily high of $2,280, falling to $2,134, before rising slightly to the current price. Over the past week, ETH fell 13.7% from the weekly high of $2,671. Moreover, the crypto market sentiment has entered fear territory. The Fear and Greed Index has dropped from 48 on Friday and 40 on Sunday to the current 37 . Now, fear is driving the prices potentially pushing them lower. But it can also present a chance to buy the dip. Source: CoinMarketCap Meanwhile, on 20 June, US BTC spot exchange-traded funds (ETFs) until later today saw only $6.37 million in inflows. While BlackRock saw an inflow of $46.91 million, Fidelity recorded an outflow of $40.55 million. Source: SoSoValue On the same day, US ETH ETFs saw outflows of $11.34 million , breaking another streak. BlackRock leads this amount with a loss of $19.71 million, while Grayscale and VanEck took in $6.6 million and 1.77 million, respectively. Source: SoSoValue Tokyo-listed investment firm Metaplanet bought an additional 1,111 BTC for $118.2 million, amid the price dip. The company now holds 11,111 BTC on its balance sheet, valued at over $1.07 billion. On the other hand, Cathie Wood’s ARK Invest offloaded $146.2 million worth of Circle (CRCL) shares on Friday. Here are the current top 15 largest holdings in Cathie Wood and Ark Invest's $ARKK ETF Tesla $TSLA – 10.15% Coinbase $COIN – 8.31% Circle $CRCL – 7.84% pic.twitter.com/SBQcYUqIip — ETF Tracker (@TheETFTracker) June 20, 2025 Quick FAQ Why did crypto move against stocks today? The crypto market has seen a significant drop in a day, while the stock markets saw a mixed picture on their last day of trading. The S&P 500 went down by 0.22%, the Nasdaq-100 decreased by 0.43%, and the Dow Jones Industrial Average rose by 0.083%. Investors were on edge over the Israel-Iran war and the US’s potential role. They were then surprised by the US attacks on Iran on Saturday, and this is bound to reflect on the stock market. Is this dip sustainable? Given the current geopolitical and economic developments, the prices may decrease further. Bitcoin may fall below $100,000 and ETH below $2,100. The post Why Is Crypto Down Today? – June 23, 2025 appeared first on Cryptonews .",cryptonews,https://cryptonews.com/news/why-is-crypto-down-today-june-23-2025/,"BTC|BUSINESS|ETH|MARKET|TRADING","Bitcoin News|News|Bitcoin|Cryptocurrency|Market",cryptocompare
2025-06-23T11:43:35,"SPX6900 Price Prediction: Traders Jump Ship as SPX Price Drops 37% in a Week, What’s Next?","The SPX6900 price has jumped by 8% today, with the altcoin’s move to $1.08 coming as the crypto market as a whole falls by 3% in the past 24 hours. Despite this increase, SPX6900 has fallen by 37% in the past week, as the wider market takes a big hit from the conflict in the Middle East . On the other hand, SPX remains up by 25% in a month and by a huge 9,900% in the past year, with the meme token only having set its current ATH of $1.73 some 12 days ago. It therefore continues to be one of the hot top-100 coins of the moment, with the coming weeks likely to bring further price increases as more investors plow into the token. SPX6900 Price Prediction: Traders Jump Ship as SPX Price Drops 37% in a Week, What’s Next? SPX’s chart looks very different from that of most other coins in the top 100, in that it has enjoyed a peak in the past couple of weeks, and not only in January, when Donald Trump took office. However, the flipside of this is that the coin entered a strongly overbought position, with its 37% drop in the past week providing a much-needed correction. Source: TradingView Indeed, SPX6900’s relative strength index (purple) has dropped to 40 this morning, which could be a prelude to a rebound. On the other hand, its MACD (orange, blue) has yet to return to its baseline or to become oversold, so it may be a few days before the token begins rallying again. But in the medium-term, SPX continues to look very promising, with its volumes still near their highest-ever levels, at around $100 million today. The meme token has been able to rise to new highs this month as a result of an influx of new investment, with major asset manager BlackRock being the most notable new investor in SPX . Open interest in the coin is also higher than it has been in every month prior to June , while its funding rate remains at a healthy 5.5%, indicating strong demand. This Cup & Handle pattern could make #SPX6900 go absolutely parabolic soon! pic.twitter.com/ghbhutWhXq — Coinvo (@ByCoinvo) June 21, 2025 And analysts are continuing to predict big things for the SPX6900 price in the coming weeks and months, with some highlighting a classic cup-and-handle pattern as a signal of an incoming breakout. Its fortunes in the next few days and weeks will depend on what happens in Iran, with a further escalation – such as the blocking of the Strait of Hormuz – likely to depress demand in the near term. However, if conditions settle, SPX could easily reach $1.25 by the end of July and $1.50 by the end of August. Bitcoin Bull Raises $7.3 Million in Snowballing Presale: Is Deflationary Meme Coin Ready to Explode? As good as SPX looks at the moment, it won’t be the only new token to do well this summer, particularly if market conditions (e.g. tariffs, Middle East) improve. There are also other, newer coins ready to surge in the coming weeks, including several presale tokens that have been building strong momentum recently. One of these is Bitcoin Bull (BTCBULL), a deflationary ERC-20 token that has now raised $7.3 million in its ongoing ICO. Last chance to buy BTCBULL before launch! The countdown ends on June 30th. Here’s what’s coming: BTCBULL token burns BTC airdrops at price milestones BTCBULL airdrop when Bitcoin hits $250K Join the herd: https://t.co/FQZXEzFwWu pic.twitter.com/aeUmLJcSOC — BTCBULL_TOKEN (@BTCBULL_TOKEN) June 2, 2025 What’s exciting about Bitcoin Bull is that its deflationary tokenomics are connected to Bitcoin’s (BTC) performance. With a hard cap of 21 billion BTCBULL, the token will conduct burns whenever BTC reaches price milestones for the first time. This will begin with $125,000, and repeat with each additional $25,000 added for the first time, shrinking BTCBULL’s supply in the long run. Not only that, but Bitcoin Bull will host airdrops of Bitcoin itself, with these happening whenever BTC adds $50,000 to its price for the time (starting with $150,000). This could make BTCBULL hugely profitable to hold, particularly when owners can stake it for a passive income. However, the coin’s presale will end in just under seven days, so investors will have to move quickly if they want to buy the token before it lists. They can do so by going to the Bitcoin Bull website , where BTCBULL is selling at its final presale price of $0.00258. The post SPX6900 Price Prediction: Traders Jump Ship as SPX Price Drops 37% in a Week, What’s Next? appeared first on Cryptonews .",cryptonews,https://cryptonews.com/news/spx6900-price-prediction-traders-jump-ship-as-spx-price-drops-37-in-a-week-whats-next/,"ALTCOIN|BTC|BUSINESS|MARKET|TRADING","Industry Talk|Altcoin|Price Prediction|SPX6900",cryptocompare
2025-06-23T11:42:48,"Gate Leads Global Derivatives Market with 69.9% Growth and $10.45B Reserves, Cementing BTC Dominance","Gate has distinguished itself in the latest CoinDesk Crypto Exchange Monthly Report, demonstrating exceptional growth within the global derivatives market. In May, Gate’s contract trading volume surged by 69.9% month-over-month,",coinotag,https://en.coinotag.com/breakingnews/gate-leads-global-derivatives-market-with-69-9-growth-and-10-45b-reserves-cementing-btc-dominance/,"BTC|EXCHANGE|MARKET|TRADING","",cryptocompare
2025-06-23T11:42:43,"Ethereum Price Prediction As ETH Continues to Fall Behind Bitcoin in June 2025","Ethereum (ETH) has gone down by 14.5% in the past week as rising tensions in the Middle East have sparked a strong sell-off that has now pushed the token to the low 2,000s. The United States bombed nuclear enrichment facilities in Iran during the weekend and a new chapter in this armed conflict between Israel and Iran began as a result. The market was spooked by the news and a downward move that started on Wednesday accelerated during the weekend, pushing ETH from nearly $2,900 to its current level of $2,260. Bitcoin (BTC) has been increasing its dominance in the crypto market as investors have rotated their capital out of altcoins amid the uncertainty and volatility triggered by these events. Data from CoinMarketCap shows that BTC’s dominance has been steadily increasing in the past year, moving from 54.1% in June 2024 to 64% as of today. As a result, ETH’s dominance has stepped back from 18.2% to 8%. It appears that investors continue to see Bitcoin as the safer bet of all in the crypto market, which favors a bearish Ethereum price prediction. Ethereum Price Prediction: ETH Could Drop to $1,800 if It Fails to Recapture These Levels Looking at the 4-hour chart, we can see that ETH has broken below two key supports already, the first at $2,380 and the second at $2,320. The token has now stepped out of consolidation as a result of this bearish breakout and could be heading to retest the $1,800 shortly as the uptrend has now been reversed. Momentum indicators have improved slightly as the Relative Strength Index (RSI) has stepped out of oversold territory for the time being and has moved above the 14-period moving average. It is still too early to say that this is the end of the downtrend. What this improvement could mean in the near term is that ETH will retest these support levels from below and could then resume its downward momentum after it raises enough buy-side liquidity. As Bitcoin’s dominance continues to increase, all crypto presales associated with the top crypto stand to reap the benefits of its positive performance. Bitcoin Hyper (HYPER) has emerged as one of the most promising new presales as the project is raising the necessary capital to launch a layer-2 scaling solution for the Bitcoin network that unlocks the untapped potential of its DeFi ecosystem and more. Bitcoin Hyper (HYPER) Keeps Surpasses $1.5M Raised to Launch its L2 Bitcoin Hyper (HYPER) leverages the efficiency of the Solana Virtual Machine (SVM) to unlock the potential of the Bitcoin network to become the home of the market’s most successful decentralized finance (DeFi) solutions. The project creates a scalable Solana-based side chain that bundles transactions offline before sending them to the Bitcoin mainnet and provides near-instant finality. As a result, developers will be able to create efficient dApps for DeFi services like lending and borrowing and yield farming, create low-cost payment platforms that use BTC as their main token, and interfaces through which users can mint meme coins on the Bitcoin blockchain. The demand for $HYPER will explode once the solution is embraced by top wallets and exchanges. Hence, at its discounted presale price of $0.012, this token offers significant upside potential to early buyers. To buy $HYPER, simply head to the Bitcoin Hyper website and connect your wallet (e.g. Best Wallet ). You can either swap USDT or ETH for this token or use a bank card to invest. The post Ethereum Price Prediction As ETH Continues to Fall Behind Bitcoin in June 2025 appeared first on Cryptonews .",cryptonews,https://cryptonews.com/news/ethereum-price-prediction-as-eth-falls-behind-bitcoin-june-2025/,"BLOCKCHAIN|BTC|ETH|MARKET|TRADING","Price Analysis|ETH Price|Ethereum|Price Prediction",cryptocompare
2025-06-23T11:40:25,"Ether's Leverage-Driven Rally Faces Breakdown Risk, Matrixport Warns","Ether’s ETH recent rally may be on shaky ground with one firm warning that last week’s price surge was largely fueled by speculative futures positions instead of a bump in organic demand. In a note on Monday, Matrixport opined that “leveraged traders have pushed [ETH’s] price higher in the absence of fundamental support,” adding that this made the asset more susceptible to the “outsized decline” the asset saw over the weekend. Ether slumped over 8% in a Saturday sell-off, leading losses among majors as traders reacted to the U.S. attack on Iranian nuclear sites in a surprise airstrike. The firm pointed to last week’s sharp drop in ETH as evidence of this position-driven fragility and warned that elevated leverage levels could continue to pressure prices. At press time, ETH traded near $2,248 — down from last week’s high above $2,400 — as derivatives data showed traders aggressively hedging downside risk. Options market signals echo that caution, as CoinDesk analyst Omkar Godbole noted over the weekend . According to data from Amberdata, ETH’s 25-delta risk reversals — a measure comparing the cost of puts versus calls — have skewed negative across June to July expiries. This suggests investors are paying up for protection against downside volatility. QCP Capital further noted in a weekend market update that “risk reversals in both BTC and ETH continue to show a preference for downside protection,” adding that long holders are actively hedging their spot exposure. Read more: SOL, XRP, DOGE Lead Altcoin Recovery After $1B Weekend Liquidation",coindesk,https://www.coindesk.com/markets/2025/06/23/ethers-leverage-driven-rally-faces-breakdown-risk-matrixport-warns,"ALTCOIN|BTC|ETH|MARKET|TRADING","Markets|Trading|Ether|Matrixport|News",cryptocompare
