datetime,headline,summary,source,url,categories,tags,api_source
2025-06-23T12:23:22,"Hedge Fund Executives Eye $100 Million to Accumulate BNB Token","A team of crypto hedge fund executives are in advanced talks to raise $100 million for investing in a token linked to Binance Holdings Ltd. through a publicly listed company they control, in the latest spin on the Bitcoin treasury blueprint pioneered by Michael Saylor’s Strategy.",bloomberg_crypto_,https://www.bloomberg.com/news/articles/2025-06-23/hedge-fund-execs-eye-100-million-for-accumulating-bnb-token,"BTC|EXCHANGE|REGULATION|BNB","",cryptocompare
2025-06-23T12:22:08,"Analyst sets Bitcoin’s next short-term high target after weekend sell-off","A trading expert is projecting that technical indicators support a potential Bitcoin ( BTC ) rally toward $110,000 as the asset attempts to recover from the weekend sell-off . Notably, Bitcoin briefly plunged below $100,000 on Sunday following a market-wide decline triggered by a U.S. strike on Iran’s nuclear facility , aligning Washington with Israel in the ongoing Middle East conflict. According to an analysis by TradingShot , the recent drop formed a descending channel similar to the correction between December 17, 2024, and January 13, 2025. In both cases, Bitcoin broke below the 50-day moving average ( MA ) and formed a lower low. The January move led to a sharp reversal that retested the all-time high, the analyst noted in a TradingView post on June 23. Bitcoin price analysis chart. Source: TradingView TradingShot also pointed out that the Relative Strength Index ( RSI ) is once again testing the 41.20 support level, reinforcing the similarity between the two patterns. Given the shorter uptrend since the April 7, 2025, low, the analyst suggested this could be a bull flag, often seen as a continuation pattern within a broader bullish cycle. While a medium-term breakout remains unconfirmed until a weekly candle closes above the record high, T radingShot has set a provisional target of $111,900 for the next potential high. Bitcoin’s short-term play Meanwhile, prominent trader Michaël van de Poppe commented in a June 23 X post that Bitcoin’s reclaim of the $100,000 level marked a possible liquidity grab below prior lows, a bear trap that triggered strong buying interest. Poppe noted that Bitcoin may consolidate in the short term, but a breakout above $102,500 could confirm the end of the correction and spark a renewed rally. He identified $103,800 as a key level for bulls to target. #Bitcoin bounces up swiftly. The second option is filled, peak liquidity taken beneath the low at $100,500 and quick reversal upwards. I think we'll stall for a bit, and once it breaks $102,500, it will likely accelerate upwards and then, the correction is over. pic.twitter.com/d6I12ZMhS7 — Michaël van de Poppe (@CryptoMichNL) June 23, 2025 Bitcoin price analysis At press time, Bitcoin was trading at $101,260, down 1.4% on the day and over 3% on the weekly chart. Bitcoin seven-day price chart. Source: Finbold The main challenge now is staying above $100,000; dropping below this level could expose Bitcoin to further downside risk toward $80,000 . Featured image via Shutterstock The post Analyst sets Bitcoin’s next short-term high target after weekend sell-off appeared first on Finbold .",finbold,https://finbold.com/analyst-sets-bitcoins-next-short-term-high-target-after-weekend-sell-off/,"BTC|MARKET|SPONSORED|TRADING","Cryptocurrency news|Bitcoin|BTC|cryptocurrency",cryptocompare
2025-06-23T12:21:39,"5G Chipmaker Sequans Joins the Bitcoin Treasury Strategy Rush","Telecommunication company Sequans (NYSE:SQNS) has announced that it will raise $384 million to launch a bitcoin treasury, according to a press release . The company has agreed to issue and sell $195 million in equity securities and $189 million in convertible secured debentures. “Our bitcoin treasury strategy reflects our strong conviction in bitcoin as a premier asset and a compelling long-term investment,” said Georges Karam, CEO of Sequans. Sequans selected U.S.-based bitcoin-only financial services firm Swan Bitcoin as a partner to assist with its treasury strategy. SQNS shares are up 14% in pre-market trading , changing hands at $2.21 per share. The decision to adopt a bitcoin treasury follows in the footsteps of several publicly-listed companies of late, with healthcare , mining and media companies all acquiring bitcoin in recent weeks. Bitcoin is currently trading at about $101,000, modestly bouncing from its panicky decline over the weekend following the U.S. strikes against Iran.",coindesk,https://www.coindesk.com/business/2025/06/23/5g-chipmaker-sequans-announces-it-will-raise-usd384m-to-kickstart-bitcoin-treasury,"BTC|MINING|REGULATION|SPONSORED|TRADING","Finance|Bitcoin Treasury Reserve Asset|Bitcoin|Swan Bitcoin|News",cryptocompare
2025-06-23T12:20:29,"CNBC: Pomplianos ProCap raises over $750 million, goes public via SPAC as bitcoin treasury bubble grows","CNBC: Pomplianos ProCap raises over $750 million, goes public via SPAC as bitcoin treasury bubble grows $BTC #Bitcoin",coinotag,https://en.coinotag.com/breakingnews/cnbc-pomplianos-procap-raises-over-750-million-goes-public-via-spac-as-bitcoin-treasury-bubble-grows/,"BTC|REGULATION","",cryptocompare
2025-06-23T12:12:59,"SLF price jumps 17% as Self Chain ousts CEO amid $50M fraud allegations","Cryptocurrencies traded in red on Monday as rising geopolitical tensions dumped Bitcoin below $100K during the weekend. While most altcoins display weakness after testing crucial support zones, Self Chain dominates trends with a bold leadership update, which has seen its native token, SLF, gain 17% on its daily price chart. Self Chain has terminated CEO Ravindra Kumar following crucial claims about his involvement in an unauthorized $50 million OTC (over-the-counter) crypto fraud. Ravindra Kumar’s role as CEO has been formally terminated. He will no longer hold any position, responsibility, or association with Self Chain in any capacity going forward. Self Chain @selfchainxyz · Follow Self Chain Governance UpdateDue to recent developments that diverge from the founding vision of Self Chain, we are initiating a decisive leadership transition that reinforces our long-term vision.This marks an important step in realigning Self Chain with its core principles 11:34 am · 23 Jun 2025 61 Reply Copy link Read 31 replies Self Chain’s governance change comes at a time when the community and projects join forces to fight the rising crypto scams. Optimism propelled SLF’s price to the upside even as bears dominated the crypto space after the weekend’s flash dip. Self Chain expels CEO Ravindra According to Self Chain’s X post, Ravindra Kumar will no longer have any official role within the firm. The team emphasized that actions that contradicted the project’s founding goals, especially connected to illegal OTC deals, prompted the CEO’s removal. Due to recent developments that diverge from the founding vision of Self Chain, we are initiating a decisive leadership transition that reinforces our long-term vision. This marks an important step in realigning Self Chain with its core principles of decentralization, transparency, and community-driven development. Meanwhile, Kumar’s fraud allegations attracted community backlash and risked Self Chain’s reputation as a community-driven, transparent LQ blockchain. The CEO’s termination likely reflects the platform’s commitment to safeguarding its status and refocusing on its core values. The team reaffirmed its dedication to Self Chain’s vision. They assured that no other team member participated in the alleged misconduct and that fraudulent activities weren’t linked to the project. The project distanced itself from illegal SLF over-the-counter sales. They emphasized never authorizing any founding member to participate in OTC transactions involving the native token. That means Self Chain didn’t approve and doesn’t recognize any SLF transactions outside official channels. The termination and reassurance helped restore investor confidence, who praised Self Chain’s swift move and transparency. SLF price jumps on community optimism The native token jumped from $0.08183 on its daily chart to a $0.09614 intraday high. That translated to a 17.49% jump, an eye-catching price move as bears dominate the digital assets space. SLF trades at $0.08701 after correcting from its daily high. The 86% uptick in 24-hour trading volume underscored revived investor and trader interest in the altcoin. Chart by CoinMarketCap SLF’s latest price surge demonstrates how crypto communities value transparency. Self Chain braces for a new chapter with a priority on integrity and decentralization. The post SLF price jumps 17% as Self Chain ousts CEO amid $50M fraud allegations appeared first on Invezz",invezz,https://invezz.com/news/2025/06/23/slf-price-jumps-17-as-self-chain-ousts-ceo-amid-50m-fraud-allegations/,"ALTCOIN|BTC|BUSINESS|TRADING|ADMINISTRATIVE EVENTS","Altcoins|Blockchain technology|Crypto|Crypto business|Crypto crime|Crypto regulation|DeFi|Bitcoin",cryptocompare
2025-06-23T12:12:53,"Norway Plans Ban on New Crypto Mining Data Centers to Preserve Power","Norway’s Labour Party government has revealed plans to impose a temporary ban on any new crypto mining data centres that use energy‑heavy proof‑of‑work systems, per Reuters . The proposed rule could kick in Autumn 2025, if approved, and is aimed at preserving electricity capacity for more productive industries. “Cryptocurrency mining is very power-intensive and generates little in the way of jobs and income for the local community,” said Minister for Digitalization Karianne Tung, adding the move reflects the government’s “clear intention to limit the mining of cryptocurrency in Norway as much as possible.” Norway, with its vast renewable hydropower resources, has long attracted Bitcoin miners seeking low‑cost, clean energy. Companies like Kryptovault have established operations outside Oslo — running data centres up to 40 MW, recycling heat to dry wood or warm nearby buildings. Despite the renewable backdrop, mining farms require continuous, high-capacity power resources that regulators increasingly view as better deployed to manufacturing, heating, or AI data workloads.",coindesk,https://www.coindesk.com/tech/2025/06/23/norway-plans-ban-on-new-crypto-mining-data-centers-to-preserve-power,"BTC|MINING","Tech|News",cryptocompare
2025-06-23T12:12:06,"Crypto Financial Services Company Matrixport Explains the Reason for Ethereum's Volatility! Here Are the Details","Crypto financial services firm Matrixport noted in its latest analysis that Ethereum’s (ETH) recent price movements were largely driven by positioning in the futures market, but there was no strong fundamental dynamic to support this rise. Matrixport: Ethereum Price Rises on Futures Positions, Lacks Fundamental Support The report stated that Ethereum’s recent sharp pullback was a result of an overheated market structure due to the use of high leverage. Matrixport emphasized that leverage levels are still high, warning that this could create more selling pressure in the short term. On the other hand, the company stated that Bitcoin (BTC) has tried to turn its direction upwards with reaction purchases in recent days, but considering seasonal trends, this recovery is unlikely to be sustainable. According to Matrixport, it is critical for Bitcoin to defend the $98,000 level to maintain its current technical structure. A breakdown below this level could trigger a broader correction. The analysis also emphasized that due to the intensity of leveraged long positions, sharp downward movements in the market could occur again in the short term. Due to this structure of Ethereum, a warning was made that it could lose value more quickly in the event of a possible negative news flow or market shock. As a result, Matrixport advised investors to be cautious, noting that markets are currently driven by the balance of leveraged derivative positions, not fundamentals. *This is not investment advice. Continue Reading: Crypto Financial Services Company Matrixport Explains the Reason for Ethereum's Volatility! Here Are the Details",bitcoinsistemi,https://en.bitcoinsistemi.com/crypto-financial-services-company-matrixport-explains-the-reason-for-ethereums-volatility-here-are-the-details/,"BTC|BUSINESS|ETH|MARKET|TRADING","Bitcoin|Ethereum|News",cryptocompare
2025-06-23T12:12:00,"XRP Crashed by Bitcoin Inflows But These XRP Rivals Fail to Catch Up","Recently published report reveals that Bitcoin and Ethereum have crashed XRP, ADA and other top coins",utoday,https://u.today/xrp-crashed-by-bitcoin-inflows-but-these-xrp-rivals-fail-to-catch-up,"ADA|BTC|ETH|XRP","XRP",cryptocompare
2025-06-23T12:11:31,"Michael Saylor’s Strategy Adds 245 Bitcoin Amid $21 Million Long-Term BTC Price Forecast","Michael Saylor’s Strategy has expanded its Bitcoin holdings by acquiring an additional 245 BTC, reinforcing its bullish outlook on the cryptocurrency’s long-term value. The purchase, totaling $26 million, was made",coinotag,https://en.coinotag.com/michael-saylors-strategy-adds-245-bitcoin-amid-21-million-long-term-btc-price-forecast/,"BTC|TRADING","Bitcoin|News|BTC",cryptocompare
2025-06-23T12:11:17,"Strategy Added 245 Bitcoin to Holdings Last Week","Strategy (MSTR), the largest publicly listed company holding bitcoin BTC, has increased its holdings by an additional 245 BTC for $26 million. This latest acquisition brings Strategy’s total bitcoin holdings to 592,345 BTC worth nearly $60 billion at bitcoin current price of about $101,000. The company’s average purchase price for its entire bitcoin position now stands at $70,681. The fresh buys were financed through proceeds raised via the at-the-market (ATM) equity offering program for its preferred stock classes, STRK and STRF. MSTR shares are lower by 2.1% premarket as bitcoin continues to reel from the weekend strikes against Iran even as traditional markets have mostly shrugged off the news.",coindesk,https://www.coindesk.com/markets/2025/06/23/strategy-added-245-bitcoin-to-holdings-last-week,"BTC|BUSINESS|MARKET|TRADING|STRK","Markets|MicroStrategy|Bitcoin|News",cryptocompare
2025-06-23T12:10:03,"Strategy buys $26M Bitcoin as prices bleed on geopolitical fears","Michael Saylor’s Strategy bought another 245 Bitcoin last week after doubling down on his long-term BTC price prediction, forecasting BTC to hit $21 million in 21 years.",cointelegraph,https://cointelegraph.com/news/strategy-buys-245-bitcoin-as-btc-bleeds-amid-geopolitical-fears?utm_source=rss_feed&utm_medium=rss&utm_campaign=rss_partner_inbound,"BTC|MARKET|TRADING","",cryptocompare
2025-06-23T12:02:15,"The State of Web3: A Global Look at Where Crypto Is Gaining Ground","The post The State of Web3: A Global Look at Where Crypto Is Gaining Ground appeared first on Coinpedia Fintech News The Web3 ecosystem has gained significant traction in recent years, with more people across the world becoming everyday crypto users. According to the latest report by Crypto.com, the number of crypto owners across the world surged by 14% in 2024 to hit 659 million by the end of the year. The total market capitalization of digital assets has also doubled from $1.7 trillion at the onset of 2024 to around $3.3 trillion as of writing. In this article, we’ll dive into some of the key growth trends in Web3, including where the most adoption has been happening, regulatory factors at play as well as the strategic role of retail-focused exchanges like XBO when it comes to onboarding more stakeholders from emerging markets like the LATAM region and EMEA. Crypto Awareness is on an Uptrend in Emerging Economies According to a recent Web3 global survey by Consensys, 93% of the people surveyed across the world are aware of crypto assets. What’s more intriguing, however, is the level of awareness in emerging countries; most of the respondents who claim to understand crypto were from Nigeria (77%), South Africa (65%) and India (60%). At the same time, crypto ownership is also significantly higher in these emerging economies; Nigeria leads the pack again with the number of respondents who own or have previously owned crypto at 73%, South Africa (68%) the Philippines (54%), Vietnam (54%) and India (52%). The percentage of Africans or Asians who intend to invest in crypto assets within the next one year was also significantly higher compared to other regions. Source: Consensys The U.S. Leads in Institutional Adoption, But Not Yet There… According to Chainalysis ‘ 2024 Global Adoption Index ’, the U.S ranked fourth in the overall indexing which comprised four major metrics; Centralized service value received ranking, Retail centralized service value received ranking, DeFi value received ranking, Retail DeFi value received ranking. What stood out was the amount of institutional capital from U.S. companies that found its way into the crypto market. For context, Bitcoin Spot ETFs attracted over $129 billion in inflows between their launch date on January 10, 2024 and the close of the year. Source: Farside But despite the impressive institutional figures, it is worth noting that retail adoption isn’t picking up as much in the U.S. compared to the emerging economies mentioned above. This can be attributed to the uncertain regulatory environment compared to other advanced regions like Europe where MiCA provisions came into full application on December, 30 2024. On the brighter side, the U.S. senate recently passed the Genius act which sailed through with a 68 – 30 vote; with the bill now going to the House, there is a good chance it will become the first of its kind stablecoin regulatory framework for companies looking to issue or manage this type of digital asset within the U.S.A. At the core, the Genius Act introduces clarity in stablecoin regulation, protecting consumers and reinforcing national security measures when dealing with stablecoins. “The bipartisan GENIUS Act will provide regulatory clarity to this important industry, keep innovation on shore, add robust consumer protection, and reaffirm the dominance of the U.S. dollar,” – noted the co-sponsor of the bill, Sen. Kirsten Gillibrand (D-NY). MiCA Framework Has Positioned Europe for Web3 Innovation As mentioned in the previous section, the MiCA framework is now in full effect. While this regulation had earlier on been met with skepticism, more crypto companies are setting up shop in Europe thanks to the clarity it provides. Some of the notable firms that have received a MiCA license since the framework was adopted include OKX which has established its European base in Malta, Crypto.com also a similar path during the same wave. Both crypto exchanges now have the flexibility to provide their services across the EU owing to the passporting provision for MiCA-licensed entities. The latest survey on Web3 startups indicated that Europe tops the world with over 3900 crypto startups; while this number may have reduced as most of these companies were not MiCA-compliant at the time of the survey, it is evident that the clarity in registration has placed Europe ahead when it comes to Web3 innovation. A Growing Market in LATAM Countries Another worthy observation is the growing Web3 market in LATAM countries. Out of the top 20 in the Chainalysis adoption list, LATAM countries featured prominently with the likes of Brazil, Venezuela, Mexico and Argentina making the cut. What’s particularly interesting in these markets is the levels at which adoption is happening. In Argentina for example, the football governing body, Argentine Football Association (AFA) has partnered with XBO, a leading digital crypto exchange focused on making digital asset trading secure, accessible and user-friendly. This strategic partnership is testament to a growing demand by LATAM countries, from retail to institutions to governments like El Salvador which had already adopted Bitcoin as legal tender but dropped it earlier this year following pressure from the IMF. It is also worth noting that LATAM was the second faster growing region, with a 42.5% year-over-year growth in crypto adoption according to the Chainlysis report. Source: Chainalysis Conclusion Web3 has come a long since Bitcoin’s debut in 2009; today, crypto is the only financial market globally that trades 24/7. But more importantly, we’re witnessing the adoption of Web3 both on a retail and institutional level. On the retail front, emerging economies are driving the metrics while advanced countries like the U.S. lead in institutional activity. The next decade will surely be interesting for Web3, it will be intriguing to witness how the latest regulatory developments steer adoption as well as the growing crypto use cases in the LATAM region, Africa and Central & Southern Asia and Oceania (CSAO).",coinpedia,https://coinpedia.org/information/the-state-of-web3-a-global-look-at-where-crypto-is-gaining-ground/,"ASIA|BTC|EXCHANGE|MARKET|REGULATION","Information",cryptocompare
2025-06-23T12:00:57,"MICROSTRATEGY PURCHASED 245 BITCOINS BETWEEN JUNE 16 – JUNE 22 AT AN AVERAGE PRICE OF $105,856 (TOTAL: $26.0 MILLION)","MICROSTRATEGY PURCHASED 245 BITCOINS BETWEEN JUNE 16 – JUNE 22 AT AN AVERAGE PRICE OF $105,856 (TOTAL: $26.0 MILLION) $BTC #Bitcoins",coinotag,https://en.coinotag.com/breakingnews/microstrategy-purchased-245-bitcoins-between-june-16-june-22-at-an-average-price-of-105856-total-26-0-million/,"BTC","",cryptocompare
