datetime,headline,summary,source,url,categories,tags,api_source
2025-06-09T01:55:37,"BTC Volatility Drops Below 40% Amid Key CPI Data and US-China Trade Talks","COINOTAG News reports that this week’s key macroeconomic event is Wednesday’s Consumer Price Index (CPI) release, which is expected to influence crypto market dynamics significantly. Ahead of this, Tuesday will",coinotag,https://en.coinotag.com/breakingnews/btc-volatility-drops-below-40-amid-key-cpi-data-and-us-china-trade-talks/,"BTC|ETH|MARKET|TRADING","BTC|ETH",cryptocompare
2025-06-09T01:50:47,"Crypto Market Meltdown: Bitcoin Spikes as Trump-Elon Chaos Hits The Market, Is A Bigger Crash Coming?","With the crypto market in a meltdown, Bitcoin (BTC) is seeing a dramatic spike in volatile price movements ignited by a public feud between US President Donald Trump and Tesla CEO Elon Musk, even as FloppyPepe (FPPE) emerges as a key focus for investors. The volatility has pulled focus away from traditional assets and cast fresh doubt on Bitcoin’s (BTC) near-term stability, sparking fears of a wider market crash. According to Coinglass , over $967 million in crypto market liquidations have occurred, confirming that bullish traders were caught off guard. The sheer scale of the chaos underscores the crypto market’s volatile nature and its reaction to macro headlines, particularly those stirred by Donald Trump or Elon Musk. Trump vs Musk: The Feud Behind the Bitcoin (BTC) Plunge Donald Trump and Elon Musk have turned the crypto market into their battlefield, igniting a wave of panic selling across Bitcoin (BTC) and altcoins. Their explosive exchange sent Bitcoin (BTC) plummeting, shedding nearly 3% and pushing it to retest the crucial $100,000 threshold once more. This political clash has pulled the entire crypto market into chaos. Data shows long liquidations for Bitcoin (BTC) totaled over $345 million, fueling analyst speculation regarding the potential for a bigger crash. With Donald Trump and Elon Musk commanding so much public attention, the fallout continues to weigh on sentiment and market direction. FloppyPepe (FPPE) Stands Tall as a Utility-Driven Survivor As the crypto market grapples with the Donald Trump–Elon Musk drama, FloppyPepe (FPPE) stands out as a new breed of altcoin. More than just a meme coin, it offers utility through AI-powered features and a strong commitment to transparency. A SolidProof smart contract audit adds to its credibility in these uncertain times. Its ecosystem includes FloppyAI for live trading insights, FloppyX video generator for short-form content, and Meme-o-Matic for meme creation. These utilities help FloppyPepe (FPPE) remain relevant and active while other projects falter. In a stormy crypto market, these real-world applications provide much-needed substance. Culturally, FloppyPepe (FPPE) draws from Matt Furie’s legacy with hand-drawn art and a hippo conservation pledge. The Floppynomics model includes a 1% supply burn, 1% redistribution, and 1% wildlife donation. This balance of culture, tech, and cause-driven action gives it lasting appeal even as Bitcoin (BTC) wavers. The FloppyPepe (FPPE) Presale Surge Is Just Getting Started While the crypto market is rocked by Donald Trump and Elon Musk’s feud, FloppyPepe (FPPE) is making waves in its Stage 2 presale. Priced at just $0.00000035 , the token has already raised over $363,000 following a record-setting Stage 1 that pulled in $2 million. FloppyPepe (FPPE) further gains backing from top influencers like Nass Crypto, who labeled it an AI gem to his 1 million+ subscribers. This endorsement injected even more momentum into the presale, attracting investors frustrated by Bitcoin (BTC) instability. Demand is growing fast as Stage 2 inches toward its cap and a higher price point. With the code FLOPPY80 , users can still claim an 80% bonus during checkout. This offer adds a powerful incentive for early adoption before listing stages drive prices up. Strategic Plays in Volatile Times The crypto market is once again proving just how vulnerable it is to political theatrics, especially when names like Donald Trump and Elon Musk are involved. Bitcoin (BTC) has faced significant damage, and the ripple effects are being felt across nearly every digital asset. This turmoil is exposing which projects are built to last and which are not. Amidst all this, FloppyPepe (FPPE) is stepping into the spotlight as a viable long-term player. With its unique blend of AI tools, cultural relevance, and verified security, FloppyPepe (FPPE) is offering stability. Its ability to thrive even as Bitcoin (BTC) and the broader crypto market falter is no accident. As Donald Trump and Elon Musk continue to shape global headlines, crypto investors must decide: cling to legacy assets rocked by external drama or pivot to projects offering real utility. FloppyPepe (FPPE) proves that in the chaos of today’s crypto market , there is still room for strategic plays. Join the FloppyPepe (FPPE) presale and community: Website | Whitepaper | Telegram | X (Twitter) Disclaimer: This is a sponsored press release for informational purposes only. It does not reflect the views of Times Tabloid, nor is it intended to be used as legal, tax, investment, or financial advice. Times Tabloid is not responsible for any financial losses. The post Crypto Market Meltdown: Bitcoin Spikes as Trump-Elon Chaos Hits The Market, Is A Bigger Crash Coming? appeared first on Times Tabloid .",timestabloid,https://timestabloid.com/crypto-market-meltdown-bitcoin-spikes-as-trump-elon-chaos-hits/,"BTC|BUSINESS|MARKET|SPONSORED|TRADING","Finance|News",cryptocompare
2025-06-09T01:47:16,"XRP Lawyer urges followers to purchase Bitcoin at $106K","John Deaton, a prominent cryptocurrency lawyer and vocal XRP supporter, is sending a powerful signal to investors: Bitcoin is still a buy — even at $106,000. On social media platform X , Deaton recently sought to explain why he thinks today’s lofty prices carry more opportunity than risks. His approach flies in the face of the notion that one should “buy low.” He makes the case, by contrast, that macro conditions and long-term potential count for more than short-term price tags. Deaton disclosed that 80% of his net worth is in BTC, and his average purchase cost is less than $25,000. Nonetheless, he does not think the current six-figure range is too late. Instead, he says they’re “more asymmetrical,” meaning there’s more upside based on what he deems are more potential gains versus potential losses—despite the more expensive price. He said this in response to Bitcoin Magazine CEO David Bailey’s appeal for people to find some money and purchase BTC today. Deaton also echoed Bailey’s call but cautioned that citizens living paycheck-to-paycheck should not risk their homes or take out loans to spend money to invest in crypto. Regardless, he maintains that Bitcoin is one of the best current stores for value. Deaton’s criticisms are rooted in larger concerns about the global economy. He cited growing national debt levels in the US, the re-imposition of Trump-era tariffs, and endless money printing from central banks as major red signs. In his view, these are gradually undermining confidence in fiat currencies. For Deaton, BTC is the answer. It’s decentralized, with only 21 million coins ever to be produced, and it can’t be manipulated by governments or printed into infinity. “Bitcoin is a hedge against the collapse of fiat,” Deaton said in a podcast interview last month. Institutions and countries are jumping in Another element of Deaton’s argument is the wave of institutional and even state adoption of Bitcoin. Strategy (formerly known as MicroStrategy) is leading the charge. The company has been in the news for its aggressive purchase of BTC. The firm now owns more than 200,000 BTC, the equivalent of tens of billions of dollars, and is adding to its holdings each week. In the last seven days alone,16 companies have been added to an expanding list of businesses incorporating Bitcoin into their corporate treasury. But businesses are not the only ones being buoyed. Governments are also starting to take Bitcoin more seriously. Rep.Tim Burchett introduced a bill in Congress to codify Trump’s executive order into a law that created a US Strategic Bitcoin Reserve. Countries such as Pakistan, Ukraine, and Ireland are also eyeing similar proposals and exploring the possibility of utilizing BTC n their reserves or foreign exchange plans. Critics groan as studies take off But not everyone is as sanguine as Deaton, even as the movement gathers steam. Dr. Peter Schiff, economist, gold supporter, and outspoken critic of Bitcoin, argued on Twitter that Bitcoin’s moonshot is nothing more than hype. He thinks it still has no inherent value and is far too erratic to be a true haven. But Deaton isn’t fazed. He acknowledges that he has “confirmation and wealth-preservation bias.” Still, he maintains that Bitcoin is the most secure long-term asset in our current political instability and economic storm world. Deaton tells investors to look past price charts. He says they should instead wonder: Where is the world headed? The solution, according to Deaton, is none other than BTC. KEY Difference Wire helps crypto brands break through and dominate headlines fast",cryptopolitan,https://www.cryptopolitan.com/xrp-lawyer-urges-buying-bitcoin-at-106k/,"BTC|BUSINESS|FIAT|TRADING|XRP","News|Bitcoin",cryptocompare
2025-06-09T01:15:42,"Bitcoin Shows Early Signs of a Potential Macro Bottom Amid Recent Market Shakeout","Bitcoin’s recent sharp correction may have set the stage for a significant rebound, signaling a potential macro bottom in the crypto market. The market shakeout cleared weak hands, with key",coinotag,https://en.coinotag.com/bitcoin-shows-early-signs-of-a-potential-macro-bottom-amid-recent-market-shakeout/,"BTC|MARKET","Bitcoin|News|BTC",cryptocompare
2025-06-09T01:02:12,"Michael Saylor Dismisses Quantum Computing Threat to Bitcoin, Calls It a Marketing Gimmick","Michael Saylor, founder of Strategy, recently addressed concerns about the impact of quantum computing on Bitcoin during an interview with CNBC, as reported by Coindesk. He emphasized that the Bitcoin",coinotag,https://en.coinotag.com/breakingnews/michael-saylor-dismisses-quantum-computing-threat-to-bitcoin-calls-it-a-marketing-gimmick/,"BTC","BTC",cryptocompare
2025-06-09T01:01:26,"DOJ Seizes $7.74M in Bitcoin Linked to Possible North Korean Sanctions Evasion and Weapons Funding","The U.S. Department of Justice has successfully seized $7.74 million in cryptocurrency linked to North Korea’s covert sanctions evasion and weapons funding operations. North Korean IT specialists exploited global remote",coinotag,https://en.coinotag.com/doj-seizes-7-74m-in-bitcoin-linked-to-possible-north-korean-sanctions-evasion-and-weapons-funding/,"ASIA|BTC","News|BTC",cryptocompare
2025-06-09T01:00:26,"Is Bitcoin primed to leap? – THESE signs point to a macro bottom at…","Could the recent dip be the springboard that sets Bitcoin up to leap higher?",ambcrypto,https://ambcrypto.com/is-bitcoin-primed-to-leap-these-signs-point-to-a-macro-bottom-at/,"BTC","Bitcoin|BTC Trading View|News|News 1|Social|Trading View|ambcrypto",cryptocompare
2025-06-09T00:31:35,"XRP’s Unexpected Plunge Suggests Possible Volatility Amid Mixed Signals in Crypto Market","Shiba Inu (SHIB) shows signs of a potential breakout amid strong whale activity despite stagnant price movements. XRP experiences unexpected volatility with a technical breakout hinting at a possible short-term",coinotag,https://en.coinotag.com/xrps-unexpected-plunge-suggests-possible-volatility-amid-mixed-signals-in-crypto-market/,"BTC|MARKET|SHIB|TRADING|XRP","Bitcoin|News|BTC|SHIB|XRP",cryptocompare
2025-06-09T00:25:39,"Bitcoin Liquidation Intensity Could Surge to $532M or $976M as Price Approaches $107K and $104K Thresholds","According to recent data from Coinglass, Bitcoin’s price movements around key thresholds could trigger significant liquidation events on major centralized exchanges (CEX). Should Bitcoin surpass the $107,000 mark, the aggregated",coinotag,https://en.coinotag.com/breakingnews/bitcoin-liquidation-intensity-could-surge-to-532m-or-976m-as-price-approaches-107k-and-104k-thresholds/,"BTC|TRADING","BTC",cryptocompare
2025-06-09T00:12:44,"Coinbase Reports Possible 82% Reduction in Account Freezing Issues, Bitcoin Stability Noted","Coinbase has successfully reduced account freezing issues by 82%, marking a significant operational improvement for the leading cryptocurrency exchange. CEO Brian Armstrong highlighted the company’s commitment to transparency and ongoing",coinotag,https://en.coinotag.com/coinbase-reports-possible-82-reduction-in-account-freezing-issues-bitcoin-stability-noted/,"BTC|ETH|EXCHANGE","Bitcoin|Ethereum|News|BTC|ETH",cryptocompare
2025-06-09T00:09:55,"Trump Media Considers $12B Bitcoin Acquisition Amid New Strategic Partnerships","Trump Media & Technology Group (TMTG) is preparing to raise $12 billion to acquire Bitcoin, signaling a bold move in corporate cryptocurrency investment. The initiative involves strategic financial partnerships, including",coinotag,https://en.coinotag.com/trump-media-considers-12b-bitcoin-acquisition-amid-new-strategic-partnerships/,"BTC|TECHNOLOGY","News|BTC",cryptocompare
2025-06-09T00:01:00,"Shiba Inu (SHIB): Big Chance, Be Ready For XRP Surprises Upcoming, Bitcoin (BTC) Ready to Dive?","Bulls are not ready for push as multiple red flags arise",utoday,https://u.today/shiba-inu-shib-big-chance-be-ready-for-xrp-surprises-upcoming-bitcoin-btc-ready-to-dive,"BTC|SHIB|XRP","XRP",cryptocompare
2025-06-09T00:00:47,"Cathie Wood Says Bitcoin Hinting at Risk-On Market Structure, Sees BTC Holding Uptrend Against Gold","ARK Invest CEO Cathie Wood says that Bitcoin ( BTC ) is likely to continue surging higher based on its performance against one red-hot commodity. In a new YouTube update, Wood shares a Bitcoin-to-gold chart that she says is still in an uptrend, partially due to BTC’s “anti-fragile” nature in recent years. “This uptrend has not been broken. Again, this aligns with the net bullish risk-on kind of market that we think we’re in, and I guess you could call the markets anti-fragile, which is a description used in Bitcoin. It’s been able to withstand all kinds of turmoil and we think that the markets, the equities markets, are following Bitcoin in this regard.” Source: ARK Invest/YouTube Wood is also optimistic about the crypto industry given regulatory clarity from the Trump administration and what she believes is an incoming reconfiguration of the financial services space. “We think this is a very powerful movement. We think the financial services sector is going to reconfigure completely in the next five to ten years, and that of course Bitcoin and now Circle and of course Coinbase as well. Robinhod, [and] others… SoFi is now moving back into crypto in a big way now that regulatory clarity is here. So, thank goodness for that.” Follow us on X , Facebook and Telegram Don't Miss a Beat – Subscribe to get email alerts delivered directly to your inbox Check Price Action Surf The Daily Hodl Mix Disclaimer: Opinions expressed at The Daily Hodl are not investment advice. Investors should do their due diligence before making any high-risk investments in Bitcoin, cryptocurrency or digital assets. Please be advised that your transfers and trades are at your own risk, and any losses you may incur are your responsibility. The Daily Hodl does not recommend the buying or selling of any cryptocurrencies or digital assets, nor is The Daily Hodl an investment advisor. Please note that The Daily Hodl participates in affiliate marketing. Generated Image: Midjourney The post Cathie Wood Says Bitcoin Hinting at Risk-On Market Structure, Sees BTC Holding Uptrend Against Gold appeared first on The Daily Hodl .",dailyhodl,https://dailyhodl.com/2025/06/08/cathie-wood-says-bitcoin-hinting-at-risk-on-market-structure-sees-btc-holding-uptrend-against-gold/,"BTC|BUSINESS|FIAT|MARKET|TRADING","Bitcoin|Financeflux|BTC|Cathie Wood|News",cryptocompare
2025-06-08T23:58:42,"Bitcoin Transaction Activity Declines to Lowest Level Since 2023 Amid Large Holder Accumulation","Bitcoin’s transaction activity has reached its lowest point since October 2023, signaling notable shifts in network usage and market behavior. Despite the decline in daily transactions, large holders continue to",coinotag,https://en.coinotag.com/bitcoin-transaction-activity-declines-to-lowest-level-since-2023-amid-large-holder-accumulation/,"BTC|MARKET","News|BTC",cryptocompare
2025-06-08T23:52:26,"Michaël van de Poppe Suggests Possible Timing for Altseason Amid Ethereum and Bitcoin Market Trends","Crypto analyst Michaël van de Poppe offers a fresh perspective on the elusive altseason, emphasizing timing and value over hype in the evolving crypto market. Van de Poppe highlights that",coinotag,https://en.coinotag.com/michael-van-de-poppe-suggests-possible-timing-for-altseason-amid-ethereum-and-bitcoin-market-trends/,"BTC|ETH|MARKET|MEME","Analysis|News|BTC|ETH|MEME",cryptocompare
2025-06-08T23:45:21,"Michael Saylor on $13M Bitcoin Forecast: ‘I’m Getting More Bullish’","Michael Saylor is ultra bullish on bitcoin as institutional adoption explodes, supply tightens, and regulatory clarity fuels his bold 30% annual growth forecast for two decades. Michael Saylor’s Bitcoin Outlook: ‘I’m Very Bullish’ Michael Saylor, executive chairman of software intelligence firm Microstrategy (Nasdaq: MSTR), which now operates under the name Strategy, expressed during a June",bitcoin.com,https://news.bitcoin.com/michael-saylor-on-13m-bitcoin-forecast-im-getting-more-bullish/,"BTC|TECHNOLOGY|TRADING","Markets and Prices|Bitcoin (BTC)|michael saylor",cryptocompare
2025-06-08T23:39:28,"Asia Morning Briefing: Michael Saylor Downplays BTC's Quantum Threat","Good Morning, Asia. Here's what's making news in the markets: Welcome to Asia Morning Briefing, a daily summary of top stories during U.S. hours and an overview of market moves and analysis. For a detailed overview of U.S. markets, see CoinDesk's Crypto Daybook Americas. BlackRock calls Quantum computers, with their ability to outperform classical binary computers and break traditional encryption, a threat to crypto . So surely BTC would price this in, as the threat of computers soon being able to break the encryption that enables the scarcity of bitcoin is an existential one. But on a recent CNBC appearance, Strategy's Michael Saylor downplayed quantum's threat to BTC, arguing that the Bitcoin protocol would implement a software upgrade – just like any other tech company – when the threat becomes imminent. ""It's mainly marketing from people that want to sell you the next quantum yo-yo token,"" Saylor said on CNBC. ""Google and Microsoft aren't going to sell you a computer that cracks modern cryptography because it would destroy Google and Microsoft – and the U.S. Government and the banking system."" Already, there are a number of proposals about how to secure Proof of Work against the quantum threat, including from BTQ , a startup building quantum-proof crypto hardware. One Bitcoin developer has put forward a draft Bitcoin Improvement Protocol that proposes a hard fork which would move everyone's wallets to quantum-secure addresses. ""Bitcoin is a protocol; the software gets upgraded every year,"" Saylor concluded, arguing that the bigger security threat for bitcoin is phishing. Saylor's view isn't a universal one, however. A recent report from Presto Research argued that the crypto industry is ""unprepared"" for the coming quantum threat. With BTC above $100K and the market getting ready to challenge another all-time high, traders just don't seem to be concerned. As CRCL has a Blockbuster IPO, the True Market Size of Stablecoins Remains a Mystery. Circle recently had a blockbuster initial public offering, and is set to open the U.S. trading week Monday at over $107 – an impressive rally over its opening price of $69. The number of stablecoins in circulation – the market cap of the asset category – is a well-known fact. Issuance can be seen on-chain after all, and that number comes in at $254 billion, according to CoinGecko data . But figuring out the volume of stablecoins used in payments is a little trickier. In a recent thread on X , Nic Carter, partner at Castle Island Ventures and the cofounder of blockchain data aggregator Coinmetrics, parsed through the available data and found that there's a huge discrepancy in the numbers. Estimating the genuine share of stablecoin transactions driven by payments rather than trading is complicated due to challenges like MEV bot interference, duplicative on-chain transactions, and spam activity designed purely to inflate metrics. Recent analyses illustrate this uncertainty starkly. A top-down heuristic from Visa and Allium estimates stablecoin transaction volumes at roughly $9 trillion annually as of May 2025. However, this figure broadly encompasses trading, DeFi activity, and settlements—not purely payments. In contrast, more detailed bottom-up analyses offer narrower but clearer insights. Fireblocks, a major custody provider, reported annual verified stablecoin payments of around $232 billion, compared with a significantly larger $2.12 trillion in trading volumes among its clients, suggesting that genuine payment transactions represent about 10% of their total stablecoin activity. Similarly, a targeted joint study by Artemis and Dragonfly sampled 20 stablecoin-focused payment providers directly. It calculated a conservative annualized payment volume of approximately $72.3 billion, acknowledging this as a probable undercount given limited sampling. In comparison to that $72.3 billion figure at the high end, Carter writes, is $232 billion, underscoring the substantial uncertainty around how extensively stablecoins are genuinely used as a payment mechanism. As for Circle, the stablecoin issuer doesn't provide a figure in its IPO filing on how much USDC is used for payments, only pointing to general transaction volume. News Roundup Coinbase, BiT Global Settle Wrapped Bitcoin (wBTC) Delisting Lawsuit BiT Global and Coinbase have settled their legal dispute over Coinbase's delisting of wrapped bitcoin (wBTC), CoinDesk previously reported . According to a joint court filing, BiT Global agreed to dismiss its lawsuit with prejudice—meaning the case cannot be refiled—and each company will cover its own legal costs. BiT Global initially sued Coinbase last year, claiming the delisting unfairly damaged wBTC's liquidity and reputation, while favoring Coinbase’s competing token, cbBTC. Coinbase cited concerns over crypto billionaire Justin Sun’s involvement with wBTC, labeling it an ""unacceptable risk,"" though specific settlement terms beyond the dismissal were not disclosed. Winklevoss Twins' Crypto Exchange Gemini Files Confidentially With SEC for IPO Gemini, the cryptocurrency exchange and custody platform founded by billionaires Cameron and Tyler Winklevoss, has confidentially filed paperwork with the U.S. Securities and Exchange Commission (SEC) to go public, CoinDesk previously reported . The IPO details, including the size and valuation, remain undisclosed, but Gemini has already engaged Goldman Sachs and Citigroup as financial advisors, positioning itself prominently among crypto-native firms entering traditional markets. This filing follows the successful IPO of stablecoin issuer Circle, whose shares surged dramatically upon debuting on the New York Stock Exchange. Gemini's planned IPO represents a significant step for crypto companies seeking broader acceptance in mainstream finance, although the timing of the offering will depend on the SEC's review and market conditions. Market Movements: BTC: Bitcoin trades flat at $105,600.30 after recovering from an intraday dip, as miners' recent surge in exchange transfers signals potential volatility ahead. ETH: Ethereum held strong above critical $2,500 support amid volatility, closing bullishly near $2,534, as BlackRock's ETH ETF nears $5 billion on sustained institutional inflows. Gold: Gold trades slightly lower at $3,314.92 but heads for weekly gains, supported by weak U.S. jobs data despite easing U.S.-China tensions. Nikkei 225: Japan's Nikkei 225 opens higher at 37,741.61 (+0.50%), extending recent gains after winning sessions in two of the past three trading days",coindesk,https://www.coindesk.com/markets/2025/06/08/asia-morning-briefing-michael-saylor-downplays-btcs-quantum-threat,"ASIA|BTC|EXCHANGE|MARKET|TRADING","Markets|Asia|btc|Michael Saylor|News",cryptocompare
2025-06-08T23:30:48,"Altcoin Rally Score Model Suggests Possible Conditions for Ethereum-Led Altseason 3.0","The Altcoin Rally Score (ARS), an innovative AI-driven model, has been introduced to predict the onset of Altseason 3.0 by analyzing key market and on-chain indicators. This model integrates four",coinotag,https://en.coinotag.com/altcoin-rally-score-model-suggests-possible-conditions-for-ethereum-led-altseason-3-0/,"ALTCOIN|BTC|ETH|MARKET|TRADING","Analysis|Bitcoin|Ethereum|News|BTC|ETH",cryptocompare
2025-06-08T23:26:02,"Bitcoin ETF Flows Show Divergence as BlackRock Sees Outflows and Bitwise Records Inflows","Bitcoin ETFs experienced notable fund flow fluctuations recently, with major players like BlackRock seeing significant outflows while Bitwise recorded impressive inflows, highlighting contrasting investor behaviors. This divergence underscores the evolving",coinotag,https://en.coinotag.com/bitcoin-etf-flows-show-divergence-as-blackrock-sees-outflows-and-bitwise-records-inflows/,"BTC|BUSINESS|FLOW","News|BTC|FLOW",cryptocompare
