datetime,headline,summary,source,url,categories,tags,api_source
2025-06-08T23:06:48,"BiT Global Withdraws Lawsuit Against Coinbase Over wBTC Delisting Amid Wrapped Token Market Competition","BiT Global has officially withdrawn its lawsuit against Coinbase concerning the delisting of wrapped Bitcoin (wBTC), marking a significant development in the competitive wrapped token market. The resolution sees both",coinotag,https://en.coinotag.com/bit-global-withdraws-lawsuit-against-coinbase-over-wbtc-delisting-amid-wrapped-token-market-competition/,"BTC|EXCHANGE|MARKET","News|BTC|WBTC",cryptocompare
2025-06-08T22:37:28,"Bitcoin Shows Potential Buy Signal Amid Major Blockchain Stock Offering Developments","Bitcoin’s recent buy signal has reignited optimism in the cryptocurrency market, marking a pivotal moment for investors and traders alike. Simultaneously, a major blockchain company’s upcoming stock offering underscores the",coinotag,https://en.coinotag.com/bitcoin-shows-potential-buy-signal-amid-major-blockchain-stock-offering-developments/,"BLOCKCHAIN|BTC|BUSINESS|MARKET|FLOW","News|BTC|FLOW",cryptocompare
2025-06-08T22:24:20,"Watch Out: Significant Token Unlocks in 16 Altcoins Next Week – Here’s the Day-by-Day, Hour-by-Hour List","Although the cryptocurrency market has been in a general downward trend this week, led by Bitcoin, the BTC price, which bottomed at around $ 100,000 on Friday, experienced a weekend recovery, climbing above $ 106,000 and is preparing to close the week in the green zone. The source of the decline during the week was the surprising debate between Elon Musk and Donald Trump and the subsequent decline in US stock prices. In addition, there will be a large number of token unlocks in many altcoins in the new week. Here is the token unlock calendar that we have prepared specially for you as Bitcoinsistemi.com. (All times are stated as UTC+3 Türkiye time) Movement (MOVE) Market Value: $369.24 million Token Amount to be Unlocked: $7.40 million (1.99% of market value) Date: June 9, 2025, 03:00 Xai (XAI) Market Value: $95.05 million Token Amount to be Unlocked: $2.66 million (2.80% of market value) Date: June 9, 2025, 09:00 Cheelee (CHEEL) Market Value: $294.34 million Token Amount to be Opened: $43.17 million (14.68% of market value) Date: June 10, 2025, 12:00 ChainGPT (CGPT) Market Value: $85.63 million Token Amount to be Unlocked: $1.20 million (1.40% of market value) Date: June 10, 2025, 18:00 io.net (IO) Market Value: $125.36 million Token Amount to be Opened: $7.68 million (6.13% of market value) Date: June 11, 2025, 03:00 BitMEX (BMEX) Market Value: $31.95 million Token Amount to be Unlocked: $1.00 million (3.13% of market value) Date: June 11, 2025, 03:00 Nereus Token (NRS) Market Value: $4.42 million Token Amount to be Opened: $2.12 million (47.92% of market value) Date: June 11, 2025, 03:00 Related News: Michael Saylor is Back in the Spotlight: Bitcoin Move Could Be Announced Tomorrow Moca Network (MOCA) Market Value: $230.84 million Token Amount to be Opened: $15.38 million (6.68% of market value) Date: June 11, 2025, 17:00 Aptos (APT) Market Value: $2.99 billion Token Amount to be Opened: $53.56 million (1.79% of market value) Date: June 12, 2025, 03:00 Suilend (SEND) Market Value: $27.94 million Token Amount to be Opened: $3.68 million (13.17% of market value) Date: June 12, 2025, 03:00 Game7 (G7) Market Value: $10.26 million Token Amount to be Unlocked: $1.77 million (17.24% of market value) Date: June 12, 2025, 03:00 DIMO (DIMO) Market Value: $19.95 million Token Amount to be Unlocked: $1.52 million (7.71% of market value) Date: June 12, 2025, 21:00 Immutable (IMX) Market Value: $971.40 million Token Amount to be Opened: $14.42 million (1.48% of market value) Date: June 13, 2025, 08:00 BounceBit (BB) Market Value: $58.32 million Token Amount to be Opened: $4.91 million (8.42% of market value) Date: June 13, 2025, 16:00 WalletConnect Token (WCT) Market Value: $80.51 million Token Amount to be Unlocked: $1.74 million (2.16% of market value) Date: June 15, 2025, 03:00 StarkNet (STRK) Market Value: $443.75 million Token Amount to be Opened: $16.99 million (3.83% of market value) Date: June 15, 2025, 15:00 *This is not investment advice. Continue Reading: Watch Out: Significant Token Unlocks in 16 Altcoins Next Week – Here’s the Day-by-Day, Hour-by-Hour List",bitcoinsistemi,https://en.bitcoinsistemi.com/watch-out-significant-token-unlocks-in-16-altcoins-next-week-heres-the-day-by-day-hour-by-hour-list/,"ALTCOIN|BTC|BUSINESS|MARKET|APT","Altcoin|News",cryptocompare
2025-06-08T21:57:07,"Here’s What to Watch for in Altcoins This Week","Cryptocurrency analyst The DeFi Investor shared the altcoin projects to follow in the new week on his social media account. The prominent projects that will witness important developments for users this week are as follows: Sonic (S): The project will announce the new S2 airdrop next week. Virtuals (VIRTUAL): The project’s new infrastructure, called Agent Commerce Protocol, is launching soon. This system will allow AI agents to perform on-chain tasks. HOME: DeFi application HOME will hold its official token launch on June 10. Bitcoin (BTC): On June 9, the U.S. Securities and Exchange Commission (SEC) will hold a roundtable on decentralized finance (DeFi). Related News: U.S. Department of Justice Makes Important Cryptocurrency Announcement HUMA: Investments for the PayFi network, dubbed Huma 2.0, will open on June 11. Spark (SKY): The Spark protocol will soon offer native cross-chain interaction. MultiversX (EGLD): Voting begins tomorrow for Barnard, a major upgrade to the MultiversX network. This upgrade will bring on-chain governance to the network. Aptos (APT): $53 million worth of APT tokens will be unlocked on June 12. *This is not investment advice. Continue Reading: Here’s What to Watch for in Altcoins This Week",bitcoinsistemi,https://en.bitcoinsistemi.com/heres-what-to-watch-for-in-altcoins-this-week/,"ALTCOIN|BLOCKCHAIN|BTC|APT|EGLD","Altcoin|News",cryptocompare
2025-06-08T21:53:25,"Bitcoin Faces Potential Challenges Amid Growing Political and Institutional Influence on Decentralization","The evolving relationship between Bitcoin and political institutions signals a pivotal shift in the decentralized finance landscape. Institutional investments are reshaping market dynamics, introducing both credibility and challenges to Bitcoin’s",coinotag,https://en.coinotag.com/bitcoin-faces-potential-challenges-amid-growing-political-and-institutional-influence-on-decentralization/,"BTC|MARKET","News",cryptocompare
2025-06-08T21:16:55,"Gold May Outperform Bitcoin as $100,000 BTC Resistance Raises Market Uncertainty, Suggests Bloomberg Analyst","Bitcoin’s recent surge to the $100,000 mark appears to have hit a significant resistance level, while gold quietly outperforms both Bitcoin and traditional stocks amid ongoing market uncertainty. Data from",coinotag,https://en.coinotag.com/gold-may-outperform-bitcoin-as-100000-btc-resistance-raises-market-uncertainty-suggests-bloomberg-analyst/,"BTC|FIAT|MARKET","Analysis|Bitcoin|News|BTC",cryptocompare
2025-06-08T20:59:50,"Best Crypto to Buy Now with Web3 IPOs and Venture Capital on the Rise","Despite some early momentum, Bitcoin’s price these past few days has mostly hovered in place, uninspiring at the surface. But price alone doesn’t always tell the full story. In the background, foundational shifts are playing out as the buzz around a stablecoin giant’s public debut has spilled beyond crypto circles and into Wall Street chatter. Another major exchange has quietly filed to go public, engaging heavyweight advisors and signaling serious institutional intent. And while this unfolds, venture capital is pouring into crypto-native startups at a pace that few expected in what’s supposedly a shaky market. The price may be sleepy, but everything else is stirring. From boardrooms to browser tabs, crypto’s relevance is being negotiated loudly and in plain view. What These Developments Signal for Crypto’s Next Chapter The stablecoin company Circle’s public debut has forced both traditional investors and crypto skeptics to pay attention. The stock opened at $31 and is now trading around $107 , marking a gain of more than 200% in just a few days. This is not a speculative token pump. It is a regulated company with a stablecoin product, being priced and traded on the New York Stock Exchange like any other major financial player. Its IPO is already being discussed across investment desks, and it has set the tone for what could become a wave of listings. ⚡️ NEW: Gemini has confidentially submitted a draft registration statement for a proposed initial public offering (IPO). pic.twitter.com/4hAKWanCD0 — Crypto Briefing (@Crypto_Briefing) June 6, 2025 Top crypto exchange Gemini is likely to be next. The exchange has confidentially submitted its paperwork to the SEC and is working with advisors like Goldman Sachs and Citigroup to take the company public. This is a firm that has already resolved multiple regulatory issues and is now positioning itself to enter public markets just as confidence in crypto-linked businesses begins to return. Outside public listings, venture capital activity is building quickly. The last week of May alone saw over $160 million raised across at least fifteen different crypto startups. The deals spanned everything from Bitcoin treasury services to AI-focused applications and stablecoin infrastructure. These are not meme projects or NFT drops. They are backed by established funds and include serious institutional names. The return of this kind of funding, especially in a market where asset prices are flat, suggests that long-term bets are already being placed and that key players see this as a time to build, not to wait. Best Crypto to Buy Now – Using the Current Market Sentiment for 10x Profits Snorter While most Layer 2 projects are racing to rebrand Bitcoin with abstract ideas and speculative jargon, Snorter takes a different approach. It leans into the absurdity of internet culture while offering real-time trading tools that mimic what users have come to expect from more established platforms. That contrast is its advantage. In a time when crypto startups are attracting major venture capital and traditional firms are walking into the space with IPO filings, Snorter reads like an experiment gone right. It doesn’t need a billion-dollar valuation or a polished PR team to feel relevant. Its chart movement, community interaction, and growing user activity do that job. Behind the memes and irreverent tone is a bot-powered architecture that lets users monitor and mimic token activity across Solana’s Pump.fun ecosystem. It is a bot, yes, but one with a brain wired to sentiment and market flow. And when VC interest points toward AI-linked and automation-driven crypto tools, Snorter quietly checks the boxes that investors are hunting for. It is still early, both in terms of development and visibility, but the mechanics are in place. Still in its presale phase, the project has managed to garner attention from major publications while being covered by top crypto YouTubers like ClayBro and many others which is usually a move that generates publicity and trust among investors. Price-wise, the project’s SNORT token may be likely to see a huge surge in demand in the coming weeks as the concept gains popularity and demand for AI-powered bots in the space increases. SUBBD Circle’s IPO was a milestone, not just for the company but for the creator economy’s ongoing shift toward ownership and autonomy. That same transition is already being explored from a different angle by SUBBD , a project built around giving creators control over their audiences, their monetization structures, and their long-term value. With traditional platforms still focused on ad revenue and short-term views, SUBBD builds something closer to a marketplace where creators are the product and the platform simultaneously. Its native token is also called the SUBBD token, a currency that allows fans to invest directly in a creator’s potential. Think of it as a public listing, but for individuals instead of corporations. That premise has found unexpected support during a time when investors are clearly looking for utility-led projects. The recent surge in venture capital for crypto startups working with AI and financial tools suggests there is appetite for models that break existing norms, and SUBBD sits neatly within that thesis. It is structured, measurable, and entirely blockchain-native. There’s also a growing awareness that Web3 needs real engagement tools, not just gimmicks. SUBBD’s structure allows creators to build income streams that are recurring, transparent, and not subject to arbitrary platform decisions. In a moment when investors are rewarding crypto products that operate with real-world use cases and tangible incentives, SUBBD brings both. It is not about replacing YouTube or Twitch. It is about changing who benefits when someone clicks subscribe. Solaxy Solaxy may not be walking into a stock exchange like Circle, but the structure it is building is just as relevant for the long game. Designed as a Layer 2 protocol bridging Solana and Ethereum, Solaxy is tuned for a world where cross-chain compatibility is no longer optional. With major crypto companies filing for IPOs and stablecoins being discussed in mainstream financial circles, infrastructure is becoming the priority. That is precisely where Solaxy fits in. The project operates with a focus on fast, low-fee transactions across major ecosystems. But its deeper value is in how it treats staking. Solaxy’s token, SOLX, is not just a placeholder or a governance label. It is wired into the network’s operations, offering users the ability to earn through high-yield staking mechanisms that support liquidity and engagement. At a time when capital is moving back into crypto, projects with meaningful, self-sustaining utility tend to rise above the rest. $SOLX has got what YOU need. 🛸🪐45M Raised! 🔥 pic.twitter.com/hamUNI7Hgz — SOLAXY (@SOLAXYTOKEN) June 6, 2025 Solaxy is also taking cues from institutional preferences. Transparency, layered security, and sustainable yield mechanics are increasingly what separate serious platforms from short-lived trends. Set to launch soon, the SOLX token’s presale is likely to gain traction due to it being one of the most successful ones this quarter, having raised more than $45 million at the time of writing. Solaxy incorporates those ideas with a model that doesn’t overpromise or lean on hype. It may not grab headlines like a public offering, but it is being quietly built for longevity. In a cycle where speed and scalability will again become central topics, and as big names like Apple and Uber explore crypto payments, a protocol like Solaxy feels unusually well-timed. Bitcoin Hyper The market rarely rewards ideas that arrive too early or too late. Bitcoin Hyper is trying to land exactly in the middle. It’s not trying to replace Bitcoin but to fix where it falls short: transaction speed and scalability. As the space watches IPO filings, venture capital flows, and traditional companies dipping into stablecoins, there is renewed focus on infrastructure that can actually support growth. Bitcoin Hyper sees this as its entry point. The project uses a multi-pronged approach, pulling in technology from Optimistic and ZK Rollups along with Solana-based speed via a smart contract validation layer. That setup allows Bitcoin to move as if it were built for high-speed DeFi without losing its original security logic. This type of architecture is the kind that VCs are looking for now. Not hype, but technical models that answer clear problems. That is part of the reason Bitcoin Hyper’s presale has already drawn early attention, with steady capital inflow and ongoing community interest. Utility-wise, the token is designed for actual usage within its Layer 2 environment. It has functions tied to gas savings, staking incentives, and cross-chain interoperability. While most projects still depend on marketing spikes, Bitcoin Hyper is shaped more like a tool than a trend. And in a cycle where companies are going public, raising hundreds of millions, and launching ETFs, that practical angle could be the difference between fading away and getting picked up for something much bigger. Conclusion The current stream of developments points to a market that may be entering a structurally bullish phase, even if price charts have yet to reflect it. Institutional interest is no longer theoretical, with crypto firms actively going public and venture capital returning in strength across multiple layers of the ecosystem. This kind of momentum often precedes broader rallies, especially when backed by real funding and regulatory progress. The projects mentioned above each reflect aspects of that shift from AI integration and token utility to infrastructure and staking innovation. If this pro-crypto wave continues to gather pace, they could be among the strongest gainers in the weeks ahead, making them well worth tracking now rather than later. Disclaimer: This is a sponsored article and is for informational purposes only. It does not reflect the views of Crypto Daily, nor is it intended to be used as legal, tax, investment, or financial advice.",cryptodaily,https://cryptodaily.co.uk/2025/06/best-crypto-to-buy-now-with-web3-ipos-and-venture-capital-on-the-rise,"BTC|BUSINESS|EXCHANGE|MARKET|TRADING","More News",cryptocompare
2025-06-08T20:57:56,"Bitcoin May Face Short-Term Correction Amid Long-Term Holder Selling Pressure and Key Support Tests","Bitcoin navigates a critical juncture as it ends a recent downtrend, facing key support levels at $103,700 and $95,600 amid selling pressure from long-term holders. Market dynamics suggest that sustained",coinotag,https://en.coinotag.com/bitcoin-may-face-short-term-correction-amid-long-term-holder-selling-pressure-and-key-support-tests/,"BTC|MARKET","Analysis|News|BTC",cryptocompare
2025-06-08T20:55:35,"Anticipated Bitcoin Surge Could Break Records","Bitcoin may reach new record levels as demand surpasses supply, says Analyst Pentoshi. Institutional investors' insatiable demand could push Bitcoin to $120,000 this month. Continue Reading: Anticipated Bitcoin Surge Could Break Records The post Anticipated Bitcoin Surge Could Break Records appeared first on COINTURK NEWS .",cointurken,https://en.coin-turk.com/anticipated-bitcoin-surge-could-break-records/,"BTC|BUSINESS","Bitcoin (BTC)",cryptocompare
2025-06-08T20:31:02,"Bitcoin Nears $107,500 Resistance After Reclaiming $106,000 Amid Renewed Momentum","Bitcoin has surged past the $106,000 threshold, signaling a renewed bullish momentum in the cryptocurrency market amid recent volatility. After a brief dip below $101,000, Bitcoin’s quick recovery highlights robust",coinotag,https://en.coinotag.com/bitcoin-nears-107500-resistance-after-reclaiming-106000-amid-renewed-momentum/,"BTC|MARKET|TRADING","Bitcoin|News|AUCTION|BTC",cryptocompare
2025-06-08T20:28:59,"U.S. and China May Discuss Rare Earth Supply Resumption Amid Market Volatility, Bitcoin Reacts","The upcoming summit between U.S. President Donald Trump and Chinese President Xi Jinping in London marks a critical step toward resolving rare earth mineral supply disruptions that have rattled global",coinotag,https://en.coinotag.com/u-s-and-china-may-discuss-rare-earth-supply-resumption-amid-market-volatility-bitcoin-reacts/,"ASIA|BTC|MARKET|REGULATION|FLOW","News|BTC|FLOW",cryptocompare
2025-06-08T20:08:04,"Bitcoin May Face Over $1 Billion in Daily Profit-Taking Amid Market Maturity and Capital Rotation","Bitcoin is experiencing significant daily profit-taking, with seasoned holders cashing out over $1 billion, signaling a pivotal moment in the current market cycle. Data from Glassnode reveals that this profit",coinotag,https://en.coinotag.com/bitcoin-may-face-over-1-billion-in-daily-profit-taking-amid-market-maturity-and-capital-rotation/,"BTC|BUSINESS|MARKET","Analysis|News|BTC",cryptocompare
2025-06-08T20:06:51,"Bitcoin Sees Potential Surge Amid Metaplanet’s Accumulation Plans and Trump-Linked Institutional Interest","Bitcoin has experienced a significant surge, reaching near $107,000, fueled by Metaplanet’s strategic accumulation plans and growing institutional interest amid geopolitical tensions. This upward momentum reflects a broader trend of",coinotag,https://en.coinotag.com/bitcoin-sees-potential-surge-amid-metaplanets-accumulation-plans-and-trump-linked-institutional-interest/,"BTC|DOGE|ETH","Bitcoin|News|BTC|DOGE|ETH",cryptocompare
2025-06-08T20:00:43,"US Ethereum ETFs Record 4 Consecutive Weeks Of Positive Inflows — Details","After a horrendous start to the year, the United States-based spot Ethereum ETFs (exchange-traded funds) have managed to turn their fortune around over the past few weeks. This positive trend mirrors the shift in sentiment amongst Ethereum investors since the start of the year’s second quarter. Ethereum ETFs Hit 15 Consecutive Days Of Capital Inflows According to data from SoSoValue, the US Ethereum ETFs registered a net inflow of $25.22 million on Friday, June 6. This latest daily performance marked the 15th straight day of capital inflows — the second-longest such streak since launch in July 2024 — for exchange-traded funds. BlackRock’s iShare Ethereum Trust (with the ticker ETHA) accounted for the majority of the inflows on Friday, posting $15.86 million to close the week. Grayscale’s Ethereum Mini Trust (ETH) was the only other US-based Ethereum ETF fund to record any activity, with a total daily net inflow of $9.37 million. This $25.22 million single-day performance brought the total net weekly inflow to a little over $281 million in the past week, representing the fourth consecutive week of capital influx for the Ethereum-based products. In the previous trading week (May 26 to May 30), the Ethereum ETFs posted a similar $285.84 million total net inflow. According to market data, the US-based spot Ethereum ETFs have registered $856.81 million in total net inflows over the span of these four weeks. Ultimately, these positive performances show a change in the way investors are looking at Ethereum at the moment. Unsurprisingly, this positive shift in investor sentiment has been reflected in the price performance of ETH over the past few weeks. The altcoin has witnessed renewed interest and demand , with its value up by more than 15% in the last 30 days. As of this writing, the Ethereum price stands at around $2,521, reflecting an over 1% in the last 24 hours. According to data from CoinGecko, the altcoin’s value is down by 0.8% in the last seven days. Inflows For Bitcoin ETFs Slowing Down The spot Bitcoin ETFs in the US also had their own streak going for the majority of the last month before it ended on Friday , May 29. The crypto-linked financial products have had a mixed performance of daily inflows and outflows since then. According to data from SoSoValue, the Bitcoin exchange-traded funds recorded a net outflow of $128.81 million in the past week. On Friday, the BTC ETFs saw a total of $47.82 million withdrawn, bringing the trading week to a close on a negative note.",bitcoinist,https://bitcoinist.com/ethereum-etfs-record-four-weeks-of-positive-inflows/,"AAVE|ADA|ALTCOIN|ASIA|ATOM|AVAX|AXS|BCH|BLOCKCHAIN|BTC|BUSINESS|COMMODITY|COMP|DOGE|DOT|ETC|ETH|EXCHANGE|FIAT|FIL|LINK|LTC|LUNA|LUNC|MANA|MARKET|MATIC|MINING|REGULATION|SHIB|SOL|SPONSORED|TECHNOLOGY|TRADING|TRX|UNI|USDT|WALLET|XLM|XMR|XRP|XTZ|ZEC|ZRX|OTHER|RESEARCH|APT|ARB|BITTENSOR|BNB|CRO|WIF|FDUSD|HBAR|ICP|IMX|INJ|LDO|MNT|NEAR|NOT|PEPE|SUI|TON|USDC|AR|FLOKI|ONDO|BGB|BONK|BRETT|RUNE|FET|PYTH|SEI|FLR|JUP|BSV|AGX|ENS|ZK|WLD|XAUT|CAKE|OM|APE|LPT|HNT|XDC|FTT|BTG|PEOPLE|MOG|PYUSD|AXL|MEME|RAY|SSV|ARKM|ETHFI|MX|AIRDROP|TOKEN SALE|FORKS|TOKEN LISTING AND DELISTING|ADMINISTRATIVE EVENTS","Ethereum|ETH|ETH Price|Ethereum ETFs|ethereum price",cryptocompare
