datetime,headline,summary,source,url,categories,tags,api_source
2025-06-08T09:15:55,"Michael Saylor Doubling Down on Bitcoin Price Prediction As BTC Holds $100,000 Level","The former chief executive of the software firm Strategy, formerly known as MicroStrategy, is doubling down on his massive price prediction for Bitcoin ( BTC ) as it continues to trade above the six-figure level. In a new interview with CNBC Television, Bitcoin firebrand Michael Saylor says that as institutions enter the top crypto asset by market cap, BTC should experience a supply shock and a surge in price. “There’s been a surge of Bitcoin treasury companies. There’s like 100 public companies or more. They’re holding Bitcoin on their balance sheet. And every single week, there’s another announcement. I think that it used to be that we’re focused on the halvings. But at this point, the entire natural supply of Bitcoin is only 450 Bitcoin available for sale every day. That’s sort of about $45 – $50 million a day at this level. That is all being consumed by the Bitcoin treasury companies. And the Bitcoin ETFs (exchange-traded funds) are coming on strong. So I’m very bullish.” Saylor goes on to slightly upgrade his price prediction for the flagship digital asset, noting that he believes it will outpace other key asset classes, such as real estate and the S&P 500. “My forecast in July of last year in Nashville was Bitcoin’s going to appreciate 29% a year on average for the next 21 years. And that moves it from it was about mid $60s, $65,000 to $13 million a coin in the year 2045. I’m getting more bullish on that forecast, but I’m certainly comfortable forecasting 30% a year ARR (annual recurring revenue) on average for the next 20 years. I think Bitcoin’s up 57% a year for the past four and a half years. Again, that’s double the Mag seven. That’s quadruple the S&P. That’s eight times real estate and bonds are down 4%. So Bitcoin is smashing everything.” Strategy is currently the world’s largest corporate holder of Bitcoin, coming in at 580,955 BTC worth just over $61.3 billion, according to data from BitcoinTreasuries. Bitcoin is trading for $105,431 at time of writing, a fractional decrease on the day. Follow us on X , Facebook and Telegram Don't Miss a Beat – Subscribe to get email alerts delivered directly to your inbox Check Price Action Surf The Daily Hodl Mix Disclaimer: Opinions expressed at The Daily Hodl are not investment advice. Investors should do their due diligence before making any high-risk investments in Bitcoin, cryptocurrency or digital assets. Please be advised that your transfers and trades are at your own risk, and any losses you may incur are your responsibility. The Daily Hodl does not recommend the buying or selling of any cryptocurrencies or digital assets, nor is The Daily Hodl an investment advisor. Please note that The Daily Hodl participates in affiliate marketing. Generated Image: Midjourney The post Michael Saylor Doubling Down on Bitcoin Price Prediction As BTC Holds $100,000 Level appeared first on The Daily Hodl .",dailyhodl,https://dailyhodl.com/2025/06/08/michael-saylor-doubling-down-on-bitcoin-price-prediction-as-btc-holds-100000-level/,"BTC|BUSINESS|MARKET|REGULATION|TRADING","Bitcoin|Trading|BTC|Crypto|institutional investing|Michael Saylor|MicroStrategy|News|strategy|trading",cryptocompare
2025-06-08T09:09:42,"Tether CEO Indicates No Immediate Plans for USDT Public Valuation Amid Market Uncertainty","Tether CEO Paolo Ardoino confirms there are no immediate plans for a public valuation of USDT, amid ongoing market uncertainties and regulatory scrutiny. USDT remains a cornerstone stablecoin, essential for",coinotag,https://en.coinotag.com/tether-ceo-indicates-no-immediate-plans-for-usdt-public-valuation-amid-market-uncertainty/,"BTC|ETH|MARKET|USDT","News|BTC|ETH|USDT",cryptocompare
2025-06-08T09:05:49,"Japan introduces revised ‘crypto-friendly’ Payment Services Act - What should investors expect?","The upper house of Japan’s National Diet passed the revised Payment Services Act (PSA) on Friday, resulting in big changes ahead for enterprises dealing with crypto. The new category of “intermediary business” alleviates the need for middleman companies in Japan to register as exchanges, but the bill has other implications, some of which bring stricter rules and greater centralization. Originally submitted to the Japan Diet back in March, the amendments to the Payment Services Act passed on Friday , and are being praised as pro-crypto.Perhaps drawing the most attention is the establishment of a new category of “intermediary business,” meaning businesses who introduce or act as liaisons between exchangers and users. Such groups will no longer have to register as an exchange with the government’s regulator, the Financial Services Agency (FSA).A separate registration, with relaxed rules, will be introduced for these intermediaries. Image: Chihiro Sakai . What’s in the new law: Stablecoins, intermediary businesses, emergency outflow barriers Under FSA discussion since November last year, the amended Payment Services Act is being cited by regional media as likely removing barriers for gaming companies and others that want to do business related to cryptocurrency and digital assets.Interest from Mercari, SBI Securities, and Monex Securities has already been reported regarding registering as an “intermediary business.”Some key changes to the act are as follows: Creation of “intermediary” businesses with relaxed registration rules. Creation of a separate registration system for exchanges. New ability to issue a legal order requiring overseas-based crypto firms to hold assets in Japan to prevent outflows in case of bankruptcy. “Trust-type” stablecoin backing assets can now be held partially (up to 50%) in low-risk investments like government bonds, instead of being 100% backed in fiat by the issuer. Stricter rules for businesses deemed overseas “collection agencies” providing e-commerce services. FSA chart detailing changes to trust-type stablecoin regulations. Source: FSA . The amended law, set to take effect within one year, essentially cements strict AML/CFT requirements and rules for registered exchange operators and e-commerce collection agencies, eases entry to the regulated crypto ecosystem for liaison businesses (which must be under the supervision of a registered operator), prevents overseas exchanges from running off with Japanese users’ money, and helps banks issue stablecoins more easily. Centralization, stricter rules — Drifting further from Satoshi While it’s understandable that gaming enterprises and others are happy to hear the news of the amendment’s success, and removal of barriers to entry, Tokyo and Japan-based adherents to Satoshi Nakamoto’s original idea of separation of money and state will see the law as a nothing-burger. Or a poison apple, more accurately.Massive banks can now issue stablecoins more easily, leveraging state credit, while overseas, permissionless markets and competitors are further targeted as threats.As Coinpost reported in 2022 of a Mitsubishi UFJ working group focused on stablecoins: “The aim is to put a stop to the current situation in which funds are flowing mainly into overseas stablecoins, including through investment in overseas Web3 (decentralized app) projects, use of major NFT markets, and even cover trading in cryptocurrency exchanges.” Businesses that handle money deemed cross-border “collection agencies” involved with activities such as e-commerce can also be regulated under the revised PSA. Source: FSA . Crackdown on foreign payment agents deemed cross-border “collection agencies,” such as those involved with e-commerce, is a slippery slope. The FSA notes it will not go after low-risk activities or require registration from low-risk intermediaries, while threatening a crackdown on online casinos and fraud, noting that “Those who conduct illegal remittances, such as online casinos and investment fraud, will be subject to regulation as unregistered businesses” under the new amendment.As with all legislation, arbitrary political interpretation allows for endless abuse. Previously, cross-border collection agencies were not required to register as a funds transfer business with the state. Now, they must rely on the FSA’s assurances only, in a state of relative limbo.Fortunately for the advocates of peer-to-peer, permissionless transactions, no matter what the new regulations bring, use of actual crypto — not regulated, bank-issued stablecoins — remains one path toward economic freedom and peace in Japan, in a time of a faltering yen, rice shortages , and mainstream monetary malaise. Your crypto news deserves attention - KEY Difference Wire puts you on 250+ top sites",cryptopolitan,https://www.cryptopolitan.com/revised-payment-services-act-japan/,"ASIA|BTC|BUSINESS|EXCHANGE|MARKET|REGULATION","Regulation|FSA|JPY",cryptocompare
2025-06-08T09:00:06,"Binance May Adjust BTC Leverage and Margin Tiers in June 2025 to Enhance Platform Stability","Binance has announced significant updates to its margin and leverage tiers for USDⓈ-M perpetual contracts, effective June 6, 2025, impacting major cryptocurrencies like BTC and ETH. These adjustments are designed",coinotag,https://en.coinotag.com/binance-may-adjust-btc-leverage-and-margin-tiers-in-june-2025-to-enhance-platform-stability/,"BTC|ETH|EXCHANGE|BNB","Bitcoin|Ethereum|News|BTC|ETH",cryptocompare
2025-06-08T08:49:45,"House Financial Services Committee to Probe Bitcoin-Related “Crypto Crimes” in June 8 MWI Hearing","On June 8th at 9:00 am ET, the House Financial Services Committee, chaired by Maxine Waters, will convene a Minority and Women Inclusion (MWI) hearing to scrutinize allegations related to",coinotag,https://en.coinotag.com/breakingnews/house-financial-services-committee-to-probe-bitcoin-related-crypto-crimes-in-june-8-mwi-hearing/,"BTC","BTC",cryptocompare
2025-06-08T08:29:36,"Best Crypto to Buy Now as the UK Lifts Ban on Crypto ETNs for Retail Investors","The Financial Conduct Authority (FCA) of the UK is all set to lift its ban on cryptocurrency exchange-traded notes (ETNs) for retail investors. The FCA had banned ETNs in January 2021 , citing their volatility and complexity for retail investors. However, because we’re seeing increasing warmth towards cryptocurrency across the globe, the UK doesn’t want to be left behind. Keep reading to find out more about the UK’s decision regarding ETNs, how the US also has major pro-crypto legislation in the works, and what the best crypto to buy now is in light of these developments. UK & UK Embrace Crypto For those unaware, an ETN is a debt security instrument offered by recognized entities. Its value is tied to an underlying asset, which, in the case of crypto, is a specific coin. As the price of the underlying asset goes up, the price of the ETN will also increase, and vice versa. It’s worth noting that crypto ownership in the UK has increased from 18% in 2024 to 24% in 2025 . This is more than that of the US. Naturally, a growth like this calls for a comprehensive regulatory design to regulate the ownership and use of digital assets in the country. Meanwhile, in the US, the Guiding and Establishing National Innovation for US Stablecoins (GENIUS) Act is expected to go for a floor vote soon enough. The GENIUS Act aims to regulate various aspects of stablecoins, such as permitted issuers, transparency, consumer protection, federal and state-level oversight authority, and legal classification. All in all, a friendlier regulatory environment will lead to a more thriving crypto market. Bitcoin recently made an all-time high of $112K , and with positive and proactive legislative support, it might soon hit $150K, too. To hop on the crypto train and make the most of its momentum, consider investing in the following altcoins. 1. Snorter Token ($SNORT) – Best Crypto to Buy Now, the Fastest and Most Affordable Trading Bot Increased crypto adoption will directly impact the growth of meme coins, which is already among the most profitable niches of the crypto space. As a result, Snorter Token could see massive growth in the coming weeks. It’s a Telegram-native trading bot designed to snipe (buy) the best meme coins as soon as they’re launched using a contact address or pool ID. This way, it will help you outsmart the bots and whales circling like sharks in the crypto market. Snorter Bot is mighty secure, too. It’s got honeypot and rugpull detection, mint trap detection, real-time blacklist scans, and freeze alerts. Other useful features include copy-trading tools, portfolio tracking, and the lowest trading fees (just 0.85%) of all competitors if you hold $SNORT. You can become an early investor in this awesome meme coin with real utility by buying into its presale. The Snorter Token presale is fairly new but has still managed to raise over $575K. Each token is currently priced at just $0.0947. 2. BTC Bull Token ($BTCBULL) – Best Bitcoin-Themed Meme Coin Offering Free $BTC Airdrops BTC Bull Token ($BTCBULL) will help you directly benefit from Bitcoin’s upcoming bull run, but at a fraction of the cost. It’ll do so in two ways: First, you’ll profit from a substantial increase in $BTCBULL’s price. According to our predictions, BTC Bull Token can reach $0.0096 by 2026 – a 3.7x jump from its current price of $0.00255. Second, you’ll benefit from BTC Bull Token’s free Bitcoin airdrops. A striking feature, the aforementioned $BTC airdrops will take place when Bitcoin reaches $150K and $200K for the very first time. However, only those who hold their $BTCBULL tokens in Best Wallet and participate in the airdrop events on social media will be eligible for free $BTC. Even better for $BTCBULL owners, the project will regularly shave off a part of the token supply. This will increase the crypto’s demand, which would then, in all likelihood, crank up its price. Buy BTC Bull Token now for just $0.00255 each. The project has emerged as one of the best crypto presales , with nearly $7M in early investor funding. 3. KoKoK The Roach ($KOKOK) – Viral New Meme Coin with Massive Potential KoKoK The Roach ($KOKOK) is a new meme coin that launched towards the end of May but has risen to become a force to reckon with in the entire crypto space. $KOKOK is up over 310% since its inception , including a chunky 28% gain over just the past seven days. This fascinating ‘disgusting’ meme coin is proof that degens have enough love to share with other animals, too, besides cute dogs, cats, and frogs. ‘The King of the Drain Pipes’ might be a fitting description for $KOKOK, but the fact remains that it could soon surge past its all-time high of around $0.20 and become one of the greatest meme coins of this year. It’s currently trading at $0.1724, with a market capitalization of $35M and a trading volume of $1.13M (up 110% over the past 24 hours). Increasing Crypto Adoption Notwithstanding, DYOR Is Necessary Despite the market’s increasing bullish outlook on the back of pro-crypto regulatory reforms, there’s no guaranteeing any returns on specific coins. The crypto market is highly unpredictable and volatile, so kindly do your own research before investing. Our articles are purely informational, not financial advice.",newsbtc,https://www.newsbtc.com/news/best-crypto-to-buy-now-as-the-uk-lifts-ban-on-crypto-etns-for-retail-investors/,"BTC|BUSINESS|MARKET|TRADING|AIRDROP","Cryptocurrency Market News",cryptocompare
2025-06-08T08:26:41,"Bitcoin May Face Challenges Surpassing $100,000 Amid Market Saturation, Gold Outperformance Considered","Bitcoin’s future price trajectory remains a hot topic as Bloomberg analyst Mike McGlone suggests a potential $100,000 ceiling for the leading cryptocurrency. Market saturation with an overwhelming number of coins",coinotag,https://en.coinotag.com/bitcoin-may-face-challenges-surpassing-100000-amid-market-saturation-gold-outperformance-considered/,"BTC|FIAT|MARKET|TRADING","Analysis|News|BTC",cryptocompare
2025-06-08T08:26:07,"Crisis Resolved for Altcoin Experiencing Major Issues with Coinbase: Agreement Reached","The legal dispute between Coinbase and BiT Global over the delisting of BiT Global’s Wrapped Bitcoin (wBTC) token from the Coinbase platform has concluded with a settlement between the parties. BiT Global has “definitively” dropped its lawsuit filed in the Northern District Court of California, meaning it cannot be refiled. Under the agreement, each side will cover its own legal fees. BiT Global claimed in a lawsuit filed last year that Coinbase had unjustifiably delisted wBTC, damaging the token’s liquidity and reputation. The company claimed that Coinbase aimed to highlight its own competing product, cbBTC, with this decision. Related News: Yet Another Hack Attack: Significant Losses Reported for These Altcoins Coinbase defended its decision to delist, stating that the token posed an “unacceptable risk” and that it was concerned that “it could end up in Justin Sun’s hands.” Chinese-born cryptocurrency billionaire Justin Sun became associated with wBTC through his partnership with BiT Global in August of last year. Following this development, Coinbase began to question Sun’s role in the project. Interestingly, after Sun joined the project as an advisor, World Liberty Financial abandoned cbBTC and resumed supporting wBTC. However, the lawsuit did not provide any additional details about the content of the agreement. The parties only agreed that they would cover their own legal costs. *This is not investment advice. Continue Reading: Crisis Resolved for Altcoin Experiencing Major Issues with Coinbase: Agreement Reached",bitcoinsistemi,https://en.bitcoinsistemi.com/crisis-resolved-for-altcoin-experiencing-major-issues-with-coinbase-agreement-reached/,"ALTCOIN|BTC|EXCHANGE|REGULATION","Altcoin|News",cryptocompare
2025-06-08T08:23:10,"Tether’s USDT May Support New ‘Stable’ Blockchain Amid Leading Revenue and $1 Trillion Transfers","Tether is set to revolutionize stablecoin utility by launching a new blockchain, Stable, which will utilize USDT as gas fees, leveraging its robust revenue streams and market dominance. With over",coinotag,https://en.coinotag.com/tethers-usdt-may-support-new-stable-blockchain-amid-leading-revenue-and-1-trillion-transfers/,"BLOCKCHAIN|BTC|BUSINESS|SOL|USDT","Bitcoin|News|BTC|JTO|SOL|TRX|UNI|USDT",cryptocompare
2025-06-08T08:20:42,"Trader Who Has Never Sold XRP Plans to Turn Holdings to $10 Million. Here’s How","XRP has faced heightened market uncertainty in recent weeks, with its value fluctuating after briefly losing a critical support level. After falling below $2.20, the asset staged a minor recovery, stabilizing near $2.17. These shifts have sparked renewed discussion about XRP’s long-term performance. While many traders adjusted their positions following the dip, one market participant has chosen to maintain a firm stance. Known publicly as Crypto Beast (@cryptobeastreal), the trader revealed that he holds a sizable XRP position and has no plans to reduce or liquidate it. According to information he shared, Crypto Beast owns approximately 1.83 million XRP, acquired at an average cost of $0.836. This suggests the purchase was made before the November 2024 price surge, when XRP began a remarkable climb. This climb culminated in a multi-year peak of $3.39, but Crypto Beast did not sell any of his tokens during or after the price surge. Never sold my XRP If XRP reaches $5.45 this will be worth $10 million dollars. Smaller than my $16 million ETH bag, but still alot of money. I’ll keep you updated on my position. pic.twitter.com/2dwQrr75rY — Crypto Beast (@cryptobeastreal) June 6, 2025 The $10 Million XRP Gain Target At the time of his public update, XRP was priced at around $2.13, bringing the value of his investment to roughly $3.9 million. Despite having gained more than $2.3 million in unrealized profit, the trader indicated that his objective is a portfolio value of $10 million. To meet this target, XRP would need to reach $5.45 per token, a 151% increase from current market levels. Experts have recently spotted bullish technical indicators on the XRP’s chart, and a popular analyst has predicted that the digital asset will soon make more millionaires , potentially setting the stage for Crypto Beast to fulfill his goal. We are on twitter, follow us to connect with us :- @TimesTabloid1 — TimesTabloid (@TimesTabloid1) July 15, 2023 Crypto Beast’s investment is fully allocated on the spot market, meaning there is no exposure to forced liquidations due to leverage. This allows him to hodl through downturns without facing mandatory position closures. Holding for the Long Term Spot holdings are stable, unlike high-leverage trades. James Wynn, who became famous for PEPE gains, lost a total of $125 million via high-leverage Bitcoin trades on Hyperliquid after sharp corrections triggered massive liquidations of his long position. This event shocked the crypto world. Some have referenced it as a sign of market manipulation by exchanges . Some commentators have encouraged investors to adopt a long-term outlook. Figures like Edoardo Farina have advised accumulating XRP, revealing that he doesn’t intend to sell significant amounts until the asset hits $100 . He has also advised investors to move their tokens to cold storage , protecting their investments from manipulation or loss due to problems with exchanges. Investors who follow his advice may become millionaires like Crypto Beast if XRP rises. Disclaimer : This content is meant to inform and should not be considered financial advice. The views expressed in this article may include the author’s personal opinions and do not represent Times Tabloid’s opinion. Readers are advised to conduct thorough research before making any investment decisions. Any action taken by the reader is strictly at their own risk. Times Tabloid is not responsible for any financial losses. Follow us on X , Facebook , Telegram , and Google News The post Trader Who Has Never Sold XRP Plans to Turn Holdings to $10 Million. Here’s How appeared first on Times Tabloid .",timestabloid,https://timestabloid.com/trader-who-has-never-sold-xrp-plans-to-turn-holdings-to-10-million-heres-how/,"BTC|BUSINESS|MARKET|TRADING|XRP","Cryptocurrency|News|XRP|XRP Holders|XRP Price",cryptocompare
2025-06-08T08:11:33,"Bitcoin Market Sentiment Surges to Greed as Fear and Greed Index Climbs to 62","According to Alternative Data reported by COINOTAG News on June 8th, the cryptocurrency Fear and Greed Index has surged to 62, marking a notable increase from yesterday’s 52. This shift",coinotag,https://en.coinotag.com/breakingnews/bitcoin-market-sentiment-surges-to-greed-as-fear-and-greed-index-climbs-to-62/,"BTC|MARKET","BTC",cryptocompare
2025-06-08T08:11:07,"This Week’s Biggest Gainers and Losers as BTC Price Reclaims $105K (Weekend Watch)","Bitcoin’s gradual ascent continued in the past 24 hours, as the asset managed to bounce above $105,000 and even challenged $106,000 briefly. Since most altcoins are quite sluggish on a daily scale, we will examine in more detail their weekly performances, where TAO and CRO stand in one corner, while HYPE, LEO, ICP, and TRX are in the other. BTC Above $105K The world’s largest cryptocurrency tried to break out at the beginning of the business week from its consolidation range but was stopped at $106,000 and $106,500 on Monday and Tuesday. The following rejections drove it south to the lower boundary, but the bulls went on the offensive once again on Thursday. However, bitcoin was stopped once again at $106,000, but this time, the correction was a lot more violent. Perhaps influenced by the ongoing spat between US President Trump and Tesla CEO Musk, BTC’s price tumbled hard and went to a multi-week low of $100,400 (on Bitstamp). As it came close to a breakdown below the coveted $100,000 level, the situation reversed and bitcoin started to recover some ground. By Friday noon, it had rebounded to around $105,000. Slightly more volatility followed, but BTC was ultimately stopped at $106,000 yesterday and now trades around $500 lower. Its market capitalization has risen to just shy of $2.1 trillion, while its dominance over the alts stands tall at 61.5%. BTCUSD. Source: TradingView Alts Up and Down The weekly scale shows that HYPE has emerged as the top gainer, having surged by almost 9%. As a result, the high-flyer now sits above $35, just less than $5 away from its recent peak. ICP follows suit with an 8% weekly increase, while LEO, TRX, and AAVE are next. On the opposite scale are TAO (-11%), GT (-5.3%), and CRO (-5.2%). SOL, DOGE, ADA, AVAX, and SHIB are also about to close the weekly candle in the red. The total crypto market cap has added around $30 billion since yesterday and is up to $3.410 trillion on CG. Cryptocurrency Market Overview. Source: QuantifyCrypto The post This Week’s Biggest Gainers and Losers as BTC Price Reclaims $105K (Weekend Watch) appeared first on CryptoPotato .",cryptopotato,https://cryptopotato.com/this-weeks-biggest-gainers-and-losers-as-btc-price-reclaims-105k-weekend-watch/,"BTC|MARKET|TRADING|BITTENSOR|CRO","BTCEUR|BTCGBP|BTCUSD|BTCUSDT|Crypto News|featured1|Market Updates",cryptocompare
2025-06-08T08:09:30,"Is $100K Bitcoin the Ceiling? Mike McGlone Thinks So","Gold still shining brighter even after Bitcoin managed to surpass $100,000 milestone",utoday,https://u.today/is-100k-bitcoin-the-ceiling-mike-mcglone-thinks-so,"BTC|FIAT","Bitcoin Price Prediction|BTC",cryptocompare
