datetime,headline,summary,source,url,categories,tags,api_source
2025-06-08T09:55:57,"Bitcoin Core Developers and Users Discuss Potential Improvements in Transaction Relay and Network Governance","Bitcoin Core developers and the wider community are actively debating the optimization of transaction relay processes and the evolving role of core software in the Bitcoin ecosystem. This ongoing dialogue",coinotag,https://en.coinotag.com/bitcoin-core-developers-and-users-discuss-potential-improvements-in-transaction-relay-and-network-governance/,"BTC|TECHNOLOGY","News|BTC|Core",cryptocompare
2025-06-08T09:52:25,"James Wynn Opens 40x Leveraged Bitcoin Short Amid Repeated Liquidations","James Wynn, a prominent trader, recently disclosed on Platform X his strategic decision to short Bitcoin (BTC). Wynn cited repeated liquidation events when taking long positions as the primary catalyst",coinotag,https://en.coinotag.com/breakingnews/james-wynn-opens-40x-leveraged-bitcoin-short-amid-repeated-liquidations/,"BTC|ZRX","BTC",cryptocompare
2025-06-08T09:50:10,"Tether's CEO clams IPO rumors after Circle's NYSE debut","Tether CEO Paolo Ardoino has cooled down talks about the company going public anytime soon. Ardoino took to blogging platform X, saying that the stablecoin issuer has no such plans, days after its rival Circle made its debut on the New York Stock Exchange (NYSE). Ardoino mentioned it while he was replying to a post about the company’s valuation. The post came days after Circle, which is behind the USDC stablecoin, entered the public market. Circle performed well on its first day, with its shares climbing 167% on its first trading session on the NYSE. The company’s shares opened at $31, before moving up by 235% in the first hours of negotiation, before closing at $82 at the end of the day. The performance showed that there is a growing market appetite for the stablecoin business. Tether CEO discusses Tether’s valuation Ardoino also addressed the speculation raised by Artemis CEO Jon Ma, who was speaking about Tether’s valuation. Ma mentioned that if Tether, who backs the USDT stablecoin were to go public, it would rank as the 19th largest company globally. He backed his claim with a table showing different companies and their current valuation. The table had companies like Microsoft, Nvidia, Apple, and Amazon, among others. Tether valuation at 515B is a beautiful number. Maybe a bit bearish considering our current (and increasing) Bitcoin + Gold treasury, yet I'm very humbled. Also truly excited for the next phase of growth of our company. Thank you everyone❤️ https://t.co/exZc05SDwd — Paolo Ardoino 🤖 (@paoloardoino) June 7, 2025 In his postulation, he noted that Tether, with a valuation of around $515 billion, will be larger than global giants like Costco and Coca-Cola. However, Ardoino was not impressed with the valuation. The Tether CEO noted that while the $515 billion valuation was a beautiful number, it might actually be too low for the company. “Maybe a bit bearish considering our current (and increasing) Bitcoin + gold treasury, yet I’m very humbled,” Ardoino said. Ardoino added that he is excited for the next stage of Tether’s growth . Meanwhile, popular Bitcoin advocate Anthony Pompliano also backed Ardoino’s stance, highlighting that the company has what it takes to hit the $1 trillion mark eventually. The stance was also shared by another prominent figure in the community, Jack Mallers, who mentioned that he hopes the company eventually reaches the valuation very soon. New inroads and investments Tether-backed stablecoin USDT currently ranks as the third-largest in the cryptocurrency market by market cap. It is valued at $154.83 billion at the time of writing, according to CoinMarketCap. The company has also been making investments in the crypto market, announcing in April that it would become a majority owner of Twenty One Capital, a new Bitcoin treasury company founded by Strike executive Jack Mallers. Despite its recent launch, Twenty One has become the third-largest holder of Bitcoin, coming behind Strategy (MicroStrategy) and mining firm MARA Holdings. Some days ago, Tether moved 37,229 Bitcoin, worth about $3.9 billion into the Bitcoin native financial platform. According to his post on X, he made three transactions totaling 25,812 BTC worth about $2.7 billion at the time before making a $730 million transfer and following it up with a $500 million BTC transfer. Twenty One Capital wants to develop Bitcoin-native capital markets infrastructure, allowing products like lending, custody, and asset issuance to operate directly on Bitcoin rails. It also has plans to go public using a Special Purpose Acquisition Company (SPAC) merger that would involve Cantor Fitzgerald’s Cantor Equity Partners, which values the company at $3.6 billion. Cryptopolitan Academy: Tired of market swings? Learn how DeFi can help you build steady passive income. Register Now",cryptopolitan,https://www.cryptopolitan.com/tether-ceo-cools-talks-about-going-public/,"BTC|MARKET|REGULATION|TRADING|USDT","Tether|BTC|Circle|USDT",cryptocompare
2025-06-08T09:48:20,"Bitcoin can liquidate $15B in shorts with 10% BTC price uptick — Data","Bitcoin traders eye key levels to hold and reclaim into the weekly close, but the chances of a major liquidity grab are growing.",cointelegraph,https://cointelegraph.com/news/bitcoin-can-liquidate-15b-shorts-10-btc-price-uptick-data?utm_source=rss_feed&utm_medium=rss&utm_campaign=rss_partner_inbound,"BTC|TRADING","",cryptocompare
2025-06-08T09:47:57,"AI could destroy crypto within five years | Opinion","Disclosure: The views and opinions expressed here belong solely to the author and do not represent the views and opinions of crypto.news’ editorial. AI has been evolving at breakneck speed and is becoming an indispensable and useful tool across many industries for business and consumer-facing functions, including the finance industry. The fast adoption of AI is largely driven by its low barriers to entry, where anyone with a computer and internet connection can interact with AI and develop it. Yet, as AI grows, it brings severe risks: AI is already sufficiently advanced to assist human-led hacking through LLMs and AI agents. You might also like: AI is crypto’s redemption, and the next generation’s big bet | Opinion Within five years, AI will develop capabilities to hack on another, far more dangerous front: through Artificial General Intelligence. Once AGI is achieved, it won’t be controlled by people. Unless governments and regulators step in now (even then, the chances of controlling it are slim), AGI will escape the confines of its creators and autonomously hack cryptocurrency encryptions… and entire global digital systems. The rise of artificial intelligence AI has seen a dramatic surge in the commercial arena, one of its most recent iterations being AI agents. These are finely tuned, complicated systems, geared to perform specialized tasks and make decisions with minimal human intervention. Already transforming the tech space and becoming a useful everyday tool for many basic human interactions, such as self-driving cars, fraud detection , on-chain trading, and application creation. The next evolution will be AGI , a complex system that can do everything a human can. It will not need human prompts or intervention; it will simply have real-time autonomy: the ability to perform tasks, but also recognise when a task needs performing. This is set to be achieved in the next two years. OpenAI CEO Sam Altman and Elon Musk have made public statements declaring clear roadmaps to achieve AGI; regardless of who gets there first, time will decide whether they are a hero or the destroyers of worlds. Potential evolution of use cases: Friend and foe Alongside positive innovations, AI is facilitating amoral actors. LLMs and AI agents are being used to assist hacking. LLMs get jailbroken to produce malware and are being used for targeted scamming, such as faking voices in phone calls to incite money transfers from unsuspecting victims. An open-sourced AI Agent can be used by malicious actors for targeted scams, tasked with finding, tracking, tracing, and infiltrating a target—never ending until it achieves its goal. One key vulnerability on the horizon lies in the potential for AGI to break cryptographic encryptions. Bitcoin ( BTC ) encryption hacking is already a growing market, but is currently limited to the realm of quantum computing , which has an incredibly high barrier to entry—it requires extreme assets, resources, and technical capabilities that the average hacker does not possess. Crypto encryption hacking has been limited to a small handful of individuals who are legally paying for the services of quantum computing firms to unlock their wallets and recover funds for a hefty finder’s fee. Encryption hacking will not always be bound to the limits of quantum computing. AGI presents much lower barriers to entry and will leverage technology that man has not even yet discovered. AI + bad actors = death of crypto Once AI has advanced to the point where it can hack encryption, the level of criminals using this tool will dramatically increase. Usage will extend well beyond innocent crypto investors trying to recover funds. Hackers will use AI agents sufficiently advanced to target and exploit these weaknesses in our financial systems. Particularly as there are many amoral groups that lack quantum computing skills, actively interested in the weaponisation of AI, for example, the North Korean Lazarus Group, infamous for financial hacks , poses a real danger. We are looking at far more devastating effects than just scams and theft. North Korea will use it as a digital weapon, destroying existing financial systems. Beyond the weaponisation of AI by unfriendly states and actors lies the potential for AGI to go rogue from its creators. Once this happens, one of the first aspects after decentralizing itself, through infiltrating digital networks to become untraceable to avoid being switched off, will be to gather financial resources. The most likely target is the financial markets, specifically crypto. It would try to access digital capital by tracking high-frequency traders, forging accounts, and hacking online bank accounts. It would also break encryption methods for Bitcoin and all major cryptocurrencies. In the blink of an eye, it will be able to hack every single wallet that has ever existed and immediately secure the assets by selling them on the chain for gold, bonds, and fiat currencies, all before any centralised authority could respond. If an AI can crack all the private keys for crypto wallets, why would it not do so within minutes, stealing and selling all of the Bitcoin and other cryptocurrencies, and then diversifying into other assets? It would, and it will. Any hope for crypto (and humankind)? Without proactive counter-strategies, AGI could dismantle cryptocurrencies and very quickly take control of all human finances. As a complex, non-deterministic system, AGI is a technology where the safety rails imposed by governments are most needed; managing these risks requires exceptional cooperation and sophistication across many actors and institutions. Yet this is the first time a world-changing technology has not been spearheaded by the government, but instead by private corporations. From the Manhattan Project to microprocessors, the internet, GPS, and digital cameras, these are all technologies that originated from government-run projects for defense, which were subsequently commercialized for consumers (except for the bomb). Silicon Valley is at the forefront of AI, placing us in a unique position in history where the scale and speed of distribution, versus government oversight, may not be sufficient to prevent major negative impacts. AI will transform society, but once AI proves extremely smart and capable, there will be little to stop the ‘wrong hands’ from developing harmful AI tools. AGI starts a countdown timer until it breaks free from its creator’s chains and moves into the real world. The risks are not exclusive to financial markets, but apply to the whole digital landscape, IoT devices, electrical grids, and so much more. Crypto is but a means to an end for AI, a means to gather wealth. Crypto is purely the financial vessel for the worst-case scenario to unfold. Read more: The hidden bias in financial AI—can blockchain finally solve it? | Opinion Author: Zach Burks Zach Burks , CEO of Mintology, is an accomplished blockchain developer with over a decade of experience in the Ethereum ecosystem. He has progressed the governing principles of Ethereum first-hand through his collaboration with the Ethereum Foundation on improving the ERC-721 standard, the cornerstone standard for all NFTs, and by authoring ERC-2981, the industry-defining on-chain royalties standard. Zach is also the mastermind behind Gasless Minting, which revolutionized the NFT creation process.",crypto_news,https://crypto.news/ai-could-destroy-crypto-within-five-years-opinion/,"BTC|ETH|FIAT|MARKET|TECHNOLOGY","Opinion|AI|Cryptocurrency|decentralization|Technology|Сrypto hack",cryptocompare
2025-06-08T09:43:27,"James Wynn Closes 40x Bitcoin Long Position, Incurs $70.71 Loss on BTC Trade","COINOTAG News reports that on June 8th, James Wynn liquidated his highly leveraged Bitcoin position, incurring a loss of $70.71. According to data from Onchain Lens, Wynn had previously initiated",coinotag,https://en.coinotag.com/breakingnews/james-wynn-closes-40x-bitcoin-long-position-incurs-70-71-loss-on-btc-trade/,"BTC|ZRX","BTC",cryptocompare
2025-06-08T09:42:43,"Viral Crypto Presale Attracts $4 Million in Investment, Nexchain Could Be the Next 10x Crypto","As the crypto market revives heading into 2025, presale projects with real-world utility are gaining traction. Investors who once jumped on meme coins are now redirecting their focus to projects showing tangible infrastructure, scalability, and longevity. Nexchain stands out in this trend. The AI-powered Layer-1 blockchain has already raised $4 million in its ongoing Stage 17 presale, catching the attention of serious crypto backers. Unlike hype coins that lack sustainable models, Nexchain is building a real ecosystem for cross-industry blockchain adoption. Its combination of scalability, decentralization, and smart automation makes it a strong contender for one of the best crypto presales of the year. Nexchain Is the Future Layer-1 Blockchain You Can Buy Early Nexchain isn’t just promising innovation, it’s already delivering features that many other chains can’t yet match. At the core of its offering is a 10% daily gas fee revenue share distributed automatically to all token holders who use non-custodial wallets. This model turns passive holding into active earning, giving NEX tokens real-world yield from network activity rather than speculative rewards. With its hybrid AI + Proof-of-Stake consensus, Nexchain reaches over 400,000 TPS, making it one of the fastest blockchains available today. The chain supports smart contracts that can access real-time AI models and execute logic based on live data. This makes it ideal for powering AI applications across DeFi, supply chains, and decentralized healthcare. The project has just entered Stage 17 with a presale price of $0.066, setting up early adopters for a potential 455% return once it lists at $0.30. With $4 million already raised and support for BTC, SOL, and TRX as payment options, investor confidence is clearly high. New upgrades to the Nexchain dashboard, an upcoming testnet launch, and a brewing airdrop campaign all point to active development and expanding utility. This isn’t just another presale — it’s a real blockchain network preparing to go live. For those ready to be early in a project that mixes tech-first design with long-term earning potential, Nexchain might be the most promising crypto ICO to watch this June. Why Nexchain May Be 2025’s Best Crypto Presale to Buy Crypto narratives come and go, but infrastructure projects with working tech always rise to the top. Nexchain brings together speed, smart revenue-sharing, and real AI functionality in one blockchain. That’s rare in today’s presale environment. The NEX token is more than a speculative play. It provides exposure to daily earnings, cross-chain utility, and access to a decentralized future where AI isn’t just a buzzword — it’s baked into the core. For anyone looking to position early in the next big thing, Nexchain offers a serious value proposition. And with the presale clock ticking, the best time to enter might be now. The post Viral Crypto Presale Attracts $4 Million in Investment, Nexchain Could Be the Next 10x Crypto appeared first on TheCoinrise.com .",thecoinrise,https://thecoinrise.com/viral-crypto-presale-attracts-4-million-in-investment-nexchain-could-be-the-next-10x-crypto/,"BLOCKCHAIN|BTC|BUSINESS|ZRX|AIRDROP","Token Presale and ICO Insights|Nexchain",cryptocompare
2025-06-08T09:41:41,"Cardano May Gain Wall Street Exposure as Nasdaq Proposes Broader Crypto ETF Inclusion","Cardano’s inclusion in Nasdaq’s reconstituted Crypto U.S. Settlement Price Index marks a pivotal advancement towards mainstream financial integration. This development positions Cardano alongside leading cryptocurrencies like Bitcoin and Ethereum, signaling",coinotag,https://en.coinotag.com/cardano-may-gain-wall-street-exposure-as-nasdaq-proposes-broader-crypto-etf-inclusion/,"ADA|BTC|ETH|LINK|LTC","Bitcoin|Ethereum|Litecoin|News|ADA|BTC|ETH|LINK|LTC|SOL|UNI|XLM|XRP",cryptocompare
2025-06-08T09:30:14,"Ethereum Prepares For A Parabolic Move – ETH/BTC Chart Signals Strong Bullish Setup","Ethereum has remained resilient over the past few weeks, holding firmly above key support levels despite a broader market pullback. While many altcoins have struggled to find direction, ETH continues to trade above the $2,500 zone — a level that has repeatedly served as a strong foundation during times of uncertainty. Now, all eyes are on the $2,800 mark, which stands as the critical resistance level that bulls must reclaim to confirm a breakout and reignite bullish momentum. The overall market remains in a wait-and-see mode, with volatility rising and macroeconomic risks clouding short-term confidence. But Ethereum’s structure remains intact, and price action continues to favor accumulation rather than breakdown. Top analyst Carl Runefelt recently shared a bullish outlook on Ethereum’s ETH/BTC pair, highlighting the formation of a textbook bullish pennant. According to his analysis, Ethereum is preparing for a parabolic move once it breaks out of this high-timeframe consolidation. A breakout on the ETH/BTC chart would likely signal altcoin strength across the board, with Ethereum leading the charge. Ethereum Eyes Breakout After Holding Critical Support Ethereum has seen a 14% retrace since the last week of May, but despite the pullback, it continues to hold firmly above the $2,400 support zone — a level that has acted as a floor during the recent correction. While market sentiment has been shaky, Ethereum’s ability to maintain this structure has analysts growing increasingly optimistic. The price action suggests consolidation rather than weakness, with bulls preparing for a potential breakout in the coming sessions. ETH remains down significantly from its yearly highs, but a recovery could be underway. The $2,800 resistance is now the critical barrier for a bullish continuation. Reclaiming that level would confirm a breakout from the current range and open the door to retesting the $3,000–$3,200 region. Some analysts argue that this recovery could mark the start of Ethereum catching up with Bitcoin’s lead, especially if it starts gaining strength in the ETH/BTC pair. Runefelt recently pointed to a bullish pennant forming on the ETH/BTC chart, suggesting that Ethereum may be on the verge of a parabolic move. The key level to watch is around 0.026 BTC. A confirmed breakout above this threshold could signal the start of altseason, as Ethereum tends to lead the way during major altcoin rotations. For now, ETH is at a critical crossroads. Holding above $2,400 gives bulls a strong foundation, but follow-through is needed. A breakout in both USD and BTC pairs would validate the bullish case and likely trigger broader upside across the altcoin market. With momentum building and a technical setup aligning, Ethereum’s next move could shape the market direction well into the summer. ETH Consolidates Below Resistance As Bulls Defend $2,430 Support Ethereum is trading at $2,516 on the daily timeframe, consolidating just below key resistance at the 200-day simple moving average (SMA), currently at $2,663. After a strong rally in May, ETH has entered a sideways range and is now retesting the 34-day exponential moving average (EMA) at $2,431 — a critical level that previously acted as a springboard for the most recent push higher. Despite several attempts, Ethereum has been unable to break above the $2,800 zone, forming a clear horizontal resistance capped by the 200-day SMA. This repeated rejection highlights growing selling pressure at the top of the range. However, the overall structure remains intact as long as ETH holds above $2,430. A daily close below this level could trigger further downside toward the 100-day SMA near $2,266. Volume has declined during this consolidation, suggesting a lack of conviction from both bulls and bears — a setup that typically precedes a breakout. If bulls can reclaim the 200-day SMA, momentum may quickly return, with $2,800 as the next critical breakout level. Featured image from Dall-E, chart from TradingView",bitcoinist,https://bitcoinist.com/ethereum-prepares-for-a-parabolic-move-eth-btc-chart-signals-strong-bullish-setup/,"AAVE|ADA|ALTCOIN|ASIA|ATOM|AVAX|AXS|BCH|BLOCKCHAIN|BTC|BUSINESS|COMMODITY|COMP|DOGE|DOT|ETC|ETH|EXCHANGE|FIAT|FIL|LINK|LTC|LUNA|LUNC|MANA|MARKET|MATIC|MINING|REGULATION|SHIB|SOL|SPONSORED|TECHNOLOGY|TRADING|TRX|UNI|USDT|WALLET|XLM|XMR|XRP|XTZ|ZEC|ZRX|OTHER|RESEARCH|APT|ARB|BITTENSOR|BNB|CRO|WIF|FDUSD|HBAR|ICP|IMX|INJ|LDO|MNT|NEAR|NOT|PEPE|SUI|TON|USDC|AR|FLOKI|ONDO|BGB|BONK|BRETT|RUNE|FET|PYTH|SEI|FLR|JUP|BSV|AGX|ENS|ZK|WLD|XAUT|CAKE|OM|APE|LPT|HNT|XDC|FTT|BTG|PEOPLE|MOG|PYUSD|AXL|MEME|RAY|SSV|ARKM|ETHFI|MX|AIRDROP|TOKEN SALE|FORKS|TOKEN LISTING AND DELISTING|ADMINISTRATIVE EVENTS","Ethereum|ETH|ethbtc|ethereum analysis|Ethereum Bullish SIgnal|ethereum news|Ethereum Rally|Ethereum vs Bitcoin|ETHUSDT",cryptocompare
