datetime,headline,summary,source,url,categories,tags,api_source
2025-06-08T07:04:14,"Billionaire BlackRock CEO Larry Fink Warns $36,000,000,000,000 Debt Will ‘Overwhelm’ America Unless Stellar Economic Growth Achieved","The chief executive of the world’s largest asset manager just issued a dire warning, saying that the US will drown in debt unless the country finds a way to stimulate and grow the economy. Speaking at the 2025 Forbes Iconoclast Summit, Larry Fink details the remarkable pace at which the US has amassed an astronomical amount of debt. “After 223 years of being a nation in 2000, the [national debt] of the United States was $8 trillion. And in the last 25 years, both parties are guilty of this, [that number’s] now at $36 trillion. And now we have a pending tax bill that’s going to add $2.3 to $2.4 trillion on the back of that. If we don’t find a way to grow at 3% a year, real growth, we’re going to hit the wall.” Although the numbers are bleak, Fink believes the US can still climb out of its multi-trillion-dollar hole, outlining a number of steps that policymakers can take to spur real economic growth across multiple industries. “This is why we need to unlock more private capital… We need to be streamlining permitting, we need to be focused on rebuilding our infrastructure. If you believe that we’re going to be the leader in AI (artificial intelligence), we’re going to have, it’s estimated, a shortage of 500,000 electricians in this country. So, despite all of this pessimism, the foundation of growth is there. We just need to unlock it… If we cannot unlock that growth and if we’re going to continue to stumble along in a 2% economy, the [national debt is] going to overwhelm this country.” Follow us on X , Facebook and Telegram Don't Miss a Beat – Subscribe to get email alerts delivered directly to your inbox Check Price Action Surf The Daily Hodl Mix Disclaimer: Opinions expressed at The Daily Hodl are not investment advice. Investors should do their due diligence before making any high-risk investments in Bitcoin, cryptocurrency or digital assets. Please be advised that your transfers and trades are at your own risk, and any losses you may incur are your responsibility. The Daily Hodl does not recommend the buying or selling of any cryptocurrencies or digital assets, nor is The Daily Hodl an investment advisor. Please note that The Daily Hodl participates in affiliate marketing. Generated Image: Midjourney The post Billionaire BlackRock CEO Larry Fink Warns $36,000,000,000,000 Debt Will ‘Overwhelm’ America Unless Stellar Economic Growth Achieved appeared first on The Daily Hodl .",dailyhodl,https://dailyhodl.com/2025/06/08/billionaire-blackrock-ceo-larry-fink-warns-36000000000000-debt-will-overwhelm-america-unless-stellar-economic-growth-achieved/,"BTC|BUSINESS|REGULATION|TRADING","Financeflux|blackrock|Larry Fink|News|US Debt|US deficits",cryptocompare
2025-06-08T06:36:26,"Why Bitcoin and Ethereum Will Never Compete With XRP in Global Payments","A tweet by crypto researcher SMQKE highlighted a point that is increasingly echoed by both academic research and industry observation: Bitcoin (BTC) and Ethereum (ETH) are structurally unfit for the demands of modern, high-volume global payments. The evidence presented supports the argument that scalability, cost-efficiency, and regulatory compatibility are critical for any digital asset to be integrated into institutional-grade financial systems. On all of these fronts, XRP significantly outperforms Bitcoin and Ethereum. Scalability Bottlenecks in Bitcoin and Ethereum Scalability, in the context of global payments, refers to the system’s ability to handle millions of transactions simultaneously with speed, reliability, and minimal cost. According to data cited in the images attached to the tweet, both Bitcoin and Ethereum process fewer than 20 transactions per second. This is a major constraint considering that modern banking infrastructure must scale to hundreds of thousands of transactions per second. As noted by IBM’s Lund, while newer systems are achieving up to 4,000 transactions per second in experimental setups, legacy blockchains like Bitcoin and Ethereum remain severely limited by their foundational architecture. WHY BTC AND ETH WILL NEVER COMPETE WITH XRP IN GLOBAL PAYMENTS Scalability means how well a system can handle lots of transactions at the same time, quickly and without high costs. Banks need this because they process millions of payments every day that must be fast and… https://t.co/N5tjg8GZ64 pic.twitter.com/PnuiSqLZc1 — SMQKE (@SMQKEDQG) June 5, 2025 Regulatory and Operational Incompatibility The high volatility and low scalability of BTC and ETH are further highlighted in academic literature. A 2022 publication available on Springer concludes that these assets are unsuitable as payment instruments in most distributed ledger technology (DLT) use cases due to these very limitations. Their underlying proof-of-work consensus mechanisms not only limit throughput but also make transaction confirmation times longer and energy consumption unsustainable. These technical deficiencies also create complications for compliance within regulated financial environments, further disqualifying BTC and ETH from institutional adoption in global payment systems. XRP’s Technical Design for Institutional Use In contrast, the XRP Ledger (XRPL) is cited in a separate academic paper on the EDISON-X energy trading system as an example of a DLT built for fast, low-cost, and scalable payments. We are on twitter, follow us to connect with us :- @TimesTabloid1 — TimesTabloid (@TimesTabloid1) July 15, 2023 XRPL uses a Federated Byzantine Agreement (FBA) consensus mechanism, which enables transaction finality in 3–4 seconds, with a cost of less than $0.001 per transaction and the capacity to handle up to 1,500 transactions per second. These attributes make XRP suitable not only for peer-to-peer payments but also for enterprise-level applications such as energy trading and cross-border financial settlement. Institutional Preferences and Real-World Integration Furthermore, the scalability and low transaction latency of XRPL are central to its adoption by financial institutions. As highlighted in a Financial Times excerpt shared in the tweet, Ripple engineered its technology from the outset to handle hundreds of thousands of transactions per second. This design goal aligns with the operational requirements of major financial institutions such as Standard Chartered and Bank of America, which necessitate systems that can support large-scale, real-time transaction processing. SMQKE’s tweet argues that Bitcoin and Ethereum were not built for today’s payment environment, and available data supports this claim. XRP, on the other hand, was designed specifically for fast and reliable transactions within regulated frameworks. This distinction explains why banks and regulated financial entities have steered clear of BTC and ETH in operational payment infrastructure, reserving their usage for speculative purposes instead. In summary, technical scalability, regulatory alignment, and settlement efficiency are essential for digital assets to be used in global payments. XRP, through its consensus mechanism and system design, meets the scalability and compliance standards required for institutional adoption, making it a strong candidate for modern payment systems. Disclaimer : This content is meant to inform and should not be considered financial advice. The views expressed in this article may include the author’s personal opinions and do not represent Times Tabloid’s opinion. Readers are advised to conduct thorough research before making any investment decisions. Any action taken by the reader is strictly at their own risk. Times Tabloid is not responsible for any financial losses. Follow us on X , Facebook , Telegram , and Google News The post Why Bitcoin and Ethereum Will Never Compete With XRP in Global Payments appeared first on Times Tabloid .",timestabloid,https://timestabloid.com/why-bitcoin-and-ethereum-will-never-compete-with-xrp-in-global-payments/,"BTC|ETH|TRADING|XRP|RESEARCH","Cryptocurrency|News|Bitcoin|Ethereum|XRP",cryptocompare
2025-06-08T06:30:57,"Still Holding BTC or BNB? Here’s Why Qubetics Might Be the Best Cheap Crypto to Buy Now","Blockchain just took another leap forward. The latest ETH L2 updates are slashing gas fees, and institutions are quietly increasing exposure to digital assets. Meanwhile, newer protocols are drawing in massive TVLs, showing that innovation is sprinting ahead. With the world edging closer to digital-first finance, traditional assets like stocks and bonds aren’t holding the same charm they once did. Instead, crypto projects with strong fundamentals and active communities are emerging as the preferred alternative for everyday buyers. And speaking of strong contenders, Qubetics is gaining serious traction. Positioned at the front of the new digital frontier, Qubetics is the world’s first web3 aggregator, fusing tools and services that power decentralized living. In a world that’s more digitally dependent than ever, this project doesn’t just ride the crypto wave—it builds the next one. Let’s compare Qubetics with the OGs: Bitcoin and BNB, and see which is the best cheap crypto to buy now. How Qubetics’ dVPN Could Be the Breakthrough Web3 Needs Decentralized VPNs (dVPNs) have emerged as a powerful alternative to traditional VPNs, offering censorship resistance, enhanced privacy, and user-driven infrastructure. However, despite their promise, most dVPN solutions today face critical challenges. These include poor user experience, limited network reach, low speeds due to fragmented node quality, and high technical barriers for both node operators and users. Many projects also suffer from weak economic incentives, making it difficult to maintain active, reliable nodes at scale. For the average user, setting up or navigating a dVPN can still feel overly complex and unreliable—limiting real-world adoption. Qubetics addresses these limitations by integrating dVPN functionality into its broader Web3 framework, enabling faster, more reliable, and user-friendly decentralized private networking. Its ecosystem is designed for seamless access—where users can connect to privacy-first routing infrastructure without managing complex setups or relying on underperforming node networks. Qubetics uses a token-based model that rewards node operators fairly while ensuring network stability and scalability. It also supports cross-chain integration and real-time performance validation, allowing users to connect securely across regions and protocols with confidence. For developers and enterprises, Qubetics offers SDK-level access to embed dVPN features directly into decentralized applications, making privacy not just an option, but a default layer within Web3 architecture. Final Presale Stage: From $0.01 to $0.3370—Last Chance Before Listing Qubetics began its presale journey at just $0.01 in Stage 1. Now in Stage 37, the final crypto presale stage, the token is priced at $0.3370, having raised over $17.7 million, distributed 515 million tokens, and attracted 27,500+ holders. Once this final allocation is sold out, $TICS will list publicly at $0.40, offering an immediate return of 18.71% to those buying in now. At the current rate, a $5,000 investment secures approximately 14,837 tokens. If the token reaches $1 post-launch, the value grows to $14,837. At $5, it climbs to $74,185. If it hits $10 or $15, the valuation jumps to $148,370 and $222,555 respectively. With the token supply reduced to 1.36 billion and 38.55% reserved for public distribution, Qubetics offers a rare mix of scarcity, utility, and early-mover advantage. Only 10 million tokens remain at this price—after that, the public market takes over. Bitcoin (BTC): The Unshakable Digital Reserve It’s the original, the heavyweight, the symbol of decentralized money. Still, it has earned its title as digital gold. It’s held by thousands of major buyers, corporate treasuries, and individual wallets worldwide, and it’s got the battle scars to prove it. Bitcoin’s value isn’t just in price. It’s in its network security, its first-mover advantage, and its unmatched decentralization. When markets shake, many still rush to Bitcoin. It’s a mainstay in the digital asset space, but for those scouting for the best cheap crypto to buy now, BTC might be more of a long-term stronghold than a near-term multiplier. The days of 1,000 percent gains might be in the rearview, but for those who want stability in a sea of volatility, Bitcoin continues to be the go-to. BNB (Binance Coin): The Backbone of the Binance Ecosystem BNB started as a utility token and grew into the glue holding the Binance ecosystem together. Whether it’s paying fees on Binance Smart Chain, participating in launches, or powering DeFi and NFT platforms, BNB is everywhere. BNB’s community is huge, with millions of users relying on it for day-to-day transactions across DeFi apps, staking protocols, and token swaps. That kind of use gives BNB real-world weight. It isn’t just speculative—it’s integral to daily blockchain use. But for new backers hunting the best cheap crypto to buy now, BNB may feel a bit pricey compared to tokens like $TICS, especially if the goal is catching early-stage growth. Still, its track record is solid. BNB exploded from a few dollars to hundreds in just a few years, proving that exchange-based tokens can become major players in the space. And with Binance constantly evolving, BNB remains a dependable bet for those looking for something with both utility and staying power. Why Qubetics Is Grabbing All the Spotlight Right Now The ongoing crypto presale of Qubetics has created a ripple effect in crypto circles for a reason. It’s not just about the potential gains. It’s about relevance. This project hits where modern issues lie—privacy, decentralization, access, and usability. Qubetics is the world’s first web3 aggregator, simplifying the decentralized experience into something anyone can use. Think about all the different services out there: VPNs, DeFi wallets, staking platforms, DEXs, aggregators, identity verification. Qubetics brings them under one roof with actual use cases. You’re not just holding a token—you’re part of a platform that does real work in the real world. That’s why it’s being seen as the best cheap crypto to buy now by early adopters who understand where tech is headed. Whether you’re someone who’s sick of handing your data over to centralized services or a professional needing secure, borderless communication, Qubetics delivers. And with each presale stage pushing the price up, those watching from the sidelines are starting to feel the heat. Once this thing hits exchanges, the whole vibe could shift fast. Final Thoughts: Ready or Not, Qubetics Is Coming 2025 isn’t the year to play it safe with tired assets. Between rising inflation and a digital-first future knocking at the door, there’s a growing call for assets that are nimble, tech-forward, and built for where the world is going, not where it’s been. Bitcoin holds the crown for being the pioneer. BNB has cemented its spot in the daily use category. But Qubetics? It’s making a serious case for being the best cheap crypto to buy now , especially for those tuned into real utility and tangible future gains. With massive presale momentum, promising ROI projections, and a platform tackling real-world problems, it’s not just a project—it’s a movement. If you’ve been watching from the sidelines, now’s the moment. The train’s still at the station—but it won’t be for long. For More Information: Qubetics: https://qubetics.com Presale: https://buy.qubetics.com/ Telegram: https://t.me/qubetics Twitter: https://x.com/qubetics FAQs What is Qubetics and why is it getting so much attention right now? Qubetics is a web3 aggregator currently in its 37th presale stage. It offers decentralized tools like a VPN and wallet integration. Its $TICS token has strong growth projections and is considered by many to be the best cheap crypto to buy now. How does Qubetics’ Decentralized VPN actually work in real life? It allows users to access the internet privately without relying on a central provider. Think freelancers working from co-working spaces, activists communicating across borders, or companies protecting sensitive data across remote teams. Why is Qubetics considered the best crypto presale of 2025? It’s raised over $17.5 million, has sold over 514 million tokens, and continues to gain community traction. Its clear use cases and aggressive growth roadmap are drawing attention as a top crypto presale pick. The post Still Holding BTC or BNB? Here’s Why Qubetics Might Be the Best Cheap Crypto to Buy Now appeared first on TheCoinrise.com .",thecoinrise,https://thecoinrise.com/still-holding-btc-or-bnb-heres-why-qubetics-might-be-the-best-cheap-crypto-to-buy-now/,"BLOCKCHAIN|BTC|EXCHANGE|TRADING|BNB","Token Presale and ICO Insights|Qubetics",cryptocompare
2025-06-08T06:30:52,"Dogecoin’s Growth Pattern Hints At Massive June–July Rally After 5-Month Pullback","Technical analysis of Dogecoin’s price action shows that Dogecoin bulls are currently working hard to register a break above the $0.2 resistance price level. However, beyond the immediate battle at the $0.20 resistance, a broader technical perspective presents a far more interesting possibility of Dogecoin reaching new all-time highs very soon. Specifically, the technical analysis of Dogecoin’s monthly candlestick timeframe chart indicates that its price is currently in the formation of a rally between June and July 2025. Related Reading: Bitcoin To Hit $180,000 In 2025? Analyst Highlights The Trigger Analyst Spots Recurring 3-Month Uptick, 5-Month Pullback Formation A technical analysis of Dogecoin’s monthly candlestick chart, first shared by crypto analyst Trader Tardigrade on the social media platform X, identifies a fascinating recurring pattern for the meme coin’s price. According to the analyst, Dogecoin has now completed two price cycles since late 2023, each consisting of a 3-month pump followed by a 5-month pullback. This rhythmic pattern first played out between December 2023 and August 2024. Dogecoin experienced a strong price surge from December to February, followed by a prolonged pullback that lasted from March to July. It followed a similar trajectory between August 2024 up until recently in May 2025, where three months of bullish momentum were followed by five months of bearish price action. The last monthly candlestick helped to confirm this setup, especially after May ended with a positive 11.7% close from its open price. As such, the next outlook is the continuation of this rally in June 2025. Each of the previous 3-month rallies has produced notable upside, with the most recent cycle in 2024 pushing Dogecoin’s price from below $0.08 to a multi-year high around $0.48 in just three months. If this cyclical behavior continues, Dogecoin could be gearing up for a comparable bullish leg in June and July, which would eventually cause it to break into new all-time highs. Chart Image From X: Trader Tardigrade Dogecoin To Repeat History With June/July Rally The notion that history could repeat itself is not new to crypto traders, but in Dogecoin’s case, the visual alignment of price action over time is hard to ignore. Keeping this possibility in mind, a repeat of the previous rally in Q4 2024 will be enough to send the Dogecoin price above resistance levels at $0.22, $0.3, and finally at $0.48. Related Reading: Elon Musk ‘Will Do Anything’ To Make XRP King, Tech Mogul Says Notably, crypto analyst Trader Tardigrade projected a run-up to $0.3 in June. A successful breach above this level could confirm the start of the next bullish cycle for Dogecoin, and Trader Tardigrade projected a peak price above $0.75 in July 2025. At the time of writing, Dogecoin is trading at $0.184, with a price increase of 0.5% in the past 24 hours. Featured image from Unsplash, chart from TradingView",newsbtc,https://www.newsbtc.com/altcoin/dogecoins-growth-pattern-hints-at-massive-june-july-rally-after-5-month-pullback/,"ALTCOIN|BTC|DOGE|MARKET|TRADING","Altcoin|altcoins|blockchain technology|cryptocurrency|doge|Dogecoin|meme coins",cryptocompare
2025-06-08T06:30:28,"MEXC Launchpad Debuts With Discounted Bitcoin Subscriptions","The new launchpad platform by MEXC is designed to provide fair and transparent access to high-quality tokens. The inaugural event offers up to 90% bitcoin discounts for new users. MEXC’s New Launchpad Aims to Democratize Token Access MEXC, a global cryptocurrency exchange, has unveiled its new launchpad platform, aiming to democratize early-stage token investing by",bitcoin.com,https://news.bitcoin.com/mexc-launchpad-debuts-with-discounted-bitcoin-subscriptions/,"BTC|EXCHANGE","Crypto News|Bitcoin (BTC)|Exchange",cryptocompare
2025-06-08T06:16:56,"Bitcoin May Have Further Upside Potential Amid Rising On-Chain Activity and Macro Trends, Analysts Suggest","Bitcoin’s on-chain activity is showing renewed strength, indicating potential for further price appreciation amid evolving macroeconomic trends. Long-term holders are increasingly mobilizing their Bitcoin holdings, a pattern historically linked to",coinotag,https://en.coinotag.com/bitcoin-may-have-further-upside-potential-amid-rising-on-chain-activity-and-macro-trends-analysts-suggest/,"BTC|MARKET|TRADING","Analysis|News|BTC",cryptocompare
2025-06-08T06:08:25,"Tether CEO snubs IPO, says $515B valuation is 'a bit bearish’","Tether’s CEO points to the company’s growing Bitcoin and gold treasury as a reason why a speculative $515 billion valuation might actually be “a bit bearish.”",cointelegraph,https://cointelegraph.com/news/tether-ceo-paolo-ardoino-no-public-plans-bearish-valuation?utm_source=rss_feed&utm_medium=rss&utm_campaign=rss_partner_inbound,"BTC|FIAT|REGULATION|TRADING|USDT","",cryptocompare
2025-06-08T06:00:06,"Bitcoin is scarcer than ever! – Why BTC’s $100K mark is only step one","How will the 2028 halving slash supply and drive Bitcoin’s next price surge?",ambcrypto,https://ambcrypto.com/bitcoin-is-scarcer-than-ever-why-btcs-100k-mark-is-only-step-one/,"BTC|TRADING","Bitcoin|BTC Trading View|News|News 1|Social|Trading View|ambcrypto",cryptocompare
2025-06-08T05:53:16,"Bitcoin DeFi Platform ALEX Lab Faces $8.3M Exploit, Plans Full USDC Reimbursement","Bitcoin DeFi protocol ALEX Lab suffered a major exploit on June 6, 2025, resulting in an $8.3 million loss across multiple asset pools, highlighting critical vulnerabilities in emerging Bitcoin-based decentralized",coinotag,https://en.coinotag.com/bitcoin-defi-platform-alex-lab-faces-8-3m-exploit-plans-full-usdc-reimbursement/,"BLOCKCHAIN|BTC|MINING|STX|USDC","News|BTC|STX|USDC|WBTC",cryptocompare
2025-06-08T05:31:33,"Ethereum ETF Inflows Could Signal Emerging Demand Amid Technical Breakout Potential","Ethereum’s recent ETF inflows have reignited discussions on whether this signals genuine institutional demand or merely a speculative rebound in the crypto market. After a steep drop from $4,000 to",coinotag,https://en.coinotag.com/ethereum-etf-inflows-could-signal-emerging-demand-amid-technical-breakout-potential/,"BTC|ETH|MARKET|TRADING","Ethereum|News|APEX|AUCTION|BTC|ETH",cryptocompare
2025-06-08T05:29:34,"Gemini’s Confidential IPO Filing May Signal Growing Bitcoin Market Interest and Regulatory Focus","Gemini’s confidential IPO filing with the SEC marks a significant milestone in the cryptocurrency sector, signaling growing institutional interest and market maturation. The move follows Circle’s successful public listing, highlighting",coinotag,https://en.coinotag.com/geminis-confidential-ipo-filing-may-signal-growing-bitcoin-market-interest-and-regulatory-focus/,"BTC|MARKET|REGULATION","News|BTC",cryptocompare
2025-06-08T05:07:14,"Bitcoin Could See Impact Amid El Salvador’s Foreign Agents Law Dispute with EU","El Salvador’s Foreign Agents Law has ignited a fierce debate, with President Nayib Bukele sharply criticizing the European Union’s condemnation of the legislation. The law mandates foreign-funded organizations to register",coinotag,https://en.coinotag.com/bitcoin-could-see-impact-amid-el-salvadors-foreign-agents-law-dispute-with-eu/,"BTC|REGULATION","News|BTC",cryptocompare
