datetime,headline,summary,source,url,categories,tags,api_source
2025-06-08T09:55:57,"Bitcoin Core Developers and Users Discuss Potential Improvements in Transaction Relay and Network Governance","Bitcoin Core developers and the wider community are actively debating the optimization of transaction relay processes and the evolving role of core software in the Bitcoin ecosystem. This ongoing dialogue",coinotag,https://en.coinotag.com/bitcoin-core-developers-and-users-discuss-potential-improvements-in-transaction-relay-and-network-governance/,"BTC|TECHNOLOGY","News|BTC|Core",cryptocompare
2025-06-08T09:52:25,"James Wynn Opens 40x Leveraged Bitcoin Short Amid Repeated Liquidations","James Wynn, a prominent trader, recently disclosed on Platform X his strategic decision to short Bitcoin (BTC). Wynn cited repeated liquidation events when taking long positions as the primary catalyst",coinotag,https://en.coinotag.com/breakingnews/james-wynn-opens-40x-leveraged-bitcoin-short-amid-repeated-liquidations/,"BTC|ZRX","BTC",cryptocompare
2025-06-08T09:48:20,"Bitcoin can liquidate $15B in shorts with 10% BTC price uptick — Data","Bitcoin traders eye key levels to hold and reclaim into the weekly close, but the chances of a major liquidity grab are growing.",cointelegraph,https://cointelegraph.com/news/bitcoin-can-liquidate-15b-shorts-10-btc-price-uptick-data?utm_source=rss_feed&utm_medium=rss&utm_campaign=rss_partner_inbound,"BTC|TRADING","",cryptocompare
2025-06-08T09:47:57,"AI could destroy crypto within five years | Opinion","Disclosure: The views and opinions expressed here belong solely to the author and do not represent the views and opinions of crypto.news’ editorial. AI has been evolving at breakneck speed and is becoming an indispensable and useful tool across many industries for business and consumer-facing functions, including the finance industry. The fast adoption of AI is largely driven by its low barriers to entry, where anyone with a computer and internet connection can interact with AI and develop it. Yet, as AI grows, it brings severe risks: AI is already sufficiently advanced to assist human-led hacking through LLMs and AI agents. You might also like: AI is crypto’s redemption, and the next generation’s big bet | Opinion Within five years, AI will develop capabilities to hack on another, far more dangerous front: through Artificial General Intelligence. Once AGI is achieved, it won’t be controlled by people. Unless governments and regulators step in now (even then, the chances of controlling it are slim), AGI will escape the confines of its creators and autonomously hack cryptocurrency encryptions… and entire global digital systems. The rise of artificial intelligence AI has seen a dramatic surge in the commercial arena, one of its most recent iterations being AI agents. These are finely tuned, complicated systems, geared to perform specialized tasks and make decisions with minimal human intervention. Already transforming the tech space and becoming a useful everyday tool for many basic human interactions, such as self-driving cars, fraud detection , on-chain trading, and application creation. The next evolution will be AGI , a complex system that can do everything a human can. It will not need human prompts or intervention; it will simply have real-time autonomy: the ability to perform tasks, but also recognise when a task needs performing. This is set to be achieved in the next two years. OpenAI CEO Sam Altman and Elon Musk have made public statements declaring clear roadmaps to achieve AGI; regardless of who gets there first, time will decide whether they are a hero or the destroyers of worlds. Potential evolution of use cases: Friend and foe Alongside positive innovations, AI is facilitating amoral actors. LLMs and AI agents are being used to assist hacking. LLMs get jailbroken to produce malware and are being used for targeted scamming, such as faking voices in phone calls to incite money transfers from unsuspecting victims. An open-sourced AI Agent can be used by malicious actors for targeted scams, tasked with finding, tracking, tracing, and infiltrating a target—never ending until it achieves its goal. One key vulnerability on the horizon lies in the potential for AGI to break cryptographic encryptions. Bitcoin ( BTC ) encryption hacking is already a growing market, but is currently limited to the realm of quantum computing , which has an incredibly high barrier to entry—it requires extreme assets, resources, and technical capabilities that the average hacker does not possess. Crypto encryption hacking has been limited to a small handful of individuals who are legally paying for the services of quantum computing firms to unlock their wallets and recover funds for a hefty finder’s fee. Encryption hacking will not always be bound to the limits of quantum computing. AGI presents much lower barriers to entry and will leverage technology that man has not even yet discovered. AI + bad actors = death of crypto Once AI has advanced to the point where it can hack encryption, the level of criminals using this tool will dramatically increase. Usage will extend well beyond innocent crypto investors trying to recover funds. Hackers will use AI agents sufficiently advanced to target and exploit these weaknesses in our financial systems. Particularly as there are many amoral groups that lack quantum computing skills, actively interested in the weaponisation of AI, for example, the North Korean Lazarus Group, infamous for financial hacks , poses a real danger. We are looking at far more devastating effects than just scams and theft. North Korea will use it as a digital weapon, destroying existing financial systems. Beyond the weaponisation of AI by unfriendly states and actors lies the potential for AGI to go rogue from its creators. Once this happens, one of the first aspects after decentralizing itself, through infiltrating digital networks to become untraceable to avoid being switched off, will be to gather financial resources. The most likely target is the financial markets, specifically crypto. It would try to access digital capital by tracking high-frequency traders, forging accounts, and hacking online bank accounts. It would also break encryption methods for Bitcoin and all major cryptocurrencies. In the blink of an eye, it will be able to hack every single wallet that has ever existed and immediately secure the assets by selling them on the chain for gold, bonds, and fiat currencies, all before any centralised authority could respond. If an AI can crack all the private keys for crypto wallets, why would it not do so within minutes, stealing and selling all of the Bitcoin and other cryptocurrencies, and then diversifying into other assets? It would, and it will. Any hope for crypto (and humankind)? Without proactive counter-strategies, AGI could dismantle cryptocurrencies and very quickly take control of all human finances. As a complex, non-deterministic system, AGI is a technology where the safety rails imposed by governments are most needed; managing these risks requires exceptional cooperation and sophistication across many actors and institutions. Yet this is the first time a world-changing technology has not been spearheaded by the government, but instead by private corporations. From the Manhattan Project to microprocessors, the internet, GPS, and digital cameras, these are all technologies that originated from government-run projects for defense, which were subsequently commercialized for consumers (except for the bomb). Silicon Valley is at the forefront of AI, placing us in a unique position in history where the scale and speed of distribution, versus government oversight, may not be sufficient to prevent major negative impacts. AI will transform society, but once AI proves extremely smart and capable, there will be little to stop the ‘wrong hands’ from developing harmful AI tools. AGI starts a countdown timer until it breaks free from its creator’s chains and moves into the real world. The risks are not exclusive to financial markets, but apply to the whole digital landscape, IoT devices, electrical grids, and so much more. Crypto is but a means to an end for AI, a means to gather wealth. Crypto is purely the financial vessel for the worst-case scenario to unfold. Read more: The hidden bias in financial AI—can blockchain finally solve it? | Opinion Author: Zach Burks Zach Burks , CEO of Mintology, is an accomplished blockchain developer with over a decade of experience in the Ethereum ecosystem. He has progressed the governing principles of Ethereum first-hand through his collaboration with the Ethereum Foundation on improving the ERC-721 standard, the cornerstone standard for all NFTs, and by authoring ERC-2981, the industry-defining on-chain royalties standard. Zach is also the mastermind behind Gasless Minting, which revolutionized the NFT creation process.",crypto_news,https://crypto.news/ai-could-destroy-crypto-within-five-years-opinion/,"BTC|ETH|FIAT|MARKET|TECHNOLOGY","Opinion|AI|Cryptocurrency|decentralization|Technology|Сrypto hack",cryptocompare
2025-06-08T09:43:27,"James Wynn Closes 40x Bitcoin Long Position, Incurs $70.71 Loss on BTC Trade","COINOTAG News reports that on June 8th, James Wynn liquidated his highly leveraged Bitcoin position, incurring a loss of $70.71. According to data from Onchain Lens, Wynn had previously initiated",coinotag,https://en.coinotag.com/breakingnews/james-wynn-closes-40x-bitcoin-long-position-incurs-70-71-loss-on-btc-trade/,"BTC|ZRX","BTC",cryptocompare
2025-06-08T09:41:41,"Cardano May Gain Wall Street Exposure as Nasdaq Proposes Broader Crypto ETF Inclusion","Cardano’s inclusion in Nasdaq’s reconstituted Crypto U.S. Settlement Price Index marks a pivotal advancement towards mainstream financial integration. This development positions Cardano alongside leading cryptocurrencies like Bitcoin and Ethereum, signaling",coinotag,https://en.coinotag.com/cardano-may-gain-wall-street-exposure-as-nasdaq-proposes-broader-crypto-etf-inclusion/,"ADA|BTC|ETH|LINK|LTC","Bitcoin|Ethereum|Litecoin|News|ADA|BTC|ETH|LINK|LTC|SOL|UNI|XLM|XRP",cryptocompare
2025-06-08T09:30:14,"Ethereum Prepares For A Parabolic Move – ETH/BTC Chart Signals Strong Bullish Setup","Ethereum has remained resilient over the past few weeks, holding firmly above key support levels despite a broader market pullback. While many altcoins have struggled to find direction, ETH continues to trade above the $2,500 zone — a level that has repeatedly served as a strong foundation during times of uncertainty. Now, all eyes are on the $2,800 mark, which stands as the critical resistance level that bulls must reclaim to confirm a breakout and reignite bullish momentum. The overall market remains in a wait-and-see mode, with volatility rising and macroeconomic risks clouding short-term confidence. But Ethereum’s structure remains intact, and price action continues to favor accumulation rather than breakdown. Top analyst Carl Runefelt recently shared a bullish outlook on Ethereum’s ETH/BTC pair, highlighting the formation of a textbook bullish pennant. According to his analysis, Ethereum is preparing for a parabolic move once it breaks out of this high-timeframe consolidation. A breakout on the ETH/BTC chart would likely signal altcoin strength across the board, with Ethereum leading the charge. Ethereum Eyes Breakout After Holding Critical Support Ethereum has seen a 14% retrace since the last week of May, but despite the pullback, it continues to hold firmly above the $2,400 support zone — a level that has acted as a floor during the recent correction. While market sentiment has been shaky, Ethereum’s ability to maintain this structure has analysts growing increasingly optimistic. The price action suggests consolidation rather than weakness, with bulls preparing for a potential breakout in the coming sessions. ETH remains down significantly from its yearly highs, but a recovery could be underway. The $2,800 resistance is now the critical barrier for a bullish continuation. Reclaiming that level would confirm a breakout from the current range and open the door to retesting the $3,000–$3,200 region. Some analysts argue that this recovery could mark the start of Ethereum catching up with Bitcoin’s lead, especially if it starts gaining strength in the ETH/BTC pair. Runefelt recently pointed to a bullish pennant forming on the ETH/BTC chart, suggesting that Ethereum may be on the verge of a parabolic move. The key level to watch is around 0.026 BTC. A confirmed breakout above this threshold could signal the start of altseason, as Ethereum tends to lead the way during major altcoin rotations. For now, ETH is at a critical crossroads. Holding above $2,400 gives bulls a strong foundation, but follow-through is needed. A breakout in both USD and BTC pairs would validate the bullish case and likely trigger broader upside across the altcoin market. With momentum building and a technical setup aligning, Ethereum’s next move could shape the market direction well into the summer. ETH Consolidates Below Resistance As Bulls Defend $2,430 Support Ethereum is trading at $2,516 on the daily timeframe, consolidating just below key resistance at the 200-day simple moving average (SMA), currently at $2,663. After a strong rally in May, ETH has entered a sideways range and is now retesting the 34-day exponential moving average (EMA) at $2,431 — a critical level that previously acted as a springboard for the most recent push higher. Despite several attempts, Ethereum has been unable to break above the $2,800 zone, forming a clear horizontal resistance capped by the 200-day SMA. This repeated rejection highlights growing selling pressure at the top of the range. However, the overall structure remains intact as long as ETH holds above $2,430. A daily close below this level could trigger further downside toward the 100-day SMA near $2,266. Volume has declined during this consolidation, suggesting a lack of conviction from both bulls and bears — a setup that typically precedes a breakout. If bulls can reclaim the 200-day SMA, momentum may quickly return, with $2,800 as the next critical breakout level. Featured image from Dall-E, chart from TradingView",bitcoinist,https://bitcoinist.com/ethereum-prepares-for-a-parabolic-move-eth-btc-chart-signals-strong-bullish-setup/,"AAVE|ADA|ALTCOIN|ASIA|ATOM|AVAX|AXS|BCH|BLOCKCHAIN|BTC|BUSINESS|COMMODITY|COMP|DOGE|DOT|ETC|ETH|EXCHANGE|FIAT|FIL|LINK|LTC|LUNA|LUNC|MANA|MARKET|MATIC|MINING|REGULATION|SHIB|SOL|SPONSORED|TECHNOLOGY|TRADING|TRX|UNI|USDT|WALLET|XLM|XMR|XRP|XTZ|ZEC|ZRX|OTHER|RESEARCH|APT|ARB|BITTENSOR|BNB|CRO|WIF|FDUSD|HBAR|ICP|IMX|INJ|LDO|MNT|NEAR|NOT|PEPE|SUI|TON|USDC|AR|FLOKI|ONDO|BGB|BONK|BRETT|RUNE|FET|PYTH|SEI|FLR|JUP|BSV|AGX|ENS|ZK|WLD|XAUT|CAKE|OM|APE|LPT|HNT|XDC|FTT|BTG|PEOPLE|MOG|PYUSD|AXL|MEME|RAY|SSV|ARKM|ETHFI|MX|AIRDROP|TOKEN SALE|FORKS|TOKEN LISTING AND DELISTING|ADMINISTRATIVE EVENTS","Ethereum|ETH|ethbtc|ethereum analysis|Ethereum Bullish SIgnal|ethereum news|Ethereum Rally|Ethereum vs Bitcoin|ETHUSDT",cryptocompare
2025-06-08T09:30:11,"Ethereum Head & Shoulders Pattern Breakdown: Can Bulls Reclaim Control?","Ethereum’s recent price action on the 4-hour chart has led to the formation of a classic Head and Shoulders pattern that opens up the possibility of a deeper correction. After a relatively stable period around the $2,500 zone, Ethereum broke below a neckline support level as last week drew to a close. This raises the question of whether a bearish continuation is already in motion for the Ethereum price or if bulls still have a shot at regaining momentum in the new week. Related Reading: Elon Musk ‘Will Do Anything’ To Make XRP King, Tech Mogul Says Head & Shoulders Pattern Confirmed After Breakdown Below $2,480 The Head and Shoulders pattern, one of the most recognizable reversal formations in technical analysis, is now clearly visible on Ethereum’s 4-hour candlestick chart. This chart and the technical outlook were first shared on the TradingView platform by crypto analyst MelikaTrader94. The structure includes a left shoulder, a prominent head peaking above $2,700, and a right shoulder that topped near $2,650. The neckline, drawn around $2,480, was breached during Ethereum’s recent pullback to $2,380. This, in turn, shifted the short-term outlook toward the bearish side. After the break, Ethereum attempted to reclaim lost ground and is currently retesting the neckline area. This retest around $2,500 is significant, as a failure to push back above this level significantly would likely validate the bearish setup and cause the Ethereum price to reverse downwards toward the next support zone. According to the outlook from analyst MelikaTrader94, the price target from this Head and Shoulders breakdown before any notable rebound upward can occur lies between $2,200 and $2,250. Chart Image From TradingView: MelikaTrader94 Bulls Must Reclaim $2,650 To Invalidate Bearish Setup A confluence of factors supports the $2,200 region as a likely landing zone. Not only is this level consistent with the measured move of the Head and Shoulders pattern, but it also aligns with an order block on May 9 during Ethereum’s rally above $2,000 at the time. This adds further technical relevance to the $2,200 to $2,250 range acting as a support zone. However, the situation is not fully bearish yet. The path forward is clear but narrow for Ethereum bulls. The first step to invalidate the bearish setup is to reclaim the neckline around $2,500 decisively. Beyond that, breaking back above the right shoulder level around $2,650 would invalidate the Head and Shoulders pattern, and another pattern will most likely come into play. Related Reading: Bitcoin To Hit $180,000 In 2025? Analyst Highlights The Trigger A successful bullish reclaim would not only nullify the bearish pattern but could also revive sentiment for another retest of the $2,700 to $2,800 zone, which corresponds to the peak of the head in the recently formed pattern. Until such a recovery occurs, the Ethereum price can quickly reverse downwards at any time. At the time of writing, Ethereum is trading at $2,510. Featured image from Unsplash, chart from TradingView",newsbtc,https://www.newsbtc.com/altcoin/ethereum-head-shoulders-pattern-breakdown-can-bulls-reclaim-control/,"ALTCOIN|BTC|ETH|MARKET|TRADING","Altcoin|altcoins|blockchain technology|crypto|cryptocurrency|ethereum|ethusd|ETHUSDT",cryptocompare
