datetime,headline,summary,source,url,categories,tags,api_source
2025-06-08T07:35:10,"BITQ: Exposure To Bitcoin With An Added Layer Of Risk","Summary BITQ offers exposure to bitcoin-related equities, but introduces additional operational and business risks compared to direct bitcoin investment. The ETF is highly concentrated, with top holdings like MicroStrategy and Coinbase heavily influencing performance and adding company-specific risk. BITQ is volatile, directionally correlates with bitcoin, and has a higher expense ratio than direct bitcoin ETFs, making it less attractive for pure bitcoin exposure. Given these factors, I recommend a HOLD rating on BITQ, suggesting investors consider direct bitcoin funds for simpler, lower-risk exposure. Bitwise Crypto Industry Innovators ETF ( BITQ ) is an equity ETF designed to provide investors with exposure to the equity of companies involved in bitcoin. Before investing in this strategy, one must be aware of the additional layer of risks involved in holding a portfolio of companies involved in the bitcoin market. If one is seeking direct exposure to bitcoin, it may be worth considering one of the bitcoin funds as opposed to an equity strategy. BITQ holds roughly 30 individual equities of companies that span from bitcoin miners to banks and asset managers. Overall, the basis for the strategy is to hold a portfolio of ""picks and shovels"" companies building out the core infrastructure for bitcoin, including miners and brokerages. Interestingly enough, Strategy ( MSTR ), formerly known as MicroStrategy, is the portfolio's top holding despite having minimal involvement in the development of the bitcoin ecosystem. Nonetheless, Strategy is a large holder of bitcoin through a leveraged debt & equity issuance strategy for acquiring bitcoin. The target balance for the strategy is to allocate a minimum of 80% of the portfolio to Tier 1 crypto innovator companies whose primary focus is in the crypto market with the remaining 20% in Tier 2, large-cap companies with diversified business interests that include ""one significant public business line focused on the crypto market."" Accordingly, for a company to be classified as a Tier 1 company, 75% of their revenue must derive from servicing cryptocurrency markets. This includes crypto mining firms, crypto mining equipment suppliers, crypto financial services companies, and other financial institutions servicing primarily crypto-related clientele. Companies can also be classified as Tier 1 organizations if 75% of net assets are direct holdings of bitcoin, Ethereum, or other related cryptocurrencies, resulting in Strategy being classified as a Tier 1 Crypto Innovator. Corporate Reports With BITQ holding 30 companies, company concentration will be greater than when compared to larger, more diverse portfolio strategies. Accordingly, the top 10 holdings account for 60.35% of the total portfolio weight. This may mean that the direction of the portfolio strategy can be determined primarily by the top 10 holdings, which include bitcoin miners and a brokerage platform. Corporate Reports Strategy is by far the most heavily weighted company in the strategy, accounting for 11.97% of the portfolio. Though my most recent research covering MSTR is quite dated , I believe the overview can be helpful in assessing the company. MSTR has a unique investment proposition in which the organization issues debt and equity to buy bitcoin in a flywheel fashion. The organization sells this strategy as a leveraged bitcoin fund. The other side of the business consists of legacy operations relating to its business intelligence platform, which many investors in MSTR downplay as the organization transforms into a bitcoin strategy. Given the weight of MSTR in the portfolio, I recommend potential investors research this company prior to making an investment decision in BITQ. The second-largest holding in BITQ is Coinbase Global ( COIN ), a cryptocurrency brokerage platform, at 9.45% of the portfolio weighting. Many of the names following are mining organizations, with MARA Holdings ( MARA ) being by far the largest miner in the cohort. Though my research covering MARA is also dated, I believe understanding the company's structure can help investors determine whether BITQ is an appropriate investment strategy. In short, MARA is a cryptocurrency mining company that began diversifying its business strategy last year into data center infrastructure, including submerged server cooling units. Though the mining industry is power-intensive, the strategy has shifted in the last few years from strictly mining to offloading heat generated from the servers as a form of energy production. Overall, the industry is relatively volatile, with profitability remaining relatively challenged. Given the volatile nature of bitcoin and reporting requirements, financial analysis of the industry can be relatively challenging and may not appropriately represent the industry. FinChat Additionally, given the volatility of bitcoin, fund performance can drastically vary from period to period, showing large gains or losses at any given time. Corporate Reports Year-to-date, BITQ has outperformed the S&P 500 ( SPX ) despite the drastically larger drawdown. TradingView As a result of the volatility in the bitcoin and related market, this strategy may be best suited for active traders or those willing to undertake major short-term risks. In general, BITQ is directionally correlated with the underlying bitcoin market. Under this notion, investing in BITQ may add an additional layer of operational risk when compared to a direct investment in bitcoin. Given that the equities in the portfolio are businesses and not a commodity, one must consider the business operations in addition to bitcoin performance as an associated risk. This may also include industry risk, political risk, and financial performance. TradingView BITQ has an expense ratio of 80bps, making BITQ relatively more expensive than comparable strategies. Given the relative correlation between related equity ETFs and bitcoin ETFs, it may be worth considering investing in bitcoin ETFs given the relative performance, lower fees, and comparable performance. Seeking Alpha My recommendation is to take into consideration the broader risk profile of the portfolio companies that make up BITQ. If seeking bitcoin exposure, it may be wise to consider one of the bitcoin funds over the equity ETFs, as many of the business-related risks aren't prevalent. I am recommending BITQ with a HOLD rating.",seekingalpha,https://seekingalpha.com/article/4793231-bitq-exposure-to-bitcoin-with-an-added-layer-of-risk?utm_source=cryptocompare.com&utm_medium=referral&feed_item_type=article,"BTC|BUSINESS|MARKET|MINING|RESEARCH","BITQ",cryptocompare
2025-06-08T07:31:03,"Ripple Price Analysis: Increased Bearish Momentum as XRP Fails to Break Out","After a long consolidation phase, XRP continues to underperform compared to many other altcoins despite ongoing speculation around regulatory clarity. Recent price action shows increasing bearish momentum. Buyers have failed to hold critical levels on both the USDT and BTC pairs, suggesting a cautious outlook for the short term. Technical Analysis By ShayanMarkets The USDT Pair XRP/USDT is now trading around $2.2 after getting rejected from the higher boundary of the large descending channel. The price has also lost the 100-day MA (orange) and is testing the 200-day MA (blue), both located around the $2.30 mark. The RSI also sits near 44, reflecting weak bullish momentum and a lack of buying interest. A daily close below the psychological level at $2 would likely open the door for a deeper correction toward the $1.55 demand zone, which also aligns with the lower trendline of the channel. Until the buyers reclaim the moving averages with strong volume, the trend favours the sellers. Structurally, the market remains neutral to bearish, with a potential shift toward bearish if the current consolidation fails to reverse. Investors should watch for a reaction around the $1.90–$2 area, which will likely dictate the next directional impulse. The BTC Pair The XRP/BTC pair is trading around the 2,100 SAT mark after a prolonged grind lower within a descending wedge structure. Once again, the price has lost both the 100-day and 200-day MAs, which have also created a bearish crossover around the 2,500 SAT mark, and is now hovering above the lower channel boundary and the 2,000 SAT demand zone. There is also a notable FVG (Fair Value Gap) in the 1,600 – 1,900 SAT range, which may act as a magnet and a support zone in case the 2,000 SAT level breaks down. Buyers will need to reclaim the moving averages and break above the channel’s higher trendline around the 2,500–2,700 SAT zone to regain any strength, which currently seems unlikely unless Bitcoin itself consolidates. As long as the price remains within the channel, short-term relief bounces are possible, but momentum still favours sellers. The broader implication is continued BTC strength or XRP relative weakness in the market cycle. The post Ripple Price Analysis: Increased Bearish Momentum as XRP Fails to Break Out appeared first on CryptoPotato .",cryptopotato,https://cryptopotato.com/ripple-price-analysis-increased-bearish-momentum-as-xrp-fails-to-break-out/,"BTC|MARKET|TRADING|USDT|XRP","Crypto News|XRP Analysis|XRPBTC|XRPUSD|Ripple (XRP) Price",cryptocompare
2025-06-08T07:30:33,"Bitcoin Core Reinforces Stance on Nonfinancial Transactions in Recent Statement","Bitcoin Core, the leading Bitcoin node software implementation, has published a statement on its policy regarding nonfinancial transactions. Over 30 collaborators signed the document, which highlights that, as a censorship-resistant system, “Bitcoin can and will be used for use cases not everyone agrees on.” Bitcoin Core Issues Final Statement on Nonfinancial Transactions Bitcoin Core, the",bitcoin.com,https://news.bitcoin.com/bitcoin-core-reinforces-stance-on-nonfinancial-transactions-in-recent-statement/,"BLOCKCHAIN|BTC|TECHNOLOGY","Blockchain|Bitcoin (BTC)",cryptocompare
2025-06-08T07:19:43,"Top 5 Cryptocurrencies Positioned for Greater 2025 Growth Than Leading Tech Stocks","Tech stocks have been investor favorites for years. Now, some digital currencies are emerging as potential leaders. Analysts predict that five cryptocurrencies might deliver higher growth by 2025 than major tech companies. This shift raises questions about which digital assets could offer these impressive returns and what factors position them for such success. XYZVerse Sets a New Trend, Could This be the Next 50X Meme Coin? The buzz around XYZVerse is real. it is going to break records in the meme coin space, targeting 50X growth upon launch. The current presale gives early investors the chance to grab $XYZ tokens at a significantly discounted price , far below the expected listing price. Bullish Mood on $XYZ XYZVerse is already featured on CoinMarketCap where the community has shown a strongly bullish mood on this coin, with 95% voters anticipating $XYZ to grow. XYZ was further noticed by reputable crypto influencers. DanjoCapitalMaster , who has close to 800,000 followers, recently expressed his support for the project, calling XYZVerse a “moonshot opportunity.” More Than Just a Meme Coin Unlike most meme coins that ride trends without much substance, XYZVerse is setting a new trend. It is blending the high-energy world of sports with the viral nature of meme culture. And it’s working. The presale is moving fast, with early buyers locking in tokens at a fraction of what some believe could be its future value. Right now, XYZVerse is still in its presale phase, but demand is high. The price has already climbed from $0.0001 in Stage 1 to $0.003333 by Stage 12, with over 70% of the $15 million milestone already raised. Investors who got in early have secured a steep discount, and with a final presale target price of $0.1, those numbers have people paying attention. Still Time to Get in Before the Presale Ends Beyond just hype, XYZVerse has a structured tokenomics model aimed at long-term sustainability. A share of 15% is allocated to liquidity to create a solid market foundation.To reward its community via airdrops and bonuses, the team has put aside 10% of the total supply. Moreover, a big chunk of 17.13% is designated for deflationary burns, which could reduce supply and drive demand for $XYZ over time. A Community-Driven Project With Big Plans One thing setting XYZVerse apart is how it engages its community. The team recently launched the Ambassador Program, giving users the chance to earn free tokens by supporting the project. And that’s just the start—there are already talks with major sports celebrities to help boost visibility. The recent partnership with decentralized sportsbook bookmaker.XYZ underscores XYZVerse’s commitment to expanding its utility. It’s a big move that gives the community something to actually use. First Exclusive Bonuses from Our Partners You showed huge interest — now it's time to cash in @bookmakerxyz is kicking things off with an exclusive First Bet Insurance for $XYZ holders. How it works: 1⃣ Visit: https://t.co/iIVMCfXh8H 2⃣ Connect your EVM wallet that you… pic.twitter.com/ydY353SLTE — XYZVerse (@xyz_verse) April 2, 2025 As part of the deal, $XYZ holders get a special bonus on their first bet—a nice perk that adds extra value just for being part of the ecosystem. By bringing together traditional sports fans and the fast-moving crypto space, XYZVerse is building something different—something with entertainment value and real engagement. Could XYZVerse Be the Next Big Meme Coin? With a fast-growing presale, a strong community, and an ambitious roadmap, XYZVerse has the ingredients of a project with serious potential. While the crypto market is always unpredictable, many investors see this as an opportunity to get in early on something big. The presale won’t last forever—so if you’re interested, now might be the time to take a closer look. Join XYZVerse, the Next Moonshot Opportunity Bitcoin’s Journey: Is the Original Cryptocurrency Still King? Bitcoin, created by the mysterious Satoshi Nakamoto, is the first cryptocurrency. It operates without a central authority, allowing people to send money directly to each other. Instead of physical coins, Bitcoin uses a shared ledger called blockchain. This ledger is spread across many computers, so no single entity controls it. Transactions are verified by miners, who solve complex puzzles to add new records and are rewarded with bitcoins. This process keeps the system secure and prevents fraud. In today’s market, Bitcoin remains a major player among cryptocurrencies. Its limited supply of 21 million coins and events called “halvings,” which reduce miners’ rewards every four years, affect its value and mining. Compared to other coins, Bitcoin is seen as digital gold—a store of value. Recent trends show renewed interest in Bitcoin as people look for alternatives to traditional money. While other cryptocurrencies offer different features, Bitcoin’s established network and early start make it attractive to many. Ethereum’s Leap into the Future: Scalability and Growth Await Ethereum has been a pioneer in the blockchain world since its launch in 2015. Created by Vitalik Buterin, it introduced smart contracts and a vast ecosystem of decentralized applications, or dApps. With the move to Proof-of-Stake through the Merge in 2022, Ethereum reduced its energy consumption and opened new possibilities for efficiency. Layer 2 solutions like Arbitrum and Polygon help speed up transactions and lower costs. The upcoming sharding phase aims to make the network even more scalable and affordable. Ether (ETH), the network’s native token, remains central, used for transactions, rewarding stakers, and as a tradable asset. In the current market cycle, Ethereum’s advancements make it a significant player to watch. Compared to other cryptocurrencies, its shift to Proof-of-Stake and focus on scalability set it apart. Predictions based on historical price movements and Bitcoin halving cycles estimate that ETH’s price could reach as high as $6,580.53 next year. By 2025, the yearly low is estimated at $2,700.31, with further growth expected up to 2030. These trends suggest that Ethereum may have considerable potential in the years ahead, especially as it continues to innovate and strengthen its network. Solana’s SOL Coin: The Fast Lane of Blockchain Technology Solana is making waves in the blockchain world with its focus on speed and scalability. Unlike some of its competitors like Ethereum and Cardano, Solana is designed to handle thousands of transactions per second without slowing down. This is great news for developers who want to build decentralized apps, known as dapps. Solana supports multiple programming languages, making it easier for more people to create on its platform. At the core of Solana is its native cryptocurrency, SOL. This coin powers transactions, runs custom programs, and rewards those who help keep the network running smoothly. Many see bright potential in SOL. Its technology allows it to support a high-capacity network, which is ideal for services that need to handle a lot of users at once. In today’s market, where fast and efficient blockchain solutions are in demand, SOL stands out. Compared to other coins, it offers quicker transaction times and lower fees. With the growing interest in areas like decentralized finance and NFTs, Solana’s capabilities make it a strong contender. For investors and developers looking for the next big thing in crypto, SOL could be an attractive option. XRP: The Fast and Borderless Currency Shaking Up the Crypto World Have you heard of XRP? It’s a digital currency that’s making waves. Created by Jed McCaleb, Arthur Britto, and David Schwartz, XRP was designed to be fast, cheap, and accessible to everyone. Unlike traditional money, it doesn’t rely on banks or central authorities. Transactions are quick, secure, and can’t be reversed. With an initial supply of 100 billion, most of which was given to Ripple (formerly OpenCoin Inc.), XRP aims to make transferring money as easy as sending a text. In today’s market, XRP stands out for its speed and low costs. While some cryptocurrencies struggle with slow transfers and high fees, XRP offers a sleek alternative. It allows smooth payments across different currencies, making it valuable in our global economy. Ripple’s efforts to boost network liquidity and support the ecosystem could enhance XRP’s potential even more. Compared to other coins, XRP’s focus on real-world use makes it an attractive option. As the crypto world evolves, currencies like XRP that solve practical problems might lead the way. Conclusion BTC, ETH, SOL, and XRP are strong options, but XYZVerse (XYZ) aims higher with its sports-meme blend, targeting 20,000% growth and engaging a passionate community. You can find more information about XYZVerse (XYZ) here: https://xyzverse.io/ , https://t.me/xyzverse , https://x.com/xyz_verse Disclosure: This is a sponsored press release. Please do your research before buying any cryptocurrency or investing in any projects. Read the full disclosure here .",themerkle,https://nulltx.com/top-5-cryptocurrencies-positioned-for-greater-2025-growth-than-leading-tech-stocks/,"BTC|ETH|SOL|TRADING|XRP","Press Releases",cryptocompare
2025-06-08T07:19:14,"Bitcoin Price Analysis: Failure to Reclaim These Levels Can Result in a Sub-$100K Correction","Bitcoin has entered a corrective phase after tagging the $111K region, following a strong multi-week rally. While momentum has cooled, the broader structure remains intact. The price action is showing signs of potential accumulation at support, and traders are watching closely to see if this pullback turns into a deeper correction or a fresh leg up. Technical Analysis By ShayanMarkets The Daily Chart On the daily timeframe, BTC is currently holding above the $103K region after sweeping the $101K sell-side liquidity. The previous bullish structure is still valid, and the price is likely targeting the mid-range of the ascending channel. The 100-day (orange) and 200-day (blue) moving averages are not far below, sitting at $92K and $95K, respectively, and continue to slope upward. This indicates that the long-term bullish momentum is not yet broken. The RSI on the daily is recovering slightly from below 50, suggesting neutral momentum after days of cooling off. Until the asset breaks below the $100K–$101K range, the current drop looks like a healthy correction in an uptrend. However, failure to reclaim the $106K–$108K resistance area quickly could increase the probability of revisiting the $95K–$97K order block, and even the two moving averages. The 4-Hour Chart Zooming into the 4H chart, BTC wicked below the descending wedge pattern after finding strong demand near the $100K area and began a V-shaped recovery. This structure historically signals a bullish reversal, and the move back above $103K supports this case. However, the current rally is approaching resistance again, which is the higher boundary of the pattern near the $105K mark, and the RSI is still under 50. This level could act as a temporary ceiling unless momentum strengthens. The sharp wick below $100K looks like a textbook liquidity grab, suggesting market makers ran stops before driving the price higher. If the buyers manage to hold above the $100K base and flip the $105K–$106K area, the door reopens for a push toward $108K and possibly a new all-time high above $112K. On the other hand, a failure to do so would likely lead to more range-bound action between $101K and $106K in the coming days. On-Chain Analysis Exchange Reserve The Exchange Reserve chart reveals a persistent and steep decline in the amount of Bitcoin held on centralized exchanges, now reaching a historic low at 2.3 million BTC. This trend has accelerated over the past year and continues into June 2025, despite BTC trading above $100K. In classical supply-demand terms, this represents a significant supply-side squeeze: fewer coins on exchanges mean less liquidity available for instant sale, tightening the circulating supply and amplifying the impact of even moderate demand spikes. This behaviour reflects a strong macroeconomic undercurrent. First, institutional accumulation is likely driving much of this trend. Large entities often move coins off exchanges into custody solutions when positioning for long-term holding or to reduce counterparty risk. Second, the growing presence of spot Bitcoin ETFs and custodial platforms (like Fidelity or BlackRock) means that BTC is increasingly flowing into vehicles that don’t recycle it back onto exchanges, removing it from the liquid supply indefinitely. This dynamic creates structural illiquidity that underpins Bitcoin’s asymmetric upside. The post Bitcoin Price Analysis: Failure to Reclaim These Levels Can Result in a Sub-$100K Correction appeared first on CryptoPotato .",cryptopotato,https://cryptopotato.com/bitcoin-price-analysis-failure-to-reclaim-these-levels-can-result-in-a-sub-100k-correction/,"BTC|EXCHANGE|FIAT|MARKET|TRADING","BTC Analysis|BTCEUR|BTCGBP|BTCUSD|BTCUSDT|Crypto News|Bitcoin (BTC) Price",cryptocompare
