datetime,headline,summary,source,url,categories,tags,api_source
2025-06-08T11:39:48,"Bitcoin at the Brink: Double Top or $150K Moonshot, What’s Next?","Bitcoin is currently trading around $105,500, up a modest 1.1% in 24 hours, after a volatile week that saw prices swing between $100,400 and $106,500. While short-term price action appears calm, with the king cryptocurrency locked in a narrow 24-hour range of $103,500 to $105,800, underlying signals hint at seismic moves ahead. And with the asset now 6.2% down from its May 22 all-time high, the crypto community is divided: double top or liftoff? Double Top Déjà Vu? Pseudonymous analyst Cryptowizard took to X on June 7 with a chart comparison between Bitcoin’s current structure and the infamous 2021 double top. “Bitcoin’s price action is starting to look familiar,’” they wrote. “Just like in 2021, we’re seeing a potential double top formation plays out. Are we setting up for a retrace or $150K next?” That question has ignited debate across the community. Investor Trade Pro isn’t buying the bearish narrative. “Make no mistake about these pullbacks. I think they are buying opportunities… All signs point to strong continuation to new all-time highs,” they asserted, citing strong on-chain metrics. Backing that bullish case, Gracy Chen of Bitget says the macro picture is playing directly into Bitcoin’s hands. Trump’s latest 1% rate cut proposal and over $500 billion in expected U.S. Treasury borrowing by Q4 hint at a liquidity tsunami. “Globally, monetary easing is no longer a question of if, but when,” she noted, calling BTC the ultimate hedge in a world increasingly skeptical of fiat stability. “Bitcoin was built for these shifts.” Market watcher Axel Adler Jr. also noted that the 30-day volatility is now “highly compressed,” a setup that could just be the basis for a substantial market swing. Meanwhile, institutional buying continues to lock up supply. Swan CIO Ben Werkman pointed out that allocators, rather than traders, are driving this cycle, accumulating BTC without intent to sell. “62% of Bitcoin hasn’t moved in over a year,” noted Swan, suggesting that historic dormancy often precedes liftoff, as was the case in 2016 and 2020. Resistance Ahead? Still, not everyone is convinced the pump is near. According to Glassnode, at this time, the Short-Term Holder Cost Basis sits at just above $97,000 , with crucial thresholds at $83,200 and $114,800. The blockchain analytics firm predicts that a break below $100,000 could ignite another liquidation cascade, especially after Friday’s $988 million in long liquidations triggered by the very public tiff between U.S. President Donald Trump and his erstwhile political ally, Elon Musk. Even Daan Crypto Trade isn’t ruling out a deeper retracement. “Below yesterday’s lows at ~$100K and I think we’ll keep trending down for another 1–2 weeks,” he posted on X, pointing to BTC’s weakening correlation with stocks and a sluggish bounce from recent lows. The post Bitcoin at the Brink: Double Top or $150K Moonshot, What’s Next? appeared first on CryptoPotato .",cryptopotato,https://cryptopotato.com/bitcoin-at-the-brink-double-top-or-150k-moonshot-whats-next/,"BLOCKCHAIN|BTC|MARKET|REGULATION|TRADING","AA News|BTCEUR|BTCGBP|BTCUSD|BTCUSDT|Crypto News|Bitcoin|Bitcoin (BTC) Price",cryptocompare
2025-06-08T11:30:56,"EU Might Make Bitcoin Illegal, XRP and RLUSD Aim to Replace SWIFT, and More  — Week in Review","EU might make Bitcoin illegal, XRP and RLUSD aim to replace SWIFT, Elon Musk backs Coinbase warning: Bitcoin could replace Dollar, and more in this Week in Review. Week in Review Europe’s privacy regulators are weighing guidelines that could effectively criminalize Bitcoin transactions. Ripple is pitching XRP and its planned RLUSD stablecoin as a lightning-fast,",bitcoin.com,https://news.bitcoin.com/eu-might-make-bitcoin-illegal-xrp-and-rlusd-aim-to-replace-swift-and-more-week-in-review/,"BTC|EXCHANGE|FIAT|XRP","The Weekly|European Union (EU)|Ripple XRP",cryptocompare
2025-06-08T11:30:05,"Trump Confirms Imminent Fed Decision—Bitcoin And Crypto Brace For Huge Price Earthquake","Trump has confirmed decision on the next Federal Reserve chair will be coming out soon, priming the bitcoin price and crypto market...",forbes,https://www.forbes.com/sites/digital-assets/2025/06/08/trump-confirms-imminent-fed-decision-bitcoin-and-crypto-brace-for-huge-price-earthquake/,"BTC|FIAT|MARKET|TRADING","Forbes Digital Assets|/digital-assets|Forbes Digital Assets|/digital-assets|standard",cryptocompare
2025-06-08T11:30:00,"Mutuum Finance (MUTM) Picks Up Speed as Bitcoin (BTC) and Ethereum (ETH) Continue to Rise","As the crypto market gains renewed momentum, Bitcoin (BTC) and Ethereum (ETH) are reclaiming key price levels, fueling optimism among investors. BTC is reaffirming their status as the best cryptocurrencies to invest in during this cycle. But as blue-chip coins steady the market, fresh capital is rotating into high-potential, new crypto Mutuum Finance (MUTM) , currently trading under $1 and drawing attention for its ambitious DeFi roadmap and projected 44x ROI potential. Over 11,700 investors own the token and has raised funds worth over $10.1 million. A lot of investors are investing at $0.03 since the next increase of 16.67%, to $0.035, is about to happen. Investors joining now are expecting a 100% return once the project goes live at a price of $0.06. MUTM is quickly becoming one of the best cryptos to buy now, especially for those eyeing the next big cryptocurrency before the next breakout. Bitcoin and Ethereum Maintain Momentum Amid Market Optimism The current price of Bitcoin (BTC) is $105,366 which is slightly higher by 0.02%. Ever since hitting its May low of $93,232, Bitcoin has rebounded and analysts say the $106,000–$106,500 range will act as strong resistance for the cryptocurrency. While writing, Ethereum (ETH) is trading above $2,628.42, adding around 0.52%. The coin is now toughing it out at a critical stage of $2,725, where it has met with challenges while progressing this week. Buying these cryptos right now is considered smart, because they open many opportunities for investors. Crypto investors are now paying more attention to upcoming altcoins like Mutuum Finance (MUTM) as high-potential investments. Mutuum Finance Presale Surges as Investor Interest Grows MUTM utilizes a two-way lending model that has made the project take center stage as far as speedy adoption by users is concerned. More than 11,700 investors have invested $10.1 million in the presale pointing to the success of the project. MUTM token will cost $0.035 in Phase 6 which means its price is set to appreciate by 16.67%. That presents investors with an opportunity for high returns. Through both market demand and strong lending approaches, Mutuum Finance is an intriguing DeFi project. Mutuum Finance’s Lending Platform Gains Trust as Certik Audit Wraps Up The Mutuum system brings together both Peer-to-Contract (P2C) and Peer-to-Peer (P2P) models. With P2C, individuals can gain rewards from USDT pools and automated smart contracts and P2P gives them full power to handle direct cryptocurrency payments. Because of these factors, trading in DeFi has become safer, more convenient and more attractive for high-yield investors. Mutuum Finance is building a fully collateralized, USD-backed stablecoin to be issued on the Ethereum network. Its overcollateralized design ensures long-term price stability, avoiding the collapse risks that have affected algorithmic stablecoins. The platform is powered by open-source smart contracts that have now been officially audited and certified safe by Certik, providing a strong foundation for user trust and paving the way for institutional adoption. Rewarding Early Investors and Growing the Community Mutuum Finance is encouraging people to join by offering attractive rewards to early investors. Ten lucky participants in the ongoing Mutuum Finance (MUTM) $100,000 giveaway will be rewarded with $10,000 worth of MUTM tokens each. Since Bitcoin and Ethereum have passed $105,000 and $2,000, respectively, investors believe in their continued growth. Along with this, Mutuum Finance (MUTM) is gaining attention after raising over $10.1 million from more than 11,700 participants in its presale. MUTM is currently $0.03 and it is forecasted to go up 16.67% very soon, so buying it now could potentially earn potential investors double their initial investment by purchasing at its initial offering of $0.03. Being able to lend money using a new system and providing a stablecoin makes it attractive in the world of DeFi. Thanks to these early supports and increasing appreciation, MUTM proves itself to be valued as much as BTC and ETH. For more information about Mutuum Finance (MUTM) visit the links below: Website: https://mutuum.com/ Linktree: https://linktr.ee/mutuumfinance",cryptopolitan,https://www.cryptopolitan.com/mutuum-finance-mutm-picks-up-speed-as-bitcoin-btc-and-ethereum-eth-continue-to-rise/,"BTC|BUSINESS|ETH|MARKET|TRADING","Press Release",cryptocompare
2025-06-08T11:27:42,"Bitcoin Family May Enhance Security by Splitting Seed Phrase Across Multiple Global Locations","The Bitcoin Family has taken a groundbreaking step in cryptocurrency security by distributing their seed phrase across multiple global locations, highlighting the critical importance of safeguarding digital assets. This move",coinotag,https://en.coinotag.com/bitcoin-family-may-enhance-security-by-splitting-seed-phrase-across-multiple-global-locations/,"BTC","News|BTC|CYBER",cryptocompare
2025-06-08T11:22:42,"Ripple CTO Suggests Roger Ver’s Legal Issues May Reflect Broader Ideological Conflict","Ripple CTO David Schwartz sheds light on the ongoing legal battle surrounding Roger Ver, highlighting deeper ideological conflicts beyond the tax allegations. Ver, a prominent early Bitcoin advocate known as",coinotag,https://en.coinotag.com/ripple-cto-suggests-roger-vers-legal-issues-may-reflect-broader-ideological-conflict/,"BCH|BTC|REGULATION","Bitcoin|News|BCH|BTC",cryptocompare
2025-06-08T11:20:15,"Billionaire Ray Dalio Issues New Warning, Says US Deficits Triggering ‘Very High Likelihood of Real Problems’","Billionaire hedge fund legend Ray Dalio says that the financial situation in the US presents a high likelihood of serious problems moving forward. In a new interview on PBS’s Amanpour and Company, Dalio, founder of Bridgewater Associates, says that the US government is in a situation where it absolutely must lower its budget deficit as a percentage of GDP from 7% to 3%. According to Dalio, the government must take a three-step approach to lowering the deficit-to-GDP ratio if it wants to avoid a “very high likelihood of real problems.” “It has to be done with three things, and it has to be spread out among these three things, because any one of those three things would be too painful. Those three things are tax revenue, spending cuts and interest rates. Although Congress and the president in the process does not deal directly with the third of those, right now a trillion dollars – half of our deficit – is interest payments, and not only do we have a trillion dollar interest payment, in the next year, we have nine trillion dollars of debt maturing that has to be either rolled over or sold… So there’s what I call my 3%, three-part solution, which was very similar to 1991-1998. It was cut by 5% of GDP, the budget deficit, in those years was cut by 5% of GDP by spreading it around. So those are the three things that are needed.” Follow us on X , Facebook and Telegram Don't Miss a Beat – Subscribe to get email alerts delivered directly to your inbox Check Price Action Surf The Daily Hodl Mix Disclaimer: Opinions expressed at The Daily Hodl are not investment advice. Investors should do their due diligence before making any high-risk investments in Bitcoin, cryptocurrency or digital assets. Please be advised that your transfers and trades are at your own risk, and any losses you may incur are your responsibility. The Daily Hodl does not recommend the buying or selling of any cryptocurrencies or digital assets, nor is The Daily Hodl an investment advisor. Please note that The Daily Hodl participates in affiliate marketing. Generated Image: Midjourney The post Billionaire Ray Dalio Issues New Warning, Says US Deficits Triggering ‘Very High Likelihood of Real Problems’ appeared first on The Daily Hodl .",dailyhodl,https://dailyhodl.com/2025/06/08/billionaire-ray-dalio-issues-dire-warning-says-us-deficits-triggering-very-high-likelihood-of-real-problems/,"BTC|BUSINESS|REGULATION|TRADING","Financeflux|News|ray dalio|US budget deficit|US Debt",cryptocompare
2025-06-08T11:11:20,"House Committee Reviews Trump’s Crypto Activities and Regulatory Acts, Considering Potential Bitcoin Market Impacts","The House Financial Services Committee recently convened to scrutinize former President Donald Trump’s involvement in cryptocurrency and evaluate the implications of the CLARITY Act on the U.S. crypto regulatory framework.",coinotag,https://en.coinotag.com/house-committee-reviews-trumps-crypto-activities-and-regulatory-acts-considering-potential-bitcoin-market-impacts/,"BTC|MARKET|REGULATION","News|BTC",cryptocompare
2025-06-08T11:11:03,"Crypto Weekly Roundup: BlackRock Shifts Focus To ETH, Trump Crypto Chaos, & More","BlackRock made headlines this week by offloading $561 million in Bitcoin to increase its Ethereum holdings, while the U.S. deepened crypto ties with El Salvador and X partnered with Polymarket for on-chain prediction markets. Meanwhile, a Trump crypto wallet controversy stirred infighting, and a Bitcoin-linked political scandal toppled the Czech Republic’s justice minister. Let’s find out more. Bitcoin The United States could be moving to deepen its engagement with El Salvador’s crypto leadership, as Bo Hines , executive director of the White House’s Presidential Council of Advisers for Digital Assets, met with Salvadoran President Nayib Bukele this week. https://cryptodaily.co.uk/2025/06/bitcoin-liquidity-boost-us-treasurys-10b-debt-buyback-spikes-crypto-market The largest U.S. Treasury buyback in history has taken place with a $10 billion purchase, resulting in Bitcoin spiking nearly $3,000 so far on Friday. Ethereum The Ethereum Foundation has announced a revised treasury management policy aimed at strengthening financial stability and safeguarding ecosystem funding in the face of crypto market volatility. BlackRock has liquidated $561 million in Bitcoin while acquiring $69 million worth of Ethereum, signaling a strategic institutional pivot amid shifting crypto market dynamics. Business Social media platform X, formerly Twitter, has officially partnered with Polymarket, a decentralized cryptocurrency prediction market, in a move aimed at blending real-time public conversation with on-chain forecasting. A dispute has broken out between various Trump-affiliated crypto ventures after a website claiming to represent an “official” Trump crypto wallet surfaced online, triggering public denials from the President’s family. Russia’s largest lender, Sberbank , has launched a new financial product tying investor returns to Bitcoin’s price performance and the U.S. dollar-to-ruble exchange rate, signaling Moscow’s growing engagement with cryptocurrency markets. Hong Kong-based Reitar Logtech Holdings Ltd. has announced plans to acquire up to $1.5 billion worth of Bitcoin, marking one of the largest potential corporate crypto treasury allocations to date. Web3 Aurora Labs is beefing up the infrastructure side of its Cloud Console by debuting the Aurora Cloud Console Marketplace , which allows developers to create their own Virtual Chain and integrate dozens of tools and services, including identity solutions, data oracles, payments, compute, data layers and security systems, with just a few clicks. Security Taiwanese cryptocurrency exchange BitoPro has confirmed it suffered a cyberattack resulting in the theft of approximately $11.5 million in digital assets. The breach, which occurred during a system upgrade, was publicly identified after on-chain sleuths flagged a series of suspicious withdrawals from the platform. Regulation The Czech Republic’s political establishment is grappling with a deepening crisis after revelations of a multimillion-dollar Bitcoin donation, linked to a convicted drug trafficker, forced the country’s justice minister to resign and triggered calls for a no-confidence vote against Prime Minister Petr Fiala’s government. Disclaimer: This article is provided for informational purposes only. It is not offered or intended to be used as legal, tax, investment, financial, or other advice",cryptodaily,https://cryptodaily.co.uk/2025/06/crypto-weekly-roundup-blackrock-shifts-focus-to-eth-trump-crypto-chaos-more,"BTC|BUSINESS|ETH|MARKET|REGULATION","Breaking News",cryptocompare
2025-06-08T11:08:07,"Bitcoin Family Possibly Enhances Security by Distributing Seed Phrase Across Four Continents Amid Rising Crypto Crimes","Didi Taihuttu and his “Bitcoin Family” have implemented a groundbreaking security strategy by distributing their Bitcoin seed phrase across four continents to combat rising crypto-related threats. This innovative approach combines",coinotag,https://en.coinotag.com/bitcoin-family-possibly-enhances-security-by-distributing-seed-phrase-across-four-continents-amid-rising-crypto-crimes/,"BTC","News|BTC",cryptocompare
2025-06-08T11:07:07,"Bitcoin Market Remains Cautious as Trump Reports Progress in US-China Deal Negotiations","Recent developments in US-China trade negotiations have sparked cautious optimism, with potential implications for global crypto markets and economic policies. Despite claims of progress by former President Donald Trump, market",coinotag,https://en.coinotag.com/bitcoin-market-remains-cautious-as-trump-reports-progress-in-us-china-deal-negotiations/,"BTC|ETH|MARKET|REGULATION","Bitcoin|Ethereum|News|BTC|ETH",cryptocompare
2025-06-08T11:05:00,"Ripple CTO Delivers Brutal Truth About 'Bitcoin Jesus' Roger Ver Case","Real story behind 'Bitcoin Jesus' charges is much worse, reveals Ripple CTO David Schwartz",utoday,https://u.today/ripple-cto-delivers-brutal-truth-about-bitcoin-jesus-roger-ver-case,"BTC","Bitcoin|BTC",cryptocompare
2025-06-08T11:04:38,"Bitcoin Whales Accumulate Amid Renewed Buying Momentum, Potential Resistance Near $107K","Bitcoin (BTC) is witnessing a significant return of large investors as whales accumulate substantial amounts, signaling renewed institutional confidence in the cryptocurrency market. Recent data reveals that Bitcoin is experiencing",coinotag,https://en.coinotag.com/bitcoin-whales-accumulate-amid-renewed-buying-momentum-potential-resistance-near-107k/,"BTC|BUSINESS|MARKET","Bitcoin|News|BTC",cryptocompare
2025-06-08T11:00:33,"Bitcoin: Will a $26M whale move help BTC push past $107K?","BTC is seeing big money return as whales stack coins but can buyers keep momentum before sellers return?",ambcrypto,https://ambcrypto.com/bitcoin-will-a-26m-whale-move-help-btc-push-past-107k/,"BTC","Bitcoin|BTC Trading View|News|News 1|Social|Trading View",cryptocompare
2025-06-08T10:56:00,"‘Bitcoin Family’ revamps security after crypto crime wave","After a wave of crypto crimes, Didi Taihuttu and his “Bitcoin Family” revamped their security by splitting their Bitcoin seed phrase across four continents.",cointelegraph,https://cointelegraph.com/news/bitcoin-family-splits-seed-phrase-global-security-upgrade?utm_source=rss_feed&utm_medium=rss&utm_campaign=rss_partner_inbound,"BTC","",cryptocompare
2025-06-08T10:45:50,"Bitcoin Eyes Breakout as Traders Watch Key Levels","Bitcoin held firm near $105,500 on June 8, signaling that its recent corrective phase may be nearing an end. The move followed a dip to $100,500 on June 5, but BTC/USD has since staged a steady recovery, nearing its weekly open. Bullish Momentum Reappears Popular analyst Rekt Capital noted signs of strength on the daily chart. “On the Daily timeframe, Bitcoin is showcasing signs of breaking its two-week Downtrend… while also turning it into support earlier today,” he said on X. He added that a daily close and retest around $106,600 would solidify a bullish continuation. Other traders, like SuperBro, also pointed to Bitcoin closing above its 10-day simple moving average as a positive sign. That metric, according to SuperBro, helps invalidate bearish scenarios. Liquidity Signals Suggest Imminent Volatility Trader Cas Abbe examined order book liquidity and observed building pressure both above and below spot price. He suggested this setup could lead to a “magnet-style” price move. “BTC liquidation cluster is now signalling an upside move,” he said. Abbe noted that a 10% price increase could liquidate $15.11 billion in shorts, while a 10% drop would impact $9.58 billion in longs. He also pointed to negative funding rates as evidence of mounting short positions. “I think BTC big move is coming next week, possibly pushing it above $109K–$110K,” he predicted. Key Support Levels Remain in Focus Some analysts are still preparing for a possible retest of lower support zones. Trader CrypNuevo said $100,000 remains a strong psychological support. “100k is the strongest psychological support… it’s the area where I’m building some longs with easy invalidation below it,” he explained. Rekt Capital Eyes Weekly Close Importance Rekt Capital also highlighted the importance of Bitcoin holding above $104,400 for a fourth consecutive weekly close. He described the retest following May’s all-time highs as “successful,” adding further weight to bullish sentiment. With market conditions showing renewed strength, all eyes are now on the next move as Bitcoin sits on the edge of a potential breakout.",cryptointelligence,https://www.cryptointelligence.co.uk/bitcoin-eyes-breakout-as-traders-watch-key-levels/,"BTC|MARKET|TRADING","Bitcoin|Crypto News Today",cryptocompare
2025-06-08T10:44:40,"Hong Kong Considers Bitcoin Perpetual Contracts for Professional Investors in New Derivative Trading Policy","Hong Kong’s Securities and Futures Commission is actively exploring the introduction of virtual asset derivative trading tailored for professional investors, as confirmed by Christopher Hui, the city’s Secretary for Financial",coinotag,https://en.coinotag.com/breakingnews/hong-kong-considers-bitcoin-perpetual-contracts-for-professional-investors-in-new-derivative-trading-policy/,"ASIA|BTC|BUSINESS|ETH|TRADING","BTC|ETH",cryptocompare
2025-06-08T10:33:42,"$1M Bitcoin Possible. Adam Back Explains Why","Here's why Bitcoin could still reach $1 million during this cycle",utoday,https://u.today/1m-bitcoin-possible-adam-back-explains-why,"BTC","Bitcoin Price Prediction|BTC",cryptocompare
2025-06-08T10:33:07,"Binance May Adjust Bitcoin Collateral and Leverage Requirements to Enhance Risk Management","Binance has announced significant updates to its collateral ratios and leverage requirements for USDⓈ-M Perpetual Contracts, effective June 6, 2025, aiming to strengthen risk management amid market volatility. The revised",coinotag,https://en.coinotag.com/binance-may-adjust-bitcoin-collateral-and-leverage-requirements-to-enhance-risk-management/,"BTC|ETH|EXCHANGE|MARKET|BNB","Analysis|Bitcoin|Ethereum|News|BTC|ETH",cryptocompare
2025-06-08T10:30:18,"Latam Insights: Brazil Defies Trump’s Threats; Meliuz Seeks Funding to Purchase BTC","Welcome to Latam Insights, a compilation of the most relevant crypto news from Latin America over the past week. In this week’s edition, Lula defies Trump’s tariff threats, Meliuz seeks financing to increase its bitcoin reserves, and Tether invests in Chile-based Orionx. Brazil Defies Trump Tariff Threats, Backs Dollar-Free BRICS Trade Brazilian President Luiz Inácio",bitcoin.com,https://news.bitcoin.com/latam-insights-brazil-defies-trumps-threats-meliuz-seeks-funding-to-purchase-btc/,"BTC|REGULATION|USDT","Crypto News|Cryptocurrency|Latin America LATAM",cryptocompare
2025-06-08T10:29:10,"Bitcoin Liquidation Intensity Could Surge to $885M if Price Drops Below $104,000, Coinglass Data Reveals","According to recent data from Coinglass, the Bitcoin price levels of $104,000 and $106,000 are critical thresholds for liquidation activity on major centralized exchanges (CEXs). Should Bitcoin dip below $104,000,",coinotag,https://en.coinotag.com/breakingnews/bitcoin-liquidation-intensity-could-surge-to-885m-if-price-drops-below-104000-coinglass-data-reveals/,"BTC|TRADING","BTC",cryptocompare
2025-06-08T10:07:03,"Bitcoin Eyes Key Support Levels Amid Growing Potential for Major Liquidity Move","Bitcoin is navigating critical support levels near $105,000 as traders anticipate a potential breakout or a significant liquidity event ahead of the weekly close. Market analysis indicates rising volatility with",coinotag,https://en.coinotag.com/bitcoin-eyes-key-support-levels-amid-growing-potential-for-major-liquidity-move/,"BTC|MARKET","Analysis|Bitcoin|News|BTC",cryptocompare
2025-06-08T10:00:37,"Bitcoin: How a $10.2M BTC investment is changing the corporate game","Even small firms are making billion-dollar crypto moves before the year ends.",ambcrypto,https://ambcrypto.com/bitcoin-how-a-10-2m-btc-investment-is-changing-the-corporate-game/,"BTC","Bitcoin|BTC Trading View|News|News 1|Social|Trading View",cryptocompare
