datetime,headline,summary,source,url,categories,tags,api_source
2025-06-09T20:20:23,"Bitcoin Mining Revolution: Tether Unveils Powerful Open Source MOS","BitcoinWorld Bitcoin Mining Revolution: Tether Unveils Powerful Open Source MOS The world of Bitcoin Mining is constantly evolving, driven by innovation and the pursuit of greater efficiency and accessibility. A significant development recently emerged from a major player in the cryptocurrency space: Tether . Known primarily for its stablecoin USDT, Tether is now making waves in the mining sector with a move that could reshape how operations are managed. What is Tether’s Open Source Mining OS? Tether CEO Paolo Ardoino recently announced a pivotal step for the company’s venture into Bitcoin mining infrastructure. Tether is open-sourcing its Mining OS , a specialized operating system designed specifically for managing Bitcoin Mining operations. This isn’t just a basic piece of software; it’s described as a modular and scalable platform. Think of it as the central nervous system for a mining farm. Whether you’re running a small setup in a garage or managing an industrial-scale facility with thousands of machines, this Mining OS is built to handle the complexity. Its modular design means it can be adapted and scaled to fit various operational sizes and needs. Key features highlighted include: Built-in support for a wide range of mining machines (ASICs). Compatibility with different cooling systems. Integration capabilities for electrical equipment monitoring. A framework for developers to create and add custom plugins. This comprehensive approach aims to provide miners with a unified platform to monitor, control, and optimize their entire operation. Why Did Tether Choose the Open Source Path? Tether’s decision to make its Mining OS Open Source is a strategic one with multiple stated goals. According to Ardoino, a primary motivation is to reduce the reliance on third-party, often proprietary, software solutions that miners currently depend on. This dependency can sometimes lead to vendor lock-in, limited customization, and potential security concerns if the software isn’t transparently developed or audited. By releasing the software under an Open Source license, Tether is inviting the broader community to inspect, use, modify, and contribute to the code. This fosters transparency, allowing anyone to see exactly how the system works, which is crucial in a security-sensitive industry like Crypto Mining . Furthermore, the move is intended to promote broader participation in Bitcoin Mining . Proprietary software can be expensive or have licensing restrictions that make it less accessible, especially for smaller operators. An open-source alternative, typically free to use and modify, lowers the barrier to entry and provides a powerful tool that was previously only available through potentially costly commercial agreements. This initiative could potentially help narrow the technological gap between large corporations with significant R&D budgets and smaller, independent miners. By providing access to sophisticated management tools, Tether aims to empower a wider range of participants in securing the Bitcoin network. The Benefits of an Open Source Mining OS The Open Source model brings several inherent advantages when applied to a critical tool like a Mining OS : Transparency: The code is publicly available, allowing anyone to audit it for bugs, inefficiencies, or malicious code. This builds trust and security. Community Collaboration: Developers from around the world can contribute to improving the software, adding new features, fixing bugs, and ensuring compatibility with new hardware. This accelerates development and innovation. Flexibility and Customization: Miners or developers can modify the software to suit their specific needs, integrate it with other systems, or develop custom plugins for unique functionalities. Reduced Costs: Typically, open-source software is free to use, eliminating licensing fees associated with proprietary solutions. While development or support costs might still exist, the base software is freely available. Increased Security: With many eyes on the code, vulnerabilities are often discovered and patched more quickly than in closed-source projects. For Bitcoin Mining operations, these benefits translate directly into potentially more efficient, more reliable, and more adaptable systems for managing their valuable hardware and resources. How Does This Impact the Crypto Mining Landscape? Tether’s entry into the Open Source Mining OS space could have several ripple effects on the broader Crypto Mining industry. Currently, miners often rely on software provided by ASIC manufacturers or third-party companies. This can lead to a fragmented ecosystem with varying levels of quality, support, and features. A robust, community-driven Open Source alternative has the potential to become a standard, or at least a widely adopted option. This could: Drive innovation across the board as other software providers might need to compete with the features and flexibility offered by the open-source alternative. Make it easier for new entrants to get started in Bitcoin Mining by providing free access to powerful management tools. Improve the overall security posture of mining operations if a widely audited and secure OS becomes available. Foster a more collaborative environment among miners and developers working on the same software base. It’s a move that aligns with the decentralized ethos of Bitcoin itself, providing tools that are not controlled by a single entity, but rather developed and maintained by a community. Exploring the Features: More Than Just Basic Monitoring The description of Tether’s Mining OS points to a platform designed for comprehensive management. Support for various mining machines is fundamental, allowing miners to integrate different models and brands into a single interface. This is particularly useful for larger operations that might use hardware from multiple vendors. Integration with cooling systems (like immersion cooling or traditional air cooling setups) and electrical equipment is also critical. Efficient cooling and power management are key to maximizing profitability and extending the lifespan of mining hardware. The ability to monitor and control these aspects through the same OS streamlines operations significantly. The plugin architecture is perhaps one of the most exciting aspects for developers and advanced users. This allows for customization and expansion beyond the core features. Imagine plugins for advanced data analytics, integration with specific monitoring hardware, automated response systems based on temperature or performance metrics, or even integration with renewable energy sources. This extensibility ensures the Mining OS can evolve and adapt to the future needs and technological advancements in the Crypto Mining space. What’s Next? Adoption and Development While the announcement is promising, the success of Tether’s Open Source Mining OS will ultimately depend on adoption and community engagement. Will miners embrace this new tool? Will developers contribute to its growth and improvement? For miners looking for alternatives to proprietary software, this presents a compelling option to explore. Getting involved early could mean influencing the direction of the software and benefiting from a transparent, community-supported platform. For developers interested in Bitcoin Mining technology, contributing to an open-source Mining OS offers an opportunity to work on a high-impact project within the industry, gain experience, and contribute to a tool used globally. Potential Challenges Like any new software, especially one that is Open Source , there will be challenges. Initial adoption might be slow as miners evaluate its stability and features compared to existing solutions. Community contributions need to be managed effectively to ensure code quality and security. Support might rely heavily on community forums and documentation initially. However, given Tether’s resources and commitment, and the inherent benefits of the Open Source model, there is significant potential for this project to become a valuable asset for the entire Bitcoin Mining ecosystem. A Bold Step for Tether and Bitcoin Mining Tether’s decision to open-source its Bitcoin Mining Operating System is a bold and potentially transformative step. By providing a free, transparent, modular, and scalable tool, they are not only reducing reliance on proprietary software but also actively working to make Bitcoin Mining more accessible and efficient for a broader range of participants. This move aligns with the core principles of decentralization and community collaboration that underpin Bitcoin. As the project develops and gains traction, it will be exciting to see how the community leverages this powerful new tool to innovate and strengthen the global Crypto Mining infrastructure. To learn more about the latest Bitcoin Mining trends, explore our article on key developments shaping Bitcoin Mining operations. This post Bitcoin Mining Revolution: Tether Unveils Powerful Open Source MOS first appeared on BitcoinWorld and is written by Editorial Team",bitcoinworld,https://bitcoinworld.co.in/tether-bitcoin-mining-os/,"BTC|MINING|TECHNOLOGY|USDT","Crypto News|bitcoin Mining|Crypto|open source.|Technology|Tether",cryptocompare
2025-06-09T20:17:38,"Analyst Says Altseason Will Come and XRP Will Explode. Here’s the Timeline","A notable shift may be looming on the cryptocurrency horizon, as seasoned analyst CryptoBull forecasts the arrival of a major altseason, a phase in which alternative cryptocurrencies (altcoins) outperform Bitcoin in market gains. Among the altcoins expected to surge significantly is XRP, the digital asset associated with Ripple. According to CryptoBull, market dynamics suggest that a decisive transition from Bitcoin to altcoins is likely to unfold within the next three months—a development that could catalyze explosive growth for XRP and other undervalued tokens. Bitcoin Dominance in a Rising Wedge The technical foundation of CryptoBull’s prediction is rooted in the Bitcoin Dominance (BTC.D) chart, which tracks Bitcoin’s market share relative to the entire cryptocurrency market. As of early June, BTC.D has been charting a rising wedge pattern—a formation traditionally viewed as bearish, particularly when appearing in an overextended trend. Altseason will come and #XRP will explode. Bitcoin dominance is in a rising wedge getting closer to the apex. Within the next 3 months we will see a shift from Bitcoin to altcoins. pic.twitter.com/vJgCzxoOpd — CryptoBull (@CryptoBull2020) June 9, 2025 The wedge is narrowing toward its apex, indicating a potential breakdown that would signal waning strength for Bitcoin relative to the broader altcoin market. Historically, when BTC dominance experienced similar wedge breakdowns, it was followed by significant capital shifts into altcoins, resulting in widespread price increases. According to CryptoBull, this cyclical trend remains consistent, with technical indicators showing that a shift in dominance is not only possible but imminent. XRP Poised for a Breakout Among the altcoins that stand to benefit from this rotation, XRP takes center stage. Even though many investors view the asset as fundamentally undervalued, particularly in light of Ripple’s expanding global presence and its push to integrate real-world asset (RWA) tokenization into financial markets, CryptoBull emphasizes that XRP is primed for a significant move, supported by both technical patterns and broader market catalysts. From a technical perspective, XRP has been forming a long-term consolidation pattern, building support levels that analysts believe could soon give way to a parabolic breakout once market sentiment shifts decisively toward altcoins. We are on twitter, follow us to connect with us :- @TimesTabloid1 — TimesTabloid (@TimesTabloid1) July 15, 2023 Macro Catalysts and Timeline CryptoBull’s forecast aligns with broader macroeconomic and market conditions. Historically, altseasons have followed key phases in the Bitcoin cycle—often when Bitcoin consolidates after a strong upward move, giving traders confidence to diversify into higher-risk assets. With Bitcoin having rallied sharply in Q1 2025 and now trading in a relatively tight range, the stage appears set for capital rotation. The next three months are seen as pivotal . CryptoBull believes that as Bitcoin dominance begins to decline from the rising wedge formation, liquidity will start flowing into the altcoin sector. This timeline aligns with past market cycles, such as in early 2018 and mid-2021, when altcoin surges followed Bitcoin’s peak performance. Additionally, growing institutional engagement with XRP and the XRPL, including integrations of Ripple’s technology in regions such as the Middle East, Africa, and Latin America, enhances the token’s appeal. As utility narratives gain traction, particularly around stablecoins and tokenized assets, XRP’s real-world applications may become a central driver of price appreciation during the next wave of altcoin enthusiasm. If history is any guide, the next three months could mark the beginning of a powerful altseason, one that sees XRP finally make good on its long-anticipated breakout. As the crypto market evolves and narratives mature, XRP is increasingly viewed not just as a speculative asset but as a cornerstone of future financial infrastructure. Disclaimer : This content is meant to inform and should not be considered financial advice. The views expressed in this article may include the author’s personal opinions and do not represent Times Tabloid’s opinion. Readers are urged to do in-depth research before making any investment decisions. Any action taken by the reader is strictly at their own risk. Times Tabloid is not responsible for any financial losses. Follow us on Twitter , Facebook , Telegram , and Google News The post Analyst Says Altseason Will Come and XRP Will Explode. Here’s the Timeline appeared first on Times Tabloid .",timestabloid,https://timestabloid.com/analyst-says-altseason-will-come-and-xrp-will-explode-heres-the-timeline/,"ALTCOIN|BTC|MARKET|TRADING|XRP","Cryptocurrency|News|Altcoins|Bitcoin|XRP",cryptocompare
2025-06-09T20:17:27,"'Bitcoin First' KULR Technology Seeks $300 Million to Boost BTC Holdings","The publicly traded company holds 920 Bitcoin, worth just under $1 billion on Monday.",decrypt,https://decrypt.co/324242/bitcoin-first-kulr-technology-seeks-300-million-to-boost-btc-holdings,"BTC|BUSINESS|TECHNOLOGY","Business",cryptocompare
2025-06-09T20:15:19,"ETF Weekly Flows: $129 Million Outflow for Bitcoin and $281 Million Inflow for Ether","Bitcoin ETFs suffered a net outflow of $129 million for the week ending June 6, marking the second consecutive week of red flows. Meanwhile, ether ETFs extended their inflow streak to a fourth week, locking in a strong $281.07 million, the third-highest weekly inflow of 2025. Bitcoin ETFs Log Second Straight Week of Outflows While",bitcoin.com,https://news.bitcoin.com/etf-weekly-flows-129-million-outflow-for-bitcoin-and-281-million-inflow-for-ether/,"BTC","Markets and Prices|Bitcoin (BTC)|ETF|Ethereum (ETH)",cryptocompare
2025-06-09T20:15:07,"Ethereum May Play a Central Role in Financial Innovation Amid Growing Institutional Interest","Ethereum is emerging as the driving force behind the next wave of Financial Innovation, shifting the crypto narrative from Bitcoin’s store-of-value dominance to programmable blockchain utility. Bernstein analysts emphasize Ethereum’s",coinotag,https://en.coinotag.com/ethereum-may-play-a-central-role-in-financial-innovation-amid-growing-institutional-interest/,"BTC|ETH|MARKET|ARB|IMX","Analysis|Ethereum|News|ARB|BTC|ETH|IMX",cryptocompare
2025-06-09T20:14:17,"Bitcoin Nears $106,000 as Institutional Interest May Shift Toward Promising Altcoins","Bitcoin’s ongoing price challenge near the $106,000 mark is shifting investor attention toward promising altcoins such as SUI, AVAX, and DOT, signaling a potential market rotation. Institutional and retail investors",coinotag,https://en.coinotag.com/bitcoin-nears-106000-as-institutional-interest-may-shift-toward-promising-altcoins/,"ALTCOIN|AVAX|BTC|DOT|SUI","News|AVAX|BTC|DOT|FLOW|SUI",cryptocompare
2025-06-09T20:11:47,"Bitcoin Could Potentially Reach New Highs Amid Bullish Technical Indicators and Increased HODLing","Bitcoin is showing promising signs of a potential surge, driven by key technical indicators and a resurgence in long-term investor confidence. Market data reveals a growing trend of Bitcoin holders",coinotag,https://en.coinotag.com/bitcoin-could-potentially-reach-new-highs-amid-bullish-technical-indicators-and-increased-hodling/,"BTC|BUSINESS|MARKET|TRADING","Analysis|News|BTC",cryptocompare
2025-06-09T20:10:59,"Bitcoin Treasury Strategy: Anemoi Makes Bold Move with 30% Allocation","BitcoinWorld Bitcoin Treasury Strategy: Anemoi Makes Bold Move with 30% Allocation The world of corporate finance is witnessing a fascinating shift, with an increasing number of companies exploring alternative asset classes for their treasury reserves. A recent, noteworthy development comes from the UK-listed firm, Anemoi, which has announced a significant allocation to the leading cryptocurrency. This move places Anemoi Bitcoin investment firmly on the radar of market watchers, highlighting a growing trend towards incorporating digital assets into traditional financial planning. Anemoi’s Strategic Shift: Embracing a Bitcoin Treasury Strategy In a move that underscores a revised approach to managing its financial assets, UK-listed Anemoi has strategically allocated a substantial portion of its cash reserves to Bitcoin. According to a company statement disseminated via EQS News, approximately 30% of Anemoi’s cash is now held in the pioneering cryptocurrency. The company’s board explicitly stated that this decision aligns with its updated treasury approach. This isn’t just a speculative flutter; it signals a deliberate and considered shift in how Anemoi views the management of its corporate funds, potentially setting a precedent for other firms, particularly within the UK market. The statement also hinted at further announcements regarding Anemoi’s financial and business strategies. This suggests the Bitcoin allocation is part of a broader strategic evolution within the company, indicating that stakeholders can expect more details on how this digital asset integration will impact their overall operations and financial health. Why Are Companies Like Anemoi Considering Corporate Treasury Bitcoin ? Anemoi’s decision is not isolated. It reflects a burgeoning trend of companies, both large and small, evaluating or executing investments in Bitcoin for their treasury holdings. Several factors are driving this interest: Inflation Hedge: In an era of quantitative easing and concerns about currency devaluation, Bitcoin’s fixed supply is seen by some as a potential hedge against inflation, preserving purchasing power over the long term. Store of Value: Often dubbed ‘digital gold’, Bitcoin is increasingly viewed as a robust store of value, offering a potential alternative to traditional safe-haven assets. Diversification: Adding Bitcoin to a treasury portfolio can offer diversification away from traditional assets like cash, bonds, and equities, potentially reducing overall portfolio risk (though introducing new forms of risk). Potential for Appreciation: While volatile, Bitcoin has demonstrated significant long-term price appreciation, offering the potential for substantial returns on treasury funds that would otherwise yield minimal interest in traditional low-rate environments. Future-Proofing: Embracing digital assets can position a company at the forefront of financial innovation, potentially aligning with future trends in finance and technology. For a UK Company Bitcoin allocation is still relatively novel compared to some counterparts in the US, making Anemoi’s move particularly notable within the British corporate landscape. The Rise of Institutional Bitcoin Adoption : Anemoi Joins the Ranks Anemoi’s investment is another data point in the accelerating trend of Institutional Bitcoin Adoption . While giants like MicroStrategy and Tesla captured early headlines with large-scale Bitcoin purchases, the movement is broadening. Smaller and mid-sized companies across various sectors are now considering or implementing similar strategies. This growing institutional interest lends legitimacy to Bitcoin as an asset class and can contribute to its price stability and wider acceptance. This adoption isn’t limited to direct treasury investments. It also includes: Financial institutions offering Bitcoin-related products (ETFs, custody services). Payment processors integrating Bitcoin and other cryptocurrencies. Venture capital funding flowing into crypto startups. Anemoi’s decision, therefore, is part of a larger global narrative where traditional finance is increasingly intersecting with the digital asset space. It highlights that the conversation around Bitcoin is moving beyond individual investors and becoming a serious consideration in corporate boardrooms. Navigating the Challenges of a Bitcoin Treasury Strategy While the potential benefits are attractive, adopting a Bitcoin Treasury Strategy comes with significant challenges that companies like Anemoi must address: Challenge Description Volatility Bitcoin’s price can experience rapid and significant fluctuations, potentially impacting the reported value of treasury holdings. Regulatory Uncertainty The regulatory landscape for cryptocurrencies is still evolving globally, including in the UK, posing compliance and legal risks. Security Risks Storing and managing private keys requires robust security protocols to prevent loss or theft. Accounting and Tax Treatment Accounting for Bitcoin holdings can be complex, and tax implications vary by jurisdiction and can be challenging to navigate. Public Perception Investing in a volatile and sometimes controversial asset like Bitcoin can impact shareholder and public perception. Companies must have a clear understanding of these risks and implement appropriate risk management strategies, including secure custody solutions and clear accounting policies, before making such an allocation. Anemoi’s board likely considered these factors as part of their revised treasury approach. What Anemoi’s Move Could Mean for the Future Anemoi’s allocation of 30% of its cash to Bitcoin is a significant statement. It suggests a strong belief in Bitcoin’s long-term value proposition and its role within a diversified corporate treasury. As a UK Company Bitcoin investor, Anemoi’s experience will likely be watched closely by other firms in the region contemplating similar moves. The company’s promise of further updates on its financial and business strategies indicates that this is just the beginning of their journey with digital assets. Future announcements might shed light on: The specific timing and price of the Bitcoin purchase(s). Their chosen custody solution for the Bitcoin holdings. How the Bitcoin holdings will be accounted for on their balance sheet. Any potential integration of blockchain technology or cryptocurrencies into their core business operations. This development reinforces the narrative that Bitcoin is transitioning from a fringe asset to a more mainstream component of corporate finance, driven by evolving views on monetary policy, asset diversification, and technological innovation. Concluding Thoughts: A Bold Step in Institutional Bitcoin Adoption Anemoi’s decision to allocate 30% of its cash reserves to Bitcoin is a bold move that highlights the increasing confidence among some corporate leaders in digital assets. This Bitcoin Treasury Strategy by a UK Company Bitcoin investor like Anemoi serves as a tangible example of the accelerating trend of Institutional Bitcoin Adoption . While challenges remain, the strategic rationale cited by Anemoi—aligning with a revised treasury approach—suggests a long-term perspective. As more companies explore Corporate Treasury Bitcoin allocations, the line between traditional finance and the digital asset ecosystem will continue to blur, potentially reshaping corporate balance sheets and investment strategies for years to come. To learn more about the latest Bitcoin and institutional adoption trends, explore our articles on key developments shaping Bitcoin institutional adoption . This post Bitcoin Treasury Strategy: Anemoi Makes Bold Move with 30% Allocation first appeared on BitcoinWorld and is written by Editorial Team",bitcoinworld,https://bitcoinworld.co.in/anemoi-bitcoin-treasury/,"BTC|BUSINESS|MARKET|REGULATION|TRADING","Crypto News|Anemoi|BITCOIN|institutional adoption|Treasury Strategy|UK Companies",cryptocompare
2025-06-09T20:02:41,"Paraguay Investigates Possible Hack of President’s Account After False Bitcoin Legal Tender Claims","Paraguay’s presidential social media account was reportedly hacked, spreading false claims about Bitcoin becoming legal tender and a $5 million BTC reserve fund. The fraudulent post mimicked official government documentation",coinotag,https://en.coinotag.com/paraguay-investigates-possible-hack-of-presidents-account-after-false-bitcoin-legal-tender-claims/,"BTC|FIAT|REGULATION","Bitcoin|News|BTC",cryptocompare
