datetime,headline,summary,source,url,categories,tags,api_source
2025-06-09T19:40:31,"Bitcoin Faces Critical Juncture After Pullback: Bitfinex Analysis Reveals Key Pressures","BitcoinWorld Bitcoin Faces Critical Juncture After Pullback: Bitfinex Analysis Reveals Key Pressures The world of cryptocurrency is never dull, and recent movements in the Bitcoin price prove just that. After hitting impressive highs, the leading digital asset experienced a notable pullback, leaving investors and analysts pondering the next move. What’s driving this volatility, and what does it mean for the broader crypto market ? Understanding the Recent Bitcoin Pullback According to the latest Bitfinex Alpha report, the weekly analysis from U.S.-based crypto exchange Bitfinex, Bitcoin has seen its price drop by over 10% from its recent all-time highs. This isn’t just random market noise; several significant factors appear to be converging to create this downward pressure. Key drivers identified by Bitfinex include: Strong Spot Demand: While seemingly counterintuitive, persistent underlying demand can sometimes lead to rapid price increases that become unsustainable in the short term, setting the stage for corrections. Long-Term Holder Profit-Taking: After significant price appreciation, long-term holders who have held Bitcoin for years often decide to sell a portion of their holdings to realize profits. This adds substantial sell pressure to the market. Macroeconomic Strain: The broader global economic environment, particularly in major economies like the U.S., plays an increasingly important role in crypto asset performance. Signs of economic weakening or policy shifts can influence investor sentiment and capital flows. The Impact of Liquidation Events One of the most dramatic aspects of the recent price drop was the scale of liquidations. Bitfinex highlighted that on a single day, June 5th, over $875 million in long positions were liquidated. This figure is substantial and underscores the leveraged nature of much of the trading activity in the crypto market . What is Liquidation? Liquidation occurs in margin or futures trading when a trader’s position is forcibly closed because they don’t have enough margin to cover potential losses. When a leveraged long position (betting on the price going up) faces a significant price drop, the exchange automatically sells off the position to prevent the account balance from falling below zero. Large-scale liquidations can create a cascading effect, pushing the price down further and triggering more liquidations, accelerating the decline. The $875 million figure indicates that a large number of traders were positioned for further price increases using leverage. When the price moved against them, these positions were wiped out, adding significant sell volume to the market and contributing to the speed and depth of the 10% pullback. What Does Bitfinex Analysis Say About Support Levels? Despite the increased sell pressure and the recent dip, the Bitfinex analysis points to critical levels where Bitcoin’s price might find support. Identifying these levels is crucial for traders and investors trying to gauge potential bottoms or re-entry points. According to the report, key support levels for BTC to watch are: $103,700 $97,100 $95,600 These levels represent potential price points where buying interest might increase, historically significant price areas, or technical indicators suggesting a floor. While support levels are not guaranteed, they serve as important markers for market participants. How Are Macroeconomic Factors Influencing Bitcoin? The connection between traditional finance and the crypto market is becoming undeniable, and macroeconomic factors are playing a larger role than ever. The Bitfinex report specifically mentions signs of weakening in the U.S. economy. Indicators of this potential weakening include: Slowing job growth Contraction in manufacturing activity Contraction in services activity Rising inflation pressures (despite efforts to curb it) A weakening economy can influence asset prices in several ways. It might lead central banks to consider interest rate cuts, which could be seen as positive for risk assets like Bitcoin. Conversely, economic uncertainty can lead investors to become more risk-averse, pulling capital out of volatile markets. The interplay of these factors creates a complex backdrop for the Bitcoin price . Growth and Adoption Continue Amidst Volatility It’s important to note that even as the market experiences volatility and faces macro headwinds, the underlying trend of crypto adoption continues globally. The Bitfinex report highlights positive developments that showcase the increasing integration of digital assets into the traditional financial system and corporate strategies. Examples cited in the report include: IG Group Offering Spot Crypto Trading: A major global financial services provider like IG Group expanding its offerings to include spot crypto trading signals growing institutional and retail demand and acceptance. Japan’s Metaplanet Raising Funds for Bitcoin Holdings: A Japanese company actively raising capital ($5.4 billion mentioned in the report, though this figure might require verification as it seems exceptionally high for a single raise focused on Bitcoin, perhaps a typo in the source or a cumulative figure/future plan) specifically to increase its Bitcoin holdings mirrors the strategy adopted by companies like MicroStrategy and indicates increasing corporate adoption of Bitcoin as a treasury reserve asset. These examples demonstrate that despite short-term price fluctuations driven by profit-taking and liquidation events, the long-term thesis for crypto adoption and integration remains strong. Actionable Insights for Navigating the Current Market Given the current environment, what should market participants consider? Monitor Macro Data: Pay close attention to economic indicators, central bank statements, and inflation reports, as these are increasingly influencing the crypto market . Watch Key Support Levels: The levels identified by Bitfinex ($103,700, $97,100, $95,600) are important technical points. Observing how the price reacts around these levels can provide clues about potential future movements. Understand Liquidation Risks: For those using leverage, the recent events are a stark reminder of the risks involved. Excessive leverage can lead to rapid losses during pullbacks. Focus on Long-Term Trends: While short-term volatility is normal, the continued growth in adoption and infrastructure development supports the long-term potential of Bitcoin and the broader crypto market . Risk Management: Always employ sound risk management practices, including setting stop-losses and not investing more than you can afford to lose. Conclusion: A Crossroads Moment for Bitcoin Bitcoin’s recent 10% pullback, analyzed by Bitfinex, highlights the complex interplay of market dynamics. Driven by profit-taking, significant liquidation events, and mounting macroeconomic factors , the price action underscores the asset’s sensitivity to both internal market structure and the external economic climate. While challenges like economic uncertainty and volatility persist, the continued march of global crypto adoption, exemplified by institutional interest and corporate treasury strategies, paints a picture of long-term resilience. Investors are now watching key support levels closely, trying to determine if this pullback is a temporary correction or the start of a deeper trend. Navigating this period requires a clear understanding of the forces at play and a focus on robust risk management, recognizing that the Bitcoin price journey is influenced by a multitude of global forces. To learn more about the latest crypto market trends, explore our article on key developments shaping Bitcoin price action . This post Bitcoin Faces Critical Juncture After Pullback: Bitfinex Analysis Reveals Key Pressures first appeared on BitcoinWorld and is written by Editorial Team",bitcoinworld,https://bitcoinworld.co.in/bitcoin-pullback-bitfinex-analysis/,"BTC|BUSINESS|EXCHANGE|MARKET|TRADING","Crypto News|BITCOIN|BITFINEX|Crypto Market|Liquidation.|Macro Economy",cryptocompare
2025-06-09T19:36:16,"Bitcoin Proponent Max Keiser Calls XRP a Silent Killer","Max Keiser, a prominent Bitcoin maximalist and media personality, has once again stirred the crypto waters with a scathing critique of XRP, calling it a “silent killer” in a recent post on X. The controversial comment was made in response to a post by the World of Statistics that asked, “What is a silent killer that people don’t realize is slowly killing them?” To that, Keiser simply replied, XRP. Known for his unabashed and often polarizing takes, Keiser’s remark has reignited long-standing tensions between Bitcoin purists and XRP supporters. While the original post was likely meant to evoke reflections on health or societal issues, Keiser’s decision to weaponize it against XRP speaks volumes about the enduring ideological divide in the cryptocurrency space. XRP https://t.co/wec1D1Lwcy — Max Keiser (@maxkeiser) June 8, 2025 Jose F Sanchez’s Painful XRP Confession The impact of Keiser’s jab was amplified by the emotional comment that followed from an X user identified as Jose F Sanchez. Sharing his regret, Sanchez wrote: “XRP made me lose approximately 30 million dollars. I had $8,000 available to invest at the time and was considering buying Solana at $0.54, XRP at $0.16, and Bitcoin at $3,800. Long short story, All inside in XRP and just like that, today Solana is $175, XRP (I don’t even care).” Sanchez’s story resonated with many in the crypto community, highlighting the frustration felt by retail investors who invested in XRP for the long haul, expecting returns similar to those of Solana, Ethereum, and meme coins like Shiba Inu or Dogecoin. While XRP has made gains since its lows, its price trajectory has lagged behind many of its peers, especially during the explosive bull cycles of 2021 and the more recent 2024–2025 rallies. Ripple’s Ongoing Legal Woes and Price Stagnation XRP’s underperformance is not without context. Since December 2020, Ripple Labs, the company closely associated with XRP, has been locked in a high-stakes legal battle with the U.S. Securities and Exchange Commission (SEC), and the case continues to cast a shadow over investor sentiment. These developments have significantly affected XRP’s momentum. While Ripple continues to make strides in enterprise blockchain adoption, including central bank digital currency (CBDC) pilots and cross-border payment solutions, the token itself has not seen price appreciation reflective of these advancements. This disconnect fuels the argument from critics like Keiser, who view XRP as a stagnating asset weighed down by centralized control and legal entanglements. We are on twitter, follow us to connect with us :- @TimesTabloid1 — TimesTabloid (@TimesTabloid1) July 15, 2023 Keiser’s History of Anti-Altcoin Sentiment Max Keiser’s disdain for altcoins, particularly XRP, is nothing new. As an early Bitcoin evangelist and host of The Keiser Report, he has long dismissed all non-Bitcoin digital assets as inferior or even dangerous. He refers to them as “centralized scams” and frequently criticizes their tokenomics, governance models, and lack of true decentralization. His criticism of XRP specifically centers on the coin’s pre-mined nature and Ripple’s significant holdings, which he believes violate the principles of decentralization that underpin Bitcoin. By calling XRP a “silent killer,” Keiser implies that it lulls investors into a false sense of security while quietly eroding their capital and opportunity cost, a point echoed in Sanchez’s regretful account. A Divisive Legacy Max Keiser’s “silent killer” remark may be seen as harsh hyperbole by some, but it encapsulates a broader narrative: the vast ideological rift within the crypto ecosystem. Bitcoin purists view XRP as a relic of the traditional financial system , marked by centralization, lack of transparency, and regulatory trade-offs, which Bitcoin was designed to challenge. Meanwhile, for XRP proponents, the asset is a practical solution to real-world financial inefficiencies, unfairly persecuted by both regulators and rivals. Whether XRP ultimately vindicates its long-term holders or confirms the suspicions of its detractors remains to be seen. Disclaimer : This content is meant to inform and should not be considered financial advice. The views expressed in this article may include the author’s personal opinions and do not represent Times Tabloid’s opinion. Readers are urged to do in-depth research before making any investment decisions. Any action taken by the reader is strictly at their own risk. Times Tabloid is not responsible for any financial losses. Follow us on Twitter , Facebook , Telegram , and Google News The post Bitcoin Proponent Max Keiser Calls XRP a Silent Killer appeared first on Times Tabloid .",timestabloid,https://timestabloid.com/bitcoin-proponent-max-keiser-calls-xrp-a-silent-killer/,"BTC|BUSINESS|REGULATION|TRADING|XRP","Cryptocurrency|News|XRP",cryptocompare
2025-06-09T19:35:43,"The Blockchain Group Plans Possible €300 Million Share Offering to Expand Bitcoin Treasury Holdings","The Blockchain Group is set to raise €300 million through an innovative “at-the-market” offering to expand its Bitcoin treasury, signaling a strategic move in corporate crypto adoption. This initiative, in",coinotag,https://en.coinotag.com/the-blockchain-group-plans-possible-e300-million-share-offering-to-expand-bitcoin-treasury-holdings/,"BLOCKCHAIN|BTC|REGULATION","News|BTC",cryptocompare
2025-06-09T21:38:52,"US lawmakers propose amendment to crypto market structure bill before markup","Two bills in the US Congress considering stablecoins and a digital asset regulatory framework will reach crucial stages this week after long debates and controversies.",Cointelegraph,https://cointelegraph.com/news/amendment-blockchain-developers-crypto-market-structure-bill?utm_source=rss_feed&utm_medium=rss&utm_campaign=rss_partner_inbound,"","",finnhub
2025-06-09T21:30:00,"BlackRock ETH accumulation, key price metrics forecast Ethereum rally to $3K","Rising futures open interest, robust spot ETH ETF flows, and a bullish technical analysis indicator forecast an Ethereum price rally to $3,000.",Cointelegraph,https://cointelegraph.com/news/blackrock-eth-accumulation-key-price-metrics-forecast-ethereum-rally-to-3k?utm_source=rss_feed&utm_medium=rss&utm_campaign=rss_partner_inbound,"","",finnhub
2025-06-09T20:25:59,"Bitcoin Price Surge Sparks Market Rally","The Bitcoin price surge to $108,000 on Monday has ignited a fresh rally across the cryptocurrency market, lifting altcoins and pushing the global market cap above $3.35 trillion. This marks Bitcoin’s highest level since May 29 and represents a 7.55% jump from its monthly low. The upswing comes amid a confluence of bullish signals: easing … Continue reading ""Bitcoin Price Surge Sparks Market Rally""",Cryptocurrency News,https://cryptocurrencynews.com/market-news/market-news-bitcoin-price-surge-sparks-market-rally/,"","",finnhub
2025-06-09T19:00:00,"Bitcoin chart pattern, return of ‘HODL mode’ point to imminent all-time BTC price high","An uptick in long-term Bitcoin holders and BTC’s start-of-week price break above $108,000 could be a sign that new highs are in order.",Cointelegraph,https://cointelegraph.com/news/bitcoin-chart-pattern-return-of-hodl-mode-point-to-imminent-all-time-btc-price-high?utm_source=rss_feed&utm_medium=rss&utm_campaign=rss_partner_inbound,"","",finnhub
2025-06-09T18:50:36,"Paraguay warns of ‘irregular activity’ after post claiming BTC is legal tender","An X post by Paraguay’s President Santiago Peña claimed the country had recognized Bitcoin as legal tender, but the official government account soon urged users to “dismiss any recently published content.”",Cointelegraph,https://cointelegraph.com/news/paraguay-president-santiago-pena-bitcoin-legal-tender?utm_source=rss_feed&utm_medium=rss&utm_campaign=rss_partner_inbound,"","",finnhub
2025-06-09T18:43:10,"Hong Kong to use Chainlink protocol in CBDC pilot project","The study involving Chainlink's Cross-Chain Interoperability Protocol is one of many initiatives exploring use cases for a potential Hong Kong CBDC, or e-HKD.",Cointelegraph,https://cointelegraph.com/news/hong-kong-government-chainlink-ccip-cbdc-pilot-project?utm_source=rss_feed&utm_medium=rss&utm_campaign=rss_partner_inbound,"","",finnhub
2025-06-09T17:50:11,"Price predictions 6/9: SPX, DXY, BTC, ETH, XRP, BNB, SOL, DOGE, ADA, HYPE","Bitcoin price pushed through a critical overhead resistance level, possibly opening the door to new all-time highs.",Cointelegraph,https://cointelegraph.com/news/price-predictions-6-9-spx-dxy-btc-eth-xrp-bnb-sol-doge-ada-hype?utm_source=rss_feed&utm_medium=rss&utm_campaign=rss_partner_inbound,"","",finnhub
2025-06-09T17:17:32,"Nasdaq-listed fintech Netcapital acquires crypto native protocol Mixie","Shares of NCPL surged more than 16% on the news of the Mixie acquisition and are up 48% year-to-date.",Cointelegraph,https://cointelegraph.com/news/netcapital-acquires-mixie-web3-gaming-crypto-merger?utm_source=rss_feed&utm_medium=rss&utm_campaign=rss_partner_inbound,"","",finnhub
2025-06-09T16:06:14,"Bitcoin price rebounds to $108K as millionaire whale goes 20x long on BTC","Analysts say Bitcoin could break its all-time high within 1–2 weeks, following breakout patterns seen recently in gold and the S&P 500.",Cointelegraph,https://cointelegraph.com/news/bitcoin-price-108k-whale-goes-long-20x-long-btc?utm_source=rss_feed&utm_medium=rss&utm_campaign=rss_partner_inbound,"","",finnhub
2025-06-09T15:46:33,"Empty seats could hamper CFTC’s ability to regulate crypto","New legislation in Washington would have the CFTC regulate crypto, but is it currently able to provide effective rulemaking?",Cointelegraph,https://cointelegraph.com/news/cftc-regulate-crypto-bill-us?utm_source=rss_feed&utm_medium=rss&utm_campaign=rss_partner_inbound,"","",finnhub
2025-06-09T15:38:41,"Tether plans to open-source Bitcoin mining OS; CEO says &#039;no need&#039; for 3rd party vendors","The USDt issuer plans to launch its open-source project by the fourth quarter of 2025, according to CEO Paolo Ardoino.",Cointelegraph,https://cointelegraph.com/news/tether-bitcoin-mining-software-open-source?utm_source=rss_feed&utm_medium=rss&utm_campaign=rss_partner_inbound,"","",finnhub
2025-06-09T15:25:00,"Hodling in 2025: The most widely used Bitcoin strategy, explained","Despite market volatility and evolving investment tools, hodling remains the go-to strategy for Bitcoin believers in 2025.",Cointelegraph,https://cointelegraph.com/explained/hodling-in-2025-the-most-widely-used-bitcoin-strategy-explained?utm_source=rss_feed&utm_medium=rss&utm_campaign=rss_partner_inbound,"","",finnhub
2025-06-09T15:15:00,"Trump Wallet scandal: Is Magic Eden really involved or just dragged in?","Magic Eden publicly promoted the Trump Wallet, but conflicting claims and legal fallout raise questions about how clearly the partnership was understood.",Cointelegraph,https://cointelegraph.com/explained/trump-wallet-scandal-is-magic-eden-really-involved-or-just-dragged-in?utm_source=rss_feed&utm_medium=rss&utm_campaign=rss_partner_inbound,"","",finnhub
2025-06-09T15:00:00,"Everyone loves crypto ETFs, but not after reading the fine print","Crypto ETFs have attracted billions in inflows and mainstream attention, but they undermine crypto’s core values of decentralization, self-custody and financial empowerment.",Cointelegraph,https://cointelegraph.com/news/everyone-loves-crypto-etfs?utm_source=rss_feed&utm_medium=rss&utm_campaign=rss_partner_inbound,"","",finnhub
2025-06-09T14:15:00,"A crypto scam that doesn’t need private keys: How does zero-value transfer work?","A crypto investor lost $2.6 million in hours, falling victim to a zero-value transfer scam, a type of address poisoning scam.",Cointelegraph,https://cointelegraph.com/explained/a-crypto-scam-that-doesnt-need-private-keys-how-does-zero-value-transfer-work?utm_source=rss_feed&utm_medium=rss&utm_campaign=rss_partner_inbound,"","",finnhub
2025-06-09T13:26:17,"XRP price will hit $25 if ETF approved, then crash 90%, new analysis says","XRP traders say it has the potential to rally to $27 as ETF approval odds increase.",Cointelegraph,https://cointelegraph.com/news/xrp-price-25-etf-approved-crash-90-new-analysis?utm_source=rss_feed&utm_medium=rss&utm_campaign=rss_partner_inbound,"","",finnhub
2025-06-09T13:14:55,"Australia unmasks $123M crypto laundering ring behind security firm","A multi-agency investigation traced illicit funds to a suspected $123 million crypto laundering operation hiding behind a security company.",Cointelegraph,https://cointelegraph.com/news/australia-crypto-laundering-ring-security-firm?utm_source=rss_feed&utm_medium=rss&utm_campaign=rss_partner_inbound,"","",finnhub
2025-06-09T12:52:36,"Strategy adds 1,045 Bitcoin for $110M in latest purchase","Strategy has acquired 1,045 Bitcoin for $110.2 million as part of its ongoing accumulation strategy, bringing total holdings to 582,000 BTC.",Cointelegraph,https://cointelegraph.com/news/strategy-buys-110m-bitcoin-amid-all-time-high-prices?utm_source=rss_feed&utm_medium=rss&utm_campaign=rss_partner_inbound,"","",finnhub
2025-06-09T12:25:33,"Ethereum privacy roadmap proposes EU GDPR-safe blockchain design","A new Ethereum privacy proposal suggests modular design and privacy tech can help the network align with EU GDPR rules while preserving decentralization.",Cointelegraph,https://cointelegraph.com/news/ethereum-modular-architecture-gdpr-privacy-proposal?utm_source=rss_feed&utm_medium=rss&utm_campaign=rss_partner_inbound,"","",finnhub
2025-06-09T11:47:02,"Kaia pledges won-pegged stablecoin as South Korean payment stocks rally","Kakao-backed blockchain Kaia joins South Korea’s stablecoin race as the tech giant’s payments app surges 30% on the stock market.",Cointelegraph,https://cointelegraph.com/news/kaia-won-pegged-stablecoin-south-korean-payment-stocks?utm_source=rss_feed&utm_medium=rss&utm_campaign=rss_partner_inbound,"","",finnhub
2025-06-09T11:26:36,"Kenya’s crypto tax could hinder Africa’s digital growth opportunity","Kenya’s proposed 1.5% crypto transaction tax could disrupt Africa’s digital integration. As Kenya advances a 1.5% tax on every crypto transaction, the nation risks undermining its fintech leadership, driving startups and talent abroad.",Cointelegraph,https://cointelegraph.com/news/kenya-crypto-tax?utm_source=rss_feed&utm_medium=rss&utm_campaign=rss_partner_inbound,"","",finnhub
2025-06-09T10:32:44,"Ether crypto funds see $296M inflows in best week since Trump election","Ether investment products saw $296 million in inflows last week despite a market slowdown, as investors await clarity from the US Fed’s June rate decision.",Cointelegraph,https://cointelegraph.com/news/ether-funds-296m-inflows-largest-week-trump-election?utm_source=rss_feed&utm_medium=rss&utm_campaign=rss_partner_inbound,"","",finnhub
2025-06-09T10:28:40,"Bitcoin price will see ‘short-term correction’ before $140K: Analysts","Bitcoin analysts say BTC price could drop in the short term before initiating a rally to all-time highs above $140,000.",Cointelegraph,https://cointelegraph.com/news/bitcoin-price-will-see-short-term-correction-before-140k-analysts?utm_source=rss_feed&utm_medium=rss&utm_campaign=rss_partner_inbound,"","",finnhub
2025-06-09T10:12:30,"Tether USDT stablecoin seen on Bolivian store price tags","Tether CEO Paolo Ardoino shared images of Bolivian duty-free goods priced in USDt, suggesting the stablecoin's growing role as a reference currency in a struggling economy.",Cointelegraph,https://cointelegraph.com/news/tether-usdt-prices-goods-bolivia?utm_source=rss_feed&utm_medium=rss&utm_campaign=rss_partner_inbound,"","",finnhub
2025-06-09T09:16:52,"MapleStory revives Avalanche, tops 1M daily transactions twice in a week","Avalanche’s blockchain activity has increased dramatically since classic online game MapleStory got a Web3 makeover on the network.",Cointelegraph,https://cointelegraph.com/news/maplestory-avalanche-tops-daily-transactions?utm_source=rss_feed&utm_medium=rss&utm_campaign=rss_partner_inbound,"","",finnhub
2025-06-09T08:44:05,"Illegal crypto mining surges in Malaysia amid unclear policies","Illegal mining and a lack of regulation limit Malaysia from tapping into the crypto mining revenue.",Cointelegraph,https://cointelegraph.com/news/malaysia-crypto-mining-growth-electricity-theft?utm_source=rss_feed&utm_medium=rss&utm_campaign=rss_partner_inbound,"","",finnhub
2025-06-09T08:09:44,"The Blockchain Group to raise $340M for Bitcoin treasury","The Paris-based crypto company already holds $154 million worth of Bitcoin, claiming to be Europe’s first BTC treasury company.",Cointelegraph,https://cointelegraph.com/news/blockchain-group-raise-340m-bitcoin-treasury?utm_source=rss_feed&utm_medium=rss&utm_campaign=rss_partner_inbound,"","",finnhub
2025-06-09T07:24:28,"$100K becomes bulls&#039; key level: 5 things to know in Bitcoin this week","Bitcoin liquidity conditions form the backdrop of a battle for BTC price support, and bull market continuation, over the coming week.",Cointelegraph,https://cointelegraph.com/news/100k-becomes-bulls-key-level-5-things-bitcoin-this-week?utm_source=rss_feed&utm_medium=rss&utm_campaign=rss_partner_inbound,"","",finnhub
