datetime,headline,summary,source,url,categories,tags,api_source
2025-06-10T01:45:34,"Robert Kiyosaki Declares Civil War Has Begun—Warns of Violent Summer","Robert Kiyosaki declares civil war has begun, sounding the alarm on economic collapse and urging a flight to bitcoin, gold, and silver as fiat trust evaporates. Robert Kiyosaki: Prepare for a Violent Financial Storm as Civil Tensions Erupt Robert Kiyosaki, author of the best-selling book Rich Dad Poor Dad, has issued a bold and urgent",bitcoin.com,https://news.bitcoin.com/robert-kiyosaki-declares-civil-war-has-begun-warns-of-violent-summer/,"BTC|FIAT|BTG","Economics|robert kiyosaki|War",cryptocompare
2025-06-10T01:41:15,"UK Insolvency Service Appoints Crypto Expert to Track Bitcoin and Recover Funds in Bankruptcy Cases","On June 10th, the UK Insolvency Service announced the appointment of its inaugural cryptocurrency intelligence expert to enhance asset recovery efforts within bankruptcy cases. Andrew Small, a former law enforcement",coinotag,https://en.coinotag.com/breakingnews/uk-insolvency-service-appoints-crypto-expert-to-track-bitcoin-and-recover-funds-in-bankruptcy-cases/,"BTC|REGULATION","BTC",cryptocompare
2025-06-10T01:36:18,"CLARITY Act May Influence Bitcoin Regulation Amid Bipartisan Support and Pending Amendments","The CLARITY Act introduces a comprehensive US crypto regulation framework aimed at clarifying token classification and enhancing consumer protection. While the bill enjoys bipartisan support, concerns persist regarding its initial",coinotag,https://en.coinotag.com/clarity-act-may-influence-bitcoin-regulation-amid-bipartisan-support-and-pending-amendments/,"BTC|REGULATION","News|Regulation",cryptocompare
2025-06-10T01:33:04,"Bitcoin Core 30 Update to Boost OP_RETURN Data Limit from 80 Bytes to Nearly 4MB","COINOTAG News reports that the Bitcoin Core development team has revealed plans to enhance the upcoming Core 30 release scheduled for October. The update will significantly increase the OP_RETURN data",coinotag,https://en.coinotag.com/breakingnews/bitcoin-core-30-update-to-boost-op_return-data-limit-from-80-bytes-to-nearly-4mb/,"BTC","",cryptocompare
2025-06-10T01:24:27,"Bitcoin Price Rises Again—Are Bulls Charging Toward a New All-Time High?","Bitcoin price started a fresh increase above the $106,000 zone. BTC is now consolidating and might attempt to clear the $110,500 resistance. Bitcoin started a fresh upward move above the $107,000 zone. The price is trading above $107,000 and the 100 hourly Simple moving average. There is a bullish trend line forming with support at $106,850 on the hourly chart of the BTC/USD pair (data feed from Kraken). The pair could start a fresh decline if it breaks the $105,000 support zone. Bitcoin Price Gains Pace Bitcoin price started a fresh increase after it settled above the $103,500 support zone . BTC was able to surpass the $104,400 and $105,000 resistance levels. The bulls even pumped the price above the $108,000 resistance. A high was formed at $110,550 and the price is now consolidating gains above the 23.6% Fib retracement level of the upward move from the $100,400 swing low to the $110,550 high. Bitcoin is now trading above $108,000 and the 100 hourly Simple moving average . There is also a bullish trend line forming with support at $106,850 on the hourly chart of the BTC/USD pair. On the upside, immediate resistance is near the $110,000 level. The first key resistance is near the $110,500 level. The next key resistance could be $112,500. A close above the $112,500 resistance might send the price further higher. In the stated case, the price could rise and test the $113,800 resistance level. Any more gains might send the price toward the $115,000 level. Another Decline In BTC? If Bitcoin fails to rise above the $110,500 resistance zone, it could start another decline. Immediate support is near the $108,200 level. The first major support is near the $106,500 level and the trend line. The next support is now near the $105,500 zone and the 50% Fib retracement level of the upward move from the $100,400 swing low to the $110,550 high. Any more losses might send the price toward the $103,500 support in the near term. The main support sits at $102,000, below which BTC might gain bearish momentum. Technical indicators: Hourly MACD – The MACD is now gaining pace in the bullish zone. Hourly RSI (Relative Strength Index) – The RSI for BTC/USD is now above the 50 level. Major Support Levels – $108,000, followed by $106,500. Major Resistance Levels – $110,500 and $112,500.",newsbtc,https://www.newsbtc.com/analysis/btc/bitcoin-price-rises-110k/,"BTC|EXCHANGE|MARKET|TRADING","BTC|bitcoin|bitcoin price|btcusd|BTCUSDT|xbtusd",cryptocompare
2025-06-10T01:12:01,"Bitcoin EMA Gap Widens Signaling Strong Bullish Momentum and Key $100,000 Support Level","Bitcoin’s technical indicators are signaling a robust bullish trend, as highlighted by Decrypt analyst Jose Antonio Lanz. The divergence between the 50-day and 200-day Exponential Moving Averages (EMA) is expanding,",coinotag,https://en.coinotag.com/breakingnews/bitcoin-ema-gap-widens-signaling-strong-bullish-momentum-and-key-100000-support-level/,"BTC|TRADING","BTC",cryptocompare
2025-06-10T01:10:10,"ANAP Holdings Considers ¥11.5 Billion Bitcoin Allocation as Potential Long-Term Treasury Strategy","ANAP Holdings has made a landmark decision by allocating ¥11.5 billion to Bitcoin reserves, signaling a strategic pivot towards cryptocurrency as a long-term treasury asset. This move reflects a growing",coinotag,https://en.coinotag.com/anap-holdings-considers-%c2%a511-5-billion-bitcoin-allocation-as-potential-long-term-treasury-strategy/,"BTC|REGULATION","News",cryptocompare
2025-06-10T01:09:10,"Bitcoin Exchange Founder Indicted for Alleged $253 Million Laundering Amid Regulatory Scrutiny","A prominent crypto exchange founder has been indicted for laundering over $253 million, linked to sanctioned Russian entities amid geopolitical tensions. The U.S. Department of Justice alleges the founder operated",coinotag,https://en.coinotag.com/bitcoin-exchange-founder-indicted-for-alleged-253-million-laundering-amid-regulatory-scrutiny/,"BTC|EXCHANGE","News|BTC",cryptocompare
2025-06-10T01:00:49,"Bitcoin Set For Dramatic Repricing As Wall Street Piles In: Cathie Wood","Appearing on the Diary of a CEO podcast, ARK Invest founder Cathie Wood said that the “green-light” approval of spot-Bitcoin exchange-traded funds in January 2024 has only just opened the gates to what she called an “institutional land-rush” for the asset. “Institutions have barely started committing,” she told host Steven Bartlett, adding that they control “trillions of dollars” yet have access to barely “a hundred-billion-dollar sliver” of new supply because just one million bitcoin remain to be mined. Why Cathie Wood Eyes $1.5 Million Per Bitcoin Wood framed the supply-demand mismatch in stark macroeconomic terms. With roughly 20 million BTC already in existence, US spot ETFs alone have vacuumed up more than 1.2 million coins—about 5.7 percent of the eventual supply—since launching eighteen months ago, according to Bitbo’s on-chain ETF tracker. Daily flow data show that even on a quiet trading day, funds such as BlackRock ’s IBIT and Ark-21Shares’ ARKB can collectively absorb tens of millions of dollars’ worth of bitcoin, occasionally draining hundreds of coins from open markets in a single session. “The SEC’s decision effectively legitimised bitcoin as an asset class,” Wood said, arguing that fiduciary pressure will force large wealth managers to follow early adopters. She compared the current migration to the early 1990s adoption of index funds: once one blue-chip pension moved, “others had to consider it” or risk underperforming. Pointing to her own firm’s experience—ARK first purchased GBTC at roughly $250 per coin in 2015—Wood said that scepticism from traditional finance often marks “the sweet spot” for long-horizon investors. Wood’s long-term thesis is explicitly monetary. Quoting her mentor Arthur Laffer, she called bitcoin “the rules-based global monetary system we’ve waited for since the US closed the gold window in 1971 .” Because bitcoin’s algorithmic issuance schedule is immune to fiscal or political tampering, she contends, it will attract central-bank reserves and corporate treasuries in jurisdictions where local currencies are chronically devalued by policy error. That dynamic, she argues, is accelerating: “Emerging-market savers need an insurance policy,” and for younger cohorts “digital gold” is already more intuitive than bullion. ARK’s revised base-case model now targets $1.5 million per bitcoin by 2030—more than a fifteen-fold gain from today’s price. The three biggest “building blocks,” Wood said, are institutional portfolio allocation, millennial and Gen-Z store-of-value demand, and grassroots adoption in inflation-prone economies via stablecoin rails. None of the current projections, she noted, assume a wholesale shift of sovereign reserves, nor do they model secondary demand from bitcoin-secured lending, both of which she believes could escalate if deficits and debt service costs keep climbing. Wood also linked bitcoin’s appeal to a broader macro backdrop of fiscal stress and waning confidence in fiat regimes. “Government spending is taxation—either now or through inflation,” she said, warning that persistent deficits threaten the dollar’s reserve-currency status and therefore heighten the allure of an apolitical ledger secured by “the largest computer network in the world.” While she acknowledged bitcoin’s volatility, Wood argued that maturation of derivatives markets and increased ETF depth are already dampening extreme price swings. With spot bitcoin ETFs now controlling a stockpile larger than the holdings of Satoshi-era wallets , Wood contends the supply shock has only begun. “There is no mechanism to create more than 21 million coins,” she told Bartlett. “If institutions want exposure, the price will have to adjust—dramatically.” Exactly how dramatic remains the $1.5 million question, but Wood’s warning is unambiguous: the slowest movers may discover they are trying to buy what the market can no longer readily supply. At press time, BTC traded at $107,200.",bitcoinist,https://bitcoinist.com/bitcoin-dramatic-repricing-cathie-wood/,"AAVE|ADA|ALTCOIN|ASIA|ATOM|AVAX|AXS|BCH|BLOCKCHAIN|BTC|BUSINESS|COMMODITY|COMP|DOGE|DOT|ETC|ETH|EXCHANGE|FIAT|FIL|LINK|LTC|LUNA|LUNC|MANA|MARKET|MATIC|MINING|REGULATION|SHIB|SOL|SPONSORED|TECHNOLOGY|TRADING|TRX|UNI|USDT|WALLET|XLM|XMR|XRP|XTZ|ZEC|ZRX|OTHER|RESEARCH|APT|ARB|BITTENSOR|BNB|CRO|WIF|FDUSD|HBAR|ICP|IMX|INJ|LDO|MNT|NEAR|NOT|PEPE|SUI|TON|USDC|AR|FLOKI|ONDO|BGB|BONK|BRETT|RUNE|FET|PYTH|SEI|FLR|JUP|BSV|AGX|ENS|ZK|WLD|XAUT|CAKE|OM|APE|LPT|HNT|XDC|FTT|BTG|PEOPLE|MOG|PYUSD|AXL|MEME|RAY|SSV|ARKM|ETHFI|MX|AIRDROP|TOKEN SALE|FORKS|TOKEN LISTING AND DELISTING|ADMINISTRATIVE EVENTS","Bitcoin News|bitcoin|bitcoin news|bitcoin price|btc|BTC news|btc price|cathie wood",cryptocompare
2025-06-10T01:00:35,"Bitcoin & Ethereum Diverge—ETF Flows Just Flipped The Narrative","Data shows the demand for spot exchange-traded funds (ETFs) has cooled off for Bitcoin, while Ethereum has continued to attract inflows. Bitcoin Has Ended A Streak Of Positive ETF Flows In a new thread on X, the on-chain analytics firm Glassnode has talked about how the total balance of the US spot ETFs has changed for Bitcoin and Ethereum recently. The spot ETFs refer to investment vehicles that provide an alternate means of gaining exposure to a cryptocurrency’s price movements in a manner that’s familiar to traditional investors. Related Reading: Crypto Suffers $1 Billion Flush As Musk-Trump Feud Shakes Bitcoin These ETFs are a relatively new presence in the sector, but they have gained sufficient popularity to become a key part of the market. Investors who previously avoided digital assets due to the perceived complexity of wallets and exchanges can now invest through ETFs, which trade on traditional exchanges. The US Securities and Exchange Commission (SEC) approved the spot ETFs for Bitcoin back in January 2024. They got approval for Ethereum half a year later, in July 2024. First, here is how the balance held by the spot ETFs has changed for Ethereum since their inauguration: As displayed in the above graph, the total balance of the Ethereum spot ETFs has been on the rise recently. In fact, the cryptocurrency has now seen four straight weeks of net inflows. In all, 97,800 ETH have entered into the wallets associated with these ETFs during this green netflow streak. Though despite the continuous inflows, their total holdings are yet to hit the 3.81 million ETH peak from February, as they currently sit at 3.77 million ETH, about 41,000 tokens lower. “Accumulation is steady, but room remains for further upside,” notes Glassnode. Bitcoin has also seen growth in its spot ETF holdings recently, but unlike Ethereum, the number one digital asset saw the metric surpass its high from February last month. That said, while the Bitcoin spot ETFs were enjoying inflows until very recently, the trend has changed during the past week as net outflows have occurred instead. This has been the first negative week in eight for the BTC ETFs. “Total holdings are now 1.20M BTC, down ~11.5K BTC from the late-May peak,” explains the analytics firm. “A pause in demand after a strong run-up – watch for signs of re-acceleration.” Related Reading: Bitcoin RSI Dips Below 30—Is A New All-Time High Next? It now remains to be seen how things will develop in the coming days for the top two cryptocurrencies and whether the divergence that is starting to develop between them will only take further hold. BTC Price Bitcoin has seen a jump of about 2% during the past day and has recovered to $107,600. Featured image from Dall-E, Glassnode.com, chart from TradingView.com",newsbtc,https://www.newsbtc.com/bitcoin-news/bitcoin-ethereum-diverge-etf-flipped-narrative/,"BTC|BUSINESS|ETH|EXCHANGE|TRADING","Bitcoin News|bitcoin|Bitcoin ETFs|btc|BTCUSDT|ETH|ethereum|Ethereum ETFs",cryptocompare
2025-06-10T00:35:40,"Bitcoin Surpasses $110K Amid Institutional Inflows, Signaling Potential Continued Growth","Bitcoin has surged beyond the $110,000 threshold, driven by robust institutional investment and significant spot BTC ETF inflows, marking a pivotal moment in cryptocurrency adoption. This upward momentum reflects growing",coinotag,https://en.coinotag.com/bitcoin-surpasses-110k-amid-institutional-inflows-signaling-potential-continued-growth/,"AVAX|BTC|LINK|UNI","Bitcoin|News|AVAX|BTC|LINK|UNI",cryptocompare
2025-06-10T00:28:46,"Top Reasons Why Ethereum (ETH) Price Will Reach $2,800 This Week","The post Top Reasons Why Ethereum (ETH) Price Will Reach $2,800 This Week appeared first on Coinpedia Fintech News As Bitcoin (BTC) price rallied above $110k on Monday, June 9, Ethereum (ETH) price jumped over 7 percent in the last 24 hours to trade about $2,686 during the late North American trading session. The large-cap altcoin, with a fully diluted valuation of about $323 billion and a 24-hour average trading volume of around $19 billion, rebounded from the lower border of a consolidation level of around $2,480. As a result, the ETH price has been retesting a crucial local resistance level around $2,681, whereby the Ether price was rejected four times in the past four weeks. Major Reasons Ethereum Price Will Rally Higher This Week Strong Institutional Adoption and ETF Flows According to market data analysis from CoinShares, Ethereum’s investment product dominated last week’s cash inflow with about $296 million. Notably, Ether’s investment product outpaced Bitcoin’s, which recorded a net cash outflow of about $56.5 million last week. As Coinpedia had reported , BlackRock’s ETHA has recorded significant cash inflows in the past two weeks, suggesting a strong demand from institutional clients. Altseason Sentiment Ethereum price is well positioned to rally towards a new local high this week fueled by the rising narrative of altseason 2025. With Bitcoin dominance signaling an imminent market reversal, more crypto investors are betting on a major altcoin rally in the near future. Furthermore, the ETH/BTC pair is heavily oversold in the weekly timeframe, amid the recent market reversal. Regulatory Clarity Earlier on Monday, the U.S. Chair Paul Atkins highlighted that American crypto investors have the right to self-custody of crypto assets. Additionally, Chair Atkins highlighted that a new and clear set of DeFi regulations are needed to foster the development of the nascent blockchain technology. With Ethereum harboring the largest DeFi space, with a total value locked (TVL) of about $63 billion and a stablecoins market cap of around $124 billion, the altcoin is well positioned to rally further in the near future.",coinpedia,https://coinpedia.org/price-analysis/top-reasons-why-ethereum-eth-price-will-reach-2800-this-week/,"ALTCOIN|BTC|ETH|MARKET|TRADING","Price Analysis|Ethereum",cryptocompare
2025-06-10T00:20:59,"Nasdaq Crypto Index Inclusion and Japan Partnership Could Influence XRP Market Dynamics","Nasdaq’s inclusion of XRP and other major cryptocurrencies into its benchmark crypto index marks a significant milestone, potentially enhancing institutional adoption and market visibility for these digital assets. The strategic",coinotag,https://en.coinotag.com/nasdaq-crypto-index-inclusion-and-japan-partnership-could-influence-xrp-market-dynamics/,"ASIA|BTC|ETH|MARKET|XRP","Bitcoin|Ethereum|News|Ripple|ADA|BTC|ETH|SOL|XLM|XRP",cryptocompare
2025-06-10T00:20:08,"Crypto IPO boom and trade talks fuel Bitcoin’s climb","Bitcoin soared above the $110,000 mark late Monday for the first time in nearly two weeks, buoyed by optimism surrounding renewed trade discussions between the United States and China. The price jump also triggered a wave of short liquidations as the rally gained momentum. The world’s largest cryptocurrency by market capitalization recently traded at around $110,286 , marking a 3.6% gain over the past 24 hours. Bitcoin is now up nearly 5% over the last seven days, rebounding from a dip below $101,000 on June 5—a pullback that capped a broader decline dating back to late May. With BTC now nearing its all-time high of $111,814 set in May, market watchers are taking note. “Bitcoin breaking above $110,000 for the first time in two weeks signals renewed bullish momentum after a period of consolidation,” said Joe DiPasquale, CEO of crypto investment firm BitBull Capital. “If BTC can hold this level, it may set the stage for a fresh push toward the $120,000 range.” Other major altcoins also rose. Ethereum (ETH), the second cryptocurrency by market cap, gained 4.5% to more than $2,679, and Solana (SOL) added more than 3% to hover close to $160. Even meme coins, which have struggled in recent weeks, showed signs of recovery. Dogecoin jumped 4.5%, and Shiba Inu added 2.5%. Crypto IPO boom and trade talks fuel Bitcoin’s climb The market’s uplift coincides with renewed talks between Washington and Beijing over longstanding trade tariffs—discussions that have soothed broader investor nerves. Investors seem optimistic about the potential for resolving trade disputes between the US and one of its largest trading partners. Treasury Secretary Scott Bessent and China’s vice premier for economic policy, He Lifeng, will lead their respective delegations in negotiations expected to continue on Tuesday. Equities responded modestly, with the Nasdaq and S&P 500 edging slightly on the day. Another factor contributing to Bitcoin’s price surge is increased crypto-related IPOs . Last week, stablecoin giant Circle went public on the New York Stock Exchange and saw its shares pop over 168%, jumping from $31 to $69 within the first day of trading. Gemini, a crypto exchange founded by the Winklevoss twins, also filed for an IPO According to David Siemer, CEO of crypto asset management company Wave Digital Assets, while the IPO bump is likely short-term excitement, the long-term institutional positioning leads us to be bullish about Bitcoin’s continued performance in 2025. Bitcoin shorts crushed as $323M liquidated in a day In the past 24 hours, close to $323 million of crypto short positions have been liquidated, CoinGlass data shows. Most of the damage was in Bitcoin, which saw around $196 million worth of liquidations. The liquidations come amid mounting macroeconomic pressures and renewed trade tensions, which have rattled investor confidence. Spot Bitcoin ETFs have seen outflows in five of the last seven trading sessions, reflecting the cautious sentiment. In contrast, Ethereum ETFs have enjoyed a streak of positive momentum, notching 15 consecutive days of inflows. 10X Research wrote in a report released Monday morning that Bitcoin is testing a breakout level, and the market setup appears significantly different from what most investors anticipated just weeks ago. According to the report, negative funding rates, a pattern of market bottoms, and a surprising surge in spot demand combine to create a high-conviction signal. Cryptopolitan Academy: Want to grow your money in 2025? Learn how to do it with DeFi in our upcoming webclass. Save Your Spot",cryptopolitan,https://www.cryptopolitan.com/bitcoin-soared-above-110k/,"BTC|BUSINESS|ETH|MARKET|TRADING","News|Bitcoin",cryptocompare
2025-06-10T00:09:26,"Whale Opens $250M 20x Leveraged Long Position on BTC, Secures $5.68M Profit on Hyperliquid","According to data from Ashes Monitoring, a significant market participant executed a substantial long position on Bitcoin (BTC) using 10 million USDC via Hyperliquid. This strategic move involved leveraging 2276",coinotag,https://en.coinotag.com/breakingnews/whale-opens-250m-20x-leveraged-long-position-on-btc-secures-5-68m-profit-on-hyperliquid/,"BTC|BUSINESS|MARKET|ZRX|USDC","BTC|USDC",cryptocompare
2025-06-10T00:01:10,"Bitcoin May Rise Above $107,000 Amid Institutional Buying and US-China Trade Talks","Bitcoin has surged past the $107,000 mark, driven by renewed investor confidence amid ongoing US-China trade discussions and significant institutional buying activity. MicroStrategy has emerged as a key institutional player,",coinotag,https://en.coinotag.com/bitcoin-may-rise-above-107000-amid-institutional-buying-and-us-china-trade-talks/,"BTC|BUSINESS|ETH","Bitcoin|News|BTC|Core|ETH",cryptocompare
2025-06-10T00:00:14,"Bitcoin Gearing Up for New Price Discovery Uptrend Amid Successful Retest of Critical Support Level: Crypto Analyst","Widely followed crypto analyst Rekt Capital says that Bitcoin ( BTC ) looks bullish after successfully retesting a strong support level. The pseudonymous analyst tells his 548,000 followers on the social media platform X that Bitcoin is attempting to move into a “price discovery uptrend.” Price discovery often refers to a process when the price of an asset moves to uncharted territory, forcing buyers and sellers to seek agreement on value. Says Rekt Capital, “Bitcoin Price Discovery Roadmap: Bitcoin is currently in a transitional phase. Price is trying to successfully post-breakout retest its ReAccumulation Range to transition into Price Discovery Uptrend 2. A volatile retest/deviation here could occur.” Source: Rekt Capital/X Rekt Capital says that BTC closing above $104,400 on the week could be the key signal that it has successfully retested the demand zone and is gearing up for higher prices. “The retest continues to be successful. Can Bitcoin successfully confirm this retest with a Weekly Close above $104400 for what would be a 4th week in a row?” Zooming in on the daily chart, the trader says that BTC needs to close above its immediate resistance and flip it into support to fully confirm a bullish continuation of the trend. “On the Daily timeframe, Bitcoin is showcasing signs of breaking its two-week Downtrend (light blue) while also turning it into support… Daily Closing & retesting ~$106,600 (black) would be even better to enable trend continuation.” Source: Rekt Capital/X At time of writing, BTC is trading at $105,528. Follow us on X , Facebook and Telegram Don't Miss a Beat – Subscribe to get email alerts delivered directly to your inbox Check Price Action Surf The Daily Hodl Mix Disclaimer: Opinions expressed at The Daily Hodl are not investment advice. Investors should do their due diligence before making any high-risk investments in Bitcoin, cryptocurrency or digital assets. Please be advised that your transfers and trades are at your own risk, and any losses you may incur are your responsibility. The Daily Hodl does not recommend the buying or selling of any cryptocurrencies or digital assets, nor is The Daily Hodl an investment advisor. Please note that The Daily Hodl participates in affiliate marketing. Generated Image: Midjourney The post Bitcoin Gearing Up for New Price Discovery Uptrend Amid Successful Retest of Critical Support Level: Crypto Analyst appeared first on The Daily Hodl .",dailyhodl,https://dailyhodl.com/2025/06/09/bitcoin-gearing-up-for-new-price-discovery-uptrend-amid-successful-retest-of-critical-support-level-crypto-analyst/,"BTC|BUSINESS|MARKET|TRADING","Bitcoin|BTC|News|rekt capital",cryptocompare
2025-06-09T23:47:07,"US Department of Justice Seeks Extension to Stay Tariff Ruling Impacting Bitcoin Trade","On June 10th, the US Department of Justice formally requested the US Federal Circuit Court of Appeals to prolong the stay on a tariff invalidation ruling issued by a lower",coinotag,https://en.coinotag.com/breakingnews/us-department-of-justice-seeks-extension-to-stay-tariff-ruling-impacting-bitcoin-trade/,"BTC","BTC",cryptocompare
