datetime,headline,summary,source,url,categories,tags,api_source
2025-06-09T20:37:56,"Tether’s Open-Source Mining OS Could Shatter Barriers – Will Public Miners Lose Their Edge?","Key Takeaways: Tether is set to open-source its Bitcoin Mining Operating System (MOS) to democratize access to mining infrastructure. The software is built to support everything from small-scale DIY rigs to large industrial mining farms. The initiative could spur a wave of new entrants, and help decentralize mining and strengthen network resilience. Tether, the issuer of the USDT stablecoin, is preparing to open-source its Bitcoin mining operating system, a move that could shake up the mining industry and lower barriers for new entrants. Announced by CEO Paolo Ardoino, the initiative seeks to provide smaller or independent miners with tools that typically require expensive third-party software or infrastructure. The software, known as the Mining Operating System (MOS), is designed to scale from small, DIY setups to large, industrial mining sites. Tether Expands Bitcoin Mining Push with Open-Source Operating System Ardoino wrote in his post announcing the plans, “Make mining great again.” He said the goal is to reduce dependence on centralized mining software providers and offer a more level playing field between small miners and publicly listed firms. Tether’s MOS is built with a modular, peer-to-peer architecture, making it highly flexible. It can run on systems as simple as a Raspberry Pi or scale up to support massive mining operations involving hundreds of thousands of machines. Tether will work towards open-sourcing its Bitcoin Mining OS (MOS). A horde of new Bitcoin mining companies will be able to enter the game and compete to keep the network safe. No need anymore of any 3rd party hosted software. MOS will create an even playing field reducing the… — Paolo Ardoino (@paoloardoino) June 9, 2025 The system already supports a wide range of mining hardware and power setups, including air-cooled and immersion-based container designs. This move could have broad implications for the mining sector. Publicly listed mining companies have historically had an edge due to access to better software tools and infrastructure. Tether’s decision to release MOS could close that gap, empowering smaller operators to enter or scale up their participation in Bitcoin mining. Another angle to this move is energy. Ardoino believes that more small and mid-sized businesses that generate their own electricity, such as through solar, will begin using excess power to mine Bitcoin. While no release date for the open-source version was provided, the announcement adds another layer to Tether’s growing involvement in Bitcoin mining and infrastructure. The company has previously invested in mining operations and energy initiatives, especially in Latin America. Miners Face Tight Margins as AI, Hashrate Wars Reshape Post-Halving Environment Tether’s push into open-source AI and mining software comes at a time when Bitcoin miners face one of the most challenging post-halving environments to date. Since the April 2025 halving cut block rewards to 3.125 BTC, many public miners have shifted from HODLing to selling. According to TheMinerMag, over 40% of mined BTC was offloaded by 15 firms in March alone. Some, like HIVE and Bitfarms, sold more than their total monthly production, a sign of rising operational strain. The pressure is mounting as the Bitcoin network’s hash rate hit a record one sextillion hashes per second in April, and mining difficulty reached a new high of 121.51 trillion in May, after a 6.81% jump. Bitcoin’s hashrate hits all-time high, but miners are selling more BTC as revenue plunges post-halving — can the network’s security surge outpace financial pressures? #Bitcoin #Mining https://t.co/D7931KDQW2 — Cryptonews.com (@cryptonews) April 17, 2025 Meanwhile, miner revenue in March plunged 50% year-over-year, dropping to just $1.2 billion. The hashprice, a key metric of mining profitability, has barely recovered, hovering around $54 per PH/s. To stay afloat, some firms are shifting to AI. HIVE has already reported stronger income from AI workloads than crypto mining, prompting heavier investment in compute infrastructure. Others, like Cango, have gone all-in on mining, producing over 950 BTC across April and May after exiting legacy operations in China. Tether’s AI initiative could support that trend, blending decentralized compute with native crypto payments and offering a new path for miners eyeing survival through diversification. In this new chapter, miners may need more than hardware to keep their edge. The post Tether’s Open-Source Mining OS Could Shatter Barriers – Will Public Miners Lose Their Edge? appeared first on Cryptonews .",cryptonews,https://cryptonews.com/news/tether-open-source-mining-os-challenges-public-miners-edge/,"BTC|BUSINESS|MINING|TECHNOLOGY|USDT","Bitcoin News|News|Bitcoin|Mining|Tether",cryptocompare
2025-06-09T20:36:30,"Paraguay Denies Launching Bitcoin Legal Tender or Strategic BTC Reserve Following Social Media Hack","The Paraguayan government has officially denied claims that Bitcoin has been made legal tender and that a $5 million BTC reserve has been established, following a high-profile social media hack.",coinotag,https://en.coinotag.com/paraguay-denies-launching-bitcoin-legal-tender-or-strategic-btc-reserve-following-social-media-hack/,"BTC|FIAT|REGULATION","Bitcoin|News|BTC",cryptocompare
2025-06-09T20:36:07,"Bitcoin Price Gains May Face Limits Below $110,000 Amid Stock Correlation and US Economic Uncertainty","Bitcoin’s recent price rally faces significant resistance due to its strong correlation with stock markets and ongoing US economic uncertainties. Despite a 3.5% gain in early June, BTC’s upside remains",coinotag,https://en.coinotag.com/bitcoin-price-gains-may-face-limits-below-110000-amid-stock-correlation-and-us-economic-uncertainty/,"BTC|BUSINESS|MARKET|TRADING|FLOW","Bitcoin|News|BTC|FLOW",cryptocompare
2025-06-09T20:34:10,"Paraguay Says Presidential X Post Promising Bitcoin Reserve a Hack","The South American country is also not starting a strategic BTC reserve. Hackers asked readers to send the asset to a Bitcoin address.",decrypt,https://decrypt.co/324244/paraguay-says-presidential-tweet-promising-bitcoin-reserve-hack,"BTC|FIAT","Law and Order",cryptocompare
2025-06-09T20:30:41,"Ethereum (ETH), Solana (SOL), or Sui (SUI): Which Layer1 Will Surge Most in June 2025?","As Bitcoin (BTC) prepares to possibly break higher and rise up past its all-time high, the big layer 1 blockchains are potentially getting ready to follow that lead and also break higher. Which of $ETH, $SOL, or $SUI could make the highest shorter term gains? $ETH 1 month of sideways price action about to end? Source: TradingView After breaking up through the descending trendline that stretched from mid-December 2024 to early May 2025, the $ETH price shot skywards for a 50% gain. However, the resistance at $2,700 held firm, and $ETH has traversed in a range between this level and the $2,400 support. It would perhaps appear to be a matter of time before the $ETH price breaks up and past this overhead resistance and moves on up to $3,500. The longer $ETH continues to trend sideways, the more explosive and higher the next move could be. $SOL breaks up past descending trendline Source: TradingView The daily time frame for $SOL illustrates how the price went down to exactly touch the 0.5 Fibonacci level, which is a relatively deep level to come down to. It bounced from there and has today broken beyond a short-term descending trendline. The daily Stochastic RSI has the indicators trending upwards and therefore there could be room for the $SOL bulls to try and make a local higher high beyond $187, which happens to be an important horizontal resistance level. If the $SOL price can consolidate above this level, this would open the path back to the all-time high. $SUI getting a bounce from major support level Source: TradingView The $SUI price is seen in the higher time frame of the weekly. This is because support and resistance can be clearly seen on this level. Last week’s candle body closed above the $3.19 horizontal support, leaving a good wick underneath, which provides evidence that the bulls came in strongly to hold this level. A bounce looks as though it is taking place now, and should the price rise above the current resistance level, the next stop could be $4. At the bottom of the chart the weekly Stochastic RSI indicators may be starting to flatten out. If they can continue to do so, and perhaps get a bounce at the 50.00 level, all systems are go for $SUI. If all the positive price action plays out for these three layer 1s, $ETH could be set to rise 36% from its current price level, $SOL 20%, and $SUI 20%. Of course, much depends how heavily investors get behind any particular one of these altcoins. It should also be borne in mind that the $ETH market cap is around 4 times bigger than $SOL, and around 30 times bigger than $SUI. Therefore, the amount needed to move the $SOL price is relatively less, and for the $SUI price much more so. Disclaimer: This article is provided for informational purposes only. It is not offered or intended to be used as legal, tax, investment, financial, or other advice.",cryptodaily,https://cryptodaily.co.uk/2025/06/ethereum-eth-solana-sol-or-sui-sui-which-layer1-will-surge-most-in-june-2025,"BTC|ETH|SOL|TRADING|SUI","Breaking News",cryptocompare
2025-06-09T20:30:10,"Bitcoin Calm Won’t Last—This Week Holds Breakout Risk","Singapore-based trading firm QCP Capital opened its Monday note with a blunt assessment: “Implied vols continue to come under pressure, with BTC stuck in a tight range as summer approaches.” In the options house’s telling, the market is drifting into the northern-hemisphere holiday season much as it did a year ago, when one-month at-the-money (ATM) volatility collapsed from 80 vols in March to barely 40 vols by July and spot repeatedly “failed to decisively breach the $70k level.” The difference this year is the new, higher plateau: BTC has sat between $100,000 and $110,000 for most of the past three weeks. The calm is visible beyond Deribit’s options screens. Deribit’s DVOL index, which tracks 30-day implied volatility, is hovering just above 40—one of its lowest prints in more than two years. Realised volatility is even quieter, so even one-year lows on implieds still look “optically rich,” QCP argues. That valuation gap has encouraged traders to sell gamma: perpetual open interest has slipped and the favourite hedge-fund basis trade—long spot via the new ETFs, short futures—has unwound, taking what QCP calls “the natural bid for vol” out of the market. Related Reading: Bitcoin At A Crossroads: $97,000 Cost Basis Holds Key To Next Breakout Flows in the listed options market confirm the malaise. Dealers report that July upside strikes around $130,000 and $140,000 are being rolled out to September “in meaningful size,” effectively pushing bullish timelines further down the curve. Meanwhile, Deribit’s put-skew has flattened as short-dated hedges expire worthless—a dynamic that often precedes a directional move once macro catalysts arrive. This Week Could Break Bitcoin’s Lull Those catalysts line up uncomfortably close. On Wednesday the Bureau of Labor Statistics will publish May consumer-price data. April’s headline CPI rose a modest 0.2% month-on-month and 2.3% year-on-year, while core prices advanced 0.2% on the month and 2.8% on the year. Economists look for headline CPI to quicken to 0.3% on the month and 2.5% year-on-year, with core CPI seen edging up to 0.3% and 2.9% respectively. Producer prices follow on Thursday: April’s PPI fell 0.5% on the month yet still printed 2.4% year-on-year. The consensus expects May PPI to rebound 0.2%, leaving the annual rate near 2.4%. Inflation is not the only macro variable in play. Friday’s stronger-than-expected US non-farm payrolls report—139,000 jobs versus a 130,000 consensus—rekindled dollar strength and knocked gold more than one percent lower, but BTC “remained conspicuously unmoved,” QCP noted. The same divergence is visible this morning: US equity futures are slightly softer, spot gold is bid on safe-haven demand, and bitcoin is trading virtually unchanged. Geopolitics may supply the spark that inflation data has so far failed to ignite. Senior US and Chinese officials meet in London today (Monday) in what both sides are calling a push for a limited trade deal that would dial back export-control threats and myriad retaliatory tariffs. The talks matter for crypto because tariffs have been feeding directly into the CPI basket and—via global risk sentiment—into bitcoin demand. “A clean break below $100k or above $110k would likely reawaken broader market interest,” QCP wrote, “but we currently see no obvious near-term catalyst to drive such a move.” Trade headlines could change that calculus in a single newsflash. Related Reading: Crypto Analyst Says This Bitcoin Top Signal Hasn’t Gone Off Yet — What To Know Institutional positioning likewise hints at fatigue. US regulatory filings show that large hedge funds trimmed spot-ETF holdings in the first quarter as the lucrative cash-and-carry spread compressed. Net inflows across the 11 US bitcoin ETFs have slowed to a trickle since late May, leaving cumulative additions at roughly $44 billion—unchanged for almost a fortnight, according to Farside data. For now, the market’s centre of gravity is exactly where QCP says it is: inside the $100,000–$110,000 corridor. Volatility sellers continue to collect premium, and the risk-reward for momentum traders remains poor. Yet with CPI, PPI and high-stakes trade negotiations all landing inside a 72-hour window, the premium that option writers are harvesting could quickly look meagre. If the inflation data surprise to the upside, a repricing of Fed-cut expectations could turn last week’s equity rally into a risk-off wobble, yanking bitcoin below six figures for the first time since April. Conversely, a benign print combined with even a symbolic easing of tariff rhetoric could flip the narrative to “soft landing, structural bid via ETFs,” reigniting topside optionality into the June quarter-end. In that scenario the rolled-out September $140,000 calls might come alive far sooner than their buyers now expect. Either way, the clock on bitcoin’s summer doldrums is ticking loudly. “Without a compelling narrative to spark the next leg higher, signs of fatigue are emerging,” QCP warns. The narrative candidates arrive this week; whether they supply ignition or simply more noise will decide whether 2025’s range trade breaks—or cements itself as the dominant theme of another crypto summer. At press time, BTC traded at $107,919. Featured image created with DALL.E, chart from TradingView.com",newsbtc,https://www.newsbtc.com/bitcoin-news/bitcoin-calm-wont-last-this-week/,"BTC|FIAT|MARKET|SPONSORED|TRADING","Bitcoin News|bitcoin|Bitcoin news|bitcoin price|btc|BTC news|btc price",cryptocompare
2025-06-09T20:28:18,"Bitcoin price shows strength, but will BTC bulls be able to push through $110K?","Bitcoin’s correlation to stocks and uncertainty about the future of the US economy could cap BTC price gains below $110,000.",cointelegraph,https://cointelegraph.com/news/bitcoin-price-shows-strength-but-will-btc-bulls-be-able-to-push-through-110k?utm_source=rss_feed&utm_medium=rss&utm_campaign=rss_partner_inbound,"BTC|TRADING","",cryptocompare
2025-06-09T20:27:31,"Experts Say XRP Could Hit $50 and $100. Here’s the Math","Despite current price limitations and market challenges, there remains persistent speculation about XRP reaching high-value targets such as $50 or even $100. Several commentators and crypto analysts continue to advocate for the possibility of this major price appreciation. However, the feasibility of such projections depends heavily on broader market conditions and XRP’s place within the cryptocurrency ecosystem. Analysts Supporting High Price Predictions In recent months, voices in the crypto space have suggested aggressive price expectations for XRP. In April, analyst Cryptominder projected that XRP could rise to $50 within the next five years. BarriC, a frequent commentator, has reiterated expectations of XRP hitting $100 , while the founder of Alpha Lions Academy noted that a $50 milestone could prompt the market to begin aiming for the $100 level. Current Market Metrics and Supply Considerations At present, XRP has a circulating supply nearing 59 billion tokens. Based on this figure, reaching $50 would result in a market capitalization of approximately $2.95 trillion. This would not only surpass Bitcoin’s current market cap of $2.06 trillion but also outpace the valuations of major global entities such as Alphabet, Amazon, and the total value of silver. A price of $100 would double XRP’s market cap to $5.9 trillion, nearly double the entire cryptocurrency market’s current capitalization, which stands at around $3.24 trillion. From its current price of $2.26, XRP would need to increase by approximately 2,112% to reach $50, and by around 4,235% to achieve a price of $100. These are substantial gains that, under current conditions, appear unlikely. Evaluating Market Conditions for Future Price Potential While these figures may seem unrealistic under existing market circumstances, they are not inherently unattainable. A substantial expansion in the overall crypto market could make higher XRP prices more plausible. For instance, Dan Gambardello, a known advocate of Cardano, has projected that the total cryptocurrency market cap could eventually rise to $40 trillion. We are on twitter, follow us to connect with us :- @TimesTabloid1 — TimesTabloid (@TimesTabloid1) July 15, 2023 In a scenario where Bitcoin retains its current market dominance of about 63.5%, it would command a market cap of approximately $25.4 trillion. If XRP were to attain a $50 valuation within that environment, it would represent just over 5% of the global crypto market, an achievable target considering XRP reached a dominance level of 5.56% as recently as February. Achieving a $100 price would require XRP to capture about 14.75% of a $40 trillion market. While this is a more ambitious figure, it remains within the boundaries of historical precedent. Notably, XRP reached a market dominance peak of 31.33% in mid-2017. The idea of XRP reaching $50 or $100 is not without merit, but it requires a fundamental shift in the broader crypto landscape. Current market caps and circulating supply make such valuations impractical today. However, under a dramatically expanded global market, such as a projected $40 trillion crypto space, these price points may become viable, assuming XRP can maintain or increase its market share. As such, while these targets are speculative, they are not beyond the realm of possibility in the long term. Disclaimer : This content is meant to inform and should not be considered financial advice. The views expressed in this article may include the author’s personal opinions and do not represent Times Tabloid’s opinion. Readers are urged to do in-depth research before making any investment decisions. Any action taken by the reader is strictly at their own risk. Times Tabloid is not responsible for any financial losses. Follow us on Twitter , Facebook , Telegram , and Google News The post Experts Say XRP Could Hit $50 and $100. Here’s the Math appeared first on Times Tabloid .",timestabloid,https://timestabloid.com/experts-say-xrp-could-hit-50-and-100-heres-the-math/,"ADA|BTC|MARKET|TRADING|XRP","Cryptocurrency|News|XRP|XRP Price|XRP Price Prediction",cryptocompare
2025-06-09T20:26:57,"Why Bitcoin Implied Volatility Has Collapsed Amid Trump Trade Talks","Bitcoin volatility hits 1-year low as U.S.-China trade talks resume, with BTC holding above $100K but trapped in range amid geopolitical uncertainty.",decrypt,https://decrypt.co/324304/bitcoin-implied-volatility-collapsed-trump,"BTC|MARKET","|Markets",cryptocompare
2025-06-09T20:26:17,"Crypto Industry Scores Win as Blockchain Clarity Bill Folded Into Landmark Legislation","A handful of key crypto policy advocacy organizations are celebrating the successful inclusion of the novel Blockchain Regulatory Certainty Act (BRCA) into the larger digital asset market structure legislation known as the CLARITY Act, a June 9 statement from the policy heavyweights states. Crypto Heavyweights Join Forces A Monday statement signed by the DeFi Education Fund, Coin Center, Solana Policy Institute, The Digital Chamber, Blockchain Association, Crypto Council for Innovation, Paradigm, and Bitcoin Policy Institute thanks Congressmen French Hill (R-AR), Bryan Steil (R-WI), Tom Emmer (R-IN), and Ritchie Torres (D-NY) for incorporating BRCA into the CLARITY Act. An updated statement from the crypto industry on the inclusion of BRCA in the latest draft of the CLARITY Act. cc: @btcpolicyorg @blockchainassn @coincenter @crypto_council @DigitalChamber @jump_ @paradigm @SolanaInstitute @Uniswap https://t.co/Dwtzqk8nEq pic.twitter.com/Byulc5Pmsp — DeFi Education Fund (@fund_defi) June 9, 2025 “We are pleased to see the Blockchain Regulatory Certainty Act (BRCA) included in the newly introduced version of the CLARITY Act,” the policy groups state. “This is a meaningful step toward protecting developers of noncustodial, peer-to-peer technologies while maintaining strong oversight of custodial financial institutions,” they add. Inside BRCA: What the Bill Actually Does News of BRCA’s latest advancement comes just days after the crypto policy organizations joined together to push for its inclusion in the high-profile digital asset legislation . If passed, BRCA would certify that crypto software developers will not be treated as financial entities under the Bank Secrecy Act. “As much-needed digital asset regulation develops in the United States, it is critically important to remember that developers creating peer-to-peer, noncustodial software and the infrastructure providers who enable decentralized networks have little in common with traditional financial institutions and should not be treated as such,” a June 5 statement reads in part. Meanwhile, the CLARITY Act would provide digital asset market participants with a clear crypto regulatory framework and is scheduled for a markup by the House Financial Services Committee (HFSC) on Tuesday afternoon. “By providing strong safeguards and long-overdue regulatory certainty, the legislation advances American innovation and reinforces America’s leadership in the global financial system,” a fact sheet from the HFSC reads . The post Crypto Industry Scores Win as Blockchain Clarity Bill Folded Into Landmark Legislation appeared first on Cryptonews .",cryptonews,https://cryptonews.com/news/crypto-industry-scores-win-as-blockchain-clarity-bill-folded-into-landmark-legislation/,"BLOCKCHAIN|BTC|MARKET|REGULATION|TECHNOLOGY","Blockchain News|News|Crypto Regulation|Regulation|U.S. Congress",cryptocompare
2025-06-09T20:21:10,"KULR Technology Group Plans $300 Million Raise to Potentially Expand Bitcoin Holdings","KULR Technology Group is set to raise $300 million to expand its Bitcoin treasury, reflecting a growing corporate trend toward cryptocurrency accumulation. The California-based firm, now identifying as a “Bitcoin-First”",coinotag,https://en.coinotag.com/kulr-technology-group-plans-300-million-raise-to-potentially-expand-bitcoin-holdings/,"BTC|REGULATION|TECHNOLOGY","News|BTC",cryptocompare
