datetime,headline,summary,source,url,categories,tags,api_source
2025-06-09T23:45:04,"Digital Asset Funds Add $224M, But Investment Momentum Slow","Digital asset investment products attracted $224 million in inflows last week, pushing the 7-week total to $11 billion. Despite this, the pace of investments appears to be slowing, as investors grow cautious and await clearer guidance from the US Federal Reserve regarding inflation and the broader direction of monetary policy. According to the latest edition of CoinShares’ Digital Asset Fund Flows Weekly Report, Bitcoin recorded $56.5 million in outflows for a second week, reflecting investor caution amid policy uncertainty. Short-Bitcoin products similarly saw $4.1 million in outflows, which represented their second consecutive week of declining interest. Ethereum continued to lead digital asset investments this week with $296.4 million in inflows, marking its seventh consecutive positive week and totaling $1.5 billion, which is equivalent to 10.5% of total assets under management. This is the strongest streak of inflows since the US election in November, which indicated growing optimism among investors. On the other hand, multi-asset investment products recorded $6.6 million in outflows for the third week running. Altcoins remained mostly flat during the same period, with the exception of Sui and Chainlink, which brought in modest inflows of $1.1 million and $0.2 million. Meanwhile, XRP faced outflows of $4 million, while Solana and Cardano saw $2.1 million and $0.4 million in outflows, respectively. The United States topped weekly inflows with $175 million over the past week, while Germany followed with $47.8 million. Switzerland, Canada, and Australia contributed $15.7 million, $9.8 million, and $6.5 million, respectively. Meanwhile, Brazil recorded $9.2 million in outflows. Hong Kong saw $14.6 million withdrawn, ending its recent inflow surge. Sweden also reported weekly outflows totaling $7.7 million. The post Digital Asset Funds Add $224M, But Investment Momentum Slow appeared first on CryptoPotato .",cryptopotato,https://cryptopotato.com/digital-asset-funds-add-224m-but-investment-momentum-slow/,"ADA|BTC|BUSINESS|ETH|XRP","AA News|Crypto News|Bitcoin|Cardano|Ethereum|Sui|XRP",cryptocompare
2025-06-09T23:45:00,"Is Bitcoin Finally Becoming a “Stable” Asset? The New Data Is Shocking","Bitcoin’s 30-day volatility dropped to its lowest level since 2015, near the 10th percentile. BTC formed an ascending channel pattern, suggesting bullish continuation with a 46% upside potential. The 50-week EMA at $85,136 acts as dynamic support, maintaining the long-term bullish structure. Bitcoin’s volatility has dropped to its lowest level in nearly a decade, a sign of a major structural shift in the market’s behavior. According to new data visualized by Ecoinometrics, Bitcoin’s 30-day realized volatility sits near the 10th percentile, meaning current market fluctuations are calmer than 90% of all weekly periods since 2015, suggesting Bitcoin is maturing into a more stable asset even as it continues its strong upward trend. This dramatic decline in volatility, which comes despite a sharp rally in May and the asset reaching new all-time highs, marks a significant change in Bitcoin’s risk profile and could make it far more attractive to a new class of institutional investors. A New Era of Stability: Bitcoin’s Risk Profile Is Changing The heatmap, based on percentile rankings of Bitcoin’s weekly volatility over a 30-day rolling window, illustra… The post Is Bitcoin Finally Becoming a “Stable” Asset? The New Data Is Shocking appeared first on Coin Edition .",coinquora,https://coinedition.com/bitcoin-volatility-decade-low-price-rally/,"BTC|BUSINESS|MARKET|TRADING","CoinMarketCap Feed|Market|Market News|News|Price Analysis|Top Crypto News|Bitcoin News",cryptocompare
2025-06-09T23:43:24,"Bitcoin Taps $110K as Crypto Market Erupts With Billions in Fresh Volume","The price of bitcoin barreled past the $110,000 mark, notching an intraday peak of $110,587 per coin. With that move, the top digital currency now commands a market cap of $2.19 trillion—taking up 63.8% of the $3.44 trillion crypto economy. At the time of writing, at 7:30 p.m. Eastern time, bitcoin is changing hands for",bitcoin.com,https://news.bitcoin.com/bitcoin-taps-110k-as-crypto-market-erupts-with-billions-in-fresh-volume/,"BTC|MARKET|TRADING","Markets and Prices|Bitcoin (BTC)|markets and prices",cryptocompare
2025-06-09T23:30:46,"Ethereum Weekly Structure Tightens – Tower Top Pattern In Play?","Ethereum has pulled back roughly 14% since the last week of May, but it’s holding firm above the critical $2,400 support zone. Despite recent volatility across the crypto market, ETH’s ability to defend this level has kept hopes alive for a potential recovery. Analysts are closely watching Ethereum’s next move, as the asset still trades well below its yearly highs, offering room for upside if momentum returns. Related Reading: Ethereum Consolidates Below $2,800 – Bulls Need This Level To Trigger Next Leg Up Since the start of the year, Ethereum has faced steep declines and inconsistent follow-through on bullish setups. However, many believe ETH is now positioned to recover lost ground — if bulls can reclaim the $2,800 resistance and flip it into support. A breakout above that level would likely open the door for a broader altcoin rally. Top analyst Big Cheds weighed in on the current structure, noting that Ethereum’s weekly chart printed its fourth small-bodied candle in a row — a classic sign of indecision. According to Cheds, ETH “still looks pre-tower top,” suggesting a potential trend shift may be forming. Ethereum Holds Ground As Bulls Face Critical Resistance Ethereum has managed to hold strong above key support levels despite several weeks of market-wide pullback and volatility. Trading above the $2,400–$2,500 zone, ETH has shown resilience while many altcoins have lost momentum. This range has become a critical battleground, with bulls now needing a clean breakout above the $2,800 mark to confirm a return to a bullish phase and potentially kick off the next leg higher. But while the technical structure remains intact for now, macroeconomic headwinds are building. US Treasury yields continue to rise as markets brace for prolonged high interest rates, signaling tighter financial conditions ahead. Combined with ongoing geopolitical uncertainty and sluggish global growth expectations, these factors continue to weigh heavily on risk assets, including crypto. Adding to the cautious tone, top analyst Big Cheds recently highlighted Ethereum’s weakening weekly momentum. According to Cheds, ETH is heading for its fourth consecutive small-bodied weekly candle — a signal of indecision that typically precedes major moves. He notes that the current setup looks pre-tower top, a classic bearish formation that often marks exhaustion at the top of a trend before a sharp reversal. This puts Ethereum at a critical juncture. A decisive breakout above $2,800 would invalidate the bearish scenario and strengthen the case for recovery toward the $3,000–$3,200 range. On the other hand, continued weakness and a failure to gain traction could trigger renewed selling pressure, especially if macro conditions worsen. As Ethereum trades within a tightening range, the next few weeks will be crucial. Whether bulls can flip resistance or bears regain control will likely determine the direction for ETH and the broader altcoin market heading into Q3. Related Reading: Bitcoin And Ethereum Defend Key Moving Averages – Bullish Signal Or Temporary Relief? ETH Reclaims Short-Term Support But Faces Overhead Pressure Ethereum is trading at $2,539 on the 4-hour chart, showing a modest rebound of +1.86% on the day. After briefly dipping below its 200 SMA ($2,511), ETH has reclaimed this key level and is now pushing toward the cluster of shorter-term moving averages — including the 34 EMA ($2,528), 50 SMA ($2,543), and 100 SMA ($2,565). This area represents immediate resistance, and how ETH reacts here will likely determine the next short-term trend. Since early May, ETH has been trading in a wide consolidation range between $2,400 and $2,800. The recent price action suggests ongoing indecision, with lower highs forming and strong support holding near the 200 SMA. Volume remains relatively muted, indicating a lack of strong directional conviction. Related Reading: Solana Key Indicator Flashes Buy Signal On Daily Chart – Rally Ahead? For bulls, reclaiming and holding above the 100 SMA is crucial for breaking out of the current range and targeting the $2,700–$2,800 region. On the downside, a loss of the 200 SMA could lead to a swift retest of $2,430 and potentially deeper downside. Featured image from Dall-E, chart from TradingView",newsbtc,https://www.newsbtc.com/news/ethereum/ethereum-weekly-structure-tightens-tower-top-pattern-in-play/,"ALTCOIN|BTC|ETH|MARKET|TRADING","Ethereum|ETH|ethereum|Ethereum Analysis|ethereum bearish|Ethereum Bearish Signal|ethereum news|Ethereum Price analysis|ETHUSDT",cryptocompare
2025-06-09T23:15:51,"Top Reasons Why Bitcoin (BTC) Price Rebounded Above $110k Today","The post Top Reasons Why Bitcoin (BTC) Price Rebounded Above $110k Today appeared first on Coinpedia Fintech News After teasing further corrections last week following the relationship fallout between Elon Musk and President Donald Trump, Bitcoin (BTC) price has strongly rebounded. The flagship coin rallied over 4 percent in the last 24 hours to reach a local high of about $110,260, less than 2 percent from its all-time high, on Monday, June 9 during the late North American session. The wider altcoin market, led by Ethereum (ETH), followed in tandem. As a result, the total crypto Open Interest (OI) surged over 6 percent to hover about $154.8 billion at the time of this writing. Additionally, more than $403 million was liquidated from the crypto-leveraged market, led by Bitcoin’s $197 million. Major Factors Influencing the Bitcoin Rally Today Favorable Regulatory Environment As Coinpedia reported , the Chairman of the United States Securities and Exchange Commission (SEC), Paul Atkins, has reiterated the importance of self-custody of crypto assets and clear regulatory frameworks for DeFi protocols. The favoring regulatory frameworks in the United States will have a ripple effect in other countries, thus enabling further crypto adoption by institutional investors. High Demand from Institutional Investors The overall supply of Bitcoin on centralized exchanges has continued to exponentially decline in the past few years, catalyzed by the high demand from institutional investors. Strategy Inc . has led dozens of companies in implementing a Bitcoin treasury management plan. The U.S. spot Bitcoin ETFs have continued to relentlessly accumulate, thus recording the fastest ETF growth to $70 billion in modern history. Macroeconomic Outlook BTC price has continued to grow in the recent past in tandem with the rising global liquidity. In addition to favoring technical aspects, whereby BTC’s daily timeframe recorded a golden cross between the 50 and 200 MA, the flagship coin has recorded impressive gains fueled by the short term uncertainty in the U.S. economy that is struggling with a historical debt crisis.",coinpedia,https://coinpedia.org/price-analysis/top-reasons-why-bitcoin-btc-price-rebounded-above-110k-today/,"BTC|BUSINESS|ETH|REGULATION|TRADING","Price Analysis|Bitcoin",cryptocompare
2025-06-09T23:00:54,"Key Bitcoin metric hits 1.1 as buyers dominate – Here’s what’s next for BTC","Bullish strength across spot and on-chain metrics for Bitcoin as it stands.",ambcrypto,https://ambcrypto.com/key-bitcoin-metric-hits-1-1-as-buyers-dominate-heres-whats-next-for-btc/,"BTC|TRADING","Bitcoin|BTC Trading View|News|News 1|Social|Trading View",cryptocompare
2025-06-09T22:53:11,"Bitcoin Rockets 240% in Short Liquidations in Just 4 Hours","BTC price surge fuels spike in short liquidations",utoday,https://u.today/bitcoin-btc-rockets-240-in-short-liquidations-in-just-4-hours,"BTC|TRADING","Bitcoin|BTC",cryptocompare
2025-06-09T22:45:41,"Bitcoin Surpasses Expectations with Potential 2026 Price Surge","The analyst forecasts Bitcoin exceeding $200,000 by 2026. A ""cup and handle"" pattern suggests an upward movement. Continue Reading: Bitcoin Surpasses Expectations with Potential 2026 Price Surge The post Bitcoin Surpasses Expectations with Potential 2026 Price Surge appeared first on COINTURK NEWS .",cointurken,https://en.coin-turk.com/bitcoin-surpasses-expectations-with-potential-2026-price-surge/,"BTC|TRADING","Bitcoin (BTC)",cryptocompare
2025-06-09T22:44:14,"Bitcoin Sees Modest Gains Amid Cautious Optimism in US-China Trade Talks and Market Stability","Renewed U.S.-China trade talks in London have sparked cautious optimism among investors, influencing key sectors such as semiconductors and Chinese tech stocks. Despite this positive momentum, major U.S. indexes showed",coinotag,https://en.coinotag.com/bitcoin-sees-modest-gains-amid-cautious-optimism-in-us-china-trade-talks-and-market-stability-2/,"BTC|BUSINESS|MARKET","Analysis|News|BTC",cryptocompare
2025-06-09T22:40:49,"SEC Chair Paul Atkins Highlights Potential Shift Toward Greater Self-Custody Flexibility for Bitcoin and DeFi Assets","SEC Chair Paul Atkins emphasizes the importance of self-custody in crypto regulation, marking a shift from previous administration policies. Atkins criticizes the former SEC stance on DeFi and staking, advocating",coinotag,https://en.coinotag.com/sec-chair-paul-atkins-highlights-potential-shift-toward-greater-self-custody-flexibility-for-bitcoin-and-defi-assets/,"BTC|REGULATION","News|BTC|Core",cryptocompare
2025-06-09T22:28:33,"Bitcoin Surpasses $110,000 Amid Market Optimism and U.S.-China Trade Talks","Bitcoin surged past the $110,000 mark for the first time in nearly two weeks, spearheading a broad rally across major cryptocurrencies amid easing U.S.-China trade tensions. Alongside Bitcoin’s rebound, altcoins",coinotag,https://en.coinotag.com/bitcoin-surpasses-110000-amid-market-optimism-and-u-s-china-trade-talks/,"ALTCOIN|BTC|MARKET|TRADING","News|BTC",cryptocompare
2025-06-09T22:26:19,"Publicly Traded Firm KULR Acquires 118.6 Bitcoin, Treasury Reaches 920 BTC","KULR Technology Group Inc. acquired 118.6 bitcoin for approximately $13 million, increasing its corporate treasury holdings. The purchase price averaged roughly $107,861 per bitcoin, the company stated Monday. This brings KULR’s total bitcoin holdings to 920 BTC. Those 920 BTC represent a total investment of about $91 million, acquired at an average price of $98,760",bitcoin.com,https://news.bitcoin.com/publicly-traded-firm-kulr-acquires-118-6-bitcoin-treasury-reaches-920-btc/,"BTC|REGULATION|TECHNOLOGY|TRADING","News Bytes|Bitcoin (BTC)|companies",cryptocompare
2025-06-09T22:24:15,"Bitcoin Soars Above $110K, Nearing Record as Ethereum and Dogecoin Rise","Bitcoin's price jumped past $110,000 for the first time in about two weeks to lead a broader upturn in digital assets.",decrypt,https://decrypt.co/324317/bitcoin-soars-above-110k-ethereum-dogecoin,"BTC|DOGE|ETH|MARKET|TRADING","||Markets",cryptocompare
2025-06-09T22:15:00,"Bitcoin’s $130K Potential: Key Trends and Market Signals to Watch Right Now","Plan B predicts Bitcoin could hit $130,000 by June with a retest of the RSI 75 level. Open interest rises 81.84% to $82.8B with a positive funding rate and long liq. at $7.52M. Michael van de Poppe expects buying pressure to accelerate Bitcoin’s growth above key levels. Bitcoin is attracting interest this month, with analysts noting that it could revisit certain key price points. Analyst Plan B considers revisiting the RSI 75 level as ideal for Bitcoin to move beyond $130,000 by June. The market relies on conquering the $130,000 price point to sustain upward momentum. Source: X Bullish Sentiment Rises Amid Heavy Short Liquidations According to the analytical platform Coinglass, the overall open interest increased by 4.94% to $75.96 billion, and the OI-weighted funding rate shifted from negative to positive at 0.0041%. The current long-to-short ratio of 1.071 is optimistic, showing that most traders have a bullish outlook. Yet, in the past 24 hours, the amount of long assets liquidated rose to $7.52 million, but is much lower than the $62.08 million for short liquidations. Source: Coinglass Bitcoin’s Growth Potential: Holding Key Levels Fuels Momentu… The post Bitcoin’s $130K Potential: Key Trends and Market Signals to Watch Right Now appeared first on Coin Edition .",coinquora,https://coinedition.com/bitcoins-130k-potential-key-trends-and-market-signals-to-watch-right-now/,"BTC|MARKET|TRADING","CoinMarketCap Feed|Market|Market News|News|Price Analysis|Top Crypto News|Bitcoin News",cryptocompare
2025-06-09T22:10:35,"Paraguayan President’s X Account Hacked – False Bitcoin Legal Tender Announcement Posted","Key Takeaways: Paraguay’s President Santiago Peña had his official X account compromised, leading to the spread of a false announcement about Bitcoin. The language and content of the post raised immediate red flags among observers, prompting swift clarification from the Paraguayan government. On-chain analysis showed the attached wallet had minimal funds and no activity, suggesting a phishing attempt. Paraguay’s President, Santiago Peña, became the latest high-profile figure to fall victim to a social media hack after his official X account was compromised on Monday. The breach resulted in a fake announcement claiming the country had adopted Bitcoin as legal tender. Paraguay Denies Bitcoin Legal Tender Claim After Presidential Account Hack The message, written unusually in English rather than Spanish, declared that Paraguay had made Bitcoin an official currency. It also claimed the government had created a $5 million BTC reserve and launched a bond program for “crypto-enabled citizens.” The post urged users to send any amount of Bitcoin to a wallet address, supposedly to determine the scale of a national rollout. https://twitter.com/SantiPenap/status/1932125390153396541 Observers quickly flagged the message as suspicious. Many noted that the language and tone were inconsistent with previous communications from the president, who typically posts in Spanish. Shortly after the post went live, the platform flagged the account for “irregular activity,” according to an additional report. The Paraguayan government swiftly issued an official response. The presidential account posted a message in Spanish that read: “Información falsa. Comunicado oficial de la presidencia de la República del Paraguay.” This statement confirmed that the Bitcoin announcement was false. Comunicado oficial. pic.twitter.com/Bk3XI6ohpp — Presidencia Paraguay (@PresidenciaPy) June 9, 2025 However, the hacker attempted to conceal the government’s warning by hiding the official reply beneath the scam post. The fraudulent message remained live for a time, possibly misleading unsuspecting users. On-chain data revealed that the wallet address provided by the hacker held only $4 and had recorded no transactions since the announcement. Despite the low activity, the nature of the post resembled a classic crypto phishing scheme. Authorities urged the public not to trust any posts from the president’s account until further notice. Paraguay’s national cybersecurity team has launched an investigation and is working with X to resolve the incident and restore control over the account. “We ask citizens to ignore any messages from the presidential account until we confirm its security,” the government said. Ongoing Crypto Scam Wave Hits Political and Industry Targets Across Latin America The hacking of Paraguayan President Santiago Peña’s official X account adds to a growing string of high-profile social media compromises, many of which have targeted the crypto industry and public figures to spread misinformation and scams. Over the past year, threat actors have increasingly exploited X for crypto-related phishing attacks. In May 2025 alone, the X accounts of Ethereum Layer-2 project ZKsync and its developer Matter Labs, were breached . @zksync & @the_matter_labs official X accounts hacked to post fake SEC alerts & phishing airdrops—ZK token drops 5%. #zksync #sec #phishing https://t.co/j4Yx6HHaob — Cryptonews.com (@cryptonews) May 13, 2025 Hackers posted fraudulent messages claiming the protocol was under U.S. investigation and shared phishing links disguised as airdrops. Around the same time, the New York Post’s account was hijacked to impersonate journalists and lure crypto users into fake podcast offers via Telegram. Earlier in the year, Canadian regulators also flagged fake articles featuring political endorsements used to promote crypto scams. State-sponsored hackers from the Lazarus Group have also posed as VCs in fake Zoom meetings to steal users’ private keys.” Paraguay has shown no intention to follow El Salvador’s 2021 move, which remains in a legal gray area following an IMF agreement reached in late 2024. Meanwhile, Paraguay’s crypto scene is under pressure. As Bitcoin mining gains traction, thanks to the country’s hydroelectric surplus, regulatory tensions are rising. Industrial players warn that new electricity rates could drive miners away . With over 10,000 illicit mining rigs seized in 2024 and tensions rising around mining regulations, the misuse of official platforms for misinformation poses a real threat to public understanding in an already volatile sector. The post Paraguayan President’s X Account Hacked – False Bitcoin Legal Tender Announcement Posted appeared first on Cryptonews .",cryptonews,https://cryptonews.com/news/paraguay-president-x-hack-bitcoin-legal-tender/,"BLOCKCHAIN|BTC|MINING|REGULATION|ZK","Bitcoin News|News|Bitcoin|crypto scam|Paraguay",cryptocompare
2025-06-09T22:01:13,"Uniswap, Jump and Leading Crypto Trade Associations To Issue Statement in Support of Blockchain Regulatory Certainty Act: Report","Leading crypto firms Uniswap, Jump Trading and the Blockchain Association will soon issue a joint statement supporting the Blockchain Regulatory Certainty Act (BRCA), according to crypto reporter Eleanor Terrett. Terrett tells her 238,200 followers on the social media platform X that the statement is “imminent.” “NEW: I’m hearing that a joint statement is imminent from the eight leading crypto trade associations, along with Uniswap and Jump, expressing their support for the Blockchain Regulatory Certainty Act (BRCA) being included in the latest version of the CLARITY Act.” The BRCA aims to provide clarity and certainty for developers, miners, and other innovators in the non-custodial crypto ecosystem. According to Terrett, the eight groups are the DeFi Education Fund, Coin Center, Solana Institute, Chamber of Digital Commerce, Blockchain Association, Crypto Council, Bitcoin Policy Institute and Paradigm, who say that the legislation is critical for protecting software developers and infrastructure providers who do not custody customer funds. “The amendment, originally introduced by GOP Majority Whip and now with bipartisan support from Rep Ritchie, is being viewed by many in the industry as a foundational policy safeguard for DeFi developers. ‘It’s critically important that we don’t treat open-source developers like traditional financial institutions,’ one policy lead told me. ‘The BRCA draws that line clearly and protects innovation.’ The joint statement urges lawmakers to include the BRCA in the CLARITY Act, the House’s digital asset market structure bill, which is expected to be marked up next week.” At time of writing, no statement has been issued. Follow us on X , Facebook and Telegram Don't Miss a Beat – Subscribe to get email alerts delivered directly to your inbox Check Price Action Surf The Daily Hodl Mix Disclaimer: Opinions expressed at The Daily Hodl are not investment advice. Investors should do their due diligence before making any high-risk investments in Bitcoin, cryptocurrency or digital assets. Please be advised that your transfers and trades are at your own risk, and any losses you may incur are your responsibility. The Daily Hodl does not recommend the buying or selling of any cryptocurrencies or digital assets, nor is The Daily Hodl an investment advisor. Please note that The Daily Hodl participates in affiliate marketing. Generated Image: DALLE3 The post Uniswap, Jump and Leading Crypto Trade Associations To Issue Statement in Support of Blockchain Regulatory Certainty Act: Report appeared first on The Daily Hodl .",dailyhodl,https://dailyhodl.com/2025/06/09/uniswap-jump-and-leading-crypto-trade-associations-to-issue-statement-in-support-of-blockchain-regulatory-certainty-act-report/,"BLOCKCHAIN|BTC|BUSINESS|TRADING|UNI","Regulators|Blockchain Regulatory Certainty Act|BRCA|Crypto|News|regulators|Uniswap",cryptocompare
