datetime,headline,summary,source,url,categories,tags,api_source
2025-06-12T04:25:31,"Bitcoin Faces Calm Before the Storm as Market Eyes $120K Milestone","Bitcoin persists in a well-defined bullish structure but recent activity in spot and derivatives markets suggests a temporary cooling-off phase. Even though there’s been plenty of price action over the past several weeks, short-term holders seem to be showing quite a bit of restraint. Broader market data implies that we’re taking a strategic pause rather than experiencing a sentiment shift. Although Bitcoin hit the $110K recently, several important indicators are now signaling a possible short-term pullback — what could be a perfectly healthy pause in an otherwise strong uptrend. At this point, it’s the $120K our eyes are most glued to, as this potential psychological milestone could trigger all kinds of renewed volatility, not to mention some profit-taking behavior. Over the past 24 hours, Short-Term Holders have been selling an average of around 21K BTC via centralized exchanges (CEX), which is below the historical average level of selling pressure. This suggests that short-term holders are currently in a state of relative calm that is,… pic.twitter.com/rAhKh7C2hG — Axel Adler Jr (@AxelAdlerJr) June 11, 2025 Short-Term Holders Stay Calm Amid Rally In the last 24 hours, an average of 21,000 BTC has been sold through centralized exchanges by holders who qualify as short-term. This does sound like a lot, and it is probably too many BTC to part with for any sane BTC bull. Yet, for this phase of the market, the offloading we have seen is a pretty normal occurrence, with the much-anticipated rally not resulting in reactionary selling from the short-term holders that we would usually expect. The sell-side pressure that we see now is a diluted version of what we had a couple of months ago, and it might even be the blush of a possible bottom. Of course, when a market is going up, we want to see the selling in the rearview mirror. And when a market is going down, we want to see the buying in the rearview mirror. Right now, we see in the rearview mirror that sellers are becoming fewer and sometimes even friendlier. As Bitcoin moves nearer to the $120K mark, the current state of tranquility may not linger. Numbers that are round and close to psychologically significant levels, like $100K and $120K, tend to attract and demand our attention. They often act as focal points for retail investors and serve as convenient landmarks for decision-making among various market participants. A tour through profit-taking at either of these two destinations would certainly qualify as a potential path to peace for profit-seekers. Derivatives Market Flashes Caution Alongside the cautious optimism in spot markets, the derivatives landscape is also noticing a reset. Open interest has recently dropped $1 billion, indicating that a large-scale unwinding of leveraged positions is happening. This reduction in leverage occurs when traders exit trades. They might exit trades to take profit, or they might exit trades to limit losses during heightened volatility. Open interest is declining, and so is net taker volume. When aggressive traders in derivatives markets are taking up a position (buying in this case), they put money to work in the market. When they stop putting money to work and start taking money back out of the market, we start to see these kinds of numbers come up. They’re not just bad numbers; they paint a bad picture. And the picture they’re painting right now happens to rhyme with the $BTC picture. Although the price could dip to $106,000 without violating the overall upward trend, it would represent a not-so-healthy market rotating away from not-so-healthy market participants. A number of recent price dips have marked transitions from the not-so-healthy phase of excessive speculation to a phase with stronger market participants (“strong hands”), offering a somewhat healthier basis from which to move on to new price highs. This transition has been necessary and, I would argue, constructive. A $1B drop in open interest indicates a large-scale position unwind and reduced leverage. The negative net taker volume (purple bar) reflects seller dominance and a pullback from the local $110K peak. If the bearish momentum persists, BTC could test support around $106K. pic.twitter.com/8CSDTr0uux — Axel Adler Jr (@AxelAdlerJr) June 10, 2025 $120K in Focus: A Key Test Ahead The $120K price point is looming. It represents not just another increase in the nominal price but also a potential major psychological hurdle that could affect retail and institutional sentiment. If Bitcoin gets close to this number, it might spark a fresh wave of decision-making around it: are we gonna lock in profits, or are we gonna use this momentum to push through the next big threshold? If the short-term holder group stays patient, as they are now, and if leverage stays low, then Bitcoin has a better shot at breaking the $120K mark with less pushback. Conversely, if the market starts to hit the “sell” button as Bitcoin nears $120K, then we might see it take a little dip before attempting another breakout. All in all, a bullish market structure still characterizes Bitcoin, but the next phase depends on a next-to-delicate balance of investor behavior and market dynamics. From the data at hand, it looks as if we are seeing consolidation but with a cautionary undertone, not a capitulation. Even with the current price pushing some holders into a profit, asking them to give up their Bitcoin is an ask too far, right now at least. If short-term holders remain this composed, then another push to the upside could happen. Leverage stepping back and price behaving in a way that makes it a Bitcoiners’ market also makes said push more likely. Disclosure: This is not trading or investment advice. Always do your research before buying any cryptocurrency or investing in any services. Follow us on Twitter @nulltxnews to stay updated with the latest Crypto, NFT, AI, Cybersecurity, Distributed Computing, and Metaverse news !",themerkle,https://nulltx.com/bitcoin-faces-calm-before-the-storm-as-market-eyes-120k-milestone/,"BTC|BUSINESS|MARKET|TRADING|RESEARCH","Crypto|News",cryptocompare
2025-06-12T04:15:48,"Peter Schiff Expresses Possible Regret Over Missing Early Bitcoin Investment Opportunity","Peter Schiff, a prominent gold advocate and Bitcoin skeptic, has publicly expressed regret for not investing in Bitcoin during its early stages, marking a notable shift in his stance amid",coinotag,https://en.coinotag.com/peter-schiff-expresses-possible-regret-over-missing-early-bitcoin-investment-opportunity/,"BTC|FIAT","News|BTC",cryptocompare
2025-06-12T04:09:58,"Bitcoin Sell Pressure May Ease If Price Surpasses $130,000, Suggests Bitwise CEO","Bitcoin’s price momentum is poised to shift dramatically once it surpasses the $130,000 threshold, signaling a potential end to significant sell pressure. Early Bitcoin holders are currently capitalizing on gains",coinotag,https://en.coinotag.com/bitcoin-sell-pressure-may-ease-if-price-surpasses-130000-suggests-bitwise-ceo/,"BTC|TRADING","Bitcoin|News",cryptocompare
2025-06-12T04:05:53,"Crypto Prices Plunge as Geopolitical Tensions Escalate","Bitcoin price dropped nearly 2% amidst Middle Eastern tensions. Geopolitical events influenced oil prices, causing market fluctuations. Continue Reading: Crypto Prices Plunge as Geopolitical Tensions Escalate The post Crypto Prices Plunge as Geopolitical Tensions Escalate appeared first on COINTURK NEWS .",cointurken,https://en.coin-turk.com/crypto-prices-plunge-as-geopolitical-tensions-escalate/,"BTC|COMMODITY|MARKET|TRADING","Cryptocurrency News",cryptocompare
2025-06-12T04:00:07,"US Stock Market Open: Exciting Gains Spark Investor Sentiment","BitcoinWorld US Stock Market Open: Exciting Gains Spark Investor Sentiment Hello, crypto enthusiasts! While our focus is often on the exciting world of digital assets, paying attention to traditional financial markets, especially the US Stock Market Open , is crucial. Why? Because the movements in stocks, particularly major indices, often provide valuable insights into broader economic health and investor appetite for risk – factors that significantly influence the cryptocurrency landscape. Today, we’re seeing a positive start on Wall Street, with major indices opening higher. This upward movement is noteworthy and something investors across all asset classes should consider. Understanding Today’s US Stock Market Open The US Stock Market Open today showed a clear positive trajectory across the major indices. This follows recent trading sessions and reflects the current mood among investors as trading for the day begins. Here’s a quick look at how the key indices performed right out of the gate: Index Change S&P 500 +0.18% NASDAQ Composite +0.24% Dow Jones Industrial Average +0.04% While these initial gains might seem modest, a positive open sets a tone for the trading day and can indicate underlying strength or confidence in the market. What Drives Stock Market Performance? Analyzing Stock Market Performance involves looking at a variety of factors. Today’s positive open could be attributed to several potential drivers: Positive Economic Data: Recent reports on employment, manufacturing, or consumer confidence can paint an optimistic picture, encouraging buying activity. Corporate Earnings: Strong performance reports from major companies can boost overall market sentiment. Federal Reserve Outlook: Expectations regarding interest rates or monetary policy can significantly impact market direction. A perceived dovish stance or stability often favors stocks. Global Market Cues: Performance in Asian and European markets overnight can influence the mood on Wall Street. Understanding these drivers helps contextualize the daily movements and provides a clearer picture of the forces shaping Stock Market Performance . Spotlight on NASDAQ Performance The NASDAQ Performance is particularly interesting for many crypto investors. The NASDAQ Composite Index is heavily weighted towards technology and growth stocks. Often, these are the same types of companies that are involved in or influenced by blockchain technology, fintech, and other digital advancements. A strong NASDAQ Performance can signal a ‘risk-on’ environment where investors are more willing to invest in growth-oriented, potentially higher-volatility assets. This sentiment often spills over into the crypto market, as Bitcoin and altcoins are also considered risk assets. The +0.24% gain at the open suggests positive momentum in the tech sector, which is a key area to watch for correlation with crypto trends. The Significance of the S&P 500 Index The S&P 500 Index is widely considered a benchmark for the overall health of the U.S. stock market, representing the performance of 500 of the largest publicly traded companies in the United States. Its movement provides a broad snapshot of market sentiment and economic conditions. A positive start for the S&P 500 Index , even a modest one like +0.18%, indicates that gains are not confined to just one sector but are potentially spread across various industries. This suggests a more generalized positive outlook among institutional and retail investors alike. Monitoring the S&P 500 gives investors a sense of the market’s breadth and underlying strength. How Does This Relate to Investor Sentiment? Today’s positive US Stock Market Open is a direct reflection of current Investor Sentiment . When markets open higher across the board, it suggests that investors are feeling optimistic about the economic outlook or specific market catalysts. Positive Investor Sentiment is a powerful force. It can lead to increased buying pressure, pushing asset prices higher. Conversely, negative sentiment can trigger sell-offs. For the crypto market, which is known for its sensitivity to market mood, strong Investor Sentiment in traditional markets is generally seen as a positive sign. It implies a greater willingness to allocate capital to assets perceived as having higher growth potential, including cryptocurrencies. What Does Positive Investor Sentiment Mean for Crypto? While not a direct one-to-one correlation, positive sentiment in stocks often creates a favorable backdrop for crypto. Here’s why: Risk-On Environment: When investors are confident, they tend to move capital into riskier assets. Both tech stocks and crypto benefit from this. Liquidity: A rising stock market can indicate ample liquidity in the financial system, some of which can flow into digital assets. Confidence Boost: General market optimism can simply make investors feel more comfortable putting money into volatile assets like Bitcoin and altcoins. Challenges and Considerations Despite the positive open and the boost to Investor Sentiment , it’s important to remain aware of potential challenges. Market conditions can change rapidly. Factors such as unexpected inflation data, shifts in Federal Reserve commentary, geopolitical events, or regulatory news can quickly dampen optimism and reverse market trends. Both stock and crypto markets are susceptible to these external pressures. Therefore, while today’s open is positive, maintaining a balanced perspective and staying informed about broader economic and political developments is key. Looking Ahead: Actionable Insights For those tracking both stocks and crypto, here are a few actionable insights based on today’s US Stock Market Open : Monitor the Trend: Is the positive open sustained throughout the day? Continued strength reinforces the positive sentiment signal. Watch Key Data Releases: Keep an eye on upcoming economic reports scheduled for the week, as these can confirm or challenge the current market optimism. Observe Crypto Correlation: See how Bitcoin and other major cryptocurrencies react to the positive stock market movement. Does the correlation hold? Sector Focus: Pay attention to the performance of specific stock sectors, particularly technology (reflected in NASDAQ Performance), as this often has a closer link to crypto movements. Today’s positive Stock Market Performance provides a snapshot of current market confidence. By understanding the drivers behind these movements and their potential impact on Investor Sentiment , crypto enthusiasts can gain valuable context for their own investment decisions. Compelling Summary In summary, the US Stock Market Open today saw major indices like the S&P 500 Index and the NASDAQ Composite posting gains. This positive Stock Market Performance is indicative of favorable Investor Sentiment as the trading day begins. While the crypto market has its own unique dynamics, the ‘risk-on’ environment suggested by a rising stock market often creates a supportive backdrop for digital assets. Keeping an eye on key indicators like the NASDAQ Performance and overall market trends helps provide a more complete picture of the financial landscape and potential influences on your crypto portfolio. Remember that markets are interconnected, and understanding traditional finance is a powerful tool for navigating the world of crypto. To learn more about the latest crypto market trends, explore our article on key developments shaping Bitcoin price action. This post US Stock Market Open: Exciting Gains Spark Investor Sentiment first appeared on BitcoinWorld and is written by Editorial Team",bitcoinworld,https://bitcoinworld.co.in/us-stock-market-open-3/,"BTC|BUSINESS|MARKET|TECHNOLOGY|TRADING","Crypto News|dow-jones|investor sentiment|Nasdaq|S&P 500|Stock Market",cryptocompare
2025-06-12T03:57:47,"Nearly One-Third of Bitcoin Supply Held by Centralized Treasuries, Indicating Institutional Shift","Centralized treasuries now control nearly one-third of Bitcoin’s circulating supply, marking a significant shift toward institutional dominance in the crypto market. Research by Gemini and Glassnode reveals that governments, ETFs,",coinotag,https://en.coinotag.com/nearly-one-third-of-bitcoin-supply-held-by-centralized-treasuries-indicating-institutional-shift/,"BTC|MARKET|RESEARCH","Bitcoin|News|BTC",cryptocompare
2025-06-12T03:54:29,"Centralized Bitcoin treasuries hold 31% of BTC supply: Gemini","Centralized treasuries, including governments, ETFs and public companies, now control approximately $668 billion of Bitcoin’s circulating supply.",cointelegraph,https://cointelegraph.com/news/bitcoin-treasuries-now-hold-nearly-31-bitcoin-supply-gemini?utm_source=rss_feed&utm_medium=rss&utm_campaign=rss_partner_inbound,"BTC","",cryptocompare
2025-06-12T03:46:02,"No one will sell their Bitcoin once it taps $130K: Bitwise CEO","Bitcoin selling will “peter off” once Bitcoin’s price moves above $130,000, says a crypto executive.",cointelegraph,https://cointelegraph.com/news/bitcoin-price-130k-sell-off-disappears-bitwise-ceo?utm_source=rss_feed&utm_medium=rss&utm_campaign=rss_partner_inbound,"BTC|TRADING","",cryptocompare
2025-06-12T03:40:37,"ASIC Bans Former Adviser Glenda Rogan for 10 Years Over AUD 14.8 Million Crypto Scam Involving Bitcoin","The Australian Securities and Investments Commission (ASIC) has imposed a decade-long ban on former financial adviser Glenda Rogan following a thorough investigation. Between March 2022 and June 2023, Rogan misappropriated",coinotag,https://en.coinotag.com/breakingnews/asic-bans-former-adviser-glenda-rogan-for-10-years-over-aud-14-8-million-crypto-scam-involving-bitcoin/,"BTC","BTC",cryptocompare
2025-06-12T03:40:03,"Bitcoin Reserves Signal Progress – But Not a Solution","HodlX Guest Post Submit Your Post “When the highs are high, the lows are even lower” accurately describes the emotional ups and downs of the cryptocurrency market. An investor will ride the wave of euphoria one day as prices peak, and then, the next, they’ll be coping with losses as the market takes a sudden and sharp turn. This pattern was seen at the beginning of 2025, when declines in Bitcoin, Ethereum and XRP signaled a rough start to the year. While it’s impossible to know if this decrease was caused by geopolitical concerns or economic instability, both put the market to the test. But following some periods of uncertainty, the crypto market has shown strong signs of revival. On May 14, 2025, Bitcoin reached a high of $104,159.98, and Ethereum peaked at $2,680.23, showing increasing confidence of investors as the market shows signs of recovery. With the first half of 2025 well underway, investors are examining past events to assess the market’s direction for the remainder of the year. Many are eying crypto reserves, as accumulating assets like BTC , ETH and a few other leading currencies is seen as having potential for continued growth. Yet, the extent of this impact remains uncertain. What’s the point of a crypto reserve Countries worldwide have strategic reserves, which they intend to draw from during supply shortages. For instance, different stockpiles are used to protect resources in the United States. Over 50 years ago, the US created the Petroleum Reserve , an oil stockpile with a total capacity of 727 million barrels to guard against supply interruptions. Around the world, governments have started assessing the benefits of adopting crypto reserves, mainly as a result of their demand over the past decade. As DeFi (decentralized finance) continues to become a hot topic, some countries have already acquired digital assets, creating a stockpile as they gain increased legitimacy worldwide. In response to this trend, some have already begun acquiring digital assets to build a collection of cryptocurrencies as they gain increased legitimacy. In Bitcoin’s case, its scarcity makes it even more attractive for governments to acquire. Bhutan, for example, a country sandwiched between India and Tibet, has emerged as an unexpected crypto holder. In the past few months, its government has moved over $63 million worth of BTC into three different wallets, one reportedly containing 600 BTC. Before returning to the Oval Office in November 2024, President Trump shared his plans to advance pro-crypto legislation, openly discussing his goal of creating a national crypto reserve. In March 2025, this became a reality when he signed an executive order establishing the country’s first Bitcoin reserve. As the market continues on this unpredictable path, many have questioned whether introducing global crypto reserves could be a legitimate remedy for stabilizing the market during periods of volatility. Are crypto reserves investors’ saving grace It’s easy to see why people believe that as governments acquire crypto and stockpile it, prices should rise, investor confidence should be strengthened and mainstream acceptance should accelerate. This perspective has inspired broader discussions within governments. A couple of months back, in April 2025, two Swedish lawmakers encouraged Elizabeth Svantesson, the country’s finance minister, to consider adding Bitcoin to the national reserves. They shared that introducing a Bitcoin reserve would help stay ahead of inflation amid growing geopolitical uncertainty. Similarly, in January 2025, the Czech National Bank governor discussed the possibility of adding a crypto reserve. When Trump initially announced the establishment of a Bitcoin reserve, the news generated some noise. Yet, the market’s response was relatively conservative, dropping five percent after the announcement. Despite national-level movements, US states have begun processing approvals at the state level, with 18 proposals from different states currently pending approval. Arizona Governor Katie Hobbs, for example, signed Senate Bill HB 2749, which updated the state’s unclaimed property laws to include digital assets. This law allows the state to retain unclaimed crypto in its original form if the owner remains unresponsive after three years, signaling a shift in how assets are valued on a state scale. This would be a welcome turn towards crypto-friendly legislation and a sign of things to come for broader adoption and increased acceptance throughout the state. On May 6, 2025, in the northeastern part of the country, New Hampshire was the first US state to allow its government to invest in virtual currencies and hold a strategic Bitcoin reserve. Governor Kelly Ayotte signed House Bill 302 , which allows the state treasurer to invest up to five percent of public funds in digital assets with a market capitalization of over $500 billion. Given the fluctuations in the financial market, some might consider it unsuitable for investment. On the other hand, some evaluate it through a bullish lens, recognizing its growth potential as an opportunity to purchase at a lower cost before the market rebounds. While a crypto reserve offers strategic advantages – especially for countries looking to diversify from traditional currencies – its current role is more complementary than the main driver. Whether a crypto reserve would be powerful enough to turn the market 180 degrees is still unknown. When nations build digital reserves and suggest establishing crypto reserves, demand inherently increases. But this general stability depends on a wide range of factors, such as broader macroeconomic trends, institutional adoption and regulatory clarity. While it would be simplistic to assume that crypto reserves could shield against market volatility, it will take time to see their impact. Until then, events, concepts and innovations will continue to shape the trajectory of both traditional and digital financial markets. James Wo , founder and CEO of DFG since its establishment in 2015, is a seasoned entrepreneur and crypto space investor. He currently manages a portfolio exceeding $1 billion in assets. With a track record as an early investor, James has supported companies such as LedgerX, Ledger, Coinlist, Circle and ChainSafe. Check Latest Headlines on HodlX Follow Us on Twitter Facebook Telegram Check out the Latest Industry Announcements Disclaimer: Opinions expressed at The Daily Hodl are not investment advice. Investors should do their due diligence before making any high-risk investments in Bitcoin, cryptocurrency or digital assets. Please be advised that your transfers and trades are at your own risk, and any loses you may incur are your responsibility. The Daily Hodl does not recommend the buying or selling of any cryptocurrencies or digital assets, nor is The Daily Hodl an investment advisor. Please note that The Daily Hodl participates in affiliate marketing. Generated Image: DALLE3 The post Bitcoin Reserves Signal Progress – But Not a Solution appeared first on The Daily Hodl .",dailyhodl,https://dailyhodl.com/2025/06/11/bitcoin-reserves-signal-progress-but-not-a-solution/,"BTC|BUSINESS|FIAT|MARKET|REGULATION","HodlX",cryptocompare
2025-06-12T03:17:31,"Louisiana Explores Blockchain With $50M Fund as Connecticut’s Bitcoin Reserve Policy Remains Unclear","Louisiana has taken a significant step in advancing blockchain technology by forming a dedicated subcommittee and announcing a $50 million fund to foster innovation in the crypto sector. Meanwhile, Connecticut’s",coinotag,https://en.coinotag.com/louisiana-explores-blockchain-with-50m-fund-as-connecticuts-bitcoin-reserve-policy-remains-unclear/,"BLOCKCHAIN|BTC|FIAT|TECHNOLOGY","News|BTC",cryptocompare
