datetime,headline,summary,source,url,categories,tags,api_source
2025-06-12T05:51:39,"Bitcoin Price Prediction 2025: Is this a Calm of Maturity or Just the Eye Before the Next Storm?","The post Bitcoin Price Prediction 2025: Is this a Calm of Maturity or Just the Eye Before the Next Storm? appeared first on Coinpedia Fintech News The US Bureau of Labor Statistics has released May’s CPI inflation rose to 2.5% YoY, matching expectations. With no surprises and, apparently, no shocks to the markets either. Despite the uptick, Bitcoin, equities, and altcoins remained steady with no panic, no rally, but just quiet resilience. This suggests that the markets have priced in mild inflation as the new normal, as the investors are more focused on rate decisions, ETF flows, and broader macro narratives than a CPI number. Now that the BTC price has officially traded above $100,000 for 30 consecutive days for the first time in history, will the upswing continue toward new highs? Bitcoin has experienced a sustained adoption from states, banks, and corporations, which has marked a new era of institutional confidence in BTC. As per some reports , 116 public companies now hold 809.1K Bitcoin, up from 312.2K a year ago. Moreover, since early April alone, nearly 100K BTC has been added, with 25+ companies disclosing new holdings. The data also shows MicroStrategy and other institutions have intensified their accumulation since November 2024 when the market rose above the consolidation phase. Since then, the BTC price has maintained a strong ascending trend and is just 3% to 4% away from the ATH. Despite this, the whales remain optimistic and not interested in taking away their profits. The above chart shows the net realized profit or loss, which has spiked each time the BTC price surged above the consolidation. This was aimed to extract profit as the whales and the investors may not be confident about the upcoming price action. However, the current breakout does not appear to have attracted them to take out the profit, as the whales seem to be bullish on Bitcoin and expect the price to maintain a strong upswing. This suggests the BTC price may continue to maintain a strong ascending trend and eventually mark a new ATH soon. Currently, Bitcoin has entered the final resistance zone ahead of an ATH but has still not broken the barrier yet. Moreover, the price is squeezing with a significant rise in the volume from around $36 billion to close to $60 billion. This suggests panic selling but the question remains whether the price will hold the key levels around $106K after plunging below $108K. If this happens, then a new ATH could be a few weeks away; otherwise, the Bitcoin (BTC) price may face a deeper correction and reach levels just below $100,000 and further trigger a strong upswing to mark a new ATH.",coinpedia,https://coinpedia.org/price-analysis/bitcoin-price-prediction-2025-is-this-a-calm-of-maturity-or-just-the-eye-before-the-next-storm/,"ALTCOIN|BTC|BUSINESS|MARKET|TRADING","Price Analysis|Bitcoin",cryptocompare
2025-06-12T05:42:22,"Bitcoin May Recover Toward $110,000 Amid Rising US CPI and Strong Investor Sentiment","Bitcoin experiences a dip below $108,000 amid a US CPI increase to 2.4%, yet strong investor buying pressure hints at a potential rebound toward $110,000. Market sentiment remains bullish with",coinotag,https://en.coinotag.com/bitcoin-may-recover-toward-110000-amid-rising-us-cpi-and-strong-investor-sentiment/,"BTC|BUSINESS|MARKET|TRADING","Analysis|News|BTC",cryptocompare
2025-06-12T05:38:45,"Bitcoin Bull Novogratz Says Strategy Copycats Are Getting 'Overhyped'","Novogratz claims that Bitcoin treasury companies are getting overhyped",utoday,https://u.today/bitcoin-bull-novogratz-says-strategy-copycats-are-getting-overhyped,"BTC|REGULATION|TRADING","Bitcoin Price Prediction|BTC",cryptocompare
2025-06-12T05:34:11,"Ethereum Price Surpasses $2,800 Amid Institutional Inflows and Market Optimism","Ethereum’s price has surged beyond the $2,800 mark, driven primarily by strong institutional inflows and positive market sentiment. This upward momentum reflects growing investor confidence and a broader bullish trend",coinotag,https://en.coinotag.com/ethereum-price-surpasses-2800-amid-institutional-inflows-and-market-optimism/,"BTC|BUSINESS|ETH|MARKET|TRADING","Analysis|News|BTC|ETH",cryptocompare
2025-06-12T05:31:10,"H100 Group Raises $10.6 Million to Potentially Expand Bitcoin Holdings in Health Tech Strategy","Swedish health tech firm H100 Group AB has significantly boosted its Bitcoin treasury strategy by raising $10.6 million, signaling growing corporate confidence in Bitcoin as a strategic asset. This latest",coinotag,https://en.coinotag.com/h100-group-raises-10-6-million-to-potentially-expand-bitcoin-holdings-in-health-tech-strategy/,"BTC|REGULATION","Bitcoin|News|BTC|Core",cryptocompare
2025-06-12T05:30:20,"Bitcoin inches towards $115K, but what missing panic means for BTC’s price","Bitcoin holds strong above $100K amid profit-taking and low volatility; $115.4K emerges as key resistance.",ambcrypto,https://ambcrypto.com/bitcoin-inches-towards-115k-but-what-missing-panic-means-for-btcs-price/,"BTC|TRADING","Bitcoin|BTC Trading View|News|News 1|Social|Trading View",cryptocompare
2025-06-12T05:30:12,"Ionic Digital Reports Astounding $9.8M Crypto Profit and Growing Bitcoin Holdings","BitcoinWorld Ionic Digital Reports Astounding $9.8M Crypto Profit and Growing Bitcoin Holdings Hey crypto enthusiasts! Get ready for some exciting news from the world of Bitcoin mining. Ionic Digital, a prominent Bitcoin mining company , has just released its operational results for May 2025, and they are certainly turning heads. The report highlights robust profitability and a strategic increase in the company’s digital asset reserves, painting a positive picture for its performance in the current market cycle. What Fueled Ionic Digital’s Strong May Performance? According to the latest report via Businesswire, Ionic Digital demonstrated impressive operational efficiency and market timing in May 2025. The core of their success lies in their mining output and strategic sales: Bitcoin Mined: Ionic Digital successfully mined 132.9 BTC during the month. This figure reflects their operational capacity and hash rate contribution to the Bitcoin network. Bitcoin Sold: The company opted to sell a significant portion of their mined Bitcoin, offloading 97 BTC. This decision is crucial for covering operational expenses, capital expenditures, and generating realized profit. Average Selling Price: The 97 BTC were sold at an average price of $101,207 per coin. Selling at this level, reflective of a strong BTC price environment in May, was a key factor in their financial results. Net Profit Realized: These sales, conducted at a favorable BTC price , resulted in a net profit of $9.8 million for the month. This substantial crypto profit underscores the potential profitability of well-managed mining operations during periods of high Bitcoin value. Achieving a $9.8 million crypto profit in a single month is a significant milestone for any Bitcoin mining company and demonstrates Ionic Digital’s ability to capitalize on market conditions. Growing Their Digital Treasury: Ionic Digital’s Bitcoin Holdings Beyond just selling for profit, Ionic Digital is also focused on accumulating and strengthening its balance sheet by increasing its Bitcoin holdings . This strategy is common among mining companies who see the potential for future appreciation in the value of Bitcoin. End-of-Month Holdings: As of the end of May 2025, Ionic Digital held a total of 2,520.2 BTC. Month-over-Month Growth: This represents a 1.44% increase in their Bitcoin holdings compared to the end of April. While they sold a large portion of their mined BTC, they still managed to add to their overall reserves, indicating a balanced approach between realizing profits and long-term asset accumulation. Increasing Bitcoin holdings is often viewed positively by investors as it ties the company’s value directly to the future performance of Bitcoin itself. It signifies confidence in the long-term prospects of the asset they are mining. What Does This Profitability Mean for Ionic Digital? The reported $9.8 million crypto profit is more than just a number; it’s an indicator of several positive aspects for Ionic Digital : Operational Efficiency: Achieving this level of profitability suggests efficient mining operations, managing electricity costs and hardware performance effectively. Market Timing: Selling a significant amount of BTC at an average price over $100,000 indicates successful execution of their sales strategy to leverage favorable market prices. The strong BTC price environment was clearly advantageous. Financial Health: A substantial profit improves the company’s financial standing, providing capital for expansion, debt reduction, or further investments in mining infrastructure. Investor Confidence: Strong financial results like these typically boost investor confidence in the company’s management and future prospects within the competitive Bitcoin mining company landscape. While the report highlights significant success, it’s also important to remember that the profitability of any Bitcoin mining company is intrinsically linked to the volatile nature of the BTC price and the increasing network difficulty. Managing these external factors remains a key challenge for all miners, including Ionic Digital . Key Takeaways from Ionic Digital’s May Report Looking at the figures, a few key points stand out: Strong Revenue Generation: Selling BTC at over $100k allowed for significant revenue and profit capture. Balanced Strategy: Ionic Digital appears to be balancing the need for immediate profitability through sales with a long-term growth strategy of increasing Bitcoin holdings . Positive Start to Q2 (assuming May is in Q2): These results suggest a strong performance quarter, contingent on sustained market conditions and operational efficiency. For those following the sector, Ionic Digital’s May performance provides a valuable data point on the potential for profitability in the current Bitcoin market, especially when the BTC price is strong. Conclusion: A Profitable Month for Ionic Digital In summary, Ionic Digital had a highly successful May 2025, reporting a notable $9.8 million crypto profit driven by strategic sales at a strong average BTC price . Coupled with a steady increase in their Bitcoin holdings , the report paints a promising picture for the company. As the Bitcoin mining company landscape continues to evolve, Ionic Digital’s ability to mine efficiently, sell strategically, and accumulate assets will be crucial for sustained success. To learn more about the latest Bitcoin mining trends, explore our article on key developments shaping Bitcoin price action and institutional adoption. This post Ionic Digital Reports Astounding $9.8M Crypto Profit and Growing Bitcoin Holdings first appeared on BitcoinWorld and is written by Editorial Team",bitcoinworld,https://bitcoinworld.co.in/ionic-digital-crypto-profit/,"BTC|BUSINESS|MARKET|MINING|TRADING","Crypto News|BITCOIN|CRYPTOCURRENCY|earnings|Finance|MINING",cryptocompare
2025-06-12T05:30:00,"GameStop Slides While Bitdeer Gains as Bitcoin Bets Take Center Stage","GameStop’s continued push into Bitcoin is drawing skepticism from investors as its stock price dropped more than 11% in after-hours trading following a $1.75 billion convertible note offering. The decline adds to the losses sustained since the company’s $513 million Bitcoin purchase in May. Meanwhile, Bitcoin miner Bitdeer posted a strong 18% increase in BTC production for the same month, supported by a rise in hashrate. GameStop Shares Tumble 11.7% After $1.75B Convertible Note Offering Hints at Further Bitcoin Moves GameStop shares plunged 11.66% in after-hours trading on Wednesday, extending a 5.31% decline during the regular session, following the company’s announcement of a $1.75 billion private offering of convertible senior notes due in 2032. The fresh financing plan adds to speculation that the gaming retailer may be preparing to buy even more Bitcoin after already deploying $513 million into the cryptocurrency last month. GME’s share price on June 11 (Source: Google Finance ) Although GameStop stopped short of confirming its intent to use the proceeds for additional Bitcoin purchases, it noted the funds would be allocated in line with its investment policy and could also support acquisitions. The vague language did little to calm jittery investors already reacting to the company’s disappointing Q1 revenue report from the day before. GameStop’s Bitcoin Bet and Mounting Debt On May 28, GameStop stunned markets by revealing that it had used a portion of its previously raised $1.5 billion to acquire 4,710 Bitcoin (BTC), becoming the 13th largest corporate Bitcoin holder globally, according to BitcoinTreasuries.NET. The investment, worth $513 million at the time of purchase, marked a radical pivot in the company’s strategy, aligning it with other high-profile Bitcoin treasurers like Strategy and Tesla. Top 13 public companies by Bitcoin holdings (Source: BitcoinTreasuries.NET ) Convertible senior notes — a hybrid financial instrument that combines features of debt and equity — have become a favored tool for companies betting big on Bitcoin. Like others before it, GameStop’s notes carry a 0% coupon and mature on June 15, 2032. The offering also includes an option for initial purchasers to acquire an additional $250 million in notes. Crucially, the notes can be converted into cash, GameStop shares, or a combination of both, leaving the door open for various capital restructuring options depending on how the company’s Bitcoin exposure and stock performance evolve. Market Reacts Poorly to Q1 Results and Bitcoin Strategy GameStop’s market performance hasn’t followed the script seen with other Bitcoin-buying firms. While Strategy and others saw stock surges after announcing their crypto plays, GME has trended in the opposite direction. Since confirming its Bitcoin acquisition on May 28, GameStop shares have dropped 18.5%, according to Google Finance. Wednesday’s sharp after-hours drop only exacerbates the trend, bringing the stock’s price back to levels not seen since March 25 — the day GameStop first revealed plans to invest in Bitcoin . Part of the negative momentum can also be attributed to the company’s Q1 earnings report, which showed a revenue decline of 17% year-over-year to $732.4 million, far short of analyst expectations. Despite posting a profit of $44.8 million for the quarter, reversing a $32.3 million loss from the same period last year, investors appeared more concerned with the top-line weakness and declining sales. Uncertainty Lingers as GameStop Straddles Gaming and Crypto GameStop’s pivot toward cryptocurrency appears to be part of a broader transformation strategy, but market participants remain divided on whether this gamble will ultimately pay off. The company has yet to make it clear how Bitcoin aligns with its core business of video games and consumer electronics, and its messaging around the use of convertible note proceeds remains opaque. The move also adds to the mounting debate over how much Bitcoin exposure is too much for public companies. With regulatory scrutiny of crypto still intensifying and Bitcoin’s price notoriously volatile, the risks of heavily Bitcoin-centric treasuries have become a growing concern among institutional investors. Nonetheless, GameStop's decision to raise funds via convertible notes mirrors the playbook of crypto-forward firms — suggesting it could be setting the stage for a larger crypto integration in the near future. Whether that includes doubling down on Bitcoin or venturing into blockchain-related acquisitions remains to be seen. Bitdeer’s Bitcoin Production Surges 18% in May as US Miners Regain Momentum Amid Market Headwinds Meanwhile, Bitdeer Technologies Group (BTDR) announced Wednesday that it mined 196 Bitcoin in May, marking an 18% increase from the 166 BTC it produced in April. The growth came as the company expanded its computational power to 13.6 exahash per second (EH/s) from 12.4 EH/s, thanks to the deployment of new mining equipment. The announcement from Bitdeer comes at a pivotal time for the crypto mining industry, which has faced mounting challenges in recent months, including reduced block rewards, volatile energy prices, and market stress sparked by macroeconomic policy shifts. Nevertheless, Bitdeer’s results align with broader signs of resilience across the mining sector, as several publicly traded miners posted similar gains for the month. Bitdeer’s May performance is part of a trend: according to data from Farside Investors, other major miners—CleanSpark, Marathon Digital Holdings (MARA), Riot Platforms, and HIVE Blockchain Technologies—also increased their monthly BTC production in May. These upticks follow a difficult stretch for the mining industry after Bitcoin’s quadrennial halving event in April, which slashed block rewards from 6.25 BTC to 3.215 BTC per block. The sharp cut, designed to reduce the rate of Bitcoin issuance, has made mining less profitable overnight, especially for operators with outdated hardware or expensive power contracts. To stay operational, many miners were forced to sell larger portions of their Bitcoin reserves, adding sell pressure to markets already reeling from geopolitical disruptions. In April, Bitcoin’s price fell below $75,000 after President Trump’s aggressive tariff announcements roiled global investor sentiment, compounding the pressure on miners. Record Bitcoin Prices Offer Relief Still, a surge in Bitcoin’s price during May—peaking at an all-time high of $111,814, per CoinGecko—has brought renewed optimism. The benchmark cryptocurrency has since pulled back slightly but remains within 3% of its record, offering a vital buffer for mining operations struggling with narrower margins post-halving. Bitdeer’s improved performance, backed by its increased hashpower, signals that larger and better-capitalized miners are positioning themselves to thrive despite a more competitive environment. The Bitcoin network’s mining difficulty—a measure of how hard it is to find a valid block—has continued to rise throughout 2024 and 2025, further squeezing smaller miners. As more powerful rigs enter the network and global competition heats up, the barrier to profitability grows. Despite this, the United States remains the largest contributor to the global hashrate, accounting for the majority of the Bitcoin network’s mining power. That dominance may be further cemented under President Donald Trump’s second-term pro-mining stance, with promises to “mint all future Bitcoin in America.” Trump’s policies, including proposed tax incentives for domestic miners and federal grants for energy infrastructure supporting mining operations, are aimed at securing the US lead in digital asset infrastructure. Outlook: Consolidation and Institutional Scale Industry experts suggest the current environment will likely accelerate consolidation, with firms like Bitdeer, CleanSpark, and Marathon positioned to acquire distressed mining assets and expand operations. As mining shifts from a retail-dominated industry to one ruled by institutional-scale players, the focus will increasingly fall on access to cheap power, cutting-edge ASIC hardware, and geopolitical favorability. For now, Bitdeer’s May production figures offer a snapshot of optimism in a space often defined by volatility.",coinpaper,https://coinpaper.com/9540/game-stop-slides-while-bitdeer-gains-as-bitcoin-bets-take-center-stage,"BTC|BUSINESS|MARKET|MINING|TRADING","News|Crypto",cryptocompare
2025-06-12T05:29:29,"Bitcoin at $200K by Year-End is Now Firmly in Play, Analyst Says After Muted U.S. Inflation Data","Bitcoin at $200K by Year-End is Now Firmly in Play, Analyst Says After Muted U.S. Inflation Data $BTC #Bitcoin",coinotag,https://en.coinotag.com/breakingnews/bitcoin-at-200k-by-year-end-is-now-firmly-in-play-analyst-says-after-muted-u-s-inflation-data/,"BTC","",cryptocompare
2025-06-12T05:28:19,"GameStop Plans $1.75B Debt Offering — More Bitcoin Buys on the Horizon?","Video game retailer GameStop has proposed a new $1.75 billion bond deal, hinting at its next big Bitcoin buy. The widely regarded meme stock announced the proposed private offering of convertible senior notes on Wednesday. The latest offering comes with 0% interest, with the convertible senior notes maturing in June 2032. Eligible only to qualified institutional buyers, it includes an option for purchasers to buy an additional $250 million in notes, within 13 days of the initial issuance. Buyers can convert the debt, which carries no regular interest, into cash or common stock under specific conditions, or a combination of both at GameStop’s election, the release noted. Funds to Fuel BTC Purchases The Texas-based company said that the proceeds from the offering would be used for general purposes. This includes “making investments in a manner consistent with GameStop’s Investment Policy and potential acquisitions.” GameStop mentioned in a March release that its board has approved “to add Bitcoin as a treasury reserve asset.” The firm already disclosed purchasing 4,710 Bitcoin between May 3, 2025 and June 10, 2025, signalling that Bitcoin will be a part of its Q2 balance sheet. @gamestop bought 4,710 Bitcoin in cash between May 3 and June 10, deepening its crypto pivot after board approval in March to adopt BTC as a treasury asset. #GameStop #BitcoinTreasury https://t.co/dmrmxkm7Ix — Cryptonews.com (@cryptonews) June 11, 2025 GameStop completed its initial convertible senior notes offering in April. With the $1.5 billion offering, the company had plans to use the proceeds in part to purchase BTC. Community Reacts to GameStop’s Offering, Shares Fell 11% GameStop’s opaque investment strategy has sparked contemplation among observers that it might evolve as a multi-faceted holding corporation. Tetron Invest wrote on X that the company is “transitioning” to be a holding company. “They’re going to hold more than just Bitcoin.” GameStop is transitioning to be a holding company, and they’re going to hold more than just Bitcoin. The new convertible offering strongly points to this, here’s why I think that’s the case pic.twitter.com/9bYOLArL1S — Tetron (@TetronInvest) June 11, 2025 While acquisitions remain the company’s priority, the lack of detailed capital allocation plans fuels theories about bitcoin diversification. Following the announcement to raise more debt, GameStop (GME) shares plummeted over 11% in the extended session Wednesday. GME shares have declined 18% since May 28, after the company confirmed its first Bitcoin buy. The trend contrasts with other firms that have shown a significant increase in their shares after announcing BTC acquisitions. The post GameStop Plans $1.75B Debt Offering — More Bitcoin Buys on the Horizon? appeared first on Cryptonews .",cryptonews,https://cryptonews.com/news/gamestop-plans-1-75b-debt-offering-more-bitcoin-buys-on-the-horizon/,"BTC|BUSINESS|FIAT|REGULATION","Bitcoin News|Bitcoin|GameStop",cryptocompare
2025-06-12T05:19:15,"Optimism (OP) Shows Short-Term Bullish Momentum Amid Key Resistance Near $0.74","Optimism (OP) has demonstrated a notable short-term rally, testing critical resistance levels amid cautious market optimism. Despite a 20% price increase since early June, the sustainability of OP’s upward momentum",coinotag,https://en.coinotag.com/optimism-op-shows-short-term-bullish-momentum-amid-key-resistance-near-0-74/,"BTC|MARKET|TRADING|OP","Bitcoin|News",cryptocompare
2025-06-12T05:15:39,"Crypto Market Faces Volatility as Key Players Make Influential Moves","Bitcoin's decline triggers broader market losses in altcoins like AVAX and ADA. G7 summit could resolve tariff issues, influencing market sentiment positively. Continue Reading: Crypto Market Faces Volatility as Key Players Make Influential Moves The post Crypto Market Faces Volatility as Key Players Make Influential Moves appeared first on COINTURK NEWS .",cointurken,https://en.coin-turk.com/crypto-market-faces-volatility-as-key-players-make-influential-moves/,"ADA|ALTCOIN|AVAX|BTC|MARKET","Cryptocurrency News",cryptocompare
2025-06-12T05:02:36,"Sweden’s H100 soars 45% in a day after raising $10M for Bitcoin treasury","H100 Group’s shares surged after the Swedish health firm announced it had raised $10.6 million to stack more Bitcoin.",cointelegraph,https://cointelegraph.com/news/swedens-h100-soars-45-percent-10-million-raise?utm_source=rss_feed&utm_medium=rss&utm_campaign=rss_partner_inbound,"BTC|REGULATION","",cryptocompare
