datetime,headline,summary,source,url,categories,tags,api_source
2025-06-12T03:10:20,"Bitcoin Caution Contrasts with Ethereum’s Leverage Surge","BitcoinWorld Bitcoin Caution Contrasts with Ethereum’s Leverage Surge The cryptocurrency market is a fascinating place, often characterized by rapid shifts and divergent trends. While Bitcoin (BTC) often sets the pace, recent data suggests a notable split in sentiment and activity, particularly when comparing the leading cryptocurrency to its closest competitor, Ethereum (ETH). Understanding this divergence is crucial for anyone navigating the current crypto market analysis . Unpacking the Cautious Bitcoin Sentiment Despite Bitcoin’s inherent strength and recent attempts to push higher, the mood among market participants appears surprisingly subdued. According to a recent research report from K33, there’s a clear undercurrent of caution surrounding BTC. This isn’t just a feeling; the data points to specific indicators: Negative Daily Funding Rates: On major exchanges like Binance, perpetual contract funding rates for BTC/USDT pairs have turned negative on a daily basis. Funding rates are periodic payments exchanged between traders holding long and short positions. Negative rates typically mean short position holders are paying long position holders, suggesting bearish sentiment or an expectation of prices falling. Low Weekly Funding Rates: Zooming out, the weekly funding rates paint a similar picture of muted enthusiasm. At just 1.3% annualized, this figure is significantly lower than what’s typically seen during periods of strong bullish momentum and high leverage demand for Bitcoin. As highlighted by reports, this combination of negative daily and low weekly funding rates signals investor skepticism and a notable lack of aggressive leverage being deployed on Bitcoin positions. Traders aren’t betting heavily on immediate upward price movements, preferring a more reserved stance. Why the Sudden Surge in Ethereum Leverage ? In stark contrast to Bitcoin’s cautious mood, Ethereum (ETH) is experiencing a significant uptick in derivatives market activity. Data indicates a clear surge in leverage demand for ETH. How do we know this? The key metric here is Open Interest (OI) in Ethereum’s derivatives markets. Open interest represents the total number of outstanding derivatives contracts (like futures or perpetuals) that have not been settled. An increase in open interest, particularly when accompanied by rising prices or stable funding rates (not plunging into negative territory like BTC), suggests new money and leverage are entering the market specifically for ETH. The growing OI in Ethereum derivatives points to traders becoming increasingly comfortable taking leveraged positions on ETH, anticipating potential price appreciation or capitalizing on other market dynamics related to the Ethereum ecosystem. This creates a fascinating dichotomy within the broader crypto market analysis . What Does This Divergence Mean for the Crypto Market Analysis ? The contrasting signals from Bitcoin and Ethereum are more than just interesting data points; they offer valuable insights into current market dynamics and potential future trends. Here are a few interpretations and implications: Rotation or Sector Focus: This could indicate a rotation of capital or attention away from Bitcoin’s immediate price action towards opportunities perceived within the Ethereum ecosystem or the broader altcoin market that often follows ETH’s lead. Ethereum-Specific Catalysts: The increased interest in ETH leverage might be driven by anticipation of specific Ethereum network developments, upgrades, or the ongoing appeal of staking yields and DeFi activity. Risk Appetite Indicator: While overall market sentiment might be cautious (as shown by BTC), the willingness to take leveraged bets on ETH suggests that risk appetite hasn’t vanished entirely, but is being selectively applied to assets perceived to have stronger near-term catalysts or growth potential. Potential for Volatility: A buildup of leverage, especially in a single asset like ETH, can increase market volatility. While it can fuel upward moves, it also creates the risk of cascading liquidations if the price moves unfavorably, potentially impacting the entire market. Diving Deeper: Understanding BTC Funding Rates and ETH Open Interest For traders and investors, keeping a close eye on metrics like funding rates and open interest is crucial for understanding market positioning and potential price movements. Let’s break them down further: BTC Funding Rates: Purpose: To keep the perpetual contract price anchored to the spot price. How it Works: If perpetual price > spot price, funding rate is positive, longs pay shorts. If perpetual price Current Signal: Negative daily and low weekly rates for BTC suggest perpetual price is trading at or below spot, indicating bearish or neutral sentiment and low demand for leveraged long positions. ETH Open Interest: Purpose: Measures the total number of active derivatives contracts. How it Works: OI increases when new contracts are opened, decreases when contracts are closed. Current Signal: Rising OI for ETH, especially if accompanied by stable or positive funding rates, indicates increasing participation and leverage in the market, often seen as a bullish sign if price is also moving up or sideways constructively. Comparing BTC funding rates and ETH open interest provides a nuanced view. It’s not simply that the whole market is cautious; rather, there’s a distinct difference in how traders are approaching these two major assets. Challenges and Opportunities This market structure presents both challenges and opportunities: Challenges: Uncertainty for Bitcoin: Low leverage and cautious sentiment could make it harder for Bitcoin to sustain significant upward moves without a strong catalyst. Risk in Ethereum Leverage: While rising OI can be bullish, high leverage increases the risk of sharp pullbacks and liquidations if market conditions change rapidly. Interpreting Signals: Disparate signals from BTC and ETH can make overall market direction harder to predict. Opportunities: Potential for ETH Momentum: The surge in leverage could fuel further upward price action for Ethereum if positive sentiment holds. Identifying Relative Strength: This divergence helps identify which parts of the market are currently attracting more speculative interest. Strategic Positioning: Understanding where leverage is concentrated allows traders to anticipate potential volatility points. Actionable Insights Given the current landscape, what should market participants consider? Risk Management: Be mindful of increased volatility, especially in ETH. Use stop-losses and manage position sizes carefully if trading with leverage. Diversification: Consider how this divergence fits into your overall portfolio strategy. Are you overexposed to one asset based on these contrasting signals? Monitor Key Metrics: Continue watching BTC funding rates and ETH open interest closely, alongside price action, for shifts in sentiment and positioning. Look for Catalysts: Pay attention to news and developments specific to both Bitcoin and Ethereum that could shift the current dynamics. Conclusion The current crypto market analysis reveals a compelling split: a cautious mood hanging over Bitcoin, reflected in negative and low funding rates, versus a clear surge in leverage demand and open interest for Ethereum. This divergence highlights that while broader market sentiment might be reserved, specific sectors or assets are attracting significant speculative interest. Understanding these underlying dynamics, particularly the signals from BTC funding rates and ETH open interest , is vital for navigating the opportunities and risks in today’s complex digital asset landscape. Whether this leads to a period of ETH outperformance or a eventual convergence of sentiment remains to be seen, but the current setup demands attention. To learn more about the latest crypto market analysis trends, explore our article on key developments shaping Bitcoin sentiment and Ethereum leverage in the market. This post Bitcoin Caution Contrasts with Ethereum’s Leverage Surge first appeared on BitcoinWorld and is written by Editorial Team",bitcoinworld,https://bitcoinworld.co.in/bitcoin-ethereum-leverage-surge/,"BTC|BUSINESS|ETH|MARKET|TRADING","Crypto News|BITCOIN|ETHEREUM|Funding Rates|Leverage|Market Analysis",cryptocompare
2025-06-12T03:00:04,"XRP Could Hit $73, Says Research Firm In Bullish Outlook","An extended technical review aired Tuesday on Sistine Research’s YouTube channel has placed XRP at the top of the current market hierarchy and mapped a price trajectory that—if historical analogues and present chart structure hold—could lift the token as high as $73 in a late-cycle blow-off. Speaking during the firm’s regular live-stream, analyst Forrest began by ranking assets that have rallied since the US election on 5 November 2024. “XRP is the number-one performing coin since the election, the strongest coin on my watch-list,” he said, displaying a four-hour relative-performance chart that compared crypto majors, select altcoins, metals and equities. The next-best performers—HBAR and XLM—were described as “beta” plays that historically accelerate only after XRP begins to trend. Can XRP Reach $73 This Cycle? Forrest’s thesis hinges on what he called a “seven-year flag and breakout” visible on XRP’s monthly time frame. The pattern comprises the long consolidation that followed the 2017 bull market and a second, five-month bull flag carved out this year. “Why would I not own a chart that looks like this?” he asked, noting the rarity of multi-cycle structures that break decisively to the upside without retracing the move. In his view, the next critical trigger sits above $3.00–3.30, where XRP’s prior all-time high was set in January 2018. Once breached, the analyst argues, momentum traders who “feel like they’ve missed it” will encounter a higher-time-frame market that is in fact just warming up: “Above three dollars I get even more bullish. The higher this goes, the more bullish it becomes—up to a point, of course.” Related Reading: XRP Eyes $2.50 Decision Zone As Macro Wave Structure Takes Shape Forrest offered a ladder of profit-taking zones: $7–10 — initial resistance where early longs may start trimming. $17–37 — an intermediate band calibrated from Fibonacci extensions and prior percentage moves. $73 — the “absolute” target, projected by measuring the full height of the 2017 breakout and extending it from the current flag’s pivot. He acknowledged that the $73 figure “sounds crazy” with XRP trading near $2.28 at the time of the stream but argued that similarly outsized moves materialised in past crypto supercycles. During the 2017 run, XRP advanced roughly 1,400% from its breakout flag; applying a comparable ratio to today’s structure yields Forrest’s upper bound. While the tone remained unambiguously bullish, the analyst did outline scenarios that would invalidate the thesis. A decisive breakdown below the present trading range—he cited the $1.80–1.90 area—could force a “round-trip” to the mid-$1 zone and delay the upward resolution. For now, however, he sees range-bound price action as constructive: “As long as we’re holding range, I’m not entertaining the deep retrace.” Related Reading: XRP Price: Analyst Says Expect Biblical Move Before Historic Crash – Here Are The Targets Forrest also distinguished between holding spot XRP—“a no-brainer”—and employing leverage, reminding viewers that structural targets are measured in months and that leveraged positions may not survive interim volatility. Sistine Research’s macro overlay remains resolutely pro-risk through the summer. The firm’s proprietary “Bitcoin Blueprint” identified the 7 June–21 June window as a historically bullish pocket. That seasonal tailwind, combined with the technical setup, underpins Forrest’s conviction that XRP will continue to outperform not only rival tokens but also traditional safe-haven assets such as gold and silver, which the firm nonetheless holds as portfolio hedges. Whether XRP can emulate its 2017 trajectory will depend on broader liquidity conditions, regulatory milestones in the ongoing SEC litigation, and the extent to which institutional flows diversify beyond Bitcoin and Ethereum. Yet the Sistine Research desk is positioned as though the heavy lifting is already under way: “It’s slowed down a little recently, but I expect this overall trend to continue.” At press time, XRP traded at $2.32. Featured image created with DALL.E, chart from TradingView.com",newsbtc,https://www.newsbtc.com/xrp-news/xrp-could-hit-73-research-firm-bullish-outlook/,"BTC|MARKET|TRADING|XRP|RESEARCH","XRP News|xrp|xrp news|XRP Price|XRP Price Analysis|XRP Price Prediction",cryptocompare
2025-06-12T02:40:28,"Shocking Trump Crypto News: Could Reconciliation with Elon Musk Ignite the Market?","BitcoinWorld Shocking Trump Crypto News: Could Reconciliation with Elon Musk Ignite the Market? The world of cryptocurrency is often swayed by unexpected forces, and few individuals command as much attention as former U.S. President Donald Trump and Tesla CEO Elon Musk. Recent reports suggesting a potential reconciliation between the two powerful figures have once again put the spotlight on how political and business heavyweights can influence the volatile digital asset landscape. The question on many minds is: what could a Trump Elon Musk reconciliation mean for the future direction of Bitcoin, Ethereum, and the broader altcoin market? Trump Crypto News: A Hint of Détente According to an account known for tracking economic news, Walter Bloomberg on X, former President Donald Trump responded to a direct question about reconciling with Elon Musk with a simple, yet telling, phrase: “I guess I could.” This brief statement, coming after a period of public disagreement and tension between the two, immediately sparked discussions across social media platforms and financial news outlets. While not a definitive commitment to patching things up, it represents a significant shift in tone compared to past exchanges. For those following the markets, especially the crypto market, any interaction or potential shift in the relationship between Trump and Musk is noteworthy. Both individuals possess immense platforms and their commentary, whether on politics, technology, or finance, has a proven track record of moving markets. This latest piece of Trump crypto news is no exception, prompting analysts to consider the potential ripple effects. The Trump-Musk Dynamic: A Tumultuous History The relationship between Donald Trump and Elon Musk hasn’t always been smooth sailing. At various times, they have appeared to be allies, with Musk even serving on Trump’s business advisory councils early in his presidency. However, disagreements, particularly around policy and political stances, led to a public falling out. Early Collaboration: Musk joined Trump’s advisory councils, suggesting a degree of alignment or at least a willingness to engage. Policy Clashes: Musk resigned from the councils following Trump’s decision to withdraw the U.S. from the Paris Agreement on climate change. Public Criticism: Both figures have publicly criticized each other at different points, adding to the perception of a strained relationship. Recent Shifts: Musk’s acquisition of Twitter (now X) and his stated commitment to free speech have led to some speculation about potential common ground with Trump, who was famously banned from the platform before being reinstated under Musk’s ownership. This history is important because it highlights the potential volatility of their interactions. A move towards reconciliation, even a tentative one, could signal a new phase where their public commentary might align more often, potentially amplifying their collective influence on various sectors, including technology, finance, and yes, cryptocurrency. Why Does Trump Elon Musk Reconciliation Matter for Crypto? Understanding why the potential mending of fences between Trump and Musk is relevant to cryptocurrency requires looking at the unique characteristics of the crypto market and the outsized influence certain figures can wield. The crypto market, compared to traditional financial markets, is often more susceptible to news, sentiment, and even individual commentary. This is due to several factors: Relative Immaturity: Despite its growth, crypto is still a relatively young asset class without the deep liquidity and established institutional structures of, say, the stock or bond markets. Retail Investor Dominance: A significant portion of the market is driven by retail investors who are often more reactive to news and social media trends. Narrative-Driven: Cryptocurrency valuations are heavily influenced by narratives around adoption, technology, regulation, and public perception. High Visibility Figures: Individuals like Elon Musk and, increasingly, political figures like Donald Trump, have massive online followings and their statements can quickly shape these narratives. Elon Musk, through his tweets and public statements, has famously influenced the price of Bitcoin and Dogecoin in the past. His company, Tesla, also made significant investments in Bitcoin, further cementing his connection to the crypto space in the eyes of investors. Similarly, while Donald Trump’s relationship with crypto has been more cautious or even critical at times, his recent foray into NFTs and his shifting public comments suggest a potential evolution in his stance. His political platform and potential future policies could have significant implications for crypto regulation and adoption in the United States. A reconciled Trump and Musk could potentially amplify each other’s messages, whether intentionally or not. If they were to find common ground on issues related to technology, finance, or even the future of digital assets, their combined voice could have a powerful effect on market sentiment and direction. This is the core reason why the possibility of a Trump Elon Musk reconciliation is considered significant news within the crypto community. Crypto Market Impact: Learning from Past Events The initial report mentioning Trump’s comment also noted that past tensions between the two had previously caused a “brief dip in the cryptocurrency market.” This serves as a tangible example of how their dynamic can translate into market movements. While the specific instance referenced might have been minor, it highlights a broader pattern. Negative commentary or public disagreements between influential figures associated with crypto can spook investors, leading to sell-offs. Conversely, positive remarks or perceived alignment could fuel rallies. Consider the following examples of how prominent figures have impacted crypto: Figure Action/Comment Crypto Impact (Example) Elon Musk Tweeting about Dogecoin Significant DOGE price surges Elon Musk Tesla accepting/suspending Bitcoin payments BTC price volatility Donald Trump Expressing skepticism about Bitcoin Minor negative sentiment shifts Various Negative regulatory comments Market-wide dips A potential Trump Elon Musk reconciliation, if it leads to more aligned or positive commentary on technology and innovation, could theoretically contribute to a more favorable narrative for the crypto market. It wouldn’t be the sole driver, but it could add to a confluence of factors influencing sentiment. Political Influence Crypto: A Growing Trend Beyond the specific Trump-Musk dynamic, the increasing intersection of political figures and the crypto world is a trend gaining momentum. As cryptocurrencies and blockchain technology become more mainstream, politicians are being forced to take stances, propose regulations, and sometimes, even engage directly with the technology (like issuing NFTs). The political influence crypto is not just about market commentary; it’s also about policy. Future regulations regarding stablecoins, exchanges, decentralized finance (DeFi), and taxation will significantly shape the environment for crypto investors and developers. Statements from potential future leaders or key political figures can offer glimpses into potential policy directions, which can, in turn, affect market confidence. The fact that a potential reconciliation between two non-crypto native figures like Trump and Musk is being discussed in the context of crypto market impact underscores just how intertwined these worlds are becoming. It highlights the need for crypto enthusiasts and investors to pay attention not just to technological developments and market charts, but also to the broader political and social landscape. What Actionable Insights Can Crypto Investors Take? Given the potential for news and commentary from influential figures to impact the market, how should a savvy crypto investor navigate this environment? Stay Informed, But Skeptical: Keep track of major news, including statements from figures like Trump and Musk, but critically evaluate their potential impact. Don’t make impulsive decisions based on a single tweet or quote. Focus on Fundamentals: While sentiment matters, the long-term value of a cryptocurrency ultimately depends on its underlying technology, use case, adoption rate, and development team. Don’t let short-term news distract from fundamental analysis. Diversify: Avoid putting all your eggs in one basket. Diversification can help mitigate risks associated with volatility driven by specific news events or individuals. Have a Strategy: Whether you are a long-term holder or a short-term trader, have a clear investment strategy based on your risk tolerance and financial goals. Stick to your plan rather than being swayed by every piece of news. Consider the Source: Evaluate the credibility and potential biases of the information source. Walter Bloomberg is known for reporting economic news, but the quote itself is a brief, non-committal statement. The possibility of a Trump Elon Musk reconciliation is an interesting piece of crypto market news, but it’s one data point among many. Understanding the *why* behind the potential impact – the influence of powerful figures and the sensitivity of the market – is more important than reacting solely to the headline. Conclusion: Watching the Dynamic Unfold Donald Trump’s comment about potentially reconciling with Elon Musk has added another layer of intrigue to the complex relationship between prominent figures and the cryptocurrency market. While it remains to be seen if a genuine reconciliation will occur, or what form it might take, the mere suggestion highlights the significant attention and potential influence these individuals command. The history of their interactions and their individual track records of impacting public discourse and financial markets make any shift in their dynamic relevant for those tracking crypto market news. As the world of digital assets continues to evolve, so too does the landscape of external factors that can affect it, including the fascinating and sometimes unpredictable realm of political influence crypto. Whether a Trump Elon Musk reconciliation leads to positive collaboration or further divergence, their actions and words will likely remain a topic of discussion and analysis within the cryptocurrency community. Investors should stay informed, but always approach such news with a critical eye, prioritizing sound investment principles over speculative reactions to headlines. To learn more about the latest crypto market trends, explore our article on key developments shaping crypto market price action. This post Shocking Trump Crypto News: Could Reconciliation with Elon Musk Ignite the Market? first appeared on BitcoinWorld and is written by Editorial Team",bitcoinworld,https://bitcoinworld.co.in/trump-crypto-elon-musk/,"BTC|BUSINESS|MARKET|TECHNOLOGY|TRADING","Crypto News|CRYPTOCURRENCY|Elon Musk|Market News|Politics|Trump",cryptocompare
2025-06-12T02:35:46,"Paul Tudor Jones Urges Caution as U.S. Faces Debt Crisis","Paul Tudor Jones highlights financial constraints and debt issues in the U.S. Jones suggests Bitcoin and gold as essential assets amid rising inflation. Continue Reading: Paul Tudor Jones Urges Caution as U.S. Faces Debt Crisis The post Paul Tudor Jones Urges Caution as U.S. Faces Debt Crisis appeared first on COINTURK NEWS .",cointurken,https://en.coin-turk.com/paul-tudor-jones-urges-caution-as-u-s-faces-debt-crisis/,"BTC|FIAT","Cryptocurrency News",cryptocompare
2025-06-12T02:34:32,"Nasdaq Filing for 21Shares SUI ETF Could Signal Growing Institutional Interest Amid SEC Review","Nasdaq’s recent filing for a spot SUI ETF marks a pivotal moment for the Sui blockchain, signaling growing institutional interest and potential mainstream adoption in the U.S. crypto market. This",coinotag,https://en.coinotag.com/nasdaq-filing-for-21shares-sui-etf-could-signal-growing-institutional-interest-amid-sec-review/,"BLOCKCHAIN|BTC|ETH|REGULATION|SUI","News|BTC|ETH|SUI",cryptocompare
2025-06-12T02:32:22,"BlackRock's Bitcoin ETF Breaks Into Top 20","The institutional adoption of Bitcoin is gaining speed as IBIT enters the top 20 ETFs",utoday,https://u.today/blackrocks-bitcoin-etf-breaks-into-top-20,"BTC","BlackRock",cryptocompare
