datetime,headline,summary,source,url,categories,tags,api_source
2025-06-20T22:30:20,"Bitcoin Bullish Divergence That Appeared Before The May ATH Has Returned Again","Bitcoin is currently hovering in a tightly compressed price range after failing multiple times to break above $110,000 earlier this month. The past few days have been characterized by the leading cryptocurrency trading around $105,000, with neither bulls nor bears taking control. Despite the overall consolidation, a subtle yet significant signal is starting to flash beneath the surface, particularly on the 4-hour chart, that might send Bitcoin to a new all-time high soon. Return Of Rare Divergence Pattern On Bitcoin’s 4H Chart Crypto analyst Luca (@CrypticTrades_) took to social media platform X to share a chart that highlights an important technical development on Bitcoin’s 4-hour timeframe: the return of a bullish divergence. This signal, which previously appeared in early April, preceded the massive rally that catapulted Bitcoin to its May 22 all-time high of $111,800. The same divergence is forming once again and another Bitcoin price breakout may be very close. Related Reading: Why The Bitcoin Price Could See Another 70%-170% Jump From Here As shown in the 4-hour candlestick timeframe chart below, the divergence is clearly illustrated between price action and the Relative Strength Index (RSI). Price has been forming lower lows, while the RSI has been printing higher lows. This mismatch serves as an early indicator that selling momentum is fading, and a reversal to the upside could follow. The previous instance of this pattern directly preceded a sharp move from a $74,000 low in early April to above $111,000 in just a few weeks. What Does This Divergence Mean For Bitcoin’s Price? Bullish divergences on mid-timeframe charts like the 4-hour have a reputation for being the first reversal signals when supported by rising volume. In Bitcoin’s current case, the appearance of this pattern again could mean that the recent retracement from $111,800 has run its course. With RSI now trending upward even as price presses slightly lower, Bitcoin may be witnessing another hidden accumulation phase before its next leg higher. Related Reading: Bitcoin Price Trend Above $100,000: The Good News And The Bad News If the pattern holds true to its previous performance in April, the leading cryptocurrency could be setting up for another push toward new all-time high levels. Bitcoin is currently not far off from a new all-time high, as it is only about 5.5% away from its price peak. Based on this, another strong breakout could easily aim beyond the previous $111,800 high. Although Bitcoin’s price is relatively stagnant for now, the presence of this bullish divergence is a reminder of how quickly things can change. The previous bullish divergence ended up with a 50% price surge. A similar performance from the current price level would translate to another target above $160,000. At the time of writing, Bitcoin is trading at $105,700, up by 1.4% in the past 24 hours, already showing signs of the bullish divergence signal coming into action. Featured image from Getty Images, chart from Tradingview.com",newsbtc,https://www.newsbtc.com/news/bitcoin/bitcoin-bullish-divergence/,"BTC|MARKET|SPONSORED|TRADING","Bitcoin|bitcoin|Bitcoin news|bitcoin price|btc|BTC news|btc price|btcusd|BTCUSDT|Luca|Relative Strength Index|RSI",cryptocompare
2025-06-20T22:00:17,"ChatGPT’s 42-Signal AI ETH Price Forecast Suggests Consolidation with Breakout Potential","ChatGPT’s o3 Pro AI model digested 42 live indicators and yielded a focused Ethereum price forecast as ETH hovers near $2,419.57 amid short-term consolidation and longer-term bullish cues. With the RSI near 43 and MACD showing bearish momentum, Ethereum trades between immediate support around $2,485 and resistance near $2,557 . Volume remains moderate at roughly $20.15 billion daily. Source: Cryptonews After oscillating in a $2,480 – $2,547 range today, longer-term EMAs indicate underlying strength as the price sits above the 50, 100, and 200-day EMAs yet below the 20-day EMA. The following analysis was conducted using one of ChatGPT’s AI models, the new o3 pro. The predictions were then reanalyzed and edited together for enhanced readability while maintaining analytical precision. Technical Pulse: Neutral Consolidation Amid Longer-Term Strength Ethereum’s daily chart on Binance reveals a market in a holding pattern. As of June 20, 2025 , ETH trades around $2,432.47 , having opened near $2,523 and swung between a high of $2,547.5 and a low of $2,368.68 . This tight band reflects short-term consolidation after prior moves, with RSI at 43.12 hovering just below neutral and MACD displaying a negative histogram around 45.35 , indicating mild bearish momentum without decisive breakdown. Volatility remains moderate, with daily price swings staying within roughly $180 – $201 , consistent with ATR levels implied by today’s high-low range. Source: Cryptonews Moving averages convey a mixed but overall bullish medium-term structure. The 20-day EMA sits slightly above the price at $2,557 , suggesting short-term resistance and consolidation pressure. In contrast, the 50-day EMA at $2,438 , the 100-day EMA near $2,372 , and the 200-day EMA around $2,476 lie below the current price, indicating that on medium and longer timeframes, the trend retains a bullish orientation. Source: TradingView Price holding above those EMAs argues that dips near $2,438–$2,485 could attract buyers defending the uptrend, while reclaiming the 20-day EMA would signal a resumption of upward momentum toward higher resistance zones. Volume remains moderate at approximately 204,000 ETH traded daily, reflecting steady institutional and retail participation but not yet a surge. Trading within the $2,485–$2,547 range shows a balanced tug-of-war, with sellers cap rallies near the 20-day EMA, while buyers step in near the 50-day EMA or intraday lows. This kind of balance often sets up a breakout once a catalyst appears. For now, the short-term mood is neutral to slightly bearish, yet the broader medium-term uptrend means any drop below immediate support will likely be brief and shallow. Any successful reclaiming of the 20-day EMA could quickly attract momentum traders. Support & Resistance: Defining the Key Zones Immediate support emerges at today’s low around $2,485 . Should that level fail on heavier volume, the next anchor lies near the 50-day EMA ( ~$2,438 ), a zone where buyers may re-enter if the broader uptrend remains intact. Source: TradingView Beneath that, psychological and structural support around $2,400 coincides with a stop-loss region that many traders reference, but a sustained break below the 50-day EMA would shift focus toward deeper corrective territory closer to major support zones around $1,800–$1,900 , though such a move would likely require major negative catalysts given Ethereum’s longer-term strength. On the upside, immediate resistance resides at the 20-day EMA near $2,557 , a hurdle that price has struggled to clear. Beyond this, today’s high at $2,547 marks the short-term ceiling; clearing that area convincingly on strong volume could open a path toward the next major resistance zone between $2,700 and $2,800 , where prior swing highs reside. Above that, strong resistance lies in the $3,200–$3,400 range, levels reached in previous bullish runs but requiring robust catalysts and sustained bullish conviction to revisit. Within the current consolidation, the interplay between support near $2,438–$2,485 and resistance near $2,557 shapes trading dynamics. Traders watching daily closes above $2,557 look for confirmation of renewed upside, while breaches below $2,485 , especially with volume pickup, indicate potential deeper tests of the 50-day EMA. Given moderate volatility, breakout or breakdown beyond these pivot points could occur quickly once momentum shifts, with daily ranges of roughly $60–$70 broadening if ATR expands. Liquidity & Market Depth: Assessing Fuel for Moves Ethereum’s market cap is around $293.41 billion , and daily trading volume exceeds $21.91 billion , which shows deep liquidity across major venues. Binance order-book depth typically absorbs sizable orders with manageable slippage, a necessary condition for sizable moves when volume surges. Institutional participation appears average, with stablecoin flows and on-chain activity reflecting continued usage. Order-book clusters often form around support zones near $2,480–$2,500 , offering a buffer against light sell-offs, while resting asks near $2,550–$2,580 can absorb minor rallies until a catalyst drives stronger buying. Monitoring volume-weighted moving averages in tandem with order-book snapshots can reveal subtle accumulation. If volume-weighted metrics trend upward while price lingers below the 20-day EMA, selective accumulation may be underway despite short-term consolidation. Given deep liquidity, a meaningful breakout above $2,557 would likely require noticeable volume expansion, indicating a shift in conviction. Conversely, a breach of $2,485 supported by higher sell volume could lead to a swift move toward the 50-day EMA at $2,438 . On-Chain Insights: Usage Trends and Network Health Ethereum’s on-chain metrics continue to illustrate robust ecosystem engagement. Source: Etherscan Active address counts and transaction volumes across layer-1 and layer-2 networks reflect ongoing usage. Nearly 1% of circulating ETH is held as a reserve asset on layer-2 networks, while whales are accumulating at rates unseen since 2017 . These behaviors suggest a demand baseline beyond mere speculation, as participants lock up ETH for staking, layer-2 activity, DeFi participation, and reserve strategies. Statements from Ethereum co-founders emphasize Ethereum’s vision as a “master ledger for the world,” underpinned by layer-2 expansion and ecosystem growth. Ethereum Layer 1 will be the master ledger for the . Permissionless to inspect, use and add data or functionality to. Credibly neutral. Censorship resistant. Tamper resistant and tamper evident (via slashing and transparency). Incessantly progressively decentralizing… https://t.co/jMaHHpK2na — Joseph Lubin (@ethereumJoseph) June 19, 2025 Rising stablecoin supply on Ethereum and surges in layer-2 usage indicate that transaction demand may persist or increase, supporting fee-related demand for ETH. At the same time, staking yields and burning mechanisms under EIP-1559 continue to reduce net supply , providing a deflationary tilt that underlies longer-term bullish narratives. However, token unlock schedules or large whale movements warrant attention, as large accumulation by whales can bolster price floors if buying outpaces selling. Yet, any large-scale sell-offs could stress support zones. Overall, on-chain metrics point to a healthy network with sustained usage and structural supply factors that favor longer-term strength, even as short-term price consolidates. Social Sentiment: Gauging Community and Market Mood LunarCrush data for Ethereum reveals a broadly constructive but cautious sentiment environment. A Galaxy Score around 41 suggests a mildly bullish bias, while an AltRank near 380 indicates high engagement relative to other assets. Engagement metrics totaled billions of interactions, and mentions remain elevated in the tens of thousands, with creators numbering nearly 37,570 voices shaping narratives. Sentiment sits around 83% positive or neutral-positive, indicating prevailing optimism tempered by awareness of broader market uncertainty. Social dominance near 13.35% indicates Ethereum’s outsized share of crypto chatter, meaning major news or shifts can drive swift sentiment swings. THE $ETH SETUP IS IDENTICAL TO $BTC IN 2020 Same structure. Same retrace. Same disbelief. Bitcoin went 11x. If Ethereum does the same… you know the number. pic.twitter.com/isvpngSw4K — Merlijn The Trader (@MerlijnTrader) June 19, 2025 Recent commentary points out themes such as Ethereum’s evolving role as layer-1 backbone, strong technical setups compared to historical BTC patterns, and potential breakout scenarios following consolidation in the $2,170–$2,480 zone. In sum, social sentiment reflects confidence in Ethereum’s fundamentals and network potential, but traders remain watchful for confirmation cues. Macro & Ecosystem Catalysts: Potential Triggers Ethereum’s price trajectory will hinge on a mix of ecosystem developments and broader market forces over the coming months. Major catalysts include progress on layer-2 rollouts, prominent DeFi or additional stablecoins launches driving transaction spikes, and announcements around protocol upgrades that enhance scalability or interoperability. Stablecoin supply on $ETH is skyrocketing! pic.twitter.com/uh3TOLv5zn — Crypto Rover (@rovercrc) June 19, 2025 Broader crypto sentiment, influenced by macro liquidity conditions, regulatory clarity around digital assets, and institutional adoption (e.g., ETFs, corporate treasury allocations), also heavily affects Ethereum’s outlook. Given its central role in decentralized finance, geopolitical events influencing risk appetite may also prompt rotations away from or back into Ethereum. Ecosystem dynamics, such as shifts in gas fee economics or competition from other layer-1s, factor into longer-term narratives but are less likely to drive abrupt short-term moves unless tied to concrete network performance data or notable project launches. Three-Month ETH Price Forecast Scenarios Over the next 90 days, Ethereum’s price will likely follow one of three broad paths, shaped by the interplay between technical conditions, on-chain trends, social mood, and macro catalysts. Range-Bound Consolidation (Base Case) In the absence of a decisive catalyst, ETH may trade within approximately $2,400–$2,600. Short-term momentum remains neutral-to-slightly bearish below the 20-day EMA, but medium-term trend stays bullish as price holds above the 50-, 100-, and 200-day EMAs. On-chain usage continues steadily, and social sentiment retains modest optimism without euphoria. Source: TradingView Volume and volatility remain moderate, yielding choppy swings that savvy traders can exploit between support near $2,365–$2,461 and resistance near $2,557–$2,600. Longer-term holders may await clearer directional signals before adding exposure. Bullish Breakout Toward $3,000+ (Bull Case) A convergence of positive factors, such as a sustained surge in layer-2 activity, a major upgrade announcement, or a broad crypto rally fueled by macro liquidity or ETF news, could lift ETH above the 20-day EMA near $2,557. Confirmation requires robust volume expansion pushing price through $2,600 and toward the $2,700–$2,800 zone, where prior resistance resides. On-chain metrics would need to register spikes in transaction volume or staking inflows, while social sentiment (Galaxy Score rising above 60 , engagement uptick) reinforces confidence. Source: TradingView Upon clearing $2,800 , the path to $3,000 and beyond becomes feasible, potentially revisiting multi-month highs if market conditions remain constructive. Traders should manage risk with trailing stops and watch for profit-taking near key resistance zones to guard against sharp pullbacks. Deeper Correction Toward $2,200–$2,300 (Bear Case) Should negative catalysts emerge, such as disappointing ecosystem news, regulatory headwinds, or broader risk-off driving crypto-wide declines, ETH could breach near-term support around $2,485 and test the 50-day EMA near $2,438. Confirmation of deeper weakness would involve volume-backed breakdown below $2,438 , accompanied by RSI falling below 45 and MACD deepening negative. Source: TradingView On-chain signs might show slowed transaction growth or unwind of staking positions, while social sentiment shifts toward caution or fear. In this scenario, the price may retest zones at around $2,300–$2,200 , reflecting deeper consolidation territories. A breach below those could invite further selling pressure toward $2,000 or lower. However, given Ethereum’s structural strength, such moves would likely be met with increased buying interest at perceived value levels. Risk management via stop-loss placement and hedging strategies becomes paramount. ETH Price Forecast: Balancing Technicals, On-Chain Health, and Sentiment Ethereum’s current consolidation reflects a market balancing short-term caution against medium-term bullish undercurrents. Price wedged between roughly $2,485 support and $2,557 resistance underlines a waiting game: will on-chain usage or macro-driven optimism tip momentum upward, or will external headwinds trigger a test of deeper support? Participants should treat each swing as a diagnostic: does price hold near $2,485 on steady or rising transaction volumes? Does reclaiming the 20-day EMA coincide with an uptick in layer-2 activity or a surge in staking inflows? Conversely, does a breach of $2,438 align with waning on-chain metrics or broader crypto weakness? Breakout or Consolidation? Ethereum’s current range between roughly $2,485 support and $2,557 resistance reflects a market where short-term momentum leans neutral to slightly bearish under the 20-day EMA. Yet, the medium-term structure remains bullish as the price is above 50, 100, and 200-day EMAs. Over the next 90 days, the interplay of on-chain usage trends, social sentiment shifts, ecosystem milestones, and macro dynamics will determine whether ETH breaks higher toward $3,000+ or undergoes a deeper correction toward $2,200–$2,300. Traders should watch for daily closes above $2,557 to validate bullish continuation or breakdowns below $2,485–$2,438 to signal caution. At the same time, watching layer-2 activity, staking trends, user engagement, and wider market indicators can either back up or challenge recent price action. The post ChatGPT’s 42-Signal AI ETH Price Forecast Suggests Consolidation with Breakout Potential appeared first on Cryptonews .",cryptonews,https://cryptonews.com/news/chatgpts-42-signal-ai-eth-price-forecast-suggests-consolidation-with-breakout-potential/,"BTC|ETH|MARKET|TRADING|FORKS","Price Analysis|ETH|Ethereum",cryptocompare
2025-06-20T21:55:12,"Former Celsius CEO Alex Mashinsky waive rights to bankruptcy distributions from the defunct firm","Former Celsius CEO Alex Mashinsky and three related entities waived rights to bankruptcy distributions from the defunct crypto lender. The waiver cemented Mashinsky’s position as the party responsible for the collapse of Celsius. It also distanced him from making amends to the victims who lost funds. The agreement filed on Monday in the U.S. Bankruptcy Court for the Southern District of New York prohibited Mashinsky, AM Ventures Holdings Inc., Koala1 LLC, and Koala3 LLC from receiving any bankruptcy proceeds. The court document stipulated that all of Mashinsky’s claims submitted or scheduled on his behalf be “withdrawn, disallowed, and shall receive no distribution” under the bankruptcy plan. Mashinsky and the entities related to him were permanently barred from receiving any recovery in the Celsius bankruptcy, allowing those reserved assets to be redistributed to other creditors. However, even as Mashinsky claimed to have agreed to forfeit the assets that the government traced directly to the proceeds of his crimes, his wife asserted that she had a superior claim to the property. Her assertions would reduce what the government seized and returned to Mashinsky’s victims if credited. Attorney Clayton says America’s investors deserve better U.S. attorney for the Southern District of New York, Jay Clayton, said the Celsius founder targeted retail investors with false promises, used their funds to place risky bets, and profited tens of millions of dollars (~$48M). At the same time, his customers lost billions (~$4.7B). Crypto influencer Tiffany Fong lost 3.1 BTC and 11.6 ETH to Celsius (over $300K at today’s prices). However, Clayton believes that America’s investors deserve better. The waiver agreement, therefore, stipulated that since the court had disallowed claims from Mashinsky and related parties, all the money and assets (crypto and company shares) that were being held for them could be released for distribution to other creditors who were owed under the bankruptcy payout plan. Mashinsky was ordered by the bankruptcy court to pay a $50K fine and forfeit $48.3 million. However, despite this specific ruling, the order clarified that it did not affect other claims, counterclaims, or defenses that the Plaintiffs, Mashinsky, AMV, Koala1, and Koala3 might have in other legal proceedings, whether in the main case or other lawsuits. Celsius has made progress in returning value to affected users, distributing over $2.5 billion to more than 251K creditors as of August 2024. However, despite the progress, reports indicated that over $1 billion in claims from ~121K creditors were filed this year alone, highlighting the scale of the liabilities Celsius faced and the number of individuals and entities impacted. Clayton also pointed out that validating and categorizing claims remained a monumental task. Mashinsky admits to giving Celsius customers ‘false comfort’ In court, Mashinsky admitted to giving Celsius customers “false comfort” by giving an interview in 2021 in which he said Celsius had received approval from regulators for its “Earn” program, which it had not. Federal prosecutors in Manhattan also said the former CEO misled Celsius’ customers to persuade them to invest, and artificially inflated the value of his company’s proprietary crypto token. He also failed to disclose that he had been selling his CEL holdings. However, Mashinsky owned up to his wrongdoings and vowed to do whatever it took to atone for his mistakes. Attorney Clayton claimed that Mashinsky marketed Celsius as the safest place for crypto, and encouraged customers to “unbank” themselves by transferring crypto assets to the platform. He repeatedly misrepresented key aspects of Celsius’s business and finances throughout his tenure to attract customers and retain their assets. His false claims covered the safety of Celsius’s yield-generating activities, its profitability, the sustainability of high reward rates, and the risks associated with depositing crypto assets on the platform. Mashinsky and others orchestrated a years-long scheme to mislead customers about the CEL token. They manipulated CEL’s price by spending hundreds of millions purchasing it on the open market to artificially inflate its value. They sometimes used customer deposits to fund these market purchases, without disclosing that to customers. Cryptopolitan Academy: Want to grow your money in 2025? Learn how to do it with DeFi in our upcoming webclass. Save Your Spot",cryptopolitan,https://www.cryptopolitan.com/ex-celsius-boss-waives-bankruptcy-claims/,"BTC|BUSINESS|ETH|MARKET|MINING","News|BTC|CEL|Celsius|ETH",cryptocompare
2025-06-20T21:27:49,"Bitcoin Price Dips Below $104,000 Amid Market Volatility and Regulatory Concerns","Bitcoin’s recent price drop below the critical $104,000 threshold signals renewed volatility in the cryptocurrency market, prompting investor caution. This decline reflects a complex interplay of macroeconomic pressures, regulatory concerns,",coinotag,https://en.coinotag.com/bitcoin-price-dips-below-104000-amid-market-volatility-and-regulatory-concerns/,"BTC|BUSINESS|MARKET|TRADING","Analysis|News|BTC",cryptocompare
2025-06-20T21:26:01,"Will Altcoin Seasons Thrive This Summer? Get the Insights","Bitcoin and altcoins show stagnation with no significant summer surge expected. Institutional involvement and changing individual strategies are altering market dynamics. Continue Reading: Will Altcoin Seasons Thrive This Summer? Get the Insights The post Will Altcoin Seasons Thrive This Summer? Get the Insights appeared first on COINTURK NEWS .",cointurken,https://en.coin-turk.com/will-altcoin-seasons-thrive-this-summer-get-the-insights/,"ALTCOIN|BTC|MARKET","Altcoin News",cryptocompare
2025-06-20T21:20:49,"Circle Shares Surge on Stablecoin Optimism While Bitcoin Treasury Firms Face Market Valuation Uncertainties","Circle’s stock soars amid stablecoin regulatory optimism, signaling strong market confidence in the future of digital currencies. Meanwhile, Bitcoin treasury firms face valuation challenges, highlighting the complexities of crypto asset",coinotag,https://en.coinotag.com/circle-shares-surge-on-stablecoin-optimism-while-bitcoin-treasury-firms-face-market-valuation-uncertainties/,"BTC|BUSINESS|MARKET|REGULATION","News|BTC",cryptocompare
2025-06-20T21:13:45,"Nakamoto Holdings Raises $51.5 Million to Potentially Expand Bitcoin Treasury Amid Corporate Adoption Trends","Nakamoto Holdings, a Bitcoin holdings company led by crypto entrepreneur David Bailey, has successfully closed a $51.5 million private equity fundraise through its merger partner KindlyMD. This capital injection is",coinotag,https://en.coinotag.com/nakamoto-holdings-raises-51-5-million-to-potentially-expand-bitcoin-treasury-amid-corporate-adoption-trends/,"BTC|REGULATION","News|BTC",cryptocompare
2025-06-20T21:09:33,"Nakamoto Holdings Rakes in $51.5 Million for Publicly Traded Bitcoin Treasury","The Bitcoin holdings company's merger partner KindlyMD closed the $51.5 million fundraise with private investors on Friday.",decrypt,https://decrypt.co/326316/nakamoto-holdings-51-5-million-publicly-traded-bitcoin-treasury,"BTC|BUSINESS|REGULATION","Business",cryptocompare
