datetime,headline,summary,source,url,categories,tags,api_source
2025-06-21T03:58:54,"Semler Scientific Unveils Plan to Accumulate 105,000 BTC by 2027","Nasdaq-listed healthcare technology company, Semler Scientific, has outlined a bold multi-year plan to significantly expand its Bitcoin holdings. The company aims to hold 10,000 BTC by the end of 2025 as an initial milestone. Building on this, it plans to increase its holdings to 42,000 BTC by the end of 2026. By the close of 2027, Semler intends to reach a total of 105,000 BTC. Semler Reports 287% Bitcoin Yield to Date According to the official press release, the company said it will fund these purchases using a mix of equity and debt financing, as well as operational cash flows. Semler, which in May 2024 became the second US public company to adopt Bitcoin as its primary treasury reserve asset, has since emerged as a significant corporate Bitcoin holder. As of June 3, 2025, the firm reported a 287% yield on its Bitcoin investment and a $177 million unrealized gain. In a move to strengthen its new approach, Semler has appointed Joe Burnett as Director of Bitcoin Strategy. Burnett, formerly Director of Market Research at Unchained, brings more than seven years of experience in Bitcoin advocacy and research. In a statement, Eric Semler, chairman of Semler Scientific, said, “We are excited to have Joe join our Bitcoin strategy team and help drive our three-year-plan to own 105,000 Bitcoins. Joe is an analytical thought leader on Bitcoin and Bitcoin treasury companies. His expertise will be instrumental as we pursue our Bitcoin treasury strategy and aim to deliver long-term value to our stockholders.” Corporate Bitcoin Holdings Grow An increasing number of public companies are deepening their involvement with the largest cryptocurrency. For instance, Genius Group, an AI-driven education company, recently increased its corporate Bitcoin reserves from 66 BTC to 100 BTC, after acquiring an additional 34 BTC valued at approximately $3.42 million. The company resumed its Bitcoin purchases on May 22, following a May 6 US Court of Appeals ruling that lifted previous legal restrictions stemming from a dispute related to its merger with FatBrain AI. CEO Roger Hamilton described reaching 100 BTC as a milestone in their broader plan to accumulate 1,000 BTC. Earlier this month, New York-based Mercurity Fintech Holding announced it would raise $800 million to build a Bitcoin treasury reserve. The company plans to integrate staking and tokenized finance tools, using secure blockchain custody infrastructure to reshape its treasury operations and boost capital efficiency through yield generation. The post Semler Scientific Unveils Plan to Accumulate 105,000 BTC by 2027 appeared first on CryptoPotato .",cryptopotato,https://cryptopotato.com/semler-scientific-unveils-plan-to-accumulate-105000-btc-by-2027/,"BTC|FIAT|REGULATION|SPONSORED|RESEARCH","AA News|BTCEUR|BTCGBP|BTCUSD|BTCUSDT|Crypto News|Bitcoin (BTC) Price|Bitcoin Adoption",cryptocompare
2025-06-21T03:48:43,"Bitcoin Spot ETF Sees $6.4 Million Net Inflow Amid IBIT and FBTC Divergence","On June 21, Farside Investors reported significant movements in the US Bitcoin spot ETF market. The overall net inflow reached $6.4 million, highlighting sustained investor interest in cryptocurrency assets. Specifically,",coinotag,https://en.coinotag.com/breakingnews/bitcoin-spot-etf-sees-6-4-million-net-inflow-amid-ibit-and-fbtc-divergence/,"BTC|BUSINESS|MARKET","BTC",cryptocompare
2025-06-21T03:36:47,"Bitcoin Futures Premium Hits Three-Month Low Amid Rising ETF Inflows, Suggesting Mixed Investor Sentiment","Bitcoin futures premiums have fallen to a three-month low despite strong inflows into Bitcoin exchange-traded funds (ETFs), revealing contrasting investor behaviors in the crypto market. This divergence underscores a nuanced",coinotag,https://en.coinotag.com/bitcoin-futures-premium-hits-three-month-low-amid-rising-etf-inflows-suggesting-mixed-investor-sentiment/,"BTC|BUSINESS|MARKET","News",cryptocompare
2025-06-21T03:30:45,"Semler Scientific Unveils 105K Bitcoin Ambition, Pushing Boundaries of Treasury Strategy","Semler Scientific ignites a bold bitcoin accumulation plan targeting 105,000 BTC by 2027, signaling unstoppable conviction in bitcoin’s global monetary revolution. Bitcoin Dominance Play: Semler Scientific Unleashes 105K BTC Target With Aggressive Financing Healthcare technology firm Semler Scientific (Nasdaq: SMLR) announced on June 19 its ambitious objectives to dramatically expand its bitcoin treasury holdings and",bitcoin.com,https://news.bitcoin.com/semler-scientific-unveils-105k-bitcoin-ambition-pushing-boundaries-of-treasury-strategy/,"BTC|REGULATION|SPONSORED|TECHNOLOGY|TRADING","Featured|Bitcoin (BTC)|Bullish",cryptocompare
2025-06-21T03:30:19,"Bitcoin May Surprise Bears: $100K–$110K Range Shows Rising Short Interest","While Bitcoin (BTC) has remained range-bound – trading between $100,000 and $110,000 for about a month – both short and long positions have been building within this range, with short positions rising at a faster pace. Bitcoin Long Positions Slightly Ahead But Shorts Catching Up After reaching a new all-time high (ATH) of $111,814 last month, BTC has consolidated within the $100,000–$110,000 range for nearly a month, offering little clarity on its next directional move. Related Reading: Bitcoin Holds Strong Despite Israel-Iran Tensions – Weekly Resistance Begins To Crack According to a new CryptoQuant Quicktake post by contributor BorisVest, fresh data from Binance crypto exchange suggests that long positions currently hold a slight edge in this range. Historical data reveals a pattern – when short positions rise, short squeezes tend to follow. Similarly, a buildup in long positions has often led to long squeezes. A decisive breakout from either end of the current range will likely determine Bitcoin’s next major move. That said, Binance data indicates that while long positions are marginally ahead, the ratio of longs to shorts remains relatively balanced. The funding rate hovering near neutral levels supports this view, reflecting a closely contested standoff between bulls and bears. However, such balance usually signals uncertainty in the market. While long interest has stabilized, short positions continue to climb – likely driven by expectations of further downside amid escalating geopolitical tensions in the Middle East. BorisVest noted: This shows that most market participants believe the rally may not continue. When Bitcoin’s price starts to fall, and funding rates turn negative, it means shorts are piling in quickly. All of this points to this range being a highly sensitive zone. He further noted that with most traders leaning toward short positions, the setup could be ripe for a surprise move in the opposite direction – possibly fuelled by quiet accumulation from larger market participants. Is BTC Preparing For A Big Move? Despite BTC trading within the $100,000 – $110,000 range for the better part of the previous month, several analysts posit that the flagship cryptocurrency is preparing for a major move in the coming weeks. Related Reading: Bitcoin Consolidates as Realized Profits Stay Low – No Signs Of Major Sell-Off Yet Most analysts are leaning toward a move to the upside. For instance, crypto trader Josh Olszewics remarked that if liquidity holds, then BTC may eye a move toward the $150,000 level. From a technical standpoint, the outlook is encouraging. Crypto analyst Mister Crypto recently pointed out that BTC is forming a bullish inverse head & shoulders pattern on the 3-day chart. However, latest on-chain data shows that Bitcoin Network Value to Transactions (NVT) Golden Cross recently moved into an overpriced zone, warranting caution. At press time, BTC trades at $105,940, up 1.1% in the past 24 hours. Featured image from Unsplash, charts from CryptoQuant and TradingView.com",newsbtc,https://www.newsbtc.com/bitcoin-news/bitcoin-may-surprise-bears-100k-110k-range-shows-rising-short-interest/,"BTC|EXCHANGE|MARKET|TRADING|BNB","Bitcoin News|Binance|bitcoin|Bitcoin bears|bitcoin bulls|Bitcoin Long Positions|btc|BTCUSDT|crypto exchange data|cryptocurrency|on-chain analysis|technical analysis",cryptocompare
2025-06-21T03:15:55,"Bitcoin Regulation Discussions During Trump Era Highlight Financial Sector Skepticism and Future Policy Considerations","Wallace Turbeville, former Goldman Sachs executive, sheds light on the Trump administration’s cautious approach to cryptocurrency regulation during pivotal hedge fund negotiations. These discussions reveal the financial sector’s skepticism toward",coinotag,https://en.coinotag.com/bitcoin-regulation-discussions-during-trump-era-highlight-financial-sector-skepticism-and-future-policy-considerations/,"BTC|ETH|REGULATION","News|BTC|ETH",cryptocompare
2025-06-21T03:00:33,"Thailand Eyes Bold Crypto Overhaul: Exchanges May Soon List Their Own Tokens","Thailand’s financial regulators are seeking public feedback on proposed updates to the framework governing crypto asset listings on local digital exchanges. The move, announced Friday by the country’s Securities and Exchange Commission (SEC), comes as Thailand continues to reshape its digital asset policies in response to growing market activity and broader efforts to modernize financial infrastructure. Revised Rules Target Transparency and Market Surveillance The proposed rule changes aim to provide crypto exchanges with flexibility while enhancing investor protection and oversight. Notably, one key proposal would allow digital asset platforms to list their own utility tokens or tokens issued by affiliated entities , a practice that is currently restricted. The public consultation period is open until July 21, after which the SEC will determine whether to proceed with the amendments. Under the updated draft, exchanges listing crypto assets would also be required to disclose the identities of individuals directly involved with the tokens. These disclosures must be visible to users and accessible through the exchange’s reporting system. Additionally, automated alerts would be integrated into exchange reporting to help the SEC detect suspicious activity, such as insider trading or market manipulation. If the new rules are enacted, any token currently listed on local platforms would be subject to a retroactive disclosure requirement, mandating exchanges to identify connected parties within 90 days of the rule’s implementation. This regulatory approach is reportedly seeking to enhance transparency and reduce risks associated with information asymmetry between developers, exchanges, and investors. Thailand’s Broader Push Toward Crypto Integration Thailand’s crypto policy developments are part of a broader strategy to position the country as a competitive digital finance hub. Earlier this month, the Thai government approved a five-year tax exemption for income earned from cryptocurrency trading. The exemption is designed to promote innovation, attract foreign capital, and give local startups more room to scale. Deputy Finance Minister Julapun Amornvivat stated that the government is accelerating efforts to integrate digital assets into the national economy . This aligns with Thailand’s plan to issue approximately $150 million worth of digital investment tokens this summer. These instruments are aimed at offering more competitive returns than traditional savings accounts and could mark the beginning of more institutional-grade tokenized finance offerings in the region. The consultation on token listing rules comes as countries across Southeast Asia take varying approaches to crypto regulation. While some jurisdictions have implemented stricter frameworks in response to market volatility and high-profile collapses, Thailand appears to be pursuing a more adaptive strategy focused on risk management and economic opportunity. Featured image created with DALL-E, Chart from TradingView",bitcoinist,https://bitcoinist.com/thailand-eyes-bold-crypto-overhaul-exchanges-soon/,"AAVE|ADA|ALTCOIN|ASIA|ATOM|AVAX|AXS|BCH|BLOCKCHAIN|BTC|BUSINESS|COMMODITY|COMP|DOGE|DOT|ETC|ETH|EXCHANGE|FIAT|FIL|LINK|LTC|LUNA|LUNC|MANA|MARKET|MATIC|MINING|REGULATION|SHIB|SOL|SPONSORED|TECHNOLOGY|TRADING|TRX|UNI|USDT|WALLET|XLM|XMR|XRP|XTZ|ZEC|ZRX|OTHER|RESEARCH|APT|ARB|BITTENSOR|BNB|CRO|WIF|FDUSD|HBAR|ICP|IMX|INJ|LDO|MNT|NEAR|NOT|PEPE|SUI|TON|USDC|AR|FLOKI|ONDO|BGB|BONK|BRETT|RUNE|FET|PYTH|SEI|FLR|JUP|BSV|AGX|ENS|ZK|WLD|CFX|XAUT|CAKE|OM|APE|LPT|HNT|XDC|FTT|BTG|PEOPLE|MOG|PYUSD|AXL|MEME|RAY|SSV|ARKM|ETHFI|MX|AIRDROP|TOKEN SALE|FORKS|TOKEN LISTING AND DELISTING|ADMINISTRATIVE EVENTS","Crypto News|crypto|Crypto and Thailand|crypto exchanges|Crypto Market|Cryptocurrency|Thailand",cryptocompare
2025-06-21T03:00:15,"Is Bitcoin’s position at risk? Look out for THESE key signals!","Why hasn’t BTC broken out despite being so close to it ATH once again?",ambcrypto,https://ambcrypto.com/is-bitcoins-position-at-risk-look-out-for-these-key-signals/,"BTC","Bitcoin|BTC Trading View|News|News 1|Social|Trading View",cryptocompare
2025-06-21T02:55:58,"Parataxis Holdings Takes Bold Steps with South Korea’s First Bitcoin Treasury","Parataxis Holdings plans South Korea's first Bitcoin treasury company. They acquire Bridge Bio to hold Bitcoin as a reserve asset. Continue Reading: Parataxis Holdings Takes Bold Steps with South Korea’s First Bitcoin Treasury The post Parataxis Holdings Takes Bold Steps with South Korea’s First Bitcoin Treasury appeared first on COINTURK NEWS .",cointurken,https://en.coin-turk.com/parataxis-holdings-takes-bold-steps-with-south-koreas-first-bitcoin-treasury/,"ASIA|BTC|FIAT|REGULATION","Bitcoin News",cryptocompare
2025-06-21T02:32:43,"Bitcoin Market Sees Potential Shift as Institutional Investors Control Majority Supply in 2024","Institutional investors have solidified their dominance in Bitcoin’s market, now controlling approximately 80% of its circulating supply, signaling a pivotal shift in market dynamics. Retail investor activity has notably declined",coinotag,https://en.coinotag.com/bitcoin-market-sees-potential-shift-as-institutional-investors-control-majority-supply-in-2024/,"BTC|BUSINESS|ETH|MARKET","News|BTC|ETH",cryptocompare
2025-06-21T02:30:19,"XRP, SOL, and BTC Followers Are Zoning In on MAGACOIN FINANCE’s Moves","As June 2025 unfolds, followers of XRP, Solana (SOL), and Bitcoin (BTC) are increasingly zoning in on the explosive moves of MAGACOIN FINANCE. With the altcoin market heating up and investors seeking the next big winner, tokens like Polkadot (DOT), Kaspa (KAS), and Aptos (APT) remain in focus—but it’s MAGACOIN FINANCE that’s capturing the most attention for its early-stage momentum and breakout potential. MAGACOIN FINANCE: A Frontrunner in 2025’s Crypto Presale Landscape MAGACOIN FINANCE has swiftly established itself as a frontrunner in the 2025 crypto presale landscape, raising over $10 million in a matter of weeks. The project’s official website offers limited access, with a bonus of 100% on investments using PATRIOTS100X. Its innovative staking platform and capped supply are appealing to both retail and institutional investors. Its contracts have been verified by HashEx, one of the most trusted names in smart contract auditing. The unique blend of meme appeal and utility is expected to drive continued growth. Solana (SOL): Bullish Structure and Institutional Support Solana is trading between $150 and $195, with analysts eyeing a breakout above $165 as a trigger for further gains. Institutional interest and ecosystem expansion continue to fuel optimism, and as SOL consolidates, many traders are allocating profits into MAGACOIN FINANCE for higher-upside exposure. Polkadot (DOT): Consistent Growth, Steady Outlook Polkadot is forecasted to trade between $3.67 and $3.68 in June, with longer-term projections pointing to steady but moderate gains. As DOT’s growth moderates, investors seeking sharper returns are increasingly looking to MAGACOIN FINANCE. Kaspa (KAS): Range-Bound but on Watchlists Kaspa is trading near $0.08, with technicals suggesting a range-bound summer. While KAS offers stability, it lacks the explosive upside now drawing capital to MAGACOIN FINANCE’s presale. Aptos (APT): Bullish Forecasts and Ecosystem Growth Aptos is projected to trade between $4.44 and $4.48 in June, with bullish sentiment for 2025 as the ecosystem expands. As APT builds, some holders are diversifying into MAGACOIN FINANCE to capture early-stage gains. Final Thoughts With XRP, Solana, and Bitcoin followers all zoning in, MAGACOIN FINANCE is setting the pace for June 2025’s altcoin market. As DOT, KAS, and APT hold steady, the boldest opportunities may belong to those who move early on MAGACOIN FINANCE. To learn more about MAGACOIN FINANCE, visit: Website: https://magacoinfinance.com Exclusive Access Portal: https://magacoinfinance.com/entry Continue Reading: XRP, SOL, and BTC Followers Are Zoning In on MAGACOIN FINANCE’s Moves",bitcoinsistemi,https://en.bitcoinsistemi.com/xrp-sol-and-btc-followers-are-zoning-in-on-magacoin-finances-moves/,"BTC|DOT|SOL|XRP|APT","Sponsored",cryptocompare
2025-06-21T02:11:42,"Trend Research Boosts ETH Holdings, Confident Ethereum Will Outperform BTC in Bull Market","LD Capital founder Li Hua Yi recently reaffirmed Trend Research’s bullish stance on Ethereum (ETH) and its expanding ecosystem. As a prominent secondary investment firm, their strategy hinges on the",coinotag,https://en.coinotag.com/breakingnews/trend-research-boosts-eth-holdings-confident-ethereum-will-outperform-btc-in-bull-market/,"BTC|ETH|MARKET|TRADING|RESEARCH","BTC|ETH",cryptocompare
2025-06-21T02:00:22,"Dogecoin Breaks Free—Could Soar 60%, Analyst Says","Dogecoin edged up slightly to $0.17 on Friday, gaining 1.0% in the last 24 hours. Trading has thinned out this week, and Dogecoin has slipped almost 3% over the past seven days. Based on reports, investors are moving carefully as volume dropped 30% to about $678 million. Related Reading: Iran’s Top Crypto Hub Loses $82 Million To Hackers With Israeli Links—Details Trading Volume Drop Signals Caution According to on‑chain data, the slump in daily volume shows fewer traders are stepping in. That 34% slide in activity suggests a loss of momentum. Some market watchers say low volume often leads to whipsaws. When fewer coins change hands, even modest buys or sells can push prices sharply in either direction. #Dogecoin $DOGE looks prime for a 60% price move! All you need to do is wait for a daily close outside of the $0.16 to $0.22 range to determine the direction of the trend. So go to @coinexcom, sign up using my referral link https://t.co/73n8mWavUX, and join me in this trade! pic.twitter.com/Im27DBuBka — Ali (@ali_charts) June 19, 2025 Triangle Pattern Points To Imminent Breakout On charts stretching from early 2024 into mid‑2025, Dogecoin fits a symmetrical triangle. Prices have carved lower highs and higher lows as trendlines converge. Data from crypto analyst Ali shows, this narrowing range often precedes a major move. He notes the tip of the triangle is due by June 2025, which puts a deadline on when volatility should pick up. DOGE Bulls Eye Breakout According to Ali’s analysis, a daily close above $0.22 likely signals a bullish breakout. If that happens, he sees Dogecoin reaching roughly $0.35 or $0.36—about 60% higher than current levels. On the flip side, a drop below $0.16 could spark a sell‑off toward $0.10. Investors are watching those exact levels to decide whether to join buyers or cut losses. DOGE Price Forecast Digital Coin Price is on the optimistic end. They predict Dogecoin could go past $0.37 before year‑end and even test its old high of $0.74 again. Market Catalysts Could Tip The Scales Dogecoin’s swings often mirror the wider crypto space or follow social media buzz. A surge in Bitcoin or Ethereum prices could carry DOGE higher, while a broader sell‑off would magnify losses. Some traders also keep an eye on endorsements from well‑known figures and major exchange listings. Related Reading: Bitcoin Nears Climax, But A Twist Awaits—Analyst Reveals Key Insight For now, patience may pay off. Traders will look for volume to confirm any move past $0.22 or under $0.16. Until then, expect choppy range‑bound action. The next few weeks will be critical as the symmetrical triangle tightens. If volume steps back in, Dogecoin could pick a clear direction—either a strong rally or a deeper correction. Featured image from Imagen, chart from TradingView",newsbtc,https://www.newsbtc.com/altcoin/dogecoin-breaks-free-could-soar-60-analyst-says/,"ALTCOIN|BTC|DOGE|MARKET|TRADING","Altcoin|altcoins|bitcoin|crypto|doge|Dogecoin|memecoins",cryptocompare
2025-06-21T01:55:59,"Thailand SEC Proposes New Digital Asset Listing Rules Potentially Affecting Bitcoin Transparency","Thailand’s Securities and Exchange Commission (SEC) has unveiled proposed digital asset listing regulations aimed at enhancing transparency and investor protection in the rapidly evolving crypto market. The public consultation period",coinotag,https://en.coinotag.com/thailand-sec-proposes-new-digital-asset-listing-rules-potentially-affecting-bitcoin-transparency/,"BTC|BUSINESS|EXCHANGE|MARKET|REGULATION","News|BTC",cryptocompare
2025-06-21T01:41:01,"Eric Semler Suggests Bitcoin Could Gain Despite Hedge Fund Skepticism Post-Trump Administration","Eric Semler, a prominent hedge fund manager and healthcare tech chairman, stands firm in his bullish stance on Bitcoin despite widespread skepticism among his peers. While many hedge fund executives",coinotag,https://en.coinotag.com/eric-semler-suggests-bitcoin-could-gain-despite-hedge-fund-skepticism-post-trump-administration/,"BTC|TRADING","News|BTC",cryptocompare
2025-06-21T01:39:50,"Texas Governor Greg Abbott Advances Bitcoin Reserve Protection with HB 4488 Amid Pending SB21 Decision","Texas Governor Greg Abbott has enacted House Bill 4488 (HB 4488), safeguarding specific state government funds, including Bitcoin reserves held externally from the state treasury, from being classified as general",coinotag,https://en.coinotag.com/breakingnews/texas-governor-greg-abbott-advances-bitcoin-reserve-protection-with-hb-4488-amid-pending-sb21-decision/,"BTC|FIAT|REGULATION","",cryptocompare
2025-06-21T01:36:31,"Bitcoin in a post-Trump world worries hedge fund execs: Eric Semler","Eric Semler says he enjoys being the “lone voice crying in the wilderness” with Bitcoin as most hedge fund executives think Bitcoin is a “fly-by-night concept.”",cointelegraph,https://cointelegraph.com/news/bitcoin-donald-trump-administration-hedge-fund-concerns-eric-semler?utm_source=rss_feed&utm_medium=rss&utm_campaign=rss_partner_inbound,"BTC","",cryptocompare
