datetime,headline,summary,source,url,categories,tags,api_source
2025-06-21T14:30:57,"Bitcoin Enters Institutional Era: Just 216 Holders Control 30% Of Supply","Bitcoin saw a sharp retracement to $102,300 after briefly climbing to $106,500 earlier today, as bulls failed once again to break through critical resistance. Sellers are stepping in at key supply zones, pushing back against attempts to enter price discovery above the $112K all-time high. Despite this pressure, Bitcoin remains resilient above the psychologically significant $100K mark, where it has found support since early June. The latest on-chain data from Gemini and Glassnode reveals a noteworthy structural shift: over 30% of Bitcoin’s circulating supply is now held by just 216 centralized entities. These include exchanges, ETFs, funds, public and private companies, DeFi contracts, and even governments. Exchanges currently hold the largest share, while public companies represent the most numerous holders. This trend highlights the deepening custodial centralization of Bitcoin, raising both adoption optimism and decentralization concerns. As the macroeconomic backdrop remains volatile—with high US Treasury yields, the Fed holding interest rates, and geopolitical tensions intensifying— Bitcoin’s price action is becoming increasingly sensitive to shifts in sentiment and liquidity. Whether BTC can hold this key support or slide deeper into correction will depend on upcoming volume reactions and potential moves from these dominant custodial players. Centralization And Geopolitics Shape Bitcoin’s Next Move Bitcoin is currently down 8% from its $112K all-time high, hovering in a broad consolidation phase with no decisive breakout. The price action suggests that the market is at a critical juncture, with traders split between two possibilities: a deeper retracement toward the $94K level or a renewed push into price discovery. This indecision is amplified by ongoing geopolitical tensions, particularly the escalating conflict between Israel and Iran. Many analysts warn that if the United States steps in, it could trigger panic across global markets, creating spillover effects into the crypto space. Meanwhile, key insights from Glassnode and Gemini shed light on a growing trend in Bitcoin’s ownership structure. Over 30% of the circulating supply is now held by just 216 centralized entities. This reflects a dual narrative—on one hand, increasing institutional adoption of Bitcoin as a reserve or investment asset, and on the other, rising custodial centralization that may undermine the network’s decentralized ethos. The largest holdings belong to crypto exchanges, ETFs, and funds, followed by public and private companies that have allocated BTC to their balance sheets. A notable portion is also locked in DeFi contracts, with some controlled by governments following seizures or strategic acquisitions. While this growing centralization may boost credibility and capital inflow, it also introduces new risks to liquidity and distribution. In such a fragile macro environment, Bitcoin’s next major move will depend not only on technical setups but also on the behavior of these key holders under pressure. BTC Price Analysis: Bulls Lose Momentum Bitcoin has retraced from its recent local high of $106,500 and is now trading around the $103,100 mark, testing a key support level highlighted in yellow on the chart—specifically the $103,600 zone. This level served as resistance earlier in the year and is now acting as a critical demand area during this consolidation phase. A daily or 3-day close below this threshold could signal further downside and open the door for a retest of the $100,000 psychological support. The chart shows lower highs forming since the $112,000 all-time high, which, if continued, may form a descending triangle structure—typically a bearish continuation pattern. Price rejection around $109,300 confirms that sellers remain in control at higher levels. Volume is slightly elevated on red candles, suggesting increased distribution. The 50 and 100 moving averages (at approximately $94,700 and $87,500, respectively) remain well below the current price, indicating room for further retracement if bearish momentum builds. Still, the broader uptrend remains intact unless price decisively breaks below the $100,000 level. Bulls need to reclaim $106,500 and close above $109,300 to signal strength. Until then, Bitcoin appears locked in a tightening range, with downside risk increasing in the short term. Featured image from Dall-E, chart from TradingView",bitcoinist,https://bitcoinist.com/bitcoin-enters-institutional-era-just-216-holders-control-30-of-supply/,"AAVE|ADA|ALTCOIN|ASIA|ATOM|AVAX|AXS|BCH|BLOCKCHAIN|BTC|BUSINESS|COMMODITY|COMP|DOGE|DOT|ETC|ETH|EXCHANGE|FIAT|FIL|LINK|LTC|LUNA|LUNC|MANA|MARKET|MATIC|MINING|REGULATION|SHIB|SOL|SPONSORED|TECHNOLOGY|TRADING|TRX|UNI|USDT|WALLET|XLM|XMR|XRP|XTZ|ZEC|ZRX|OTHER|RESEARCH|APT|ARB|BITTENSOR|BNB|CRO|WIF|FDUSD|HBAR|ICP|IMX|INJ|LDO|MNT|NEAR|NOT|PEPE|SUI|TON|USDC|AR|FLOKI|ONDO|BGB|BONK|BRETT|RUNE|FET|PYTH|SEI|FLR|JUP|BSV|AGX|ENS|ZK|WLD|CFX|XAUT|CAKE|OM|APE|LPT|HNT|XDC|FTT|BTG|PEOPLE|MOG|PYUSD|AXL|MEME|RAY|SSV|ARKM|ETHFI|MX|AIRDROP|TOKEN SALE|FORKS|TOKEN LISTING AND DELISTING|ADMINISTRATIVE EVENTS","Bitcoin News|bitcoin|Bitcoin Adoption|Bitcoin analysis|Bitcoin Bull Run|Bitcoin Institutionals|bitcoin news|Bitcoin supply|btc|BTCUSDT",cryptocompare
2025-06-21T14:30:09,"US Banks Sued After Artificial Intelligence Sparks $20,000 Fraudulent Transfer: Report","Two billion-dollar banks are facing a lawsuit for allegedly failing to stop a huge transfer fueled by artificial intelligence. Texas resident Gary Cunningham is suing PlainsCapital Bank and Pathward N.A. after $20,000 was fraudulently transferred from his account, reports Fox 26. The fraud happened after criminals hacked Cunningham’s email and used AI to clone his voice and convince his accountant to transfer $20,000 to a Pathward Financial account instead of the usual Chase account. At the time, his accountant was being deceived, Cunningham was traveling. The 76-year-old, who is representing himself in court, says the institutions should have better protections against AI-initiated fraud. I believe I have enough information here to force the banks to do something different because they were negligent – grossly negligent. “[The accountant] was convinced it was me talking to her – but I didn’t – I was on a plane to Chicago. There’s no way that was me.” While Cunningham is not a trained lawyer, he tells Fox 26 he learned the court process from his late wife and was also guided by a couple of friends who are lawyers. The lawsuit comes at a time when financial fraud against elderly Americans is on the rise. Annually, elderly Americans are losing over $3 billion per year to fraud, according to the FBI. Follow us on X , Facebook and Telegram Don't Miss a Beat – Subscribe to get email alerts delivered directly to your inbox Check Price Action Surf The Daily Hodl Mix Disclaimer: Opinions expressed at The Daily Hodl are not investment advice. Investors should do their due diligence before making any high-risk investments in Bitcoin, cryptocurrency or digital assets. Please be advised that your transfers and trades are at your own risk, and any losses you may incur are your responsibility. The Daily Hodl does not recommend the buying or selling of any cryptocurrencies or digital assets, nor is The Daily Hodl an investment advisor. Please note that The Daily Hodl participates in affiliate marketing. Generated Image: Midjourney The post US Banks Sued After Artificial Intelligence Sparks $20,000 Fraudulent Transfer: Report appeared first on The Daily Hodl .",dailyhodl,https://dailyhodl.com/2025/06/21/us-banks-sued-after-artificial-intelligence-sparks-20000-fraudulent-transfer-report/,"BTC|BUSINESS|FIAT|TRADING","Scams, Hacks & Breaches|bank|banks|fraud|News|transfer|US Bank|US banks",cryptocompare
2025-06-21T14:25:34,"Bitcoin Whales Withdraw from Binance, New Best Presale Contender Attracts Huge Investor Surge","Bitcoin Whales Trigger Crypto Market Shift The recent swings in the Bitcoin market have sent waves of caution through crypto communities. Big withdrawals from centralized platforms like Binance are showing that whales—big Bitcoin holders—might be repositioning or reducing their Bitcoin exposure amid apparent regulatory uncertainty and security issues. As these influential players make big moves, more and more retail investors are also making a shift, looking to find and fund decentralized and transparent opportunities that they see as safer. Within this context, the Neo Pepe Presale is now over $1.3 million funded, doing quite well in what is currently a not-so-bullish presale crypto market. They are in stage four of their presale, with some of the tokens selling for $0.08, on their way, we presume, to some steep token price increases after the presale is over. How Bitcoin Whale Movements Impact Market Moves Bitcoin whale movements are more usual indicators than instigators, frequently shining a light on larger shifts in the market’s feel. Recent outflows from Binance, however, are simply raising too many eyebrows and seem to be prompting a lot of second-guessing and rethinking. Investors who are not in full-blown panic mode are at least nudged closer to that realm when they consider 1. the total amounts being withdrawn; 2. the percentage of Binance’s total in/out flow that these withdrawals and the associated market making and money moving back and forth seem to indicate; and 3. the apparent internal/external governance problems at Binance and its affiliated companies that these withdrawals call into question. As speculative investigation begins to cause investor panic, one of the only ways out is seemingly through Neo Pepe Coin and the governance problems it solves. These features mark it as one of the surefire best crypto presale contenders of the year. Transparent Presale Structure Builds Investor Confidence Neo Pepe has emerged as a top pepe coin thanks to its robust presale strategy. That strategy is fully transparent and verifiable through on-chain activity. How is the presale so transparent? Because, unlike opaque projects that have a presale, Neo Pepe operates under a model called decentralized autonomous organization (DAO). And that presale, ladies and gentlemen, has a multisig approach to overseeing what goes where and with whom concerning your tokens and treasury. Now, young whales and old codgers might ask: ""Why care about transparency during the presale? Centralized projects are centralized for a reason. Do I have to eliminate de facto centralization to achieve this level of transparency?"" In the face of market manipulation from massive movement of whales, there’s your answer. You might want to pick up a little Neo Pepe as its early-stage pricing gives you considerable incentives for seeking presale opportunities. $NEOP’s Unique Positioning in Crypto’s Future Investor demand for transparency in cryptocurrency markets changed from something that some might characterize as a luxury to an overall requirement in 2025. Neo Pepe meets this demand through what could best be described as a trustless, open-source operation. Much of the trust that investors might have in a presale is built on the mechanisms that are employed to release the tokens in a manner that doesn't put too much downward pressure on the market. Neo Pepe's presale ostensibly employs such mechanisms. Yet, there's much more to Neo Pepe than just operating in a trustless fashion that makes the presale investor-friendly. There are also the automatic trust assurances that come with the kind of open-source operation that provides mechanism transparency. How Neo Pepe is Enhancing Decentralized Finance Participating in decentralized finance (DeFi) is not enough for Neo Pepe—it is actively enriching this part of the crypto universe through innovations in governance and financial security. Neo Pepe sharply reduces several familiar risks associated with traditional crypto investments. By decentralizing treasury control and establishing clear, auditable processes, it reduces the kind of uncertainty that can lead to catastrophic losses. Its smart contract outlines the process for managing treasury funds far too well for anyone to mistake it for the kind of secretive operation that led to the collapse of FTX. This active participation model is particularly appealing in an era where investors seek more meaningful control and less exposure to centralized financial pitfalls. Neo Pepe's Big Moment—Youtuber Asks Is This Coin Really Crypto’s Future? Crypto analyst Gems Booster examines this upcoming top pepe coin presale, with a sharp eye and sharper commentary, the presale of Neo Pepe. They unpack what sets this ambitious meme coin apart and what might hold it back. Their conclusion is that the presale is indeed carefully crafted and innovative, with layered strategy that escalates excitement through clearly defined pricing stages. Yet, even as they laud the sophistication (and, more importantly, the practicality) of Neo Pepe's auto-liquidity protocol, they remain lightly skeptical. After all, as Gems Booster points out, a truly innovative project with bold ideas is not always a sure bet in the current crypto market. They offer a set of potential obstacles that could stand in Neo Pepe's way and provide some vivid, honest commentary. You won't find more straightforward coverage around. 3 Key Reasons to Participate in Neo Pepe Coin’s Presale Full On-Chain Transparency – Every action is visible on the blockchain, ensuring accountability and fostering trust among early investors. Immutable Governance – No centralized control or hidden privileges, with all critical decisions executed by community consensus through the DAO. Staged Incentives – Early participation offers the best pricing opportunities, incentivizing swift action and rewarding early conviction. Why Retail Investors Prefer Neo Pepe Retail investors are gravitating toward Neo Pepe’s for several strategic reasons: Transparency and Trust: Retail investors prioritize visibility into the inner workings of their investments. Neo Pepe’s DAO structure and fully transparent tokenomics meet these requirements comprehensively. Community Control: Decisions are made collectively, reducing the risk of centralized manipulation or hidden agendas, empowering investors directly. Deflationary Mechanics: The automatic liquidity and burning of LP tokens ensure sustained value appreciation, a key aspect that appeals to both short-term speculators and long-term holders. Clear Roadmap: Neo Pepe’s clearly defined and ambitious roadmap includes robust milestones, each strategically planned to ensure incremental and sustainable growth. Secure Your Spot in Neo Pepe’s Revolution You might want to get a little Neo Pepe sooner rather than later—join the movement today by visiting the official Neo Pepe website or participating directly through supported cryptocurrencies. Stay informed through their Telegram . Neo Pepe Coin is more than hype—it’s a community-powered, fully transparent crypto experience crafted for the future. Disclaimer: This is a sponsored article and is for informational purposes only. It does not reflect the views of Crypto Daily, nor is it intended to be used as legal, tax, investment, or financial advice.",cryptodaily,https://cryptodaily.co.uk/2025/06/bitcoin-whales-withdraw-from-binance-new-best-presale-contender-attracts-huge-investor-surge,"BTC|BUSINESS|EXCHANGE|MARKET|BNB","More News",cryptocompare
2025-06-21T14:13:43,"US Spot Bitcoin ETFs May See Continued Interest Amid Nine Consecutive Days of Net Inflows","US spot Bitcoin ETFs have achieved a remarkable milestone with nine consecutive days of net positive inflows, signaling robust institutional interest and sustained demand for Bitcoin exposure through regulated investment",coinotag,https://en.coinotag.com/us-spot-bitcoin-etfs-may-see-continued-interest-amid-nine-consecutive-days-of-net-inflows/,"BTC","News|BTC",cryptocompare
2025-06-21T14:08:01,"Rising Bitcoin Knots Nodes Suggest Potential Network Schism and Price Impact by Late 2025","A significant surge in Bitcoin Knots nodes signals a potential ideological rift within the Bitcoin network, raising concerns about future price stability and protocol governance. Bitcoin Knots, a more configurable",coinotag,https://en.coinotag.com/rising-bitcoin-knots-nodes-suggest-potential-network-schism-and-price-impact-by-late-2025/,"BCH|BLOCKCHAIN|BTC|TRADING","Bitcoin|News|BCH|BTC|Core",cryptocompare
2025-06-21T14:07:36,"Russia ramps up search for ‘black miners’ implicated in 1.3 trillion-ruble loss","Russian grid operator Rosseti has set out to hunt down what it calls “black miners,” or those mining cryptocurrencies on stolen electricity worth billions of rubles. The power company, one of the largest in the world, announced it’s now working with Russian telecoms to expand its toolkit for identifying illegal crypto mining farms across the vast country. Rosseti to catch illegal crypto miners by analyzing internet traffic State-controlled Rosseti, the energy giant uniting regional grid operators in Russia, is elaborating a new mechanism to pinpoint illegal mining facilities, its head told journalists on the sidelines of the St. Petersburg International Economic Forum ( SPIEF ). Andrei Ryumin, who chairs Rosseti’s management board and serves as its director general, revealed that the company is currently working with Russian mobile operators Rostelecom and Mobile TeleSystems (MTS) on the matter, the business news portal RBC reported. The group hopes they can identify mining farms by following internet traffic. Ryumin explained: “For example, if data is transferred in large volumes, then this is mining. We are currently interacting with them so that they can locate such facilities and help us understand if they are legal.” The technology to do that is there, the official added. Meanwhile, MTS confirmed it has already provided Rosseti with access to its EnergyTool, an AI-based solution that analyzes not only internet traffic but also a number of other indicators, such as data from smart electricity meters. “Areas with abnormal traffic are indicated on the map, which helps energy workers find illegal cryptocurrency mining more effectively,” said Oleg Aldoshin, vice president of corporate business at MTS, the largest telecommunications firm and mobile network operator in Russia. According to its stats, the number of mining farms in the Russian Federation has increased by 9% in the first five months of 2025. Mining, as an industry, has been growing since its legalization in the country last year. To mine legally, companies and individual entrepreneurs are required to register with the Federal Tax Service (FNS) and pay their taxes . However, according to the authority, less than a third of active miners have so far done so. ‘Black miners’ caused $16.5 million in damages in 2024 According to Rosseti’s calculations, the so-called “black miners,” who tap into electricity networks illegally to mint digital coins, caused financial damages of more than 1.3 billion rubles ($16.5 million) last year alone. In reality, the losses are much higher than the estimate, Andrei Ryumin is convinced. He also noted: “We identify only part of the black mining.” The differential tariff for electricity distributed to the population, which was introduced in early 2025, is only good for combating “gray miners,” the executive also remarked. In Russia’s terminology, small miners who mine at their homes are often called “gray” as they are not required to register as mining enterprises with the FNS if their consumption does not exceed 6,000 kWh of electricity monthly. Differential rates allow Russian utilities to keep their consumption in check as they are charged more than regular households for the larger amounts of electricity powering improvised mining rigs in basements and garages. At the same time, “black” miners are those who burn energy completely outside the law by illegally connecting their hardware to public grids. “And the more expensive bitcoin is, the more of them there are,” the head of Rosseti pointed out. The power giant is also keeping track of the geographical distribution of illegal mining activities. According to the company’s estimates, Dagestan, along with other Russian republics in the North Caucasus, has the largest concentration of black miners, followed by some parts of Siberia . So far, mining has been banned in almost a dozen energy-deficient regions of the country, but critics say the restrictive measures mostly affect legal mining businesses. KEY Difference Wire : the secret tool crypto projects use to get guaranteed media coverage",cryptopolitan,https://www.cryptopolitan.com/russia-to-hunt-down-black-miners/,"BTC|BUSINESS|MINING|REGULATION|TECHNOLOGY","Bitcoin|BTC|RUB|USD",cryptocompare
2025-06-21T14:00:25,"Ethereum Charts Signal Potential Bottom – All Eyes On Next Move","Ethereum is once again trading at critical demand levels, testing the lower boundary of a six-week range that began forming in early May. After briefly climbing toward $2,800 earlier this month, ETH has retraced back to the $2,400 zone, reigniting debate about whether this is a healthy consolidation or a sign of further downside to come. Despite the pressure, Ethereum has not broken below this range, signaling that buyers continue to step in at these levels. Related Reading: Solana Analyst Sees $123 And $116 As Mid-Zone Support Levels – Here’s Why This extended consolidation period suggests a decisive move is nearing. Breakouts from tight ranges like this one often lead to strong directional momentum, and ETH’s current price structure could act as a launchpad—if bulls regain control. According to top analyst M-log1, Ethereum may have already bottomed during its most recent retrace, with the current action reflecting accumulation rather than weakness. The ETH/BTC ratio, another critical chart watched by traders, is also hovering near support levels, implying that a rotation back into altcoins may be imminent if Ethereum holds or pushes higher. For now, the market watches closely, as ETH’s next move could set the tone for broader altcoin performance in the weeks ahead. Ethereum Holds Range As Market Awaits Decisive Break Ethereum continues to trade within a tight consolidation range that began in early May, showing resilience despite growing global tensions and macroeconomic uncertainty. The price has hovered between $2,360 and $2,700, forming a narrow channel as buyers and sellers remain locked in a standoff. With conflicts in the Middle East intensifying and financial markets reacting to high interest rates and rising Treasury yields, crypto assets are under pressure, and Ethereum is no exception. The long-anticipated altseason has yet to materialize, and Ethereum is widely seen as the key to unlocking that next phase. ETH’s dominance in the smart contract and DeFi space gives it a central role in leading altcoin market momentum. Traders and analysts are closely monitoring its current range, especially after M-log1 shared analysis suggesting the recent low at $2,360 could mark a local bottom. According to M-log1, Ethereum is now consolidating just below the $2,450 level, and this zone could serve as a bullish trigger if reclaimed with strength. A decisive move in either direction will likely set the tone for the broader crypto market, with a breakout above $2,500 potentially igniting the next leg upward. Until then, market participants are watching closely. If ETH fails to hold these demand levels, the range could break to the downside, delaying any altseason rally further. But if bulls regain control and push above key resistance, it could signal the start of a much-anticipated upward move. In this environment of uncertainty, Ethereum’s next breakout-or breakdown—could prove pivotal for market sentiment heading into the second half of the year. Related Reading: Ethereum Prepares For A Decisive Move: ETH/BTC Setup Could Trigger Altseason ETH Tests Key Support As Price Retraces Ethereum is currently trading at $2,405, down 4.17% in the last session, after testing a low of $2,367. The chart reveals that ETH has retraced back to the lower boundary of a six-week range, confirming strong demand in the $2,360–$2,400 area. This zone has acted as a critical support level multiple times, with bulls stepping in each time to defend it. The price remains trapped below the 200-day moving average ($2,774), which has proven to be a strong resistance. Meanwhile, both the 50-day and 100-day moving averages are trending below price, currently sitting at $2,287 and $2,640, respectively, tightening the range even more. This compression typically leads to high volatility once a breakout occurs. Related Reading: Ethereum Mirrors Bitcoin 2017-2021 Pattern – $4,000 Is The Trigger Point Volume has remained elevated during recent sessions, suggesting that buyers and sellers are actively competing for control. A decisive close below $2,360 could trigger a cascade toward $2,100 or lower. Conversely, if bulls manage to reclaim $2,500 and sustain momentum toward the $2,700–$2,800 resistance band, it may set the stage for a breakout. Featured image from Dall-E, chart from TradingView",newsbtc,https://www.newsbtc.com/news/ethereum/ethereum-charts-signal-potential-bottom-all-eyes-on-next-move/,"ALTCOIN|BTC|ETH|MARKET|TRADING","Ethereum|ETH|ethereum|Ethereum Analysis|Ethereum Bottom|ethereum news|ethereum price|Ethereum Support|Ethereum Technical Charts|ETHUSDT",cryptocompare
