datetime,headline,summary,source,url,categories,tags,api_source
2025-06-21T05:47:57,"Semler Scientific Plans Potential $11 Billion Bitcoin Accumulation Under New Leadership Through 2027","Semler Scientific unveils an $11 billion Bitcoin acquisition strategy, appointing Joe Burnett to lead its ambitious crypto treasury expansion. The company targets holding 105,000 BTC by 2027, signaling a significant",coinotag,https://en.coinotag.com/semler-scientific-plans-potential-11-billion-bitcoin-accumulation-under-new-leadership-through-2027/,"BTC|MARKET|REGULATION","Analysis|Bitcoin|News|BTC|JOE",cryptocompare
2025-06-21T05:36:24,"Texas Protects Its Bitcoin Holdings With New Law","The post Texas Protects Its Bitcoin Holdings With New Law appeared first on Coinpedia Fintech News Texas Governor Greg Abbott just signed a new law ( House Bill 4488 ) that protects the state’s Bitcoin reserves and other crypto holdings. Without this law, these funds might have been forced to be sold off in 2025. Now, they’re safe and won’t be treated like regular government money. This shows that Texas is serious about using and protecting cryptocurrency as part of its official financial plans. Update: Texas has passed a law securing off-treasury $BTC reserves, with a key decision on SB21 potentially allowing the state to buy #Bitcoin , set for June 22. #CoinPedia #CryptoNews #Blockchain #CryptoMarket pic.twitter.com/jS0eJluyH9 — Coinpedia (@CoinpediaNews) June 21, 2025 Bitcoin Investment Bill Awaits Abbott’s Decision While HB 4488 is now law, all eyes are on Senate Bill 21 (SB21) , which proposes allowing Texas to invest directly in Bitcoin and other cryptocurrencies with market caps over $500 billion. At present, only Bitcoin qualifies, making it the prime candidate for state investment. Governor Abbott has until June 22 to sign or veto SB21. If he takes no action, the bill will become law automatically. SB21 would mark a major milestone in crypto adoption at the state level, aligning Texas with a growing number of institutions that view Bitcoin as a strategic reserve asset. Institutional Momentum Builds Around Bitcoin Governor Abbott’s steps mirror a broader institutional trend. Hedge fund manager Eric Semler, who chairs healthcare firm Semler Scientific, has been vocal in his support of Bitcoin as a long-term investment . Semler’s firm recently increased its Bitcoin holdings, reinforcing the view that crypto is gaining ground as a store of value. .article-inside-link { margin-left: 0 !important; border: 1px solid #0052CC4D; border-left: 0; border-right: 0; padding: 10px 0; text-align: left; } .entry ul.article-inside-link li { font-size: 14px; line-height: 21px; font-weight: 600; list-style-type: none; margin-bottom: 0; display: inline-block; } .entry ul.article-inside-link li:last-child { display: none; } Also Read : Why Crypto Market Is Down Today? $240B Wiped Out Amid Israel-Iran Tensions , His popular approach, investing in what most don’t, has paid off historically, especially in turbulent markets. Semler’s confidence in Bitcoin also echoes the sentiment of a growing number of hedge funds; recent data shows nearly half now have some crypto exposure. Texas is Sending a Message The passage of HB 4488 shows that Texas is serious about protecting its crypto reserves. If SB21 follows, the state could become one of the first to officially invest in Bitcoin. Together, these two bills reflect a calculated but forward-looking approach. For investors and institutions watching from the sidelines, Texas might be the place where crypto meets government policy and gets taken seriously. .article_register_shortcode { padding: 18px 24px; border-radius: 8px; display: flex; align-items: center; margin: 6px 0 22px; border: 1px solid #0052CC4D; background: linear-gradient(90deg, rgba(255, 255, 255, 0.1) 0%, rgba(0, 82, 204, 0.1) 100%); } .article_register_shortcode .media-body h5 { color: #000000; font-weight: 600; font-size: 20px; line-height: 22px; text-align:left; } .article_register_shortcode .media-body h5 span { color: #0052CC; } .article_register_shortcode .media-body p { font-weight: 400; font-size: 14px; line-height: 22px; color: #171717B2; margin-top: 4px; text-align:left; } .article_register_shortcode .media-body{ padding-right: 14px; } .article_register_shortcode .media-button a { float: right; } .article_register_shortcode .primary-button img{ vertical-align: middle; width: 20px; margin: 0; display: inline-block; } @media (min-width: 581px) and (max-width: 991px) { .article_register_shortcode .media-body p { margin-bottom: 0; } } @media (max-width: 580px) { .article_register_shortcode { display: block; padding: 20px; } .article_register_shortcode img { max-width: 50px; } .article_register_shortcode .media-body h5 { font-size: 16px; } .article_register_shortcode .media-body { margin-left: 0px; } .article_register_shortcode .media-body p { font-size: 13px; line-height: 20px; margin-top: 6px; margin-bottom: 14px; } .article_register_shortcode .media-button a { float: unset; } .article_register_shortcode .secondary-button { margin-bottom: 0; } } Never Miss a Beat in the Crypto World! Stay ahead with breaking news, expert analysis, and real-time updates on the latest trends in Bitcoin, altcoins, DeFi, NFTs, and more. .subscription-options li { display: none; } .research-report-subscribe{ background-color: #0052CC; padding: 12px 20px; border-radius: 8px; color: #fff; font-weight: 500; font-size: 14px; width: 96%; } .research-report-subscribe img{ vertical-align: sub; margin-right: 2px; } Subscribe to News var templateIds = ""6""; var listOfSubscribed = []; function subscribed_popupmodal(template_id) { var templateId = '6'; getAllSubscriberCategoryList([templateId]); var subcribemodal = window.parent.document.getElementById('subscribe-modal-design'); if (subcribemodal) { var modalContent = ` Never Miss a Beat in the Crypto World! Stay informed and gain the edge you need to navigate the crypto world. Select your subscription now Daily Get real-time crypto news, market insights, and blockchain updates. Weekly Stay updated with major trends, funding news, and price analysis. Monthly Receive a detailed report with market analysis and expert predictions. Subscribe Now `; subcribemodal.innerHTML = modalContent; } subscribe_unsubscribe_status(template_id); //getAllSubscriberCategoryList(template_id); } function toggleSubscription(subscription, template_id) { var subscriptionCheckbox = document.getElementById(subscription + '_' + template_id); var li = document.getElementById(subscription + 'Selected_' + template_id); if (subscriptionCheckbox.checked) { li.classList.add('active'); } else { li.classList.remove('active'); } } function getAllSubscriberCategoryList(getcategoryId) { jQuery.ajax({ url: 'https://coinpedia.org/wp-admin/admin-ajax.php', type: 'GET', data: { action: 'subscribe_api_ajax_request', apiurl: '/app/email_newsletter/list', }, success: function(response) { var result = JSON.parse(response.message); if (result.status === true) { var idstosubscribed = [] // Populate listOfSubscribed with subscribed category IDs result.message.forEach(listofcategory => { if (listofcategory.subscribe_status === 1) { if (!listOfSubscribed.includes(listofcategory._id)) { listOfSubscribed.push(listofcategory._id); } if (!idstosubscribed.includes(listofcategory.news_cp_category_row_id)) { idstosubscribed.push(listofcategory.news_cp_category_row_id); } } }); idstosubscribed.forEach(id => { var subscribeButton = document.getElementById('subscribe_' + id); var unsubscribeButton = document.getElementById('unsubscribe_' + id); if (subscribeButton && unsubscribeButton) { subscribeButton.style.display = 'none'; unsubscribeButton.style.display = 'block'; var showDownloadReport = document.getElementById('download_report'); if (showDownloadReport) { showDownloadReport.style.display = 'block'; } } }); } }, error: function(xhr, status, error) { console.error('Error:', error); } }); } function subscribe_unsubscribe_status(getcategoryId) { var elementTounsubscribe = parent.document.getElementById('unsubscribe_' + getcategoryId); var elementTosubscribe = parent.document.getElementById('subscribe_' + getcategoryId); jQuery.ajax({ url: 'https://coinpedia.org/wp-admin/admin-ajax.php', type: 'POST', data: { action: 'subscribe_api_ajax_request', apiurl: '/app/email_newsletter/list?category_row_id=' + getcategoryId, }, success: function(response) { var result = JSON.parse(response.message); if (result.status === true) { parent.jQuery('.skeliton-loader-block').hide(); var hasSubscribeStatusOne = false; result.message.forEach(subscribeStatus => { if (listOfSubscribed.includes(subscribeStatus._id) && subscribeStatus.subscribe_status === 1) { hasSubscribeStatusOne = true; } if (subscribeStatus.notification_type === 3) { parent.document.getElementById('monthlySelected_' + getcategoryId).style.display = 'block'; parent.document.getElementById('monthly_' + getcategoryId).setAttribute('data-id', subscribeStatus._id); if (subscribeStatus.subscribe_status === 1) { parent.document.getElementById('monthly_' + getcategoryId).checked = true; } } else if (subscribeStatus.notification_type === 2) { parent.document.getElementById('weeklySelected_' + getcategoryId).style.display = 'block'; parent.document.getElementById('weekly_' + getcategoryId).setAttribute('data-id', subscribeStatus._id); if (subscribeStatus.subscribe_status === 1) { parent.document.getElementById('weekly_' + getcategoryId).checked = true; } } else if (subscribeStatus.notification_type === 1) { parent.document.getElementById('dailySelected_' + getcategoryId).style.display = 'block'; parent.document.getElementById('daily_' + getcategoryId).setAttribute('data-id', subscribeStatus._id); if (subscribeStatus.subscribe_status === 1) { parent.document.getElementById('daily_' + getcategoryId).checked = true; } } if (subscribeStatus.subscribe_status === 1) { listOfSubscribed.push(subscribeStatus._id); } }); if (hasSubscribeStatusOne) { elementTosubscribe.style.display = 'none'; elementTounsubscribe.style.display = 'block'; } else { elementTosubscribe.style.display = 'block'; elementTounsubscribe.style.display = 'none'; } } }, error: function(xhr, status, error) { console.error('Error:', error); } }); } function logSelectedSubscriptions(categoryid) { var unsubscribemodal = document.querySelector('.unsubscribed-popup-modal .modal'); var subscribedmodal = document.querySelector('.subscribed-popup-modal .modal'); unsubscribemodal.innerHTML=''; subscribedmodal.innerHTML=''; var selectedSubscriptions = []; var storeCheckedId = []; var checkboxes = document.querySelectorAll('#subscription-options-' + categoryid + ' input[type=""checkbox""]'); var errorMessage = document.getElementById('error-message-select'); // Use a Set to handle unique data-ids var uniqueSubscribedIds = new Set(listOfSubscribed); checkboxes.forEach(function(checkbox) { var dataId = parseInt(checkbox.getAttribute('data-id')); if (checkbox.checked) { selectedSubscriptions.push(checkbox.id); storeCheckedId.push(dataId); } else { uniqueSubscribedIds.delete(dataId); // Remove unchecked data-id } }); // Update listOfSubscribed with unique values listOfSubscribed = Array.from(uniqueSubscribedIds); var selectedSubscriptionsString = selectedSubscriptions.join(', '); var concatinateSubscribeId = [...new Set(storeCheckedId.concat(listOfSubscribed))]; var categoryData = { 'subscribed_categories': concatinateSubscribeId }; var requestSubscriberData = { action: 'handle_dynamic_api_request_with_headers', security: '98b63c3be8', endpoint: '/app/email_newsletter/update_categories', token: '', data: categoryData }; jQuery.ajax({ url: 'https://coinpedia.org/wp-admin/admin-ajax.php', type: 'POST', data: requestSubscriberData, beforeSend: function(xhr) { xhr.setRequestHeader('X-Requested-With', 'XMLHttpRequest'); }, success: function(response) { try { response = response.data; if (storeCheckedId.length === 0) { var unsubcribedPopUpmodal = ` You’ve Unsubscribed Successfully We're sorry to see you go! Your subscription has been canceled. If you change your mind, you can re-subscribe anytime. Thank you for being part of our community! `; unsubscribemodal.innerHTML = unsubcribedPopUpmodal; document.querySelector('#subscribe-modal-design .modal').style.display = 'none'; unsubscribemodal.style.display = 'block'; unsubscribemodal.classList.remove('hide'); unsubscribemodal.classList.add('show'); document.getElementById('subscribe_' + categoryid).style.display = 'block'; document.getElementById('unsubscribe_' + categoryid).style.display = 'none'; var showDownloadReport = document.getElementById('download_report'); if (showDownloadReport) { showDownloadReport.style.display = 'none'; } } else { var subscribedPopupModal = ` Thank you for subscribing! Thank you for subscribing to our crypto and blockchain newsletter! You’ll now receive the latest news, insights, and updates straight to your inbox. Welcome to our community! `; let selectedSubscriptionsArray = selectedSubscriptionsString.split(','); let subscribedCategories = selectedSubscriptionsArray.map(subscription => subscription.split('_')[0]); let subscribedCategoriesString = subscribedCategories.join(', '); subscribedmodal.innerHTML = subscribedPopupModal; if (document.getElementById('selectidname')) { document.getElementById('selectidname').textContent = subscribedCategoriesString; } document.querySelector('#subscribe-modal-design .modal').style.display = 'none'; subscribedmodal.style.display = 'block'; subscribedmodal.classList.remove('hide'); subscribedmodal.classList.add('show'); document.getElementById('subscribe_' + categoryid).style.display = 'none'; document.getElementById('unsubscribe_' + categoryid).style.display = 'block'; var showDownloadReport = document.getElementById('download_report'); if (showDownloadReport) { showDownloadReport.style.display = 'block'; } } } catch (e) { console.error('Error parsing response:', e); } }, }); } function closeModal(template_id) { var modalId = template_id; var modal = document.querySelector('#' + modalId); // Using querySelector to find the modal if (modal) { modal.classList.add('hide'); modal.classList.remove('show'); setTimeout(function() { modal.style.display = 'none'; }, 500); } else { console.warn('Modal not found:', modalId); } } function closeunsubscribemodal() { var unsubscribemodal = document.querySelector('.unsubscribed-popup-modal .modal'); if (unsubscribemodal) { unsubscribemodal.classList.add('hide'); unsubscribemodal.classList.remove('show'); } setTimeout(function() { unsubscribemodal.style.display = 'none'; }, 500); } function closesubscribemodal() { var subscribedmodal = document.querySelector('.subscribed-popup-modal .modal'); setTimeout(function() { subscribedmodal.style.display = 'none'; }, 500); if (subscribedmodal) { subscribedmodal.classList.add('hide'); subscribedmodal.classList.remove('show'); } } function withoutLoginClicked(withoutlogin_id) { localStorage.setItem('subscribe_without_Login', 'true'); localStorage.setItem('subscribe_clicked_id', withoutlogin_id); } document.addEventListener('DOMContentLoaded', function() { const subscribewithoutData = localStorage.getItem('subscribe_without_Login'); const subscribe_clicked_cat_id = localStorage.getItem('subscribe_clicked_id'); // Function to get cookies function getCookie(name) { let value = ""; "" + document.cookie; let parts = value.split(""; "" + name + ""=""); if (parts.length == 2) return parts.pop().split("";"").shift(); } // Get user token from cookies const userToken = getCookie('user_token'); if (subscribewithoutData === 'true' && userToken) { // Call the modal function with the category ID subscribed_popupmodal(subscribe_clicked_cat_id); // Remove the flag and category ID from localStorage localStorage.removeItem('subscribe_without_Login'); localStorage.removeItem('subscribe_clicked_id'); } }); /************************** update susbcriber content **************************** */ function initializeSubscriptionButton() { var initialListItems = document.querySelectorAll('.subscription-options input[type=""checkbox""]'); initialListItems.forEach(function(item) { console.log(item.checked, 'Initial Checkbox checked status'); }); var listItems = document.querySelectorAll('.subscription-options li'); if (listItems.length === 0) return; var anyActive = false; listItems.forEach(function(item) { var checkbox = item.querySelector('input[type=""checkbox""]'); if (checkbox) { if (checkbox.checked) { item.classList.add('active'); anyActive = true; // Set anyActive to true } else { item.classList.remove('active'); // Remove 'active' class if checkbox is unchecked } } }); } function updateButtonText(anyActive) { var subscribeButtonSpan = document.querySelector('.subscribe-submit .changeBtnText'); if (subscribeButtonSpan) { if (anyActive) { subscribeButtonSpan.textContent = 'Subscribe Now'; } else { subscribeButtonSpan.textContent = 'Unsubscribe'; } } } function updateSubscriptionButton() { var listItems = document.querySelectorAll('.subscription-options li'); if (listItems.length === 0) return; var anyActive = false; listItems.forEach(function(item) { var checkbox = item.querySelector('input[type=""checkbox""]'); if (checkbox) { if (checkbox.checked) { item.classList.add('active'); anyActive = true; // Set anyActive to true } else { item.classList.remove('active'); // Remove 'active' class if checkbox is unchecked } } }); // Update the button text based on whether any list item has the 'active' class updateButtonText(anyActive); } document.addEventListener('click', function(event) { var clickedItem = event.target.closest('.subscription-options li'); if (clickedItem) { var checkbox = clickedItem.querySelector('input[type=""checkbox""]'); if (checkbox) { checkbox.checked = !checkbox.checked; updateSubscriptionButton(); } } }); FAQs How likely is SB21 to become law and what would it mean for Texas crypto investments? SB21 is highly likely to become law as Governor Abbott’s deadline is June 22, 2025, and inaction means automatic passage. It would enable Texas to directly invest in Bitcoin, creating a state-managed reserve. What are the potential risks of Texas holding Bitcoin as a strategic reserve outside traditional assets? Potential risks include Bitcoin’s high volatility, regulatory uncertainty, and cybersecurity threats. Critics also question whether government involvement in speculative assets aligns with prudent fiscal policy. Why is only Bitcoin currently qualifying for Texas’s proposed investment bill and could Ethereum join later? Only Bitcoin currently qualifies because SB21 requires a minimum 12-month average market capitalization of $500 billion. Ethereum could join later if its market cap consistently meets this threshold. What impact might Texas’s crypto policies have on institutional interest in Bitcoin? Texas’s proactive crypto policies could significantly boost institutional interest in Bitcoin by legitimizing it as a reserve asset, potentially encouraging other states and large entities to follow suit.",coinpedia,https://coinpedia.org/news/texas-protects-its-bitcoin-holdings-with-new-law/,"ALTCOIN|BLOCKCHAIN|BTC|BUSINESS|FIAT|MARKET|REGULATION","News|Bitcoin|Bitcoin Reserve",cryptocompare
2025-06-21T05:01:45,"Why Crypto Market Is Down Today? $240B Wiped Out Amid Israel-Iran Tensions","The post Why Crypto Market Is Down Today? $240B Wiped Out Amid Israel-Iran Tensions appeared first on Coinpedia Fintech News The cryptocurrency market has been under immense pressure over the past week, primarily due to growing geopolitical risks. On June 21, the total cryptocurrency market dropped by 1.26% to $3.21 trillion , wiping out nearly $240 billion in value. Bitcoin led the fall, slipping to a low of $103,127, down 2% in just seven days. Altcoins were hit even harder—Ethereum dropped to $2,456, losing 10% during the same time. But what exactly is causing this crypto market crash? Let’s break down! Israel-Iran War & U.S. Involvement Fears The biggest trigger has been the rising conflict between Israel and Iran. Crypto investors are now worried that the U.S. might step into the war, as Trump has already warned Iran over not signing a deal. As a result, Bitcoin fell from $108,000 to $103,000 in a week, while Ethereum, Solana & Dogecoin also dropped over 10%. Whale Sell-Offs Taking Profits Whales are starting to sell huge amounts of Bitcoin and moving off altcoin on the exchange. According to Glassnode data , wallets that held BTC for 6–12 months sold over $900 million recently. Even those who’ve held Bitcoin for over a year have started cashing out. In early June, long-term holders took home $1.2 billion in profits, one of the biggest profit-taking waves this year. Massive Liquidations Add Pressure As prices dropped, many traders using leverage got wiped out. In the past 24 hours alone, over $503 million in crypto positions were liquidated, with 134,000 traders affected. Most of these losses happened on Ethereum, which saw $183 million in liquidations. The largest single loss was seen by a Bitcoin trade worth $8 million on the Bybit exchange. Altcoins Hit Harder Than Bitcoin While Bitcoin dropped about 2%, most altcoins dropped even more. Ethereum is down 10% for the week, Solana fell over 11%, and XRP lost 1.4%. The Altcoin Index has dropped to 22 , showing Bitcoin is dominating the market.",coinpedia,https://coinpedia.org/news/why-crypto-market-is-down-today-240b-wiped-out-amid-israel-iran-tensions/,"ALTCOIN|BTC|ETH|EXCHANGE|MARKET","News",cryptocompare
2025-06-21T05:00:58,"Bitcoin Sees Modest Gains, But Demand Weakness Limits Breakout Potential","Bitcoin has resumed a slow climb upward after a recent period of consolidation, briefly breaking back above the $106,000 mark earlier today. At the time of writing, the cryptocurrency is trading at $105,383, reflecting a 0.8% increase over the past 24 hours. While this upward move has not sparked a major breakout, analysts are paying close attention to on-chain and market structure indicators that suggest a cautiously balanced environment. Related Reading: Analyst Warns Of Bitcoin Breakdown—’If This Continues, It Snaps’ On-Chain Data Points to Equilibrium, But Demand Wanes According to CryptoQuant analyst Darkfost, the market currently lacks extreme signals of profit-taking or panic. In a recent analysis, Darkfost explained that realized profits over a seven-day moving average remain below $1 billion. This is in line with figures observed during the market correction in late 2024 and significantly below peaks seen in early 2025. The analyst suggests that the current realized profit levels point to a market that is not under pressure from large-scale investor exits, supporting the ongoing consolidation. In the same report, Darkfost also discussed how a decline in demand may be limiting further upward momentum. By analyzing the ratio of new supply to the supply held inactive for over a year, the study observed that while demand remains positive, it has been weakening since Bitcoin’s local high in May. This suggests that although the market is absorbing existing selling pressure, fresh buying interest is not strong enough to trigger a new rally. As a result, the market appears to be in a state of temporary equilibrium, a phase where both sellers and buyers are relatively inactive. Bitcoin Traders Brace for Volatility in a Crowded Range Another CryptoQuant analyst, BorisVest, echoed the sentiment of a tightly contested market by analyzing Binance order flow and position data. He noted that Bitcoin has traded within a range of $100,000 to $110,000 for nearly a month. Within this band, both long and short positions have been building, and traders are watching the extremes of this zone closely. According to BorisVest, any breakout beyond $110,000 or drop below $100,000 could set the tone for the next significant price movement. The $100K–$110K price range has become a battleground for both bulls and bears. BorisVest observed that short positions are currently increasing, indicating that a significant portion of market participants expect a downward correction. Related Reading: Is Bitcoin Gearing Up for a Breakout? On-Chain Signals Say ‘Watch This Level’ However, he also pointed out that when shorts dominate, the risk of a sudden reversal, known as a short squeeze, becomes more likely. This behavior is consistent with recent funding rate trends, which show a fairly balanced distribution of long and short bets. Featured image created with DALL-E, Chart from TradingView",newsbtc,https://www.newsbtc.com/bitcoin-news/bitcoin-sees-modest-gains-but-demand-weakness-limits-breakout-potential/,"BTC|BUSINESS|MARKET|TRADING|BNB","Bitcoin News|bitcoin|bitcoin market|btc|BTCUSDT|crypto|crypto market|cryptocurrency|cryptoquant",cryptocompare
