datetime,headline,summary,source,url,categories,tags,api_source
2025-06-21T01:30:18,"MAGACOIN FINANCE Joins Bitcoin and Solana in Top 2025 Bullish Picks","The 2025 crypto bull run is in full swing, and a new wave of top picks is emerging as investors look beyond the usual giants. Bitcoin (BTC) continues to set the pace with record institutional inflows, while Solana (SOL) is drawing bullish forecasts from experts. Now, MAGACOIN FINANCE is joining this elite group, rapidly gaining traction as one of the most promising altcoins for the year. With Cardano (ADA), NEAR Protocol (NEAR), Kaspa (KAS), and Arbitrum (ARB) also in focus, the market is primed for dynamic moves. MAGACOIN FINANCE: Setting New Standards for Altcoin Launches MAGACOIN FINANCE is making waves in 2025 after raising over $10 million in its limited-access pre-sale. With a capped supply, bold branding, and a full audit by HashEx, the project is gaining serious traction. Investors can double their holdings using promo code PATRIOTS100X—analysts expect major upside ahead of its public launch. Momentum is building fast across social platforms, with growing interest from both retail and early-stage backers. Many now view MAGACOIN FINANCE as one of the year’s most compelling altcoin opportunities. Bitcoin (BTC): Institutional Inflows and New Highs Bitcoin is riding a wave of institutional adoption and record spot ETF inflows, with leading analysts forecasting a 2025 top between $180,000 and $250,000. As BTC continues to break new ground, it remains the market’s anchor and a key benchmark for bullish sentiment. Solana (SOL): Bullish Patterns and Expert Forecasts Solana is working on a bullish cup and handle pattern, with seven reputable experts predicting 2025 highs ranging from $220 to $1,000 and an average target of $515. Ecosystem expansion and the potential for ETF approval are driving optimism, keeping SOL among the top bullish picks. Cardano (ADA): DeFi Growth and Layer-2 Upgrades Cardano is forecasted to reach as high as $5.66 in 2025, supported by DeFi adoption, scaling solutions like Hydra, and growing institutional interest. ADA’s innovative approach and network upgrades are drawing attention from both retail and professional investors. NEAR Protocol (NEAR): Steady Growth Outlook NEAR Protocol is projected to reach $2.91 by the end of 2025, with a cumulative ROI of +18% and a long-term outlook for continued ecosystem development. As NEAR’s fundamentals strengthen, it remains a steady pick for diversified portfolios. Kaspa (KAS): Volatility and High Potential Kaspa’s price could range from $0.08 to $0.65 in 2025, with some analysts predicting up to 620% gains if bullish momentum holds. Its unique consensus mechanism and growing adoption keep KAS on the radar for high-risk, high-reward traders. Arbitrum (ARB): Layer-2 Leadership Arbitrum continues to lead Layer-2 solutions for Ethereum, with ongoing upgrades and ecosystem growth supporting its long-term value proposition. As ARB’s adoption expands, it remains a favorite among DeFi-focused investors. Final Thoughts With MAGACOIN FINANCE joining Bitcoin, Solana, and other top altcoins in the 2025 bullish spotlight, the stage is set for a year of dynamic gains and new market leaders. To learn more about MAGACOIN FINANCE, visit: Website: https://magacoinfinance.com Exclusive Access Portal: https://magacoinfinance.com/entry Continue Reading: MAGACOIN FINANCE Joins Bitcoin and Solana in Top 2025 Bullish Picks",bitcoinsistemi,https://en.bitcoinsistemi.com/magacoin-finance-joins-bitcoin-and-solana-in-top-2025-bullish-picks/,"ADA|BTC|SOL|TRADING|NEAR","Sponsored",cryptocompare
2025-06-21T01:19:43,"XRP Price Prediction: Analyst Declares ‘Only Two Paths Remain’ as XRP Tightens to Breaking Point","The XRP price has inched up to $2.17 today , with this consolidation happening as the crypto market loses 1.5% in the past 24 hours. The altcoin is now up by 1.5% in a week but down by 8% in a month, following weeks of escalating tension in the Middle East and little progress with regards to international tariffs. That said, XRP retains a strong 335% increase in the past year, while analysts are beginning to suggest that the coin nearing a pivotal tipping point. This could be in either direction, however, although XRP’s fundamentals have become increasingly strong in recent weeks, pointing to a very positive long-term price prediction . XRP Price Prediction: Analyst Declares ‘Only Two Paths Remain’ as XRP Tightens to Breaking Point Posting on X, analyst CasiTrades wrote that XRP’s “consolidation has finally reached its apex and something big is coming next.” Unfortunately, she suggested that a big dive is more or less as likely as a breakout, so traders may need to tread very carefully in deciding whether to buy or sell. The market is officially out of time! After months of tightening, the #XRP consolidation has finally reached its apex and something big is coming next. There are only two paths from here: either the explosive breakout we've been waiting for begins now, or we see one final… pic.twitter.com/xGRyaevRxX — CasiTrades (@CasiTrades) June 18, 2025 The main point of her analysis was that, if XRP struggles to break through $2.25 for much longer, it could slide to lower levels, to $2.00 or “even $1.55.” However, she may have invalidated her analysis to some degree by suggesting, a reply to her own post , that to “be clear, I do think we’ll get that drop to support today or tomorrow.” This did not happen, with the XRP price hanging around the same $2.15 level it had on the day (Wednesday) she made these predictions. If we look at XRP’s chart today, we see that the coin’s resistance (red) and support (green) are indeed converging to a point where a big move may arrive. As for the other indicators, they suggest that the altcoin remains in an oversold position, which would imply a strong rebound. Source: TradingView Its RSI (purple) has been below 50 for much of the time since February, while its moving average convergence divergence (MACD) is also in an oversold space. So given that XRP remains one of the strongest coins in the market in terms of fundamentals, it should pick up again strongly soon, assuming that t he Israel-Iran conflict doesn’t escalate further . With listed firms buying up XRP , with XRP ETFs on the way, and with Ripple expanding its business , the XRP price could easily reach $2.50 by the end of July and $3 by September. Bitcoin Hyper Gains Momentum with $1.4 Million Presale: Next 100x Coin? XRP continues to be a very strong altcoin, but traders should always consider diversifying into newer tokens, allocating a small percentage of their portfolios to coins that may show strong volatility. This should include presale tokens, which can often rally big when they list for the first time, especially if they’ve had successful raises. And one sale gaining steam right now belongs to Bitcoin Hyper (HYPER), an Ethereum- and Solana-based tokensed that has raised just over $1.4 million in its ICO. Bitcoin Hyper is quickly gaining momentum because of its exciting plans to launch a layer-two network for Bitcoin, providing the latter with a big boost in speed and scalability. It will make use of zero-knowledge proofs to provide greater efficiency and security, while it will also harness Ethereum and Solana virtual machines to achieve its greater throughput. On top of this, it’s planning to provide a platform for DEXes and DeFi applications, so that a thriving DeFi ecosystem can build on top of the Bitcoin base layer. Its native token HYPER will be necessary to pay for transactions, meaning that demand for the token will grow in step with the platform’s growth. Holders will also be able to stake it for a passive income, with investors able to buy it now by going to the Bitcoin Hyper website . It’s currently selling for $0.01195, although this will rise again later today. The post XRP Price Prediction: Analyst Declares ‘Only Two Paths Remain’ as XRP Tightens to Breaking Point appeared first on Cryptonews .",cryptonews,https://cryptonews.com/news/xrp-price-prediction-analyst-declares-only-two-paths-remain-as-xrp-tightens-to-breaking-point/,"ALTCOIN|BTC|MARKET|TRADING|XRP","Price Analysis|Price Prediction|Ripple|XRP",cryptocompare
2025-06-21T01:15:55,"Uncover the Truth Behind Bitcoin’s Cyclical Patterns","Bitcoin's cycle continues with influences from institutional investors and ETFs. New demand impacts, but market psychology retains core influence. Continue Reading: Uncover the Truth Behind Bitcoin’s Cyclical Patterns The post Uncover the Truth Behind Bitcoin’s Cyclical Patterns appeared first on COINTURK NEWS .",cointurken,https://en.coin-turk.com/uncover-the-truth-behind-bitcoins-cyclical-patterns/,"BTC|BUSINESS|MARKET","Cryptocurrency News",cryptocompare
2025-06-21T01:04:27,"AguilaTrades Increases BTC Long Position Above $400M Amid Price Drop to $102,340","According to data from Ember Monitor, AguilaTrades has notably expanded their long position on Bitcoin (BTC), now exceeding $400 million. This strategic move coincided with a BTC price decline from",coinotag,https://en.coinotag.com/breakingnews/aguilatrades-increases-btc-long-position-above-400m-amid-price-drop-to-102340/,"BTC|TRADING","BTC",cryptocompare
2025-06-21T01:00:26,"Analyst Warns Of XRP Trap — „You’re Being Played”","CryptoInsightUK’s latest market briefing arrives with the sound of literal hammer blows next door, an accidental soundtrack to the pounding he expects traders to take before the next rally. In a thirteen–minute walkthrough of XRP, Bitcoin and Ethereum liquidity maps, the British analyst argues that the market is staging what he calls “a deliberate trap” designed to flush out weak hands, harvest stop-loss orders and maximise upside leverage for larger players—leaving retail participants “screaming, ‘Yay, we’re going to the upside,’ … only to find out they’ve been played.” The Trap Is Set, Warns XRP Trader He begins with XRP’s five-month down-channel that started at the New-Year peak, noting that price continues to hug the underside of a descending trend line. “We’re stuck below that trend line basically looking to see if this liquidity is going to get taken below us. My obvious opinion is that it is,” he says, underscoring the conviction that a sweep of resting bids below remains the path of least resistance. The flush, he contends, would “make our journey to the upside much better and much easier to navigate,” because it would reset funding, scare out late longs and reload the order book for what he still calls the next “parabolic expansion probably up towards the $8 to $12 region.” Related Reading: ‘Out of Time’: XRP Consolidation Hits Final Moment, Analyst Alerts The trap, however, may not be a straightforward vertical collapse. Charts, he reminds viewers, “love doing something like” an initial breakout that rallies 15-20%, convinces traders the bear-phase is finished, and then abruptly reverses into the deep liquidity pocket below. “That’s exactly how higher-highs-and-higher-lows type situations are supposed to get you frustrated,” he says, openly conceding that the pattern looks engineered. The phrase he never uses—manipulation—hovers unspoken over the analysis, but his rhetoric leaves little doubt: “This is how they test everybody.” Bitcoin, in his narrative, may serve as the decoy that sets the trap. The benchmark asset has already slipped out of its own wedge-like consolidation and, he observes, “does like to do this sort of thing” by staging premature upside breaks. He sketches a possible march toward $115,000 that would “delay the inevitable” and then give way to a liquidity hunt of its own. Even so, his mid-cycle price band for Bitcoin remains $150,000 to $220,000. That upside, he argues, justifies dollar-cost-averaging into altcoins even while keeping “a tiny bit of dry powder” in reserve for the washout he expects. Related Reading: XRP 5-Wave Count Shows When The Price Will Hit All-Time Highs Above $5 A more elaborate scenario involves a temporary dominance surge in Bitcoin to the 66 to 74% range. As Bitcoin siphons capital, alts such as XRP would “bleed out,” take the downside liquidity target, and only then reverse as cash rotates back into their order books. He illustrates the dance on twin TradingView panels—Bitcoin on the left, XRP on the right—before concluding that the rotational setup is “not highly likely” because it requires several macro-scale dominoes to fall in sequence. Still, he refuses to dismiss it, pointing to the strategic reserve bill in Washington as the sort of narrative catalyst that could spark a temporary Bitcoin-only rally and demoralise alt-holders. Macro-risk flickers through the commentary—wars that could “shove us down” in the near term—but he treats geopolitical stress as a catalyst for final capitulation rather than a thesis-killer. “The upside is so large it almost can’t be ignored,” he insists, framing the present chop as a high-volatility pause before a structural up-leg. Whether that leg begins only after a full flush or emerges from yet another fake-out remains uncertain, but the analyst’s message is unmistakable: traders who chase breakouts without accounting for hidden hands risk being liquidated first, spectators to the parabola they hoped to ride. For now he is content to wait “for the market to do its worst trick,” believing that the final shakeout will announce itself through a sudden, depth-piercing wick. “You’re being played,” he warns. The admonition is stark: if the playbook unfolds as expected, the pain will be quick. “If we get these levels, that’s where I’m putting the last bit of my dry powder in. It’s $1.80-ish, $1.90 maybe.” At press time, XRP traded at $2.16. Featured image created with DALL.E, chart from TradingView.com",newsbtc,https://www.newsbtc.com/xrp-news/analyst-warns-of-xrp-trap-youre-being-played/,"BTC|FIAT|MARKET|TRADING|XRP","XRP News|xrp|xrp news|XRP Price|XRP Price Analysis|XRP Technical Analysis",cryptocompare
2025-06-21T01:00:17,"Bitcoin Takes a Breather While MAGACOIN FINANCE and Solana Shine Brighter","Intro: Market Rotations Put New Altcoins in Focus As Bitcoin steadies after a high-volatility run, traders are beginning to reallocate their attention — and capital — into newer, higher-potential altcoins. While legacy assets like XRP, Cardano, TRON, and Litecoin maintain their positions, it’s MAGACOIN FINANCE and Solana that are emerging as leaders in this new wave of market momentum. Bitcoin (BTC) Cools After Recent Rally Bitcoin has taken a step back this week, consolidating after weeks of bullish action. Without a strong macroeconomic catalyst or breakout headline, BTC appears to be in a pause phase. Many investors are holding long-term, but traders looking for faster ROI are rotating out of Bitcoin and into assets showing more immediate traction and structural benefits. MAGACOIN FINANCE: Where Smart Traders Are Moving Now While older assets tread water, MAGACOIN FINANCE is gaining strong traction — and doing so with substance behind the hype. Here’s why it’s drawing capital quickly: 170B Fixed Supply: No future dilution or inflation. Staking Is Live: Traders can lock in passive rewards while holding. HashEx-Audited: The project has cleared a full security audit. No VC Control: Community-driven, with zero centralized ownership traps. On-Chain Strength: Wallet growth and long-hold behaviors continue to rise. Bonus Offer Active: The PATRIOTS100X bonus gives early buyers extra leverage before listings arrive. As the broader market steadies, MAGACOIN FINANCE is proving it has more than potential — it has the behavior, structure, and timing that typically precede breakout runs. Solana (SOL) Sustains Ecosystem Leadership Solana continues to rank among the most active blockchains by daily transactions and user activity. Its thriving ecosystem across NFTs, gaming, and decentralized apps has helped it remain relevant even in market lulls. While SOL hasn’t posted a dramatic price jump recently, its steady technical strength keeps it high on the list for altcoin exposure. XRP Eyes Resolution But Moves Cautiously XRP is still waiting on regulatory clarity, with the joint motion to release $125 million from escrow signaling that the SEC case may soon reach its conclusion. While this has sparked optimism, traders remain cautious due to the token’s sensitivity to legal headlines. The potential for an ETF or integration with SWIFT remains, but timing remains uncertain, prompting some capital outflow into earlier-stage coins. Cardano (ADA) Faces Community Confidence, Price Hesitation Cardano continues to build through its developer community, with founder Charles Hoskinson maintaining visibility. Still, ADA’s price remains closely tied to the overall market and has not generated its own breakout narrative in this cycle. It remains a long-term favorite, but in the short term, its momentum is flat, causing some traders to explore alternatives. TRON (TRX) Keeps Stability But Lacks Excitement TRON remains a strong network for stablecoins and high-frequency transactions, and Justin Sun continues to push updates and global partnerships. However, TRX hasn’t seen much volatility or growth this month. It is viewed as a stable layer, but traders looking for explosive upside are rotating to assets with more dynamic incentive models. Litecoin (LTC) Struggles for Relevance Litecoin has historically been called the silver to Bitcoin’s gold, but recent market activity has left LTC in the background. Without new technical developments or major ecosystem updates, it’s seen largely as a legacy hold — not a growth vehicle — and traders are beginning to overlook it during active rotation cycles. Final Thoughts Bitcoin is taking a well-earned pause, and while Solana maintains strong traction, it’s MAGACOIN FINANCE that is turning heads for those chasing early-entry upside. Meanwhile, XRP, Cardano, TRON, and Litecoin continue to hold their lanes — but lack the same urgency or structure that’s driving attention toward this new contender. For more information about MAGACOIN FINANCE, please visit: Website: https://magacoinfinance.com Exclusive Access: https://magacoinfinance.com/buy-maga Continue Reading: Bitcoin Takes a Breather While MAGACOIN FINANCE and Solana Shine Brighter",bitcoinsistemi,https://en.bitcoinsistemi.com/bitcoin-takes-a-breather-while-magacoin-finance-and-solana-shine-brighter/,"ADA|BTC|LTC|SOL|TRADING","Sponsored",cryptocompare
2025-06-21T01:00:10,"Smarter Web Company’s stock rallies by 43% after its Bitcoin stash hits $36M","Bitcoin treasury mania has hit the United Kingdom.",ambcrypto,https://ambcrypto.com/smarter-web-companys-stock-rallies-by-43-after-its-bitcoin-stash-hits-36m/,"BTC|BUSINESS|REGULATION","Bitcoin|BTC Trading View|News|News 1|Social|Trading View",cryptocompare
2025-06-21T00:40:58,"Bloomberg Analysts Raise Bitcoin Physically-Backed ETF Approval Odds to Over 90% Amid SEC Optimism","Bloomberg analysts Eric Balchunas and James Seyffart have increased the likelihood of approval for most physically-backed crypto ETFs to over 90%, highlighting the U.S. SEC’s constructive engagement as a pivotal",coinotag,https://en.coinotag.com/breakingnews/bloomberg-analysts-raise-bitcoin-physically-backed-etf-approval-odds-to-over-90-amid-sec-optimism/,"BTC|REGULATION","BTC",cryptocompare
2025-06-21T00:30:40,"Google Gemini Predicts Shiba Inu (SHIB) Price for July 1, 2025","As the crypto market navigates another wave of uncertainty, attention has turned to Shiba Inu (SHIB), the popular meme coin currently trading between $0.0000117 and $0.000012 as of June 20, 2025. With July just nine days away, investors and enthusiasts alike are curious about what lies ahead. To provide a data-informed forecast, we turned to Google Gemini, one of the most advanced AI models, to predict SHIB’s potential price movement by July 1, 2025, based on recent technical and market trends. SHIB’s Current Market Landscape Over the last month, SHIB has experienced a noticeable decline, dropping between 19% and 21%. Even over the past week, the asset has shown a slight downturn, ranging from 0.7% to 11%. Despite this bearish stretch, SHIB appears to be holding its ground above a key support level near $0.000011. This has led to early signs of buyer accumulation, as traders begin to see potential value at current price levels. A notable development on SHIB’s price chart is the emergence of a falling wedge pattern, a structure commonly viewed as a precursor to a bullish breakout. Meanwhile, order book data from exchanges shows that buy orders currently outweigh sell orders—another subtle indicator of a possible trend reversal forming beneath the surface. Technical Barriers and Bearish Pressure Despite encouraging signs of accumulation, SHIB still faces significant technical resistance. It remains below its 50-day, 100-day, and 200-day moving averages—both simple and exponential—levels that typically mark bearish dominance. There’s also concern that a death cross may be forming, a signal that occurs when short-term averages cross below long-term ones, often interpreted as a warning of continued downward momentum. At this point, market sentiment around SHIB is largely described as “neutral” to “bearish.” Traders appear cautious, awaiting a clear technical or fundamental catalyst to shift the short-term outlook. Google Gemini’s Price Forecast for July 1, 2025 Using all of this recent data, Google Gemini provided three distinct price projections based on possible short-term market outcomes: Conservative Scenario: Stabilization Without a Catalyst In a muted environment where no significant market-wide or SHIB-specific catalyst appears, Gemini suggests SHIB may continue consolidating above its current support. We are on twitter, follow us to connect with us :- @TimesTabloid1 — TimesTabloid (@TimesTabloid1) July 15, 2023 Price action is expected to remain range-bound, possibly reclaiming minor resistance around $0.000012 but lacking the momentum to push significantly higher. In this case, the price is likely to hover between $0.000012 and $0.0000125. Moderate Scenario: Technical Recovery Begins In this scenario, the falling wedge begins to play out as a bullish reversal, with accumulation strengthening and perhaps minor positive developments within the Shiba Inu ecosystem, such as updates to Shibarium adding momentum. If SHIB can begin reclaiming some of its moving averages, Google Gemini projects a modest yet meaningful move higher, placing the expected price range between $0.0000125 and $0.000014 by July 1. Bullish Scenario: Breakout Triggered by Major Catalyst A stronger, more optimistic outcome would require a significant trigger, such as a large token burn, a breakthrough development in Shibarium, or an overall rally in the crypto market, especially led by Bitcoin and Ethereum. In such a case, SHIB would likely break decisively from the falling wedge, push above the 200-day EMA, and aim to reclaim the highs it saw earlier in May or June. Under these conditions, Gemini forecasts the price could rise sharply to anywhere between $0.0000145 and $0.000017. Final Thoughts Shiba Inu’s path over the next nine days remains closely tied to both technical structures and broader market behavior. While current trends lean slightly bearish, underlying signals such as buyer interest and chart patterns suggest the possibility of a short-term recovery. Ultimately, according to Google Gemini, SHIB’s price by July 1 will depend heavily on whether accumulation continues, resistance levels are broken, and any fresh catalyst ignites momentum. In a quiet market, SHIB may remain stable with modest gains. But if the right conditions align, the meme coin could surprise traders with a sharp upside move. Disclaimer : This content is meant to inform and should not be considered financial advice. The views expressed in this article may include the author’s personal opinions and do not represent Times Tabloid’s opinion. Readers are urged to do in-depth research before making any investment decisions. Any action taken by the reader is strictly at their own risk. Times Tabloid is not responsible for any financial losses. Follow us on Twitter , Facebook , Telegram , and Google News The post Google Gemini Predicts Shiba Inu (SHIB) Price for July 1, 2025 appeared first on Times Tabloid .",timestabloid,https://timestabloid.com/google-gemini-predicts-shiba-inu-shib-price-for-july-1-2025/,"BTC|BUSINESS|MARKET|SHIB|TRADING","Cryptocurrency|News|SHIB|SHIB Price|SHIB Price Prediction|Shiba Inu",cryptocompare
2025-06-21T00:29:59,"Bitcoin Derivatives Show Caution Despite Strong Institutional Inflows to Spot BTC ETFs","Bitcoin derivatives traders exhibit caution as the futures premium hits a three-month low despite steady spot ETF inflows. Options market sentiment turns bearish amid macroeconomic uncertainties, contrasting with resilient institutional",coinotag,https://en.coinotag.com/bitcoin-derivatives-show-caution-despite-strong-institutional-inflows-to-spot-btc-etfs/,"BTC|MARKET|TRADING","Bitcoin|News|BTC",cryptocompare
2025-06-21T00:22:20,"Bitcoin futures premium falls to 3-month low despite strong BTC ETF inflows","Bitcoin derivatives traders turned cautious, despite steady inflows to the spot BTC ETFs.",cointelegraph,https://cointelegraph.com/news/bitcoin-futures-premium-falls-to-3-month-low-despite-strong-btc-etf-inflows?utm_source=rss_feed&utm_medium=rss%3Ftimestamp%3D1750465477963%26_ts%3D1750465477963%26rand%3D0.9021166216287124&utm_campaign=rss_partner_inbound,"BTC","",cryptocompare
