datetime,headline,summary,source,url,categories,tags,api_source
2025-06-21T16:55:54,"Federal Reserve Governor Says Interest Rate Cuts Could Materialize As Early as July","Rate cuts could materialize earlier than consensus expectations, according to Federal Reserve Governor Christopher Waller. In a new interview with CNBC, Waller says the Federal Open Market Committee (FOMC) could slash the federal funds rate as soon as July. “Any tariff inflation we should see, and I’ve been given various estimates, and I don’t think it’s going to be that big, and we should just look through it in terms of setting policy and look at the underlying trend of inflation. And right now, the data the last few months is showing that trend inflation is looking pretty good, even on a 12-month basis, so I’ve labeled these ‘good news rate cuts,’ if inflation comes down to target, we can actually bring rates down. I’ve been saying this since around November of ’23. So I think we’re in that position that we could do this as early as July.” Waller does say that’s just his view and acknowledges the FOMC might not share that opinion. The FOMC announced on Wednesday that it planned to maintain the target range for the federal funds rate at 4.25-4.5%, arguing that it was the most suitable level to achieve both maximum employment and controlled inflation. The Fed has held interest rates steady since December, when it cut the rate by 0.25%. CME Fed Watch tool indicates there’s only a 14.5% chance of a rate cut in July but a 61.8% chance of one at the FOMC’s meeting in September. Follow us on X , Facebook and Telegram Don't Miss a Beat – Subscribe to get email alerts delivered directly to your inbox Check Price Action Surf The Daily Hodl Mix Disclaimer: Opinions expressed at The Daily Hodl are not investment advice. Investors should do their due diligence before making any high-risk investments in Bitcoin, cryptocurrency or digital assets. Please be advised that your transfers and trades are at your own risk, and any losses you may incur are your responsibility. The Daily Hodl does not recommend the buying or selling of any cryptocurrencies or digital assets, nor is The Daily Hodl an investment advisor. Please note that The Daily Hodl participates in affiliate marketing. Generated Image: DALLE3 The post Federal Reserve Governor Says Interest Rate Cuts Could Materialize As Early as July appeared first on The Daily Hodl .",dailyhodl,https://dailyhodl.com/2025/06/21/federal-reserve-governor-says-interest-rate-cuts-could-materialize-as-early-as-july/,"BTC|BUSINESS|FIAT|MARKET|TRADING","Regulators|Christopher Waller|Federal Reserve|interest rates|News|rate cut",cryptocompare
2025-06-21T16:48:46,"JPMorgan Chase Refuses to Reimburse Customer After Scammers Drain $32,000 by Posing As Bank Employees: Report","A 28-year-old teacher says JPMorgan Chase is refusing to make him whole after scammers pretending to work at the bank stole $32,000. Texas resident Russell Leahy says he lost the money to thieves who claimed to be Chase Bank representatives, reports the ABC-affiliated news station WFAA. Leahy says he got a phone call from the impostors who warned him that his account was flashing suspicious activity and that he needed to relocate his funds for security purposes. He says he followed the thieves’ instructions after seeing text messages and banking details that appeared to support their claims. “I couldn’t even believe how sophisticated it was.” Leahy, who had been saving up for years in hopes of starting a family with his wife, says the fraudsters drained his entire life savings, $32,000, from his account. “I had literally never felt like the wind had been taken out of my sails before. I’d never really felt like I was going to pass out before, but it really felt like the end of the world for me.” When JPMorgan Chase learned of the incident, the bank decided to send Leahy $2,000 – just 6.25% of the money that he lost. According to the banking giant, Leahy’s case does not qualify for fraud protection, leaving him to shoulder most of the losses. In a statement to WFAA, JPMorgan Chase draws a distinction between scams and fraud. “Fraud on a bank account involves someone illegally accessing someone else’s account and making withdrawals, transfers, or purchases without the account holder’s permission. [A scam] is a deceptive scheme or trick used to cheat someone out of their money or other valuable assets. Scammers often use false promises, misleading information, or deceptive activities to manipulate victims into giving up something of value. Scams can take many forms, including counterfeit or non-existent products sold on social media marketplaces, phishing emails, fake websites, spoofed Caller IDs on mobile phones, fake profiles on dating sites, fake jobs on job boards, among others.” Follow us on X , Facebook and Telegram Don't Miss a Beat – Subscribe to get email alerts delivered directly to your inbox Check Price Action Surf The Daily Hodl Mix Disclaimer: Opinions expressed at The Daily Hodl are not investment advice. Investors should do their due diligence before making any high-risk investments in Bitcoin, cryptocurrency or digital assets. Please be advised that your transfers and trades are at your own risk, and any losses you may incur are your responsibility. The Daily Hodl does not recommend the buying or selling of any cryptocurrencies or digital assets, nor is The Daily Hodl an investment advisor. Please note that The Daily Hodl participates in affiliate marketing. Generated Image: Midjourney The post JPMorgan Chase Refuses to Reimburse Customer After Scammers Drain $32,000 by Posing As Bank Employees: Report appeared first on The Daily Hodl .",dailyhodl,https://dailyhodl.com/2025/06/21/jpmorgan-chase-refuses-to-reimburse-customer-after-scammers-drain-32000-by-posing-as-bank-employees-report/,"BTC|BUSINESS|FIAT|TRADING","Scams, Hacks & Breaches|Bank Scam|JPMorgan Chase|News|Scams|US Bank",cryptocompare
2025-06-21T16:44:38,"Solana's SOL Holds $140 Support as Reversal Pattern Gains Strength","Solana's native token, SOL SOL, is trading at $140.46, down 1.41% over the past 24 hours, after recovering from a sharp 4.9% decline that took the price from $142.91 to $135.96, according to CoinDesk Research's technical analysis model. The asset has since stabilized between $140 and $142, with support forming at $140.40. Solana’s ecosystem continues to grow, with recent announcements including support for wrapped Bitcoin (WBTC) on the network. Analysts remain divided on the outlook, with some pointing to a potential move toward $200, while others expect a retracement to the $123–$135 range. Technical Analysis Highlights SOL declined 4.9% from $142.91 to $135.96, establishing a 7.08-point trading range. The asset recovered to form a consolidation pattern between $140 and $142. High-volume support appeared at $140.40 during the 13:00 hourBetween 14:32 and 14:37, SOL surged from $140.48 to $141.40. Selling pressure pushed the price down to $140.32, then to a session low of $140.29. A descending channel formed with lower highs and lower lowsResistance at $142.65 capped price action twice. Concentrated selling volume occurred during the 15:10 candle, suggesting near-term bearish sentiment Disclaimer: Parts of this article were generated with the assistance from AI tools and reviewed by our editorial team to ensure accuracy and adherence to our standards . For more information, see CoinDesk's full AI Policy .",coindesk,https://www.coindesk.com/markets/2025/06/21/solana-s-sol-holds-usd140-support-as-reversal-pattern-gains-strength,"BTC|MARKET|SOL|TRADING|RESEARCH","Markets|AI Market Insights|Technical Analysis|Solana|SOL|News",cryptocompare
2025-06-21T16:32:50,"Solana Faces Potential $120 Decline Amid Bearish Patterns, While Onchain Data Suggests Long-Term Resilience","Solana (SOL) faces a potential price correction to $120 amid bearish technical signals, yet strong onchain metrics suggest resilient fundamentals. The head-and-shoulders pattern on SOL’s daily chart indicates a possible",coinotag,https://en.coinotag.com/solana-faces-potential-120-decline-amid-bearish-patterns-while-onchain-data-suggests-long-term-resilience/,"BTC|MARKET|SOL|TRADING","Analysis|Bitcoin|News|BTC|SOL",cryptocompare
2025-06-21T16:32:43,"Making Wealth Fairer: TUIMAX Breaks Financial Barriers with Blockchain","The traditional financial system has evolved for over a century, yet fair access to financial services remains an unfulfilled promise. According to the World Bank, more than 1.7 billion adults around the world still lack access to a bank account, and hundreds of millions more are excluded from even the most basic financial tools. In response, TUIMAX is leveraging blockchain and crypto assets to build a more inclusive global financial system. TUIMAX is a crypto asset platform driven by a vision of “inclusive finance.” Headquartered in Singapore and licensed by FinCEN with a U.S. MSB registration, TUIMAX has remained committed to the principle of “technology for good” since its inception. The platform aims to use blockchain technology to connect marginalized communities and dismantle the geographic and systemic barriers imposed by traditional finance. TUIMAX’s mission is carried out through three main initiatives: 1. Creating Accessible Financial Accounts Unlike traditional banks that require cumbersome paperwork and charge high fees, TUIMAX allows users to register in just 10 seconds and begin managing assets within 5 minutes. The platform provides a free basic digital wallet supporting stablecoins and major assets like USDT, BTC, and ETH, making it easy even for first-time crypto users to get started. 2. Delivering Tailored Education for Emerging Markets TUIMAX has launched multilingual crypto literacy programs in collaboration with local universities and nonprofits in countries such as the Philippines, Nigeria, and India. These include in-person courses and an online learning platform focused on introductory crypto finance. Every user also receives a simplified “Beginner’s Investment Guide” and access to one-on-one customer support. 3. Empowering Users Through Community Governance TUIMAX has implemented an “On-Chain Community Points System” that rewards users for participating in project voting, submitting suggestions, referring others, or completing learning tasks. Points can be redeemed for tokens, fee discounts, or early access to project testing. This mechanism encourages users to evolve from passive participants into active contributors and co-builders of the ecosystem. “We’re not just here to offer trading tools,” said the TUIMAX co-founder, “we’re here to build a truly decentralized financial ecosystem that’s based on trust, accessibility, and usability.” Looking ahead, TUIMAX plans to further strengthen its local presence in underbanked regions and roll out new modules such as an “On-Chain Identity System” and “Mobile Banking Solutions,” giving more people the right to financial freedom in the digital age. Visit us Disclaimer : This content is meant to inform and should not be considered financial advice. The views expressed in this article may include the author’s personal opinions and do not represent Times Tabloid’s opinion. Readers are urged to do in-depth research before making any investment decisions. Any action taken by the reader is strictly at their own risk. Times Tabloid is not responsible for any financial losses. The post Making Wealth Fairer: TUIMAX Breaks Financial Barriers with Blockchain appeared first on Times Tabloid .",timestabloid,https://timestabloid.com/making-wealth-fairer-tuimax-breaks-financial-barriers-with-blockchain/,"ASIA|BLOCKCHAIN|BTC|FIAT|TECHNOLOGY","Finance",cryptocompare
