datetime,headline,summary,source,url,categories,tags,api_source
2025-06-21T16:00:33,"Dogecoin Faces Pressure, Cardano Shifts Strategy, and Cold Wallet Gains as Best Crypto Coin to Buy","Three different moves in the crypto market are shaping investor focus. Dogecoin (DOGE) is testing the $0.17 level again as interest in meme-coins cools. Cardano (ADA) is planning a $100 million shift from its treasury into stablecoins and Bitcoin to help grow its slow DeFi sector. However, Cold Wallet (CWT) is showing a different kind of progress. It offers cold-storage security with a simple, chat-style layout and is already usable. At a presale price of $0.00906, it is positioning itself as the best crypto coin to buy for users who value strong privacy and real control. Dogecoin Nears Key Level: Can $0.17 Hold This Time? Dogecoin (DOGE) recently dropped under $0.20, raising new questions about its short-term support. The $0.17 zone is now being tested, and the overall trend in meme coins is adding more pressure. Some analysts view the dip below $0.20 as a possible entry point, with a chance for a bounce if enough buying returns around $0.17 to $0.18. But if that support breaks, deeper losses could follow. A quick rebound off $0.17 might trigger a strong rally as sentiment shifts. Dogecoin still has a large user base, and public attention can change fast. For those open to risk, this moment may offer short-term upside if price action holds. Can Cardano’s $100M Liquidity Plan Spark DeFi Growth? Cardano is preparing to shift $100 million in ADA from its treasury into Bitcoin and stablecoins. The goal is to strengthen its DeFi sector and improve stablecoin access on the network. At present, only about 10% of Cardano’s DeFi total value is held in stablecoins, well behind Ethereum and Solana. Supporters say this move could help grow liquidity and bring returns to the treasury without inflating ADA’s supply. The transition would be done in phases, using tools like time-weighted average pricing and private trades. Some warn this could pressure ADA’s price, but Charles Hoskinson believes the market can absorb the impact. For those watching Cardano’s DeFi space, this plan could mark an important step. A stronger link to stablecoins and Bitcoin may improve adoption and bring more use to its network. Cold Wallet Builds a New Way to Manage Crypto with Privacy in Mind Most crypto wallets are built for desktops and full dashboards, but many users are on mobile and want simplicity. Instead of tabs, charts, and extra plugins, Cold Wallet offers a layout that feels like a chat app. Behind that simple interface is cold storage-grade encryption. Every action is on-chain, encrypted, and kept away from central servers. There’s no need to jump between apps or use browser extensions. With Cold Wallet, users type a command, and it processes securely. The layout is simple, but the tech behind it is strong. There is no data tracking and no exposure of private keys. For those who care about privacy but do not want complex apps, Cold Wallet offers a direct option. At a presale price of $0.00906 in stage 14, it could be the right time to look closer. Cold Wallet is not just another crypto tool. It’s a new way to think about safe and easy crypto access on mobile. Comparing Cold Wallet to DOGE and ADA for 2025 Utility and Strength Dogecoin (DOGE) is showing weak support levels. Cardano (ADA) is working on rebuilding its DeFi presence through a large liquidity plan. Cold Wallet (CWT), by contrast, is not waiting on market trends or upgrades. It already functions with strong privacy and a mobile-first layout that focuses on ease of use. Cold Wallet blends high-level encryption with an interface that feels familiar and easy to manage. It is the first wallet that connects strong protection with a layout designed for comfort. As other crypto assets face uncertainty, CWT offers something already working. With the stage 14 presale price set at $0.00906, the timing may be important. For users focused on practical tools and data privacy, Cold Wallet stands out. It may be the best crypto coin to buy for those who value function over hype in 2025. Explore Cold Wallet Now: Presale: https://purchase.coldwallet.com/ Website: https://coldwallet.com/ X: https://x.com/ColdWalletToken Telegram: https://t.me/ColdWalletTokenOfficial The post Dogecoin Faces Pressure, Cardano Shifts Strategy, and Cold Wallet Gains as Best Crypto Coin to Buy appeared first on TheCoinrise.com .",thecoinrise,https://thecoinrise.com/dogecoin-faces-pressure-cardano-shifts-strategy-and-cold-wallet-gains-as-best-crypto-coin-to-buy/,"ADA|BTC|DOGE|MARKET|TRADING","Token Presale and ICO Insights|Cold Wallet",cryptocompare
2025-06-21T15:59:47,"Here Are Predicted Timelines for $10K in XRP to Turn $1 Million","Several experts in the crypto space have teased a future where XRP holders become millionaires from modest investments. XRP has held the $2 price level for the past six months. While this marks a massive 336% increase from its earlier $0.50 range, many believe XRP is still far from its ""destined"" valuation.Popular price forecasts place XRP’s potential between $10 and $100, with some ambitious projections even suggesting the $1,000 price level. Amid widespread optimism about XRP, this analysis explores how and when a $10,000 investment in XRP today could grow to make holders millionaires.How $10K in XRP Can Reach $1 MillionAt the time of writing, XRP is trading at $2.10. A $10,000 investment would purchase approximately 4,762 XRP tokens. For this portfolio to reach $1 million in value, XRP would need to increase by 9,900%.This would require XRP’s unit price to hit $210. Accordingly, anyone holding at least 4,762 tokens would see their portfolio enter the million-dollar range.While the journey to $210 seems formidable, XRP delivered an even more dramatic surge during the 2017–2018 cycle, rising by over 700 times its value.However, XRP’s market capitalization has expanded significantly since then, and a full repeat of that historic performance in a single cycle is highly debated. For context, at a $210 price point, XRP’s market cap would exceed $12.3 trillion. This would surpass the combined valuations of major tech firms like Apple, Google, and NVIDIA. As a result, market watchers have varying opinions on when such a scenario might materialize.When XRP Price Could Reach $200+: Five Distinct TimelinesLast year, analyst Javon Marks suggested that XRP’s breakout from its largest-ever coil pattern indicated a potential run to $200. According to Marks, XRP’s seven-year consolidation from 2017 to 2024 mirrors a 2014–2017 pattern that preceded a rally to $3.84.While he slightly revised his expectations for 2025, he maintains a triple-digit price outlook for XRP this cycle. If this scenario holds, a $10K investment in XRP could approach $1 million. Other commentators in the XRP community share this perspective, with some projecting even higher prices, such as $305. However, research-based predictions from platforms like Telegaon and Changelly suggest XRP may take several years to reach the $200 price point required to turn $10K into $1 million.Specifically, Telegaon projects that XRP may not reach $236 until 2050, 25 years from now. Changelly offers a more optimistic timeline, estimating XRP could reach the $200 level between 2034 and 2040, up to 15 years from now.Many in the crypto community reject these longer timelines, dismissing them as pessimistic. Some suggest they likely originate from ""Bitcoin maxis"" unwilling to acknowledge XRP’s potential.Meanwhile, XRP enthusiasts take solace in a prediction by prominent analyst BarriC. He forecasts that XRP could reach $200 between 2032 and 2033.Interestingly, Matthew Brienen, COO of CryptoGuard, argues that XRP could reach $1,000 as early as 2035. This implies that he expects XRP to hit $200 much earlier.",thecryptobasic,https://thecryptobasic.com/2025/06/21/here-are-predicted-timelines-for-10k-in-xrp-to-turn-1-million/?utm_source=rss&utm_medium=rss&utm_campaign=here-are-predicted-timelines-for-10k-in-xrp-to-turn-1-million,"BTC|MARKET|TRADING|XRP","Market|Latest XRP (Ripple) News Today|XRP Price Prediction",cryptocompare
2025-06-21T15:58:25,"Here’s XRP Price If XRP ETFs Get 35% of Bitcoin ETF Flows, as Bloomberg Now Pegs Approval Odds at 95%","XRP might be looking at a massive price rally if spot XRP ETFs pull in even a slice of the capital that has poured into Bitcoin ETF products. Most recently, Bloomberg ETF analysts Eric Balchunas and James Seyffart confirmed that they have updated the chances of an XRP ETF approval to 95%. This has further triggered excitement about what that could mean for XRP's price.XRP Price if XRP ETFs Attract 35% of Bitcoin ETF InflowsNotably, if XRP ETFs attract a small fraction, say 35% of the net flows that Bitcoin ETFs have pulled in since launching in January 2024, our calculations indicate that XRP price could reach nearly $30. To put things into perspective, Bitcoin ETFs have seen $46.66 billion in net inflows since their launch. If XRP manages to pull in 35% of that, it will record about $16.331 billion in netflows. Such a development would have a tremendous impact on prices.Importantly, in market valuations, price doesn't rise one-for-one with capital inflows. Instead, traders use multipliers to estimate how inflows affect market cap. Some past multipliers reached 674x .However, for the sake of achieving a conservative estimate, we leveraged a more modest 100x multiplier, which gives a clearer picture without overhyping. At that rate, $16.331 billion in ETF inflows would add $1.633 trillion to XRP's value.Right now, XRP has a market cap of $125.87 billion and trades at $2.13, with a circulating supply of 58.93 billion tokens. If you add $1.633 trillion to its current market cap, the total jumps to $1.759 trillion. That puts XRP's projected price at $29.89 per token, nearly $30, considering the current circulating supply.Updates Surrounding XRP ETFsNotably, this scenario feels more realistic now that expectations around XRP ETF approvals have jumped. Bloomberg's Seyffart and Balchunas recently pointed to ongoing engagement from the U.S. SEC and said they believe approval will come; it's just a matter of time. Traders also show strong confidence on prediction platforms like Polymarket, where odds of an XRP ETF approval in 2025 have jumped to around 88%. XRP ETFs Approval Odds Polymarket XRP ETFs Approval Odds | Polymarket Institutional interest has also picked up. At press time, 2025, several major players, including Franklin Templeton, 21Shares, and Bitwise, have already filed applications for spot XRP ETFs, and those filings now sit under SEC review.Franklin Templeton's proposal has drawn the most attention. The firm filed in March 2025, and while the SEC recently delayed its decision again, the move followed standard procedure. The agency also opened a public comment window, giving investors until late July to weigh in on proposed rule changes.Meanwhile, Canada has already moved ahead . This week, the Toronto Stock Exchange rolled out three spot XRP ETFs, showing that global demand for regulated XRP investment products is real and growing.If U.S. regulators follow Canada's lead and XRP ETFs pick up just part of the traction Bitcoin ETFs have seen, XRP could be in for one of the biggest moves in its history.",thecryptobasic,https://thecryptobasic.com/2025/06/21/heres-xrp-price-if-xrp-etfs-get-35-of-bitcoin-etf-flows-as-bloomberg-now-pegs-approval-odds-at-95/?utm_source=rss&utm_medium=rss&utm_campaign=heres-xrp-price-if-xrp-etfs-get-35-of-bitcoin-etf-flows-as-bloomberg-now-pegs-approval-odds-at-95,"BTC|MARKET|REGULATION|TRADING|XRP","Market|Latest XRP (Ripple) News Today|Latest XRP ETF News Market Insights|XRP Price Prediction",cryptocompare
2025-06-21T15:37:50,"Bitcoin Knots Chain Split May Influence Bitcoin Stability and Blockchain Development Insights","Bitcoin Knots, a lesser-known Bitcoin client, recently experienced a chain split that raised questions about network stability and market impact. Despite the incident, Bitcoin’s price remained stable, reflecting the resilience",coinotag,https://en.coinotag.com/bitcoin-knots-chain-split-may-influence-bitcoin-stability-and-blockchain-development-insights/,"BLOCKCHAIN|BTC|MARKET|TRADING|FORKS","News|BTC|Core",cryptocompare
2025-06-21T15:36:09,"Crypto Analyst Sets Expectations for Solana, Bitcoin, and Ethereum","Altcoin Sherpa predicts moderate near-term movements for Solana, Bitcoin, and Ethereum. Solana's notable past surges seem unlikely, while Bitcoin approaches potential breakout. Continue Reading: Crypto Analyst Sets Expectations for Solana, Bitcoin, and Ethereum The post Crypto Analyst Sets Expectations for Solana, Bitcoin, and Ethereum appeared first on COINTURK NEWS .",cointurken,https://en.coin-turk.com/crypto-analyst-sets-expectations-for-solana-bitcoin-and-ethereum/,"ALTCOIN|BTC|ETH|SOL","Bitcoin (BTC)|Ethereum (ETH)",cryptocompare
2025-06-21T15:35:46,"US Rumors on Seizing Ripple’s XRP Escrow for National Reserve Remain Unconfirmed","Recent speculation suggests the U.S. government may seize Ripple’s XRP escrow holdings to bolster national financial reserves, sparking widespread discussion across crypto communities. Despite recurring XRP escrow releases by Ripple,",coinotag,https://en.coinotag.com/us-rumors-on-seizing-ripples-xrp-escrow-for-national-reserve-remain-unconfirmed/,"ADA|BTC|FIAT|XRP|FLOW","News|Ripple|ADA|BTC|FLOW|SOL|XRP",cryptocompare
2025-06-21T15:33:48,"Immutable May Retain NFT Market Lead Despite Sales Decline Amid Ethereum and Polygon Shifts","The NFT market has seen a significant downturn this week, with sales volume dropping 18.43% to $116.9 million, signaling a shift in market momentum. Despite the decline in sales, participation",coinotag,https://en.coinotag.com/immutable-may-retain-nft-market-lead-despite-sales-decline-amid-ethereum-and-polygon-shifts/,"BTC|ETH|MARKET|MATIC|IMX","Ethereum|News|BTC|ETH|IMX|MATIC|SOL",cryptocompare
2025-06-21T15:30:13,"Bitcoin Price Breakdown Spurs Sell-Offs, Analyst Reveals What Will Happen If BTC Hits 92,800","The Bitcoin price crashed from as high as $106,000 to $102,000 on June 20, sparking sell-offs among investors. Now, crypto analyst Colin has indicated that the flagship crypto could still drop to as low as $92,800 and revealed what will happen if BTC gets there. The Current Bitcoin Price Action And What To Expect In an X post, Colin said that it looks increasingly likely that the Bitcoin price will see a retest of at least 100,800 as the first major level of support. The analyst made this statement as BTC dropped out of a bullish pennant for a second time. The measured target for this bull pennant is $150,000. Related Reading: Analyst Says Bitcoin Price Could Rise 3x To $300,000 As AVIV Levels Resemble Previous Bull Cycles However, with the most recent breakdown, the Bitcoin price threatens to decline further before any potential move to the upside. Colin stated that the next major levels below $100,800 are $97,600 and $92,800. He opined that BTC is likely to quickly rebound from these support levels if it gets there. The crypto analyst remarked that this Bitcoin price movement is all possible within the confines of the right shoulder of the larger inverse Head-and-Shoulders pattern. He added that this can make the right shoulder more complete, basically on the same level as the left shoulder. This analysis comes just a day after Colin revealed that BTC has deviated from the global M2 money supply. However, he suggested that the BTC bull market is far from over. The analyst noted that the deviation happens 20% of the time and doesn’t invalidate the macro trend. Basically, the Bitcoin price is primed to rally higher at some point and possibly reach the $150,000 measured target. Market expert Raoul Pal also commented on BTC’s correlation with the money supply, stating that it shows that there is no need to worry about the current price action. Bulls Need To Step In For BTC In an X post, crypto analyst Titan of Crypto stated that the Bulls need to step in now for the Bitcoin price. He noted that BTC is facing a key test, having just been rejected at the Fair Value Gap at around $106,000. The analyst added that the flagship crypto is now retesting the lower boundary of the symmetrical triangle. Related Reading: Analyst Says Bitcoin Price Could Rise 3x To $300,000 As AVIV Levels Resemble Previous Bull Cycles Titan of Crypto stated that if this lower boundary at around $104,000 fails, then the next level would be the previous weekly low at $102,679. If the Bitcoin price fails to hold that level, it could further drop to the liquidity pocket near $100,300. At the time of writing, the Bitcoin price is trading at around $103,500, down in the last 24 hours, according to data from CoinMarketCap. Featured image from Getty Images, chart from Tradingview.com",newsbtc,https://www.newsbtc.com/news/bitcoin/if-bitcoin-hits-92800/,"BTC|BUSINESS|MARKET|SPONSORED|TRADING","Bitcoin|bitcoin|Bitcoin news|bitcoin price|btc|BTC news|btc price|btcusd|BTCUSDT|CoinMarketCap|Colin|Fair Value Gap|Global M2 Money Supply|Raoul Pal|symmetrical triangle|Titan Of Crypto",cryptocompare
2025-06-21T15:28:22,"Companies Are Racing to Build Bitcoin Treasuries","Several non-crypto companies are emulating MicroStrategy by buying and storing bitcoin, driving a dramatic 170% rise in corporate-held BTC. Altogether, around 130 public companies now own roughly 3.2% of bitcoin’s total supply. • MicroStrategy (now “Strategy”): Founder Michael Saylor set the trend in August 2020 when his firm started selling shares to buy bitcoin. Their market cap soared beyond the value of their holdings. Now with 592,100 BTC, they continue issuing equity and debt—$42 billion planned over three years—to accumulate more, confident they can weather even a 90% drop. • Twenty One Capital: This new firm emerged in May via a SPAC merger, backed by Tether and SoftBank. With about 37,230 BTC (worth nearly $3.9 billion), it aims to rival Strategy as the leading listed bitcoin accumulation vehicle. • Tesla: Elon Musk’s company first bought $1.5 billion in bitcoin in 2021, briefly sold most of it in 2022, and has since restocked. Tesla recorded a $600 million accounting gain last year thanks to crypto valuation rules. • Metaplanet: Originally a hotel developer, this Tokyo firm pivoted in 2024 to follow Strategy’s model. With 10,000 BTC now, it plans to reach 210,000 by 2027. Eric Trump even advises the company. • Block (formerly Square): Under Jack Dorsey, Block began buying BTC in October 2020. Now the company invests 10% of monthly gross profits from its bitcoin services back into holdings, aiming to solidify bitcoin’s role as the “internet’s native currency.” • Next Technology Holding: The Chinese AI software company jumped from 833 BTC late last year to 5,833 BTC in Q1 2025 after issuing shares and warrants to fund their crypto acquisition strategy. Nasdaq even warned about delisting before the move. • GameStop: The memestock-stock icon entered the bitcoin space in late May, purchasing 4,710 BTC via a $512 million convertible bond offering. Despite initial share-price drops, it's already preparing a second $2.25 billion bond issue. • Semler Scientific: This US healthcare-tech firm replaced its cash reserves with bitcoin starting in May 2024. With 4,449 BTC bought via cash, equity issuance, and $100 million in bonds, Semler’s share price hasn’t soared—but it's holding steady at a valuation close to its bitcoin assets. • Trump Media & Technology Group: Though currently holding no bitcoin, Trump’s media firm aims to build a treasury portfolio worth $2.5 billion. No purchases are scheduled yet, but a pro-crypto regulatory push is expected under his influence. Across the board, many of these firms are valued at a premium over their bitcoin holdings , reflecting investor confidence that they can continually issue new shares or bonds to fund purchases—a cycle dubbed the “infinite money glitch.” However, this strategy is untested in a sustained crypto downturn , and heavy debt could leave some companies vulnerable if bitcoin prices collapse.",coinpaprika,https://coinpaprika.com/news/companies-are-racing-to-build-bitcoin-treasuries,"BTC|BUSINESS|MARKET|REGULATION|TECHNOLOGY","",cryptocompare
2025-06-21T15:21:44,"Peter Schiff Claims He “Gets Bitcoin” But Not Dollar-Pegged Stablecoins, Plans To Launch Gold-Backed Alternative","Peter Schiff — a prominent gold advocate and Bitcoin critic — has slammed U.S. dollar-pegged stablecoins, as the assets enjoy a moment in U.S. policy circles after the Senate passed a landmark regulation bill with major bipartisan support. Schiff called the US dollar a “flawed fiat currency,” emphasizing the need for a gold-backed stablecoin instead. “I get Bitcoin, but not U.S. dollar stablecoins,” Schiff opined in a Friday post on X. “If you’re going to introduce a third-party custodian, why settle for a token backed by a flawed fiat currency like the dollar, when you can own one backed by gold? You get the same liquidity, but you also get a real store of value.” A stablecoin is a crypto token whose price is pegged to a stable currency, mostly the U.S. dollar. This is normally done by holding a reserve of dollars and other assets that cover the cost of the issued stablecoins. Crypto traders use stablecoins to enter and exit positions without having to access fiat currencies directly, particularly in markets where U.S. dollars are prohibited or unreachable. These assets can also be used to make payments or send remittances abroad in real-time and at much lower costs compared to traditional rails. When one X user urged Schiff to introduce a gold-backed stablecoin, Schiff noted that such a coin already exists and added that he plans to launch his own. The stablecoin market is currently dominated by U.S. dollar-backed tokens like Tether’s USDT and Circle’s USDC. Stablecoins Are Poised To Explode Schiff’s comments come as the U.S. Senate passed the GENIUS Act to regulate the fast-growing stablecoin industry. The legislation now heads to the House, and President Donald Trump expects to sign it into law by August. As previously covered by ZyCrypto , retail giants Amazon and Walmart, and other multinational companies are considering launching their own stablecoins. The stablecoin market has grown to over $260 billion, with US Treasury Secretary Scott Bessent predicting that it could become a $3.7 trillion asset class by the end of the decade, especially with the passage of the GENIUS Act.",zycrypto,https://zycrypto.com/peter-schiff-claims-he-gets-bitcoin-but-not-dollar-pegged-stablecoins-plans-to-launch-gold-backed-alternative/,"BTC|FIAT|MARKET|REGULATION|USDT","Cryptocurrency|News|Bitcoin News|Peter Schiff|Stablecoins",cryptocompare
