datetime,headline,summary,source,url,categories,tags,api_source
2025-07-16T20:21:53,"GameStop Eyes Crypto Payments After $500M Bitcoin Bet","TL;DR GameStop explores crypto payments for trading cards, focusing on customer demand and blockchain utility. CEO Cohen says Bitcoin buy was a hedge against inflation, not a copy of Strategy. GameStop’s crypto push follows past NFT, wallet attempts; stock remains flat after new comments. Company Considers Crypto for Collectibles GameStop is looking at crypto as a possible payment method for trading cards and collectibles. CEO Ryan Cohen said the retailer is open to the idea, depending on customer demand. He told CNBC’s Squawk Box that the company wants to reduce its dependence on hardware and focus more on collectibles. “There’s an opportunity to buy trading cards and to do so using cryptocurrency. So, we’ll see how much there is on the actual demand side for that kind of product,” Cohen said . When asked which coins might be accepted, he responded, “We’re going to look at all cryptocurrencies.” Bitcoin Seen as Protection, Not a Copy of Others GameStop bought 4,710 Bitcoin in late May, spending over $500 million. Cohen said the decision was about protecting value during a time of rising inflation and currency concerns. “The utility of crypto beyond investing is a hedge against inflation,” he said. He also pushed back against the idea that GameStop is following the same path as Strategy. “We have our own unique strategy,” he said. Cohen pointed out that GameStop holds more than $9 billion in cash and marketable securities, and will be careful with how that money is used. This is not GameStop’s first step into crypto. In 2022, it launched both a crypto wallet and an NFT marketplace. Both were later closed due to unclear rules in the U.S. market. The wallet shut down in November, and the NFT platform closed in January. Despite those setbacks, the company is still watching the space closely. Cohen’s recent comments suggest a more careful and measured approach going forward. Share Price Remains Flat After Announcement The stock didn’t move much after Cohen’s comments. It dropped by 2% during the day and rose only slightly after the market closed. GameStop shares are currently trading at $23.20. In May, GameStop’s stock had jumped by 30% ahead of the Bitcoin buy but fell again in June after a new fundraising plan was announced. Source: Google Finance Meanwhile, the company raised $450 million as part of a planned $2.25 billion private offering. Some of those funds could be used for future digital asset investments, depending on market and legal developments. The post GameStop Eyes Crypto Payments After $500M Bitcoin Bet appeared first on CryptoPotato .",cryptopotato,https://cryptopotato.com/gamestop-eyes-crypto-payments-after-500m-bitcoin-bet/,"BTC|TRADING|BUSINESS|MARKET|BLOCKCHAIN","AA News|Crypto News|GameStop",cryptocompare
2025-07-16T20:19:03,"Calamos Files for Laddered Bitcoin ETF Aiming to Limit Losses Beyond 20% Through Options Strategy","🚀 Are You Chasing New Coins? Catch the newest crypto opportunities. Be the first to buy, be the first to win! Click here to discover new altcoins! Calamos Investments has",coinotag,https://en.coinotag.com/calamos-files-for-laddered-bitcoin-etf-aiming-to-limit-losses-beyond-20-through-options-strategy/,"BTC|ALTCOIN","Bitcoin|News|BTC",cryptocompare
2025-07-16T20:15:57,"New Calamos Bitcoin ETF to use options strategy tied to five major BTC funds","The new ETF claims to provide protection against losses greater 20%, relying on the structure of underlying ETFs that the new fund would invest in.",cointelegraph,https://cointelegraph.com/news/new-calamos-bitcoin-etf-to-use-options-strategy-tied-to-five-major-btc-funds?utm_source=rss_feed&utm_medium=rss&utm_campaign=rss_partner_inbound,"BTC","",cryptocompare
2025-07-16T20:15:49,"Ark Invest Sells $13.3M in Coinbase Shares","On July 15, Ark Invest, a leading investment firm led by Cathie Wood, made another bold move to offload shares from a major fintech firm. The company sold 34,207 shares of Coinbase (COIN) worth about $13.3 million from its Next Generation Internet ETF (ARKW). This decision comes shortly after Coinbase’s stock reached its highest closing price on July 14, prompting the firm to rebalance its portfolio to manage risk effectively. Rebalancing Strategy: A Reflection of Ark Invest’s Principles Additionally, Ark Invest sold about $8.7 million of its own Bitcoin (BTC) Exchange-Traded Fund (ETF) (ARKB). This sale was timed as Coinbase stock closed at $394.01 on Monday, increasing its market capitalization past $100 billion for the day. These sales were part of a larger effort to maintain a balanced fund by ensuring no single asset makes up more than 10% of the total portfolio. This careful approach protects investment from heavily influencing the ETF’s performance, which helps lower the risk of volatility. Recall that Ark Invest offloaded over $24 million worth of shares from Coinbase Global Inc. and Block Inc. on June 26. This sale was carried out through Ark’s flagship ETF, the Ark Innovation ETF (ARKK). Likewise, the company sold 189,649 shares of Block Inc., a financial company led by Jack Dorsey. In a similar vein, Ark Invest sold 609,175 Circle (CRCL) shares across three of its ETFs, securing $146.2 million. Despite the heavy selling, ARK remains among the top shareholders of major tech firms. Ark Invest Buys Robinhood Shares In another significant move, the investment management firm acquired 210,714 shares of Robinhood (HOOD) for almost $10 million. This purchase follows Robinhood’s impressive earnings report for the first quarter of 2025, which exceeded expectations. The company’s better-than-expected earnings indicate that it is gaining popularity as the economy stabilizes and more individual investors become involved. Furthermore, the ARKK fund bought 186,812 shares of Guardant Health for $9.1 million. Similarly, the fund purchased shares in Advanced Micro Devices and 10X Genomics. It is worth noting that Ark’s purchase indicates its belief that Robinhood will be valuable in the long run. Meanwhile, Ark Invest has increased its target for Bitcoin to a staggering $2.4 million by 2030. Ark Invest Poised for Crypto and Fintech Growth Cathie Wood, CEO of Ark Invest, is known for her forward-thinking investment strategies, particularly in disruptive technologies such as digital assets and fintech. ARK’s recent moves also underscore the firm’s adaptability in these rapidly evolving sectors. The firm is strategically shifting its portfolio to capitalize on future gains as cryptocurrency price trends continue to shape the market. In April 2024, the firm added OpenAI shares to its venture fund , maintaining diversification within its ETFs. The post Ark Invest Sells $13.3M in Coinbase Shares appeared first on TheCoinrise.com .",thecoinrise,https://thecoinrise.com/ark-invest-sells-13-3m-in-coinbase-shares/,"EXCHANGE|BTC|BUSINESS|ZRX|MARKET","Blockchain News|ARK Invest|Coinbase",cryptocompare
2025-07-16T20:13:39,"ARK Invest Sells $8.7 Million Worth of Bitcoin ETF Shares Taking Profits","ARKB had $6.2 million in outflows as Bitcoin ETFs overall added $403 million, marking nine straight days of inflows across the sector.",decrypt,https://decrypt.co/330461/ark-invest-sells-8-7-million-worth-bitcoin-etf-shares-taking-profits,"BTC","Coins",cryptocompare
2025-07-16T20:10:18,"Bitcoin ETF: ARK Invest’s Strategic Sale Unveils Crucial Market Insights","BitcoinWorld Bitcoin ETF: ARK Invest’s Strategic Sale Unveils Crucial Market Insights The world of cryptocurrency is constantly buzzing with significant developments, and institutional moves often send ripples across the market. Recently, a notable event involving Cathie Wood’s ARK Invest captured headlines: a substantial sale of its Bitcoin ETF shares. This strategic move, valued at $8.7 million, marks ARK Invest’s largest sale since a pivotal stock split in mid-June, prompting many to ask: what does this mean for the future of Bitcoin ETF holdings and the broader crypto investment landscape? What’s Behind ARK Invest’s Latest Bitcoin ETF Sale? On July 16, Cathie Wood’s renowned investment management firm, ARK Invest, executed a significant transaction, selling 225,742 shares of its ARK 21Shares Bitcoin ETF (ARKB). This sale amounted to a remarkable $8.7 million, making it the largest divestment by the firm in this particular ETF since a 3-for-1 stock split occurred in mid-June. ARK Invest, known for its focus on disruptive innovation, has been a prominent player in the digital asset space, often making bold moves that reflect its long-term conviction in technologies like blockchain and artificial intelligence. This recent sale naturally raises questions. Is it a strategic rebalancing of their portfolio? A move to lock in profits after a period of Bitcoin’s price appreciation? Or perhaps a reflection of a broader shift in their tactical allocation? Understanding the nuances of such institutional actions is crucial for anyone monitoring the market, as firms like ARK Invest often set precedents or signal trends. Understanding the Dynamics of Bitcoin ETF and ARKB For many investors, a Bitcoin ETF offers a regulated and accessible way to gain exposure to the price movements of Bitcoin without directly owning the cryptocurrency. The ARK 21Shares Bitcoin ETF (ARKB) is one such instrument, launched after years of anticipation for spot Bitcoin ETFs in the United States. These ETFs aim to track the real-time price of Bitcoin, providing institutional and retail investors with a familiar investment vehicle. The introduction of spot Bitcoin ETFs earlier this year was hailed as a landmark event, signifying growing mainstream acceptance and institutional adoption of digital assets. Funds like ARKB have seen considerable inflows, demonstrating a strong appetite for this new investment avenue. However, like any financial product, Bitcoin ETFs are subject to market dynamics, including inflows, outflows, and the strategic decisions of major holders like ARK Invest. Key characteristics of ARKB and similar Bitcoin ETFs: Accessibility: Traded on traditional stock exchanges, making them easy to buy and sell through standard brokerage accounts. Regulation: Subject to regulatory oversight, offering a layer of investor protection not always present in direct crypto purchases. Price Tracking: Designed to closely track the price of Bitcoin, providing indirect exposure. Liquidity: Generally offer good liquidity, allowing for efficient entry and exit points. The Impact of a Stock Split: Why Did ARKB Adjust Its Shares? The ARK Invest sale followed a 3-for-1 stock split for ARKB in mid-June. A stock split is a corporate action where a company increases the number of its outstanding shares by dividing each existing share into multiple shares. In a 3-for-1 split, one share becomes three shares, and the price per share is proportionally reduced. For example, if a share was trading at $100 before the split, it would trade at approximately $33.33 after the split. Why do companies perform stock splits, especially for an ETF like ARKB? Increased Accessibility: A lower per-share price can make the ETF more appealing to a broader range of investors, particularly retail investors who might perceive a lower price as more affordable. Enhanced Liquidity: With more shares outstanding, the trading volume often increases, leading to greater liquidity in the market. Psychological Effect: A lower share price can create a perception of being ‘cheaper’ or more ‘affordable,’ even though the total value of an investor’s holding remains unchanged. It’s crucial to understand that a stock split does not change the fundamental value of the ETF or the total value of an investor’s holdings. If an investor owned 100 shares at $100 each (totaling $10,000) before a 3-for-1 split, they would own 300 shares at approximately $33.33 each (still totaling $10,000) after the split. The recent sale by ARK Invest, therefore, needs to be viewed in the context of these adjusted share prices, but the dollar value of the sale remains the key metric. Decoding Cathie Wood’s Investment Philosophy: A Strategic Shift or Portfolio Rebalancing? Cathie Wood , CEO and CIO of ARK Invest, is renowned for her high-conviction, long-term investment strategy focused on disruptive innovation. Her firm’s portfolios often include companies at the forefront of technologies like artificial intelligence, genomics, robotics, and, notably, blockchain. ARK Invest’s consistent belief in Bitcoin as a transformative technology and a potential hedge against inflation has been a cornerstone of their digital asset strategy. Given this philosophy, a significant sale of ARKB shares by ARK Invest warrants closer examination. It could be interpreted in several ways: Profit-Taking: After a period of strong performance in the crypto market, it’s a common strategy for institutional investors to take some profits off the table to manage risk or reallocate capital. Portfolio Rebalancing: ARK Invest manages multiple funds, and this sale might be part of a broader rebalancing effort across their diverse portfolios to maintain desired asset allocations or to fund new investment opportunities in other high-conviction areas. Tactical Adjustment: While ARK is known for long-term views, they also make tactical adjustments based on market conditions, liquidity needs, or specific fund mandates. This could be a tactical move in response to current market sentiment or anticipated shifts. It is less likely to signal a fundamental change in ARK Invest’s long-term bullish stance on Bitcoin itself, given their consistent advocacy and continued involvement in the crypto ecosystem. However, it underscores the dynamic nature of institutional investment strategies, even among those with strong thematic convictions. Navigating the Broader Crypto Investment Landscape: What Does This Mean for Investors? The sale by ARK Invest, while significant, should be viewed within the broader crypto investment landscape. Institutional participation in Bitcoin and other digital assets has grown exponentially, bringing both stability and new dynamics to the market. While a large sale can sometimes trigger short-term market reactions, it’s essential for investors to look beyond immediate headlines and consider the larger trends. For individual investors, this event offers several actionable insights: Don’t Panic: A single institutional sale, even a large one, does not necessarily signal a collapse or a negative long-term outlook for Bitcoin or Bitcoin ETFs. Markets are complex, and institutional decisions are often multifaceted. Understand Institutional Strategy: Recognize that large firms like ARK Invest have complex portfolio management strategies, including risk management, rebalancing, and profit-taking. Their moves are not always direct indicators of their long-term conviction. Focus on Fundamentals: Continue to evaluate the underlying fundamentals of Bitcoin and the broader crypto market, such as adoption rates, technological developments, regulatory clarity, and macroeconomic factors. Diversify: As always, diversification remains a key principle in investing. Do not put all your eggs in one basket, whether it’s a single crypto asset or a single ETF. Stay Informed: Keep abreast of news from reputable sources and analyze it critically. Understand the context behind major institutional moves. The ongoing evolution of the crypto investment space, with increasing institutional involvement, means that market participants need to be more sophisticated in their analysis. Events like ARK Invest’s ARKB sale serve as important reminders that even pioneers in the space actively manage their positions. Conclusion: Navigating Institutional Waves in the Crypto Market ARK Invest’s $8.7 million sale of its Bitcoin ETF shares, following a strategic stock split, is a significant event that highlights the dynamic nature of institutional crypto investment. While the immediate reaction might be to speculate on its implications, a deeper dive reveals it’s likely a combination of profit-taking, portfolio rebalancing, and tactical adjustments within Cathie Wood’s overarching investment philosophy. This move underscores the growing maturity of the Bitcoin ETF market and the complex strategies employed by major players. For investors, the key takeaway is to remain informed, understand the multi-faceted reasons behind institutional actions, and focus on long-term fundamentals rather than short-term fluctuations caused by individual transactions. The journey of crypto into mainstream finance continues, marked by such strategic maneuvers that shape its path forward. To learn more about the latest explore our article on key developments shaping Bitcoin ETF institutional adoption. This post Bitcoin ETF: ARK Invest’s Strategic Sale Unveils Crucial Market Insights first appeared on BitcoinWorld and is written by Editorial Team",bitcoinworld,https://bitcoinworld.co.in/ark-invest-bitcoin-etf-sale/,"BTC|BUSINESS|MARKET|TRADING|BLOCKCHAIN","Crypto News|Ark Invest|BITCOIN|Cathie Wood|Crypto|ETF",cryptocompare
2025-07-16T20:06:28,"Ethereum Surges Past $3,300 Amid Record Holder Growth and Increasing Institutional Interest","🚀 Are You Chasing New Coins? Catch the newest crypto opportunities. Be the first to buy, be the first to win! Click here to discover new altcoins! Ethereum (ETH) has",coinotag,https://en.coinotag.com/ethereum-surges-past-3300-amid-record-holder-growth-and-increasing-institutional-interest/,"ETH|BTC|ALTCOIN","Bitcoin|Ethereum|News|BTC|ETH",cryptocompare
2025-07-16T20:04:59,"Bitcoin bounced back to $122K after dropping on failed crypto bills in Congress","Wall Street stocks flipped out Wednesday after someone inside the White House told CNBC that Trump might fire Jerome Powell as Fed chair. That single comment kicked off chaos. The S&P 500 dropped hard at first, down 0.6%, before clawing its way back into the green once Trump denied the whole thing . By the Closing Bell, the S&P 500 scraped out a tiny 0.1% gain. Nasdaq also managed to add 0.1% after tanking nearly 0.8% during the day. The Dow Jones did slightly better, up 162 points, or 0.3%, but that’s only after it was down more than 260 points earlier. Traders were stuck in limbo. Nobody knew whether to trust the official denial or brace for another bombshell. “The markets would not like it if Powell was fired,” said Larry Tentarelli from Blue Chip Daily Trend Report. “It’s obviously a political hotbed… but overall, most of the big market participants that I know of think Powell has done a very good job.” Translation? If Trump pulls the trigger, stocks could get wrecked. Semiconductor names drag down tech sector Tech wasn’t safe either. Chip stocks started bleeding, and it wasn’t subtle. The VanEck Semiconductor ETF is now down 0.6% for the week and could snap a seven-week win streak. That would be its worst performance since its eight-week rally ended in March 2019. ASML took the biggest hit. Shares were down 9.5% by midday Wednesday, already sitting 7% lower on the week. That’s ASML’s worst day since October 15, 2024, and its worst week since April. And the kicker? This came after the company beat both top- and bottom-line expectations in its second-quarter results. But the problem is what they said next: They don’t know if they’ll grow in 2026. Uncertainty like that makes investors run for the hills. Other chip names got slammed too. Micron Technology, Marvell Technology, Monolithic Power Systems, Teradyne, and NXP Semiconductor all ended the day in the red. Nvidia, after printing an all-time high on Tuesday, cooled off a bit. Shares slipped slightly, but the company is still pacing for its eighth straight weekly gain, up 3.4% this week. AMD followed suit with a strong 5% gain for the week so far, looking good for a second solid green close. Meanwhile, bank earnings came in Tuesday , and they looked decent on paper. Goldman Sachs, Morgan Stanley, and Bank of America all beat expectations. But their stocks didn’t care. Every single one traded lower. The market clearly isn’t buying the narrative, or maybe it just didn’t matter with the Fed drama stealing the spotlight. Bitcoin recovers, Ether starts to break out While stocks whiplashed, crypto made a nasty dip before bouncing right back. Bitcoin crashed to $115,000 late Tuesday night after the House shot down a set of crypto bills. That vote was a slap to the face for anyone expecting clear rules in the near term. But by Wednesday, BTC was back at $122K. Traders didn’t wait around; they bought the dip instantly. Ether, on the other hand, actually looked stronger than Bitcoin. It’s now broken out of a long-standing inverse head-and-shoulders pattern, which had been forming all year. Holding above the $2,870 breakout level gives it a target of $4,375. And it’s not just chart theory here. Momentum is blasting higher. ETH’s 14-day RSI jumped from the low 30s to the mid-70s in four weeks. In May, that number hit nearly 90 before things cooled down. So the move we’re seeing right now is sharp—and it’s real. If ether keeps pushing and hits that $4,375 target, it’ll blow past its December 2023 highs and start testing the top of the 2021 cycle. That would complete a multi-year bullish base that’s been building on the monthly log chart. Even more interesting? Ether’s been outperforming Bitcoin. Since the lows in April, BTC has climbed 60%. ETH? Up 130%. Cryptopolitan Academy: Want to grow your money in 2025? Learn how to do it with DeFi in our upcoming webclass. Save Your Spot",cryptopolitan,https://www.cryptopolitan.com/stocks-crypto-rebound-on-conflicting-signals/,"BTC|MARKET|ETH|FIAT|TECHNOLOGY","Economy|BTC|Nasdaq|S&P 500",cryptocompare
2025-07-16T20:00:57,"Ripple Vs. SWIFT: How XRP Is Powering The Next Wave Of On-Demand Settlements","XRP community member Avengers has drawn attention to how the altcoin is playing a major role in on-demand settlements. This comes as crypto firm Ripple gains ground in its bid to topple SWIFT, which currently leads the way with its payment rails. XRP’s Role As Ripple Looks To Compete With SWIFT In an X post , Avengers said that XRP is quietly becoming the new backbone of cross-border finance as on-chain settlements, which are faster and cheaper, gain traction. He made this statement while also suggesting that SWIFT is losing transactions to Ripple. The crypto commentator noted that SWIFT transaction volume is down 15% while XRP Ledger (XRPL) activity is surging. Based on this, he declared that global payments are shifting on-chain. Ripple uses the XRP Ledger for its payment services , which explains the momentum shift as the crypto firm gains ground. Meanwhile, as the XRPL’s native token, XRP is also crucial to the crypto firm’s payment services. The altcoin also plays a key role in the settlement of cross-border transactions. It is worth noting that Ripple CEO Brad Garlinghouse had predicted that XRP could take up to 14% of SWIFT’s volume in the next five years. He explained that liquidity is what drives these payment solutions and that the altcoin could gain significantly if it drives the liquidity layer. This could also serve as a catalyst for the XRP price to rally higher. A Ripple document also recently surfaced, highlighting how the XRP price could increase due to organic demand. The firm expects demand for the altcoin to surge as it expands its payment services. Meanwhile, the report also noted that XRP already serves two functions: security and acting as a bridge currency on the XRPL. XRP Gains Boost With Ripple’s MiCA Plans XRP is poised to gain momentum as Ripple seeks to acquire a Markets in Crypto-Assets (MiCA) license, thereby expanding its operations into Europe. The crypto firm has already registered its business in Luxembourg and will look to acquire this coveted European license through the country. With a MiCA license, Ripple will be able to serve around 450 million users across the 27 European Union member states, a move that will further boost XRP’s adoption. It is also worth mentioning that Ripple has applied for a US national banking license, which could give the XRP price a lift. Ripple is expected to secure more institutional partners once it secures this banking license, with these institutions also adopting XRP in the process as part of the crypto firm’s payment services. Partners like Japan’s SBI are already betting big on the altcoin, thanks to its partnership with the crypto firm. At the time of writing, the XRP price is trading at around $2.91, up almost 2% in the last 24 hours, according to data from CoinMarketCap.",bitcoinist,https://bitcoinist.com/xrp-is-powering-demand-settlements/,"ETH|MARKET|BTC|FIAT|ADA|TRADING|DOGE|REGULATION|ALTCOIN|BUSINESS|BLOCKCHAIN|ZRX|TOKEN SALE|XRP|TREASURY|SPONSORED|SOL|EXCHANGE|BNB|USDT|ALGO|BCH|PYUSD|TRX|FORKS|RESEARCH|ASIA|TECHNOLOGY|MINING|PEPE|USDC|SHIB|BITTENSOR|WALLET","XRP|Altcoin|Avengers|Brad Garlinghouse|Coinmarketcap|European Union|Markets in Crypto-Assets|MiCA|ripple|XRP Ledger|XRP news|XRP price|XRPL|XRPUSD|XRPUSDT",cryptocompare
