datetime,headline,summary,source,url,categories,tags,api_source
2025-07-16T19:25:02,"Grosse Pointe Farms is the first Michigan town to pass a law regulating crypto ATMs","Grosse Pointe Farms, a small town near Detroit, has become the first in Michigan to pass a local law regulating cryptocurrency ATMs to shield residents from rising scam activity. The city council unanimously approved the ordinance on Tuesday, following a case where a resident was scammed at a crypto ATM in neighboring St. Clair Shores. Officials say fraudsters instructed the victim to withdraw cash and deposit it into a crypto kiosk under false pretenses. This incident mirrors a growing trend across Michigan. In April, the state attorney general issued a warning about increasing crypto ATM-related scams, urging the public to stay cautious. Around the same time, the Detroit Free Press reported that several victims had lost thousands of dollars in irreversible cryptocurrency transactions. City cracks down on crypto ATMs to curb scams and protect users As cryptocurrency fraud continues to rise, the Grosse Pointe Farms city council has voted to introduce a new, stricter regulation about crypto ATMs nationwide . The goal is to increase transparency and discourage abuse of the machines. Council debated the ordinance, in which City Attorney Bill Burgess highlighted the ordinance’s primary components at the meeting. Michigan will also require that any crypto ATM placed there be registered with the Department of Public Safety. Operators are supposed to acquire a bona fide business license before placing their machines. To safeguard users, the machines must also present fraud warnings and consumer protection messages explicitly informing users about the dangers of making irrevocable transactions. The ordinance also restricts new users to transactions of $1,000 a day and $5,000 within the first 14 days. These restrictions are automatically removed after 14 days. Burgess said the idea was that, by that point, a person would become familiar with using the machine and understand how it works, making them less vulnerable to scams. Council member Lev Wood said such protections are necessary because scammers frequently target people who don’t understand what they are doing, causing them to deposit big chunks of their cash into crypto ATMs. “The crooks tell people to go and put money into these machines, and it’s a very untransparent situation,” Council member Lev Wood said at the meeting. “What we want to do with our ordinance tonight is to enhance transparency and provide some help to our residents.” The council unanimously approved the ordinance, a sign of widespread support for proactive action on digital safety. Crypto operators welcome oversight measures The ordinance had the backing of local officials and players in the crypto industry. Coinflip, a Chicago-based digital currency business that operates crypto ATMs in the US, sent a representative, Carson Gat, to provide insight on the industry side. He described how he intervened to prevent an older woman from being swindled at a kiosk. Gat said that first-time users were the most vulnerable, noting that most scam attempts occurred when people were unfamiliar with cryptocurrency exchanges. Coinflip, which has operated in Michigan since 2019, was granted a money transmitter license in April. Limits and holds, at least for new users, are good since they also deter bad actors and protect users. The new regulations in Grosse Pointe Farms could set a template for other communities across Michigan and the nation. Regulators are not surprised by the surge of crypto-related fraud. Crypto payments, unlike bank transactions, are all but irretrievable once made. This has made crypto ATMs an easy mark for scammers who use high-pressure tactics to get victims to send money in a hurry. Crypto kiosks are commonly located in gas stations, convenience stores, and shopping malls. Operators often leave these spots, making them easy targets for scams. Experts say that victims may feel isolated, unsure how to seek help, or unable to involve a friend or family member. KEY Difference Wire helps crypto brands break through and dominate headlines fast",cryptopolitan,https://www.cryptopolitan.com/michigan-passes-state-crypto-atm-rules/,"REGULATION|BTC|BUSINESS|FIAT|MARKET","Regulation|BTC|United States",cryptocompare
2025-07-16T19:24:07,"Bitcoin’s Price is Nowhere Near Overheating Despite Surge to $123K: CryptoQuant","Bitcoin recently surged to unprecedented levels, breaking past $123,000 for the first time on July 14. The milestone follows earlier highs of $112,000 on July 9 and $118,000 on July 11, marking a series of sharp moves within days. However, unlike previous rallies, the current surge appears to be supported by healthier market conditions. On-chain data from CryptoQuant suggests the market is not overheating – a notable contrast to past cycles where similar price spikes led to short-term corrections. Bitcoin Positioned for Sustained Upside as Market Cools CryptoQuant’s analysis focuses on a key metric known as the UTXO Age Bands, particularly the 1-day to 1-week range. Spikes in this range typically indicate short-term selling pressure and profit-taking behavior. In March and December 2024, it showed strong activity, signaling overheated market conditions. In contrast, the current cycle shows smaller spikes, even as the apex coin trades at higher prices. Notably, the reduced movement suggests that holders are less eager to sell quickly. Many now appear to be treating Bitcoin as a long-term asset rather than chasing short-term profits. According to CryptoQuant, this shift in sentiment could support a more sustained rally through the second half of 2025. With the market showing fewer signs of fast-paced speculation, the absence of aggressive selling pressure may allow prices to climb further without immediate pullbacks. Institutional Demand Builds Momentum Alongside this behavior change is a noticeable rise in institutional interest. Between July 7 and 12, 29 companies added a combined 4,209 BTC to their balance sheets, with 80 treasury-related announcements logged in just five days. Institutional demand is also surging through U.S. spot Bitcoin ETFs , which saw over $2.7 billion in inflows last week, far outpacing the number of new Bitcoins mined. Leading the charge is BlackRock’s IBIT ETF, which recently surpassed $80 billion in assets under management, achieving this milestone faster than any ETF in history. Consequently, the combination of strong institutional inflows and subdued short-term selling could offer more price stability. With retail speculation slowing and larger players stepping in, Bitcoin’s path to higher prices may remain wide open. The post Bitcoin’s Price is Nowhere Near Overheating Despite Surge to $123K: CryptoQuant appeared first on CryptoPotato .",cryptopotato,https://cryptopotato.com/bitcoins-price-is-nowhere-near-overheating-despite-surge-to-123k-cryptoquant/,"BTC|MARKET|TRADING","AA News|BTCEUR|BTCGBP|BTCUSD|BTCUSDT|Crypto News|Bitcoin (BTC) Price|Bitcoin Bull Run",cryptocompare
2025-07-16T19:19:00,"Ethereum Takes The Hand As Bitcoin Finds Its Local Top","Summary Ether has had a stellar run – since its 2,174 lows on June 21st, the crypto rallied back close to 50%, leading to the ETH/BTC ratio looking poised for a decent breakout. The altcoin market is currently looking good, and few potential measured moves targets point towards the ongoing move in the ratio to stall between 2.90% and 3.1% in ETH/BTC. Buyers will have to push through the $3,250 resistance-turned support to warrant further upside. By Elior Manier A month ago, one of our crypto market analysis had mentioned the scenario of Ethereum retaking some of the relative strength it had heavily lost in the beginning of 2025, notably leaving some space for Solana to outperform the second largest cryptocurrency. Now, since its War lows, Ether ( ETH-USD ) has had a stellar run – Since its 2,174 lows on June 21st, the crypto rallied back close to 50% , leading to the ETH/BTC ratio looking poised for a decent breakout. The ratio has just broken out to the upside of its range which calls for an ETH Technical Analysis. ETH/BTC Breaks out of its 3 month-long Consolidation The second-to-first-crypto ratio is essential to track the appetite for altcoins, key to signs of depth in digital assets as Bitcoin had taken a significant advantage since it started rallying to its first $100,000 trip – The rally in BTC had started in October 2024 and started to put a top in the ratio. Yesterday marked the breaching of the 2.64% top of range, which had stuck the altcoins in lesser demand, particularly since the start of the Israel-Iran War had dampened appetite.The altcoin market is currently looking good, and few potential measured moves targets point towards the ongoing move in the ratio to stall between 2.90% and 3.1% in ETH/BTC – This would give Ether some considerable upside, particularly if Bitcoin consolidates at current levels. Ethereum Technical Analysis ETH Weekly Timeframe Ethereum Weekly Chart, July 16, 2025 – Source: TradingView Looking out to the Weekly timeframe serves to show how the 3 year action in the second biggest crypto has been rangebound overall. But with the major rally in Bitcoin ( BTC-USD ) and the expansion of the democratization of what was a niche-financial market, there is potential to retest at least December 2024 highs as long as the crypto market maintains its bullish tone. Looking at fibonacci extensions of the 2022 $1,000 lows to December 2024 highs, any All-time high breakout (still far from current levels) could stall between $4,915 to $5,250 (127.8% to 138.2% Fibs) and further rally towards $5,970 161.8% targets.Many things may happen before these levels get hit; however, in technical analysis, all scnearios must be explored. ETH 8H Timeframe Ethereum 8H Chart, July 16, 2025 – Source: TradingView Looking closer marks the strength of the ongoing run with prices currently way overbought looking at the RSI – Overbought levels may only stall a rally when such a squeeze happens, as the run may just keep continuing for a while before stallling. However, buyers will have to push through the $3,250 resistance-turned support to warrant further upside. The way the buying candles look, it seems that there is still some potential in the buying towards the Measured Move target around $3,400 to $3,450 which would coincide with the ETH/BTC ratio targets emitted above. Of course, anything can happen and things might go further or drop suddenly depending on sentiment – Markets are unpredictable and we are just pointing some high probability scenarios. Ethereum 1H Chart Ethereum 1H Chart, July 16, 2025 – Source: TradingView The ongoing impulsive bull move is evolving within an upwards hourly channel.Watch for the reactions as prices are approaching the top of this channel at overbought RSI levels – The short-term action stays bullish as long as the channel is maintained. The Total Market Cap is moving upwards in today's session Crypto Total Market Cap, July 16, 2025 – Source: TradingView Cryptocurrency buying can also be expressed in an upwards channel looking at how the current action is going – Watch for any break above the $3.78 All-Time highs or what happens if buyers can't push through. We are ""only"" $4B away from that record. Safe Trades! Original Post Editor's Note: The summary bullets for this article were chosen by Seeking Alpha editors. Original Post Editor's Note: The summary bullets for this article were chosen by Seeking Alpha editors.",seekingalpha,https://seekingalpha.com/article/4801714-ethereum-takes-hand-as-bitcoin-finds-its-local-top?utm_source=cryptocompare.com&utm_medium=referral&feed_item_type=article,"MARKET|ETH|TRADING|BTC|ALTCOIN","ETHW|ETHA|FETH|EZET|ETH|ETHE|QETH|ETHV|CETH|ETQ|ETH-USD",cryptocompare
2025-07-16T19:17:39,"Roger Ver Challenges Spain’s Extradition Ruling Amid U.S. Bitcoin Tax Evasion Case","🚀 Are You Chasing New Coins? Catch the newest crypto opportunities. Be the first to buy, be the first to win! Click here to discover new altcoins! Crypto entrepreneur Roger",coinotag,https://en.coinotag.com/roger-ver-challenges-spains-extradition-ruling-amid-u-s-bitcoin-tax-evasion-case/,"BTC|REGULATION|ALTCOIN","News|BTC",cryptocompare
2025-07-16T19:11:41,"'Bitcoin Jesus' Roger Ver Sues Spain to Block Extradition Over US Tax Charges: Bloomberg","Bitcoin icon Roger Ver sued Spain for allegedly violating his legal protections, after it ruled he could be extradited to the United States.",decrypt,https://decrypt.co/330431/bitcoin-jesus-ver-sues-spain-block-extradition-us-tax-charges,"BTC|REGULATION","||Law and Order",cryptocompare
2025-07-16T19:10:45,"U.S. Inflation Data Accelerates Onset of Altcoin Season","Leading altcoins like Ethereum and Solana reacted to the US inflation data more strongly than Bitcoin, as highlighted by The Block. According to the U.S. Bureau of Labor Statistics (BLS), inflation accelerated in June, with the consumer price index (CPI) rising to 2.7%. BRN lead analyst Valentin Fournier noted: ”Inflation data confirmed market optimism. Inflows into ETFs continue, and altcoins are catching up with Bitcoin.” Bitcoin reacted modestly to the CPI news—its price rose only 2% over the past 24 hours, approaching $119,300. Meanwhile, Ethereum jumped 7.9% to $3,238 and Solana rose 5.4% to $167, according to CoinGecko. Fournier emphasized that investors' risk appetite increased after the report was published. Capital began flowing into altcoins, as evidenced by inflows into Ethereum ETFs ($193 million) and investment products based on Solana ($3.3 million), respectively. According to the analyst, the second-largest cryptocurrency, Ethereum, benefits not only from demand for exchange-traded funds but also from interest fueled by corporate players. Public company SharpLink Gaming, which owns 280,706 ETH, became the largest public holder of Ethereum, surpassing the Ethereum Foundation. Over the past week, the firm has acquired more than 50,000 ETH worth over $73 million. Nasdaq-listed miner BitMine Immersion also announced it had raised $67.3 million to buy Ethereum. When is the altcoin season? Ethereum is rising despite Bitcoin's lackluster performance, with capital actively flowing into altcoins. According to key indicators, investors are inspired by inflows into ETFs based on Ethereum and corporate purchases. The altcoin index—the performance of 75% of coins within the top 50 cryptocurrencies by market capitalization—reached its highest level since February, signaling a clear trend change.",coinpaper,https://coinpaper.com/9972/u-s-inflation-data-accelerates-onset-of-altcoin-season,"ETH|ALTCOIN|BTC|MARKET|SOL","News|Crypto",cryptocompare
2025-07-16T19:05:39,"The Bitcoins Bulgaria’s government reportedly sold in 2018 now represent a $25 billion missed opportunity","In 2018, Bulgaria allegedly quietly sold off 213,500 Bitcoins seized from a criminal syndicate, reaping what then seemed like a prudent windfall. But with Bitcoin now trading at over $117,000, those coins would be worth more than $25 billion today, roughly $1 billion more than Bulgaria’s current public debt. While the Balkan nation has denied seizing or even liquidating the Bitcoins in question, the story has come to symbolize a missed strategic opportunity, eclipsing even Germany’s recent sales in scale and consequences. Bulgaria, once briefly speculated to be among the world’s largest sovereign Bitcoin holders, is now being cited as a textbook example of selling too early, even though it appeared like a fiscally responsible decision at the time. The episode resurfaced this week following a post on X , noting the value comparison between Bulgaria’s rumored Bitcoin stash and its national liabilities. Binance founder and crypto billionaire Changpeng Zhao “CZ” responded to the post , writing: “Bitcoin could solve most public debt.” Bitcoin could solve most public debt. https://t.co/sBq81KMkio — CZ 🔶 BNB (@cz_binance) July 16, 2025 A $3 billion decision with $25 billion consequences The 213,500 BTC were reportedly originally seized in 2017 as part of Operation SELC, a coordinated crackdown on a customs fraud ring. At the time, the Bulgarian authorities did not disclose the fate of the coins in detail. However, by 2018, several local reports suggested the holdings had been sold off in tranches, likely netting the government around $3.5 billion, based on Bitcoin’s price hovering between $10,000 and $17,000 at the time. Fast-forward to mid-2025, and Bitcoin’s meteoric rise has rewritten the economic implications of that decision. With the coins now worth over $117,000 each, the trove would be valued at over $25 billion. That’s more than Bulgaria’s estimated $24 billion debt as of the end of 2024, per data from World Economics . Germany also missed its Bitcoin payday Unlike Germany , which recently made headlines for offloading part of its Bitcoin reserves through the Bundeskriminalamt (BKA) , prompting price volatility, Bulgaria’s earlier sell-off appears less tactical and more conservative. At the time, the logic was rooted in caution: avoid volatility, monetize seized assets swiftly, and strengthen short-term cash positions. However, critics argue that the move reflected a lack of foresight in managing unconventional reserves. Had Bulgaria adopted a more balanced strategy, retaining, for example, 10% to 20% of its Bitcoin while offloading the rest, it would today sit on a strategic reserve valued between $2.5 and $5 billion. That cushion could have enabled debt restructuring, currency stabilization, or long-term infrastructure investment, analysts suggest. CZ’s Bitcoin-as-debt-hedge thesis CZ’s comment “Bitcoin could solve most public debt” taps into a growing school of thought that Bitcoin could serve as a hedge against sovereign debt risk, particularly in a climate of rising inflation and global fiscal imbalances. VanEck, the asset manager, recently modeled a scenario in which the U.S. Treasury held Bitcoin reserves as a complement to gold, projecting that a modest allocation could offset future liabilities if adopted early. In Latin America, countries like El Salvador have taken a much more assertive stance, incorporating digital gold into national reserves and launching Bitcoin-backed bond instruments. While critics call such policies reckless, advocates argue that they position countries to benefit disproportionately in the next crypto cycle. Whether true or not, as long as the urban myth continues to make the rounds, Bulgaria’s Bitcoin liquidation could go down as one of the most significant missed fiscal opportunities of the last decade. KEY Difference Wire : the secret tool crypto projects use to get guaranteed media coverage",cryptopolitan,https://www.cryptopolitan.com/bulgaria-germany-selling-bitcoin-too-early/,"BTC|FIAT|TRADING|BNB|EXCHANGE","Bitcoin|BTC|Bulgaria|Germany",cryptocompare
2025-07-16T19:02:05,"Analyst Suggests Bitcoin Could See Significant Gains Amid Regulatory Shifts and Market Trends","🚀 Are You Chasing New Coins? Catch the newest crypto opportunities. Be the first to buy, be the first to win! Click here to discover new altcoins! Bitcoin and Nvidia",coinotag,https://en.coinotag.com/analyst-suggests-bitcoin-could-see-significant-gains-amid-regulatory-shifts-and-market-trends/,"BTC|MARKET|ALTCOIN","Analysis|News|BTC",cryptocompare
2025-07-16T18:56:57,"Prices Slump, But Stablecoins, RWAs, and Bitcoin Futures Hit Record Highs: Bitwise Report","According to Bitwise Asset Management, newly inaugurated U.S. leadership delivered sweeping pro-crypto reforms—including a national executive order prioritizing digital assets, the launch of a Strategic Bitcoin Reserve, and the dismissal of most Securities and Exchange Commission (SEC) lawsuits targeting the sector. Perhaps most impactful was the official termination of Operation Choke Point 2.0, a regulatory chokehold that limited crypto’s access to traditional banking rails. These moves represented a long-awaited victory in Washington, offering the kind of policy clarity the digital asset industry had pursued for over a decade. Despite the regulatory momentum, markets reacted with a downturn. The Bitwise 10 Large Cap Crypto Index fell 18% in Q1. Ethereum dropped 45%, and crypto equities declined by 27%. “Frustrating,” was how Bitwise CIO Matt Hougan described the quarter—a period when positive structural shifts failed to lift market sentiment. Quiet Momentum in Stablecoins and RWAs While token prices dominated headlines, Bitwise’s data shows a different story unfolding under the surface. Stablecoins posted $218 billion in assets under management—up 13.5% from the previous quarter—alongside a 30% surge in transaction volumes. Tokenized real-world assets (RWAs) gained major traction, jumping over 37% quarter-over-quarter, while regulated bitcoin futures trading volume and open interest reached all-time highs. These developments indicate growing institutional engagement and pivoting toward asset types with real-world utility or compliance-first design. “Parts of the crypto market are experiencing raging bull markets,” Hougan noted, citing stablecoins, RWAs, and bitcoin futures as key pockets of growth. A More Resilient Q2 on the Horizon Bitwise points to several potential catalysts in Q2 2025. These include increased global liquidity, progress on stablecoin legislation in the U.S., and a rising narrative around bitcoin’s role as a strategic hedge asset. As central banks turn dovish and major legislative reforms gain traction, crypto infrastructure appears primed for a breakout. The expected repeal of SEC guidance SAB 121 and new banking rules could unlock further institutional participation. Additionally, with geopolitical instability on the rise, digital assets like bitcoin are being reevaluated as long-term reserve assets by both sovereigns and corporations. While Q1 may have underwhelmed on price action, Bitwise suggests that the structural groundwork laid during the quarter could lay the foundation for a more powerful rally in the months ahead. CIO Warns of Fragile Progress Without Congressional Support In May, Bitwise CIO Matt Hougan issued a stark warning about the fragility of crypto’s momentum, urging Congress to pass lasting regulation. Bitwise Chief Investment Officer @Matt_Hougan has voiced serious concerns over Congress's ability to pass meaningful crypto regulation. #Bitwise #Crypto https://t.co/dYQyGR2HTV — Cryptonews.com (@cryptonews) May 6, 2025 In a note to clients, Hougan praised recent moves by the Trump administration—such as the creation of a Strategic Bitcoin Reserve and the rollback of SEC enforcement—but stressed that these executive actions are not permanent. Without legislation, he cautioned, future administrations could easily reverse course. Despite his long-term optimism—predicting new all-time highs and even a potential $200,000 Bitcoin price—Hougan said the industry faces a “rough summer” if lawmakers fail to deliver regulatory clarity. His comments reflect growing concern within the digital asset space that political support alone isn’t enough to secure crypto’s future. The post Prices Slump, But Stablecoins, RWAs, and Bitcoin Futures Hit Record Highs: Bitwise Report appeared first on Cryptonews .",cryptonews,https://cryptonews.com/news/bitwise-report-stablecoins-rwas-bitcoin-futures-record-highs/,"BTC|MARKET|REGULATION|TRADING|FIAT","Blockchain News|News|Bitcoin|Bitwise|Stablecoins",cryptocompare
