datetime,headline,summary,source,url,categories,tags,api_source
2025-07-16T19:41:37,"Top 5 Hottest Cloud Mining Platforms of 2025: Zero Threshold, Smart Mining, Everyone Can Easily Earn Bitcoin","The popularity of cryptocurrency mining continues to rise, but nowadays you don’t need expensive equipment or complicated technical skills to participate in mining Bitcoin and mainstream altcoins. With the new generation of cloud mining platforms (such as Cryptosolo), all you need is a mobile phone or a computer. No matter where you are, you can start automatic mining with just one click and enjoy daily passive income. AI-powered scheduling, green energy, and real-time profit settlement make mining simpler and more efficient than ever. This article lists the top five cloud mining platforms of 2025, helping you enter the world of crypto wealth with low risk and zero threshold. Three Core Advantages of Cloud Mining 1. Cryptosolo : Zero Hardware Investment, Worry-Free and Effortless No need to purchase or maintain expensive mining rigs, nor worry about noise, electricity consumption, or device wear and tear. The platform manages everything for you—all you need to do is register to participate. Small Investment to Start, Flexible Scaling Whether you’re a beginner or an experienced player, you can choose suitable contracts based on your budget, add funds at any time, or exit as needed, offering strong liquidity for your capital. Multi-Currency Support, Risk Diversification Mainstream cloud mining platforms usually support multiple cryptocurrencies such as Bitcoin, Ethereum, and Dogecoin. Intelligent allocation of computing power enhances the stability of returns. Cryptosolo: Register and Get $15, AI-Driven Green Mining Want to experience true “foolproof” mining? Cryptosolo is your best choice. No app download required—simply use your browser or mobile device to get started. The platform uses AI optimization algorithms to automatically select the best mining strategies, with 95% of its power coming from renewable energy, making it eco-friendly. Suitable for: Beginners and those seeking stable passive income Main Highlights: $15 sign-up bonus, 24-hour automatic profit settlement, extremely simple operation, transparent earnings Flexible Contracts: Terms range from 1 to 6 days, catering to different funding needs Popular Contract Overview: Contract Amount Period Daily Profit Total Profit Trial Contract $200 1 day $7 $207 Antminer S17 $600 2 days $18 $636 Antminer S19 $1200 3 days $42 $1326 ANTSPACE MD5 $3600 5 days $144 $4320 Avalon 1166 $8000 6 days $360 $10160 ETC Miner E11 $30000 3 days $2040 $36120 PandaMiner B3 $60000 2 days $5280 $65280 Get Started in Four Easy Steps: Visit the Cryptosolo website and register an account Claim your $15 new user bonus—no credit card required Choose a contract and start mining with one click in your browser Check your automatically settled earnings daily and withdraw anytime 2-5. Other Noteworthy Cloud Mining Platforms Besides Cryptosolo, the following platforms are also highly regarded for their unique advantages: Platform A: Focuses on high transparency and real-time settlement, ideal for investors seeking stable returns Platform B: Flexible multi-currency switching, one-stop management of various crypto assets Platform C: User-friendly interface with beginner tutorials and 24/7 customer support Platform D: High-performance computing power rental, fast withdrawals, and low fees 2. EMCD – Versatile Mining Platform for Flexible Multi-Currency Management If you’re searching for a mining platform that supports multiple cryptocurrencies while offering flexibility and powerful features, EMCD is an excellent choice. With mining pools distributed across North America, Europe, and Asia, EMCD provides users with high-speed, stable mining connections worldwide. The platform supports merged mining, allowing you to mine Litecoin and Dogecoin simultaneously to maximize your hash power utilization. EMCD also offers unique tools, such as a Telegram bot for real-time mining alerts and custom firmware for Antminer devices, further enhancing performance and security. For miners looking to diversify their investments and manage multiple crypto assets, EMCD stands out as a flexible and professional solution. 3. Antpool – Industry Giant, Stable and Reliable Mining Choice Antpool is one of the world’s oldest and largest cryptocurrency mining pools, providing robust hash power and a highly secure network environment for large-scale and institutional miners. Its years of operational experience and continuous technical advancements ensure stable returns and outstanding performance. Antpool supports Bitcoin as well as a variety of major altcoins, making it a comprehensive platform particularly suited for miners seeking long-term, stable income. If you value brand reputation and platform stability, Antpool is a trustworthy choice. While it may not be at the forefront of AI optimization, its overall strength remains industry-leading. 4. Bitdeer – Easy Cloud Mining for Beginners, Transparent and Efficient Bitdeer is dedicated to making cloud mining simple and accessible. Whether you are a beginner or a casual miner, you can get started with ease. The platform offers flexible contract options and transparent pricing, partnering with top global hardware suppliers to ensure mining efficiency. Bitdeer supports multiple cryptocurrencies and operates green energy data centers, appealing to environmentally conscious investors. Its intuitive interface makes tracking your earnings straightforward, and withdrawals are quick and hassle-free—making Bitdeer a great choice for those seeking a worry-free mining experience. 5. Unmineable – Effortless Mining of Rare Altcoins Unmineable breaks the mold with its unique mining model, allowing users to mine popular altcoins that are typically hard to access, such as Dogecoin and Ethereum, without complex setups. The platform uses intelligent algorithms to automatically select the most profitable coins to mine and converts your rewards into your chosen crypto asset, greatly enhancing flexibility and convenience. For users eager to explore a diverse range of crypto assets, Unmineable is the perfect pick. Comparison Table of Leading Global Cloud Mining Platforms Platform Key Advantages Supported Coins Special Features Ideal Users Cryptosolo AI scheduling, green energy, flexible plans BTC/ETH/DOGE, etc. Free trial bonus, daily settlement Beginners, passive earners EMCD Multi-coin merged mining, global nodes BTC/LTC/DOGE/ETC Telegram bot, custom firmware Diversified investors Antpool Established, powerful, secure BTC & major altcoins Industry reputation, stability Large miners, institutions Bitdeer Simple, transparent, eco-friendly Various major coins Flexible contracts, global centers Beginners, eco-users Unmineable Rare coins, auto conversion, easy to use Various altcoins Smart mining, auto conversion Altcoin enthusiasts Why Choose Cryptosolo as Your Top Cloud Mining Platform? With advanced AI-driven hash power allocation and over 95% renewable energy usage, Cryptosolo stands out as a global leader in cloud mining. Whether you’re new or experienced, you can enjoy flexible investment options and daily automated earnings. The minimum investment is just $200, and new users receive a $15 bonus upon registration. The platform is easy to use, secure, and fully compliant. Trusted by hundreds of thousands of users worldwide, Cryptosolo is your solid foundation for building crypto wealth. Real User Feedback:“Since using Cryptosolo, mining has never been easier. I receive stable daily income, and the setup is incredibly convenient. It has truly transformed my mining experience!” Join Cryptosolo Now and Start Growing Your Crypto Assets! Cloud mining offers crypto investors a low-barrier, low-risk way to grow their digital assets. Choose Cryptosolo to enjoy smart mining, eco-friendly operations, and flexible contracts. Register now to receive a $15 free trial bonus and start mining Bitcoin, Ethereum, Dogecoin, and more with ease. Don’t miss your chance—embrace your digital wealth future with Cryptosolo! Disclaimer: This is a sponsored article and is for informational purposes only. It does not reflect the views of Crypto Daily, nor is it intended to be used as legal, tax, investment, or financial advice.",cryptodaily,https://cryptodaily.co.uk/2025/07/top-5-hottest-cloud-mining-platforms-of-2025-zero-threshold-smart-mining-everyone-can-easily-earn-bitcoin,"MINING|BTC|BUSINESS|ALTCOIN|DOGE","More News",cryptocompare
2025-07-16T19:32:08,"BREAKING NEWS: The US Government Allegedly Holds Far Fewer Bitcoins Than Estimated – Big if True","The US Marshals Service (USMS), affiliated with the US Department of Justice, announced in its official response dated July 15, 2025, that the state currently has only 28,988 Bitcoins left. This figure represents a significant decrease from the previously publicly estimated figure of approximately 200,000 BTC, which at current prices is worth approximately $3.44 billion. Documents shared in response to a FOIA (Freedom of Information Act) request on March 24, 2025, contain a detailed breakdown of the government's Bitcoin holdings. The USMS stated that the information in these documents was compiled by the Asset Forfeiture Division (AFD). The agency also emphasized that some pages in the memorandum were partially censored and shared. Full list of BTC holdings. Request was dated March 24, response is from today. DM me your email, I'll send you the files. Total BTC holdings are 28,988.35643016, or approx. $3.44 Billion at current price. US Marshal Service liquidates assets in public auctions, so unless they… pic.twitter.com/e4Z5rHbHtG — L0la L33tz (@L0laL33tz) July 16, 2025 Related News: Fugitive Zhu Su, Founder of Failed Crypto Company 3AC, Makes Critical Remarks About Solana (SOL) - Shares Why He's Big Bull on SOL Because the USMS regularly sells its digital assets through public auctions, this list is assumed to be current and accurate unless an official sale is announced. The US government's Bitcoin reserves have swelled over the years due to seizures following major lawsuits like the Silk Road operation. However, according to recent data, the majority of these assets have allegedly been liquidated. *This is not investment advice. Continue Reading: BREAKING NEWS: The US Government Allegedly Holds Far Fewer Bitcoins Than Estimated – Big if True",bitcoinsistemi,https://en.bitcoinsistemi.com/breaking-news-the-us-government-allegedly-holds-far-fewer-bitcoins-than-estimated-big-if-true/,"BTC|SOL|TRADING|MARKET","Bitcoin|News",cryptocompare
2025-07-16T19:30:06,"US Stock Market Boost: Major Indices Open Higher, What It Means for Crypto","BitcoinWorld US Stock Market Boost: Major Indices Open Higher, What It Means for Crypto For anyone tracking the pulse of global finance, especially those deeply entrenched in the dynamic world of cryptocurrencies, the performance of the traditional US Stock Market is always a key indicator. Today brought a wave of positive news as major U.S. stock indices opened higher, signaling a potentially robust day for investors. But what does this uptick in traditional markets truly signify for the often-volatile crypto space? Let’s dive into the details and uncover the ripple effects. The US Stock Market Sees a Promising Market Open The trading day kicked off with an optimistic tone across Wall Street, as all three major U.S. stock indices registered gains right out of the gate. This immediate positive momentum suggests a prevailing sense of optimism among traders and investors, eager to capitalize on potential opportunities. Here’s a quick snapshot of the opening performance: S&P500: +0.17% NASDAQ: +0.05% Dow: +0.29% These early gains, while modest, set a positive precedent for the day. The S&P 500, widely regarded as one of the best gauges of large-cap U.S. equities, showing green is often a good sign for overall market health. Similarly, the Dow Jones Industrial Average, representing 30 significant U.S. companies, and the technology-heavy NASDAQ Composite, both starting strong, reinforce this positive sentiment. What’s Driving This Investor Confidence ? When markets open higher, it’s rarely due to a single factor. Instead, it’s often a confluence of various macroeconomic indicators, corporate news, and prevailing sentiment. So, what might be fueling this initial burst of investor confidence today? Several elements typically contribute to such positive openings: Favorable Economic Data: Recent releases concerning inflation, employment, or consumer spending might have painted a more optimistic picture of the economy, alleviating fears of a slowdown or recession. Positive Corporate Earnings: Strong earnings reports from bellwether companies can often lift the entire market, as they signal robust business health and future growth potential. Even if no major reports were out this morning, positive pre-market news or analyst upgrades could have set the tone. Anticipation of Monetary Policy: Expectations regarding the Federal Reserve’s stance on interest rates or quantitative easing can significantly impact market sentiment. A perceived dovish tilt or stability in policy can encourage risk-taking. Geopolitical Stability: A period of reduced geopolitical tension or positive diplomatic developments can also contribute to a more stable and confident market environment. Technical Rebound: Sometimes, a positive open is simply a technical rebound after a period of consolidation or minor correction, as investors look to buy the dip or re-enter positions. Understanding these underlying drivers is crucial, as they provide context not just for the stock market, but also for how other asset classes, including cryptocurrencies, might behave. Analyzing NASDAQ Performance and Broader Market Trends The NASDAQ Performance , while showing a modest gain of +0.05% at the open, is particularly noteworthy for crypto enthusiasts. The NASDAQ Composite is heavily weighted towards technology and growth stocks, many of which are seen as more sensitive to interest rate changes and broader economic shifts than their value counterparts. In recent years, the correlation between tech stocks and cryptocurrencies has become increasingly apparent, with both often reacting similarly to macro-economic news. Why is NASDAQ’s performance so relevant? Risk-On Appetite: A positive NASDAQ suggests that investors are willing to take on more risk, favoring growth-oriented assets. This ‘risk-on’ sentiment often spills over into the crypto market, as digital assets are generally considered higher-risk, higher-reward investments. Innovation and Disruption: Both the tech sector and the crypto industry are built on innovation and disruption. Positive sentiment in one often indicates a broader belief in the power of technology to drive future economic growth. Liquidity Flows: When large institutional investors see opportunities in the tech sector, it can free up capital or create a positive feedback loop that eventually finds its way into other speculative assets, including Bitcoin and altcoins. Monitoring the NASDAQ throughout the day will provide further clues about the sustained appetite for growth and innovation, which could indirectly bolster crypto prices. The S&P 500 and Dow Jones: Barometers of Economic Health While the NASDAQ captures the tech pulse, the S&P 500 and the Dow Jones Industrial Average offer a broader perspective on the health of the U.S. economy. The S&P 500, comprising 500 of the largest U.S. companies across various sectors, is often considered the best single gauge of large-cap U.S. equities. Its positive open of +0.17% indicates broad-based optimism, not just confined to the tech sector. The Dow Jones, though less diversified, represents established industrial giants and blue-chip companies. Its +0.29% gain suggests that even traditional sectors are experiencing a positive start, hinting at a robust economic environment. When these major indices move in unison, it often signals a strong underlying sentiment that transcends specific industries. This synchronized positive movement across the S&P 500, NASDAQ, and Dow is crucial because it paints a picture of: Broad Market Confidence: It’s not just one sector or a few companies doing well; the optimism is more widespread. Reduced Systemic Risk Fears: When major indices are up, it often means that immediate systemic risks (like a financial crisis or major economic downturn) are perceived as low. Capital Allocation: A healthy stock market can encourage capital to flow into other asset classes, including those perceived as riskier, like cryptocurrencies. Implications of Today’s Market Open for Crypto Investors The positive market open in traditional equities holds significant implications for the cryptocurrency market. Historically, there has been a notable correlation between the performance of major stock indices, particularly the NASDAQ, and the price movements of cryptocurrencies like Bitcoin and Ethereum. Here’s how today’s stock market performance could influence your crypto portfolio: Factor Impact on Crypto Explanation Risk-On Sentiment Positive When investors feel confident in traditional markets, they are more likely to allocate capital to higher-risk assets like cryptocurrencies. Increased Liquidity Positive A rising stock market can free up capital or generate profits that investors might re-invest into crypto, seeking higher returns. Institutional Interest Positive Large institutions often manage diversified portfolios. A strong stock market performance might make them more comfortable with crypto exposure. Macroeconomic Stability Positive A perception of stable economic conditions reduces the need for ‘safe haven’ assets, allowing more speculative investments to thrive. Potential Decoupling Neutral/Negative (Less Likely) While correlation is common, some argue for a future ‘decoupling.’ However, today’s open suggests continued linkage. While cryptocurrencies are known for their unique market dynamics and often react to their own set of news (e.g., regulatory developments, technological upgrades, specific project news), they are not entirely insulated from broader macroeconomic trends. A rising tide in the stock market often lifts many boats, and crypto has increasingly become one of those boats. Challenges and Considerations Amidst the Gains Despite the positive open, it’s crucial for investors to maintain a balanced perspective. The financial markets are complex, and short-term gains do not guarantee long-term stability. Several challenges could still impact the trajectory of both traditional stocks and cryptocurrencies: Inflationary Pressures: Persistent high inflation could still prompt central banks to adopt more aggressive monetary policies, which typically dampen market enthusiasm. Interest Rate Hikes: Further rate hikes, if deemed necessary to combat inflation, could increase borrowing costs for businesses and consumers, potentially slowing economic growth and impacting corporate earnings. Geopolitical Risks: Unforeseen geopolitical events can quickly shift market sentiment from ‘risk-on’ to ‘risk-off,’ leading to sell-offs across asset classes. Regulatory Scrutiny: For the crypto market specifically, increasing regulatory scrutiny worldwide remains a significant overhang that can introduce volatility regardless of traditional market performance. Market Volatility: Both stock and crypto markets are inherently volatile. A positive open can quickly reverse course due to unexpected news or a shift in sentiment. Therefore, while today’s start is encouraging, it serves as a reminder to stay informed and agile in your investment strategy. Actionable Insights for Navigating Market Volatility For investors, particularly those with exposure to both traditional stocks and cryptocurrencies, today’s positive market open offers several actionable insights: Stay Informed: Continue to monitor economic data releases, corporate earnings, and central bank communications. These are the fundamental drivers of market sentiment. Diversify Your Portfolio: While correlation exists, diversification across different asset classes (stocks, bonds, crypto, real estate) can help mitigate risks during periods of high volatility. Understand Your Risk Tolerance: Before making any investment decisions, assess your personal risk tolerance. A positive market day might encourage aggressive moves, but it’s important to stick to a strategy that aligns with your financial goals and comfort level. Look Beyond Daily Swings: Focus on long-term trends rather than reacting to every daily fluctuation. A strong long-term investment thesis is often more resilient than short-term trading strategies. Consider Dollar-Cost Averaging: For crypto investors, dollar-cost averaging (investing a fixed amount regularly, regardless of price) can be an effective strategy to navigate market ups and downs, taking advantage of both dips and rallies. Conclusion: A Glimmer of Hope in Dynamic Markets Today’s higher open for the U.S. stock markets – with the S&P 500, NASDAQ, and Dow all in positive territory – is a welcome sight for investors globally. It signals a moment of renewed investor confidence , potentially driven by a mix of favorable economic conditions and a willingness to embrace risk. For the cryptocurrency market, this positive momentum in traditional finance often acts as a tailwind, fostering a ‘risk-on’ environment that can encourage capital flows into digital assets. While challenges and uncertainties always loom, today’s strong start offers a glimmer of hope and reinforces the interconnectedness of global financial markets. Staying informed, maintaining a diversified approach, and understanding the broader macroeconomic landscape will be key to navigating the dynamic interplay between traditional stocks and the ever-evolving world of crypto. To learn more about the latest US Stock Market trends, explore our article on key developments shaping investor confidence and its impact on crypto market correlation . This post US Stock Market Boost: Major Indices Open Higher, What It Means for Crypto first appeared on BitcoinWorld and is written by Editorial Team",bitcoinworld,https://bitcoinworld.co.in/us-stock-market-boost/,"MARKET|BUSINESS|TRADING|BTC|FIAT","Crypto News|Crypto Market|investor confidence|Market Trends|S&P 500|US Stock Market",cryptocompare
