datetime,headline,summary,source,url
2025-05-15T12:25:29.000Z,"Key Reasons Monero Surge Continues Even as Bitcoin Bulls Take a Breather","",CoinDesk,https://www.coindesk.com/markets/2025/05/15/key-reasons-monero-xmr-price-rally-continues-even-as-bitcoin-btc-takes-bull-breather
2025-05-15T12:21:26.000Z,"Bitcoin to $1M by 2028 as Hayes tells Europe to ’get your money out’","Key points:US Treasurys and foreign capital “repatriation” make a recipe for $1 million BTC, says Arthur Hayes.Europeans face tightening capital controls, inviting a recommendation to take back control of personal funds.Seven-figure BTC price targets are already gaining traction.Bitcoin (BTC) will shoot to $1 million in just three years, thanks to global macroeconomic shifts, Arthur Hayes forecasts.In his latest blog post released on May 15, the former CEO of crypto exchange BitMEX doubled down on his sky-high BTC price prediction.Hayes: $1 million Bitcoin due “between now and 2028”Bitcoin has two strong tailwinds that will help propel it to seven digits in a few years.For Hayes, shifting capital controls worldwide and US Treasury “devaluation” means that Bitcoin will become the go-to safety net for investors everywhere.He summarized:“Foreign capital repatriation and the devaluation of the gargantuan stock of US Treasurys will be the two catalysts that will power Bitcoin to $1 million sometime between now and 2028.”TLT US exchange-traded fund indexed in gold, Bitcoin (screenshot). Source: Arthur Hayes/SubstackWhile that date may appear arbitrary and demand 900% BTC price gains, Hayes argued that the financial landscape could change in an instant, depending on the next US governmental administration.“I say 2028, because that is when the next US presidential election occurs and who knows what type of politician will win and what policies they will enact,” he said.While the presidency of Donald Trump has enacted various pro-crypto policies, this could begin to reverse if a shift in government were to occur. In Europe, meanwhile, an increasing desire to control and even suppress crypto use by the general population signals a growing divergence.“Not even China has banned the private ownership of Bitcoin because it knows it’s counterproductive and impossible,” Hayes wrote. “For you Euro-poor-peans, whose governments practice a less effective form of communism than China, don’t expect the European Central Bank (ECB) to learn this lesson without trying. Therefore, get your money out now!”Betting on a seven-figure breakoutAs Cointelegraph reported, Hayes has not been shy about predicting both short-term and longer-term BTC price expansion in the years to come.Related: Bitcoin looks ‘ridiculous’ as bulls attempt $2T market cap flip — AnalystIn April, he foresaw the return to $100,000, and before that, joined those seeing the mid-$70,000 zone as a likely local bottom.Multimillion-dollar targets for the next decade include those of major financial players such as Fidelity Investments.Michael Saylor, CEO of business intelligence firm Strategy, which has the world’s largest Bitcoin treasury of any public company, said this week that he envisaged a $10 trillion valuation.“My forecast for 2045 is 13 million a Bitcoin,” he added.This article does not contain investment advice or recommendations. Every investment and trading move involves risk, and readers should conduct their own research when making a decision.",Cointelegraph,https://cointelegraph.com/news/arthur-hayes-btc-1m-by-2028-europe-get-money-out?utm_source=rss_feed&utm_medium=rss%3F&utm_campaign=rss_partner_inbound
2025-05-15T12:21:26.000Z,"Bitcoin to $1M by 2028 as Hayes tells Europe to ’get your money out’","Key points:US treasuries and foreign capital “repatriation” make a recipe for $1 million BTC, says Arthur Hayes.Europeans face tightening capital controls, inviting a recommendation to take back control of personal funds.Seven-figure BTC price targets are already gaining traction.Bitcoin (BTC) will shoot to $1 million in just three years thanks to global macroeconomic shifts, Arthur Hayes forecasts.In his latest blog post released on May 15, the former CEO of crypto exchange BitMEX doubled down on his sky-high BTC price prediction.Hayes: $1 million Bitcoin due “between now and 2028”Bitcoin has two giant tailwinds that will help propel it to seven digits in just a few years.For Hayes, shifting capital controls worldwide, as well as US treasury “devaluation,” mean that Bitcoin will become the go-to safety net for investors everywhere.He summarizes:“Foreign capital repatriation and the devaluation of the gargantuan stock of US treasuries will be the two catalysts that will power Bitcoin to $1 million sometime between now and 2028.”TLT US exchange-traded fund indexed in gold, Bitcoin (screenshot). Source: Arthur Hayes/SubstackWhile that date may appear arbitrary and demand 900% BTC price gains, Hayes argues that the financial landscape could change in an instant depending on the next US governmental administration.“I say 2028, because that is when the next US presidential election occurs and who knows what type of politician will win and what policies they will enact,” he continues.While the Presidency of Donald Trump has enacted various pro-crypto policies, these could also begin to reverse if a shift in government occurs. In Europe, meanwhile, an increasing desire to control and even suppress crypto use by the general population signals a growing divergence.“Not even China has banned the private ownership of Bitcoin because it knows it’s counterproductive and impossible,” Hayes writes. “For you Euro-poor-peans, whose governments practice a less effective form of communism than China, don’t expect the European Central Bank (ECB) to learn this lesson without trying. Therefore, get your money out now!”Betting on a seven-figure breakoutAs Cointelegraph reported, Hayes has not been shy about predicting both short-term and longer-term BTC price expansion in the years to come.Related: Bitcoin looks ‘ridiculous’ as bulls attempt $2T market cap flip — AnalystIn April, he foresaw the return to $100,000, and before that, joined those seeing the mid-$70,000 zone as a likely local bottom.Multimillion-dollar targets for the next decade include those of major financial players such as Fidelity Investments.Michael Saylor, CEO of business intelligence firm Strategy, which has the world’s largest Bitcoin treasury of any public company, told mainstream media this week that he envisages a $10 trillion valuation.“My forecast for 2045 is 13 million a Bitcoin,” he added.This article does not contain investment advice or recommendations. Every investment and trading move involves risk, and readers should conduct their own research when making a decision.",Cointelegraph,https://cointelegraph.com/news/arthur-hayes-btc-1m-by-2028-europe-get-money-out?utm_source=rss_feed&utm_medium=rss&utm_campaign=rss_partner_inbound
2025-05-15T12:16:29.000Z,"Capital Creeps Back Into Solana as On-Chain Demand Shows Early Signs of Recovery","",CoinDesk,https://www.coindesk.com/markets/2025/05/15/capital-creeps-back-into-solana-as-on-chain-demand-shows-early-signs-of-recovery
2025-05-15T12:14:56.000Z,"DEX Aggregator CoW Swap Targets 33% Trading Boost With Collaboration Feature, More Rewards","",CoinDesk,https://www.coindesk.com/tech/2025/05/15/dex-aggregator-cow-swap-targets-33-trading-boost-with-collaboration-feature-more-rewards
2025-05-15T12:09:08.000Z,"Jim Chanos takes opposing bets on Bitcoin and Strategy","Prominent short-seller Jim Chanos, once a vocal critic of Bitcoin and cryptocurrencies, revealed a new trading play that involves shorting shares of Strategy (formerly MicroStrategy) and buying Bitcoin.At the Sohn Investment Conference in New York, Chanos told CNBC he’s “selling MicroStrategy stock and buying Bitcoin.” The investor described the move as buying something for $1 and selling something for $2.50, referring to what he sees as a significant price mismatch.Chanos argued that Strategy is selling the idea of buying Bitcoin (BTC) in a corporate structure, and that other companies are following suit in hopes of receiving a similar market premium.Chanos said this was “ridiculous.” He described his trade as “a good barometer of not only just the arbitrage itself, but I think of retail speculation.”Selling Strategy stock to buy BitcoinChanos’ recent move assumes investors overpay for Bitcoin exposure through corporate wrappers like Strategy and other firms that follow its Bitcoin accumulation blueprint. The investor’s move reflects a stance that purchasing Bitcoin directly would be better than purchasing Strategy’s stocks for indirect Bitcoin exposure. Chanos’ move suggests that holding Bitcoin through companies reflects excessive speculation and risk mispricing. It assumes that retail investors’ idea of having Bitcoin indirectly through corporate wrappers can inflate the company’s stock valuations. While shorting Strategy may seem like a good idea, investors have already lost billions shorting Saylor’s company. In 2024, investors who bet against the firm lost about $3.3 billion as the stock rose. As of May 2025, Strategy holds about 568,840 Bitcoin, valued at around $59 billion. Since the company started accumulating Bitcoin in 2020, its stock price has surged by 1,500%, outperforming the S&P 500’s gains during the same period. In a recently released documentary from the Financial Times, Strategy analyst Jeff Walton said that the company’s Bitcoin holdings would help it become the “number one publicly traded equity in the entire market” in the future.Chanos previously called Bitcoin a “libertarian fantasy”  Chanos has not always been favorable toward Bitcoin. In a 2018 interview, Chanos described Bitcoin as a “libertarian fantasy.” Chanos said that having digital currency as a store of value in the worst-case scenario wouldn’t work. The investor said that if fiat currency brings the world down, the last thing he’d want to own is Bitcoin. “Food would work the best,” he said. He also criticized Bitcoin for enabling illicit activity, calling the crypto sector “the dark side of finance” in a 2023 interview, and accusing the industry of facilitating tax evasion and money laundering.Chanos also expressed skepticism about spot Bitcoin exchange-traded funds (ETFs), saying that Wall Street needs to keep the public interested in crypto to profit from the fees. Despite those critiques, Chanos now appears to see value in holding Bitcoin directly, particularly in contrast to investing in public companies with large BTC treasuries.Related: $1B Bitcoin exits Coinbase in a day as analysts warn of supply shockChanos’ history in short-sellingChanos is best known for his short position against the energy company Enron before the firm filed for bankruptcy in 2001. The move generated profits for Kynikos Associates, a firm that he founded. A short position involves borrowing assets from a broker, selling them at the current price, and then repurchasing the assets once the value falls to give back what is owed to the broker. Short sellers profit when the asset’s value declines, but face losses when the asset appreciates. While the investor profited from short-selling Enron, Chanos’ predictions weren’t always correct. Chanos was bearish on Tesla and announced a short position in 2016. Tesla stock skyrocketed by 2,200% between 2015 and 2021. The event caused major losses to Chanos’ fund. In 2020, the fund ended with $405 million in assets under management after having over $900 million the previous year. The fund was converted into a family office, and external assets were returned to investors. Magazine: Danger signs for Bitcoin as retail abandons it to institutions: Sky Wee",Cointelegraph,https://cointelegraph.com/news/chanos-shorts-microstrategy-buys-bitcoin-retail-speculation?utm_source=rss_feed&utm_medium=rss%3F&utm_campaign=rss_partner_inbound
2025-05-15T12:09:08.000Z,"Jim Chanos takes opposing bets on Bitcoin and Strategy","Prominent short-seller Jim Chanos, once a vocal critic of Bitcoin and cryptocurrencies, revealed a new trading play that involves shorting shares of Strategy (formerly MicroStrategy) and buying Bitcoin.At the Sohn Investment Conference in New York, Chanos told CNBC he’s “selling MicroStrategy stock and buying Bitcoin.” The investor described the move as buying something for $1 and selling something for $2.50, referring to what he sees as a significant price mismatch.Chanos argued that Strategy is selling the idea of buying Bitcoin (BTC) in a corporate structure, and that other companies are following suit in hopes of receiving a similar market premium.Chanos said this was “ridiculous.” He described his trade as “a good barometer of not only just the arbitrage itself, but I think of retail speculation.”Selling Strategy stock to buy BitcoinChanos’ recent move assumes investors overpay for Bitcoin exposure through corporate wrappers like Strategy and other firms that follow its Bitcoin accumulation blueprint. The investor’s move reflects a stance that purchasing Bitcoin directly would be better than purchasing Strategy’s stocks for indirect Bitcoin exposure. Chanos’ move suggests that holding Bitcoin through companies reflects excessive speculation and risk mispricing. It assumes that retail investors’ idea of having Bitcoin indirectly through corporate wrappers can inflate the company’s stock valuations. While shorting Strategy may seem like a good idea, investors have already lost billions shorting Saylor’s company. In 2024, investors who bet against the firm lost about $3.3 billion as the stock rose. As of May 2025, Strategy holds about 568,840 Bitcoin, valued at around $59 billion. Since the company started accumulating Bitcoin in 2020, its stock price has surged by 1,500%, outperforming the S&P 500’s gains during the same period. In a recently released documentary from the Financial Times, Strategy analyst Jeff Walton said that the company’s Bitcoin holdings would help it become the “number one publicly traded equity in the entire market” in the future.Chanos previously called Bitcoin a “libertarian fantasy”  Chanos has not always been favorable toward Bitcoin. In a 2018 interview, Chanos described Bitcoin as a “libertarian fantasy.” Chanos said that having digital currency as a store of value in the worst-case scenario wouldn’t work. The investor said that if fiat currency brings the world down, the last thing he’d want to own is Bitcoin. “Food would work the best,” he said. He also criticized Bitcoin for enabling illicit activity, calling the crypto sector “the dark side of finance” in a 2023 interview, and accusing the industry of facilitating tax evasion and money laundering.Chanos also expressed skepticism about spot Bitcoin exchange-traded funds (ETFs), saying that Wall Street needs to keep the public interested in crypto to profit from the fees. Despite those critiques, Chanos now appears to see value in holding Bitcoin directly, particularly in contrast to investing in public companies with large BTC treasuries.Related: $1B Bitcoin exits Coinbase in a day as analysts warn of supply shockChanos’ history in short-sellingChanos is best known for his short position against the energy company Enron before the firm filed for bankruptcy in 2001. The move generated profits for Kynikos Associates, a firm that he founded. A short position involves borrowing assets from a broker, selling them at the current price, and then repurchasing the assets once the value falls to give back what is owed to the broker. Short sellers profit when the asset’s value declines, but face losses when the asset appreciates. While the investor profited from short-selling Enron, Chanos’ predictions weren’t always correct. Chanos was bearish on Tesla and announced a short position in 2016. Tesla stock skyrocketed by 2,200% between 2015 and 2021. The event caused major losses to Chanos’ fund. In 2020, the fund ended with $405 million in assets under management after having over $900 million the previous year. The fund was converted into a family office, and external assets were returned to investors. Magazine: Danger signs for Bitcoin as retail abandons it to institutions: Sky Wee",Cointelegraph,https://cointelegraph.com/news/chanos-shorts-microstrategy-buys-bitcoin-retail-speculation?utm_source=rss_feed&utm_medium=rss&utm_campaign=rss_partner_inbound
2025-05-15T11:58:19.000Z,"Stablecoins seen as ideal fit for real-time collateral management","Cryptocurrencies and stablecoins are gaining recognition in the traditional finance (TradFi) space for their ability to streamline payments and increase efficiency in existing financial systemsIn finance, collateral management refers to the process of managing the underlying collateral securing other financial transactions, such as loans or derivatives, to mitigate credit risks and ensure smooth transactions.Digital assets like stablecoins are the “perfect” financial instrument for real-time collateral management, according to a recent pilot by DTCC Digital Assets, which suggests that digital assets, particularly stablecoins, could modernize and simplify this critical function.“Digital assets really are the perfect use case for collateral management, whether it be uncleared derivatives, clear derivatives, central counterparties, repo, or any other type of collateral,” said Joseph Spiro, product director at DTCC Digital Assets, during a panel at Consensus 2025.From left: Ian Allison, CoinDesk reporter; Jelena DDjuric, CEO of Noble; Kyle Hauptman, chairman of the National Credit Union Administration, and Joseph Spiro, digital assets product director at DTCC Digital Assets. Source: CointelegraphCollateral management requires complicated manual processes due to stringent requirements for locked-up collateral that can only be released to the appropriate parties at pre-set intervals.“All of that can be accomplished better, faster, more efficiently through digital assets and smart contracts,” Spiro said, adding that “all the manual processing can go away.”Related: Top South Korean presidential hopefuls support legalizing Bitcoin ETFsThe pilot, dubbed the “Great Collateral Experiment,” comes as US policymakers work toward clear regulatory frameworks for stablecoins.On May 14, at least 60 of the top crypto founders gathered in Washington, DC, to support the Guiding and Establishing National Innovation for US Stablecoins, or GENIUS Act. The bill initially failed to get enough support from Democrats on May 8.Coinbase CEO in Washington, DC on May 14. Source: Brian ArmstrongThe GENIUS Act seeks to establish collateralization guidelines for stablecoin issuers while requiring full compliance with Anti-Money Laundering laws.The bill stalled on May 8 after failing to gain support from key Democrats, some of whom have voiced concerns about US President Donald Trump potentially profiting from digital assets through his crypto-related ventures.Related: Ukraine strategic Bitcoin reserve bill reportedly in final stagesStablecoins can streamline lending and settlementIncorporating stablecoins into traditional fiat-backed loans could further streamline TradFi processes, according to Kyle Hauptman, chairman of the National Credit Union Administration.The programmability of stablecoins could make the loan repayment process more transparent and streamlined for all participants. It is currently a “clunky process where they settle at the end of the month,” Hauptaman said during the same panel discussion, adding:“Stablecoins and their programmability can make this vastly easier.”“We not only made life easier for credit unions to settle these things up, you could do it for smaller amounts of money, but the borrower should get a better deal here because now this thing has some of the traits of a large bond issuance. It’s now liquid,” he said.Another piece of legislation — the Stablecoin Transparency and Accountability for a Better Ledger Economy (STABLE) Act — passed the House Financial Services Committee on April 2 in a 32–17 vote. The bill awaits scheduling for debate and a floor vote in the House of Representatives.  Magazine: Bitcoin to $1M ‘by 2029,’ CIA tips its hat to Bitcoin: Hodler’s Digest, April 27 – May 3",Cointelegraph,https://cointelegraph.com/news/stablecoins-perfect-use-case-tradfi-collateral-management?utm_source=rss_feed&utm_medium=rss%3F&utm_campaign=rss_partner_inbound
2025-05-15T11:58:19.000Z,"Stablecoins seen as ideal fit for real-time collateral management","Cryptocurrencies and stablecoins are gaining recognition in the traditional finance (TradFi) space for their ability to streamline payments and increase efficiency in existing financial systemsIn finance, collateral management refers to the process of managing the underlying collateral securing other financial transactions, such as loans or derivatives, to mitigate credit risks and ensure smooth transactions.Digital assets like stablecoins are the “perfect” financial instrument for real-time collateral management, according to a recent pilot by DTCC Digital Assets, which suggests that digital assets, particularly stablecoins, could modernize and simplify this critical function.“Digital assets really are the perfect use case for collateral management, whether it be uncleared derivatives, clear derivatives, central counterparties, repo, or any other type of collateral,” said Joseph Spiro, product director at DTCC Digital Assets, during a panel at Consensus 2025.From left: Ian Allison, CoinDesk reporter; Jelena DDjuric, CEO of Noble; Kyle Hauptman, chairman of the National Credit Union Administration, and Joseph Spiro, digital assets product director at DTCC Digital Assets. Source: CointelegraphCollateral management requires complicated manual processes due to stringent requirements for locked-up collateral that can only be released to the appropriate parties at pre-set intervals.“All of that can be accomplished better, faster, more efficiently through digital assets and smart contracts,” Spiro said, adding that “all the manual processing can go away.”Related: Top South Korean presidential hopefuls support legalizing Bitcoin ETFsThe pilot, dubbed the “Great Collateral Experiment,” comes as US policymakers work toward clear regulatory frameworks for stablecoins.On May 14, at least 60 of the top crypto founders gathered in Washington, DC, to support the Guiding and Establishing National Innovation for US Stablecoins, or GENIUS Act. The bill initially failed to get enough support from Democrats on May 8.Coinbase CEO in Washington, DC on May 14. Source: Brian ArmstrongThe GENIUS Act seeks to establish collateralization guidelines for stablecoin issuers while requiring full compliance with Anti-Money Laundering laws.The bill stalled on May 8 after failing to gain support from key Democrats, some of whom have voiced concerns about US President Donald Trump potentially profiting from digital assets through his crypto-related ventures.Related: Ukraine strategic Bitcoin reserve bill reportedly in final stagesStablecoins can streamline lending and settlementIncorporating stablecoins into traditional fiat-backed loans could further streamline TradFi processes, according to Kyle Hauptman, chairman of the National Credit Union Administration.The programmability of stablecoins could make the loan repayment process more transparent and streamlined for all participants. It is currently a “clunky process where they settle at the end of the month,” Hauptaman said during the same panel discussion, adding:“Stablecoins and their programmability can make this vastly easier.”“We not only made life easier for credit unions to settle these things up, you could do it for smaller amounts of money, but the borrower should get a better deal here because now this thing has some of the traits of a large bond issuance. It’s now liquid,” he said.Another piece of legislation — the Stablecoin Transparency and Accountability for a Better Ledger Economy (STABLE) Act — passed the House Financial Services Committee on April 2 in a 32–17 vote. The bill awaits scheduling for debate and a floor vote in the House of Representatives.  Magazine: Bitcoin to $1M ‘by 2029,’ CIA tips its hat to Bitcoin: Hodler’s Digest, April 27 – May 3",Cointelegraph,https://cointelegraph.com/news/stablecoins-perfect-use-case-tradfi-collateral-management?utm_source=rss_feed&utm_medium=rss&utm_campaign=rss_partner_inbound
