datetime,headline,summary,source,url,categories,tags,api_source
2025-07-03T06:24:26,"SOL rebounds on staking ETF launch, targets $170 next","The cryptocurrency market was bullish on Wednesday following a poor start to the week. Bitcoin rallied by nearly 3% to retest the $110k mark before retracing to now trade around $108,900. Solana’s SOL was one of the best performers among the top 10 cryptocurrencies by market cap, surpassing the $150 psychological mark in the process. Backed by strong fundamentals, SOL could be on the verge of a breakout as analysts expect a volatile July. The REX-Osprey Solana + Staking ETF hits $33m in trading volume on debut day The major driver behind SOL’s recent rally is the launch of the REX-Osprey Solana + Staking ETF. The ETF began trading on Wednesday and recorded one of the best debut days for exchange-traded funds. Bloomberg Senior ETF Analyst Eric Balchunas revealed that the ETF recorded a $33 million trading volume on its first day, outperforming recent Solana and XRP ETF debuts. Eric Balchunas @EricBalchunas · Follow Replying to @EricBalchunas $SSK ended day with $33m in volume. Again, blows away the Solana futures ETF and XRP futures ETFs (or the avg ETF launch) but it is much lower than the Bitcoin and Ether spot ETFs. 10:01 PM · Jul 2, 2025 61 Reply Copy link Read 10 replies In addition to that, the fund closed the day with about $1 million in assets under management. According to the ETF issuer, the fund is regulated under the Investment Company Act of 1940 and uses Anchorage as a custodian. The high trading volume of the ETF suggests interest from Wall Street. Coinvo recently revealed that institutional interest in Solana funds continues to increase. Coinvo’s recent chart revealed that SOL futures volume on the CME has just hit an all-time high. This surge in volume from institutional investors is a strong sign that big players are actively positioning. MartyParty @martypartymusic · Follow #Solana News: Wall Street has discovered @solana – @CMEGroup $SOL Futures volume goes exponential. 7:53 PM · Jul 2, 2025 623 Reply Copy link Read 28 replies SOL targets $170, showing signs of recovery The SOL/USD 4-hour chart remains bearish, but indicators suggest the pair could rally higher soon. The chart is efficient, indicating that the bears have grabbed liquidity to the downside. Despite the bearish trend on the higher timeframe, SOL is showing signs of extending its recovery after adding nearly 4% to its value in the last 24 hours. The Relative Strength Index (RSI) of 60 shows that SOL is no longer facing selling pressure, with buyers increasingly taking control of the market. The Moving Average Convergence Divergence (MACD) lines are also within the positive territory, suggesting a bullish bias. SOL could be targeting the Transactional Liquidity (TLQ) level at $162 over the next few hours or so. If the rally continues, SOL could retest the next major resistance level at $174, its highest price since May 29. SOL is currently hovering around the $150 zone, with the support line suggesting that the current levels could be a base. If SOL could embark on a strong rally, key resistance levels to watch out for in the medium term include $220 and $300. However, if the bearish trend returns, SOL could retest the weekend low of $137 once again. An extended bearish run would see SOL dip further to the $125 support level, with the next key support around $99. The post SOL rebounds on staking ETF launch, targets $170 next appeared first on Invezz",invezz,https://invezz.com/news/2025/07/03/sol-rebounds-on-staking-etf-launch-targets-170-next/,"SOL|TRADING|MARKET|ALTCOIN|BTC","Altcoins|Crypto|Solana",cryptocompare
2025-07-03T06:22:24,"Forza Raises $3.8 Million to Expand Bitcoin Holdings Under Coinsilium Group","Forza, operating under the umbrella of the UK-listed Coinsilium Group, has successfully secured around $3.8 million in funding aimed at expanding its Bitcoin portfolio. This strategic capital injection underscores Forza’s",coinotag,https://en.coinotag.com/breakingnews/forza-raises-3-8-million-to-expand-bitcoin-holdings-under-coinsilium-group/,"BTC","BTC|Core",cryptocompare
2025-07-03T06:09:07,"First US Solana Staking ETF Sees $12M Inflows on Debut With $33M Volume","The first Solana staking exchange-traded fund (ETF) in the United States wrapped up its debut trading session with $12 million in inflows and $33 million in volume, marking a strong start for staking-focused crypto ETFs. Key Takeaways: The first US Solana staking ETF launched with $12 million in inflows and $33 million in volume. Opening day trading volumes topped earlier Solana and XRP futures ETFs. REX-Osprey’s creative fund structure overcame SEC hurdles, avoiding the standard spot ETF approval process. The REX-Osprey Solana Staking ETF, trading under the ticker SSK, launched Wednesday on the Cboe BZX Exchange. The fund offers investors exposure to Solana (SOL) while providing staking yields, positioning it as the first ETF in the U.S. to combine spot Solana exposure with staking rewards. Solana Staking ETF Outpaces Futures Funds According to Bloomberg ETF analyst Eric Balchunas , the ETF’s opening day volumes surpassed those seen by earlier Solana and XRP futures ETFs. However, they fell short of the explosive debuts of spot Bitcoin and Ether ETFs, which together recorded $4.6 billion in shares traded on their first day in January 2024. Bloomberg’s James Seyffart noted the ETF saw $8 million in trading volume within its first 20 minutes, describing it as a “healthy start to trading.” $SSK ended day with $33m in volume. Again, blows away the Solana futures ETF and XRP futures ETFs (or the avg ETF launch) but it is much lower than the Bitcoin and Ether spot ETFs. pic.twitter.com/t6LkQwDXLc — Eric Balchunas (@EricBalchunas) July 2, 2025 Anchorage Digital co-founder Nathan McCauley called the launch a “defining moment” for digital assets, highlighting its role in expanding institutional access to crypto staking opportunities. The ETF’s launch was not without hurdles. The Securities and Exchange Commission (SEC) initially raised objections in late May, questioning whether the product qualified as an “investment company” under federal securities laws. REX-Osprey navigated these challenges by structuring the fund to invest at least 40% of its assets in other exchange-traded products, many of which are listed outside the United States. The regulatory workaround allowed the fund to avoid the traditional 19b-4 filing process typically required for spot crypto ETFs. Nate Geraci, president of NovaDius Wealth Management, previously described the strategy as a “regulatory end-around,” a view shared by analysts who have debated whether the fund should be classified as a conventional spot Solana ETF. yes, altho to be fair this is some 400-level ETF technical nerd-ery — Eric Balchunas (@EricBalchunas) July 1, 2025 Strong Start Sparks Hopes for Spot Solana ETF Approval The promising debut has fueled speculation about the potential approval of true spot Solana ETFs. Both Seyffart and Balchunas recently estimated a 95% chance that the SEC will approve spot Solana ETFs before the year ends. Seyffart added that a wave of new ETFs, including products tied to XRP and Litecoin, could arrive in the second half of 2025. Meanwhile, Solana’s price saw muted movement, gaining 3.6% over the past 24 hours and trading around $153 at press time. Despite the ETF launch, SOL remains down nearly 48% from its highs earlier this year. However, Solana CME futures showed rising institutional appetite, with open interest reaching $167 million after the ETF’s debut, according to data from SolanaFloor. As reported, digital asset investment funds pulled in $2.7 billion last week, capping an 11-week streak of inflows that now totals $16.9 billion. The bulk of the inflows came from the United States, accounting for $2.65 billion. Switzerland and Germany recorded modest additions of $23 million and $19.8 million, respectively, while Canada, Hong Kong, and Brazil posted small outflows. Bitcoin remained the primary magnet for capital, drawing $2.2 billion last week, a commanding 83% of total inflows, while short-Bitcoin products extended their year-to-date outflows to $12 million. The post First US Solana Staking ETF Sees $12M Inflows on Debut With $33M Volume appeared first on Cryptonews .",cryptonews,https://cryptonews.com/news/first-us-solana-staking-etf-sees-12m-inflows-on-debut-with-33m-volume/,"SOL|TRADING|REGULATION|XRP|BTC","Altcoin News|Solana|Solana ETF",cryptocompare
2025-07-03T06:08:04,"North Korean Malware May Target Bitcoin Wallets on Mac Devices Through Sophisticated Infostealer","North Korean hackers have launched a sophisticated malware campaign targeting Apple devices, specifically aiming to compromise cryptocurrency wallets through novel attack methods. The malware, named NimDoor, exploits social engineering tactics",coinotag,https://en.coinotag.com/north-korean-malware-may-target-bitcoin-wallets-on-mac-devices-through-sophisticated-infostealer/,"BTC","News|BTC|Core|CYBER",cryptocompare
2025-07-03T06:07:43,"BlackRock’s Bitcoin ETF Overtakes Giant S&P 500 Fund with Soaring Success","BlackRock’s Bitcoin ETF surpasses S&P 500 in revenue, highlighting institutional interest. The fund attracts 52 billion USD since launch, dominating spot Bitcoin ETF sector. Continue Reading: BlackRock’s Bitcoin ETF Overtakes Giant S&P 500 Fund with Soaring Success The post BlackRock’s Bitcoin ETF Overtakes Giant S&P 500 Fund with Soaring Success appeared first on COINTURK NEWS .",cointurken,https://en.coin-turk.com/blackrocks-bitcoin-etf-overtakes-giant-sp-500-fund-with-soaring-success/,"BTC|BUSINESS","Bitcoin (BTC)",cryptocompare
2025-07-03T06:02:06,"Bitcoin Could Potentially Reach $116,000 Amid Favorable Macroeconomic Factors and ETF Inflows","Bitcoin is poised for a potential surge to $116,000, driven by a convergence of favorable macroeconomic factors and increasing institutional demand. Key indicators such as robust inflows into spot Bitcoin",coinotag,https://en.coinotag.com/bitcoin-could-potentially-reach-116000-amid-favorable-macroeconomic-factors-and-etf-inflows/,"BTC","News",cryptocompare
2025-07-03T06:00:52,"Whales Are Quietly Repositioning, Here’s What Bitcoin’s $107K Price Isn’t Telling You","Bitcoin continues to show little upward momentum as it trades below the $110,000 mark. As of the time of writing, the asset is priced at $108,071 after recording a modest 2% gain in the past 24 hours. Despite nearing its all-time high in recent weeks, Bitcoin appears to be caught in a holding pattern as institutional rebalancing and on-chain dynamics take center stage. Recent analysis by CryptoQuant contributor Kripto Mevsimi has drawn attention to unusual on-chain activity during the final days of June. Related Reading: Bitcoin Seasonality: Why Summer 2025 Will Catch Everyone Off Guard Institutional Rebalancing and Local Exhaustion Signals In a post titled “Whale Profit-Taking and Loss Realizations: Was Late June a Local Pivot Point?” the analyst noted conflicting behaviors among Bitcoin whales. A notable $641 million in realized profits was recorded alongside more than $1.24 billion in realized losses, a combination that suggests a potential inflection point in market sentiment. Mevsimi emphasized that this mixed realization trend came at the close of the second quarter, a period often associated with institutional portfolio adjustments. “Structurally, late June is also the end of H1, when ETFs and institutional funds often rebalance portfolios,” he wrote. Mevsimi added: “That timing adds weight: this wasn’t just noise — it may have been a deliberate repositioning.” Notably, these large movements in realized profit and loss did not extend into early July, which may imply either a temporary stabilization or the beginning of a new market phase. The report also detailed divergent whale behavior. Newer whales, likely short-term participants entering in Q2, showed signs of capitulation, realizing both profits and significant losses. In contrast, older whales locked in $91 million in profits with negligible losses. This division may indicate a shift in control, with experienced holders offloading risk while short-term players exited amid market uncertainty. According to Mevsimi, the convergence of these trends hints at a local exhaustion phase rather than a continued rally. Bitcoin LTH Unrealized Profits and Historical Context In a separate analysis, CryptoQuant’s Darkfost explored the unrealized profit profile of Bitcoin long-term holders (LTHs), revealing a downward trend despite BTC’s proximity to record highs. Citing the Market Value to Realized Value (MVRV) ratio, Darkfost noted that average unrealized profits have fallen to around 220%. This is well below the peaks recorded during market tops in March and December 2024, which reached 300% and 350%, respectively. “Although these profits may seem substantial, we’re still far from the levels observed during the tops of this cycle,” Darkfost stated. The realized price for LTHs now stands at approximately $39,000, suggesting a strong cushion but also reinforcing that speculative excess has yet to return in full force. Related Reading: Bitwise Just Sounded The Alarm—Bitcoin Could Explode Soon The analyst added that a return to top-cycle unrealized profit levels would require BTC to rise to around $140,000, a target echoed by several bullish forecasts. Featured image created with DALL-E, Chart from Tradingview",newsbtc,https://www.newsbtc.com/bitcoin-news/whales-are-quietly-repositioning-heres-what-bitcoins-107k-price-isnt-telling-you/,"BTC|MARKET|TRADING|BUSINESS|SPONSORED","Bitcoin News|bitcoin|bitcoin market|btc|BTCUSDT|crypto|crypto market|cryptoquant",cryptocompare
2025-07-03T06:00:33,"Ripple Follows Circle’s Lead and Applies for US Banking License","Ripple also applied for a Master Account with the Federal Reserve. These applications aim to bring Ripple’s RLUSD stablecoin under dual state and federal oversight to align with new legislation like the GENIUS Act. This follows a similar move by Circle, the issuer of USDC, which also applied for OCC approval. Meanwhile, billionaire Peter Thiel is backing a new startup- and crypto-focused bank called Erebor, which will fill the gap left by Silicon Valley Bank’s collapse. In Europe, Belgium’s KBC Bank is set to offer crypto investments via its Bolero platform. Ripple Makes Power Play in US Banking Ripple Labs is seeking a US banking license to deepen its ties with traditional finance and comply with emerging stablecoin regulations. The company’s CEO, Brad Garlinghouse, announced on X that Ripple formally applied for a national bank charter from the Office of the Comptroller of the Currency (OCC). If approved, it would bring Ripple under both federal and state regulatory oversight. The New York Department of Financial Services already supervises Ripple's RLUSD stablecoin, and Garlinghouse said that this added federal oversight will set a new standard of trust in the stablecoin industry. This development happened after a similar application by Circle Internet Group, the issuer of the USDC stablecoin. Just days earlier, Circle applied to the OCC to form a national trust bank responsible for managing its stablecoin reserves. Both moves come on the heels of the US Senate passing the GENIUS Act, which is legislation that outlines regulatory requirements for stablecoin issuers and designates the OCC as the key federal watchdog for larger players in the space. Circle’s CEO Jeremy Allaire said that the company is aligning itself with the changing regulatory landscape around dollar-pegged payment stablecoins. In addition to its OCC application, Ripple also applied for a Master Account with the Federal Reserve. This would allow Ripple to hold RLUSD reserves directly with the Fed. Garlinghouse described this feature as a critical safeguard to reinforce long-term trust in the stablecoin. The application was made via Standard Custody, a crypto custody firm that Ripple acquired in early 2024. Garlinghouse explained that the tide is turning in Washington, with Congress advancing clearer crypto regulations and traditional banks showing renewed interest in engaging with digital asset firms. This is in stark contrast to the restrictive environment of previous years, which was often referred to as “Operation Chokepoint 2.0.” XRP’s price action over the past 24 hours (Source: CoinMarketCap ) Market reaction to Ripple’s banking ambitions has been positive. XRP climbed 2.87% to $2.24. The rally began shortly after Garlinghouse’s announcement and peaked at $2.27 before slightly retreating. Peter Thiel Backs New Bank for Startups and Crypto Meanwhile, a group of billionaires, including PayPal co-founder Peter Thiel, is reportedly working on launching a new financial institution named Erebor to fill the void left by the collapse of Silicon Valley Bank in March of 2023. According to the Financial Times , Erebor will focus on serving startups and cryptocurrency companies, and has already applied for a US bank charter to operate as a fully licensed bank . Thiel’s venture capital firm, Founders Fund, is said to be among the early investors in the new bank. Other backers reportedly include Palmer Luckey, co-founder of defense contractor Anduril, and Joe Lonsdale, founder of investment firm 8VC. Thiel is a long-time supporter of Bitcoin and the broader digital asset ecosystem, and he is also known for backing Bullish, a crypto exchange that recently filed for an initial public offering in the United States. Erebor’s strategy seems to be centered on providing banking services and loans to early-stage startups and other high-risk ventures that have found it difficult to access capital in the wake of tighter financial regulations. The initiative is also seen as an attempt to reestablish a specialized financial services institution that mirrors the role Silicon Valley Bank once played in the innovation economy. The collapse of Silicon Valley Bank in 2023 sent shockwaves through the banking and crypto industries. It was shut down by California’s financial regulator after rapidly rising interest rates devalued its bond holdings. The bank failed when a flood of clients tried to withdraw funds, triggering a liquidity crisis. At the time, the bank served around half of all venture capital-backed tech and life sciences firms in the country. Bank failures in the year 2023 (Source: FDIC ) The demise of Silicon Valley Bank also contributed to a wider crisis that saw the downfall of other institutions like Silvergate Bank, Signature Bank, and First Republic Bank. The crypto sector was particularly hard-hit, with investment funds losing roughly 10% of their assets under management in a single week. According to Harvard Business Review, the bank's failure tightened credit access for venture-backed startups, which created an urgent need for a replacement institution. Although Silicon Valley Bank still operates as a division of First Citizens Bank after its acquisition in March of 2023, its collapse shed some light on the vulnerabilities in the venture capital and digital asset banking landscape. Erebor now plans to fill that gap. KBC Bank to Offer Crypto Investments KBC Bank, one of Belgium’s largest financial institutions, is preparing to allow its customers to invest in cryptocurrencies through its online investment platform Bolero. The bank confirmed that Bolero will provide access to Bitcoin and Ethereum investments later this year. A spokesperson for KBC stated that the bank is currently undergoing an analysis to become recognized as a Crypto-Asset Service Provider (CASP), with the aim of launching the service by autumn. The initiative is expected to give private investors the opportunity to invest directly in Bitcoin and Ethereum in a secure and regulated environment, with an emphasis on education and compliance. If the rollout proceeds as planned, KBC will become the first major Belgian bank to offer crypto investment services to retail clients. Currently, most Belgian investors rely on international exchanges like Binance, Coinbase, and OKX, or on fintech platforms like Revolut and N26 to access crypto markets. KBC’s move forms part of the trend among European banks that are increasingly exploring crypto investment and custody solutions. In Germany, both Deutsche Bank and Sparkassen-Finanzgruppe are reportedly preparing to introduce crypto offerings in the near future. Meanwhile, Spain’s BBVA has been advising its high-net-worth clients to allocate a portion of their portfolios to cryptocurrencies like Bitcoin. This wave of crypto adoption by banks was anticipated by industry leaders. In April, executives from major crypto firms Messari and Sygnum predicted that banks would start entering the space more aggressively in the second half of 2025, encouraged by a more favorable global regulatory landscape. Supporting this trend, Stripe’s co-founder John Collison revealed in May that the payments giant has been in discussions with several banks interested in experimenting with stablecoins.",coinpaper,https://coinpaper.com/9786/ripple-follows-circle-s-lead-and-applies-for-us-banking-license,"FIAT|BTC|BUSINESS|EXCHANGE|MARKET","News|Crypto",cryptocompare
2025-07-03T05:55:36,"Bitcoin may tap $116K in July amid ‘perfect storm’ of macro catalysts","A move to $116,000 represents a 6.45% jump from Bitcoin’s price at the time of publication.",cointelegraph,https://cointelegraph.com/news/bitcoin-price-forecast-macro-catalysts-etf-fed-reserve?utm_source=rss_feed&utm_medium=rss&utm_campaign=rss_partner_inbound,"BTC|TRADING","",cryptocompare
