datetime,headline,summary,source,url,categories,tags,api_source
2025-07-03T07:43:00,"Mysterious $816,524,780 Bitcoin Transfer Stuns Community, Here's Who's Behind It","Tremendous amount of BTC moved in just minutes by anonymous whale",utoday,https://u.today/mysterious-816524780-bitcoin-transfer-stuns-community-heres-whos-behind-it,"BTC","Bitcoin|BTC",cryptocompare
2025-07-03T07:42:44,"Arthur Hayes Suggests Stablecoins and Bitcoin Could Support U.S. Treasury Debt Markets Amid Structural Challenges","Former BitMEX CEO Arthur Hayes highlights the growing role of stablecoins as a vital liquidity channel amid the U.S. Treasury’s escalating debt issuance challenges. Hayes emphasizes that traditional bond-buying mechanisms",coinotag,https://en.coinotag.com/arthur-hayes-suggests-stablecoins-and-bitcoin-could-support-u-s-treasury-debt-markets-amid-structural-challenges/,"MARKET|REGULATION|BTC","Analysis|News",cryptocompare
2025-07-03T07:40:06,"Bitcoin Near $107K Amid ETF Inflows and Futures Gaps Suggesting Structured Institutional Demand","Bitcoin consolidates near $107,000 amid growing ETF inflows and widening futures gaps, signaling a shift toward institutional-driven market dynamics. Futures gaps on the CME chart are attracting price attention, indicating",coinotag,https://en.coinotag.com/bitcoin-near-107k-amid-etf-inflows-and-futures-gaps-suggesting-structured-institutional-demand/,"BTC|MARKET|TRADING","Analysis|News|BTC",cryptocompare
2025-07-03T07:39:07,"Market Prophet Tom Lee Reveals His Prediction About Ethereum (ETH) – “Banks…”","Famous investor and Fundstrat co-founder Tom Lee predicts that banks will buy Ethereum (ETH) not only for speculative gains but also to secure their infrastructure. Lee states that this strategy will initiate institutional-level Ethereum accumulation, similar to MicroStrategy’s Bitcoin investments. According to Lee, the financial sector and the cryptocurrency world will become increasingly intertwined by 2025. The basis of this convergence is stablecoins, which are rapidly being adopted and used by both consumers and large institutions. The majority of these stablecoins are built on the Ethereum infrastructure. Lee, who says, “ETH is the backbone of the stablecoin ecosystem,” argues that banks will aim to ensure the security of the network by investing in Ethereum. Lee predicts that stablecoins will be one of the key components of the future banking infrastructure. Stating that especially large banks such as Goldman Sachs and JPMorgan will start issuing their own stablecoins using the ETH network, Lee stated that these institutions will contribute to network security by staking Ethereum. Related News: How Much U.S. President Donald Trump Has Earned from Cryptocurrency Ventures Revealed - Here Are the Hard-to-Believe Number In the Ethereum network, which operates with the Proof-of-Stake (PoS) mechanism, institutions that stake ETH on the network become transaction validators, which both ensures network security and provides income to the staking institutions. According to Lee, this will play a critical role, especially in ensuring the security of stablecoins. Lee also said that Ethereum currently hosts 51% of stablecoins and 30% of network fees come from stablecoin transactions. He stated that this situation will further increase the dominance of the US dollar in global finance. “If the stablecoin market reaches $2 trillion from $250 billion, transaction fees and therefore returns on the ETH network will also increase exponentially,” he said. Bitmine Immersion, a company led by Lee, has launched a $250 million private investment round in line with this strategy. All funds raised will be used to purchase ETH. Investors include leading institutions in both traditional finance and crypto, such as Founders Fund, Kraken, Galaxy Digital, and Pantera. The company’s strategy will be evaluated based on the amount of Ethereum earned per share. It is also expected that the company’s value will increase over time through methods such as generating returns by staking Ethereum, financing transactions with ETH in hand, and increasing the price of Ethereum. *This is not investment advice. Continue Reading: Market Prophet Tom Lee Reveals His Prediction About Ethereum (ETH) – “Banks…”",bitcoinsistemi,https://en.bitcoinsistemi.com/market-prophet-tom-lee-reveals-his-prediction-about-ethereum-eth-banks/,"ETH|MARKET|BUSINESS|BTC|EXCHANGE","Ethereum|News",cryptocompare
2025-07-03T07:37:37,"Arthur Hayes Predicts Bitcoin’s Dramatic Shift","Arthur Hayes warns of temporary dollar liquidity tightening affecting Bitcoin. Maelstrom adopts protective measures, reducing illiquid altcoin positions. Continue Reading: Arthur Hayes Predicts Bitcoin’s Dramatic Shift The post Arthur Hayes Predicts Bitcoin’s Dramatic Shift appeared first on COINTURK NEWS .",cointurken,https://en.coin-turk.com/arthur-hayes-predicts-bitcoins-dramatic-shift/,"BTC|ALTCOIN","Cryptocurrency News",cryptocompare
2025-07-03T07:31:56,"Addentax Group Considers Issuing Shares to Acquire Up to 12,000 Bitcoin Pending Approvals","Addentax Group Corp. is set to acquire up to 12,000 Bitcoin through a share exchange, marking a significant move in digital asset accumulation without involving cash transactions. The deal, currently",coinotag,https://en.coinotag.com/addentax-group-considers-issuing-shares-to-acquire-up-to-12000-bitcoin-pending-approvals/,"BTC|EXCHANGE","Bitcoin|News|BTC",cryptocompare
2025-07-03T07:30:00,"Best Cryptocurrencies to Invest in Bitcoin (BTC) Eyes New Highs in July","The crypto market is shifting gears, and not quietly. Bitcoin (BTC) is on the verge of pushing toward potential new highs in July as ETF inflows return and investor sentiment strengthens. But while the spotlight shines on BTC’s macro momentum, a wave is building underneath, and Mutuum Finance (MUTM) is riding it fast. The project is 5th stage of presale that is already sold out more than 50%. The current amount amassed by Mutuum Finance is already over $11.5 million with over 12,700 holders. Mutuum Finance is checking both boxes, and sliding into watchlists for the best crypto to buy in 2025 before June is out. Bitcoin Holds Firm as July Rally Approaches Bitcoin is now selling at about $108,526, recovering gradually after its April crash on about $74,000 and just short of its new all-time record of about $111,970. This uptrend is supported by technical data: BTC itself re-took its 50-day moving average, which is around $106,000, and has not fallen beneath good support, which shows BTC to have a solid base. As macro trends and regulatory clarity work in favor of BTC, the case is made to reach new highs BTC finds itself in arguably its best position all year, substance, clarity on regulations, and an at-long-last climate. Mutuum Finance Presale Achieves Outstanding Results More than $11.5 million and over 12,700 investors were drawn as part of Mutuum Finance (MUTM) presale. This kind of winds is the sign of the increased confidence of investors in the short-term success of the project and its long-term perspective. $50K Up for Grabs as Mutuum Finance Pushes Development Forward Mutuum Finance has launched a USDT Bug Bounty in the amount of $50,000 with CertiK. It is a bounty that is all-inclusive in the sense that, it is partitioned based on the four variable levels of severity which include, critical, major, minor and low. It is also the way of presenting the fact that the project is attentive regarding security and transparency. Proven Dual-Lending Formula Transformation of DeFi Mutuum Finance (MUTM) is designed to a mixed lending platform that will service the requirement of passive and active DeFi users. The need of any investor to want to earn passive income by depositing his USDT into smart contracts pools which guarantee stable passive income determined by its interest rate which goes up or down depending upon the changes in the market conditions is satisfied by its Peer-to-Contract (P2C) model. Moreover, the Peer-to-Peer (P2P) model lets the lenders and borrowers be as engaged as possible in resolving terms of a trade and do not require a third party. The model is more prevalent among the users of less stable assets. Leaderboard and 100,000 Giveaway Mutuum Finance is grateful to its early investors and has launched a $100,000 giveaway where 10 lucky participants will be rewarded with $10,000 MUTM. This celebrates the investors’ early belief in the project. Mutuum Finance (MUTM) has already raised over $11.5 million and attracted more than 12,700 holders, placing it firmly among the top crypto contenders to watch heading into 2025. Bitcoin is regaining its footing, aiming for new all-time highs in July, but under-the-radar gems like Mutuum are capturing the attention of smart investors early. A proven dual-lending model, a $50,000 security bounty with CertiK, and an ongoing $100,000 giveaway are all fueling momentum. As the presale moves past the halfway mark, now is the time to act. Join Mutuum Finance today and secure your stake in one of the fastest-growing DeFi platforms before prices climb and the window closes. For more information about Mutuum Finance (MUTM) visit the links below: Website: https://mutuum.com/ Linktree: https://linktr.ee/mutuumfinance",cryptopolitan,https://www.cryptopolitan.com/best-cryptocurrencies-to-invest-in-bitcoin-btc-eyes-new-highs-in-july/,"BTC|BUSINESS|MARKET|TRADING|USDT","Press Release",cryptocompare
2025-07-03T07:24:25,"Bitcoin and JPMorgan Will Soar on the Back of Big Bank Stablecoins: Hayes","The premise is driven by Treasury Secretary Scott Bessent’s agenda to engineer a liquidity injection that resembles past Federal Reserve interventions, said Hayes in a lengthy blog post on July 3. However, this will be done via financial innovation and regulatory tweaks, not overt money printing, he added. Bessent is “done getting fluffed,” and it’s time for him to “soak the world with his liquidity juices,” he exclaimed. Trillions in T-Bill Buying Power Hayes stated that this stealth liquidity injection strategy has two massive beneficiaries: Bitcoin and JPMorgan. JPMorgan’s stablecoin ( JPMD ) allows it to digitize deposits, eliminate compliance costs, and earn a risk-free spread by buying US Treasury bills. “Quid Pro Stablecoin” is a discussion on how US banks adopting stablecoins can provide $6.8 trillion of buying power for The BBC’s shitty treasuries. https://t.co/QHqgZAPv0J pic.twitter.com/pcejYZ8Urx — Arthur Hayes (@CryptoHayes) July 3, 2025 Additionally, regulatory changes such as the GENIUS Act could effectively hand “too big to fail” banks a monopoly on stablecoins, which could lock out fintech firms such as Circle. “The adoption of stablecoins by TBTF banks creates up to $6.8 trillion of T-bill buying power.” Moreover, if JPMorgan converts even a fraction of its deposits into stablecoins, it unlocks hundreds of billions in low-risk, high-margin earnings, potentially doubling or tripling its market cap. Bitcoin would also benefit because stablecoin issuance creates massive Treasury bill demand without quantitative easing, which suppresses yields and reflates risk assets. The primary cryptocurrency thrives when liquidity expands and rates drop. “The real stablecoin play isn’t betting on crusty FinTechs like Circle—it’s understanding that the US government just handed TBTF banks the launch keys to a multi-trillion-dollar liquidity bazooka disguised as ‘innovation’.” Ethereum to Benefit The JPMD stablecoin will ride on Base, a layer-2 operated by Coinbase built on top of Ethereum, confirming that the asset will use Ethereum infrastructure. This positions the protocol as the settlement layer for the new banking liquidity engine. “This is debt monetization dressed in Ethereum drag,” said Hayes. If big banks settle stablecoins on Ethereum, the current industry standard for real-world asset tokenization, demand for the network’s blockspace, layer-2s, and validators increases. The Ethereum infrastructure is quietly powering the entire play, so it is also likely to benefit, though Hayes didn’t directly address it. It could also become the next corporate treasury gold rush due to its staking yields, which are not available with Bitcoin, according to analysts. The post Bitcoin and JPMorgan Will Soar on the Back of Big Bank Stablecoins: Hayes appeared first on CryptoPotato .",cryptopotato,https://cryptopotato.com/bitcoin-and-jpmorgan-will-soar-on-the-back-of-big-bank-stablecoins-hayes/,"BTC|ETH|FIAT|REGULATION|BLOCKCHAIN","AA News|Crypto News|Bitcoin|Ethereum|JP Morgan|Stablecoins",cryptocompare
2025-07-03T07:14:48,"Crypto Tycoon Tim Heath Foils Kidnapping Attempt by Biting Off Attacker’s Finger","Australian crypto billionaire Tim Heath narrowly escaped a violent kidnapping attempt in Tallinn, Estonia, last July by biting off part of an attacker’s finger, an Estonian court heard this week. Key Takeaways: Tim Heath escaped a kidnapping attempt in Estonia by biting an attacker’s finger. The suspects stalked Heath for weeks, using disguises and a GPS tracker. Seven men are accused of plotting to abduct Heath and steal his crypto assets. The chilling incident highlights the growing wave of targeted abductions against wealthy crypto figures in 2025, which has forced many executives to bolster their security measures. Heath, a prominent investor and founder of the Estonian-based Yolo Group, was ambushed by two men disguised as painters in the stairwell of his apartment building. Ex-Boxer Tries to Muzzle Crypto Tycoon in Failed Kidnapping According to testimony cited by Estonian outlet Eesti Ekspress and the Sydney Morning Herald, one of the attackers, Azerbaijani national Allahverdi Allahverdiyev, a former boxer and wrestler, tried to silence Heath by covering his mouth. In a desperate act of self-defense, Heath bit through Allahverdiyev’s index finger, managing to break free and retreat into his apartment. The struggle, which lasted about 30 seconds, cost Heath a tooth but forced the kidnappers to flee. The attackers abandoned a rented van nearby, and police later discovered part of Allahverdiyev’s severed finger about 100 meters from the scene. Court documents revealed the attackers had been stalking Heath in the weeks before the assault, both physically and with a GPS tracker placed on his vehicle. The group allegedly planned to force Heath into the van, transport him to a rented sauna house, and coerce him into transferring his crypto holdings. This is David Balland. He co-founded Ledger, one of the biggest companies in crypto This week, he was kidnapped and tortured Here’s the full story of what happened: (and why it’s a wake-up call for everyone in crypto) pic.twitter.com/0NpLlN8aZm — Pix (@PixOnChain) January 24, 2025 Prosecutors say a hacker was also involved to expedite the digital theft. The group of seven suspects reportedly entered Estonia using fake Georgian passports. In the days before the attack, they bought painters’ uniforms and equipment to pose as workmen. Two men have been arrested so far: Allahverdiyev and Georgian citizen Ilgar Mamedov, who prosecutors claim was the getaway driver. Mamedov has denied involvement, insisting he ended up in Estonia by accident. Three other suspects remain unidentified, and two, including the alleged ringleader Najaf Najafli, are wanted by authorities. Kidnappers Demanded 30 Bitcoin After Failed Abduction After the failed abduction, Heath allegedly received a Telegram message containing photos of his apartment along with a demand for 30 Bitcoin, worth about $3.3 million at the time. When Heath didn’t respond, there were no further attempts to contact him, but prosecutors argue the threat could still be active. Heath has since spent over $3.1 million on private security and relocated to a new home. His legal team is pursuing reimbursement of these costs from the accused kidnappers as the court case continues in Estonia. The recent attack follows a more brutal incident on May 1, when four masked men abducted the father of a crypto entrepreneur in Paris, cutting off one of his fingers before police intervened. In another incident, the father of a crypto millionaire was brutally attacked . And in New York, a tourist was tortured for over two weeks as kidnappers tried to extract his Bitcoin credentials. The post Crypto Tycoon Tim Heath Foils Kidnapping Attempt by Biting Off Attacker’s Finger appeared first on Cryptonews .",cryptonews,https://cryptonews.com/news/crypto-tycoon-tim-heath-foils-kidnappers-by-biting-attackers-finger/,"BTC|BUSINESS|MARKET|REGULATION|WALLET","Altcoin News|Crime|Crypto crime|Kidnapping",cryptocompare
2025-07-03T07:04:40,"Billionaire Ray Dalio Says US Government Will Be Forced To Deal With Incoming ‘Debt Bomb’ – Here’s How","Bridgewater Associates founder Ray Dalio says that America is going to be forced to deal with its soaring debt problem. The billionaire tells his 1.7 million followers on the social media platform X that the US will likely lower interest rates and print money to address the nation’s ballooning debt obligations. However, he warns that such measures are not very effective. “When countries have too much debt, lowering interest rates and devaluing the currency that the debt is denominated in is the preferred path government policy makers are most likely to take, so it pays to bet on it happening. At the moment of my writing, we know that the projections are for big deficits and big increases in government debt and debt service expenses ahead… I also shared last week why I believe the political system in the US won’t be able to get its debt problems under control. We know how debt service costs (paying back interest and principal) will grow rapidly to squeeze out spending, and we also know that, at best, it is highly doubtful that there will be an increase in demand for the debt commensurate with the supply that needs to be sold. I laid out in detail what I think the implications of all this are in ‘How Countries Go Broke,’ where I offer a description of the mechanics behind my thinking. Others have stress tested it, and thus far there has been almost total agreement that the picture I am painting is accurate.” Dalio believes the US will eventually have to both cut spending and raise taxes to save itself from the looming fiscal crisis. “There is no way that the deficit/debt bomb problem can be sustainably dealt with unless there is a mix of tax revenue increases and spending decreases that are determined in a bipartisan way. Our representatives in Washington, D.C., both Republicans and Democrats, know this is true. They understand the need to reduce the deficit by having those from both sides chip in a bit (e.g., a 4% increase in tax revenue and a 4% spending cut) which would lead to a supply/demand balance improvement for US debt which in turn would lower interest rates.” Follow us on X , Facebook and Telegram Don't Miss a Beat – Subscribe to get email alerts delivered directly to your inbox Check Price Action Surf The Daily Hodl Mix Disclaimer: Opinions expressed at The Daily Hodl are not investment advice. Investors should do their due diligence before making any high-risk investments in Bitcoin, cryptocurrency or digital assets. Please be advised that your transfers and trades are at your own risk, and any losses you may incur are your responsibility. The Daily Hodl does not recommend the buying or selling of any cryptocurrencies or digital assets, nor is The Daily Hodl an investment advisor. Please note that The Daily Hodl participates in affiliate marketing. Generated Image: Midjourney The post Billionaire Ray Dalio Says US Government Will Be Forced To Deal With Incoming ‘Debt Bomb’ – Here’s How appeared first on The Daily Hodl .",dailyhodl,https://dailyhodl.com/2025/07/03/billionaire-ray-dalio-says-us-government-will-be-forced-to-deal-with-incoming-debt-bomb-heres-how/,"BUSINESS|REGULATION|BTC|TRADING","Financeflux|debt|interest rates|News|ray dalio|US government",cryptocompare
2025-07-03T07:04:21,"Donald Trump Crypto Holdings Now Make Up 8% of His Net Worth","The post Donald Trump Crypto Holdings Now Make Up 8% of His Net Worth appeared first on Coinpedia Fintech News Donald Trump’s crypto portfolio is making headlines. A recent Bloomberg report reveals that Donald Trump holds at least 8% of his net worth in Bitcoin and other cryptocurrencies. This revelation comes amid growing speculation that Trump’s pro-crypto stance may not be just political, but personal. Donald Trump Net Worth: Real Estate, Truth Social, and Crypto As of now, Trump’s total net worth is estimated at $6.4 billion, largely made up of: Real estate assets, including 19+ properties valued over $50 million each His stake in Trump Media & Technology Group (Truth Social) And now, a rapidly growing share of crypto holdings While Trump’s real estate empire remains the backbone of his business, the report suggests that cryptocurrencies are becoming a larger slice of Trump’s financial pie. World Liberty Financial: The Core of Trump’s Crypto Holdings The centerpiece of Donald Trump’s crypto wealth is a project called World Liberty Financial (WLFI). WLFI has raised over $550 million from token sales $390 million of that amount reportedly went directly to the Trump family Trump and his family also own 22.5 billion WLFI tokens, valued at approximately $2 billion (though currently non-transferable, hence not included in his official net worth) USD1 Stablecoin and TRUMP Memecoin Fuel Trump’s Crypto Empire Trump’s crypto holdings don’t stop with WLFI. The report highlights two other major assets in his portfolio: 1. USD1 Stablecoin Market Cap: $2.2 billion+ 24H Trading Volume: $1.5 billion+ Annual Earnings from Reserves: $100 million [post_titles_links postid=”477986″] 2. TRUMP Memecoin Market Cap: $1.79 billion 24H Trading Volume: $269 million Total Supply: 1 billion TRUMP tokens Circulating Supply: ~200 million CIC Digital, the firm controlling 80% of TRUMP tokens, is reportedly linked to the Trump Organization Trump Steps Into the Crypto Mining Business Donald Trump has a 20% stake in American Bitcoin, a U.S.-based crypto mining firm. The company recently merged with Gryphon Digital Mining and is now valued at over $3 billion. This move places Trump directly in the mining sector, further diversifying his crypto interests. Final Thoughts While Trump’s public support for cryptocurrencies has often made headlines, this new report suggests something more: Donald Trump’s crypto holdings are now a central piece of his fortune. With over $500 million directly tied to crypto and even more in token valuations, Trump may be one of the most crypto-exposed political figures in the world. As the next election cycle heats up, Trump’s net worth and growing crypto empire are likely to remain in the spotlight. [article_inside_subscriber_shortcode title=”Never Miss a Beat in the Crypto World!” description=”Stay ahead with breaking news, expert analysis, and real-time updates on the latest trends in Bitcoin, altcoins, DeFi, NFTs, and more.” category_name=”News” category_id=”6″] FAQs How did Donald Trump accumulate such a large crypto portfolio, and when did he start investing in crypto? Donald Trump’s significant crypto wealth rapidly grew, especially after October 2024. It stems from the launch of his own meme coins ($TRUMP, $MELANIA) and a substantial stake in World Liberty Financial, a crypto exchange affiliated with his family. He has also directly engaged with the crypto mining sector. What is World Liberty Financial (WLFI), and how does it generate value for the Trump family? World Liberty Financial (WLFI) is a crypto venture co-established by Donald Trump, with his sons Eric, Donald Jr., and Barron listed as Web3 ambassadors. It generates value through token sales (raising over $550 million), with a Trump family entity receiving 75% of net revenues from these sales and holding 22.5 billion WLFI tokens. How does Trump’s crypto wealth compare to other political figures or billionaires? Donald Trump is likely one of the most crypto-exposed political figures globally, with over 8% of his estimated $6.4 billion net worth tied to crypto. While exact comparisons with other politicians are hard, his direct involvement in crypto projects and substantial holdings make him an outlier among major political figures. Billionaires like Elon Musk hold far greater crypto wealth.",coinpedia,https://coinpedia.org/news/donald-trump-crypto-holdings-now-make-up-8-of-his-net-worth/,"MINING|TOKEN SALE|BTC|BUSINESS|MARKET","News|Crypto news",cryptocompare
2025-07-03T07:03:16,"Bitcoin Nears Key Resistance at $109,476 Amid Cautious Investor Sentiment and Potential for Further Gains","Bitcoin’s recent price surge to $108,948 positions it near its all-time high, yet realized profits remain modest, indicating investor patience over immediate profit-taking. The critical resistance level at $109,476 stands",coinotag,https://en.coinotag.com/bitcoin-nears-key-resistance-at-109476-amid-cautious-investor-sentiment-and-potential-for-further-gains/,"BTC|BUSINESS|MARKET|TRADING","Analysis|Bitcoin|News|BTC",cryptocompare
