datetime,headline,summary,source,url,categories,tags,api_source
2025-06-03T15:30:37,"Stablecoins Ignite Record-Breaking May, Supply Jumps To $244B – Data","A surge of stablecoin transactions marked May as a standout month for the crypto sector. It moved beyond mere token swaps. Lots of people and services turned to dollar-pegged coins for moving value. Activity hit fresh highs, hinting that stablecoins are now the main channel for on-chain payments. Related Reading: XRP Could Transform Your Finances Long Before $10K, Angel Investor Says Spike In Wallet Activity According to Artemis data, more than 33 million wallets sent or received stablecoins during May. That’s a big jump compared with earlier months. It shows more folks are leaning on these digital dollars than on native tokens. Many traders, DeFi users, and everyday people tapped stablecoins to keep their funds tied to the US dollar. This wave of usage also came as the wider market showed signs of life, with prices slowly rising and confidence climbing. Shift To Faster Networks Based on reports, BNB Smart Chain counted over 10 million active wallets for stablecoin moves early in May. TRON came very close, with a little over 9 million wallets during that same stretch. These two networks are cheap and quick. Folks want to dodge higher fees on older chains. By month’s end, both BNB Smart Chain and TRON could top those numbers again. That trend speaks to growing demand for fast, low-cost payments and DeFi deals. Ethereum simply can’t match these lower fees right now. Stablecoin Supply Growth Stablecoins also saw more tokens enter circulation. The total supply grew to $244 billion, up nearly 3% in just one month. But not all coins minted equally. Tether’s USDT remained the heavyweight champion. It added nearly $4 billion to its total supply in May alone. Most of that new USDT landed on TRON. Today, TRON holds nearly $78 billion in USDT, while Ethereum carries $73 billion. In sum, USDT’s overall supply now tops $153 billion and added tokens almost every day. USDC moved in the opposite direction. Its supply dipped slightly, thanks to outflows on Solana. Still, USDC keeps about $60 billion circulating across all its chains. Related Reading: Pepe Makes It To Trump’s Feed—Is A Crypto Endorsement Next? Payments And Bridges Overtake Cards Stablecoins didn’t just grow in supply and usage. They carried huge volumes of payments. Over the past 30 days, those coins moved over $2 trillion worth of value. That level beats what many debit and credit cards handled in the same span. For example, Visa’s volumes were lower than what stablecoins saw. Plus, USDC’s cross-chain moves spiked. The CCTP bridge saw $7.7 billion flow through it, up 83% month-on-month. That rush of bridging means more people are shuttling dollars between networks for trades, lending, or simple transfers. Featured image from ETF Stream, chart from TradingView",newsbtc,https://www.newsbtc.com/stablecoin/stablecoins-ignite-record-breaking-may-supply-jumps-to-244b-data/,"BTC|ETH|USDT|BNB|USDC","Stablecoin|bitcoin|crypto|Stablecoins|tether|TRON|USDC|USDT",cryptocompare
2025-06-03T15:28:03,"Bitcoin ETFs See Potential Profit-Taking While Ethereum ETFs Show Continued Institutional Interest","Bitcoin ETFs have experienced significant outflows totaling $1.2 billion as investors capitalize on recent price surges, while Ethereum ETFs continue to attract institutional inflows, signaling a shift in market dynamics.",coinotag,https://en.coinotag.com/bitcoin-etfs-see-potential-profit-taking-while-ethereum-etfs-show-continued-institutional-interest/,"BTC|BUSINESS|ETH|MARKET|TRADING","News",cryptocompare
2025-06-03T15:27:09,"Bitcoin Eyes Liquidity Zones Near $106,000 Amid Support Strengthening and Limited New Highs Potential","Bitcoin’s price action is currently targeting liquidity zones above $106,000 as traders anticipate a potential recovery, while solid support levels bolster market confidence. Despite increased profit-taking, the intensity remains moderate",coinotag,https://en.coinotag.com/bitcoin-eyes-liquidity-zones-near-106000-amid-support-strengthening-and-limited-new-highs-potential/,"BTC|MARKET|TRADING","Analysis|Bitcoin|News|BTC",cryptocompare
2025-06-03T15:25:00,"Cryptocurrencies Surge as Vital Market Movements Unfold","Bitcoin reaches $106,600, eyes set on $106,800 for further altcoin benefits. China's diplomatic moves contribute to a positive market sentiment in June. Continue Reading: Cryptocurrencies Surge as Vital Market Movements Unfold The post Cryptocurrencies Surge as Vital Market Movements Unfold appeared first on COINTURK NEWS .",cointurken,https://en.coin-turk.com/cryptocurrencies-surge-as-vital-market-movements-unfold/,"ALTCOIN|ASIA|BTC|MARKET","Cryptocurrency News",cryptocompare
2025-06-03T15:24:58,"Bitcoin Dips Amid Tariff Deadline Uncertainty and K33’s $1M BTC Purchase","COINOTAG News reports that the current 90-day tariff suspension is set to expire on July 9th, according to K33 Research Director Vetle Lunde. President Trump aims to secure the “One",coinotag,https://en.coinotag.com/breakingnews/bitcoin-dips-amid-tariff-deadline-uncertainty-and-k33s-1m-btc-purchase/,"BTC|REGULATION|RESEARCH","BTC",cryptocompare
2025-06-03T15:24:11,"The Blockchain Group Reports Over 1,000% YTD Bitcoin Yield Following 624 BTC Acquisition","The Blockchain Group has significantly expanded its Bitcoin treasury, acquiring 624 BTC for €60.2 million and reporting an impressive 1,097.6% year-to-date Bitcoin yield. This strategic accumulation underscores the company’s commitment",coinotag,https://en.coinotag.com/the-blockchain-group-reports-over-1000-ytd-bitcoin-yield-following-624-btc-acquisition/,"BLOCKCHAIN|BTC|REGULATION","Bitcoin|News|BTC|Core",cryptocompare
2025-06-03T15:22:57,"BlackRock Bitcoin ETF Is the Youngest Top ETF and May Surpass Satoshi in BTC Holdings, Bloomberg Analyst","The BlackRock Bitcoin ETF has emerged as the fastest-growing fund by assets, according to a recent disclosure by Bloomberg ETF analyst Eric Balchunas. Just 1.4 years since its launch, the BlackRock iShares Bitcoin Trust (IBIT) has amassed $72.4 billion in assets under management, making it the youngest ETF in the top 25 by a margin of over a decade. According to Balchunas, this development positions IBIT as the only fund under 10 years old on the list, and one that is nine times younger than the next-youngest ETF. https://twitter.com/EricBalchunas/status/1929872901479539068Notably, IBIT’s rise signals historic investor demand for direct Bitcoin exposure through a regulated ETF wrapper.Historic Asset Growth for a NewcomerAmong the top ETFs by asset size, longstanding funds such as Vanguard’s VOO, SPDR’s SPY, and iShares’ IVV each carry more than $580 billion in assets and have been active for at least 14 years. In stark contrast, the BlackRock Bitcoin ETF ranks 23rd in size despite its short existence, with its 1.4-year age making it a significant statistical outlier. Other ETFs, such as VWO and IEMG, are over 12 years old, underscoring the unusual nature of IBIT’s ascent.In his analysis, Bloomberg ETF analyst Eric Balchunas described IBIT’s position among the top ETFs as “like an infant hanging out with teenagers and twenty-somethings,” emphasizing the fund’s unusually young age relative to its peers. He added that this is possibly the most amazing stats pulled by IBIT. While older ETFs built scale over decades, the BlackRock Bitcoin ETF accumulated assets at an accelerated rate. He also pointed out the role of structural advantages—such as liquidity, cost efficiency, and the trust associated with traditional ETF frameworks—as key drivers behind IBIT’s success in attracting inflows.BlackRock Bitcoin ETF Could Surpass Satoshi Nakamoto as Largest BTC HolderAlongside its asset growth, IBIT has also emerged as a leading custodian of Bitcoin. According to Balchunas, IBIT currently holds 660,842 BTC, ranking it as the second-largest holder globally. Only the balance belonging to Bitcoin’s pseudonymous creator, Satoshi Nakamoto, exceeds IBIT’s holdings. Estimates suggest Satoshi’s wallets contain approximately 1,123,500 BTC, though some analysts, such as London-based Farside Investors, have questioned the certainty of that figure.Meanwhile, Balchunas emphasized that even conservative estimates still place IBIT on track to become the largest holder of Bitcoin by late 2026. The BlackRock Bitcoin ETF has purchased around $50 billion worth of Bitcoin since its inception, surpassing major holders like Binance and Strategy, which hold 622,546 BTC and 580,955 BTC respectively.Long-Term ETF Market Impact DiscussedIn a separate development, Strategy Chairman Michael Saylor in April predicted that IBIT could eventually overtake Vanguard’s VOO to become the largest ETF globally. At a Bitwise-hosted Bitcoin conference, Saylor outlined a potential path over the next decade where Bitcoin ETFs reshape traditional fund rankings. Balchunas later echoed this possibility, noting that while such an outcome remains speculative, IBIT’s trajectory is significant within the broader ETF industry.",thecryptobasic,https://thecryptobasic.com/2025/06/03/blackrock-bitcoin-etf-is-the-youngest-top-etf-and-may-surpass-satoshi-in-btc-holdings-bloomberg-analyst/?utm_source=rss&utm_medium=rss&utm_campaign=blackrock-bitcoin-etf-is-the-youngest-top-etf-and-may-surpass-satoshi-in-btc-holdings-bloomberg-analyst,"BTC|BUSINESS|EXCHANGE|MARKET|BNB","Market|Bitcoin ETF|Latest Bitcoin (BTC) News Today",cryptocompare
2025-06-03T15:21:48,"Why Bitcoin and Ethereum ETF Investments Are Diverging","Bitcoin ETFs see $1.2 billion in outflows as investors take profits, while Ethereum ETFs mark 12 days of inflows amid growing institutional interest. Here's what analysts have to say.",decrypt,https://decrypt.co/323449/why-bitcoin-ethereum-etf-investments-diverging,"BTC|BUSINESS|ETH|MARKET","||Markets",cryptocompare
2025-06-03T15:21:43,"Here’s Why Market Flushouts and Whale Moves Could Set the Stage for Bitcoin’s Next Rally","Bitcoin held firm above the $105,000 mark following a weekend dip, as rattled market participants assess whether the pullback signals a temporary breather. Ongoing shifts in sentiment and trader positioning hint at a broader market recalibration quietly unfolding. No Panic, No Euphoria Bitcoin’s derivatives and spot markets are undergoing a structural recalibration. On Binance, long positions continue to be liquidated in significant waves, at times surpassing $40 million per hour, as seen in the Liquidation Delta metric cited by CryptoQuant. These liquidations highlight heavy pressure on long positions, but notably, there is no corresponding surge in short liquidations. This indicates that while many leveraged long traders are being flushed out , there is little evidence of a counter-move or short squeeze. Meanwhile, Binance funding rates remain largely neutral as it hovers around zero, which suggests a lack of extreme directional bias in the perpetual futures market. Traders are neither aggressively betting on upside nor downside, indicating caution rather than fear or greed. “In simpler terms: the derivatives market is not signaling panic, nor euphoria, just cautious recalibration.” Bitcoin Whales Quietly Accumulate Whale behavior paints a more optimistic picture. Data from the Whale Screener shows that over $500 million in combined Bitcoin and Ethereum was withdrawn from spot exchanges on June 2nd. Most notably, crypto exchange Bitfinex recorded a single-day outflow of 20,000 BTC, worth over $1.3 billion at current prices. This represented the largest Bitcoin withdrawal from the exchange since August 2019. Such a significant movement off exchanges often points to long-term holding intentions by large entities, which could ease immediate selling pressure in the market. Together, these signals – neutral funding, liquidation of overleveraged longs, and strategic accumulation by large holders – depicts a market that is clearing excess leverage and preparing for a potential next leg upward. Although short-term volatility remains, the broader trend suggests Bitcoin may be in the early stages of a new bullish phase driven by healthier market structure and long-term investor confidence. The post Here’s Why Market Flushouts and Whale Moves Could Set the Stage for Bitcoin’s Next Rally appeared first on CryptoPotato .",cryptopotato,https://cryptopotato.com/heres-why-market-flushouts-and-whale-moves-could-set-the-stage-for-bitcoins-next-rally/,"BTC|EXCHANGE|MARKET|TRADING|BNB","AA News|Crypto News|Bitcoin (BTC) Price|Bitcoin Whales",cryptocompare
2025-06-03T15:14:11,"Donald Trump Jr Finally Reveals Why His Family Got Into Bitcoin","In a recent interview on CNBC's Squawk Box , Donald Trump Jr. shared that his family turned to Bitcoin and crypto out of necessity. Speaking with co-hosts Joe Kernen and Andrew Ross Sorkin, he presented why the Trumps got into crypto and what pushed them in that direction, insisting that it was not an attempt to chase the prevalent trend.Kernen asked Trump Jr. about the headlines tying Bitcoin to the Trump brand and the broader MAGA movement. He questioned whether it was appropriate for President Donald Trump to have a meme coin tied to his name.The Trump's Entered Bitcoin and Crypto Out of NecessityIn response, Trump Jr. explained that their turn to crypto started after his family entered politics. Before that, banks in New York returned his calls and approved loans for real estate projects without hesitation. https://twitter.com/SquawkCNBC/status/1929895962408861834However, once his father became president, those same institutions stopped answering. The Trumps found themselves shut out of the banking scene . According to him, the financial system turned on them overnight, and they couldn't get basic financing even with solid business records and assets.He said that was when he and his brother realized something important: the system was not built to be fair. Before politics, they had access to everything because of their name and resources. Afterward, they experienced the kind of financial roadblocks that everyday Americans face all the time. This opened their eyes. Notably, they saw crypto as a way to work around a system that suddenly turned against them.Blockchain Has Some Real BenefitsSpeaking further, he added that blockchain technology also has real advantages. As a real estate developer, he questioned why basic processes like title insurance still cost so much and take so long. He saw clear ways crypto could make those transactions faster and cheaper. For him, the decision wasn't about jumping on a trend, it was about survival and innovation. He described it as a necessary pivot after getting locked out of traditional finance.Sorkin then asked whether the Trump-linked meme coin could let foreign or domestic actors secretly send money to those in power. Responding, Trump Jr. distanced himself from the coin, saying he wasn't part of that project and instead focused on more serious areas like stablecoins and Bitcoin mining.Trump Jr: TRUMP Meme Coin a ""Proof of Concept""Still, he defended the meme coin as a ""proof of concept,"" arguing it shows how the crypto world recognizes that traditional finance doesn't treat everyone equally.Interestingly, Kernen compared the meme coin controversy to past scandals involving Hunter Biden's art and the Clinton Foundation. He suggested that, like those cases, the meme coin could open the door to influence buying. Trump Jr. acknowledged those concerns but pointed out the anonymous nature of crypto makes it hard to link transactions directly to political power. He said the coin proves how quickly the public is losing trust in traditional systems.When asked about criticisms from crypto insiders, Trump Jr. insisted that no one he spoke to had voiced any concerns. Instead, many thanked him for helping bring attention and credibility to the space. He said crypto attracts a wide range of people, including libertarians, conservatives, and those simply looking for more financial freedom, and that the support hasn't come from just one side of the political aisle.To wrap up, Sorkin asked if crypto could one day threaten the U.S. dollar. Trump Jr. said he believes the opposite. He pointed out that stablecoins like USD1 actually support the dollar's dominance. He explained that these coins now buy more Treasuries than many foreign governments do, helping maintain U.S. borrowing power. In his view, stablecoins might end up being the key to keeping the dollar strong in the long run.The Trump Family's Involvement in CryptoNotably, the Trump family has made major moves in crypto. In Q4 2024, World Liberty Financial, a decentralized finance platform inspired by Trump Sr., launched, raising $550 million through token sales. In mid-January 2025, just before the inauguration, Donald Trump launched the TRUMP meme coin while Melania Trump launched MELANIA . Reports say Trump-affiliated groups hold 80% of both coins. At the end of March, Trump Jr. and Eric Trump revealed they had taken a minority stake in American Bitcoin, a mining company created with Hut 8. Also, WLFI introduced the USD1 stablecoin , backed by a $2 billion investment from an Abu Dhabi firm through Binance. Then last month, Trump Media and Technology Group announced a $2.5 billion plan to build a Bitcoin treasury.",thecryptobasic,https://thecryptobasic.com/2025/06/03/donald-trump-jr-finally-reveals-why-his-family-got-into-bitcoin/?utm_source=rss&utm_medium=rss&utm_campaign=donald-trump-jr-finally-reveals-why-his-family-got-into-bitcoin,"BTC|MARKET|REGULATION|TECHNOLOGY|TOKEN SALE","Market|Trending Now|Latest Donald Trump News",cryptocompare
2025-06-03T15:13:23,"Tether Just Made Twenty One Capital a Bitcoin Powerhouse","$3.9 billion worth of Bitcoin didn’t just disappear into cold storage. It went straight into Jack Mallers’ hands — or more precisely, his new ventu...",tipranks,https://www.tipranks.com/news/tether-just-catapulted-a-bitcoin-startup-into-the-big-leagues?utm_source=cryptocompare.com&utm_medium=referral,"BTC|USDT","Market News|MARA|MSTR",cryptocompare
2025-06-03T15:13:07,"SolarBank Considers Following Michael Saylor’s Lead with Bitcoin Treasury Strategy","SolarBank Corporation has strategically embraced Bitcoin for its treasury reserves, following the example set by Michael Saylor’s MicroStrategy, to enhance financial resilience and attract tech-savvy investors. The company’s move integrates",coinotag,https://en.coinotag.com/solarbank-considers-following-michael-saylors-lead-with-bitcoin-treasury-strategy/,"BLOCKCHAIN|BTC|REGULATION|USDC|FLOW","Blockchain|News|BTC|Core|FLOW|USDC",cryptocompare
2025-06-03T15:11:15,"Bitcoin taps $106K liquidity as bulls defend price with $260M bid","BTC price action is already hunting liquidity immediately above price as support thickens, but market analysis doubts that new highs will come this week.",cointelegraph,https://cointelegraph.com/news/bitcoin-160k-liquidity-bulls-defend-price-260m-in-place?utm_source=rss_feed&utm_medium=rss&utm_campaign=rss_partner_inbound,"BTC|MARKET|TRADING","",cryptocompare
2025-06-03T15:04:45,"Norwegian Brokerage K33 Begins Bitcoin Treasury Strategy With Initial 10 BTC Purchase","K33, a Norwegian digital asset brokerage, has initiated its Bitcoin Treasury strategy with a purchase of 10 BTC valued at approximately SEK 10 million. This acquisition marks the beginning of",coinotag,https://en.coinotag.com/norwegian-brokerage-k33-begins-bitcoin-treasury-strategy-with-initial-10-btc-purchase/,"BTC|REGULATION","Bitcoin|News|BTC|Core",cryptocompare
2025-06-03T15:02:45,"Cango Reports Mining Nearly $100 Million in Bitcoin Following Full Pivot to BTC Operations","Cango has solidified its position as a leading Bitcoin mining firm by producing over 950 BTC, valued at more than $100 million, in just two months following its strategic pivot",coinotag,https://en.coinotag.com/cango-reports-mining-nearly-100-million-in-bitcoin-following-full-pivot-to-btc-operations/,"BTC|MINING","Bitcoin|Mining|News|BTC|Core",cryptocompare
2025-06-03T15:00:38,"Ethereum vs Bitcoin: Vitalik Buterin Highlights Ethereum’s Censorship Resistance and Security Advantages","Ethereum co-founder Vitalik Buterin recently highlighted Ethereum’s robust stance on censorship resistance and network security, positioning it as a leader in these critical areas. Despite Ethereum’s advancements, Buterin acknowledged that",coinotag,https://en.coinotag.com/breakingnews/ethereum-vs-bitcoin-vitalik-buterin-highlights-ethereums-censorship-resistance-and-security-advantages/,"BTC|ETH","BTC|ETH",cryptocompare
2025-06-03T15:00:07,"SEC’s Hester Peirce Suggests SAB 121 Repeal Could Broaden Bitcoin Custody Access","SEC Commissioner Hester Peirce has publicly criticized Staff Accounting Bulletin 121 (SAB 121), calling it an overreaching regulatory measure that restricts traditional financial institutions from offering crypto custody services. Peirce",coinotag,https://en.coinotag.com/secs-hester-peirce-suggests-sab-121-repeal-could-broaden-bitcoin-custody-access/,"BTC|REGULATION","News|BTC",cryptocompare
2025-06-03T15:00:00,"Cango produced over $100M of Bitcoin in two months after mining pivot","Cango mined 954.5 BTC worth more than $100 million in April and May, following its full pivot to Bitcoin mining and sale of its legacy operations.",cointelegraph,https://cointelegraph.com/news/better-cango-produced-100m-of-bitcoin-in-first-two-months-after-mining-pivot?utm_source=rss_feed&utm_medium=rss&utm_campaign=rss_partner_inbound,"BTC|MINING","",cryptocompare
2025-06-03T14:59:01,"Tether’s Investment in Orionx Could Enhance Bitcoin Adoption and Stablecoin Use in Latin America","Tether’s recent investment in Orionx marks a pivotal step towards enhancing cryptocurrency accessibility across Latin America, focusing on stablecoin-driven financial solutions. This strategic partnership aims to leverage Orionx’s regional presence",coinotag,https://en.coinotag.com/tethers-investment-in-orionx-could-enhance-bitcoin-adoption-and-stablecoin-use-in-latin-america/,"BTC|USDT","Bitcoin|News|BTC|USDT",cryptocompare
2025-06-03T14:57:15,"Money Flooding Into  Ethereum—Is the Momentum Building for the ETH Price Rally to $4000?","The post Money Flooding Into Ethereum—Is the Momentum Building for the ETH Price Rally to $4000? appeared first on Coinpedia Fintech News The Ethereum price is experiencing a notable surge, trading around $2625 after marking a significant rebound from the recent lows. The rise has been bolstered by substantial inflows of ETFs, marking the largest weekly inflow of 2025. This suggests the institutional interest is fueling the bullish momentum. On the other hand, the US SEC has recently approved staking programs for Ethereum, enhancing investors’ confidence and contributing to increased demand. Besides, the ETH price is heading towards a breakout zone of a bullish pattern, suggesting a potential reversal and signalling positive market sentiment. Meanwhile, the drop in the ETH reserves in the CEXs points towards self-custody and accumulation. The key resistance was breached at $2550 with nearly 288K in trading volume, due to which the overall trend remains bullish as higher lows continue to hold. Meanwhile, the token has formed a bullish morning star pattern in the monthly charts, pointing towards a long-term reversal to the upside. On the other hand, the Open Interest and volume are both rising, substantiating the bullish claim. What’s next? When will the ETH price breakout from the accumulation and reach $3000? The daily chart shows the price accumulating within a bullish, ascending triangle while the range between $2691 and $2712 is acting as a strong resistance zone. Meanwhile, the CMF has rebounded after testing the average range at 0, hinting towards a significant influx of liquidity that may help the price to remain elevated. Besides, the MACD displays a drop in the selling pressure, which may further promote a bullish crossover. This could help the price rise beyond the pattern that may further validate the beginning of a fresh bullish trend. Therefore, until the Ethereum price remains above $2550, the bullish structure could continue to prevail, with the upper target between $2700 and $3000 being the key resistance. However, a confirmation at $2800 could be pivotal as a downside risk arises if the support is broken. On the other hand, ETH/BTC is also showing signs of reversal, implying possible Ethereum outperformance vs. Bitcoin and a broader altseason.",coinpedia,https://coinpedia.org/price-analysis/money-flooding-into-ethereum-is-the-momentum-building-for-the-eth-price-rally-to-4000/,"BTC|BUSINESS|ETH|MARKET|TRADING","Price Analysis|Ethereum",cryptocompare
