datetime,headline,summary,source,url,categories,tags,api_source
2025-07-16T12:50:36,"Corporate Bitcoin Adoption: Refine Group’s Bold $1.03M Move Signals a New Era","BitcoinWorld Corporate Bitcoin Adoption: Refine Group’s Bold $1.03M Move Signals a New Era In a fascinating turn of events that underscores the growing mainstream acceptance of digital assets, Sweden’s Refine Group, a marketing company, has made headlines with a significant strategic decision. The firm recently announced it has successfully raised 10 MSEK, equivalent to approximately $1.03 million, through a directed share issue. But here’s the kicker: the explicit purpose of this capital injection is to fund its BTC Purchases . This bold move by Refine Group isn’t just a ripple; it’s a clear signal in the evolving landscape of corporate finance, highlighting a burgeoning trend towards Corporate Bitcoin Adoption . What’s Driving This Swedish Bitcoin Investment? For many, the idea of a marketing company pivoting to invest its capital in a volatile asset like Bitcoin might seem unconventional. However, Refine Group’s decision is part of a larger narrative unfolding across the globe. Companies are increasingly exploring Bitcoin as a legitimate component of their treasury strategies, seeking refuge from inflationary pressures and aiming for long-term value appreciation. Refine Group’s direct share issue for Swedish Bitcoin Investment is a testament to several underlying factors: Inflation Hedge: With global economies grappling with rising inflation, traditional fiat currencies are losing purchasing power. Bitcoin, often dubbed ‘digital gold,’ is seen by many as a robust hedge against this erosion. Store of Value: Its decentralized nature and finite supply of 21 million coins make Bitcoin an attractive long-term store of value, immune to governmental interference or quantitative easing policies. Diversification: Including Bitcoin in a corporate treasury offers diversification away from traditional assets like cash, bonds, and equities, potentially reducing overall portfolio risk and enhancing returns. Forward-Thinking Strategy: Companies like Refine Group recognize the digital transformation sweeping through finance. Embracing Bitcoin positions them as innovative and adaptable, potentially attracting a new generation of investors and clients who are digitally native. The news, initially shared by NLNico (@btcNLNico) on X, quickly garnered attention, underscoring the market’s keen interest in how traditional businesses are integrating cryptocurrencies. The Accelerating Trend of Corporate Bitcoin Adoption Refine Group is certainly not the first, nor will it be the last, company to embrace Bitcoin. Over the past few years, we’ve witnessed a growing list of public and private entities making significant Bitcoin allocations. This trend, often referred to as Corporate Bitcoin Adoption , began with pioneers like MicroStrategy, which has accumulated vast amounts of BTC, viewing it as their primary treasury reserve asset. Other notable names include Tesla, Square (now Block), and various smaller enterprises across different sectors. This shift signifies a maturation of the cryptocurrency market. What was once considered a niche, speculative asset is now being seriously considered by corporate boards as a viable treasury management tool. The reasons vary, but the common thread is a belief in Bitcoin’s long-term potential and its role in a future digital economy. Key Indicators of Corporate Bitcoin Adoption: Increased public company holdings of BTC. Development of new financial products and services catering to institutional crypto demand. Growing regulatory clarity (though still evolving) in various jurisdictions. More traditional financial institutions offering crypto services to their corporate clients. Strategic Advantages of a Bitcoin Treasury Strategy Implementing a Bitcoin Treasury Strategy goes beyond merely buying BTC; it involves a comprehensive assessment of risk, liquidity, and long-term objectives. For Refine Group, this strategy likely aims to: Enhance Shareholder Value: By potentially increasing the value of the company’s assets, the investment could lead to higher stock prices and greater returns for shareholders. Attract New Investors: Companies with a clear crypto strategy can appeal to a new demographic of investors who are enthusiastic about the digital asset space. Future-Proofing: As the world moves towards digital economies, having exposure to decentralized digital assets like Bitcoin can provide a competitive edge and ensure relevance in the long run. Improved Balance Sheet Strength: If Bitcoin continues its upward trajectory, it can significantly bolster the company’s balance sheet, providing more financial flexibility. However, it’s crucial for any company considering such a move to conduct thorough due diligence, including understanding the tax implications, security requirements for holding digital assets, and the potential for market volatility. Navigating the Landscape of BTC Purchases: Risks and Rewards While the potential rewards of substantial BTC Purchases are alluring, it’s equally important to acknowledge the inherent risks. Bitcoin’s price volatility is well-documented; sharp price swings can impact a company’s balance sheet, at least on paper. Regulatory uncertainty also remains a factor, as governments worldwide continue to develop their frameworks for digital assets. Despite these challenges, the long-term outlook for Bitcoin remains strong for many proponents. The increasing institutional interest, coupled with its fixed supply and growing network effect, paints a compelling picture for its future value. Companies like Refine Group are betting on this long-term appreciation, viewing short-term fluctuations as part of the journey. Considerations for Companies Making BTC Purchases: Custody Solutions: Securely storing Bitcoin is paramount. Companies often use institutional-grade custodians or robust cold storage solutions. Accounting and Reporting: Accounting for Bitcoin on a balance sheet can be complex, requiring specialized knowledge and adherence to relevant standards. Market Timing: While some advocate for dollar-cost averaging, others attempt to time the market, a strategy that carries its own risks. Refine Group’s move adds another layer to the narrative of Bitcoin’s journey from an obscure digital currency to a legitimate corporate asset. It signals a growing confidence among traditional businesses in the long-term viability and potential of the cryptocurrency ecosystem. Conclusion: A Glimpse into the Future of Corporate Finance Refine Group’s $1.03 million share issue for BTC Purchases is more than just a financial transaction; it’s a powerful statement. It highlights the evolving perspective of corporate treasuries, moving beyond traditional assets to embrace the potential of digital currencies. This Swedish Bitcoin Investment exemplifies a growing trend of Corporate Bitcoin Adoption , where companies are strategically leveraging Bitcoin as a hedge, a growth asset, and a signal of their forward-thinking approach. As more firms explore a robust Bitcoin Treasury Strategy , we can expect to see further integration of digital assets into mainstream finance, reshaping how businesses manage their capital in an increasingly digital world. The future of corporate finance is undoubtedly becoming more decentralized and digitally-driven, and Refine Group is clearly positioning itself at the forefront of this exciting transformation. To learn more about the latest Bitcoin trends, explore our article on key developments shaping Bitcoin institutional adoption. This post Corporate Bitcoin Adoption: Refine Group’s Bold $1.03M Move Signals a New Era first appeared on BitcoinWorld and is written by Editorial Team",bitcoinworld,https://bitcoinworld.co.in/refine-group-bitcoin-purchase/,"BTC|REGULATION|MARKET|BUSINESS|TREASURY","Crypto News|BITCOIN|corporate investment|CRYPTOCURRENCY|Refine Group|SWEDEN",cryptocompare
2025-07-16T12:48:02,"Eskom Grid Surges to 60.6%—Is South Africa Poised for Its Bitcoin Mining Plan?","South Africa’s state-run power utility, Eskom, has posted a notable uptick in performance, marking a milestone in a long-struggling electricity supply system. According to a June 2025 electricity update by Minerals Council South Africa (MCSA), the utility’s Energy Availability Factor (EAF) hit an average of 60.6% for the month, the first time this year that Eskom surpassed the 60% mark. More critically, it comes just as Eskom begins to explore new frontiers, among them, Bitcoin mining. Source: Eskom & Minerals Council SA Eskom Sees Stability Gains Amid Winter Demand, But Long-Term Challenges Persist Eskom has shown signs of short-term recovery after years of persistent blackouts, failing infrastructure, and rising debt. The utility managed to avoid load-shedding through most of June and into July, marking a rare period of stability for the national grid. According to André Lourens, chief economist at MCSA, the improved performance reflects a combination of reduced maintenance, better plant output, and strategic use of emergency reserves. “Emergency reserves were sufficient and used strategically to balance the grid, even as the system came under pressure,” he said. Eskom’s Energy Availability Factor (EAF), a measure of plant readiness, typically improves in winter as maintenance is scaled back. In early June, the utility brought 2,500 MW of generation capacity back online ahead of a cold front, helping keep unplanned outages below the 15,000 MW threshold that often triggers Stage 2 load-shedding. Eskom’s Winter Outlook projects that if unplanned outages remain below 13,000 MW, the country can avoid blackouts altogether. Even in a less favorable scenario with 15,000 MW in outages , blackouts would be limited to 21 days over the 153-day winter season. The National Transmission Company South Africa (NTCSA) also released a 52-week forecast, indicating Eskom has adequate capacity to meet demand and reserve requirements through July 2026, even factoring in up to 17,200 MW in unplanned outages. Still, electricity production remains below pre-pandemic levels. Eskom is currently producing around 16,800 GWh per month, up from earlier in the year but still short of the 17,100 GWh monthly average in 2024 and far below the 19,000 GWh peak in 2019. Eskom 52-week outlook Source: Eskom & Minerals Council SA Lourens said output could edge slightly higher in July and August as winter demand peaks. Financially, the utility remains under pressure. Electricity sales have fallen 16% over the past decade, from 217.9 TWh in 2014 to 183.3 TWh in 2024. Revenue, however, has risen 115% over the same period, largely due to steep tariff increases. The average electricity price rose from R0.71 per kWh in 2014 to R2.12 in 2025. Despite falling demand and rising costs, Eskom’s workforce remains bloated. While employee numbers have dropped from 50,000 to 40,000 over the past decade, the World Bank estimates only 14,200 are needed. Labor costs have soared, increasing nearly tenfold since the 1990s. With R403 billion ($22.7 billion) in debt, Eskom is now exploring new revenue opportunities. CEO Dan Marokane recently suggested repurposing excess electricity to support energy-intensive sectors such as AI, data centers, and Bitcoin mining . Eskom Eyes Bitcoin Mining, AI as Part of Future Energy Strategy Amid Operational Setbacks Eskom is exploring Bitcoin mining and AI-driven data centers as potential solutions to utilize surplus generation capacity and stabilize its finances, according to CEO Dan Marokane. Speaking at the BizNews Conference earlier this month, Marokane said the utility is drawing lessons from the United States, where Bitcoin mining operations have contributed to grid flexibility by reducing power use during high-demand periods. Eskom explores supporting Bitcoin mining, AI, and data centers as South Africa’s utility confronts falling electricity sales, debt, and renewable competition. #Eskom #BitcoinMining https://t.co/1iB479D9fg — Cryptonews.com (@cryptonews) July 1, 2025 Eskom is studying similar demand-response models, such as Texas-based Riot Platforms, which earned $32 million in 2023 by cutting power consumption during a heatwave. “There are exciting opportunities around AI and data centers, but also within the space of Bitcoin,” said Marokane. However, environmental concerns persist. A 2024 study in Nature Communications linked major U.S. mining facilities to air pollution across state lines, while their energy use surpassed that of Los Angeles. Although global Bitcoin mining is gradually shifting toward renewables, 52.4% as of the latest Cambridge report , natural gas remains the primary energy source, replacing coal. Eskom’s shift in strategy comes as it continues to struggle with unplanned outages and rising operating costs. From June 13 to 19, outages briefly surged to over 15,000 MW, forcing the utility to increase its use of expensive open-cycle gas turbines. Diesel spending has reached R4.51 billion so far this year—more than double the same period in 2024. The utility is also dealing with delays at the Koeberg Nuclear Power Station. The return of Unit 1 has been pushed back by at least a month after inspections revealed defects in four steam generator tubes. Eskom confirmed that the defects have been addressed in line with safety standards, following assistance from international specialists. Despite the setbacks, Marokane said Eskom must evolve. “The business has to reinvent itself and use part of this baseload in a way that can help it manage the remainder of its debt pile,” he said. The post Eskom Grid Surges to 60.6%—Is South Africa Poised for Its Bitcoin Mining Plan? appeared first on Cryptonews .",cryptonews,https://cryptonews.com/news/eskom-grid-surges-to-60-6-is-south-africa-poised-for-its-bitcoin-mining-plan/,"BTC|MINING|BUSINESS|FIAT|TRADING","Technology News|Bitcoin Mining|South Africa",cryptocompare
2025-07-16T12:47:51,"XRP Sees Increased Trader Interest as Price Approaches Key Resistance Levels Amid Market Developments","XRP has achieved a significant milestone with over 14 million tokens burned, signaling strong network activity and growing trader interest. The XRP burn mechanism continues to play a crucial role",coinotag,https://en.coinotag.com/xrp-sees-increased-trader-interest-as-price-approaches-key-resistance-levels-amid-market-developments/,"XRP|MARKET|TRADING|BTC|ETH","Analysis|News|Ripple|BTC|ETH|XRP",cryptocompare
2025-07-16T12:45:59,"‘Markets Got It Wrong’ – Investor Dan Ives Says This Lagging Subsector Could Be the Biggest of the Year for Tech","Dan Ives, the global head of technology research at Wedbush Securities, says that one tech subsector is primed to have an explosive year. In a new CNBC Television interview, the investor says that the market is undervaluing the cybersecurity subsector. “I think it’s really been a rotation, maybe some of the higher growth in software, some of these other AI (artificial intelligence) plays, so [cybersecurity’s] maybe lagged here. I think the market’s got it wrong. I think, actually, when you look at a subsector, cybersecurity could be the biggest subsector of the year for tech… When you look at CrowdStrike, you look at Zscaler, Palo Alto, Check Point, as more moves to the cloud, cybersecurity is going to go hand-in-hand. So I think this is going to be one of those areas that actually significantly outperforms their earnings season.” Ives also says that he is bullish on IBM, predicting the tech giant will have a resurgence due to the adoption of artificial intelligence. “When you look at [IBM].. when it comes to AI, I think what [IBM CEO Arvind Krishna] is doing there, there’s a renaissance that’s going on. That’s why we’re very bullish on IBM… And I think more and more that’s a stock that’s going to get re-rated, and I think it’s one investors continue to underestimate what’s happened there at IBM.” Follow us on X , Facebook and Telegram Don't Miss a Beat – Subscribe to get email alerts delivered directly to your inbox Check Price Action Surf The Daily Hodl Mix Disclaimer: Opinions expressed at The Daily Hodl are not investment advice. Investors should do their due diligence before making any high-risk investments in Bitcoin, cryptocurrency or digital assets. Please be advised that your transfers and trades are at your own risk, and any losses you may incur are your responsibility. The Daily Hodl does not recommend the buying or selling of any cryptocurrencies or digital assets, nor is The Daily Hodl an investment advisor. Please note that The Daily Hodl participates in affiliate marketing. Generated Image: Midjourney The post ‘Markets Got It Wrong’ – Investor Dan Ives Says This Lagging Subsector Could Be the Biggest of the Year for Tech appeared first on The Daily Hodl .",dailyhodl,https://dailyhodl.com/2025/07/16/markets-got-it-wrong-investor-dan-ives-says-this-lagging-subsector-could-be-the-biggest-of-the-year-for-tech/,"BUSINESS|MARKET|TRADING|TECHNOLOGY|BTC","Financeflux|cybersecurity|Dan Ives|ibm|News|tech",cryptocompare
2025-07-16T12:45:29,"Singapore court approves WazirX request to revote on creditor scheme","The Singapore High Court just gave the green light for a revote on the hacked WazirX crypto exchange restructuring plan. The court reversed its June 4 ruling rejecting WazirX’s restructuring proposal. This would allow the Indian crypto exchange to reopen and begin reimbursing users within weeks. The revised plan, submitted by WazirX’s parent firm Zettai, aims to resolve earlier regulatory objections. It is particularly concerned about Panama-based Zensui and its compliance under Singapore’s Financial Services and Markets Act (FSMA). Earlier, the US, Japan, and South Korea had issued a joint statement, confirming that North Korea’s Lazarus Group was behind the attack. WazirX eyes reopening As per the amended scheme, Indian-registered Zanmai Labs will now oversee all distributions to creditors and users. Zettai and Zensui will no longer handle fund disbursement or core operations. The structural shift toward a locally regulated operator seems like a key in swaying the court. The moratorium on Zettai has also been extended. It grants the company temporary relief from legal actions as it prepares for a creditor vote in the coming weeks. The Singaporean Court confirmed that all previous concerns raised during the June proceedings have been addressed in the updated filing. “Zettai is committed to completing the revote process as soon as possible,” the company stated. If approved by the requisite creditor majority and sanctioned by the court, the WazirX platform will reopen, and distributions will begin under the proposed scheme promptly. 📢 Update on Court Hearing The Singapore High Court has set aside its 4th June 2025 order in SUM 940, and has allowed a revote to be conducted based on an amended scheme. Zettai’s moratorium has also been extended. This decision follows further arguments presented by Zettai.… pic.twitter.com/j0pfywAufo — WazirX: India Ka Bitcoin Exchange (@WazirXIndia) July 16, 2025 It added that the creditors’ vote will be instrumental in securing the approval of the scheme and moving forward with the First Distribution. As of now, the WazirX creditor revote is expected to take place in the coming weeks. The crypto industry has moved ahead a lot since the Indian crypto exchange got hacked. At the time of the hack, 18 July 2024, Bitcoin was trading around $60,000-$70,000. As of now, BTC price has reached an all-time high (ATH) above $123,000. Bitcoin is trading at an average price of $118,862 at press time. CoinDCX defends fund handling Separately, another Indian crypto exchange, CoinDCX, denied allegations it moved user funds to unregistered entities in Lithuania. Reports suggest that CoinDCX CEO Sumit Gupta called the claims “misinformation.” It was followed by reports of WazirX raising the issue in an affidavit filed with the Singapore High Court. Gupta has mentioned that all INR and crypto assets from Indian users have always been held by Neblio Technologies, a registered FIU-IND entity. He added that CoinDCX had no Lithuania-based entity until February 2025, and any interactions were strictly exploratory. Source: Sumit Gupta’s X He added that on February 7, 2025, the exchange updated its terms of use to make Neblio Technologies the formal contracting party. This change was made to further strengthen transparency and user trust. CoinDCX CEO highlighted that they do this proactively so that the users never face challenges like those seen during the WazirX episode. Cryptopolitan Academy: Coming Soon - A New Way to Earn Passive Income with DeFi in 2025. Learn More",cryptopolitan,https://www.cryptopolitan.com/wazirx-gets-nod-for-revote-creditor-scheme/,"ASIA|BTC|EXCHANGE|TRADING|MARKET","News|BTC|INR|SGD|WazirX",cryptocompare
2025-07-16T12:45:00,"Was That the Top for Bitcoin? Top On-Chain Analysts Say No","Top on-chain analysts say that despite a pullback from $122k, the Bitcoin bull run has not yet peaked A key “Peak Signal” indicator from CryptoQuant that has called every major top since 2013 has not flashed Analysis from Swissblock shows the rally is only on day 12 of what is typically a 15-to-30-day expansion After a recent surge that saw Bitcoin push to a new all-time high above $122,000, the price has pulled back to around $118,848. But despite the cooldown, a consensus is forming among top on-chain analysts that the recent peak was likely not the final cycle top for Bitcoin. Key indicators that have accurately signaled major market tops in the past have not yet been triggered, according to new reports from analytics firms CryptoQuant, Swissblock, and Glassnode. Their data suggests that the broader bull market structure remains intact and the rally has more room to run. CryptoQuant: The “Peak Signal” Has Not Flashed Yet CryptoQuant contributor Axel Adler Jr. highlighted a critical chart showing the “Bitcoin Peak Signal,” a tool that has accurately called major cycle tops since 2013. The chart, which overlays Bitcoin’s price history with peak s… The post Was That the Top for Bitcoin? Top On-Chain Analysts Say No appeared first on Coin Edition .",coinquora,https://coinedition.com/bitcoin-cycle-top-not-yet-on-chain-analysis/,"BTC|TRADING|MARKET","Market|Market News|News|Price Analysis|Bitcoin News",cryptocompare
