datetime,headline,summary,source,url,categories,tags,api_source
2025-07-16T13:57:45,"$235M XRP Futures Frenzy: Smart Money Loading Up?","TL;DR CME XRP futures hit $235M in one day, signaling rising institutional interest and global demand. SEC approves UXRP, the first U.S.-listed leveraged XRP ETF, set to launch on NYSE Arca. 3iQ’s Canadian XRP ETF tops $50M in assets as regulated products gain traction globally. XRP Futures Set New Record on CME CME’s XRP futures market posted its highest trading volume to date on July 11. Over $235 million in notional value changed hands in a single day, with volume spread across standard and micro contracts. This brings the total traded volume since the May 19 launch to over $1.6 billion. The contracts offer exposure to XRP without requiring token ownership. The standard contract is based on 50,000 XRP, while the micro version covers 2,500 coins. These cash-settled products are tied to CME’s XRP-Dollar Reference Rate and are available to both institutions and retail traders. Institutions Turn to Regulated Exposure CME has become a go-to exchange for investors who want access to crypto through regulated markets. Its Bitcoin and Ether futures are already widely used, and XRP is now following a similar path. The latest numbers suggest growing use of XRP futures among trading firms. CME’s Active Trader account posted , “XRP and Micro XRP futures crossed $235M notional traded on July 11.” That day, over 9,100 contracts were traded, equal to more than 82 million XRP. Micro contracts also saw their busiest session since launch. Ripple, which uses XRP for international payments, is applying for a banking license in the United States. It is also looking to register under the MiCA framework in the European Union. These moves are part of a broader strategy to build compliant infrastructure for XRP in major markets. XRP Gets First U.S. ETF as Global Demand Grows XRP futures aren’t the only regulated product gaining traction. On July 14, 3iQ reported that its XRP ETF, trading on Canada’s TSX, crossed $50 million in assets. CME data also shows that 45% of XRP futures volume comes from outside North America, pointing to strong demand across regions. Adding to this institutional wave, the SEC has approved the ProShares Ultra XRP ETF, a leveraged futures-based product set to trade under the ticker UXRP on NYSE Arca. Trading is scheduled to begin by week’s end, giving XRP its first U.S.-listed ETF exposure. The post $235M XRP Futures Frenzy: Smart Money Loading Up? appeared first on CryptoPotato .",cryptopotato,https://cryptopotato.com/235m-xrp-futures-frenzy-smart-money-loading-up/,"XRP|TRADING|MARKET|REGULATION|BTC","Crypto Bits|Crypto News|XRPBTC|XRPUSD|CME Group",cryptocompare
2025-07-16T13:54:27,"Bitcoin ETFs Just Pulled Off a $7.78B Inflow Streak Since July 9th","Bitcoin experienced a typical pullback after hitting a new all-time high above $123K this week, briefly dipping before recovering to $118K on Wednesday. Despite this pause in its rally, strong institutional interest remains clear, as consistent inflows into Bitcoin ETFs continued to support market confidence and the broader bullish momentum. Bitcoin ETFs Are Soaking Up Fiat Market intelligence platform Santiment revealed that there has been a surge of capital moving into Bitcoin ETFs as the top crypto asset trades in new territory. Since June 9, these investment vehicles have recorded a combined net inflow of $7.78 billion, averaging $353.8 million daily. Glassnode also observed that Monday marked one of the largest daily inflows to the spot Bitcoin ETFs in the past three months, with over 7,500 BTC added in a single day. What’s striking is Tuesday’s follow-through, as institutions showed no hesitation, adding another 3,400 BTC or around $402 million in net inflows, despite the previous day’s surge. This also represented nine consecutive days of consistent buying pressure. According to data updated by SoSoValue, BlackRock’s IBIT was the top performer as it captured $416.35 million in net inflows. Next up was VanEck’s HODL, which added $19 million, while Grayscale’s Mini Bitcoin Trust and Bitwise’s BITB also saw $18.56 million and $12.7 million, respectively. This steady influx of fiat into the funds aligns with on-chain whale accumulation, which, according to Santiment, is contributing to Bitcoin’s record-setting all-time high levels and demonstrates the growing appetite for institutional exposure to BTC amid its historic rally. Bitcoin Could Hit $200K on Global Institutional Inflows If global institutional inflows alone enter the market, Bitcoin could rise another 70% to approach $200,000, as per an update by Kobeissi Letter. With Bitcoin delivering a 90% CAGR over the past 13 years, even conservative funds are allocating 1% to BTC as treasury adoption gains momentum. Kobeissi noted that with $31 trillion in institutional AUM in the US, a 1% allocation could inject $300 billion into Bitcoin. This, in turn, could drive prices to around $133,000, a widely cited short-term target. Factoring in global institutional AUM, a $1 trillion inflow could add 70% to Bitcoin’s price, thereby pushing it closer to $200,000, all without retail participation. As more institutional products launch and entities accumulate BTC for treasuries, experts believe that Bitcoin’s upward trajectory will continue. The post Bitcoin ETFs Just Pulled Off a $7.78B Inflow Streak Since July 9th appeared first on CryptoPotato .",cryptopotato,https://cryptopotato.com/bitcoin-etfs-just-pulled-off-a-7-78b-inflow-streak-since-july-9th/,"BTC|MARKET|TRADING|FIAT|REGULATION","AA News|BTCEUR|BTCGBP|BTCUSD|BTCUSDT|Crypto News|Bitcoin (BTC) Price|Bitcoin ETF|Bitcoin Whales",cryptocompare
2025-07-16T13:53:00,"Strategy's Saylor Issues One-Word Verdict for Bitcoin","Strategy's CEO Michael Saylor channels his inner dude from ""Big Lebowski"" in new one-word Bitcoin verdict",utoday,https://u.today/strategys-saylor-issues-one-word-verdict-for-bitcoin-0,"BTC","Michael Saylor",cryptocompare
2025-07-16T13:50:48,"Bitcoin Metrics Suggest Potential for Continued Upside as Market Cycle Appears Incomplete","Bitcoin’s current market cycle shows strong signs of continuation, with key indicators like liquidity, timing, and sentiment pointing toward further upside potential. Data from multiple sources reveals that capital is",coinotag,https://en.coinotag.com/bitcoin-metrics-suggest-potential-for-continued-upside-as-market-cycle-appears-incomplete/,"BTC|MARKET|ETH","Analysis|News|BTC|ETH",cryptocompare
2025-07-16T13:48:57,"Q2 market update: Binance leads, but OKX, Bybit and Bitget are coming strong","Binance, OKX, Bybit, and Bitget posted strong performances in the exchange market through Q2 2025, according to TokenInsight. Total trading volume across the top 10 exchanges reached $21.6 trillion despite declining 6.16%. Binance held a 35.39% market share, while five exchanges posted gains. Crypto market capitalization rebounded to $3.46 trillion, marking 28.2% quarterly growth. Binance maintains dominant position Binance held 35.39% trading volume share in Q2 2025, marking a slight decline from Q1. The exchange dropped 1.18% from the previous quarter’s 36.57% market share. Nevertheless, Binance remained the only exchange consistently capturing over one-third of market share. OKX secured second position with 14.34% market share, posting 1.08% quarter-on-quarter growth. The exchange increased from 13.26% in Q1 2025, showing steady market expansion. Bybit maintained third position with 12.20%, declining 0.80% from the previous quarter. Bitget held 11.45% market share with 0.14% growth from Q1’s 11.31% position. MEXC posted an 11.45% share, declining 1.58% from 13.03% in Q1 2025. Gate achieved the largest market share increase, rising 2.55% to 7.95%. Source: TokenInsight BingX recorded 2.17% market share, a 0.17% decline from Q1 levels. HTX maintained 2.64% share, posting 0.51% growth quarter-on-quarter. Coinbase held 1.06% market share, declining 0.62% from the previous quarter. KuCoin maintained a 1.29% market share with 0.05% growth from its Q1 position. Five exchanges saw market share growth during the Q2 2025 period. Gate led gains followed by OKX with substantial quarter-on-quarter improvements. Total trading volume reached $21.6 trillion across the top 10 exchanges combined. The volume declined 6.16% from Q1 despite Bitcoin’s recovery to $106,000 by the end of the quarter. Market conditions drive trading volume decline Bitcoin rose from $83,000 to peak at $111,900, ending the quarter near $106,000. Most other assets saw limited recovery, with altcoins experiencing sharp liquidity drops. Trading activity declined across many alternative cryptocurrencies during the quarter. Crypto market capitalization rebounded to approximately $3.46 trillion by Q2’s end. The recovery marked a 28.2% quarter-on-quarter increase following Q1’s deep correction. ETF product inflows and Bitcoin rally primarily drove market recovery. Federal Reserve rate cut expectations and improving employment data supported sentiment. However, geopolitical tensions and sluggish global growth limited a broader rebound. Ongoing macro uncertainty and slow regulatory progress weighed on activity. Cautious investor sentiment continued affecting trading volumes across exchanges consistently. For the second consecutive quarter, the market’s volume performance declined. Volumes could stay low in the absence of robust inflows or new policy support. In the first quarter, spot trade volume was $51 billion per day; now, it is $40 billion. Spot trading totaled $3.63 trillion, a 21.7% decrease from $4.6 trillion in Q1. Derivatives trading stats fell 3.6% from the previous quarter to $20.2 trillion. The average daily trade of derivatives decreased from $233 billion to $226 billion. Exchange tokens showed mixed performance Exchange tokens showed mixed performance in Q2 2025 with all major tokens underperforming Bitcoin . Bitcoin gained 31.62% while exchange tokens failed to show similar momentum. BNB recorded the highest gain among exchange tokens at 8.91% quarterly. OKB, BGB, and KCS posted modest increases during the quarter. Most other major exchange tokens experienced declines across the timeframe. Exchange token performance remained closely tied to struggling altcoin market conditions. Bitcoin rallied strongly, backed by spot ETF inflows and regulatory clarity. Exchange tokens failed to benefit from the same institutional momentum. During Q2, there was a noticeable drop in altcoin market trading activity and liquidity. Exchange token performance from TokenInsight In Q2 2025, spot trading share continued to fall on most exchanges. With a 2.70% gain in spot share, MEXC had the biggest growth, followed by Bitget. In the face of uncertainty, traders continued to choose high-frequency derivatives trading in Q1. The goal of trading derivatives was to leverage market volatility and manage risks. The pattern showed that spot markets had a more severe decline than derivatives. Binance maintained its leading open interest position with a 23.83% average market share. The exchange increased 0.36% from Q1’s 23.47% open interest share. HTX, Bitget, and OKX recorded the largest open interest gains at 1.19%, 0.71%, and 0.63%. Cryptopolitan Academy: Coming Soon - A New Way to Earn Passive Income with DeFi in 2025. Learn More",cryptopolitan,https://www.cryptopolitan.com/binance-okx-bybit-bitget-dominate-q2-market/,"EXCHANGE|MARKET|BNB|TRADING|BTC","News|Binance|Bitget|BTC|Bybit|OKX",cryptocompare
2025-07-16T13:45:30,"If XRP ends the week at this level, it will hit a record high of $4.8","Cryptocurrency trading expert Ali Martinez is projecting that XRP could rally to a new all-time high near $5, provided the token secures a decisive weekly close. Martinez noted that XRP is showing renewed strength on the weekly chart, emphasizing that breaching $3 would serve as the key catalyst for a breakout to new highs at $4.9, he said in an X post on July 16. XRP price analysis chart. Source: TradingView The analysis highlighted that XRP has repeatedly tested the $3 mark since early 2025 but has consistently failed to close above it, reinforcing its role as a major resistance level. However, recent price action shows a shift in momentum, with XRP forming higher lows since bottoming near $1.90 in April. The steep rally into mid-July, which saw XRP briefly reclaim $3, suggests strong buying interest, putting the token on the brink of a critical breakout. Now, if buyers can push the price above $3 and hold it through the weekly close, the setup would confirm a bullish continuation, targeting $4.80, which is nearly 60% above current levels. XRP fundamentals Overall, XRP has been on a bullish run in line with broader market sentiment, driven by Bitcoin’s ( BTC ) rally to a record high above $123,000. This momentum has helped XRP reclaim its position as the third-largest cryptocurrency by market cap. The rally also follows the U.S. Securities and Exchange Commission’s decision in late June to drop its appeal in the long-running case against Ripple, ending four years of legal uncertainty. Both parties are now exploring a settlement pending court approval. Adding to the optimism, Ripple applied on July 2 for a federal bank charter with the Office of the Comptroller of the Currency, signaling an ambitious move into regulated financial services. Investor interest is also rising, with eleven asset managers filing for spot XRP ETFs and ProShares launching leveraged products tied to the token. XRP price analysis At press time, XRP was trading at $2.96, up 3% on the day and nearly 24% over the past week. XRP seven-day price chart. Source: Finbold The price is well above its 50-day simple moving average ( SMA ) at $2.29 and 200-day SMA near $1.80, confirming strong bullish momentum. However, with a 14-day RSI of 80.62 signaling extreme overbought conditions, the market risks a short-term pullback that could limit its ability to break and hold above the key $3 level decisively. Featured image via Shutterstock The post If XRP ends the week at this level, it will hit a record high of $4.8 appeared first on Finbold .",finbold,https://finbold.com/if-xrp-ends-the-week-at-this-level-it-will-hit-a-record-high-of-4-8/,"XRP|TRADING|MARKET|BTC|BUSINESS","Cryptocurrency news|Bitcoin|crypto|cryptocurrency|XRP",cryptocompare
2025-07-16T13:44:57,"Bitcoin Price Analysis: BTC Bullish Momentum Returns After Recent Correction, Is $140K Next?","Bitcoin is currently trading around $119K after reaching a new all-time high above $123K just days ago. This historic breakout has come with aggressive momentum, flipping prior resistance levels into strong support. The overall structure remains bullish, but recent price action shows early signs of a potential short-term exhaustion. By ShayanMarkets The Daily Chart On the daily chart, BTC has respected its macro bullish channel and just broke out from a large bull flag formation that had been developing for several weeks. This continuation pattern came after a steep rally from the April lows around 75K and was followed by a clean breakout above the 108K resistance zone. Once BTC cleared that level, momentum accelerated rapidly, with the price pushing through the key 114K resistance level and tapping $123K, forming new all-time highs. The bullish structure remains intact, with higher highs and higher lows forming clearly. BTC is now sitting below the dotted trendline that marks the midline of the multi-month ascending channel. This midline zone could be the target of this price rally, as the market might reach and test it around $140K. Another critical observation on the daily chart is the confluence between the breakout and the moving averages. The asset is holding well above both the 100-day and 200-day moving averages, which are slowly curving upward. This suggests strong underlying demand and trend continuation. If BTC does retrace, the 110K zone stands out as the primary support block, not only due to recent price memory but also because it aligns with recent major highs. The 4-Hour Chart Zooming in on the 4-hour timeframe, BTC is testing the $118K–$119K bearish fair value gap, which is now acting as resistance. After the sharp rally toward $121K, the price has pulled back modestly, forming a small range just under the bearish FVG. The RSI has also cooled down from overbought levels and now sits around 58, suggesting there’s still room for more upside in the short term. However, the recent rejection from the $123K highs shows that some local resistance is forming. This could lead to short-term distribution unless bulls reclaim this bearish FVG convincingly. Yet, below the current price, several clean bullish FVGs exist, starting at $114K and extending down to $111K. These are prime zones to watch for long setups if BTC dips further. They mark strong, unmitigated demand areas where the price rallied impulsively with little resistance. A drop into these zones, followed by bullish price action (like a sweep and reclaim), would offer high-probability continuation opportunities toward 125K and beyond. Sentiment Analysis Bitcoin Retail Activity Surge One of the most telling on-chain signals right now is the surge in retail trading activity, as measured by the Bitcoin Spot Retail Activity Through Trading Frequency indicator. This metric evaluates the relative increase in retail participation based on changes from the one-year moving average. Historically, surges in this metric, especially when it turns red, have coincided with major pivots, mostly indicating overheated conditions and excessive euphoria. Right now, the chart is not showing red signals, meaning retail participation is still average. This indicates that retail traders and investors are yet to flood the market and chase the price, at least not to the extent that they have during previous all-time highs. This suggests that the price could still rise sustainably if other factors, especially the futures market metrics, remain stable. The post Bitcoin Price Analysis: BTC Bullish Momentum Returns After Recent Correction, Is $140K Next? appeared first on CryptoPotato .",cryptopotato,https://cryptopotato.com/bitcoin-price-analysis-btc-bullish-momentum-returns-after-recent-correction-is-140k-next/,"TRADING|BTC|MARKET|BUSINESS","BTC Analysis|BTCEUR|BTCGBP|BTCUSD|BTCUSDT|Crypto News|Bitcoin (BTC) Price",cryptocompare
2025-07-16T13:43:09,"Arizona, Texas, and Utah Named Blockchain Policy “Trailblazers” in US","Arizona, Texas, and Utah have emerged as leaders in cryptocurrency regulation in the United States, according to the latest “Tokenized in America” report by Chainlink and the Blockchain Association . Key Takeaways: Arizona, Texas, and Utah lead the US in crypto regulation, earning “trailblazer” status. Over half of the US states have strong congressional support for blockchain. State-level momentum builds alongside federal efforts during “Crypto Week.” These states have been recognized as “trailblazers” for their friendly blockchain policies and growing ecosystems. The report assessed states on several factors, including government-led blockchain pilot projects, active pro-crypto task forces, and legislative support. Concentration of blockchain-related workforce, strategic Bitcoin reserve initiatives, and membership in the North American Blockchain Association (NABA) were also determining factors. Arizona, Texas, and Utah Lead with Strong Regulatory Clarity Arizona, Texas, and Utah scored highest, reflecting a strong commitment to fostering crypto innovation and regulatory clarity. “Texas, Arizona, and Utah earned Trailblazer status for their strength in both policy and ecosystem development,” the report noted. Other states like North Carolina, California, New Hampshire, and Wyoming also showed notable progress across multiple categories. Adam Minehardt, Chainlink Labs’ head of policy, emphasized that while federal crypto regulation receives most attention, significant momentum is building at the state level. He described the report as shedding light on states’ vital roles in shaping digital asset opportunities and challenges ahead. Currently, more than half of U.S. states have robust congressional support for blockchain policy, and over a third operate dedicated pro-crypto task forces. ARIZONA SIGNS STRATEGIC BITCOIN RESERVE INTO LAW! pic.twitter.com/xQXsm2fEXQ — Dennis Porter (@Dennis_Porter_) May 8, 2025 About 22% run blockchain pilot programs, while 16% are pursuing strategic Bitcoin reserve initiatives, signaling growing institutional interest at the regional level. This surge in state-level activity coincides with the U.S. government’s “Crypto Week,” which aims to pass three crucial bills to enhance industry standards and clarify regulatory frameworks. These include the GENIUS Act for stablecoin innovation, the CLARITY Act focused on digital asset market regulation , and the Anti-CBDC Surveillance State Act opposing a central bank digital currency. While industry insiders admit the CLARITY Act has imperfections, its potential passage could position the U.S. as a global leader in digital asset policy. Corporate Bitcoin Holdings Hit Record $91 Billion in 2025 Corporate interest in Bitcoin surged in Q2 2025, with companies adding a record 159,107 BTC valued at over $17.6 billion. This marked a 23.13% rise from the previous quarter and brought total corporate holdings to 847,000 BTC, about 4% of the capped 21 million supply, according to Bitwise Asset Management. The total value of corporate Bitcoin treasuries soared to $91 billion by the end of June, driven by Bitcoin’s price increase of nearly 61% over the quarter. Public companies holding Bitcoin also jumped sharply, with 46 new entrants raising the total number of firms to 125, a 58.23% quarter-on-quarter increase. Leading corporate holders include Michael Saylor’s Strategy with 597,325 BTC, driving strong stock performance with a 43% year-to-date gain. Bitcoin miner MARA Holdings holds nearly 50,000 BTC, while newcomers like Twenty One and Metaplanet have also made significant purchases . GameStop and Trump Media’s recent Bitcoin buys underscore the broadening corporate embrace of digital assets. The post Arizona, Texas, and Utah Named Blockchain Policy “Trailblazers” in US appeared first on Cryptonews .",cryptonews,https://cryptonews.com/news/arizona-texas-and-utah-named-blockchain-policy-trailblazers-in-us/,"BTC|BLOCKCHAIN|REGULATION|FIAT|ETH","Altcoin News|Adoption|Arizona|Bitcoin|Ethereum|Texas",cryptocompare
2025-07-16T13:40:23,"Ripple Price Analysis: Will XRP Break All-Time High Levels in This Aggressive Rally?","XRP has finally come alive after a prolonged period of consolidation and underperformance relative to other major crypto assets. Over the past two weeks, Ripple’s token has broken out from long-standing patterns against both USD and BTC, shifting market structure and flipping critical resistances into support. The breakout is not only technical, it’s aggressive, with surging momentum and elevated RSI levels, hinting at the return of speculation and perhaps early signs of a narrative forming around XRP again. But how sustainable is this rally? Technical Analysis By ShayanMarkets The USDT Pair The XRPUSDT chart is showing a powerful breakout above $2.30 after months of sideways action. The price broke out of a falling wedge pattern that had been forming since late 2024. The wedge breakout was accompanied by a strong bullish candle that closed well above the 50-day and 200-day moving averages, both located around the $2.30 zone. XRP is now pushing into a major resistance area at $3.00, a zone that previously acted as a supply ceiling multiple times during the past year. The rally has been sharp, and the RSI has entered extremely overbought territory at 80. Historically, such RSI spikes have led to corrections or sideways consolidation before continuation. As long as XRP holds above the 100-day and 200-day moving averages in the coming days, the path toward $3.40 and even $4.00 opens up. However, a close below the MAs could trigger profit-taking and drag the price back below $2.00. The BTC Pair The XRP/BTC pair also confirms this momentum shift. The price has broken out of a falling wedge structure and flipped the key 2,200 SAT range into support. This is significant, as XRP had been trending downward against BTC for the majority of 2025. The breakout invalidates the bearish market structure and suggests a new trend phase could be developing. Currently sitting around 2,500 SAT, XRP/BTC is testing its 200-day moving average and is trying to make higher highs and higher lows above it. Moreover, the RSI on this pair is also overbought at 83, suggesting the rally may be overextended in the short term. The next significant resistance lies around 3,100 SAT, a zone that acted as a major distribution region during XRP’s last bullish leg. If XRP/BTC can consolidate above the 2,400 SAT level, the buyers will likely aim for this zone in the next impulse. The post Ripple Price Analysis: Will XRP Break All-Time High Levels in This Aggressive Rally? appeared first on CryptoPotato .",cryptopotato,https://cryptopotato.com/ripple-price-analysis-will-xrp-break-all-time-high-levels-in-this-aggressive-rally/,"TRADING|XRP|MARKET|BTC|USDT","Crypto News|XRP Analysis|XRPBTC|XRPUSD|Ripple (XRP) Price",cryptocompare
