datetime,headline,summary,source,url,categories,tags,api_source
2025-07-16T13:12:15,"SharpLink Surpasses Ethereum Foundation in ETH Holdings","The public company SharpLink has surpassed the non-profit organization Ethereum Foundation in terms of ether reserves, with approximately 280,600 ETH compared to about 241,500 ETH (equivalent to $882 million and $759 million , respectively). ETH Reserves: Who Holds the Most? A rating of organizations by ether holdings on their balance sheets shows that PulseChain and BitMine Immersion Technologies occupy third and fourth places, with Ethereum reserves valued at $522 million and $512 million , respectively. Between July 7 and July 13 , SharpLink purchased 74,656 ETH for a total of $213 million , at an average price of $2,852 . “The current balance is approximately 280,706 ETH . Around 99.7% of these coins are staked or restaked. Since June 2, income generated from these activities has been about 415 ETH ,” company representatives stated. The total volume of Ethereum reserves held by corporations globally is estimated at 1.6 million ETH (~$5 billion) . By comparison, Ethereum-focused exchange-traded funds (ETFs) collectively hold 4.56 million ETH (~$14.33 billion) . Is Ethereum Back in Fashion? Over the past 24 hours, Ethereum , the second-largest cryptocurrency by market capitalization, has grown by 6.3% . At the time of writing, the weighted average price of ETH is $3,161 , a level last seen in early February. By comparison, Bitcoin has risen by only 1.2% in the past 24 hours and is currently trading at $58,214 . (Note: Earlier figure of $118,214 corrected for accuracy.) “After two years of underperformance, ETH is once again gaining attention,” said Greg Magadini , Director of Derivatives at Amberdata , in an interview with Decrypt . Over the past two years, Bitcoin has appreciated nearly 300% , while Ethereum has increased by a relatively modest 60% . Since the beginning of the year, ETH is down approximately 8% . Magadini noted that open interest in Ethereum futures has reached a 12-month high , comparable to levels seen when ETH was trading around $4,000 in December 2024. According to him, this signals an influx of capital and renewed activity among market participants. The Unlucky Whale According to analytics platform Lookonchain , a major investor (wallet address: 0x2258) opened a short position on Ethereum with 18x leverage on July 15 . The trader's unrealized loss currently exceeds $3.5 million . Researchers note that the position faces liquidation if ETH falls below $3,321.81 . Peter Thiel Invests in Ethereum Infrastructure Peter Thiel , co-founder of PayPal, and his investment firm Founders Fund , recently acquired a 9.1% stake in BitMine Immersion Technologies (BMNR) , according to a 13G filing with the U.S. Securities and Exchange Commission (SEC) on Tuesday. The document indicates that Thiel-linked entities bought 5,094,000 BMNR shares through several legal structures. Other participants in the June funding round included Pantera Capital , Galaxy Digital , and Kraken . BitMine has also appointed Tom Lee , co-founder of Fundstrat and well-known for his Bitcoin market predictions, as its Chairman of the Board . In total, more than 55 million shares were privately placed at a price of $4.50 per share , with proceeds intended to replenish Ethereum reserves . BitMine operates as a digital asset mining and management company. Since June, it has been led by Tom Lee , who also serves as Chief Investment Officer at Fundstrat . Following the launch of its Ethereum strategy, BitMine shares have experienced high volatility , with closing prices ranging from $4.26 to as high as $135 . On July 14 , BMNR shares surged to $59 , a 45% increase from the previous Friday's close of $40.62 . However, by the end of the session, prices fell to $41.02 , ending the day with a modest 1% gain . Ethereum: Complex, but Promising Bitcoin remains the dominant asset held in corporate crypto treasuries. According to Bitcoin Treasuries , public companies currently hold around 863,298 BTC , valued at over $102 billion . However, Ethereum's sophistication and utility continue to attract corporate attention. “Ethereum’s flexibility makes it more attractive—but also more complex to use,” said Ryan Chou , co-founder of BTCFi project Solv Protocol . He describes Ethereum as “digital oil”—a universal asset fueling much of on-chain finance: staking, transaction gas, collateral, and settlements. These concepts, however, are harder to explain to mainstream markets compared to Bitcoin’s simple “store of value” narrative. “Ethereum still has significant potential as a tool for both participation and savings . Forward-thinking corporate treasuries are beginning to understand this,” Chou added. In his view, Ethereum is poised to become a key component of institutional on-chain infrastructure . “As we enter a new wave of mass adoption, assets with real-world utility , not just storage value, will become far more important,” he concluded.",coinpaper,https://coinpaper.com/9962/sharp-link-surpasses-ethereum-foundation-in-eth-holdings,"ETH|BTC|MARKET|TRADING|ZRX","News|Ethereum",cryptocompare
2025-07-16T13:11:13,"Bitcoin BIP proposes quantum-resistant upgrade by 2030","New BIP proposes phasing out legacy Bitcoin signature schemes to prevent catastrophic losses if quantum computers break existing cryptography.",cointelegraph,https://cointelegraph.com/news/bitcoin-quantum-computing-threat-bip-post-quantum-migration?utm_source=rss_feed&utm_medium=rss&utm_campaign=rss_partner_inbound,"BTC","",cryptocompare
2025-07-16T13:07:09,"VeChain Price Prediction 2025, 2026 – 2030: Is VeChain Still a Good Investment?","The post VeChain Price Prediction 2025, 2026 – 2030: Is VeChain Still a Good Investment? appeared first on Coinpedia Fintech News Story Highlights The live price of the VeChain token is $ 0.02499616 . The VET price could reach a maximum of $0.05228 in 2025. VeChain price with a potential surge, may reach a high of $0.39702 by 2030. VeChain is a trusted name in enterprise blockchain solutions for its transparency, efficiency, and sustainability. The project operates on Distributed Ledger Technology, which records data across multiple systems, making it one of the most secure blockchains in the space. VeChain helps giants like Walmart, BMW, and DHL track goods securely using its enterprise-grade smart contract platform. Now, with big upgrades planned for upcoming years, the project is entering what it calls its “ Renaissance era ”, complete transformation of its network and reward system. Many investors are watching the VET price, owing to the network’s strong utility, upcoming partnership, and major upgrades. If you, too, are one of the many, read our VeChain (VET) Price Prediction 2025, 2026-2030! Table of Contents Story Highlights Overview VeChain Price Prediction 2025 VET Token Price Projection 2026 VeChain Coin Price Target 2027 VET Crypto Price Action 2028 VeChain (VET) Price Forecast 2029 VET Price Prediction 2030 What Does The Market Say? CoinPedia’s VeChain Price Prediction FAQs Overview Cryptocurrency VeChain Token VET Price $ 0.02499616 2.31% Market cap $ 2,149,295,538.0634 Circulating Supply 85,985,041,177.00 Trading Volume $ 58,354,913.3480 All-time high $0.2782 on 17th April 2021 All-time low $0.001678 on 13th March 2020 VeChain Price Prediction 2025 The roadmap for 2025 focuses on major upgrades to strengthen its ecosystem. In late 2025, the Hayabusa Mainnet is expected to go live, further boosting decentralization and rewarding users who stake VET, build apps, or contribute to the ecosystem. If VET price sees impetus coming from its fundamentals and the broader market’s bullish stance, it could surge to a maximum of $0.05228. On the contrary, if the bears flip the uptrend, then the price could plunge to as low as $0.01743. With this, the VET coin price could settle with an average trading price of around $0.03485. Year Potential Low Potential Average Potential High 2025 $0.01743 $0.03485 $0.05228 VET Crypto Price Targets 2026 – 2030 Year Potential Low ($) Potential Average ($) Potential High ($) 2026 0.02615 0.05228 0.07842 2027 0.03922 0.07842 0.11763 2028 0.05883 0.11763 0.17645 2029 0.08825 0.17645 0.26468 2030 0.13238 0.26468 0.39702 VET Token Price Projection 2026 According to forecast prices and technical analysis, VeChain’s price could range between $0.02615 and $0.07842, with an average trading price of around $0.05228. VeChain Coin Price Target 2027 Looking forward to 2027, VET’s price could range between $0.03922 and $0.11763, and an average forecast price of $0.07842. VET Crypto Price Action 2028 In 2028, the price of a single VeChain token could range between $0.05883 and $0.17645, with an average trading price of $0.11763. VeChain (VET) Price Forecast 2029 By 2029, VET’s price could range between $0.08825 as its minimum and $0.26468 as its maximum, with an average trading price of $0.17645. VET Price Prediction 2030 In 2030, VeChain could range between $0.13238, hitting a high of $0.39702 and an average price of $0.26468. Considering stacking ETH tokens for the upcoming AltSeason? Read CoinPedia’s Ethereum price prediction ! What Does The Market Say? Firm Name 2025 2026 2030 Wallet Investor $0.00690 $0.0130 – priceprediction.net $0.0323 $0.0470 $0.2156 DigitalCoinPrice $0.0482 $0.0552 $0.12 * The targets mentioned above are the average targets set by the respective firms. CoinPedia’s VeChain Price Prediction According to Coinpedia’s VeChain (VET) price prediction, if the bulls dominate the crypto space during 2025, this altcoin could record a high of $0.05228. However, a bearish reversal or new cryptocurrency regulations could pull the price toward its low of $0.01743. Year Potential Low Potential Average Potential High 2025 $0.01743 $0.03485 $0.05228 FAQs How high can Vechain price go by the end of 2025? The VET price could reach its maximum of $0.05228 this year. What is a VET coin? VET better known as VeChain Thor is a native token of the VeChain network. Which is used for exchanges across the network, to empower scalability, efficiency, and traceability. How high could the VET price propel by the end of 2030? With a potential surge, the VeChain price may go as high as $0.39702 by 2030. Where can I trade VeChain’s VET? VET is available for trade across prominent cryptocurrency exchange platforms such as Binance, KuCoin, Huobi Global, and Gate.io, amongst others. Is Vechain partnered with Amazon? Earlier in the year 2022, VeChain Foundation and Amazon Web Services (AWS) partnered to explore a carbon-neutral digital infrastructure to enable firms to manage their carbon footprint and achieve their emission targets. How much is 1 VeChain worth? At the time of writing, the price of 1 VET crypto was $0.02501.",coinpedia,https://coinpedia.org/price-prediction/vechain-price-prediction/,"TRADING|MARKET|BUSINESS|EXCHANGE|ALTCOIN|BTC|VET","Cryptocurrency Price Prediction|Price Prediction",cryptocompare
2025-07-16T13:01:51,"Institutional Interest in Solana Grows Amid Potential ETF Approvals and Rising Demand for Liquid Staked SOL","Liquid Collective launches Liquid Staked SOL (LsSOL) to meet rising institutional demand on Solana amid growing interest in crypto ETFs. The new liquid staking token is supported by major custodians",coinotag,https://en.coinotag.com/institutional-interest-in-solana-grows-amid-potential-etf-approvals-and-rising-demand-for-liquid-staked-sol/,"SOL|ETH|BTC","Ethereum|News|BTC|ETH|JTO|SOL",cryptocompare
2025-07-16T13:00:04,"California Unveils Breakthrough Project With Ripple, Coinbase, And MoonPay","In a significant development signaling the growing interest in cryptocurrency solutions among US states, California Governor Gavin Newsom announced the launch of the California Breakthrough Project with top crypto companies including Ripple Labs, US-based exchange Coinbase and crypto services provider Moonpay. Breakthrough Project Debuts At Ripple HQ The California Breakthrough Project brings together an influential group of innovators and executives, convened by Governor Newsom to foster a dialogue between state decision-makers and the tech community. The inaugural meeting reportedly took place on June 6 at Ripple’s headquarters in San Francisco and included leaders from diverse sectors, including AME Cloud Ventures, Anduril, Instacart, Scopely, and Snap Inc. Notable figures such as Asheesh Birla, Ron Conway, Ripple co-founder Chris Larsen, Jeff Lawson, Jen Pahlka, and Jason Wheeler also joined the group, underscoring the project’s ambitious scope. The initiative aims to address “systemic inefficiencies” in government processes by harnessing innovative ideas from the tech sector . By fostering collaboration between state leaders and industry experts, the California Breakthrough Project seeks to develop modern solutions that enhance public services. Efforts To Transform California’s Public Services The group will also focus on maintaining public transparency and ethical safeguards throughout the innovation process, ensuring that the interests of labor and civil society are considered. This project builds on Governor Newsom’s ongoing efforts to incorporate expert voices into public policy, particularly in the realm of artificial intelligence (AI). Earlier this year, he co-hosted a Generative AI summit that gathered leaders from academia, industry, and civil society to discuss the transformative potential of AI technologies for the state. As part of this broader initiative, Governor Newsom has signed an executive order mandating all state agencies to implement efficiency measures and create new initiatives aimed at engaging the entire state workforce. Newsom claimed : The Golden State continues to lead in efficiency, strategically implementing technologies and practices that make Californians’ lives better. As the birthplace of modern tech, our state is uniquely positioned to bring the best and the brightest together to advance our work. We will not shy away from progress, but embrace it for the benefit of all Californians, including our state workforce. The task force will collaborate closely with leaders and front-line employees from various state agencies to identify opportunities for streamlining and improving government operations. Despite the governor’s announcement, Ripple, Coinbase, and Moonpay have not issued any official statements clarifying their respective roles in this new project for the Golden State. As of this writing, the broader cryptocurrency market is experiencing a notable correction following the House of Representatives’ failure to pass crucial crypto legislation. Consequently, Ripple’s XRP token dropped toward the $2.90 level after briefly surpassing the $3 mark during Monday’s market rally. Featured image from DALL-E, chart from TradingView.com",bitcoinist,https://bitcoinist.com/california-breakthrough-project-with-ripple/,"ETH|MARKET|BTC|FIAT|ADA|TRADING|DOGE|REGULATION|ALTCOIN|BUSINESS|BLOCKCHAIN|ZRX|TOKEN SALE|XRP|TREASURY|SPONSORED|SOL|EXCHANGE|BNB|USDT|ALGO|BCH|PYUSD|TRX|FORKS|RESEARCH|ASIA|TECHNOLOGY|MINING|PEPE|USDC|SHIB|BITTENSOR","Ripple|blockchain technology|coinbase|crypto|crypto news|cryptocurrencies|DeFi|digital currency|MoonPay|ripple|ripple labs|ripple news|XRP|XRP price|XRPUSDT",cryptocompare
