datetime,headline,summary,source,url,categories,tags,api_source
2025-05-26T19:55:41.000Z,"Vitalik Buterin Calls for Ethereum To Be More Private and Resilient Amid Rise of ‘Cashless Society’","Vitalik Buterin, the co-founder of Ethereum says that ETH should work towards being more ready to play the role of cash. In a new post on the social media platform X, Buterin comments on a report published by The Guardian about Sweden’s migration toward becoming a cashless society. The report discusses how plans for Sweden to become completely cashless by 2025 have been partially successful. However, due to geopolitical uncertainties and the war in Eastern Europe, the Swedish government is now encouraging citizens to keep more cash – krona – on them. Sweden launched a pilot program for an “e-krona” in 2017, but then ended it in 2023. The Riksbank – Sweden’s central bank – stated in March that it determined there was little need to issue a digital krona, but that it would re-evaluate the plans if the European Central Bank (ECB) issued a digital euro. Said the Riksbank, “The Payments Inquiry’s assessment in 2023 was that there was insufficient social need for the Riksbank to issue an e-krona. At the same time, the inquiry considered that the Riksbank should continue to evaluate the conditions for issuing an e-krona so that it is possible to introduce an e-krona within a reasonable time if the Riksdag takes such a decision.” Says Buterin on the Guardian story, “Nordics are walking back the cashless society initiative because their centralized implementation of the concept is too fragile. Cash turns out necessary as a backup. Ethereum needs to be resilient enough, and private enough, to be able to credibly play this kind of role.” Earlier this month, Buterin made headlines by calling Ethereum “needlessly complex.” Follow us on X , Facebook and Telegram Don't Miss a Beat – Subscribe to get email alerts delivered directly to your inbox Check Price Action Surf The Daily Hodl Mix Disclaimer: Opinions expressed at The Daily Hodl are not investment advice. Investors should do their due diligence before making any high-risk investments in Bitcoin, cryptocurrency or digital assets. Please be advised that your transfers and trades are at your own risk, and any losses you may incur are your responsibility. The Daily Hodl does not recommend the buying or selling of any cryptocurrencies or digital assets, nor is The Daily Hodl an investment advisor. Please note that The Daily Hodl participates in affiliate marketing. Generated Image: Midjourney The post Vitalik Buterin Calls for Ethereum To Be More Private and Resilient Amid Rise of ‘Cashless Society’ appeared first on The Daily Hodl .",dailyhodl,https://dailyhodl.com/2025/05/26/vitalik-buterin-calls-for-ethereum-to-be-more-private-and-resilient-amid-rise-of-cashless-society/,"BTC|BUSINESS|ETH|FIAT|TRADING","Ethereum|ETH|News|vitalik buterin",cryptocompare
2025-05-26T19:48:26.000Z,"Bitcoin Price Forecast: Long-Term $250K Target? Ozak AI May Hit $1 Sooner","Bitcoin (BTC) maintains dominating headlines with its superb price movements, even as emerging initiatives like Ozak AI (OZ) are taking images of investor interest with their ability for large returns. As of May 13, 2025, Bitcoin is trading at about $103,255, reflecting a mild increase of 22.89% from the previous close. Meanwhile, Ozak AI, priced at simply $0.003, is garnering interest for its formidable intention of accomplishing $1, representing a potential 300x return for early buyers. Bitcoin Price Forecast: Long-Term $250K Target? Bitcoin (BTC), currently trading around $104,000, continues to draw sturdy bullish sentiment within the market. Institutional interest is on the rise, spurred through the approval of spot Bitcoin ETFs and increasing adoption from traditional financial players. With main analysts, along with Standard Chartered and Fundstrat, predicting a $150K–$180K price goal by the end of 2025, Bitcoin stays a top project in the crypto race. These projections are primarily based on tightening supply, and macroeconomic developments favoring decentralized assets as hedges against inflation. BTC’s resistance zones lie at $115,000 and $120,000, with aid around $88,000 and $75,000. A damage above the $100K psychological mark ought to spark a FOMO-pushed rally towards the $180K ceiling. However, seasoned investors are aware that Bitcoin’s big market cap limits its upside in comparison to smaller-cap tokens, which could supply exponential returns with tons much less capital inflow. Ozak AI May Hit $1 Sooner Ozak AI is an innovative project that combines artificial intelligence with blockchain technology to offer predictive analytics and data solutions. With an Ozak AI presale rate of $0.003, Ozak AI has already raised over $1 million, indicating strong investor interest. The project aims to attain a $1 valuation by using 2025, representing a potential 300x go back for early buyers. Ozak AI's platform consists of capabilities like customizable Prediction Agents and secure Data Vaults, positioning it as a strong tech surroundings. Analysts endorse that the developing demand for AI solutions and the project’s unique value proposition ought to pressure the giant boom in the coming years. While Bitcoin continues demonstrating its strength as a main cryptocurrency with a potential long-term target of $250,000, emerging projects like Ozak AI offer interesting possibilities for extensive returns in a shorter time-frame. Investors should recollect their risk tolerance and investment goals whilst exploring those options, preserving in mind the inherent volatility and uncertainties in the crypto market. About Ozak AI Ozak AI is a blockchain-based project that offers a technology platform that specializes in predictive AI and advanced data analytics for financial markets. Ozak AI helps crypto investors and companies in choice-making by offering real-time, accurate, and actionable insights thru machine learning algorithms and decentralized community technologies. For more visit: Website : Telegram : Twitter Disclaimer: This is a sponsored article and is for informational purposes only. It does not reflect the views of Crypto Daily, nor is it intended to be used as legal, tax, investment, or financial advice.",cryptodaily,https://cryptodaily.co.uk/2025/05/bitcoin-price-forecast-long-term-250k-target-ozak-ai-may-hit-1-sooner,"BTC|BUSINESS|MARKET|TRADING|ZRX","More News",cryptocompare
2025-05-26T19:47:40.000Z,"Bitcoin Whale James Wynn Faces $7.5 Million Loss on 40x Long Position","In a recent analysis of on-chain metrics, crypto enthusiast James Wynn’s significant **40x Bitcoin long position** is now facing an **unrealized loss** of **$7.5 million**. This alarming shift has drawn",coinotag,https://en.coinotag.com/breakingnews/bitcoin-whale-james-wynn-faces-7-5-million-loss-on-40x-long-position/,"BTC|MARKET|ZRX|PEPE","BTC|PEPE",cryptocompare
2025-05-26T19:33:25.000Z,"Trump Media’s $3 Billion Plan to Acquire Bitcoin May Invite Increased Scrutiny of Trump’s Crypto Ventures","The recent decision by Trump Media and Technology Group to venture into cryptocurrency is a significant development in the intersection of politics and finance. By raising $3 billion through equity",coinotag,https://en.coinotag.com/trump-medias-3-billion-plan-to-acquire-bitcoin-may-invite-increased-scrutiny-of-trumps-crypto-ventures/,"BTC|TECHNOLOGY","News|BTC",cryptocompare
2025-05-26T19:00:05.000Z,"2,700% XRP Rise? Analyst Predicts Monster Move Based On The Charts","A well-known crypto analyst, going by the name Egrag Crypto, has laid out some eye-popping targets for XRP. According to his charts, the token could climb as high as $45, a 2,700% jump from its current price. A more modest scenario would still send it to $19, up a little over 1,000%. He points to past cycles where similar moves took shape over roughly 770 days. Yet not everyone is on board with his bullish outlook. Related Reading: Investors Pour $2.75 Billion Into Bitcoin ETFs As Price Skyrockets Historical Moves And Cycle Timing Based on reports, Egrag Crypto stresses that XRP’s rallies in 2017 and 2021 followed almost identical paths. The token hit $3.25 in 2017 after surging 2,770%. Then in 2021 it jumped 1,052% to about $1.80. Each rally was marked by a bearish crossover on the 21 EMA and the 33 MA, followed by sideway trading for around 777 days after the 2018 peak and 770 days after the 2021 high. He believes the same setup started late in 2024, when XRP climbed nearly sixfold from its previous low. #XRP – Targeting $19 or $45? 🟣Charts Men lie, women lie, but charts don’t! 📊 I’m not improvising here; I’m relying on historical data to present future predictions. Will it rhyme exactly? No, because if it were that easy, everyone would be a multimillionaire! 💰 🟣Human… pic.twitter.com/YasA4k98fd — EGRAG CRYPTO (@egragcrypto) April 11, 2025 Bullish Targets And Risks According to the analysis, a repeat of past moves could push XRP as high as $45. A less aggressive run would still see it reach $19. Egrag Crypto even points to an intermediate target of about $27 as a likely milestone. Those numbers assume a straight path up, but markets rarely move in straight lines. Big jumps often end with sharp pullbacks. Traders chasing 2,700% gains could face long wait times and steep drops. Bearish Views Gain Ground Other voices warn against getting swept up in the hype. Market watcher Koroush says now is a time for shorts. He pegs a possible decline to $1.30. Others favor a short bias, pointing to weakening demand and faltering momentum. Related Reading: Bitcoin To $125K By End Of Q2? Bold Call From Bybit Executive Advice For Traders Egrag Crypto recommends a simple Dollar-Cost Averaging plan. Buy small amounts at regular intervals. That way, no one big buy leaves you exposed. He says to sell in slices, too. Lock in gains at key levels instead of betting everything on the top. This kind of step-by-step play can cut losses and smooth out wild swings. Looking Ahead The debate around XRP’s next phase is far from over. Historical charts show one side of the story. On-chain trends, legal battles, and macro factors tell another. If charts really don’t lie, as Egrag Crypto quips, XRP might be gearing up for a fireworks show. Featured image from Unsplash, chart from TradingView",newsbtc,https://www.newsbtc.com/altcoin/2700-xrp-analyst-predicts-monster-move-based-on-the-charts/,"ALTCOIN|BTC|MARKET|TRADING|XRP","Altcoin|altcoins|bitcoin|crypto|memecoins|xrp",cryptocompare
2025-05-26T18:55:38.000Z,"Bitcoin’s Momentum: Key Resistance Levels Could Influence Altcoin Trends Ahead","Bitcoin’s resilience amid market fluctuations continues to draw significant attention, making it a focal point for crypto investors aiming for potential gains. Despite recent market volatility, institutional investment in Bitcoin",coinotag,https://en.coinotag.com/bitcoins-momentum-key-resistance-levels-could-influence-altcoin-trends-ahead/,"ALTCOIN|BTC|ETH|MARKET|XRP","Ethereum|News|BTC|ETH|XRP",cryptocompare
2025-05-26T18:55:19.000Z,"Quite the opposite, criminals are embracing blockchain more as a feature than a bug","Ari Redbord, the Global Head of Policy at TRM Labs, has shed light on the mind of the crypto criminals saying that they are not intimidated by blockchain’s transparency. According to him, North Korea hackers understand they can be tracked and traced but they perceive it as the cost of doing business. Initially, the crypto industry was sure their system would not have criminals as a vulnerability because transactions are open to everyone. However, over time, all manner of illicit activities have multiplied. Redbord says that criminals see the transparent nature of blockchain more as a feature than a bug. Blockchain being transparent is not enough Recently, the crypto industry has recorded kidnappings as a result of blockchain transparency. A crypto investor, John Woeltz, did the most recent kidnapping, among many others , this month. He allegedly beat and hanged the victim off a ledge when he refused to provide his Bitcoin password. Ari Redbord said, “I think that’s the paradox of crypto…we say bad guys should never use crypto because we see every transaction, and that’s true, but the reality is that they can also move funds faster and in larger amounts, and that’s why we just have to get better and better at what we’re doing.” The thing about crypto is that funds can be moved in minutes, if not seconds. This is very friendly to criminals. According to Michael Pearl, vice president of strategy at a blockchain security firm, security methods such as multi-factor authentication could help make forced transfers harder to execute without alerting others. On the other hand, transparency has helped blockchain technology compete with traditional assets such as Gold. Crypto users have convinced the US government that BTC is better than Gold. They reasoned it takes about 44k man-hours, 20 people and 18 months to audit the Gold Reserves in Fort Knox. But it takes about 1 second and a push of a button to audit Bitcoin. A victim scammed $2.6 million of crypto in three hours A report from Web3 security company Cyvers says the victim was scammed twice in three hours and lost $2.6 million worth of Tether’s stablecoin (USDT). 🚨ALERT🚨Our system has detected~2.6M $USDT loss from a targeted address poisoning scam involving zero-value transfers. A single victim was repeatedly scammed by the same attacker address. First, the victim lost 843K $USDT . ⏳ About 3 hours later, the same victim sent 1.75M… pic.twitter.com/WWVlrZvavK — 🚨 Cyvers Alerts 🚨 (@CyversAlerts) May 26, 2025 The victim was the target of an address poisoning scam. Usually, attackers send transactions with no value from a wallet address that looks like a real one the victim uses or interacts with. The person who was scammed first sent $843,000 in USDT to the con artist. Not even three hours later, they mistakenly sent an extra $1.7 million in USDT to the same fake address. The event shows how complicated crypto-related scams are getting. This year has been difficult for crypto investors. For instance, in April alone, over 18 big attacks were reported. The most severe one involved a fake Bitcoin (BTC) transaction, which resulted in a loss of $330.7 million. In February, hackers used malware to trick the Dubai-based exchange Bybit into approving deals that weren’t supposed to happen. The exchange lost $1.46 billion. This theft beat the previous record of $611 million stolen from Poly Network in 2021. Meanwhile, Ripple sent a message to its users telling them to be careful of scams, which tend to become more common when the crypto market goes up. The blockchain company wrote in a blog post about the rise of scams using AI-made content, such as deepfake videos of Ripple CEO Brad Garlinghouse giving away XRP. “These posts include branding and profile pictures that look exactly like what the companies, individuals or government authorities use It’s important to spot which accounts are fake, and which posts are cryptocurrency giveaway scams.” Ripple wrote. Cryptopolitan Academy: Want to grow your money in 2025? Learn how to do it with DeFi in our upcoming webclass. Save Your Spot",cryptopolitan,https://www.cryptopolitan.com/criminals-are-embracing-blockchain-more/,"BLOCKCHAIN|BTC|BUSINESS|EXCHANGE|USDT","News|Cyvers|Ripple",cryptocompare
2025-05-26T18:52:32.000Z,"Price predictions 5/26: SPX, DXY, BTC, ETH, XRP, BNB, SOL, DOGE, ADA, HYPE","Key points: Bitcoin ETPs continue to witness solid buying, signaling that the bulls expect the uptrend to continue. Several major altcoins witnessed a pullback, but lower levels continue to attract buyers. Bitcoin ( BTC ) is attempting to sustain above $109,588, indicating buying on every minor dip. Bitcoin has risen for seven consecutive weeks , and if buyers can extend the streak to eight weeks, it clears the path for further upside. Crypto analyst and trader Carpe Noctom said in a post on X that Bitcoin has only seen three instances of eight consecutive weekly positive closes, and every time, Bitcoin has been higher in the following 6 and 12 month time period. Institutional investors sense a long-term opportunity and, hence, have continued to pump money into Bitcoin exchange-traded products (ETPs). CoinShares reported on May 26 that Bitcoin ETPs witnessed $2.9 billion in inflows last week, which is a quarter of the total inflows for 2024. Crypto market data daily view. Source: Coin360 Although most analysts remain bullish over the long term, some are warning of a possible short-term pullback in Bitcoin. CryptoQuant contributor Crazzyblockk wrote in a QuickTake blog post that the data shows buyer exhaustion and increasing volatility, which could start a short-term correction toward $105,000 . Could buyers catapult Bitcoin to a new all-time high, pulling altcoins higher? Let’s analyze the charts of the top 10 cryptocurrencies to find out. S&P 500 Index price prediction The S&P 500 Index (SPX) turned down from 5,968 and reached the 20-day exponential moving average (5,759). SPX daily chart. Source: Cointelegraph/TradingView If the price rebounds off the 20-day EMA, the index could gradually climb toward the overhead resistance of 6,000. Sellers are expected to pose a strong challenge in the 6,000 to 6,147 zone. The short-term advantage will favor the bears on a break and close below the 20-day EMA. The index could then plummet to the 50-day simple moving average (5,584), which is likely to attract buyers. US Dollar Index price prediction The bulls tried to push the US Dollar Index (DXY) above the 20-day EMA (100.15) on May 22, but the bears held their ground. DXY daily chart. Source: Cointelegraph/TradingView Sellers are trying to strengthen their position by pulling the price below the 99 support. If they manage to do that, the index could continue its slide to the solid support at 97.92. Buyers are expected to defend the 97.92 level with all their might because a break below it may sink the index to 95.67. Buyers will have to drive and maintain the price above the 50-day SMA (101.26) to indicate that the corrective phase may be over. Bitcoin price prediction Bitcoin bulls are trying to push and sustain the price above $109,588, indicating that every minor dip is being purchased. BTC/USDT daily chart. Source: Cointelegraph/TradingView The upsloping moving averages and the RSI near the overbought territory signal that the path of least resistance is to the upside. If buyers shove the price above $111,980, the BTC/USDT pair could skyrocket to $130,000. The 20-day EMA ($104,886) is the vital support to watch out for on the downside. A break and close below the 20-day EMA could tempt short-term buyers to book profits. That could sink the pair to the psychologically crucial $100,000 level, where buyers are expected to mount a strong defense. Ether price prediction Ether ( ETH ) turned up from the 20-day EMA ($2,425) on May 25, indicating solid demand at lower levels. ETH/USDT daily chart. Source: Cointelegraph/TradingView The bulls will try to drive the price above the $2,738 obstacle again. If they succeed, the ETH/USDT pair could soar to $3,000. The bears will try to halt the up move at $2,850, but the bulls are likely to prevail. If the price turns down from the current level or the overhead resistance and breaks below the 20-day EMA, it suggests that the bulls are losing their grip. The pair could dip to $2,323 and then to $2,111. XRP price prediction XRP ( XRP ) has been oscillating between $2.65 and $2, signaling equilibrium between buyers and sellers. XRP/USDT daily chart. Source: Cointelegraph/TradingView The flattish 20-day EMA ($2.34) and the RSI near the midpoint do not give a clear advantage either to the bulls or the bears. If the price turns up and breaks above $2.48, the bulls will have another go at the $2.65 resistance. If they clear the overhead hurdle, the XRP/USDT pair could soar to $3. On the other hand, a break and close below the 50-day SMA could sink the pair to the solid support at $2. Buyers are expected to vigorously defend the $2 level because a break below it may sink the pair to $1.61. BNB price prediction BNB ( BNB ) has started to move toward the overhead resistance of $693 after taking support at the 20-day EMA ($652). BNB/USDT daily chart. Source: Cointelegraph/TradingView The upsloping 20-day EMA and the RSI in the positive territory indicate an advantage to buyers. If bulls kick the price above $693, the BNB/USDT pair could rally to the $732 to $761 overhead zone. Contrarily, if the price turns down and breaks below the 20-day EMA, it suggests that the bears are trying to seize control. The pair could slump to $633 and subsequently to the 50-day SMA ($617). Solana price prediction Solana ( SOL ) took support at the 20-day EMA ($169) on May 25, indicating that the sentiment remains positive and traders are buying on minor dips. SOL/USDT daily chart. Source: Cointelegraph/TradingView The bulls will again attempt to drive the price above the $188 overhead resistance. If they can pull it off, the SOL/USDT pair could surge to $210 and eventually to $220. Sellers will have to pull the price below the 20-day EMA to prevent the upside. The pair could then plunge to the 50-day SMA ($151), which is likely to act as solid support. A bounce off the 50-day SMA could signal a few days of range-bound action between $153 and $188. Related: Solana following Bitcoin? Network activity, chart pattern point to $300 SOL price Dogecoin price prediction Dogecoin ( DOGE ) has been trading between $0.26 and $0.21, signaling buying near the support and selling close to the resistance. DOGE/USDT daily chart. Source: Cointelegraph/TradingView The price has bounced off the 20-day EMA, opening the gates for a rally to the overhead resistance of $0.26. Buyers will have to pierce the $0.26 level to start the next leg of the uptrend to $0.30 and then to $0.35. Alternatively, a break and close below the $0.21 support suggests the bears are back in the game. The DOGE/USDT pair could then swing inside a large range between $0.26 and $0.14 for some time. Cardano price prediction Buyers are trying to keep Cardano ( ADA ) above the neckline of the inverse head-and-shoulders pattern but have failed to start a strong rebound. ADA/USDT daily chart. Source: Cointelegraph/TradingView The 20-day EMA ($0.75) is flattening out, and the RSI is near the midpoint, indicating a balance between supply and demand. Buyers will have to propel the price above $0.86 to tilt the advantage in their favor. If they manage to do that, the ADA/USDT pair could rally to $1.01. Contrary to this assumption, if the price turns down and breaks below the neckline, it suggests that the bulls have given up. The pair could then drop to the $0.60 support, which is likely to attract buyers. Hyperliquid price prediction Hyperliquid (HYPE) has been in a strong uptrend for the past several days. Buyers asserted their supremacy by pushing the price above the $35.73 resistance on May 25. HYPE/USDT daily chart. Source: Cointelegraph/TradingView The bulls will try to maintain the momentum and push the price to $42.25, where the bears are expected to step in. If buyers do not give up much ground from $42.25, the uptrend could extend to $50. The immediate support on the downside is $35.73. If the HYPE/USDT pair rebounds off $35.73, it increases the likelihood of a rally above $42.25. Sellers will gain the upper hand on a break below $32. This article does not contain investment advice or recommendations. Every investment and trading move involves risk, and readers should conduct their own research when making a decision.",cointelegraph,https://cointelegraph.com/news/price-predictions-5-26-spx-dxy-btc-eth-xrp-bnb-sol-doge-ada-hype?utm_source=rss_feed&utm_medium=rss&utm_campaign=rss_partner_inbound,"ADA|BTC|MARKET|SOL|TRADING","",cryptocompare
