datetime,headline,summary,source,url,categories,tags,api_source
2025-05-26T17:20:14.000Z,"Elon Musk quietly confirms X money “happening soon” amid dollar troubles","Elon Musk has confirmed that X will launch X money soon. This is setting up the social media platform to be an everything app, as Musk wanted. The money service is expected to give users a digital wallet on X to store money and make peer-to-peer transfers. The information has been made public by an Elon Musk and Tesla fan account, after which the repost was picked up by the widely-followed Tesla Owners Silicon Valley account. It added, “Payments. Banking. The Everything app just got even bigger.” 🚨BREAKING: Confirmed by Elon — X is launching X Money soon 💸📲 Payments. Banking. The everything app just got even bigger. pic.twitter.com/vVHszUKQC8 — Tesla Owners Silicon Valley (@teslaownersSV) May 25, 2025 Elon Musk commented, “This will be a very limited access beta at first When people’s saving are involved, extreme care must be taken.” The project has not started yet. Musk has been getting money transfer licenses in states across the country since he bought Twitter and changed its name to X. X to become the US WeChat Industry leaders have been adding financial services to social media platforms for a long time. Nearly ten years ago, Meta made Facebook Marketplace, a place where people could buy and sell things. While TikTok has a Shop, it also has a Creator Rewards program that lets artists make money. However, the new thing about X Money is that it lets you make quick payments from the app. TikTok says that payments made through PayPal are usually handled in 72 hours. Musk has said in the past that he wants people to do all of their banking on his platform and that one day, “you won’t need a bank account.” Visa said earlier this year that it would be the first company to work with X Money. Through the agreement, users would be able to safely send money to X from their checking account or debit card. Not to say that there are no competitors. There are a lot of players in the market for mobile payment apps. Millions of people use them regularly. However, X Money is the most tightly linked mix of money and social media the US market will see. This is a popular pairing in other parts of the world; Tencent’s WeChat is a good example of the service. X Money LLC is now registered with money transmitter licenses in 40 states plus the District of Columbia. It is also registered with the Financial Crimes Enforcement Network (FinCEN). Joanne Kumire, lead banking and payments analyst at GlobalData, said in emailed comments, “Acquiring money transmitter licenses, leveraging Visa’s support, and tapping into X’s existing user base create a strong foundation However, the challenge lies in turning potential into action. To succeed, X will need to address trust concerns, offer compelling reasons for users to switch, and deliver a seamless, innovative payment experience.” The odds that Musk will allow crypto transitions While working with DOGE, Musk said that he wanted to put the US Treasury on a blockchain. This is the technology that Bitcoin and other crypto coins are based on. Musk is a huge fan of c rypto and especially the Doge memecoin. Also, earlier this year, Linda Yaccarino, CEO of X, said that payments would be coming to the social media platform in 2025. This led to a lot of wild speculation that the platform might use or support bitcoin, crypto, or dollar-pegged stablecoins that use crypto technology to make transactions faster and cheaper. In the meantime, the crypto market is doing extremely well, with the biggest coin (BTC) managing to maintain above $100k. On the other hand, the dollar has been affected by the uncertainties that have come with Trump’s administration. This has led to the US states approving of the strategic Bitcoin reserve. Cryptopolitan Academy: Tired of market swings? Learn how DeFi can help you build steady passive income. Register Now",cryptopolitan,https://www.cryptopolitan.com/elon-musk-quietly-confirms-x-money-here-soon/,"BLOCKCHAIN|BTC|FIAT|MARKET|TECHNOLOGY","Tech|X Money",cryptocompare
2025-05-26T17:17:42.000Z,"New Whales May Influence Bitcoin’s Price as Profit-Taking Continues Around $110,000 Mark","Bitcoin’s recent momentum has come to a halt near the $110,000 mark as new whales take profits, exerting selling pressure on the market. Despite a remarkable surge of over 30%",coinotag,https://en.coinotag.com/new-whales-may-influence-bitcoins-price-as-profit-taking-continues-around-110000-mark/,"BTC|MARKET|TRADING","Analysis|News|BTC",cryptocompare
2025-05-26T17:01:00.000Z,"Remixpoint to Acquire $7M More in Bitcoin, Boosting Crypto Holdings to $84M","Remixpoint to Double Bitcoin Holdings with Additional $7M Purchase Japanese energy and consulting firm Remixpoint disclosed plans to purchase an additional ¥1 billion ($7 million) worth of Bitcoin, doubling its overall holdings in cryptocurrency to ¥12 billion, or roughly $84 million. Strategic Diversification of Digital Assets The purchase, in a Monday regulatory filing, follows the near-funding last year of a previous ¥11 billion acquisition, ¥10.5 billion of which has already been incurred. Remixpoint said the timing of the new acquisition will be determined by market conditions, though no price or date has been provided. The market value of crypto assets held will be marked to market quarterly and the resultant gains/losses will be realized in the income statement,” the company added. Market Favours Positively Remixpoint shares rose 5.26%, closing at 580 yen on the Tokyo Stock Exchange, following the announcement. The positive market response reflects investors’ confidence in the company’s ongoing transition towards digital assets. A Segment of New Trend in Japan Remixpoint, listed in 2006 after its incorporation in 2004, started out in software before expanding to the energy and auto sectors. Recently, it expanded its foray into cryptocurrencies as part of a small but growing group of Japanese firms adding Bitcoin to their capital strategy. In 2023, another move by Metaplanet, holding in excess of 1,100 BTC valued at over $125 million today, served to reinforce the trend among Japanese firms towards utilizing crypto as a defense mechanism against financial instability. With Remixpoint contributing to its Bitcoin holdings, it solidifies the broader trend among Japanese firms to include digital assets in long-term planning strategies.",btcpulse,https://btc-pulse.com/remixpoint-to-acquire-7m-bitcoin-boosting-crypto/,"ASIA|BTC|BUSINESS|EXCHANGE|MARKET","Bitcoin",cryptocompare
2025-05-26T17:00:46.000Z,"Trump Media Seeks to Raise $3B for Crypto Purchase: FT","Trump Media and Technology Group (DJT), the company that operates the social media site Truth Social, is planning to raise $3 billion to buy crypto assets, the Financial Times reported on Monday. The capital raise, which is said to combine an equity raise and convertible bond offering, could be announced at this week's Bitcoin 2025 event held in Las Vegas, according to the report. The news comes as a growing roster of public firms are adding cryptocurrencies, predominantly bitcoin BTC, to their balance sheets, taking a page from Michael Saylor-helmed Strategy's (MSTR) increasingly popular playbook. The software firm has become the world's largest corporate holder of the leading crypto asset, accumulating over $62 billion in BTC in its treasury by financing the purchases via a combination of equity and debt issuances. Trump Media shared plans earlier this year to launch a financial services platform focusing on crypto and customized exchange-traded funds. It also said it wants to partner with crypto exchange Crypto.com to launch the ETF products. Read more: Strategy Buys 4,020 Bitcoin for $427M, Brings Total Stash to Over 580,000 BTC",coindesk,https://www.coindesk.com/business/2025/05/26/trump-media-seeks-to-raise-3b-for-crypto-purchase-ft,"BTC|EXCHANGE|REGULATION|TECHNOLOGY","Finance|Donald Trump|MicroStrategy|News",cryptocompare
2025-05-26T17:00:16.000Z,"Massive US Spot BTC ETF Inflows Hit $2.75B, Signaling Strong Demand","BitcoinWorld Massive US Spot BTC ETF Inflows Hit $2.75B, Signaling Strong Demand Are you tracking the latest moves in the crypto market? If so, you won’t want to miss this. US spot BTC ETFs just had a week that turned heads, attracting a substantial $2.75 billion in combined net inflows. This isn’t just a casual uptick; according to data compiled by SoSoValue, this figure marks the third-largest weekly inflow recorded since these investment vehicles launched. It’s a clear indicator of robust interest, particularly from institutional players looking for regulated exposure to the leading digital asset. What’s Behind the Surge in Bitcoin ETF Inflows ? The $2.75 billion figure for US spot BTC ETFs is significant for several reasons. Firstly, its sheer size demonstrates a high level of capital allocation into the Bitcoin space through these regulated products. This level of inflow suggests sustained demand, potentially driven by: Increasing Institutional Confidence: Traditional finance institutions, wealth managers, and hedge funds are becoming more comfortable allocating capital to Bitcoin via familiar ETF structures. Macroeconomic Factors: Uncertainties in traditional markets, inflation concerns, and the search for uncorrelated assets can drive interest in Bitcoin. Market Momentum: Positive price action often attracts further investment, creating a virtuous cycle of inflows and price appreciation. Ease of Access: Spot Bitcoin ETFs offer a simple and regulated way for a broad range of investors to gain exposure to BTC price movements without directly holding the cryptocurrency. This inflow volume, ranking as the third-largest weekly total, underscores the growing maturity and acceptance of Bitcoin as an investable asset class within the traditional financial system. It highlights that the initial wave of post-launch excitement hasn’t entirely subsided and that significant capital continues to flow into these products during favorable market conditions. A Look at Ethereum ETF Inflows While Bitcoin dominates the headlines, other digital assets are also seeing interest through similar regulated products. During the same period, US spot Ethereum (ETH) ETFs also recorded positive net inflows, totaling $248.31 million. Although this figure is considerably smaller than the Bitcoin ETF inflows, it is noteworthy, especially considering the relative market cap difference between ETH and BTC and the newer status of spot ETH ETFs compared to their BTC counterparts. The positive inflows into Ethereum ETF inflows suggest: Diversification within Crypto: Investors are not solely focused on Bitcoin but are also exploring other major cryptocurrencies like Ethereum through regulated channels. Growing Interest in the Ethereum Ecosystem: Ethereum’s role in decentralized finance (DeFi), NFTs, and smart contracts makes it an attractive asset for those betting on the broader Web3 ecosystem. Anticipation of Future Developments: Positive sentiment surrounding potential future upgrades or increased utility for the Ethereum network could be driving investment. Comparing the two, the scale of Bitcoin ETF inflows clearly dwarfs that of Ethereum ETFs for the week. This reflects Bitcoin’s status as the primary gateway asset for institutional crypto investment and its longer history and larger market presence. However, the positive inflows for ETH ETFs indicate a broadening appetite for regulated crypto exposure beyond just Bitcoin. Decoding the Latest Crypto ETF Trends Observing the consistent, and at times massive, inflows into US spot BTC ETFs and the emerging inflows into ETH ETFs provides valuable insights into current market dynamics. These flows are often seen as a proxy for institutional and traditional investor sentiment towards the crypto asset class. Key trends highlighted by this data include: Institutional Accumulation: The significant volumes suggest that institutional players are actively accumulating Bitcoin and, to a lesser extent, Ethereum through these accessible products. This is a stark contrast to earlier cycles where retail investors primarily drove price action. Market Liquidity and Depth: ETF inflows contribute to increased liquidity and depth in the underlying spot markets as issuers purchase BTC and ETH to back the ETF shares. Validation of the Asset Class: The willingness of large investment firms and their clients to invest through regulated ETFs provides further validation for Bitcoin and Ethereum as legitimate asset classes. Impact on Price Discovery: While not the sole driver, consistent large inflows can exert upward pressure on prices due to the constant buying demand created by ETF issuers. What Does This Mean for Institutional Crypto Investment ? The sustained interest, exemplified by the $2.75 billion week for US spot BTC ETFs , solidifies the narrative that institutional crypto investment is not a fleeting trend but a growing component of modern portfolio allocation. These ETFs act as a bridge, allowing institutions bound by mandates or regulatory hurdles that prevent direct crypto holdings to gain exposure. The implications for institutional crypto investment are profound: Increased Market Stability: As more institutional capital enters the market, it can potentially lead to greater stability compared to purely retail-driven cycles. Further Product Development: The success of BTC and ETH ETFs may pave the way for similar products tracking other digital assets, expanding the regulated investment landscape. Enhanced Regulatory Clarity: The operation of these ETFs requires significant regulatory oversight, potentially leading to clearer guidelines for the broader crypto market over time. While the picture is overwhelmingly positive regarding inflows, it’s important to remember that markets are dynamic. Outflows can occur due to profit-taking, changes in sentiment, or broader economic shifts. However, the current trend suggests a strong underlying demand from sophisticated investors. Challenges and the Road Ahead Despite the impressive inflows, the market for US spot BTC ETFs and ETH ETFs is not without its challenges. Volatility remains a characteristic of the crypto market, meaning the value of these ETFs can fluctuate significantly. Regulatory landscapes can also shift, potentially impacting the products or the underlying assets. Competition among ETF providers is also high, leading to fee pressures. Looking ahead, the sustainability of these inflow levels will depend on various factors, including global economic conditions, further regulatory developments, and the continued performance of Bitcoin and Ethereum. However, the strong start and significant capital attracted so far paint a bullish picture for the integration of crypto assets into traditional investment portfolios. Summary: A Watershed Moment for Crypto ETFs The past week’s performance of US spot BTC ETFs , pulling in $2.75 billion and marking the third-largest weekly inflow ever, is a powerful testament to the growing acceptance and demand for Bitcoin among traditional investors. Coupled with positive inflows into US spot Ethereum ETFs, these figures highlight robust Crypto ETF trends and underscore the increasing importance of Institutional crypto investment in shaping the market. While challenges remain, the trajectory suggests a continued path towards mainstream adoption through regulated investment vehicles. To learn more about the latest Crypto ETF trends, explore our article on key developments shaping Institutional crypto investment. This post Massive US Spot BTC ETF Inflows Hit $2.75B, Signaling Strong Demand first appeared on BitcoinWorld and is written by Editorial Team",bitcoinworld,https://bitcoinworld.co.in/us-spot-btc-etf-inflows/,"BTC|BUSINESS|ETH|MARKET|TRADING","Crypto News|BITCOIN|Crypto Market|ETFs|ETHEREUM|Institutional Investment",cryptocompare
2025-05-26T16:59:03.000Z,"Is Trump Poised to Raise $3B to Buy Up Cryptocurrencies?","Trump Media & Technology Group ($DJT) or TMTG as it is also known, is looking to raise $3 billion to buy cryptocurrencies including Bitcoin. Invest...",tipranks,https://www.tipranks.com/news/is-trump-poised-to-raise-3b-to-buy-up-cryptocurrencies?utm_source=cryptocompare.com&utm_medium=referral,"BTC|TECHNOLOGY","Market News|DJT",cryptocompare
2025-05-26T16:55:35.000Z,"Public Companies Could Hoard As Much as $259,395,600,000 in Bitcoin by End of 2026, According to Bitwise","Crypto asset manager Bitwise says publicly traded companies are increasingly investing in Bitcoin ( BTC ) as the flagship cryptocurrency transitions from a speculative investment to a more strategic corporate asset. In a new report, Bitwise says c orporate Bitcoin holders grew their collective holdings from 394,131 to 786,857 BTC over a six-month period from November 15th, 2024 to May 15th, 2025. The increase amounts to 392,726 BTC, which is equivalent to 196,363 BTC acquired per quarter. Using the data, Bitwise projected the amount of Bitcoin that public companies will likely accumulate over the next six quarters through the end of 2026. The model suggests that corporate investors will likely buy 98,181 BTC per quarter if Bitcoin adoption slows by half. Companies will purchase 196,363 BTC per quarter if the pace remains the same and 392,726 BTC per quarter if the adoption rate doubles, as per the model. In the bull case scenario, public companies can hoard as much as 2.356 million BTC, which represents 11.22% of the total Bitcoin supply, or $259.395 billion based on Bitcoin’s current price of $110,100. The anticipated inflows in the bear and base case scenarios are 589,000 BTC and 1.178 million BTC, respectively. Say Bitwise analysts, “Collectively, these developments signal a new era of Bitcoin adoption in which public companies not only hold Bitcoin but design business models around it. Pioneered by Michael Saylor, the ‘Bitcoin Standard’ corporate playbook of reorienting excess cash into Bitcoin purchases and using a company’s capital structure to fund additional Bitcoin acquisition is becoming a repeatable model. As more companies adopt the Bitcoin Standard, it reinforces Bitcoin’s role as a corporate treasury asset and educates equity investors on its utility – driving broader institutional acceptance.” Follow us on X , Facebook and Telegram Don't Miss a Beat – Subscribe to get email alerts delivered directly to your inbox Check Price Action Surf The Daily Hodl Mix Disclaimer: Opinions expressed at The Daily Hodl are not investment advice. Investors should do their due diligence before making any high-risk investments in Bitcoin, cryptocurrency or digital assets. Please be advised that your transfers and trades are at your own risk, and any losses you may incur are your responsibility. The Daily Hodl does not recommend the buying or selling of any cryptocurrencies or digital assets, nor is The Daily Hodl an investment advisor. Please note that The Daily Hodl participates in affiliate marketing. Generated Image: Midjourney The post Public Companies Could Hoard As Much as $259,395,600,000 in Bitcoin by End of 2026, According to Bitwise appeared first on The Daily Hodl .",dailyhodl,https://dailyhodl.com/2025/05/26/public-companies-could-hoard-as-much-as-259395600000-in-bitcoin-by-end-of-2026-according-to-bitwise/,"BTC|BUSINESS|REGULATION|TRADING","Bitcoin|bitwise|BTC|News",cryptocompare
2025-05-26T16:53:46.000Z,"CZ’s YZi Labs Ignites Avalon, Bitcoin DeFi’s $500M Ecosystem","In a bold bet on Bitcoin’s DeFi future, Changpeng Zhao (CZ)-backed YZi Labs— formerly Binance Labs —has made an undisclosed investment in Avalon Labs, a fast-rising platform building on-chain capital markets powered by BTC. In an X post on May 26, the firm said the project is building financial infrastructure around BTC-collateralized lending, stablecoin USDa, savings products, and credit services, showing there is interest in Bitcoin-powered DeFi. https://twitter.com/yzilabs/status/1927000818680541674?s=61 USDa: Powering a Bitcoin-Backed Financial Ecosystem At the core of Avalon’s ecosystem is USDa, a Bitcoin-backed stablecoin that allows users to borrow, earn yield, and transact without selling their BTC. The firm has over $500 million in total value locked (TVL). USDa is the second-largest collateralized debt position (CDP) project tracked by DeFiLlama. The platform goes beyond stablecoins to include BTC-backed lending, yield-bearing savings accounts, and a Bitcoin-collateralized credit card, managing more than 20,000 BTC. Scaling Toward Regulation and Institutional Growth Avalon’s journey began in Season 8 of the Most Valuable Builder (MVB) accelerator—run in partnership with BNB Chain, CoinMarketCap, and YZi Labs. In a blog post, the firm explains that with this new capital injection, Avalon is preparing to scale globally, targeting regulatory licenses across key markets and working with elite law firms to launch a fully regulated public fund. At the same time, the company said it is ramping up its institutional lending business, seeking to become the world’s first fully regulated on-chain Bitcoin financial institution. “Avalon leverages Bitcoin’s security and liquidity to create a full-stack financial ecosystem,” said Alex Odagiu, Investment Director at YZi Labs. “It bridges the gap between Bitcoin’s vast potential and real-world usability.” “We’re building the premier financial hub for Bitcoin,” added Venus Li, Co-Founder of Avalon Labs. “With YZi Labs’ support, we’ll bring Bitcoin-backed products to everyday users and unlock yield for a global audience.” Binance Labs Rebrands to YZi Labs With CZ Engaging More In December, Binance Labs announced plans to rebrand in 2025. Changpeng Zhao (CZ) will lead and personally engage with investment projects. CZ served four months in prison for violating the U.S. Bank Secrecy Act and other regulatory issues. Binance Labs broke away from the exchange Binance and became an independent entity in 2024. The rebranding reflects its evolving vision and distances itself from the exchange. The investment arm said Binance founder CZ will dedicate more time to investing and directly engaging with projects. CZ is permanently banned from being involved in Binance leadership but is allowed to focus on investments. The post CZ’s YZi Labs Ignites Avalon, Bitcoin DeFi’s $500M Ecosystem appeared first on Cryptonews .",cryptonews,https://cryptonews.com/news/cz-yzi-labs-avalan-bitcoin-defi-investment/,"BTC|EXCHANGE|MARKET|BNB|TOKEN LISTING AND DELISTING","Blockchain News|News|Avalon|Binance Labs|YZi Labs",cryptocompare
