datetime,headline,summary,source,url,categories,tags,api_source
2025-05-26T13:59:11.000Z,"10 red flags that scream ‘fake airdrop,’ and how to avoid them","Key takeawaysIn 2024 and 2025, fake airdrop scams targeting Hamster Kombat, Wall Street Pepe and others led to millions in user losses, contributing to over $9.9 billion in global crypto scam damages.Fake airdrops impersonate legitimate projects, tricking users into revealing private keys, signing malicious contracts or paying upfront fees that lead to irreversible crypto theft.Warning signs include no official announcement, suspicious URLs, requests for private keys, grammar errors and unrealistic reward promises.Future airdrops are shifting toward activity-based, retroactive and AI-monitored models that reward genuine user engagement while reducing exploitation.While cryptocurrency airdrops are a legitimate way for projects to gain publicity and users, scammers exploit this hype, draining wallets through fake campaigns. In 2024 and 2025, fake airdrop scams around projects like Hamster Kombat and Wall Street Peepe cost victims millions. According to Chainalysis, the global estimated losses in 2024 from cryptocurrency scams and fraud, which included fake airdrops, amounted to at least $9.9 billion. Spotting red flags is crucial to staying safe from fake airdrops. This article explores key warning signs and practical tips to protect your funds. What are fake airdrops?Airdrops are a common practice of distributing free tokens in the crypto world as part of marketing campaigns, user acquisition efforts, or community-building exercises. Legitimate airdrops reward early takers, increase token visibility, or promote network activity. Getting airdrops requires minimal effort, like signing up, joining a community or holding a specific token.However, the popularity of airdrops has also drawn scammers. They exploit user greed and curiosity by promising free tokens (fake airdrops) in exchange for sensitive actions such as sharing private keys, signing malicious contracts or paying gas fees. Fraudsters may impersonate real projects using spoofed domains or fake social media accounts.These scams often look convincing, and even experienced users can fall victim. This is the reason consistent vigilance is required when you are getting airdrops. Did you know? In 2023, Inferno Drainer helped scammers steal over $80 million through airdrop phishing campaigns. Operating as a “drainer-as-a-service,” it lets affiliates use prebuilt kits to run scam airdrop sites, targeting wallets across several blockchains.Key red flags that expose ‘fake airdrops’Before you connect for an airdrop, learn to spot the warning signs. These red flags are your first line of defense against losing your crypto or sensitive information to scammers:1. No official announcement from verified channelsWhat to watch for: A major warning sign of a fake airdrop is the lack of any announcement on the project’s official communication channels. Scammers often use unsolicited direct messages, unofficial Telegram groups or poorly crafted websites mimicking legitimate ones to promote fake airdrops.How to avoid: Always verify the legitimacy of an airdrop by checking the project’s official website, verified X account or official Discord/Telegram channels before clicking any links. If the airdrop isn’t mentioned there, keep away from it.2. Request for private key or seed phraseWhat to watch for: A critical red flag of a fake airdrop is a request to “verify” your wallet by providing your private key or seed phrase. These scams deceive users into surrendering complete control of their crypto wallets by posing as eligibility checks. Once shared, scammers can immediately steal all assets.How to avoid: Genuine airdrops never ask for your private key or recovery phrase, which should always remain confidential. If anyone or any website requests these, it is a clear scam. Exit the page immediately.3. Upfront gas fees or crypto paymentsWhat to watch for: A significant warning sign of a fake airdrop is that it requires upfront gas fees or cryptocurrency payments to “unlock” tokens. Scammers often insist you send Ether (ETH) or other coins to claim rewards, but after the payment, the promised tokens never materialize, and your funds are lost.How to avoid: Legitimate airdrops are free, typically involving only simple tasks like connecting a wallet or completing minor actions. If an airdrop demands any payment, it is likely to be a scam. Never send funds to unfamiliar addresses.4. Suspicious URLs or clone sitesWhat to watch for: Fake airdrops frequently employ phishing websites resembling legitimate crypto platforms. These sites aim to deceive users into connecting wallets and signing fraudulent transactions.How to avoid: You need to carefully check a project’s URL before executing any transaction on it. There will likely be subtle differences, such as misspellings, extra characters or alternate domain extensions.Did you know? Some airdrops use retroactive criteria, rewarding users based on past activity. This encourages organic participation before the airdrop announcement, so simply using DApps naturally could make you eligible for future free tokens.5. Poor grammar and urgent languageWhat to watch for: Many fake airdrops feature poor grammar, spelling errors or aggressive phrases like “Claim Now Or Lose Out!” or “Final Chance For Free Tokens!” These tactics aim to create panic, rushing users into clicking malicious links without careful thought. Sloppy writing and intense urgency are clear signs of a scam.How to avoid: Legitimate crypto projects communicate professionally and clearly. If an airdrop announcement contains errors or uses high-pressure, time-sensitive language, steer clear. 6. Fake social proof or bot commentsWhat to watch for: Scammers frequently use fake airdrop posts filled with fabricated social proof, such as comments like “I just got 500 $XYZ!” or “Totally legit!” These are often posted by bots or fake accounts to create a false sense of trust and encourage participation. They might also use fake or hacked celebrity accounts to disseminate false information regarding airdrops.How to avoid: Avoid trusting social media comments alone to determine an airdrop’s legitimacy. Research the token thoroughly, confirm its presence on reputable platforms, and seek authentic user feedback on forums like Reddit or trusted crypto Discord groups. Genuine projects maintain transparent communities, not just artificial hype.7. Unknown or nonexistent token projectsWhat to watch for: Certain fake airdrops promote tokens tied to obscure or nonexistent projects, which might lack a white paper, roadmap, official website or verifiable team. Scammers use these fabricated tokens to trick users into connecting wallets or approving transactions that result in stolen funds.How to avoid: Always research a token extensively before participating in an airdrop. Check for a white paper, official website, team credentials and active community presence. If the project lacks basic details or appears suspiciously new with no credible background, it is likely fraudulent.8. Token approval trapsWhat to watch for: Certain fake airdrops entice users to connect their wallets and grant token spending permissions. These seemingly harmless “approval” requests can allow scammers to freely transfer or drain your tokens without further interaction, exploiting the granted permissions.How to avoid: Exercise caution when approving token transactions, particularly from unfamiliar sources. Avoid authorizing smart contract interactions on untrusted websites. Regularly use tools like revoke cash to check and cancel unnecessary token approvals.9. Redirects to malicious wallet drainersWhat to watch for: Some fake airdrop links redirect users to malicious DApps known as wallet drainers. These sites are designed to resemble legitimate claim pages but execute malicious smart contracts once a wallet is connected. By clicking “claim airdrop,” users unknowingly sign transactions that give scammers full access to their funds.How to avoid: Always review transaction pop-ups carefully before signing. Use browser wallets like MetaMask with built-in phishing protection and stay updated on known scam domains. If a site looks unfamiliar or triggers unexpected approvals, disconnect immediately. 10. Unrealistic reward promisesWhat to watch for: Fake airdrops often attract users with unrealistic promises, such as “Instantly claim $2,000 in free tokens!” with no effort required. These offers exploit greed and curiosity, luring users into connecting wallets or signing transactions without proper scrutiny.How to avoid: Be suspicious of extravagant claims. Genuine airdrops usually provide modest rewards and have certain eligibility criteria. If an offer appears too good to be true, it is likely to be fraudulent.Did you know? In 2021, the Ethereum Name Service (ENS) gave governance tokens via an airdrop to anyone who had registered a .eth name. Many ENS holders received thousands of dollars just for owning a crypto domain name.Examples of fake airdropsHere are some examples of well-known fake airdrops to help you understand how these fraudulent actions scam unsuspecting victims:Hamster KombatHamster Kombat is a Telegram-based tap-to-earn game where players manage a virtual crypto exchange as a hamster CEO. By tapping, completing daily tasks and upgrading, players earn HMSTR coins, which are convertible to tradable tokens. Launched in March 2024, it attracted over 250 million users, but scams targeting players have raised concerns.Malicious actors targeted Hamster Kombat to profit from the tap-to-earn game’s viral popularity. Kaspersky warned users about fake Hamster Kombat airdrops, meant to steal victims’ crypto wallet credentials.Wall Street PepeWall Street Pepe ($WEPE) is an Ethereum-based memecoin that combines meme culture with practical trading utilities. Inspired by the Pepe meme and Wall Street trading, $WEPE provides small traders with unique market insights, strategic analysis and a supportive community.The $WEPE airdrop scam mimicked the legitimate token's website. It lured users with promises of an airdrop and prompted them to connect their digital wallets, inadvertently signing malicious contracts that drained their assets.HEXHEX is a token built on Ethereum to help users capitalize on cryptocurrency market growth through a system that supports coin locking and staking for fixed durations. The fraudulent webpage replicated the official HEX site. The airdrop on this counterfeit site was fake and unrelated to the genuine HEX project or other initiatives. When a crypto wallet was linked to the deceptive site, it activated a malicious contract that enabled the cryptocurrency drainer to steal funds.SuiSui (SUI) is a layer-1 blockchain and smart-contract platform engineered for speed, privacy and accessibility, featuring a distinctive object-centric data model.When users checked airdrop eligibility on the fraudulent webpage posted by the scammers, they were prompted to link their digital wallets. This action unwittingly signed a malicious contract, enabling the cryptocurrency drainer. Consequently, their funds were automatically transferred to wallets controlled by scammers through seamless, unauthorized transactions.LayerZeroThe LayerZero airdrop implemented a novel \""proof-of-donation\"" claiming system. Instead of distributing $ZRO tokens for free, as typical airdrops do, LayerZero required users to donate $0.10 per token to the Protocol Guild, which supports Ethereum’s core developers.In July 2023, security firm CertiK cautioned users to be careful about fake airdrops being promoted on X by accounts impersonating Layer Zero. When users clicked on the links, they were sent to a website that resembled the official LayerZero website.How crypto airdrops are evolving from freebies to secure community rewardsCrypto airdrops are advancing beyond basic token giveaways, adopting more advanced and secure approaches to engage users. Projects increasingly implement activity-based airdrops, rewarding users for contributions like staking, testing apps or engaging in governance. This shift seeks to promote authentic community involvement and prevent exploitative tactics. Novel distribution models such as snapshot-based allocations and retroactive rewards are gaining traction. These approaches enhance transparency and ensure tokens reach active community contributors. Integrating artificial intelligence and machine learning improves fraud detection and strengthens airdrop security by helping detect bots, fake wallets and fraudulent behavior, making airdrops more secure and resistant to exploitation.This transformation reflects the evolution of responsible, effective token distribution practices that align with decentralization and community empowerment goals.This article does not contain investment advice or recommendations. Every investment and trading move involves risk, and readers should conduct their own research when making a decision.",Cointelegraph,https://cointelegraph.com/news/fake-airdrops-and-how-to-avoid-them?utm_source=rss_feed&utm_medium=rss&utm_campaign=rss_partner_inbound,"","",finnhub
2025-05-26T13:37:10.000Z,"Bitcoin’s new highs may have been driven by Japan bond market crisis","Bitcoin’s recent all-time high may be linked to ongoing issues in the Japanese bond market in a development that may signal BTC’s growing recognition as a hedge against instability in the traditional financial (TradFi) system.Bitcoin’s (BTC) price rose to a new all-time high of $112,000 on May 22, before retracing to change hands above $109,700 at the time of writing on May 26, Cointelegraph data shows.While some attributed the rally to geopolitical developments, including U.S. President Donald Trump’s announcement of Russia–Ukraine ceasefire talks on May 19, macroeconomic factors appear to be playing a larger role, according to market analysts.BTC/USD, 1-year chart. Source: CointelegraphJapan bonds hit yield recordBitwise’s head of European research, André Dragosch, pointed to growing concerns around Japan’s sovereign credit outlook, highlighting a spike in the country’s long-term bond yields.Japan 30-year LSEG government bonds yield. Source: Cointelegraph/TradingViewThe 30-year yield on Japanese bonds reached a new all-time high of 3.185% on May 20, 2025, before retreating to 3.115% on May 23, TradingView data shows.Related: $1M Bitcoin by 2030: Big names predict massive debt-driven BTC rallyGovernment bonds are typically considered safe-haven assets. But when yields rise sharply, it often signals investor concerns about fiscal sustainability and repayment risk. Japan’s debt-to-GDP ratio exceeds 250%, compared to Germany’s 62%, yet both countries had 30-year bond yields near 3.1% on May 21, noted The Kobeissi Letter.“Because yields are increasing, sustainability becomes more of an issue, meaning credit risk increases, meaning yields increase even more,” Dragosch said. “And so you end up in this kind of fiscal debt doom loop.”Dragosch said the growing volatility in Japan’s bond market could be prompting some institutional investors to reconsider Bitcoin’s role as a hedge against sovereign default risk.“This is now affecting other bond markets, especially the US Treasury market,” Dragosch added.Source: The Kobeissi LetterRelated: Crypto, NFTs are a lifeboat in the sinking fiat system: Finance RedefinedSovereign risk drives crypto appealJapan’s bond market instability raises sovereign credit risk concerns, leading to more Bitcoin adoption among TradFi participants, Dragosch told Cointelegraph, adding:“Bitcoin is an immutable asset. It’s free of counterparty risk. It’s a hedge against sovereign risk and sovereign default.”“Perceived default risk continues rising, yields continue rising? This is a rough benchmark of why Bitcoin could be heading toward $200,000,” Dragosch said, adding that this remains conditional on the continued Bitcoin accumulation from corporations and exchange-traded fund (ETF) holders.Bitcoin ETF inflows, monthly, all-time chart. Source: SosovalueMeanwhile, the US spot Bitcoin ETFs are less than $1.3 billion away from surpassing the monthly inflow record of $6.49 billion from November 2024, Cointelegraph reported on May 23.Magazine: Arthur Hayes $1M Bitcoin tip, altcoins ‘powerful rally’ looms: Hodler’s Digest, May 11 – 17",Cointelegraph,https://cointelegraph.com/news/bitcoin-all-time-high-by-japanese-bond-market-crisis?utm_source=rss_feed&utm_medium=rss&utm_campaign=rss_partner_inbound,"","",finnhub
2025-05-26T13:12:20.000Z,"How to read Bitcoin candlestick charts (no experience needed)","Key takeawaysBitcoin candlesticks are a popular tool among Bitcoin traders because they’re simple to use and offer an intuitive way to understand market sentiment and trends.Bitcoin candlesticks are a rather old tool. Rice trader Honma Munehisa invented them in Japan as far back as the 18th century. They were introduced to Western financial markets in the late 1980s.They help you understand bullish and bearish patterns in technical analysis. This knowledge will get you started with Bitcoin trading.They should not be your only tool for making informed decisions. Combine them with other Bitcoin technical indicators, such as MAs (moving averages) or the RSI (relative strength index). If you’re new to Bitcoin (BTC) trading, you may wonder when to buy or sell. Candlestick charts, like bar or line graphs, have time on the horizontal axis, while the price data appears on the vertical axis. They provide a quick look at price movements when compared to other charts. You can quickly view the highest and lowest prices of an asset in a specific timeframe. It also shows the opening and closing prices. Here are a few Bitcoin trading tips to help you get started. No experience needed; this is your go-to crypto candlestick chart tutorial, perfectly suited for beginners.Why analyze Bitcoin price chartsTechnical analysis is an essential and consolidated strategy for trading markets. When Bitcoin (BTC) started picking up and prices fluctuated more, crypto investors began to use trading strategies from traditional markets, such as candlesticks. For Bitcoin technical analysis basics, platforms like TradingView offer many charts and technical indicators. These tools are easy to use, even for beginners. TradingView crypto charts can be candlestick, bar or line charts. Here’s an overview of candlestick charts to help you get started with Bitcoin trading.Beginner’s guide to Bitcoin candlestick chartsCandlestick charts are a milestone in technical analysis and the first step to understanding Bitcoin charts. They are an essential tool to quickly assess price movements and market trends in the short term. They represent Bitcoin’s price trends on a chart over a specific period, such as one hour, four hours or one day, to help traders make better decisions.Why use candlesticks? They help traders visualize price movements over time.They help identify bullish, bearish or consolidation sentiment.They help spot patterns like reversals or continuations to predict future price movements.A candlestick represents four key price points:The opening price at the start of the periodThe closing price at the end of the periodThe highest price reached during the periodThe lowest price reached during the period.A candlestick is formed of a body, the bulky part between the open and close prices. It is green when the price goes up in a bullish move, and the closing price is higher than the opening price. It is red when the closing price is lower than the opening price, so the price is in a bearish movement as it goes down.The body size shows strong buying and selling pressure when it’s long. It indicates uncertainty when it’s short. A candlestick also has wicks, or shadows. They are thin lines above and below the body that indicate the highest or lowest prices the asset hit during the relevant trading frame.Here’s a useful example that may help you understand it better. Suppose you’re analyzing the four-hour chart using candlesticks, and Bitcoin’s opening price is $90,000. The closing price is $93,500, with a high of $95,000 and a low of $88,700. In this instance, the candlestick will appear as a green body from $90,000 to $93,500. An upper wick hitting $95,000 and a lower wick dipping to $88,700.Advantages of Bitcoin candlestick chart Bitcoin candlestick charts offer several advantages, including:Candlestick charts offer you a quick view of market sentiment and price movement. They show if the market is positive or negative and how strong that feeling is. You can pick different timeframes based on your trading style, whether you’re a day trader, swing trader or long-term investor.For example, the one-minute chart works well for scalping, while the daily chart is better for long-term investors. As crypto markets are open 24 hours a day, the open and close prices reflect the start and end of the chosen timeframe.Introduction to advanced crypto charting techniques to trade BTCCandlesticks are a great way to start trading Bitcoin. They give you a quick look at market trends and help predict price movements. Once you know the basic charts and skills, you can explore advanced techniques. For example, using moving averages can help you make better investing decisions.Here are some of the best tools Bitcoin traders use to leverage technical analysis, volume and market psychology. These strategies give traders an edge in the ever-changing crypto market.1. Fibonacci retracement Fibonacci retracement is a technical analysis tool used to spot potential support and resistance levels, as well as price targets. To use this method, draw lines connecting a major high and low on the chart. Then, calculate retracement levels using Fibonacci ratios like 23.6%, 38.2%, 50% and 61.8%. You can use the Fibonacci retracement for confirmation when paired with trendlines or moving averages. 2. Volume profileVolume profile is another tool for technical analysis. It shows trading volume for price instead of time. Knowing where trading happens most helps traders spot key price levels. These levels often create strong support and resistance zones. 3. Elliot Wave TheoryThe Elliott Wave theory is a prediction model of price movements based on market psychology and wave patterns. According to the theory, the market moves in trends of five waves, followed by three waves of correction, with each wave reflecting trader sentiment.4. Other indicatorsThe relative strength index (RSI) is one of the most common charting indicators. It measures the strength of Bitcoin’s upward and downward price movements over time.The simple moving average (SMA) indicates the average price of an asset over time, which can help you understand Bitcoin’s overall price movement. The exponential moving average (EMA) is a better alternative to the SMA for identifying short-term trends. Like the SMA, the EMA shows you the average price of an asset over time, but the EMA focuses more on recent days.Caution! Reading Bitcoin candlesticks or any other charts is a great first step toward understanding market behavior, but remember charts don’t guarantee outcomes. Always combine technical insights with risk management, and never trade more than you can afford to lose.This article does not contain investment advice or recommendations. Every investment and trading move involves risk, and readers should conduct their own research when making a decision.",Cointelegraph,https://cointelegraph.com/news/how-to-read-bitcoin-candlestick-charts?utm_source=rss_feed&utm_medium=rss&utm_campaign=rss_partner_inbound,"","",finnhub
