datetime,headline,summary,source,url,categories,tags,api_source
2025-05-31T06:07:21,"Crypto Markets Shed $200B in 48 Hours as Bitcoin Dumps to 12-Day Low (Weekend Watch)","Perhaps driven by the latest escalation of tensions between the US and China, bitcoin’s price has tumbled over the past 12 hours to a multi-week low of $103,000. The altcoins have it even worse, with massive price drops from the likes of SUI, LINK, DOGE, SOL, ADA, and more. CRO has defied the market-wide trend with a double-digit price surge. BTC Dumps to $103K Ever since it skyrocketed to almost $112,000 last Thursday to chart a new all-time high, bitcoin’s price has been unable to recapture or even sustain its momentum. It started to fall on the next day when US President Trump recommended a new set of tariffs against the EU. Although he delayed their implementation for over a month, BTC failed to bounce off decisively and was stopped at around $110,000 on a couple of occasions. The latest rejection, which came on Thursday at $109,000, was the worst one (for now) as it drove BTC down to $105,000. It recovered some ground to $106,000 yesterday, but the bears reemerged and pushed the cryptocurrency south to a 12-day low of just over $103,000. This decline transpired after Trump said China “violated” the trade agreement between the two, while Beijing responded kindly. Although BTC has regained some ground and now sits above $103,500, its market cap has slid to $2.06 trillion on CG, while its dominance over the alts has shot up to 61.3%. BTCUSD. Source: TradingView Alts Bleed Out, Not CRO The alternative coins have marked some big losses over the past day. Ethereum is close to breaking below $2,500 after a 4.5% drop. XRP has plunged beneath $2.15, while DOGE, SOL, ADA, SUI, LINK, and AVAX have plummeted by up to 9%. The situation with the lower-cap alts is even more painful, as many, such as ENA, INJ, VIRTUAL, and PEPE, have charted double-digit price declines. CRO is the only exception, having gained 17% in the past day and trading close to $0.11. The total crypto market cap has seen roughly $200 billion gone in the past two days and is down to $3.360 trillion. Cryptocurrency Market Overview. Source: QuantifyCrypto The post Crypto Markets Shed $200B in 48 Hours as Bitcoin Dumps to 12-Day Low (Weekend Watch) appeared first on CryptoPotato .",cryptopotato,https://cryptopotato.com/crypto-markets-shed-200b-in-48-hours-as-bitcoin-dumps-to-12-day-low-weekend-watch/,"ADA|BTC|MARKET|TRADING|CRO","BTCEUR|BTCGBP|BTCUSD|BTCUSDT|Crypto News|featured1|Market Updates",cryptocompare
2025-05-31T06:05:24,"Bitcoin Reserve Levels Hit New Low as Whales Shift to Non-Custodial Storage","The latest report from Cointelegraph highlights a significant trend in the cryptocurrency market as of May 31st. The reserve level of Bitcoin exchanges has reached a historically low point. This",coinotag,https://en.coinotag.com/breakingnews/bitcoin-reserve-levels-hit-new-low-as-whales-shift-to-non-custodial-storage/,"BTC|FIAT|MARKET","BTC",cryptocompare
2025-05-31T06:00:04,"Bitcoin Difficulty Set for Another Jump—How High This Time?","On-chain data shows the Bitcoin network Difficulty is set to go up in the next adjustment and is estimated to reach a new all-time high (ATH). Bitcoin Difficulty Will Go Up Again In The Upcoming Adjustment The “ Difficulty ” refers to a feature present on the Bitcoin blockchain that dictates how hard the miners currently find their task of mining blocks on the network. The feature exists to ensure just one thing: that the rate at which miners add blocks to the chain remains constant. Whenever miners solve a block, they receive a block subsidy as compensation, so by locking the speed of these chain validators, the Difficulty makes it so that they get this reward at a consistent pace as well. The reason Satoshi programmed the Difficulty into the blockchain lies in the nature of the block subsidy itself. The coins miners earn from it are freshly minted, meaning that every time they solve a block, the total supply of the cryptocurrency goes up. If miners could indefinitely speed themselves up by simply adding more computing power, the asset’s supply would be flooded with tokens. But thanks to the existence of the Difficulty, this runaway inflation is an impossible scenario. That said, miners can deviate from their usual pace for short periods, as the Difficulty doesn’t show an immediate change. More specifically, there is a window of about two weeks between each network adjustment. The adjustments are fully automatic, with the Difficulty being changed exactly enough in them to bring the miners back to the standard pace of a block every 10 minutes. The next adjustment is set to occur later today at midnight, UTC. Below are the details related to this event from CoinWarz . As is visible, the Bitcoin miners have taken an average of 9.58 minutes per block during the last couple of weeks, suggesting that they have been faster than the network wants. The BTC blockchain will now respond with an increase in Difficulty, which is currently estimated to be of about 4.35%. The last adjustment also led to an increase in the indicator, although it was a notably smaller one. This new jump would take the metric to around 126.95 terahashes, which is a new record. The ATH in the Difficulty is arriving as the 7-day average of the Bitcoin Hashrate , a measure of the total computing power employed by the miners, has been inching toward a new high as well, as data from Blockchain.com displays. BTC Price At the time of writing, Bitcoin is floating around the $105,800 level, down more than 2% over the last seven days.",bitcoinist,https://bitcoinist.com/bitcoin-difficulty-set-another-jump-how-high-time/,"AAVE|ADA|ALTCOIN|ASIA|ATOM|AVAX|AXS|BCH|BLOCKCHAIN|BTC|BUSINESS|COMMODITY|DOGE|DOT|ETC|ETH|EXCHANGE|FIAT|FIL|LINK|LTC|LUNA|LUNC|MANA|MARKET|MATIC|MINING|REGULATION|SHIB|SOL|SPONSORED|TECHNOLOGY|TRADING|TRX|UNI|USDT|WALLET|XLM|XMR|XRP|XTZ|ZEC|ZRX|OTHER|RESEARCH|APT|ARB|BITTENSOR|BNB|CRO|WIF|FDUSD|HBAR|ICP|IMX|INJ|LDO|MNT|NEAR|NOT|PEPE|SUI|TON|USDC|AR|FLOKI|ONDO|BGB|BONK|BRETT|RUNE|FET|PYTH|SEI|FLR|JUP|BSV|AGX|ENS|ZK|WLD|XAUT|CAKE|OM|APE|HNT|XDC|FTT|BTG|PEOPLE|MOG|PYUSD|AXL|MEME|RAY|SSV|ARKM|ETHFI|MX|AIRDROP|TOKEN SALE|FORKS|TOKEN LISTING AND DELISTING|ADMINISTRATIVE EVENTS","Bitcoin News|bitcoin|bitcoin difficulty|Bitcoin Miners|bitcoin mining|btc|BTCUSDT",cryptocompare
2025-05-31T05:30:44,"Bitcoin’s Price Sees Drop as Altcoin Traders Face Increased Pressure","Bitcoin’s recent upward trajectory has encountered resistance after reaching a record-breaking peak of over $111,000 last week. Following this new all-time high, Bitcoin has retraced approximately 4% in the past seven days, bringing its current trading price down to $105,485. This represents a daily decline of 1.8%, reflecting cautious market sentiment and potential profit-taking among traders. In light of these recent price movements, a CryptoQuant analyst has been closely observing market dynamics, particularly concerning the launch of the Bitcoin Exchange-Traded Fund (ETF). A detailed analysis provided by Joao Wedson, a contributor to CryptoQuant’s QuickTake platform, has shed new light on the liquidation trends observed in Bitcoin compared to other cryptocurrencies, also known as altcoins. Related Reading: This Chart Warns Bitcoin’s Momentum May Be Running Out, Here’s Why Liquidation Disparity Between Bitcoin and Altcoins Since the launch of the Bitcoin ETF, market behaviors have demonstrated a notable divergence between Bitcoin and altcoin liquidations. According to Wedson, Bitcoin liquidations on Binance have predominantly involved short positions, indicating traders who bet against Bitcoin were systematically liquidated during its recent price rise. Specifically, the Cumulative Liquidation Delta (CLD) showed short liquidations surpassing longs by approximately $190 million. This suggests market participants holding bearish positions were compelled to exit as Bitcoin’s value surged, pushing the price further upward. In stark contrast, altcoins have experienced a markedly different scenario. During the same period, altcoins faced nearly $1 billion more in long liquidations compared to shorts. This liquidation imbalance indicates that traders betting on a broad altcoin recovery faced substantial losses. The sustained downward pressure on altcoins reveals the failure of expectations surrounding an “Altseason,” a period when alternative cryptocurrencies typically outperform BTC. Implications of Market Asymmetry The distinct patterns in liquidations between BTC and altcoins reflect critical shifts in investor risk sentiment and leverage usage. BTC’s favorable price performance primarily impacted traders with bearish outlooks, forcing the liquidation of short positions and contributing to a bullish market perception. Conversely, the altcoin sector’s persistent price declines have led to widespread liquidation of bullish positions, highlighting the misalignment between trader expectations and actual market behavior. According to Wedson, since December 2024, this liquidation asymmetry has widened considerably, underscoring a shift in market focus. Investors have increasingly viewed BTC as a safer or more reliable bet amidst broader market uncertainty, while altcoins have suffered due to heightened leverage and speculative positioning. Related Reading: Bitcoin Surges With Low Retail Interest – Is A Second Wave Coming? This trend has intensified following the ETF’s approval, as traders appear more confident betting on Bitcoin’s stability and growth potential compared to the volatility and unpredictability of the altcoin market. Moving forward, the current market conditions suggest that investors may continue to approach Bitcoin with measured optimism while maintaining a cautious stance toward altcoins. Featured image created with DALL-E, Chart from TradingView",newsbtc,https://www.newsbtc.com/bitcoin-news/bitcoin-price-sees-drop-as-altcoin-traders-face-increased-pressure/,"ALTCOIN|BTC|BUSINESS|MARKET|TRADING","Bitcoin News|altcoin|bitcoin|bitcoin market|btc|BTCUSDT|crypto market|cryptoquant",cryptocompare
2025-05-31T05:30:31,"Bitcoin ETFs Soar as Investors Flee Gold Holdings","A strategic pivot among investors is becoming clear as capital shifts from traditional safe havens to digital alternatives. Over the past five weeks, U.S.-based bitcoin ETFs attracted more than $9 billion in inflows, predominantly led by Blackrock’s Ishares Bitcoin Trust (IBIT), while gold ETFs experienced over $2.8 billion in outflows. Analysts cite bitcoin’s rising appeal",bitcoin.com,https://news.bitcoin.com/bitcoin-etfs-soar-as-investors-flee-gold-holdings/,"BTC|BUSINESS|FIAT","News Bytes|Bitcoin (BTC)|gold|News Bytes - 2",cryptocompare
2025-05-31T05:00:55,"Solana’s Strategy moment: Can SOL replicate BTC’s institutional gains?","Is Solana the future of corporate crypto treasury management?",ambcrypto,https://ambcrypto.com/solanas-strategy-moment-can-sol-replicate-btcs-institutional-gains/,"ALTCOIN|BTC|REGULATION|SOL","Altcoin|News|News 1|Social|Solana|Trading View",cryptocompare
2025-05-31T04:34:02,"Bitcoin’s Liquidation Thresholds: What Happens If Prices Hit $102K or $105K?","According to insights from COINOTAG on May 31st, recent analytics from Coinglass highlight critical price levels for Bitcoin. If Bitcoin’s value descends below $102,000, the potential for cumulative long liquidations",coinotag,https://en.coinotag.com/breakingnews/bitcoins-liquidation-thresholds-what-happens-if-prices-hit-102k-or-105k/,"BTC|MARKET|TRADING","BTC",cryptocompare
2025-05-31T04:05:57,"Rising Demand Signals Possible Bitcoin Recovery Amid Recent Price Correction","Daily capital inflows for Bitcoin have reached an impressive $1.8 billion, showcasing strong demand even amid recent price fluctuations. Despite a drop in price to $104K, market sentiment remains bullish",coinotag,https://en.coinotag.com/rising-demand-signals-possible-bitcoin-recovery-amid-recent-price-correction/,"BTC|MARKET|TRADING","Bitcoin|News",cryptocompare
2025-05-31T04:00:20,"Bitcoin’s pullback hits Day 4 – Here’s why a stealth moonshot may be loading","Demand for Bitcoin as daily fresh capital inflow hits $1.8 billion despite higher prices.",ambcrypto,https://ambcrypto.com/bitcoins-pullback-hits-day-4-heres-why-a-stealth-moonshot-may-be-loading/,"BTC|MARKET","Bitcoin|BTC Trading View|News|News 1|Social|Trading View",cryptocompare
2025-05-31T04:00:13,"Panama Canal Could Prioritize Bitcoin-Paying Ships, Mayor Suggests","Panama City’s mayor, Mayer Mizrachi, put forward an unusual plan at the Bitcoin 2025 conference in Las Vegas on May 29. He suggested that cargo ships could speed up their transit through the Panama Canal if they paid in Bitcoin. It was a brief comment, but it set off a flurry of questions about how it might work in practice. Related Reading: Tether’s 2-Year, $5 Billion Investment Blitz Fuels US Companies: CEO Bitcoin Payments For Priority Passage According to reports from the panel, Mizrachi spoke alongside El Salvador’s Bitcoin policy leaders, Max Keiser and Stacy Herbert. He said that ships could “cut the line” by paying tolls in Bitcoin. He offered the idea as a way to reward early adopters. It was presented in a casual tone, but it touched on a serious topic: how fast payments could tie into a long-standing shipping process. Ships Could Pay Panama Canal Transit Fees in Bitcoin The mayor of Panama City, Mayer Mizrachi, said he is exploring bitcoin payment options for ships passing Panama Canals. “What if you have a perk for paying in bitcoin?” Mizrachi mused. “You’d get to go faster.” 🤣🤣🤣 pic.twitter.com/zciROaSGjM — Ray (@ray4tesla) May 30, 2025 Questions Over Fees And Fairness Based on what was discussed, the Canal’s current rule is first-come, first-served. Changing that would need approval from the Panama Canal Authority and Panama’s national government. Shipping companies might push back if they feel smaller carriers are priced out. US President Donald Trump weighed in late last year, arguing that US ships faced “unfair tolls” and hinting at reclaiming the Canal in December 2024. That episode showed how sensitive Canal changes can be. Handling A $5 Billion Business According to the Panama Canal website, the waterway brought in around $5 billion in revenue between October 2023 and September 2024. Nearly 10,000 ships passed through, carrying about 423 million tons of goods. That’s about 5% of global maritime commerce. If Bitcoin payments were allowed, the Authority would need a plan to deal with price swings. One day’s checkout could be 50 BTC, the next it might jump to 60 BTC. Panama would likely need a quick exchange system to turn BTC into dollars or other stable currencies. Related Reading: $400K Bitcoin? Analyst Says It’s Not A Dream—It’s ‘Coded’ A Push For City-Level Crypto Mizrachi has also backed letting people pay city fees—taxes, fines and permits—in Bitcoin, Ether and USDC. He raised the idea of a Bitcoin reserve for Panama City, which produces over half of the nation’s GDP. He noted he wouldn’t need more laws to start one. But real steps will depend on lawmakers and officials at the national level. For now, it remains a mayoral proposal, rather than a binding plan. Mizrachi claimed over $5 billion in Bitcoin transactions happen in Panama every year, though much of it is “behind closed doors,” he said. Featured image from Pexels, chart from TradingView",newsbtc,https://www.newsbtc.com/news/bitcoin/panama-canal-could-prioritize-bitcoin-paying-ships-mayor-suggests/,"BTC|BUSINESS|EXCHANGE|FIAT|MINING","Bitcoin|bitcoin|btc|btcusd|crypto|El Salvador|Panama Canal",cryptocompare
2025-05-31T03:57:58,"Best crypto presales to buy as Bitcoin sees renewed volatility","Bitcoin (BTC) and Ethereum (ETH) slipped 2.5% and 5%, respectively, on Saturday after President Donald Trump accused China of violating its trade agreement with the United States, reigniting fears of escalating trade tensions. The decline followed the release of the latest US Personal Consumption Expenditures (PCE) data, which came in line with expectations and initially kept the crypto market steady. However, sentiment turned negative after Trump’s statement on Truth Social suggested that China had reneged on the terms of a previously negotiated deal. He emphasized the impact of his 145% tariffs on Chinese imports, claiming they had placed China in “grave economic danger” and triggered civil unrest, prompting him to strike a quick agreement to stabilize conditions. This development adds to the volatility traders have seen since February, when tariff threats on Canada and Mexico began surfacing. With Bitcoin (BTC) experiencing renewed volatility, retail interest is rotating toward high-risk, high-reward opportunities like Bitcoin Pepe , which is now in the final phase of its presale. As speculative capital seeks fresh momentum plays, early-stage tokens such as Bitcoin Pepe are gaining traction among traders looking to capture outsized returns. The appeal lies in the typical presale dynamic—low entry price, viral branding, and the potential for explosive upside once listings go live. BTC to slip to $100K? Bitcoin (BTC) is down 4.50% for the week to $103,332 and appears vulnerable to a short-term retest of the $100,000 mark. However, blockchain data suggests that any sustained move below that threshold may be short-lived. According to CryptoQuant, the Net Realized Profit/Loss (NRPL) chart, which measures the realized gains and losses from Bitcoin transactions, shows only moderate profit-taking at current levels. This contrasts sharply with the elevated spikes seen during the March and November 2024 peaks, which preceded significant sell-offs and market tops. The relatively restrained selling now suggests that the market is not exhibiting signs of overheating, leaving room for further upside. Supporting the case for a strong bounce if BTC dips below $100,000 is the short-term realized price, currently at $96,000. This metric reflects the average acquisition price of coins moved recently and has historically served as a reliable support during bullish phases. In prior cycles, Bitcoin has typically not stayed below this level for long, underscoring solid investor conviction and persistent demand. Taken together, the muted profit-taking and a key support near the $96,000 point to a high likelihood that any pullback under six figures would attract dip-buying interest, reinforcing the broader bullish trend. Why market attention is on Bitcoin Pepe Even as Bitcoin grapples with short-term volatility, its recent move to new highs has buoyed sentiment across the broader crypto market, an environment that has historically set the stage for wider rallies. In this risk-on backdrop, investor appetite is again turning toward speculative corners of the market, with meme coins among the early beneficiaries. One standout in this rotation is Bitcoin Pepe, which is positioning itself not just as another viral token but as a meme-centric Layer 2 built on the Bitcoin network. The project claims to combine Bitcoin’s security with scalability comparable to Solana—an infrastructure edge that differentiates it from the majority of meme tokens, which typically offer little beyond branding. To build out its Layer 2 ecosystem, Bitcoin Pepe has lined up several strategic partnerships. These include collaborations with Super Meme, Catamoto, and Plena Finance, as well as a tie-up with the GETE Network aimed at expanding into the cross-chain Web3 gaming segment. These moves suggest an effort to blend meme culture with real-world blockchain utility. Investor interest appears to be following. Bitcoin Pepe has raised more than $12.7 million in its ongoing presale, with BPEP tokens priced at $0.0396. The presale is set to close on May 31, 2025, and a centralized exchange listing is expected shortly thereafter—an event that could act as a near-term price catalyst. As speculative capital continues to rotate into meme coins and early-stage projects, Bitcoin Pepe is positioning itself at the convergence of infrastructure development and retail-driven hype. The post Best crypto presales to buy as Bitcoin sees renewed volatility appeared first on Invezz",invezz,https://invezz.com/news/2025/05/31/best-crypto-to-buy-as-bitcoin-sees-renewed-volatility/,"ASIA|BTC|BUSINESS|MARKET|TRADING","Crypto",cryptocompare
2025-05-31T03:00:51,"Bitcoin Upward Momentum ‘Highly Likely’ To Continue, On-Chain Data Shows","Although Bitcoin (BTC) appears to have stalled in the mid-$100,000 range, on-chain data indicates that the top cryptocurrency’s bullish momentum is far from over. BTC recently hit a new all-time high (ATH) of $111,980, prompting several crypto analysts to forecast even higher prices in the near term. Bitcoin Rally Far From Over, Data Suggests According to a recent CryptoQuant Quicktake post by contributor Crypto Dan, Bitcoin is still “highly likely” to continue its upward trajectory. The analyst shared the Bitcoin Net Realized Profit/Loss (NRPL) chart to support this outlook. Related Reading: Bitcoin Near ATH, But Long-Term Holders Aren’t Selling – More Upside Ahead? The NRPL chart highlights the scale of realized profits and losses by market participants who are selling BTC. A relatively low NRPL during price increases typically signals that profit-taking is limited, often indicating the continuation of a bullish trend. In the chart, the current level of profit realization is highlighted in right-most red box. While the recent price surge may trigger a short-term correction, the extent of realized profits does not suggest the end of the ongoing upward cycle. As Dan noted: Compared to the NRPL spikes at past cycle peaks, this round of profit-taking is relatively limited. In particular, when compared to the movements at the highs in March and November 2024, the current level of profit realization is notably lower. Dan concluded that the current level of profit-taking does not point to a major trend reversal. Instead, Bitcoin is poised to continue climbing, potentially targeting levels beyond $120,000 in the coming weeks. Despite the optimism, some market watchers remain cautious. Noted crypto analyst Ali Martinez recently suggested that Bitcoin’s current price action might be a bull trap, with BTC at risk of falling below the $100,000 threshold. For the uninitiated, a bull trap refers to when the asset briefly breaks above a well-established resistance range, leading traders to believe a breakout is occurring, but then quickly reverses and falls back below the resistance level. This move often plays out to lure in long positions before liquidating them as the price drops back into the previous range. Bitcoin Selling Pressure Weak, Retail Yet To Arrive On a more positive note, multiple on-chain indicators suggest Bitcoin is not yet near its cycle top. Notably, retail investor participation in the current rally remains limited – a sign that the market may still have room for a second wave of capital inflow. Related Reading: Bitcoin Sees Massive 7,883 BTC Outflow From Coinbase – Are Institutions Loading Up? Likewise, Binance inflow data shows that certain investor groups are not eager to sell their BTC, possibly anticipating further gains. At press time, BTC is trading at $105,659, down 2.5% over the past 24 hours. Featured image from Unsplash, charts from CryptoQuant, X, and TradingView.com",newsbtc,https://www.newsbtc.com/bitcoin-news/bitcoin-upward-momentum-highly-likely-to-continue-on-chain-data-shows/,"BTC|BUSINESS|EXCHANGE|MARKET|TRADING","Bitcoin News|bitcoin|btc|BTCUSDT|bull trap|crypto|cryptocurrency|digital asset|Net Realized Profit/Loss|NRPL|On-chain data",cryptocompare
