datetime,headline,summary,source,url,categories,tags,api_source
2025-05-30T20:14:37.000Z,"Trump Media To Invest $2.3 Billion In Bitcoin After Successfully Closing Capital Raise","Trump Media and Technology Group (DJT), the operator of Truth Social, has closed its previously announced private placement offering to establish its corporate Bitcoin treasury, which produced $2.32 billion in net proceeds. Trump Media’s $2.32 Billion Bitcoin Buying Power According to a May 30 press release , the Trump family-led company sold roughly 56 million shares at $25.72 apiece for gross proceeds of $1.44 billion and issued $1 billion in 0% convertible senior secured notes maturing in 2028. Around 50 institutional investors participated in the sale. The offering was led by Yorkville Securities and Clear Street, with Cantor Fitzgerald serving as financial advisor. Trump Media said it would use approximately $2.32 billion in net proceeds to buy Bitcoin and for other general corporate purposes. The placement will put the world’s largest cryptocurrency on Trump Media’s balance sheet alongside existing cash, cash equivalents, and short-term investments. “Trump Media is focused on acquiring great assets, and this deal will give us the financial freedom to implement the rest of our strategies,” Trump Media CEO and Chairman Devin Nunes said in the release. “It means the Company will have more than $3 billion in liquid assets, and our shareholders will have exposure to Bitcoin. The deal positions Trump Media for the kind of rapid expansion we’ve always envisioned, and we look forward to advancing even further throughout the America First economy.” Crypto.com and Anchorage Digital will custody all the Bitcoin purchased by Trump Media. The move adds the Nasdaq-listed company to an increasing list of publicly-traded firms that have raised capital to purchase cryptocurrencies like Bitcoin, a play pioneered by Michael Saylor’s Strategy. The software intelligence-turned-Bitcoin development firm has become the world’s largest Bitcoin corporate holder , amassing more than $60 billion in BTC by financing frequent buys through a mix of equity and debt issuances. Trump Media described its offering as “one of the largest Bitcoin treasury deals for any company” on Wall Street, adding that the firm will become “one of the top Bitcoin holders among publicly-traded U.S. firms with one of the most comprehensive Bitcoin treasury strategies.” Trump and his family have gone all-in on crypto in recent months since the president’s return to office in January, launching meme coins and the decentralized finance protocol, World Liberty Financial — which also debuted its own stablecoin . Moreover, Trump’s sons, Eric and Donald Trump Jr., have launched their own Bitcoin mining company.",zycrypto,https://zycrypto.com/trump-media-to-invest-2-3-billion-in-bitcoin-after-successfully-closing-capital-raise/,"BLOCKCHAIN|BTC|REGULATION|SPONSORED|TECHNOLOGY","Bitcoin|News|Bitcoin News|Donald Trump",cryptocompare
2025-05-30T20:07:06.000Z,"State-backed Financial Institution in China Praises Bitcoin – What’s Going On?","The International Monetary Association (IMI), China’s state-backed financial think tank, has published a remarkable analysis of Bitcoin’s role in the global reserve system. The IMI article states that Bitcoin is no longer just a speculative tool, but is starting to be positioned as a strategic reserve asset. IMI states that due to high US budget deficits, expansionary monetary policies and the continuous decline in real yields on US Treasury bonds, many countries' central banks are turning to alternative reserve assets. The organization said that in this environment, new competitors have emerged against traditional reserve instruments such as gold, and that Bitcoin is increasingly attracting institutional attention with its fixed supply structure and decentralized nature. Related News: White House Officials Speak Out Following Developments in US-China Trade Tensions: Will the 145% Tariff Be Reinstated? The published analysis notes that some countries’ central banks and sovereign wealth funds have had contact with Bitcoin or have indirectly invested in it. For example, Norway’s sovereign wealth fund’s indirect Bitcoin ownership is cited, which is considered an indication that Bitcoin is beginning to be accepted as a long-term store of value. It is stated that Bitcoin can become a protection tool against the instability of traditional currencies, especially for developing countries struggling with high inflation and whose national currencies are under great pressure. According to IMI, in this period when the global financial order began to reshape, Bitcoin has evolved from its “speculative asset” identity to the role of a “strategic reserve asset” with the weakening of the dominance of the US dollar. *This is not investment advice. Continue Reading: State-backed Financial Institution in China Praises Bitcoin – What’s Going On?",bitcoinsistemi,https://en.bitcoinsistemi.com/state-backed-financial-institution-in-china-praises-bitcoin-whats-going-on/,"ASIA|BTC|FIAT|MARKET|REGULATION","Bitcoin|News",cryptocompare
2025-05-30T20:05:49.000Z,"Bitcoin Experiences Sell-Off Amid Macroeconomic Concerns, Yet Professional Traders Maintain Bullish Outlook","Bitcoin’s recent sell-off is a response to macroeconomic turbulence, yet professional traders are maintaining a bullish outlook on its future price. Despite the pressure from geopolitical tensions and declining bond",coinotag,https://en.coinotag.com/bitcoin-experiences-sell-off-amid-macroeconomic-concerns-yet-professional-traders-maintain-bullish-outlook/,"BTC|TRADING|USDT","Bitcoin|News|BTC|USDT",cryptocompare
2025-05-30T20:03:43.000Z,"Bitcoin ETF Outflows Surge as Fidelity and Grayscale Lead Redemptions, While BlackRock and ETH Funds Show Resilience","The recent shifts in the cryptocurrency market present a mixed outlook, with Bitcoin ETFs experiencing significant outflows while Ethereum funds draw strong interest. This divergence emphasizes the evolving investor preferences",coinotag,https://en.coinotag.com/bitcoin-etf-outflows-surge-as-fidelity-and-grayscale-lead-redemptions-while-blackrock-and-eth-funds-show-resilience/,"BTC|BUSINESS|ETH|MARKET|FLOW","Ethereum|News|BTC|ETH|FLOW",cryptocompare
2025-05-30T20:00:36.000Z,"$413,200,000,000 in Unrealized Losses Hit US Banks As FDIC Warns Rising Rates Adding Pressure","US banks are now saddled with $413.2 billion in unrealized losses on their balance sheets. In its new Quarterly Banking Profile for the first quarter of 2025, the Federal Deposit Insurance Corporation (FDIC) says US banks reported a $67.5 billion decrease in unrealized losses on securities, primarily Treasuries and other bonds. Although it looks like progress, the FDIC warns the decrease has likely already reversed amid extreme bond market volatility and a surging Treasury yield curve. “Longer-term interest rates such as the 30-year mortgage rate and the 10-year Treasury rate decreased in the first quarter, increasing the value of securities reported by banks and lowering unrealized losses. However, increases in longer-term interest rates since the end of the first quarter would likely reverse most of these improvements in unrealized losses if measured today.” Rebel Cole, who worked in the Federal Reserve System for ten years, tells Fortune that today’s levels of unrealized losses represent a serious ongoing danger for lenders. “All it takes is one bad news story about any of these banks, and we could have another banking crisis like we had in March of [2023]. I’m amazed we haven’t had one since then.” Unrealized losses represent the difference between the price banks paid for securities and the current market value of those assets. Concern over such paper losses played a major role in the collapse of Silicon Valley Bank in 2023, as depositors panicked and withdrew funds after learning the bank sold securities at a steep loss to cover liquidity needs. The FDIC says banks recorded a $180.9 billion rise in domestic deposits in Q1, which is about 1%, and a $3.8 billion increase in net income to $70.6 billion, with a reserve coverage ratio declining from 179.9% to 168.8%. Follow us on X , Facebook and Telegram Don't Miss a Beat – Subscribe to get email alerts delivered directly to your inbox Check Price Action Surf The Daily Hodl Mix Disclaimer: Opinions expressed at The Daily Hodl are not investment advice. Investors should do their due diligence before making any high-risk investments in Bitcoin, cryptocurrency or digital assets. Please be advised that your transfers and trades are at your own risk, and any losses you may incur are your responsibility. The Daily Hodl does not recommend the buying or selling of any cryptocurrencies or digital assets, nor is The Daily Hodl an investment advisor. Please note that The Daily Hodl participates in affiliate marketing. Generated Image: Midjourney The post $413,200,000,000 in Unrealized Losses Hit US Banks As FDIC Warns Rising Rates Adding Pressure appeared first on The Daily Hodl .",dailyhodl,https://dailyhodl.com/2025/05/30/413200000000-in-unrealized-losses-hit-us-banks-as-fdic-warns-rising-rates-adding-pressure/,"BTC|BUSINESS|FIAT|MARKET|REGULATION|TRADING","Fintech|bank|banks|FDIC|Federal Deposit Insurance Corporation|News|Unrealized Losses|US Bank|US banks",cryptocompare
2025-05-30T20:00:17.000Z,"Ethereum Pulls Back To 20DMA After $2,700 Rejection: Testing Strength At Key Support","Ethereum is showing renewed strength as it consolidates above the $2,500 mark, signaling resilience in the face of broader market volatility. After several weeks of testing the $2,700 region, ETH remains within striking distance of this critical resistance, keeping bullish momentum alive. Market sentiment has shifted in Ethereum’s favor, with analysts and investors increasingly pointing to the possibility of an upcoming altseason. Related Reading: Altseason Loading? Analyst Explains How FTX $5B Distribution May Trigger The Next Bull Leg Top analyst Big Cheds shared a technical breakdown, noting that ETH is currently back to a key moving average after flexing a move above the $2,700 range. This move aligned with the underside of a key resistance level, forming a confluence zone that could act as a springboard or rejection point in the days ahead. While Bitcoin consolidates just under its all-time high, Ethereum appears to be gaining traction as traders look for opportunities beyond BTC. With ETH holding higher lows and establishing a steady base, a breakout above the $2,700–$2,800 range could confirm a broader market rotation into altcoins. For now, bulls must maintain control above $2,500 to keep the structure intact and fuel hopes of a move higher. Ethereum At A Pivotal Level As Bulls Defend Support Ethereum is facing a crucial test as it struggles to reclaim higher prices and confirm a sustained uptrend. After multiple attempts to break above the $2,700 resistance zone, the price has been met with volatility, creating a choppy environment that reflects broader uncertainty in the crypto market. Despite this, analysts remain optimistic about Ethereum’s prospects, especially as altseason chatter grows louder. Cheds recently shared a key insight: Ethereum is now back at its 20-day moving average (DMA) after briefly surging above the $2,700 range. This push met the underside of the 200-day simple moving average (SMA), creating a confluence zone that could act as the launchpad for the next rally, or the line in the sand that decides short-term direction. Holding this DMA support is critical. If bulls defend this level, it could signal renewed strength and spark a breakout that sends ETH back toward $3,000 and beyond. Amid rising speculation and technical pressure, Ethereum’s current structure still leans bullish. It’s maintaining higher lows and continues to show signs of accumulation, which supports the thesis of a possible altseason in the near future. If BTC stabilizes and ETH clears resistance, the entire market could shift upward rapidly. Related Reading: Ethereum Tests Key Weekly Resistance – Analyst Sets $4K Target If ETH Breaks Out Ethereum Tests Support At Key Short-Term Levels Ethereum is consolidating on the 4-hour chart as it hovers around $2,614, following a minor pullback from the $2,780 local top. The chart shows ETH retesting the 34-period EMA (currently near $2,624) and finding short-term support along the confluence of the 50 and 100-period SMAs. These moving averages are acting as a dynamic support band that has held firm during previous retracements in May. The structure remains bullish overall, with higher lows maintained since the breakout on May 9. However, the current price action is forming a tightening wedge pattern, which suggests that a breakout—either up or down—is imminent. Volume has been declining slightly, indicating a potential pause before a decisive move. Related Reading: Ethereum Spot Premium Signals Strength – $2,800 Resistance In Focus For bulls, holding above the $2,580–$2,600 zone is critical. A clean bounce from here could set up another attempt to break the $2,700–$2,800 resistance area. On the flip side, a break below the 100 SMA could expose ETH to a deeper retracement toward $2,500 or even the $2,400 zone if selling pressure accelerates. Featured image from Dall-E, chart from TradingView",newsbtc,https://www.newsbtc.com/news/ethereum/ethereum-pulls-back-to-20dma-after-2700-rejection-testing-strength-at-key-support/,"ALTCOIN|BTC|ETH|MARKET|TRADING","Ethereum|ETH|ethereum|Ethereum Analysis|ethereum news|Ethereum pullback|Ethereum Resistance|Ethereum retrace|ETHUSDT",cryptocompare
2025-05-30T20:00:11.000Z,"Bitcoin ETFs see $358 mln exit – First outflow after 10-day inflow streak ends","Fidelity and Grayscale ETFs lead redemptions, while BlackRock and ETH funds maintain strong momentum.",ambcrypto,https://ambcrypto.com/bitcoin-etfs-see-358-mln-exit-first-outflow-after-10-day-inflow-streak-ends/,"BTC|ETH","Bitcoin|BTC Trading View|News|News 1|Social|Trading View|ambcrypto",cryptocompare
2025-05-30T20:00:00.000Z,"Bitcoin falls below $104K, but data shows BTC traders positioned for a rebound","Bitcoin sells off amid mounting macroeconomic uncertainty, but data shows pro traders clinging to their bullish price expectations.",cointelegraph,https://cointelegraph.com/news/bitcoin-falls-below-104k-but-data-shows-btc-traders-positioned-for-a-rebound?utm_source=rss_feed&utm_medium=rss&utm_campaign=rss_partner_inbound,"BTC|TRADING","",cryptocompare
2025-05-30T19:55:48.000Z,"Here’s How Low Bitcoin Could Fall in the Worst-Case Scenario, According to One Widely-Followed Crypto Trader","A closely followed crypto analyst is laying out Bitcoin’s worst-case scenario while also showing how BTC could shoot up to a new all-time high. In a new thread, pseudonymous crypto analyst Pentoshi tells his 865,000 followers on the social media platform X that the top crypto asset by market cap could dip to a price in the mid-$90,000s if it were to lose support around the $101,000 to $102,000 area. However, according to the analyst, demand for the flagship digital asset will be greater than all the BTC mined from all points, which in turn should eventually lead to a price spike. “We are still making higher highs and higher lows, overall this is a strong uptrend… [In my opinion], the worst case scenario [if] the trend [were] to continue [is] we see mid $90,000s as the next higher low. That’s IF we lose around $101,000-$102,000 area, which is the current support. I don’t really think you can compare this currently to 2021 because the situation isn’t the same at all, we were going into a period then of [quantitative tightening] after a period of extreme excess. The competition currently for BTC is only growing, and I’m quite certain the demand is greater than the daily mined BTC from all data points. So demand > supply over any period of time. I think the biggest enemy of people is their own patience. I too make these mistakes [from] time to time.” Source: Ali Pentoshi/X The trader’s chart indicates that BTC could dip to his target sometime between June and July before sparking a rally to the $120,000 range. BTC is trading for $105,471 at time of writing, a 1.5% decrease during the last 24 hours. Follow us on X , Facebook and Telegram Don't Miss a Beat – Subscribe to get email alerts delivered directly to your inbox Check Price Action Surf The Daily Hodl Mix Disclaimer: Opinions expressed at The Daily Hodl are not investment advice. Investors should do their due diligence before making any high-risk investments in Bitcoin, cryptocurrency or digital assets. Please be advised that your transfers and trades are at your own risk, and any losses you may incur are your responsibility. The Daily Hodl does not recommend the buying or selling of any cryptocurrencies or digital assets, nor is The Daily Hodl an investment advisor. Please note that The Daily Hodl participates in affiliate marketing. Featured Image: Shutterstock/GrandeDuc The post Here’s How Low Bitcoin Could Fall in the Worst-Case Scenario, According to One Widely-Followed Crypto Trader appeared first on The Daily Hodl .",dailyhodl,https://dailyhodl.com/2025/05/30/heres-how-low-bitcoin-could-fall-in-the-worst-case-scenario-according-to-one-widely-followed-crypto-trader/,"BTC|BUSINESS|MARKET|SPONSORED|TRADING","Bitcoin|Trading|BTC|Crypto|News|Pentoshi|trading",cryptocompare
2025-05-30T19:52:33.000Z,"Fidelity: Bitcoin Could Reach This 'Important Milestone'","Fidelity’s Jurien Timmer has identified an important milestone that Bitcoin could soon achieve",utoday,https://u.today/fidelity-bitcoin-could-reach-this-important-milestone,"BTC","Fidelity",cryptocompare
