datetime,headline,summary,source,url,categories,tags,api_source
2025-05-31T03:00:36,"Top Crypto to Buy Now: BlockDAG Presale Momentum, ETH Upgrades, SOL & ADA Developments","With new data emerging and notable upgrades taking shape, several leading crypto assets are catching attention this week. Ethereum’s shift toward broader institutional use, Solana’s appearance in strategic reserves, Cardano’s fresh DeFi integrations, and BlockDAG’s surging presale have all sparked interest. Each project brings a unique angle, from scalability and smart contract utility to low-cost entry and active ecosystems, but one project is clearly drawing the most eyes. This isn’t just about who’s rising in price. When considering the top crypto to buy now, investors are evaluating technical strength, ecosystem development, and near-term momentum. Based on these factors, BlockDAG has emerged with standout traction, while ETH, SOL, and ADA continue to show solid reasons to stay on watch. Here’s a detailed look at how they compare. 1. BlockDAG: $0.0018 Pricing & Exchange Reveal Set the Stage BlockDAG is showing rapid growth as it moves toward a key milestone in its presale phase. The coin is still available at $0.0018, while total presale funding is now closing in on $277 million. What’s driving interest? On June 13, BlockDAG will reveal 20 centralized exchanges where BDAG will be listed, a turning point that could fuel its public breakout. The project’s strength goes beyond exchange plans. BlockDAG merges DAG scalability with PoW security and supports 2,000 TPS at launch, scaling to 15,000 TPS. Its mobile app, X1, already has over 1 million users, while community-focused features like Buyer Battles and a 25% referral program have increased user engagement. A refreshed Double Up Reset also gives buyers a renewed chance to increase their holdings. With low entry pricing, growing visibility, and a defined path to listings, BlockDAG is building strong fundamentals. These factors explain why many see it as the top crypto to buy now, especially for those looking at long-term upside with real near-term catalysts. 2. Solana: Testing Support With Strategic Boost From Institutional Backing Solana is trading at $163.19, down 5.5% over the past day. Despite the dip, it’s holding firm after a solid recovery from April lows around $115. The current zone between $158 and $163 is a crucial support range. If it holds, analysts say SOL could test resistance at $183, with potential upside toward $195 and $210. What’s reinforcing confidence in Solana is its inclusion in the U.S. Strategic Bitcoin Reserve, a notable recognition of its broader utility. The platform continues to attract developers and users through its growing Web3 and DeFi ecosystem. If price stability continues, Solana remains a technically sound option. For swing traders and long-term believers, it continues to earn a place among the top crypto to buy now. 3. Ethereum: Institutional Demand & $4K Forecasts Support Strength Ethereum is currently priced at $2,620, having dipped 3.9% in the last 24 hours, with intraday movement between $2,591 and $2,732. This drop follows a strong monthly gain of nearly 45%, fueled by spot ETF inflows and renewed interest from institutions. Ethereum remains the leader in DeFi, holding more TVL than its closest competitors. The latest upgrade, Pectra, increased validator limits from 32 ETH to 2,048 and introduced faster, lower-cost network performance. While a $2.4 billion options expiry on May 30 may create short-term price swings, long-term targets remain high. Analysts at Standard Chartered see a $4,000 price point in 2025 and $7,500 by 2029. Ethereum’s continued relevance and technical strength make it a consistent pick among those scanning for the top crypto to buy now. 4. Cardano: Expanding Utility Through Bitcoin DeFi Cardano’s current price is $0.7009, showing a 6.7% decline on the day. Its trading range is sitting between $0.699 and $0.755. While price action has stayed muted, Cardano has been making quiet but meaningful moves. A major one is its integration of Bitcoin DeFi through the Lace Wallet, giving BTC users access to ADA-based financial tools. Alongside Solana, Cardano was recently added to the U.S. Strategic Bitcoin Reserve, a move that boosts its credibility. Analysts are projecting ambitious targets, including $2.05 by the end of 2025 and potentially $10 by 2030. These projections are tied to the blockchain’s ability to scale and integrate real-world use cases. While ADA isn’t stealing headlines right now, its developments and price range make it a relevant name in any discussion about the top crypto to buy now. Why BlockDAG Commands the Most Attention Ethereum brings institutional confidence. Solana continues to test important support levels while expanding its network. Cardano is quietly adding real-world use through Bitcoin integration. Yet BlockDAG is combining all the key elements, accessible pricing, strong technology, user incentives, and a confirmed roadmap to listings. With the presale target set at $600 million and the current price still at $0.0018, BlockDAG offers one of the most compelling setups. Its growing user base, solid architecture, and scheduled exchange reveal give it a clear advantage. For those searching for the top crypto to buy now , BlockDAG presents a rare opportunity to get in before the public launch and potential price shift begin. The days leading up to June 13 may represent the last chance to enter before a major wave of visibility and demand reshapes its market position. For buyers focused on value, growth, and timing, BlockDAG might just be the move worth making. The post Top Crypto to Buy Now: BlockDAG Presale Momentum, ETH Upgrades, SOL & ADA Developments appeared first on TheCoinrise.com .",thecoinrise,https://thecoinrise.com/top-crypto-to-buy-now-blockdag-presale-momentum-eth-upgrades-sol-ada-developments/,"ADA|BTC|ETH|SOL|TRADING","Token Presale and ICO Insights|BlockDAG",cryptocompare
2025-05-31T02:50:23,"Meta Platforms Shareholders Reject Bitcoin (BTC) Inclusion in $72 Billion Cash Reserves","In a significant development in the cryptocurrency landscape, Meta Platforms faced a decisive vote during its annual shareholder meeting held on May 30th. Shareholders overwhelmingly rejected a proposal that sought",coinotag,https://en.coinotag.com/breakingnews/meta-platforms-shareholders-reject-bitcoin-btc-inclusion-in-72-billion-cash-reserves/,"BTC","BTC",cryptocompare
2025-05-31T02:34:57,"Stocks and Crypto Tick Downward As Trump Accuses China of Violating Trade Agreement","Stocks and crypto lost a little bit of ground on Friday as President Donald Trump accused China of violating a recent trade agreement. Trump says on Truth Social that he had previously decided to make a deal with China because his tariffs were plunging the Asian giant into “grave economic danger.” But according to Trump, his efforts did not pay off, as he says China breached a deal with the United States. “I saw what was happening and didn’t like it, for them, not for us. I made a FAST DEAL with China in order to save them from what I thought was going to be a very bad situation, and I didn’t want to see that happen. Because of this deal, everything quickly stabilized and China got back to business as usual. Everybody was happy! That is the good news!!! The bad news is that China, perhaps not surprisingly to some, HAS TOTALLY VIOLATED ITS AGREEMENT WITH the US. So much for being Mr. NICE GUY!” The Nasdaq Composite dropped by 0.32% on Friday, while the S&P 500 traded closer to even, only slumping by 0.0081%. Crypto, on the other hand, fell further, with the overall digital market cap dropping by more than 4%. Bitcoin ( BTC ) fell by more than 1%. The Trump Administration announced multiple waves of tariffs on China in early April, which China responded to with retaliatory measures. Earlier this month, the White House announced that it had reached a deal with China to suspend and lower many of those tariffs, which kickstarted the equities market. Follow us on X , Facebook and Telegram Don't Miss a Beat – Subscribe to get email alerts delivered directly to your inbox Check Price Action Surf The Daily Hodl Mix Disclaimer: Opinions expressed at The Daily Hodl are not investment advice. Investors should do their due diligence before making any high-risk investments in Bitcoin, cryptocurrency or digital assets. Please be advised that your transfers and trades are at your own risk, and any losses you may incur are your responsibility. The Daily Hodl does not recommend the buying or selling of any cryptocurrencies or digital assets, nor is The Daily Hodl an investment advisor. Please note that The Daily Hodl participates in affiliate marketing. Generated Image: Midjourney The post Stocks and Crypto Tick Downward As Trump Accuses China of Violating Trade Agreement appeared first on The Daily Hodl .",dailyhodl,https://dailyhodl.com/2025/05/30/stocks-and-crypto-tick-downward-as-trump-accuses-china-of-violating-trade-agreement/,"ASIA|BTC|BUSINESS|MARKET|REGULATION","Financeflux|Bitcoin|China|Crypto|News|s&p 500|stocks",cryptocompare
2025-05-31T02:30:23,"Whale’s Bitcoin Journey: From $10 Million Profits to $2.47 Million Losses Amid Price Volatility","On May 31, COINOTAG reported that notable on-chain analyst Yu Jin has tracked significant transactions involving a prominent whale in the cryptocurrency market. This investor purchased Bitcoin (BTC) at an",coinotag,https://en.coinotag.com/breakingnews/whales-bitcoin-journey-from-10-million-profits-to-2-47-million-losses-amid-price-volatility/,"BTC|BUSINESS|MARKET|TRADING","BTC",cryptocompare
2025-05-31T02:21:30,"Bitcoin Mining Difficulty Surges to All-Time High with 4.38% Increase, Hitting 126.98 T","On May 31st, a significant update from BTC.com revealed a notable increase in Bitcoin mining difficulty, which adjusted at block height 899,136 at 08:01:30 Beijing time. The latest figures indicate",coinotag,https://en.coinotag.com/breakingnews/bitcoin-mining-difficulty-surges-to-all-time-high-with-4-38-increase-hitting-126-98-t/,"BTC|MINING","BTC",cryptocompare
2025-05-31T02:00:40,"Halfway To Clean: Bitcoin Hits 50% Renewable Mark, Ripple Chairman Reacts","Ripple’s chairman Chris Larsen praised the crypto network’s move toward greener energy this week. He spoke after Ripple handed over the “Skull of Satoshi” artwork at the 2025 Bitcoin conference. Larsen said the gift was a way to recognize progress and to build a better rapport between the two camps. Related Reading: $400K Bitcoin? Analyst Says It’s Not A Dream—It’s ‘Coded’ Ripple Bridges A Divide According to posts on X, Larsen funded the “Change the Code, Not the Climate” campaign entirely on his own back in 2023. He spent six figures to back Canadian artist Benjamin Von Wong’s piece, which urged Bitcoin to swap its energy-guzzling proof-of-work system for something kinder to the planet. The plan didn’t pan out as he had hoped. Still, Larsen seemed upbeat about moving past that setback. He made clear Ripple itself didn’t put any cash into the drive. In early 2023 when I funded the “Change the Code” campaign, my goal was to see if there was a way to turn Bitcoin into an accelerator for direct air capture. The campaign didn’t work, and that’s ok! Note – Ripple did not fund this campaign. Bitcoin’s energy transition in the… https://t.co/qIcadDtzDu — Chris Larsen (@chrislarsensf) May 28, 2025 Bitcoin’s Shift To Renewables Based on reports from the Cambridge Centre for Alternative Finance, about 50% of Bitcoin’s power now comes from renewable sources. That includes wind, hydropower and even nuclear energy. Miners have also tapped into waste gas projects, turning flared natural gas into fuel for their rigs. Five years ago, those numbers were far smaller. Today, the shift shows that Bitcoin can clean up its act without rewriting its code. Special guest at Bitcoin 2025 – the Skull of Satoshi, donated by @Ripple to the Bitcoin community. The Skull will now have a permanent home at the Bitcoin Museum in Nashville. pic.twitter.com/Eo3kNqRvGp — The Bitcoin Conference (@TheBitcoinConf) May 28, 2025 Skull Of Satoshi Donation At yesterday’s conference, Ripple formally handed the skull sculpture to the wider Bitcoin community. The gesture was more than a photo-op. It signaled that Ripple wants to ease the tension between XRP supporters and Bitcoin purists. In the past, the two groups have sparred over fees, speed and now environmental impact. By giving away an artwork meant to spark debate, Ripple is saying, “Let’s talk, not fight.” Call For A United Crypto Front Ripple’s CEO Brad Garlinghouse joined in the show of goodwill. He called on all crypto players to pull together. He urged regulators to carve out clearer rules, and asked industry insiders to focus on serving the unbanked. Garlinghouse stressed that XRP and Bitcoin fans have more in common than they might think. He said it’s time to unite against outside pressures, like tightening regulations and market skepticism. Related Reading: Tether’s 2-Year, $5 Billion Investment Blitz Fuels US Companies: CEO Looking ahead, Ripple’s move could set a tone for how rival networks interact. It proves that even tough critics can find common ground. And it suggests that big art—and big ideas—can help bridge divides. Featured image from Unsplash, chart from TradingView",newsbtc,https://www.newsbtc.com/news/bitcoin/halfway-to-clean-bitcoin-hits-50-renewable-mark-ripple-chairman-reacts/,"BTC|MARKET|SPONSORED|USDT|XRP","Bitcoin|bitcoin|blockchain technology|btc|btcusd|crypto market|crypto news|cryptocurrency",cryptocompare
2025-05-31T01:35:45,"Recovery of Bitcoin Whales Amid Bearish Signals and Key Support Challenges","Bitcoin (BTC) continues to face challenges, recently down 5.3% amid signs of increased whale activity that may signal reaccumulation efforts. Despite the recent downturn, heightened volatility and potential bearish signals",coinotag,https://en.coinotag.com/recovery-of-bitcoin-whales-amid-bearish-signals-and-key-support-challenges/,"BTC|MARKET|TRADING","Analysis|Bitcoin|News|BTC",cryptocompare
2025-05-31T01:34:13,"Bank of England Considers Bold Move into Bitcoin Reserves","The Bank of England might explore acquiring Bitcoin amid crypto interest. Nigel Farage's Reform UK proposes a Bitcoin reserve and reduced crypto taxes. Continue Reading: Bank of England Considers Bold Move into Bitcoin Reserves The post Bank of England Considers Bold Move into Bitcoin Reserves appeared first on COINTURK NEWS .",cointurken,https://en.coin-turk.com/bank-of-england-considers-bold-move-into-bitcoin-reserves/,"BTC|FIAT|REGULATION","Bitcoin News",cryptocompare
2025-05-31T01:30:09,"Ghost Wallets From 2011 Awaken, Move $23M in Bitcoin","With bitcoin still hovering above the $100,000 mark but slipping since hitting its record high, four vintage wallets from 2011 sprang to life this week, moving 221.99 BTC—worth over $23 million—for the first time in nearly 14 years. Dormant Bitcoin From 2011 Springs to Life Early-era bitcoin stashes from 2009, 2010, and 2011 rarely move",bitcoin.com,https://news.bitcoin.com/ghost-wallets-from-2011-awaken-move-23m-in-bitcoin/,"BTC","Crypto News|Bitcoin (BTC)|Wallets",cryptocompare
2025-05-31T01:00:48,"Bitcoin Will Soar, Altcoins Won’t—Charles Edwards Explains Why","In an interview with Korean crypto researcher Juhyuk Bak, also known as @JuhyukB, Capriole Investments CEO Charles Edwards laid out a striking divergence in the crypto asset markets: while Bitcoin could double this year, altcoins remain structurally impaired and far from any meaningful rotation. Bitcoin Could Hit $200,000 This Year Speaking from the perspective of a macro quant hedge fund operator, Edwards was unequivocally bullish on Bitcoin, stating, “If the data stays in the current trend we’re in, I think $150–200K is definitely possible this year.” The founder of Capriole, a fund known for pioneering on-chain valuation models like Hash Ribbons, Energy Value, and the Macro Index, grounded this forecast in a web of interlocking technical, sentiment, and macroeconomic signals. Related Reading: Bitcoin Warning: Bull Trap Or $270,000 Rocket? Analyst Exposes What’s Coming “We’re printing new all-time highs on daily and weekly closes,” Edwards noted. “As long as we stay above $104K as long as the Macro Index trends up, and US liquidity continues to rise, this environment is very bullish.” Capriole’s proprietary Macro Index—a machine learning model aggregating over 100 inputs from Fed liquidity to bond and equity markets—has turned decisively positive. Bitcoin’s rally, Edwards emphasized, is further reinforced by metrics like MVRV Z-Score, Hodler Growth Rates, and Energy Value, all signaling room for expansion. But while Bitcoin shows strength across multiple dimensions, altcoins are telling a very different story. The Death Of The Old Altcoin Cycle Edwards refrained from naming specific altcoins but delivered a clear macro verdict: the capital flow dynamics have changed, and altcoins are no longer on an equal footing with Bitcoin. “Structurally, things are quite a bit different this cycle […] the biggest driving forces are Bitcoin ETFs and US policy. That’s creating a centralizing effect—funneling capital directly into Bitcoin,” he explained. He pointed to the historical cycles of retail-led altcoin rallies, followed by catastrophic drawdowns—often exceeding 99% losses. “Retail has just gotten destroyed,” he said bluntly. “There’s a fatigue in the altcoin space that wasn’t there four or five years ago.” Related Reading: Bitcoin Could Explode On Bessent’s $250 Billion Deregulation Shock The legacy of failed ICOs, broken tokenomics, and events like the FTX collapse have left lasting scars. Meanwhile, institutions are avoiding the risks and complexity of smaller-cap digital assets, opting instead for regulated Bitcoin exposure through ETFs and corporate treasury allocations. “It used to be more of a level playing field. That’s no longer the case,” Edwards said. “The real money is flowing into Bitcoin—and that probably continues for a while.” When Will Altcoins Wake Up? Despite the grim tone, Edwards does not dismiss altcoins entirely. He views a strong altcoin cycle as conditional—not impossible, but dependent on clear Bitcoin dominance first. Using Capriole’s Speculation Index and Crypto Breadth models, which track the relative strength and price movement of altcoins, he made a key observation: “Right now, only 5% of altcoins are above their 200-day moving average. That’s not bullish.” He compared the current setup to late 2020, when Bitcoin surged from $10K to $60K before altcoins began outperforming. That rotation required Bitcoin to first breach previous all-time highs decisively. “You want Bitcoin to hit something like $140K while alts are still underperforming. That would be the ideal setup […] that’s when capital begins rotating downstream,” he explained. Conversely, if altcoins begin pumping prematurely, while Bitcoin remains range bound, Edwards sees that as a top signal. “That’s usually the last puff of air,” he warned. Cycles Are Changing, Risks Are Evolving Beyond price action, Edwards questioned the relevance of traditional halving cycles. He argued that the impact of miners—once the primary driver of Bitcoin supply dynamics—has diminished significantly due to ETFs, corporate treasuries, and sovereign actors like Michael Saylor. “That four-year cycle is dead—or at least dramatically weaker. Miners are now just 2–3% of the total supply flow. The real drivers today are institutions,” he said. This evolution reduces the probability of 80% drawdowns and increases the risk of systemic leverage—particularly from publicly traded Bitcoin-heavy firms. While not an immediate concern, Edwards sees potential for long-term vulnerabilities if major players overextend. Edwards also discussed diversification within Capriole’s portfolio. While Bitcoin remains the firm’s core allocation, he revealed exposure to quantum computing equities like IonQ (IONQ), Rigetti (RGTI), D-Wave (QBTS), and QUBT. “I think quantum is like Bitcoin in 2015. It’s early, it’s volatile, but the long-term CAGR could be even higher than Bitcoin’s.” He added that gold also plays a strategic role, not as a replacement but as a hedge. Capriole monitors the gold-to-equity ratio closely, and its breakout above the 200-day moving average is seen as a historically bullish signal—both for gold and Bitcoin. In closing, Edwards urged investors to tune out most of the financial news cycle. “Probably 99% of headlines don’t matter,” he said. Instead, focus on game-changing shifts: Fed pivots, global liquidity expansions, and true structural reconfigurations of capital flow. “We’re wired to overreact to bad news. The key is to filter it down to a few macro drivers that actually move the market—and Bitcoin right now has those working in its favor.” Until altcoins show meaningful breadth and break their long-term resistance structures, Edwards’ message is clear: Bitcoin will soar. Altcoins won’t—at least, not yet. At press time, BTC traded at $105,557. Featured image created with DALL.E, chart from TradingView.com",newsbtc,https://www.newsbtc.com/bitcoin-news/bitcoin-will-soar-altcoins-wont-charles-edwards/,"ALTCOIN|BTC|FIAT|MARKET|TRADING","Bitcoin News|altcoin|Altcoin Season|altcoins|bitcoin|Bitcoin news|bitcoin price|btc|BTC news|btc price",cryptocompare
2025-05-31T00:50:21,"James Wynn’s Bold BTC and PEPE Bet Amidst $3.25M Maneuver and $4M HYPE Redemption Deadline","On May 31, COINOTAG reported significant movements in the cryptocurrency sphere, particularly involving notable market player, James Wynn. According to on-chain analyst Yu Jin, Wynn successfully amassed $3.25 million through",coinotag,https://en.coinotag.com/breakingnews/james-wynns-bold-btc-and-pepe-bet-amidst-3-25m-maneuver-and-4m-hype-redemption-deadline/,"BTC|MARKET|PEPE","BTC|PEPE",cryptocompare
