datetime,headline,summary,source,url,categories,tags,api_source
2025-05-31T06:44:44,"BlackRock’s Bitcoin ETF Faces Record Outflow, Raising Questions About Market Dynamics and Future Inflows","In a surprising turn of events, BlackRock’s spot Bitcoin ETF has recorded its largest outflow, signaling potential shifts in market dynamics. This significant outflow highlights fluctuations in institutional interest amidst",coinotag,https://en.coinotag.com/blackrocks-bitcoin-etf-faces-record-outflow-raising-questions-about-market-dynamics-and-future-inflows/,"BTC|MARKET","Analysis|News|BTC",cryptocompare
2025-05-31T06:42:14,"BlackRock’s Bitcoin ETF ends 31-day inflow streak with biggest outflow ever","BlackRock ended its spot Bitcoin ETF inflow streak with its largest outflow on record, nearly $12.7 million more than its previous biggest outflow day.",cointelegraph,https://cointelegraph.com/news/blackrock-bitcoin-etf-inflow-streak-ends-outflow-btc?utm_source=rss_feed&utm_medium=rss&utm_campaign=rss_partner_inbound,"BTC","",cryptocompare
2025-05-31T06:41:10,"Why Is the Crypto Market Down Today?","The post Why Is the Crypto Market Down Today? appeared first on Coinpedia Fintech News Crypto markets slid on Friday as fresh tariff concerns once again discouraged investors. Bitcoin is down over 2% today, trading at $103,700. Smart contract platforms also took a big hit as Solana fell 6.3%, Sui dropped 7.8%, and Avalanche slid 7.3%. Crypto stocks were also affected as Bitdeer (BTDR) sank 8.3% after a big rally, while MicroStrategy (MSTR) dipped 2.7% and Coinbase (COIN) lost 1.3%. U.S.-China Trade Tensions Startle Crypto Markets The rising U.S.-China tensions are back in focus after a brief truce earlier this month. President Trump accused China of violating the tariff agreement, while Treasury Secretary Scott Bessent said in a Fox interview that trade talks with Chinese representatives had “stalled.” In response, China called on the U.S. to “immediately correct its erroneous actions and cease discriminatory restrictions,” according to the BBC. Earlier, the easing of tensions had fueled a rally in risk assets like Bitcoin, but the renewed conflict could now erase those gains. Memecoins See Sharp Pullback Bitcoin has dropped 6% over the past week. Whale activity shows signs of a comeback, but technical signals are still flashing warning signs. A death cross also looms for Bitcoin, and if it falls below the $104,584 support, it could slide further toward $100,694. Bulls need to reclaim $106,726 to regain control and prevent deeper losses. Memecoins also saw a sharp pullback, with over $10 billion wiped from their market cap in just seven days. It dropped from $74 billion to $64 billion, which is the lowest since May 9. Over $11.4 billion in Bitcoin and Ethereum options were to expire yesterday, which had a major impact on their short-term price action. Open Interest Drops, Liquidations Hit $800M The Fear and Greed Index has also dropped from 74 to 69, a three-week low. Over 217,000 traders were liquidated recently, with over $800 million in total liquidations across the crypto market. Over the past 24 hours, there have been $716 million in total liquidations. Bitcoin futures saw a $3.7 billion drop in open interest as BTC fell from $108,000 to $104,500. This sharp pullback signals a healthy reset, clearing out overleveraged positions and cooling market hype. While Bitcoin could soon dip to $100,000, however, data shows that a drop below that level could be short-lived. CryptoQuant’s Net Realized Profit/Loss (NRPL) chart shows there is only mild profit-taking, which is far less than the sell-offs seen at market tops in 2024. This hints that the market isn’t overheated and Bitcoin’s uptrend may still have room to run. If Bitcoin drops below $100,000, the $96,000 would be a key support level attracting buyers and limiting further drops. Trader Altcoin Sherpa points to a strong support zone between $102K–$104.5K and expects a bounce that could push Bitcoin above $107K in the coming days.",coinpedia,https://coinpedia.org/news/why-is-the-crypto-market-down-today-11/,"ALTCOIN|ASIA|BTC|MARKET|TRADING","News|Altcoins|Bitcoin|Crypto news",cryptocompare
2025-05-31T06:40:24,"AI Startups: Unlocking Future Innovation at Bitcoin World Sessions: AI","BitcoinWorld AI Startups: Unlocking Future Innovation at Bitcoin World Sessions: AI In the rapidly evolving landscape of technology, the intersection of AI and blockchain holds immense potential. For those tracking breakthroughs in this space, understanding the practical applications and future direction of artificial intelligence is key. Bitcoin World Sessions: AI provided a dedicated platform to explore this convergence, shining a spotlight on the AI Innovation driven by leading partners and the startups they support. This high-energy event brought together founders, investors, and technologists to delve into how AI is reshaping industries. From initial concepts presented in a pitch deck to full-scale deployment, the discussions highlighted real-world impact. We were proud to feature insights from our partners, whose expertise offered attendees a direct view into the latest developments and strategies in AI. The Rise of AI Startups A significant theme explored was the transformative role of AI within new ventures. In the session “Your Next Co-Founder Will Be AI,” Tanka CEO Kisson Lin presented a compelling vision for AI Startups . Drawing from extensive experience at major tech companies and multiple entrepreneurial ventures, Lin discussed how AI can serve as a relentless co-founder. Key takeaways from this session included: AI handling crucial, time-consuming tasks like drafting product documentation and preparing investor updates. Enabling founders to scale their operations more quickly. Facilitating smarter workflows and reducing founder burnout. This perspective emphasizes how AI is moving beyond being just a tool to becoming an integral part of the founding team, fundamentally changing how AI Startups are built and scaled. Implementing Enterprise AI Solutions Moving from startups to established corporations, the event showcased practical applications of AI in large organizations. The session “How Toyota Repair Technicians Leverage AI with NLX” provided a concrete example of Enterprise AI in action. Kordel France from Toyota and Andrei Papancea from NLX shared their journey of taking an AI concept to a scaled deployment. They detailed how AI-powered conversational tools were implemented to provide Toyota technicians with instant access to complex repair data. This integration has led to: Increased technician productivity. Improved dealership efficiency. Smarter, faster workflows for accessing critical information. This case study demonstrated the tangible benefits that Enterprise AI can deliver when applied strategically to specific business challenges. Building with Generative AI Another area of significant interest was the development of applications using generative AI. The session “Building Richer and More Scalable GenAI Applications for Startups and Developers” featured Nipun Agarwal and Sandeep Agrawal discussing how MySQL HeatWave facilitates building powerful, scalable Generative AI applications. Their presentation highlighted how the platform streamlines complex RAG (Retrieval Augmented Generation) workflows through: A built-in vector store. In-database Large Language Models (LLMs). Integrated machine learning capabilities. This approach eliminates the need for separate databases or complex ETL processes, allowing developers to build faster, work with real-time data, and dedicate more time to innovation in the Generative AI space. Empowering Teams with AI Agents The concept of collaborative AI systems and agents was also a key focus. Iliana Quinonez, Director of Customer Engineering at Google Cloud Startups, presented “Democratizing AI and Building Collaborative Systems with AI Agents .” She explained how collaborative AI agents are transforming teamwork and boosting productivity across organizations. Key points included: Making AI agent development accessible to teams regardless of their technical experience. Building intelligent systems that can work seamlessly with both humans and other AI systems. Driving smarter, faster collaboration through empowered teams. This session underscored the potential for AI Agents to act as force multipliers, enhancing human capabilities and streamlining complex collaborative tasks. Integrating AI Across the Enterprise Suite Expanding on the theme of Enterprise AI , the session “Suite AI: How SAP Is Bringing AI to the Enterprise” explored SAP’s strategy for embedding AI across its business suite. Max McPhee and Rob Seifert detailed how innovations are driving efficiency and transforming operations within large companies. Highlights included: SAP’s AI agent, Joule, and its role in assisting users. Embedded intelligence within core SAP applications. Options for custom AI development to meet specific business needs. This provided insight into how major software providers are making Enterprise AI capabilities readily available to businesses of all sizes, facilitating widespread adoption and transformation. Experience the Future of AI Innovation Bitcoin World Sessions: AI offered a deep dive into the practical applications and future directions of AI, from supporting AI Startups to implementing complex Enterprise AI solutions and building with Generative AI and AI Agents . The insights shared by partners provided valuable perspectives on the state of AI Innovation today and where it is heading. The event itself was held on June 5, 2025, in Berkeley, CA, featuring leaders from companies like OpenAI, Anthropic, Khosla Ventures, and more. Attendees had the opportunity to gain expert insights, participate in workshops, and network with peers at the forefront of the AI revolution. To learn more about the latest AI market trends, explore our article on key developments shaping AI features. This post AI Startups: Unlocking Future Innovation at Bitcoin World Sessions: AI first appeared on BitcoinWorld and is written by Editorial Team",bitcoinworld,https://bitcoinworld.co.in/ai-startups-innovation-event/,"BLOCKCHAIN|BTC|BUSINESS|MARKET|TECHNOLOGY","AI News|AI|ai agents|Enterprise AI|Generative AI|Startups",cryptocompare
