datetime,headline,summary,source,url,categories,tags,api_source
2025-05-30T19:50:54.000Z,"Bitcoin Mining: Cango’s Remarkable Growth Adds 109.1 BTC","BitcoinWorld Bitcoin Mining: Cango’s Remarkable Growth Adds 109.1 BTC In the ever-evolving landscape where traditional industries intersect with the cutting edge of digital finance, news from unexpected corners often makes the biggest splash. This week, Cango Inc., a company primarily known as a leading automotive transaction service platform in China, turned heads in the cryptocurrency world with a significant announcement regarding its Bitcoin mining operations. What’s Behind Cango’s Jump into Bitcoin Mining? Cango’s foray into the world of digital asset mining might seem surprising at first glance for a company rooted in the automotive sector. However, it reflects a growing trend among diverse corporations looking to diversify their assets, explore new revenue streams, and potentially hedge against macroeconomic uncertainties. By acquiring Bitcoin (BTC) mining machines, reportedly from industry giant Bitmain, Cango is actively participating in the process that secures the Bitcoin network and generates new BTC. Bitcoin mining involves using powerful computers to solve complex mathematical problems. The first miner to solve the problem gets to add the next block of transactions to the Bitcoin blockchain and is rewarded with newly minted Bitcoin and transaction fees. This process requires significant computational power and energy, making it a capital-intensive operation. For a company like Cango, investing in mining infrastructure represents a strategic decision to directly accumulate a digital asset that many believe has long-term value potential. A Closer Look at Cango’s Growing Cango BTC Holdings The core of the recent announcement from Cango, shared via their official channels, was the impressive figure of 109.1 BTC mined within a single week. This is a substantial amount of Bitcoin, reflecting efficient operations and significant deployed hashing power. But perhaps more importantly, this weekly yield has significantly boosted their total reserves. Following this successful week of mining, Cango’s total Cango BTC holdings have now reached an impressive 3,398 BTC. To put this into perspective, let’s consider the approximate value (keeping in mind that cryptocurrency prices are highly volatile and this value fluctuates constantly). As of the time of writing, 3,398 BTC represents a multi-million dollar asset on their balance sheet. This positions Cango as a notable corporate holder of Bitcoin, although still considerably smaller than giants like MicroStrategy, whose strategy is primarily focused on accumulating BTC. The growth in their holdings demonstrates that their investment in mining equipment is yielding tangible results, steadily increasing their digital asset reserves over time. This isn’t just a speculative purchase; it’s an active accumulation strategy through operational activity. Why Are More Companies Embracing Corporate Bitcoin Strategies? Cango is not alone in exploring the potential of digital assets. The trend of companies adding Bitcoin to their balance sheets, often referred to as adopting a corporate Bitcoin strategy, gained significant momentum starting in 2020. Companies cite various reasons for this move: Inflation Hedge: Bitcoin is often viewed as a potential hedge against the devaluation of fiat currencies due to its capped supply. Asset Diversification: Adding a non-correlated asset like Bitcoin can help diversify a company’s treasury reserves away from traditional cash and bonds. Potential for Appreciation: Companies anticipate that the value of Bitcoin will increase over the long term. Attracting Talent and Investor Interest: Embracing innovative technologies like Bitcoin can make a company appear forward-thinking. New Revenue Streams: For companies like Cango, mining directly generates new assets and potentially revenue. While holding Bitcoin is one approach, actively engaging in crypto mining , as Cango is doing, represents a deeper operational commitment to the ecosystem. It requires expertise in setting up and managing mining infrastructure, navigating energy costs, and dealing with the technical complexities involved. Navigating the World of Crypto Mining: Challenges and Considerations While the rewards of successful crypto mining , such as accumulating 109.1 BTC in a week, are attractive, the process comes with significant challenges: High Capital Costs: Acquiring powerful mining hardware, like the machines from Bitmain, requires a substantial upfront investment. Energy Consumption and Cost: Mining is energy-intensive. The cost and availability of electricity are major factors influencing profitability and operational location. Mining Difficulty: As more miners join the network, the difficulty of solving the mathematical problems increases, requiring more powerful hardware to maintain the same level of output. Hardware Obsolescence: Mining technology evolves rapidly, meaning hardware can become less efficient or obsolete over time. Regulatory Uncertainty: The regulatory environment for cryptocurrency mining varies significantly across jurisdictions and can change unexpectedly, posing risks, especially for companies operating in complex regions like China. Bitcoin Price Volatility: The value of the mined Bitcoin fluctuates with market prices, impacting the profitability of the operation. Cango’s continued success in mining suggests they are effectively managing these challenges, leveraging their resources and strategic partnerships (like with Bitmain) to build a productive mining operation alongside their primary automotive business. Cango’s Announcement in the Context of Recent Bitcoin News This positive development from Cango comes at a time when the broader Bitcoin news cycle is often dominated by market price movements, regulatory discussions, and the performance of dedicated crypto companies. Cango’s update serves as a reminder that adoption and participation in the Bitcoin network are expanding beyond traditional crypto-native firms. It highlights that companies from diverse sectors are finding strategic reasons to engage with Bitcoin, either through direct investment or operational activities like mining. This kind of organic accumulation by publicly traded companies adds another layer to the institutional adoption narrative surrounding Bitcoin. Benefits of Cango’s Mining Strategy: Direct accumulation of a potentially appreciating asset. Diversification of company assets. Potential new revenue stream from mining rewards and transaction fees. Operational involvement provides deeper understanding of the crypto ecosystem. Challenges Cango Faces: Significant capital expenditure on hardware. Ongoing operational costs, primarily energy. Risk associated with Bitcoin price volatility. Navigating the complex and evolving regulatory landscape for crypto mining. Maintaining competitive edge against dedicated mining companies. Actionable Insights from Cango’s Move What can individuals and other businesses take away from Cango’s successful mining venture? Diversification is Key: Companies are exploring non-traditional assets for balance sheet management. Operational Adoption is Growing: It’s not just about buying Bitcoin; some companies are integrating crypto into their operations. Mining Requires Expertise: Successful mining involves careful planning, significant investment, and efficient management of technical and energy resources. Stay Informed: Keep an eye on companies from traditional sectors entering the crypto space, as it signals broader acceptance and potential future trends. Cango’s ability to successfully mine over 100 BTC in a week and build their holdings to over 3,000 BTC demonstrates that with the right strategy and resources, companies from various industries can effectively participate in the digital asset economy. Conclusion: Cango’s Mining Success Signals Broader Trends Cango’s announcement that it mined 109.1 BTC this week, bringing its total Cango BTC holdings to 3,398 BTC, is more than just a number; it’s a testament to the increasing integration of corporate Bitcoin strategies into the operations of diverse companies. While their primary business remains automotive services, their significant investment in Bitcoin mining infrastructure, supplied by Bitmain, is clearly paying off, allowing them to accumulate a substantial digital asset reserve. This move highlights the growing interest from non-crypto native companies in leveraging digital assets for strategic purposes, whether for balance sheet management, diversification, or exploring new revenue streams through activities like crypto mining . As the world of finance and technology continues to converge, expect to see more such stories emerge, further solidifying Bitcoin’s place in the global corporate landscape. Cango’s remarkable growth in its BTC holdings is a notable piece of recent Bitcoin news , underscoring the dynamic evolution of corporate engagement with cryptocurrencies. To learn more about the latest Bitcoin news trends, explore our article on key developments shaping Bitcoin price action. This post Bitcoin Mining: Cango’s Remarkable Growth Adds 109.1 BTC first appeared on BitcoinWorld and is written by Editorial Team",bitcoinworld,https://bitcoinworld.co.in/cango-bitcoin-mining-growth/,"BTC|BUSINESS|MARKET|MINING|TRADING","Crypto News|BITCOIN|Cango|Corporate|Crypto news|MINING",cryptocompare
2025-05-30T19:50:38.000Z,"Bitcoin Conference Highlights Individual Liberty and Political Engagement Amid Regulatory Discussions","The Bitcoin 2024 conference in Las Vegas showcased key insights into cryptocurrency’s intersection with politics and individual liberty. Attendees engaged with notable figures, including U.S. Vice President JD Vance, highlighting",coinotag,https://en.coinotag.com/bitcoin-conference-highlights-individual-liberty-and-political-engagement-amid-regulatory-discussions/,"BTC|REGULATION","News|BTC",cryptocompare
2025-05-30T19:50:23.000Z,"Crypto Liquidations Nearly $1B Today: Time to Exit and Take Profits?","The post Crypto Liquidations Nearly $1B Today: Time to Exit and Take Profits? appeared first on Coinpedia Fintech News The cryptocurrency market recorded more than $841 million in total forced liquidations during the last 24 hours leading to Friday, May 30, during the late North American trading session. As Bitcoin (BTC) price dropped below $105k, the wider altcoin market led by the memecoins recorded heavy forced liquidation of long-leveraged traders. According to market data from Coinglass, more than $747 million in forced crypto liquidations involved long traders. The forced liquidations of Bitcoin’s whale-long traders, led by James Wynn , triggered further short-term pessimism. Meanwhile, the short crypto traders recorded around $80 million in forced liquidations during the past 24 hours. As a result, the odds of a long squeeze escalated despite the overall optimism of a market rebound over the weekend. What Next for the Altcoin Market The optimism of a crypto rebound in the coming few days remains evident amid the ongoing bloodbath. Bitcoin’s fear and greed index hovered around 60 percent, signaling greed among crypto traders. The improving crypto regulatory frameworks in major jurisdictions, led by the United States, has attracted more institutional investors in the web3 space. As a result, it is evident that more crypto investors are anticipating a bullish rebound in the coming days, potentially a parabolic rally in the near future. However, the ongoing bearish sentiment may likely delay a bullish rebound, especially if Bitcoin price drops below $100k again in the coming days. Nonetheless, the notable surge of bearish traders will likely trigger a major short squeeze of Bitcoin price rebounds above $110k in the coming days. The crypto bullish outlook has a higher ground catalyzed by rising adoption from institutional investors and favoring regulatory frameworks from major jurisdictions. As a result, a wait-and-see strategy could apply in the coming days, if and only if the Bitcoin price will not drop below $96k.",coinpedia,https://coinpedia.org/news/crypto-liquidations-nearly-1b-today-time-to-exit-and-take-profits/,"ALTCOIN|BTC|BUSINESS|MARKET|TRADING","News|Altcoins|Bitcoin|Crypto news|Price Analysis",cryptocompare
2025-05-30T19:44:18.000Z,"For Bitcoin 2025, the word of the day was ‘freedom’","From Ross Ulbricht's first significant public appearance to Strategy’s Michael Saylor addressing the crowd, the focus of the Bitcoin conference was often on individual liberty.",cointelegraph,https://cointelegraph.com/news/bitcoin-2025-event-recap-freedom?utm_source=rss_feed&utm_medium=rss&utm_campaign=rss_partner_inbound,"BTC","",cryptocompare
2025-05-30T19:41:29.000Z,"Trader makes $17M by betting against James Wynn’s high-risk strategy","While James Wynn lost nearly $100 million, another trader made a fortune by consistently taking the opposite side of his trades. One crypto trader earned more than $17 million by betting against controversial crypto fund manager James Wynn. On Friday, May 30, Lookonchain reported that the trader behind wallet address 0x2258 repeatedly mirrored the opposite of Wynn’s positions. The trader shorted when Wynn went long and went long when Wynn shorted. The approach paid off, resulting in $17 million in profits while Wynn racked up $98 million in losses. The winning strategy lately? Do the opposite of James Wynn. 0x2258 has been counter-trading James Wynn—shorting when James Wynn goes long, and going long when James Wynn shorts. In the past week, 0x2258 has made ~$17M, while James Wynn has lost ~$98M. https://t.co/NhOE1YD4QN pic.twitter.com/aO13boYza2 — Lookonchain (@lookonchain) May 30, 2025 This strategy started drew attention on May 24, when 0x2258 shorted both Bitcoin and Ethereum, contrary to Wynn’s long positions. The next day, after Wynn closed his trades, 0x2258 followed suit, locking in a $1.36 million gain. You might also like: From PEPE to Billions: meet crypto’s boldest whale James Wynn Wynn then flipped to shorting BTC and ETH, while 0x2258 went long. When Wynn exited, the counter-trade earned 0x2258 another $2.54 million. This continued until May 26, when Wynn went long again and 0x2258 profited $1.7 million by shorting. Wynn’s risky bets cost him $98 million James Wynn is a well-known high-leverage trader whose risky trades on Hyperliquid have led him to the biggest losses yet, now amounting to about $100 million. Still, the trader stated that he had no regrets over the “casino.” “Zero regrets. Flipping $4 million to $100 million and back down to -$13 million is one hell of a thrill. Hope many of you enjoyed it as much as I did,” James Wynn said . While being well-known for his leveraged trades, Wynn is also a controversial figure due to his involvement in memecoins. He was accused by several crypto investigators, including ZachXBT, of pumping and dumping memecoins to his followers. You might also like: James Wynn longs PEPE with 10x leverage as PEPE price eyes potential 20% – 40% leg up",crypto_news,https://crypto.news/trader-makes-17m-by-betting-against-james-wynns-high-risk-strategy/,"BTC|ETH|TRADING|ZRX|PEPE","News|Trading",cryptocompare
2025-05-30T19:40:18.000Z,"Bitcoin’s post-ETF rally triggered massive short liquidations, rewarding bullish traders.","Since the approval of Bitcoin spot ETFs in the U.S. in early 2024, Bitcoin (BTC) has rallied strongly, punishing bearish traders in the process. Altcoins have moved in the opposite direction, dealing a harsh blow to bullish investors hoping for an imminent “altseason.” A recent analysis on CryptoQuant highlights the contrast in liquidation patterns between BTC and altcoins since the approval of spot Bitcoin ETFs, offering a glimpse into the diverging paths taken by the two market segments. Short liquidations on Bitcoin have far exceeded long liquidations since the ETF approval, according to the report. Short liquidations on Bitcoin have far exceeded long liquidations since the ETF approval. Source: @joao_wedson Bitcoin’s post-ETF rally crushes the bears On Binance, Bitcoin’s Cumulative Liquidation Delta (CLD) showed that short liquidations on Bitcoin exceeded long liquidations by far since the SEC approved ETFs in early 2024. In essence, traders who bet against Bitcoin since then have been systematically forced out of their positions as BTC steadily climbed. In a post on X , analyst Joao Wedson, the author of the CryptoQuant report, stated, “The data doesn’t lie: since the ETF launch, there has been $190 million more in short liquidations than long liquidations on Binance.” According to Wedson, Bitcoin’s price strength during this period caught many bearish speculators off guard. Rather than correcting or stalling after the ETF launches, BTC has extended its rally, reinforcing its dominance and trust among institutional and retail investors alike. Altcoins have become a trap for bulls Unlike Bitcoin, the story is starkly different for the altcoin market. While Bitcoin has steadily climbed and squeezed shorts, altcoins have suffered from overwhelming long liquidations. According to CryptoQuant’s data, long liquidations in the altcoin market outpaced short liquidations by nearly $1 billion during the same post-ETF period. Long liquidations in the altcoin market outpace short liquidations by nearly $1 billion since Bitcoin spot ETFs launched. Source: @joao_wedson This imbalance suggests that many traders expected altcoins to follow Bitcoin’s bullish lead, perhaps anticipating the onset of a long-awaited “altseason”—a period in which altcoins outperform BTC. Unfortunately for these traders, altcoin prices largely trended downward, defying the bullish bias and resulting in widespread liquidations of leveraged long positions. Market dynamics reveal a diverging risk appetite This stark difference in liquidation patterns reveals more than just market volatility; it suggests a fundamental shift in trader sentiment and risk behavior. While investors showed correct bullish conviction in Bitcoin, they incorrectly assumed altcoins would follow suit. The result? BTC punished the bears, but altcoins punished their bulls even harder. The divergence also reflects institutional interest. Spot Bitcoin ETFs have attracted billions in capital from traditional finance players, buoyed by strong macroeconomic narratives, adding legitimacy and demand to BTC. Altcoins, however, lack similar instruments and regulatory clarity, leaving them more vulnerable to retail speculation and volatility. For traders and analysts, the message is clear, and it’s that the current crypto environment favors Bitcoin in terms of relative stability and upside potential. KEY Difference Wire : the secret tool crypto projects use to get guaranteed media coverage",cryptopolitan,https://www.cryptopolitan.com/btc-punishes-bears-altcoins-punishes-bulls/,"ALTCOIN|BTC|BUSINESS|MARKET|TRADING","News|BTC",cryptocompare
