datetime,headline,summary,source,url,categories,tags,api_source
2025-05-30T21:50:13.000Z,"Trump Media Makes Strategic $2.32 Billion Bitcoin Treasury Move","BitcoinWorld Trump Media Makes Strategic $2.32 Billion Bitcoin Treasury Move In a development that has sent ripples through both the stock market and the cryptocurrency world, reports indicate that Trump Media & Technology Group (DJT) has made a significant foray into the digital asset space. According to information shared by Watcher Guru on X, the company is set to make a massive Bitcoin acquisition, signaling a bold new direction for its treasury management strategy. What Does This $2.32 Billion Trump Media Bitcoin Deal Mean? The core of the news revolves around a reported agreement valued at an astonishing $2.32 billion . Under this deal, Trump Media is said to be purchasing Bitcoin with the explicit intention of holding it as a Treasury Asset . This move places DJT in a growing, albeit still small, group of publicly traded companies opting to allocate a portion of their corporate reserves into the leading cryptocurrency. For context, corporate treasury management traditionally involves holding low-risk, liquid assets like cash, short-term government bonds, or commercial paper. The decision to swap a substantial amount of capital for a volatile asset like Bitcoin is a significant departure from conventional practices. Key aspects of this reported deal include: Scale: The sheer size of the investment ($2.32 billion) is noteworthy, positioning it as one of the largest corporate Bitcoin acquisitions reported to date, potentially rivaling or exceeding holdings of other publicly known corporate holders depending on the exact terms and timing. Purpose: Holding Bitcoin as a Treasury Asset implies a long-term strategy, viewing BTC not just as a speculative trade but as a store of value or hedge against inflation, similar to how some view gold. Source: The report originated from Watcher Guru on X, a popular source for crypto news and market updates. While widely reported, official confirmation from Trump Media itself is the definitive next step that stakeholders will be watching for. Why Would Trump Media Consider a Crypto Investment Like Bitcoin? The decision for a company like Trump Media to engage in a large-scale Crypto Investment , specifically in Bitcoin, could be driven by several factors: Potential for Appreciation: Bitcoin has historically shown significant price appreciation over the long term, despite considerable volatility. A company might see this as an opportunity to grow its treasury reserves beyond the modest returns offered by traditional safe-haven assets. Inflation Hedge Narrative: Bitcoin is often touted as ‘digital gold’ and a potential hedge against inflation dueating to its fixed supply cap (21 million coins). In an era of quantitative easing and potential currency devaluation concerns, holding a non-sovereign, scarce asset could be appealing. Attracting a Specific Investor Base: Trump Media’s platform, Truth Social, caters to a specific audience. Given the growing interest in cryptocurrency among various demographics, including those politically aligned, a move into Bitcoin could resonate with and potentially attract investors interested in both the company and the crypto space. Following Corporate Trends: While not mainstream, companies like MicroStrategy have famously adopted Bitcoin as a primary treasury reserve asset, demonstrating a potential blueprint for other corporations. This could signal confidence in Bitcoin’s long-term viability as a corporate asset. What are the Potential Challenges and Risks for DJT Stock and Bitcoin? While the potential upsides are clear, holding a volatile asset like Bitcoin as a Treasury Asset comes with significant risks that could impact DJT Stock and the company’s financial stability: Market Volatility: Bitcoin’s price can experience dramatic swings in short periods. A significant downturn could rapidly diminish the value of Trump Media’s treasury holdings, potentially impacting its balance sheet and investor confidence. Regulatory Uncertainty: The regulatory landscape for cryptocurrencies remains evolving and fragmented across different jurisdictions. Future regulations could impact the value, liquidity, or even the legality of holding Bitcoin. Security Risks: Holding large amounts of cryptocurrency requires sophisticated security measures to protect against hacking, theft, or loss of private keys. A security breach could result in the total loss of the invested capital. Accounting and Reporting Challenges: Accounting for volatile digital assets like Bitcoin can be complex and subject to specific rules (like FASB’s recent standard requiring fair-value accounting), which can introduce volatility into reported earnings. Public Perception: While appealing to some, a large Crypto Investment could alienate more conservative investors who prefer traditional, stable treasury management practices. How Does This Compare to Other Corporate Bitcoin Holdings? Trump Media’s reported $2.32 billion investment would place it among the top publicly traded companies by Bitcoin holdings. Here’s a simplified comparison (figures are approximate and subject to change based on market price and ongoing acquisitions): Company Approximate BTC Holdings (as of relevant reports) Reported Trump Media Holding MicroStrategy (MSTR) ~214,400 BTC ~ $2.32 Billion Worth of BTC (Exact amount depends on purchase price) Marathon Digital (MARA) ~17,857 BTC Tesla (TSLA) ~9,720 BTC Note: The actual number of Bitcoin acquired by Trump Media depends on the average purchase price paid during the reported $2.32 billion transaction. This table highlights the scale of the reported Trump Media deal. While MicroStrategy remains the leader by a significant margin in terms of the *number* of Bitcoin held, a $2.32 billion investment is substantial and indicates a serious commitment to the asset class. What Are the Actionable Insights for Investors? For investors tracking DJT Stock , this news is crucial. It introduces a new variable – the performance of a volatile digital asset – directly onto the company’s balance sheet. Investors will need to consider: DJT Stock Volatility: The stock price may become increasingly correlated with Bitcoin’s price movements. Due Diligence: Understanding Trump Media’s specific strategy for managing this asset (custody, risk management, future plans) is key. Market Sentiment: How the broader market reacts to a media company making such a large Crypto Investment could influence sentiment around DJT. For Bitcoin investors, a multi-billion dollar acquisition by a publicly traded company, regardless of its industry, is generally viewed positively as it signals increasing institutional adoption and demand. This could contribute to positive price momentum, though it does not guarantee future gains. Conclusion: A Bold Step into the Digital Treasury Frontier The reported $2.32 billion Bitcoin acquisition by Trump Media marks a significant and potentially transformative moment for the company. By opting to hold Bitcoin as a Treasury Asset , DJT is embracing a strategy that, while still unconventional, is gaining traction among corporations seeking alternatives to traditional cash reserves. This move could offer substantial benefits if Bitcoin appreciates, potentially enhancing the company’s balance sheet and appealing to a digitally-savvy investor base. However, it also introduces considerable risk due to Bitcoin’s inherent volatility and the evolving regulatory landscape. Investors in both DJT Stock and the broader cryptocurrency market will be watching closely to see how this strategic Crypto Investment unfolds and what impact it ultimately has on Trump Media’s financial future and the perception of corporate Bitcoin adoption. To learn more about the latest Bitcoin and cryptocurrency trends, explore our articles on key developments shaping Bitcoin institutional adoption. This post Trump Media Makes Strategic $2.32 Billion Bitcoin Treasury Move first appeared on BitcoinWorld and is written by Editorial Team",bitcoinworld,https://bitcoinworld.co.in/trump-media-bitcoin-deal/,"BTC|BUSINESS|MARKET|REGULATION|TRADING","Crypto News|BITCOIN|CRYPTOCURRENCY|Investment|Treasury|Trump Media",cryptocompare
2025-05-30T21:48:47.000Z,"FTX Creditors Face Debates Over $5 Billion Payout’s Potential Impact on Crypto Markets","The ongoing distributions to FTX creditors have ignited discussions and concerns about their potential impact on the broader crypto market. The recent $5 billion payout initiated by the FTX Recovery",coinotag,https://en.coinotag.com/ftx-creditors-face-debates-over-5-billion-payouts-potential-impact-on-crypto-markets/,"BTC|ETH|MARKET|FTT","News|BTC|ETH|FTT",cryptocompare
2025-05-30T21:40:25.000Z,"Bitcoin: Chinese Think Tank Sees Opportunity Against US Dollar Dominance","BitcoinWorld Bitcoin: Chinese Think Tank Sees Opportunity Against US Dollar Dominance In a move that has captured the attention of global financial and cryptocurrency markets, a Chinese government-affiliated think tank has reportedly evaluated Bitcoin , the leading digital asset, as a potential reserve asset and even a countermeasure against the long-standing dominance of the US Dollar in the global financial system. This perspective, emerging from within China, a nation known for its stringent stance on decentralized cryptocurrencies, is particularly noteworthy. According to information shared by Solid Intel on X, the think tank’s assessment suggests that Bitcoin “deserves continued attention” in the context of reserve assets, especially amidst ongoing concerns about the pervasive influence and potential risks associated with the US Dollar ‘s hegemony. Why Would a Chinese Think Tank Look at Bitcoin as a Reserve Asset? Understanding the significance of this perspective requires looking at the traditional role of reserve assets and the current global financial landscape. Traditionally, national central banks and governments hold reserve assets to provide economic stability, manage exchange rates, and ensure liquidity in times of crisis. Gold has historically served this purpose, and more recently, the US Dollar has become the preeminent global reserve currency, largely due to the size and stability of the U.S. economy, the depth of its financial markets, and the dollar’s role in international trade. However, the concentration of global finance around a single currency, the US Dollar , also creates dependencies and potential vulnerabilities for other nations. Discussions around ‘de-dollarization’ – efforts by countries to reduce their reliance on the dollar – have been gaining traction, particularly among nations seeking greater economic autonomy or those with geopolitical tensions with the United States. For a Chinese Think Tank , exploring alternatives or complements to the existing dollar-centric system is a strategic consideration. While China has been actively promoting its own currency, the Yuan, for international use and developing its central bank digital currency (CBDC), the digital yuan, looking at independent, decentralized assets like Bitcoin , albeit cautiously, suggests an exploration of all potential avenues in a complex geopolitical and economic environment. Is Bitcoin Truly a Viable Countermeasure Against US Dollar Hegemony? This is where the think tank’s view becomes particularly intriguing and sparks considerable debate. The idea of Bitcoin challenging the US Dollar ‘s global status is a long-term, highly speculative prospect. The US Dollar ‘s dominance is deeply entrenched in global trade, debt markets, and institutional frameworks built over decades. However, Bitcoin possesses unique characteristics that proponents argue could, over time, offer an alternative: decentralization (no single country controls it), scarcity (capped supply of 21 million coins), borderlessness, and censorship resistance. These traits stand in stark contrast to fiat currencies controlled by central banks. The think tank’s perspective likely isn’t suggesting an immediate replacement of the US Dollar with Bitcoin . Instead, it’s more probable they are evaluating Bitcoin as one piece in a broader strategy: As a Hedge: Holding a small portion of reserves in a non-sovereign, decentralized asset could potentially act as a hedge against risks specific to fiat currencies or the existing financial system. As an Alternative System Explorer: Investigating how a decentralized digital currency could function in international transactions or as a store of value outside traditional channels. As a Geopolitical Signal: Even the discussion from a state-affiliated body sends a signal about exploring options and acknowledging the evolving nature of global finance, potentially encouraging other nations or entities to consider alternatives to the US Dollar . It’s crucial to note the significant challenges Bitcoin faces before it could realistically challenge the US Dollar ‘s role, including its price volatility, scalability issues for mass transactions, regulatory uncertainty across different jurisdictions, and the sheer network effect and infrastructure supporting the dollar. China’s Complex Relationship with Digital Currency China’s stance on cryptocurrencies has been famously contradictory. On one hand, the country has implemented strict bans on crypto trading and mining, citing financial stability risks and speculative concerns. This has led many to believe China is outright against decentralized digital assets. On the other hand, China has been a pioneer in developing its own central bank digital currency , the Digital Yuan (e-CNY). This state-controlled digital currency is designed to replace physical cash, enhance domestic payments, and potentially facilitate international transactions under Beijing’s purview. The focus has clearly been on centralized digital money controlled by the state, not decentralized ones like Bitcoin . The fact that a government-affiliated Chinese Think Tank is discussing Bitcoin positively, even as a potential reserve asset or countermeasure, highlights a potential internal nuance or a strategic exploration happening behind the scenes. It suggests that while China suppresses public crypto activity, the strategic implications of decentralized digital assets are still being studied at higher levels, perhaps as a tool in geopolitical and economic strategy rather than a public investment vehicle. What Are the Potential Benefits and Challenges of Bitcoin as a Reserve Asset? Let’s break down the potential upsides and significant hurdles: Potential Benefits: Decentralization: Not controlled by any single government or central bank, offering potential independence from geopolitical influence. Scarcity: Fixed supply makes it potentially inflation-resistant over the long term, unlike fiat currencies which can be printed infinitely. Border-Agnostic: Can be sent and received globally without intermediaries, potentially useful for international transfers or bypassing traditional financial channels. Transparency (Pseudonymous): Transactions are recorded on a public ledger, offering a different type of transparency compared to traditional finance. Significant Challenges: Volatility: Extreme price swings make it a risky store of value for national reserves which prioritize stability. Regulatory Uncertainty: Lack of clear, consistent global regulations creates legal and operational risks for state adoption. Scalability: The network’s current capacity limits its use for high-frequency, large-volume transactions needed for global finance. Security & Custody: Securely storing large amounts of Bitcoin is complex and high-stakes for a nation-state. Energy Consumption: The energy used by the Proof-of-Work consensus mechanism remains a point of criticism and environmental concern. Public Perception & Understanding: Still viewed with skepticism by many traditional finance experts and the general public. What Does This Signal for the Future of Digital Currency and Global Finance? This report from a Chinese Think Tank , while not official government policy, is a significant signal. It indicates that major global powers are seriously considering the implications of decentralized digital currency , even those like China that have been publicly restrictive towards it. It suggests that the conversation around global reserve assets and the future of finance is evolving beyond traditional fiat and gold. While Bitcoin replacing the US Dollar as the primary reserve asset is not on the immediate horizon, the fact that influential bodies are evaluating its potential role, even as a hedge or a component of a diversified reserve strategy, validates its growing importance on the global stage. It reinforces the narrative that digital assets are not just speculative investments but are becoming intertwined with geopolitical and macroeconomic discussions. For investors and observers in the crypto space, this serves as a reminder that the long-term value proposition of Bitcoin extends beyond retail speculation to potential strategic adoption by sophisticated players, including nation-states or state-affiliated entities exploring alternatives in a shifting world order. Conclusion: A Noteworthy Shift in Perspective The evaluation of Bitcoin by a Chinese government-affiliated think tank as deserving attention for its potential role as a reserve asset and a countermeasure against US Dollar hegemony is a development of considerable interest. It highlights the strategic thinking occurring within major global powers regarding the future of finance and the role of decentralized digital currency . While China’s official stance on public crypto remains restrictive and its focus is heavily on the Digital Yuan, this report suggests a deeper, more nuanced internal analysis of Bitcoin ‘s potential utility in a geopolitical context. It underscores the growing recognition of Bitcoin ‘s unique properties, even as significant challenges remain for its widespread adoption as a national reserve asset. This perspective from a Chinese Think Tank adds another layer to the ongoing global debate about de-dollarization, the future of reserve currencies, and the transformative potential of digital assets in shaping the financial landscape of tomorrow. It’s a signal that the conversation around Bitcoin is moving from the fringes into the realm of high-level strategic consideration. To learn more about the latest Bitcoin trends, explore our article on key developments shaping Bitcoin institutional adoption. This post Bitcoin: Chinese Think Tank Sees Opportunity Against US Dollar Dominance first appeared on BitcoinWorld and is written by Editorial Team",bitcoinworld,https://bitcoinworld.co.in/bitcoin-chinese-think-tank/,"ASIA|BTC|FIAT|MARKET|TRADING","Crypto News|BITCOIN|CHINA|CRYPTOCURRENCY|Finance|Geopolitics",cryptocompare
2025-05-30T21:34:02.000Z,"Metaplanet and K33 Deepen Bitcoin (BTC) Exposure With Strategic Initiatives","In a strategic move to accelerate its Bitcoin acquisition goals, Japan-based Metaplanet issued $21 million in interest-free bonds to the Evo Fund on May 29, following a separate $50 million raise the previous day. These zero-coupon bonds, known as the 17th series, come with a $525,000 face value and are set to mature on November 28, 2025. As they bear no interest, Metaplanet avoids additional financial costs tied to borrowing. Metaplanet Adds to Bitcoin Warchest According to the official document , the terms allow Evo Fund to initiate early redemptions with a five-day notice, either in full or in multiples of $525,000. Additionally, redemptions may be linked to future funding rounds with the same investor. The bonds are unsecured, with no guarantees or administrators, which is in line with Japanese corporate law. Payment processing will take place at the company’s Tokyo office. This fundraising effort contributes to Metaplanet’s larger goal of amassing 10,000 BTC by the end of 2025. Year-to-date, the company has raised $135.2 million, including previous rounds in February ($25.9 million), March ($13.3 million), and earlier in May ($25 million). Currently holding approximately 7,800 BTC, worth around $840 million, Metaplanet ranks 11th among global corporate Bitcoin holders, with an average purchase price of $91,340 per BTC. In March, it used cash-secured put options to acquire 696 BTC, followed by an additional 145 BTC in April for $13.6 million. Metaplanet isn’t the only company doubling down on Bitcoin. In Scandinavia, K33 is taking a similar approach. K33 Joins Corporate Bitcoin Trend K33, the Oslo-based cryptocurrency brokerage company, announced plans to begin holding Bitcoin on its balance sheet after raising 60 million SEK ($6.22 million). As per the announcement on May 28th, the funding was secured via interest-free convertible loans and a new round of share and warrant issuances. The Norwegian firm confirmed that 100% of the funds will be used to buy Bitcoin, possibly acquiring up to 57 BTC at current prices. The firm secured 45 million SEK ($4.66 million) through loans maturing in June 2028, and 15 million SEK ($1.5 million) via equity and warrants. Investors converting their warrants before March 2026 will be granted additional free warrants, which would potentially allow K33 to raise a total of 75 million SEK ($7.77 million). In its Q1 financial update, CEO Bull Jenssen said K33 is partnering with other Nordic Bitcoin treasury firms and intends to leverage its holdings to create Bitcoin-based services, including collateralized lending. The post Metaplanet and K33 Deepen Bitcoin (BTC) Exposure With Strategic Initiatives appeared first on CryptoPotato .",cryptopotato,https://cryptopotato.com/metaplanet-and-k33-deepen-bitcoin-btc-exposure-with-strategic-initiatives/,"BTC|BUSINESS|MARKET|REGULATION|TRADING","AA News|BTCEUR|BTCGBP|BTCUSD|BTCUSDT|Crypto News|Bitcoin|Metaplanet",cryptocompare
2025-05-30T21:31:58.000Z,"FARTCOIN PRICE ANALYSIS & PREDICTION (May 30) – Fartcoin Breaks Down After Posting 25% Losses Weekly, Bearish in Play","After rising by almost 10x in nine weeks, Fartcoin saw a sharp rejection and halted bullish last week. This triggered a significant decline over the past week and now appears highly bearish amid the latest breakdown. Considered as one of the most recovered assets during the last buying phase, Fartcoin recorded a mind-blowing gain and reached its highest level of $1.6 for the first time in four months. While that brought a good return on investment within a short period, major holders booked profits, and the price slipped. That action led to a steady dump as Bitcoin loses traction this week, and the price dipped to a daily low of $1.08. There’s hope for a rebound daily as the trend remains in favour of the bulls in the short term. However, looking at the recent breakdown in the bullish structure on the 4-hour chart, the trading landscape appears to have changed in favour of bears. As we can see on the daily chart, they are currently in charge of the market. In fact, more dips may surface with no signs of interceptions. Technically, the bulls are currently off the market. If they return with a major push above the current monthly high, we can anticipate another rally to a new multi-month high. But for now, they are taking a break. FARTCOIN’s Key Levels to Watch Source : Tradingview A slight price recovery may bring a retest at the breakdown level of $1.2 before resuming selling. If the market pushes above this level, it may reclaim the $1.646 resistance with a potential break up to $2 and $2.74. The target support levels to watch in the latest dip are $0.95 and $0.645. If these levels fail to contain pressure, $0.355 would be the next level to keep in mind. Key Resistance Levels: $1.646, $2, $2.74 Key Support Levels: $0.95, $0.645, $0.355 Price: $1.1 Trend: Bullish Volatility: Low Disclosure: This is not trading or investment advice. Always do your research before buying any cryptocurrency or investing in any services. Follow us on Twitter @nulltxnews to stay updated with the latest Crypto, NFT, AI, Cybersecurity, Distributed Computing, and Metaverse news !",themerkle,https://nulltx.com/fartcoin-price-analysis-prediction-may-30-fartcoin-breaks-down-after-posting-25-losses-weekly-bearish-in-play/,"BTC|MARKET|TRADING|ZRX|RESEARCH","Market Analysis|$FARTCOIN",cryptocompare
