datetime,headline,summary,source,url,categories,tags,api_source
2025-05-30T21:14:07.000Z,"The Once Largest Cryptocurrency Exchange Got Off Light: They Repelled the North Korean Attack","BitMEX, once one of the largest options trading platforms in the cryptocurrency world, announced that it successfully prevented a social engineering attack by the famous hacker group Lazarus, which has links to North Korea. The company said in a statement regarding the attack that not only was the attempt unsuccessful, but also that important information was obtained by reverse engineering the mechanism behind the attack. BitMEX reported that the attack began when one of its employees received a proposal for a Web3 project on LinkedIn with the theme of “NFT Marketplace.” The aim was to infiltrate the system by convincing the employee to run a code containing malware. However, when the employee reviewed the code repository, he noticed suspicious statements and reported the situation to the BitMEX security team. The technical analysis revealed clues to the Lazarus Group’s tracking methods and operational vulnerabilities. BitMEX revealed that the attackers were attempting to reuse the malicious code called “BeaverTail”, which was previously attributed to Lazarus by Unit 42 of Palo Alto. Related News: BREAKING NEWS: Meta (Facebook) Shareholders Reject Proposal to Add Bitcoin to the Company's Treasury! Here Are the Details The BitMEX team stated that the attack scenario was based on the goal of collecting user IP addresses and passwords and saving them in a database, but the attackers made an operational error and revealed the original IP addresses. In light of this information, special software was created and regular queries were sent to the database, and at least 10 of the test or development accounts used by the attackers were detected. BitMEX stated that they observed that the Lazarus Group was divided into subgroups with different technical competencies, and pointed out that although the basic phishing methods used in the campaign were weak, the subsequent attack processes were advanced. This development comes after Coinbase suffered a massive data breach a few weeks ago that could have potentially cost it $400 million. *This is not investment advice. Continue Reading: The Once Largest Cryptocurrency Exchange Got Off Light: They Repelled the North Korean Attack",bitcoinsistemi,https://en.bitcoinsistemi.com/the-largest-cryptocurrency-exchange-got-off-light-they-repelled-the-north-korean-attack/,"ASIA|BTC|EXCHANGE|MARKET|TRADING","Exchange|News",cryptocompare
2025-05-30T21:10:27.000Z,"Unlock Savings: AI Trivia Countdown for Bitcoin World Sessions AI","BitcoinWorld Unlock Savings: AI Trivia Countdown for Bitcoin World Sessions AI Are you ready to merge your interest in the future of technology with a chance to save big? As the highly anticipated Bitcoin World Sessions: AI event approaches, there’s a unique opportunity to test your AI knowledge and score a fantastic deal on admission. This isn’t just about attending a premier tech event ; it’s about proving your understanding of the AI landscape and being rewarded for it. Put Your AI Knowledge to the Test With the clock ticking down to the Bitcoin World Sessions: AI event on June 5th at UC Berkeley’s Zellerbach Hall, we’re launching the TC Sessions: AI Trivia Countdown. This is your chance to showcase what you know about the artificial intelligence industry. Think you know the answer to questions like, “Which AI technology powers self-driving cars?” or “What percentage of global startups use AI in their products today?” If so, this quiz is for you. Win Big with AI Trivia Participating in the AI trivia is simple and offers a significant reward. Answer a few short, AI-specific questions correctly, and you could win a special discount code. This code allows you to purchase one ticket to Bitcoin World Sessions: AI at a low flat rate of $200 and receive a second ticket for free. That’s two tickets for the price of one! Here’s how to participate: Fill out the AI trivia form. Check your email to see if you’ve won the special code. Register your winning code on the TC Sessions: AI ticket page. This special trivia deal is only available for a limited time. The trivia countdown closes on June 4th, so you need to act fast to get your shot at winning. Don’t Miss Bitcoin World Sessions AI Winning the trivia is a great way to attend the main event. The Bitcoin World Sessions AI conference on June 5th brings together leaders from the AI and venture capital worlds. You’ll hear from experts at companies like OpenAI, Anthropic, Khosla Ventures, and more. The day is packed with valuable content, including expert insights, hands-on workshops, and opportunities for high-impact networking. Even if you don’t win the trivia, other savings opportunities are available until June 4th. You can save $300 on your ticket and get 50% off a second ticket. These deals are designed to make attending this premier AI conference accessible. Why Attend This Premier Tech Event ? Attending the Bitcoin World Sessions: AI is an investment in understanding the future. AI is rapidly transforming industries, and this tech event provides a platform to learn directly from the innovators and investors shaping this change. Whether you’re a founder, investor, developer, or simply interested in the intersection of AI and technology, the insights gained here will be invaluable. The special ticket deals disappear when the event doors open on June 5th. Secure your spot now to gain access to a full day of learning and connection. Putting your AI knowledge to the test could lead to significant savings on your ticket to Bitcoin World Sessions: AI. The AI Trivia Countdown offers a fun and rewarding way to secure your entry. Don’t miss this opportunity to save money while preparing for a day of learning and networking at this key industry event. To learn more about the latest AI market trends, explore our article on key developments shaping AI features. This post Unlock Savings: AI Trivia Countdown for Bitcoin World Sessions AI first appeared on BitcoinWorld and is written by Editorial Team",bitcoinworld,https://bitcoinworld.co.in/bitcoin-world-ai-trivia/,"BTC|BUSINESS|MARKET|MINING|TECHNOLOGY","AI News|AI|Bitcoin World Sessions AI|Startups|TC Sessions AI|Tech Event",cryptocompare
2025-05-30T21:00:40.000Z,"Bitcoin Seeks Support Amid $3.7 Billion Open Interest Reset, Possibility of Rebounding Above $100,000","Bitcoin’s recent price fluctuations highlight a crucial recalibration in the cryptocurrency market, emphasizing support levels and trader sentiment. The market’s dynamics are shifting as analysts observe a balanced approach to",coinotag,https://en.coinotag.com/bitcoin-seeks-support-amid-3-7-billion-open-interest-reset-possibility-of-rebounding-above-100000/,"BTC|MARKET|TRADING","Analysis|News|BTC",cryptocompare
2025-05-30T21:00:30.000Z,"Secure Your Spot: AI Event at Bitcoin World Sessions Approaches","BitcoinWorld Secure Your Spot: AI Event at Bitcoin World Sessions Approaches The future of technology is rapidly evolving, and understanding Artificial Intelligence is crucial, especially for those navigating the dynamic world of cryptocurrency and blockchain. The convergence of AI and crypto presents immense opportunities and challenges. Are you ready to delve into the real conversations shaping this intersection? The highly anticipated AI Event , Bitcoin World Sessions: AI, is just days away, offering an unparalleled opportunity to gain unfiltered insights directly from industry pioneers. AI Event Approaches: Unfiltered Conversations Await June 5th marks the date for Bitcoin World Sessions: AI at UC Berkeley’s Zellerbach Hall. This isn’t just another surface-level discussion; it’s a deep dive into the core truths of AI. The event promises real, unfiltered conversations, moving beyond the hype to explore the actual building, thinking, and investing shaping the future of AI. It’s a critical gathering for anyone serious about understanding the technological landscape that increasingly impacts all sectors, including digital assets. What to Expect at This Premier AI Conference The agenda for this leading AI Conference is packed with critical topics and visionary speakers. Attendees will gain insights on: The Frontier of AI: A fireside chat with Anthropic’s Jared Kaplan. From Seed to Series C: Understanding what Venture Capital AI investors look for in founders. Strategies for founders building on existing foundation models. Tactics for launching and succeeding against large incumbents. Hard talk on AI Ethics and Safety. These sessions are designed to provide tactical knowledge and bold perspectives from leaders at the forefront of AI development and investment. Exploring the full agenda reveals a day dedicated to actionable insights and answering big questions. Connecting with AI Startups and Venture Capital Networking is a key component of Bitcoin World Sessions: AI. Whether you are pitching your AI Startups , seeking collaboration, or simply looking to connect with like-minded individuals, the event facilitates meaningful interactions. The Braindate app helps match attendees based on shared interests, making networking smarter and more efficient. Beyond the main event, Side Events throughout the week in Berkeley provide continued opportunities for conversations and connections. This is a prime environment to meet potential investors, co-founders, or collaborators in the AI and tech space, including those interested in the intersection with crypto. Shaping the Future of AI The discussions at Bitcoin World Sessions: AI are not just academic; they are about actively shaping the Future of AI . Hearing from power players like those from OpenAI, Google Cloud Startups, Twelve Labs, Khosla Ventures, Toyota, DeepMind, and Odyssey provides a direct line to the people building this future. Their insights cover everything from technical breakthroughs to investment strategies and ethical considerations. Being present means participating in the dialogue that will define the next era of technology. Secure Your Spot: Don’t Miss the Savings Deadline Time is running out to get the best rate for this essential AI Event . With just 6 days left until June 5th, ticket prices are set to increase significantly when the doors open. You can currently save $300 on your pass and get a 50% discount for a +1. This low-rate deal is available only through June 4th. Don’t wait for rates to spike; register now to lock in your savings and ensure your participation in these critical discussions. For those feeling confident in their knowledge, an AI trivia contest offers a chance for an even deeper discount, potentially scoring two tickets for the price of one ($200 total), but this special trivia deal also ends June 4th. Bitcoin World Sessions: AI is where the noise drops out and the real conversations begin. Don’t sit this one out; be part of the community driving the future of AI. Register now. To learn more about the latest AI market trends, explore our article on key developments shaping AI features. This post Secure Your Spot: AI Event at Bitcoin World Sessions Approaches first appeared on BitcoinWorld and is written by Editorial Team",bitcoinworld,https://bitcoinworld.co.in/secure-ai-event-spot/,"BTC|BUSINESS|MARKET|TECHNOLOGY|TRADING","AI News|AI|Events|Startups|Technology|VENTURE CAPITAL",cryptocompare
2025-05-30T21:00:00.000Z,"Bitcoin drop to $100K likely, but futures market reset means dips won’t last long","Bitcoin’s chance of falling to $100,000 has increased, but the $3.7 billion open interest wipeout means traders will view dips as buying opportunities.",cointelegraph,https://cointelegraph.com/news/bitcoin-drop-to-100k-likely-but-futures-market-reset-means-dips-won-t-last-long?utm_source=rss_feed&utm_medium=rss&utm_campaign=rss_partner_inbound,"BTC|MARKET","",cryptocompare
2025-05-30T20:54:41.000Z,"Bitcoin Whales Surge Amidst Exchange Inflows, Hinting at Potential Market Shift and Correction Risks","Bitcoin whales are asserting their dominance in exchange activity, with recent metrics indicating a potential shift in market behavior. The surge in whale influence could herald a move from accumulation",coinotag,https://en.coinotag.com/bitcoin-whales-surge-amidst-exchange-inflows-hinting-at-potential-market-shift-and-correction-risks/,"BTC|EXCHANGE|MARKET","Analysis|News",cryptocompare
2025-05-30T20:50:33.000Z,"Hyperliquid Whale Opens Massive $46.1M Bitcoin Long Position","BitcoinWorld Hyperliquid Whale Opens Massive $46.1M Bitcoin Long Position Get ready to dive into the deep end of the crypto market because a significant move just happened on Hyperliquid! A well-known whale in the crypto space, identified as James Wynn by crypto observer @EmberCN, has reportedly opened a truly massive Bitcoin (BTC) long position. This isn’t just any trade; it’s a staggering $46.1 million position utilizing 40x leverage. Let’s break down what this means and why it’s catching the attention of traders everywhere. What Does a $46.1M Bitcoin Long Position Signify? When someone opens a long position on an asset like Bitcoin, they are essentially betting that the price of that asset will go up. A $46.1 million position is colossal by any standard, but especially so when we consider the platform and the leverage involved. On a decentralized perpetual exchange like Hyperliquid, such a large trade can have various implications, from signaling bullish sentiment to potentially influencing market dynamics, at least in the short term. This specific trade has the following key details: Position Size: $46.1 million USD equivalent Asset: Bitcoin (BTC) Leverage: 40x Entry Price: $105,560 Liquidation Price: $102,713 The difference between the entry price and the liquidation price is relatively small due to the high leverage. This highlights the inherent risk involved, which we’ll discuss further. Understanding Crypto Leverage : High Rewards, Higher Risks Leverage in crypto trading allows traders to control a large position with a relatively small amount of capital. In this case, 40x leverage means that for every dollar the whale put down, they are controlling $40 worth of Bitcoin. While this amplifies potential profits if the price moves favorably, it also dramatically increases the risk of liquidation. Think of leverage like a double-edged sword: Potential Benefit: A small price increase can lead to significant percentage gains on the initial capital invested. If BTC goes up even slightly from the entry price, the profit on $46.1 million is magnified 40 times relative to the margin used. Significant Challenge: A small price decrease can lead to rapid and complete loss of the initial capital. With 40x leverage, a price drop of just a few percent from the entry price can wipe out the entire position. The liquidation price of $102,713, being only about 2.7% below the entry of $105,560, starkly illustrates this risk. High leverage is a common tool in aggressive trading strategies, but it requires precise timing and significant conviction, or potentially sophisticated hedging strategies that aren’t visible on-chain. Who is the Hyperliquid Whale and Why Does it Matter? While the identity of “James Wynn” in the context of being a whale is tied to this specific reported trade by @EmberCN, the term “whale” in crypto refers to an individual or entity holding a very large amount of a particular cryptocurrency or having significant capital for trading. Whale movements are often tracked because their large trades have the potential to impact market liquidity and price, especially on specific platforms. On platforms like Hyperliquid, which are known for high leverage trading and perpetual futures, whale activity can be particularly impactful. Their trades, whether long or short, can add significant volume and open interest, potentially influencing price discovery or setting up large liquidation cascades if the market moves against them. Monitoring whale activity is a common practice in crypto trading , though it’s crucial not to blindly follow these moves. Whales have different goals, capital sizes, and risk tolerances than most retail traders. This particular trade could be part of a larger strategy, a hedge against other positions, or a high-conviction directional bet. Impact on BTC Price : What Could Happen Next? A large long position like this, while significant, is just one factor in the complex global Bitcoin market. However, its presence on Hyperliquid, a platform favored by sophisticated traders, is noteworthy. If Bitcoin’s price begins to rise, this position will become increasingly profitable, and the whale might choose to add to it or hold, adding bullish pressure. Conversely, the existence of a large liquidation price at $102,713 creates a potential target for market makers or other large traders. If the price drops towards this level, it could trigger the liquidation of this massive $46.1 million position. A liquidation of this size involves the platform automatically closing the position, which can add selling pressure to the market, potentially pushing the BTC price down further and potentially triggering other liquidations. Therefore, this trade adds a layer of volatility potential to the market around the $102,713 level. Traders are now aware that a move below this point could see increased selling activity as the position is unwound. Lessons for Your Own Crypto Trading Strategy Observing whale trades on platforms like Hyperliquid offers valuable insights, but it also serves as a powerful reminder about the nature of high-stakes crypto trading : Understand Leverage: This example clearly shows the power and danger of high leverage . Never use leverage you don’t fully understand, and always be aware of your liquidation price. Most retail traders should use leverage cautiously, if at all. Risk Management is Key: A whale might have deep pockets or complex strategies to manage risk, but for the average trader, setting stop-losses and managing position size relative to your total capital is crucial. Don’t risk more than you can afford to lose. Whales Aren’t Always Right: While whale movements are interesting, they are not infallible. This position could get liquidated. Base your trading decisions on your own analysis and risk tolerance, not just on what a whale is doing. Market Structure Matters: Large positions like this become part of the market structure. Knowing where potential liquidation levels exist can be useful information for anticipating potential volatility points in the crypto market . In Conclusion: A Bold Bet on Bitcoin’s Future The reported $46.1 million, 40x leveraged Bitcoin long position opened by a whale on Hyperliquid is a bold statement in the market. It signifies a strong bullish conviction at the entry price of $105,560 but comes with an extremely tight margin for error, highlighted by the liquidation price at $102,713. This trade underscores the high-stakes nature of leveraged perpetual trading and the potential impact large players can have on market dynamics, particularly around key price levels that could trigger liquidations. While fascinating to observe, it serves as a critical lesson for all traders on the importance of understanding crypto leverage, managing risk diligently, and forming independent crypto trading strategies rather than simply following the moves of market giants. To learn more about the latest Bitcoin trends and crypto trading strategies, explore our articles on key developments shaping Bitcoin price action . This post Hyperliquid Whale Opens Massive $46.1M Bitcoin Long Position first appeared on BitcoinWorld and is written by Editorial Team",bitcoinworld,https://bitcoinworld.co.in/hyperliquid-whale-bitcoin-long/,"BTC|BUSINESS|MARKET|TRADING|ZRX","Crypto News|BITCOIN|Hyperliquid|Leverage|trading.|Whales",cryptocompare
2025-05-30T20:48:47.000Z,"Bitcoin Price Prediction: BTC Slips Below $105K as Global Policies Shif","Reform UK leader Nigel Farage made waves at the Bitcoin 2025 conference by announcing that the party will now accept Bitcoin and other cryptocurrencies as donations. This makes Reform UK the first major British party to accept digital assets, partnering with Radom, a leading crypto payments platform. Farage also revealed plans for a “Cryptoassets and Digital Finance Bill” if his party wins the next UK election, to be enacted before 2029. Key proposals include reducing the crypto capital gains tax from 24% to 10%, establishing a Bitcoin reserve at the Bank of England, and opposing the introduction of a UK central bank digital currency (CBDC). 'We are going to launch a crypto revolution in Britain.' Reform UK Leader Nigel Farage has unveiled a new initiative — the Crypto Assets and Digital Finance Bill — which his party has drafted and will actively campaign for. pic.twitter.com/uiAD5eQihq — GB News (@GBNEWS) May 29, 2025 Farage’s experience of being debanked has led to this crypto-friendly stance, which could resonate with the estimated 7 million UK crypto holders, especially the 25% under 30. India’s Regulatory Shift Could Change the Crypto Landscape India is set to release a discussion paper on crypto regulation in June 2025, marking a significant milestone in its stance on digital assets. This paper will incorporate inputs from the FSB and IMF, and will involve stakeholders from the IT and finance sectors. While the Reserve Bank of India is cautious and promoting its CBDC as a safer alternative, the global trend of regulatory acceptance, including pro-crypto comments from US Vice President J.D. Vance, suggests India may soften its stance. Clarity on India’s crypto policies could boost institutional and retail confidence, making Bitcoin more resilient. New York’s “Bitbond” Plan and Technical View on Bitcoin At Bitcoin 2025, New York City Mayor Eric Adams announced plans to issue a Bitcoin-backed municipal bond, the “Bitbond”, where investors can earn returns tied to Bitcoin’s performance. He also renewed calls to scrap New York’s BitLicense, saying it stifles innovation. LATEST: New York Mayor Eric Adams calls for a Bitcoin bond in NYC and an end to the state BitLicense program. pic.twitter.com/ZcGf9NhrmX — Cointelegraph (@Cointelegraph) May 29, 2025 “You have a crypto mayor,” he said, vowing to make the city more crypto-friendly. This could attract institutional interest and increase the likelihood of long-term Bitcoin adoption. Bitcoin Price Prediction – Technical Outlook On the technical front, the Bitcoin price prediction is bearish. On the 2-hour chart, BTC/USD is in a descending channel with lower highs and lower lows. The 50-period EMA acts as resistance, and the MACD exhibits deep red histograms and a bearish signal line crossover. A “Three Black Crows” pattern is strong bearish. Support is at $102,168, and resistance is near $106,655. If BTC breaks $102,168, it could test $100,799 or $99,356. A bullish reversal – a hammer or morning star pattern, with MACD divergence and EMA crossover – could take it back to $106,655. Best Wallet ($BEST): The Future of Crypto Storage and Access Best Wallet is capturing the spotlight as one of the hottest crypto projects, blending security, accessibility, and early-stage opportunities. With a sleek interface available on Google Play and the App Store, it supports over 1,000 cryptocurrencies. As the first wallet to integrate Fireblocks MPC-CMP technology, it’s already ahead of the curve in wallet innovation. Key features include an Upcoming Tokens page that allows users to buy presale tokens directly within the app, without the need to connect wallets to potentially risky sites. This seamless integration enables users to track token growth within their portfolio, all while benefiting from Fireblocks-backed security and a no-KYC sign-up process. The $BEST Token isn’t just a utility; it’s a game-changer. It unlocks reduced transaction fees, higher staking yields, and exclusive early access to projects. Holders even receive governance rights, shaping the future direction of the Best Wallet ecosystem. Additionally, the platform’s airdrop campaigns and quests provide further earning opportunities for loyal users. With over $12.85 million raised in its presale and tokens priced at $0.025105, now is the time to act. Secure your $BEST allocation before the next price jump, and gain early access to a wallet that’s redefining how crypto enthusiasts and investors interact with digital assets. The post Bitcoin Price Prediction: BTC Slips Below $105K as Global Policies Shif appeared first on Cryptonews .",cryptonews,https://cryptonews.com/news/bitcoin-price-prediction-btc-slips-below-105k-as-global-policies-shif/,"BTC|BUSINESS|FIAT|REGULATION|TRADING","Price Analysis|Bitcoin|Cryptocurrency",cryptocompare
2025-05-30T20:45:05.000Z,"BREAKING NEWS: Meta (Facebook) Shareholders Reject Proposal to Add Bitcoin to the Company's Treasury! Here Are the Details","According to the latest development, Meta (formerly Facebook) shareholders have rejected the proposal to consider adding Bitcoin to the company's treasury. The decision to reject the proposal was taken with 8.85 million abstentions, 4.9 billion votes against and 3.9 million votes in favour. Image showing the result of a vote among Meta shareholders. *This is not investment advice. Continue Reading: BREAKING NEWS: Meta (Facebook) Shareholders Reject Proposal to Add Bitcoin to the Company's Treasury! Here Are the Details",bitcoinsistemi,https://en.bitcoinsistemi.com/breaking-news-meta-facebook-shareholders-reject-proposal-to-add-bitcoin-to-the-companys-treasury-here-are-the-details/,"BTC|REGULATION","Bitcoin|News",cryptocompare
