datetime,headline,summary,source,url,categories,tags,api_source
2025-07-12T20:26:00,"Cardano price prediction 2025-2031: Will ADA recover to $3 soon?","Key takeaways : Cardano’s price is expected to surpass $0.7827 in 2025. By 2028, ADA/USD could decline and reach $2.63. By 2031, Cardano might reach a maximum price of $8.61 Cardano is a third-generation blockchain platform launched in 2017 by Ethereum co-founder Charles Hoskinson. Designed for decentralized applications and smart contracts, it uses Ouroboros—a unique, energy-efficient Proof of Stake consensus mechanism. Cardano’s two-layer architecture separates transactions from smart contracts, enhancing scalability and flexibility. Its native cryptocurrency, ADA, is used for transaction fees, staking, and governance, allowing holders to influence the platform’s future. Emphasizing a research-driven, peer-reviewed development approach, Cardano aims to tackle blockchain challenges like scalability and sustainability, making it a strong alternative to platforms like Ethereum. Perhaps you’re wondering: with its innovative technology, can Cardano’s ADA reach new all-time highs soon? Let’s uncover what the future holds for Cardano. Overview Cryptocurrency Cardano Token ADA Price $0.7066 Market Cap $21 Billion Trading Volume (24-hour) $677 Million Circulating Supply 45 Billion ADA All-time High $3.10 on Sept 02, 2021 All-time Low $0.01735 on Oct 01, 2017 24-hour High $0.7427 24-hour Low $0.6902 Cardano price prediction: Technical analysis Metric Value Volatility 8.23% 50-day SMA $ 0.669534 14-Day RSI 47.74 Sentiment Bearish Fear & Greed Index 74 (Greed) Green Days 14/30 (47%) Cardano ADA recovers slightly ADA price analysis 1-day chart ADAUSD chart by TradingView Cardano (ADA) has shown a strong bullish rebound on the 1-day chart on. J, climbing to approximately $0.71. The RSI stands at 66.28, suggesting increasing bullish momentum but also approaching the overbought threshold, which often precedes short-term consolidation. The MACD remains positive, with the MACD line above the signal line, indicating sustained upward pressure. Bollinger Bands have widened with the price testing the upper band, reinforcing a volatile breakout move. If ADA maintains this strength, it could challenge the next resistance near $0.75 to $0.80. However, any pullback might retest the $0.68 zone as support before continuation or correction. ADA price analysis 4-hour chart ADAUSD chart by TradingView Based on the 4-hour chart of Cardano (ADA), the price has demonstrated a strong recovery, trading near $0.705. The Bollinger Bands show expansion with ADA testing the upper band, signaling bullish volatility. The Balance of Power (0.83) favors buyers, suggesting dominance of bullish sentiment. However, the MACD histogram reveals some waning momentum as the MACD line dips slightly below the signal line, hinting at short-term indecision. Despite this, the overall structure supports a continuation of the uptrend if ADA holds above $0.68. Failure to maintain momentum could trigger a correction toward the middle Bollinger Band near $0.67 for support. ADA technical indicators: Levels and action Daily simple moving average (SMA) Period Value ($) Action SMA 3 $ 0.591013 SELL SMA 5 $ 0.604081 SELL SMA 10 $ 0.586336 SELL SMA 21 $ 0.598662 SELL SMA 50 $ 0.669534 SELL SMA 100 $ 0.677483 SELL SMA 200 $ 0.612612 SELL Daily exponential moving average (EMA) Period Value ($) Action EMA 3 $ 0.611091 SELL EMA 5 $ 0.635019 SELL EMA 10 $ 0.654165 SELL EMA 21 $ 0.669998 SELL EMA 50 $ 0.710588 SELL EMA 100 $ 0.747892 SELL EMA 200 $ 0.722727 SELL What to expect from Cardano price analysis next Based on both the 4-hour and 1-day charts, Cardano (ADA) is showing signs of bullish continuation with strong momentum building. On the 1-day chart, ADA has reclaimed the $0.70 zone and broken through the upper Bollinger Band, signaling heightened volatility and buyer strength. The RSI at 66.28 suggests ADA is approaching overbought territory but still has room to run. On the 4-hour chart, buyers remain in control, supported by a high Balance of Power (0.83) and expanding Bollinger Bands. If bulls sustain pressure above $0.68, ADA may target $0.75 next. A break below $0.68 could invite consolidation or retracement. Is Cardano a good investment? Cardano (ADA) presents a mixed investment opportunity. It is a third-generation blockchain that aims to solve scalability issues and enhance security through its Proof-of-Stake mechanism. While some analysts predict significant price increases by 2030, others caution that it remains a high-risk investment due to the volatile nature of the crypto market. Investors should consider their risk tolerance and research before investing, as Cardano’s future performance is uncertain and contingent on market conditions and technological advancements. What will Cardano be worth in 2025? ADA might reach a maximum price of $5.97, with an average trading price of about $5.17 and a minimum price of $5.03. What will Cardano be worth in 2030? In 2030, ADA’s average forecast price could be $5.82. Its minimum and maximum trading price is expected to be $5.63 and $6.75, respectively. What is the Cardano forecast for 2040? Predicting Cardano’s (ADA) price in 2040 is highly speculative as it depends on multiple factors, including adoption, regulatory developments, technological advancements, and macroeconomic conditions. However, if Cardano continues its development in smart contracts, decentralized applications (dApps), and blockchain efficiency, it could see widespread adoption, driving its price higher. Some optimistic projections suggest that ADA could reach double-digit prices, possibly ranging from $10 to $50 or more, if the cryptocurrency market continues to expand and Cardano establishes itself as a leader in blockchain technology. However, in a bearish scenario, where regulatory hurdles and competition slow its progress, ADA could struggle to maintain high valuations. What will be the future price of Cardano in 2050? Predicting Cardano’s (ADA) price in 2050 is highly speculative, but if blockchain adoption continues to grow and Cardano successfully scales its smart contract ecosystem, its price could see significant appreciation. In a bullish scenario, ADA could reach $50 to $100 or even higher if it becomes a dominant blockchain platform with real-world utility in finance, governance, and enterprise solutions. However, in a bearish scenario where adoption stagnates or regulations hinder growth, ADA could remain below $10. The price will depend on mass adoption, technological advancements, global regulations, and overall cryptocurrency market trends over the coming decades. Will Cardano recover? Cardano’s recovery potential depends on market sentiment and adoption. Despite past challenges, its projected price increase in 2025, potentially reaching $1, has significantly bolstered confidence in the coin’s future. Will Cardano reach $5? Based on our analysis, Cardano will reach $5 by 2030, with a forecasted range of around $5.97. This projection is driven by Cardano’s continued technological advancements, growing adoption, strategic partnerships, and increasing market confidence, indicating a positive long-term growth trajectory for the cryptocurrency market. Will Cardano reach $10? ADA is predicted to reach $7.33 by 2031. By this time, the coin is expected to attain a maximum price of $8.61. Will Cardano reach $50? Cardano is trading around $0.5823, with an all-time high of $2.80 in early 2021. While not impossible, reaching $50 in the next few years is highly uncertain. Does Cardano have a good long-term future? Cardano (ADA) has the potential for a positive long-term future, primarily driven by its technological advancements and growing ecosystem. Predictions indicate that by 2030, Cardano could see significant growth, with estimates suggesting a rise to around $6.75. The platform’s unique features, such as its focus on scalability and partnerships with various institutions, position it well for future adoption. However, its success will depend on overcoming regulatory scrutiny and developer engagement challenges. Recent news/opinion on Cardano Cardano has taken a major step toward decentralized governance with the enactment of its Constitution, as highlighted in Messari’s Q1 report. The report notes active DRep participation, a 30% rise in stablecoin market cap, a 13% increase in DeFi diversity score, and a 5% growth in treasury balance (ADA). This milestone marks Cardano’s commitment to community-driven governance, positioning it as a leader in blockchain innovation. Messari’s new report highlights a big step for Cardano: the Constitution is live, and community governance has begun with active DReps now in the process. https://t.co/Z3P2zbafWi — Cardano Community (@Cardano) May 22, 2025 Cardano price prediction July 2025 As for July 2025, Cardano price is expected to lowest at $0.5712. Given the average expected price of $0.6314 , the ADA price may rise to $0.6494 at maximum. Cardano Price Prediction Potential Low Potential Average Potential High Cardano price prediction July 2025 $0.5712 $0.6314 $0.6494 Cardano price prediction 2025 According to the Cardano price prediction, ADA might reach a maximum price of $0.7827, with an average trading price of about $0.7248 and a minimum price of $0.7007. Cardano Price Prediction Potential Low Potential Average Potential High Cardano price prediction 2025 $0.7007 $0.7248 $0.7827 Cardano price predictions 2026-2031 Year Minimum Price Average Price Maximum Price 2026 $1.04 $1.07 $1.22 2027 $1.52 $1.58 $1.80 2028 $2.36 $2.43 $2.63 2029 $3.46 $3.56 $4.14 2030 $5.03 $5.17 $5.97 2031 $7.33 $7.59 $8.61 Cardano price prediction 2026 The Cardano market price is expected to peak at $1.22 in 2026. However, it might fall to $1.04, with an average of $1.07. Cardano price prediction 2027 The price for Cardano is predicted to decline and reach a maximum value of $1.80 in 2027. On the lower end, ADA is expected to trade at $1.52, with an average of $1.58. Cardano price prediction 2028 Traders can expect an average trading price of $2.43, with minimum and maximum prices of $2.36 and $2.63, respectively, in 2028 Cardano price forecast 2029 Cardano is expected to reach an all-time high of $4.14 by 2029. However, it could fall to $3.46 with an average price of $3.56. Cardano price prediction 2030 In 2030, ADA’s average forecast price could be $5.17. Its minimum and maximum trading price is expected to be $5.03 and $5.97, respectively. Cardano price prediction 2031 In 2031, Cardano Ada’s price is expected to reach a maximum of $8.61, an average of $7.59, and a minimum of $7.33. Cardano price prediction 2025-2031 Cardano price prediction: Analysts’ ADA price prediction Firm Name 2025 2026 DigitalCoinPrice $1.29 $1.47 Coincodex $ 0.806931 $ 0.679118 Cryptopolitan’s Cardano price prediction According to Cryptopolitan projections, the price of ADA could reach a maximum of $0.824 in 2025. By 2026, Cardano’s price could trade at a maximum of $1.264 Cardano’s historic price sentiment Cardano price history / Coingecko Cardano was founded in 2015 and went live in 2017. It initially gained investor support and popularity for being affordable and environmentally friendly due to its unique PoS mechanism called Ouroboros. In 2021, Cardano implemented the smart contract feature with the Alonzo update. This update came on the ADA test network and brought the interoperability and scalability that was promised to the users earlier. The ADA price reached its all-time high during the bullish cycle of 2021 when it hit $3.09. However, its price started plummeting at the beginning of September 2021 and reached a low of $0.220 in June 2023. In 2024, Cardano peaked at $0.810 in March before dropping to $0.401 in April due to heavy selling. It traded between $0.52–$0.401 in April and $0.317–$0.423 by July, with strong support at $0.33 in August. After peaking at $0.37 in September and dipping to $0.33 in November, ADA surged to $1.1999 at the start of December, hit a maximum price of $1.3264, and closed the year at $0.8451. In January 2025, Cardano traded around $1.02 and $1.09. However, the closing price for Cardano in January was $0.9. In February 2025, ADA surged toward $0.81 but it declined toward $0.64 by the end of the month. ADA value dropped further in March as it dipped to the $0.60 range. In April, ADA price dropped below $0.55 but it later surged toward $0.7. ADA ended April at $0.7030. At the start of May, ADA price skyrocketed to $0.8. ADA ended May at $0.7599. In June, ADA is trading between $0.73 to $0.76. As of the beginning of July, ADA price is trading at $0.5823",cryptopolitan,https://www.cryptopolitan.com/cardano-price-prediction/,"ADA|TRADING|MARKET|BUSINESS|ETH|BTC|BLOCKCHAIN|FORKS","Crypto Price Predictions|ADA",cryptocompare
2025-07-12T20:15:51,"SHIB Community Reflects on Ryoshi’s Legacy as Token Faces Significant Price Decline","The enigmatic SHIB creator Ryoshi’s past messages resurface, shedding light on his humble stance and the ongoing evolution of the Shiba Inu ecosystem. Despite Ryoshi’s disappearance in 2022, the SHIB",coinotag,https://en.coinotag.com/shib-community-reflects-on-ryoshis-legacy-as-token-faces-significant-price-decline/,"SHIB|TRADING|BTC|ETH","News|BTC|ETH|KSM|SHIB",cryptocompare
2025-07-12T20:11:49,"Animoca Brands Explores Bitcoin Partnership with Denver Digital Currency Group to Support Blockchain Growth","Animoca Brands has forged a strategic partnership with Denver Digital Currency Group (DDC) to optimize its Bitcoin treasury management, marking a pivotal step in integrating cryptocurrency with mainstream digital entertainment",coinotag,https://en.coinotag.com/animoca-brands-explores-bitcoin-partnership-with-denver-digital-currency-group-to-support-blockchain-growth/,"BTC|BLOCKCHAIN|REGULATION","News|BTC|Core",cryptocompare
2025-07-12T20:05:18,"It's not just about bitcoin anymore. Altcoins are drawing more corporate attention","More on Bitcoin, Ethereum, etc. Ripple: How A Banking License Could Stir The Still Waters And Reprice XRP Chart Of The Day: Stocks? Check. Gold? Check. Bitcoin? Check Bitcoin Reaches Fresh All-Time High In Market-Wide Breakout - What's Next? (Technical Analysis) Stablecoins could reshape the yield curve, Apollo warns EU regulator warns of ‘halo effect’ risk from licensed crypto firms",seekingalpha,https://seekingalpha.com/news/4466867-its-not-just-about-bitcoin-anymore-altcoins-are-drawing-more-corporate-attention?utm_source=cryptocompare.com&utm_medium=referral&feed_item_type=news,"BTC|ALTCOIN|ETH|FIAT|MARKET","BTC-USD|ETH-USD|SOL-USD|CRO-USD|XRP-USD|MSTR|BMNR|BTBT|DJT|DFDV",cryptocompare
2025-07-12T20:00:48,"Bitcoin Market Cycles May Persist Amid Risks of Organic Downturn, Says Xapo Bank CEO","Seamus Rocca, CEO of Xapo Bank, cautions that Bitcoin’s next market downturn may arise organically rather than from a single catastrophic event, challenging prevailing assumptions about crypto cycles. Despite the",coinotag,https://en.coinotag.com/bitcoin-market-cycles-may-persist-amid-risks-of-organic-downturn-says-xapo-bank-ceo/,"BTC|MARKET|FIAT|FLOW","Analysis|News|BTC|FLOW",cryptocompare
2025-07-12T20:00:46,"JPMorgan Chase CEO Says Traders May Be Seriously Mistaken on Fed Rate Cuts: Report","JPMorgan Chase chief executive Jamie Dimon thinks the U.S. Federal Reserve could actually raise rates, contrary to popular belief. Despite consensus expectations of a rate cut in the coming months, Dimon said in a speech in Ireland on Thursday that he thinks the market is underestimating the potential impact of inflation on the Fed’s policymaking, Reuters reports . “I think the possibility of those higher rates (is) higher than anybody else… The market is pricing a 20% chance. I would price in a 40-50% chance. I would put that as a cause for concern.” Dimon says the US government’s tariffs, immigration policies and budget deficit could all have inflationary impacts. Other voices in the financial sector have predicted the opposite for Fed policy. Goldman Sachs Research economists recently estimated there’s more than a 50% chance of the Fed cutting rates at the Federal Open Market Committee (FOMC) meeting in September, three months earlier than their previous prediction. The Goldman economists predict 25-basis-point cuts in September, October, and December, and March and June of 2026. The CME FedWatch Tool estimates there’s a 93.3% chance the Fed will maintain the target range for the federal funds rate at 4.25-4.5% at the FOMC meeting in July. The tool, which generates probabilities using the 30-day Fed Funds futures prices, estimates there’s a 59.7% chance the Fed will cut the rate by 25 basis points at the FOMC meeting in September. FedWatch estimates a 0% chance of a rate hike this month or in September. Follow us on X , Facebook and Telegram Don't Miss a Beat – Subscribe to get email alerts delivered directly to your inbox Check Price Action Surf The Daily Hodl Mix Disclaimer: Opinions expressed at The Daily Hodl are not investment advice. Investors should do their due diligence before making any high-risk investments in Bitcoin, cryptocurrency or digital assets. Please be advised that your transfers and trades are at your own risk, and any losses you may incur are your responsibility. The Daily Hodl does not recommend the buying or selling of any cryptocurrencies or digital assets, nor is The Daily Hodl an investment advisor. Please note that The Daily Hodl participates in affiliate marketing. Generated Image: Midjourney The post JPMorgan Chase CEO Says Traders May Be Seriously Mistaken on Fed Rate Cuts: Report appeared first on The Daily Hodl .",dailyhodl,https://dailyhodl.com/2025/07/12/jpmorgan-chase-ceo-jamie-dimon-cuts-against-consensus-opinion-says-hes-pricing-in-40-50-chance-the-fed-raises-rates-report/,"MARKET|TRADING|BTC|BUSINESS|FIAT","Financeflux|Regulators|fed|Federal Reserve|interest rates|Jamie Dimon|JPMorgan|News",cryptocompare
2025-07-12T20:00:00,"Top Cryptos to Invest in as Bitcoin (BTC) Teases Move to $120,000 and Beyond","With Bitcoin (BTC) aiming for the $120,000 mark, the entire market is bracing for a major shift, and early movers are already positioning for what could be the biggest breakout of the year. But while Bitcoin grabs headlines, a new coin is quietly turning up the heat: Mutuum Finance (MUTM) . The project is currently selling at $0.03 in stage 5 of presale, over 65% now sold out. Phase 5 investors will get to enjoy a guaranteed 100% ROI return on listing. The project has already surpassed over $12.1 million and onboarded over 13100 investors thus far. Mutuum Finance could go past $2 post launch. Bitcoin (BTC) Outlook Amid $120K Buzz Bitcoin is currently trading around $111,271, firmly above $110K after clearing its June high near $110,524. Analysts are spotlighting bullish technicals, such as a classic “bull-flag” breakout on the IBIT spot‑BTC ETF chart, with some forecasting a potential rally between 30–25% toward $134K–$143K. Institutional inflows remain robust, with over $45B in monthly ETF investments and continued accumulation by whale wallets and long-tenured holders emerging from dormancy. Key support now lies around $105K–$108K, while a sustained breakout above $114K could pave the way for a push toward $120K+. Overall, technical setup and macro momentum suggest Bitcoin is consolidating near all-time highs, potentially setting the stage for its next bullish leg. Mutuum Presale Smashes Through $12.1M, Momentum Still Building With its revolutionary two-way lending paradigm, Mutuum Finance (MUTM) already has over 13100 investors on board and has raised $12.1 million. MUTM currently costs $0.03, but will increase further in the next phases and launch at $0.06. This guarantees all phase 5 investors a 2x return at launch. In addition, MUTM is set to climb past $3, delivering a 100x ROI. Mutuum Passes CertiK Audit with 95 Trust Score Mutuum Finance is turning momentum into credibility. A CertiK smart contract audit has verified that the codebase has high transparency standards with a trust score of 95.0/100. Underpinned by open-source smart contracts and the success of a Certik audit, the platform offers a safe foundation for digital financial transactions. Mutuum Finance is pairing state-of-the-art lending features with a robust ecosystem, charting a definite course for the future of DeFi. Aside from complementing its ecosystem even more, Mutuum Finance (MUTM) is developing an Ethereum-based, fully collateralized stablecoin pegged to the USD. As opposed to algorithmic models that depeg, the stablecoin developed to date will be in a way that it provides long-term liquidity, stability, and reliability to retail and institutional users. Mutuum Finance: Smarter Lending, Smarter Borrowing Mutuum Finance is a Peer-to-Contract (P2C) and Peer-to-Peer (P2P) lending combination, offering customers huge returns and complete control over transactions, respectively. These lending models offer end-to-end DeFi pain-free experience best adapted to user demands and safer, more transparent, and more flexible than the conventional centralized lending offerings. Mutuum Finance’s Reward Programs The project is already certified by CertiK and positioning itself for mass adoption, and the investors who invest now will reap huge at launch. The platform is also conducting a $100,000 giveaway , and 10 lucky participants will get $10,000 in Mutuum Finance tokens each. Mutuum Finance has also recently launched the official Bug Bounty Program alongside CertiK and the reward will be $50,000. This program has four severity levels i.e., critical, major, small and low whereby there is no level of vulnerability that is not rewarded, and edges towards the maximum. As Bitcoin pushes past $111K, smart investors are eyeing Mutuum Finance (MUTM) for bigger gains. Priced at $0.03 in Phase 5, over $12.1M has already been raised from 13,100+ investors, with 65% of the round sold out. Phase 5 buyers are guaranteed 2x returns on launch, with upside potential aiming for 100x. Join before the price rises. For more information about Mutuum Finance (MUTM) visit the links below Website: https://mutuum.com/ Linktree: https://linktr.ee/mutuumfinance",cryptopolitan,https://www.cryptopolitan.com/top-cryptos-to-invest-in-as-bitcoin-btc-teases-move-to-120000-and-beyond/,"BTC|BUSINESS|TRADING|ZRX|MINING","Press Release",cryptocompare
2025-07-12T19:59:28,"Bitcoin's four-year market cycle isn't dead — Xapo Bank CEO","Seamus Rocca warned that the next Bitcoin market downturn could be sparked organically and not through a single catastrophic event.",cointelegraph,https://cointelegraph.com/news/four-year-bitcoin-cycle-not-dead-xapo-ceo?utm_source=rss_feed&utm_medium=rss&utm_campaign=rss_partner_inbound,"BTC|MARKET|FIAT","",cryptocompare
2025-07-12T19:40:11,"Crypto Weekly Wrap: Bitcoin Dominance Falls as Altcoins Post Double-Digit Gains","In the last seven days, the total crypto market capitalization climbed 10%, from $3.4 trillion to $3.74 trillion. Bitcoin closed at just over $117,200, gaining 8.5%—but its dominance dropped from 63.71% to 57.85%, signaling a shift to altcoins. Crypto Market Ends Week on a High Note After a slow start, the crypto economy ended the",bitcoin.com,https://news.bitcoin.com/crypto-weekly-wrap-bitcoin-dominance-falls-as-altcoins-post-double-digit-gains/,"ALTCOIN|BTC|MARKET|TRADING","Markets and Prices|Bullish|markets and prices",cryptocompare
