datetime,headline,summary,source,url,categories,tags,api_source
2025-07-12T21:45:18,"Ethereum ETF Records Milestone with Over $900 Million in Inflows","Ethereum (ETH) Exchange Traded Funds (ETFs) have recorded their most outstanding inflows since they launched over a year ago. This asset class raked in $907 million in weekly inflows this past week and marked their best week ever. It is worth noting that the milestone coincided with the period when ETH recorded a 17% weekly gain. Three Consecutive Days of Ethereum ETF Inflows Ethereum ETFs were launched in July 2024, and since that time, it has faced some challenges in hitting a breakthrough. Its inflows have not been as productive as those of Bitcoin (BTC) ETFs. All of a sudden, the Ethereum ETFs registered their best weekly inflows. According to SoSoValue, investors plunged $907.99 million into Ethereum ETFs in the past week alone. E ven crypto market expert Nate Geraci acknowledged the inflows on X , citing that these inflows include three of the top 10 inflow days overall. Markedly, the most significant daily inflows for the week were recorded on July 10, when these funds took in $383.10 million. In addition to July 10, July 9 and 11 were days when the funds recorded top inflow this week. Specifically, the ETFs recorded net inflows of $211.32 million and $204.82 million, respectively, on these days. Ethereum Price Performance and Outlook Meanwhile, Ethereum price has recorded some uptick this week with Bitcoin price climbing to a new All-time-high (ATH) above $117,000. The largest altcoin by market capitalization went above the $3,000 level in the process. The rally ran past 17%, but the coin has since seen some fluctuations. At press time, Ethereum was trading at $2,923.59, corresponding with a 1.51% drop within the last 24 hours. Its market capitalization has also dropped to $353.11 billion, and the 24-hour trading volume has reduced by 53.59% to $20.88 billion. SharpLink Acquired 10,000 ETH to Reinforce its Position Apart from the rally in ETH price, the coin gained attention from an acquisition by SharpLink . Notably, the company purchased 10,000 ETH in exchange for $25,723,680, pegging a unit of ETH at $2,572.37. The acquisition deepens the company’s association with the second-largest cryptocurrency by market capitalization. SharpLink’s Ethereum holding has now moved from 205,634 ETH, which was previously disclosed, to about 215,634 ETH. The post Ethereum ETF Records Milestone with Over $900 Million in Inflows appeared first on TheCoinrise.com .",thecoinrise,https://thecoinrise.com/ethereum-etf-records-milestone-with-over-900-million-in-inflows/,"ETH|TRADING|MARKET|BTC|EXCHANGE","Blockchain News|Ethereum (ETH)",cryptocompare
2025-07-12T21:29:08,"A Company May Have Sold a Large Amount of This Altcoin – Onchain Data Shows","According to on-chain analysis, 4,120 ETH (approximately $12.2 million) was transferred to a centralized exchange (CEX) in the past hours from an address believed to be affiliated with staking and verification service provider Arthapala. The address in question has sold a total of 118,907 ETH since June 11, 2025, with a total value of approximately $202 million. The average transfer price was recorded as $2,546. Meanwhile, the Ethereum spot ETF market is also experiencing significant momentum. According to SoSoValue data, a total of $205 million in net inflows into Ethereum spot ETFs yesterday, marking the sixth consecutive day of net inflows into the funds. Related News: Renowned Analyst Predicts the ‘Most Critical Price Level’ for Bitcoin and the Highest Price BTC Price Will Reach This Cycle The ETF with the highest single net inflow of the day was BlackRock's ETHA, with $137 million. ETHA's total historical net inflow reached $6.29 billion. The Grayscale Ethereum Mini Trust ETF (ETH) came in second. This fund saw net inflows of $25.5 million in a single day, bringing its total net inflow to $824 million. *This is not investment advice. Continue Reading: A Company May Have Sold a Large Amount of This Altcoin – Onchain Data Shows",bitcoinsistemi,https://en.bitcoinsistemi.com/a-company-may-have-sold-a-large-amount-of-this-altcoin-onchain-data-shows/,"ALTCOIN|ETH|TRADING|BTC|MARKET","Altcoin|News",cryptocompare
2025-07-12T21:00:41,"Bitcoin Bulls In Cloud 9? Analyst Identifies Where Risk Lies","After a near-excellent start to the month of July, Bitcoin has performed even more impressively over the past few days. The premier cryptocurrency, after a brief period of sideways momentum earlier this week, has attained a new all-time-high valuation at a price close to $119,000. Unsurprisingly, the Bitcoin market is experiencing a wave of optimism — an inference still heavily backed by the latest on-chain revelation. Bitcoin Market Sentiment Shifts Bullish In a July 11 post on social media platform X, cryptocurrency analytics firm Alphractal delved into the current price action of Bitcoin, offering insights into the cryptocurrency’s future trajectory. Related Reading: Bitcoin Soars Past $118,800—Breakout Or Brutal Bull Trap? The firm’s on-chain observation revolves around the Aggregated Liquidation Levels Heatmap (7 Days) metric, which visualizes price zones with high concentrations of long or short liquidations over a span of 7 days, and the Aggregated Liquidation Levels Heatmap (1 month) which does the same, except that this covers a monthly timeframe. After the most recent Bitcoin price rally to a new all-time high, all of the overleveraged bears had their market positions wiped out. Aided by the short squeeze, which usually follows such large liquidation events, the flagship cryptocurrency still retains its strong bullish momentum and continues to surge. According to Alphractal, the aggregation liquidation levels across different timeframes now show that most current leveraged positions are betting on the Bitcoin price. As the market continues to ascend the charts, investor optimism will turn more positive, which may further push more traders to open long positions in the BTC futures market. However, Alphractal warned against the inclination to be recklessly involved in the current bullish market. “If, for any reason, the price drops $10,000 back to the $107,000 zone, it could be the bulls’ turn to face massive liquidations,” the analytics firm said. The firm went further, explaining that a Bitcoin price drop of that magnitude would have a negative impact on the market optimism. On the bright side, Alphractal also mentioned that such an occurrence could offer new accumulation opportunities in the near future. Still on market optimism, a drop in Bitcoin’s value by $10,000 might lead to a phenomenon referred to as a Long squeeze, where the price of Bitcoin continues to plummet with increased momentum. A long squeeze typically occurs when the falling price of a cryptocurrency (in this case, Bitcoin) forces traders with long positions to sell their assets either to cut losses or to break even. This contributes to the already present bearish momentum and sends the BTC price further south. Amidst Bitcoin’s current rally, Alphractal ultimately advised that traders leverage wisely and with caution, as the market’s next action stands at an unpredictable zone. Bitcoin Price At A Glance Still showing signs of healthy bullish momentum, Bitcoin, as of press time, is valued at around $118,145. Data from CoinGecko shows that the flagship cryptocurrency has jumped by more than 3.34% in the last 24 hours. Related Reading: Bitcoin Dominance Falls: 9 Factors To Watch For That Says The Altcoin Season Has Begun Featured image from iStock, chart from TradingView",newsbtc,https://www.newsbtc.com/news/bitcoin-bulls-in-cloud-9-analyst-identifies-where-risk-lies/,"BTC|TRADING|MARKET|TOKEN SALE|ALTCOIN","Cryptocurrency Market News|Alphractal|bitcoin|bitcoin price|btc|btc price|BTCUSDT",cryptocompare
2025-07-12T20:49:23,"Bitcoin Climbs New Heights: Will It Soar Even Higher?","Van de Poppe expects significant price growth in Bitcoin by 2025. Ethereum could potentially return to its all-time high levels. Continue Reading: Bitcoin Climbs New Heights: Will It Soar Even Higher? The post Bitcoin Climbs New Heights: Will It Soar Even Higher? appeared first on COINTURK NEWS .",cointurken,https://en.coin-turk.com/bitcoin-climbs-new-heights-will-it-soar-even-higher/,"BTC|ETH|TRADING","Bitcoin (BTC)",cryptocompare
2025-07-12T20:45:00,"Bitcoin Momentum Rebuilds — TON and SUI Hit Technical Buy Zones","Bitcoin has officially reclaimed center stage, crossing the $118,000 mark for the first time in history. Fueled by a record-setting short squeeze and ETF inflows, the breakout is triggering capital shifts across the market. SUI and Toncoin are showing signs of strength—but it’s MAGACOIN FINANCE, a decentralized political memecoin, that’s quietly entering buy-zone discussions among early-stage investors looking for high-conviction narratives in the next altcoin wave. Bitcoin’s Breakout Powered by Short Squeeze and ETF Inflows The Bitcoin rally has been nothing short of historic. Between July 10–11, over $1 billion in short positions were liquidated, marking the largest forced buyback event since January. Spot ETF inflows continue to accelerate, bringing institutional demand and long-term price pressure. Bitcoin 7-Days price chart from CoinGecko Market sentiment is bullish, with open interest now clustering at the $120K and $140K strike levels. U.S. legislators are also preparing pro-crypto bills as part of an upcoming “Crypto Week,” reinforcing optimism heading into Q3. But the more telling trend? Altcoin rotations are already underway—particularly toward early narratives and low-cap bets. SUI Holds Above $3.50 as DeFi Integrations Fuel Speculation SUI is emerging as one of the most technically robust altcoins this week. After integrating tBTC—a synthetic Bitcoin asset—into its DeFi ecosystem, SUI soared above $3.50 and confirmed its inverse head-and-shoulders breakout pattern. Analysts now point to $3.89 as the next resistance target, with institutional accumulation growing and daily volume tracking higher. It’s a clear indicator that DeFi-aligned narratives are back in focus, especially those with cross-asset bridges and liquidity inflows. But SUI’s surge is also creating spillover attention for projects like MAGACOIN FINANCE—those operating in entirely different lanes but benefiting from renewed risk appetite. TON Rebounds Near $2.97 After Visa Controversy Cools Down Toncoin (TON) is stabilizing near $2.97 after weathering a wave of investor uncertainty related to its failed “golden visa” pilot in the UAE. The TON Foundation clarified its limited role in the proposal, and traders are once again watching the charts. TON’s symmetrical triangle setup signals a potential volatility breakout. Support at $2.81 has held, and sentiment is slowly improving, although technical indicators remain mixed. Analysts caution that TON needs a clean break past $3.00 to resume its previous trend. MAGACOIN FINANCE: Political Altcoin Narrative Enters Buy-Zone Phase While BTC, SUI, and TON dominate headlines, MAGACOIN FINANCE is making noise where it matters—wallets, volume, and forums. The meme-powered altcoin recently passed $11.2 million raised with over 5,234 verified holders. But what’s attracting fresh attention is the breakout behavior: weekly volume is up 320%, and 1,500+ new wallets were created in under 48 hours. MAGACOIN FINANCE isn’t riding ETF news or protocol upgrades—it’s leading with ideological clarity. As a decentralized political memecoin, its zero-tax model, HashEx-audited contract, and capped 170B supply structure offer a scarcity play built on anti-centralization values. Early discussions suggest listing momentum could follow if current community traction continues. Traders who missed early SHIB or DOGE waves are calling MAGACOIN “the politically aligned altcoin for this cycle.” Final Thoughts Bitcoin is climbing. SUI is strengthening. TON is stabilizing. But MAGACOIN FINANCE is emerging—fast. As traders look for early-stage opportunities beyond hype cycles, MAGACOIN FINANCE’s mix of community governance, transparent supply, and political identity makes it a serious contender in the next meme altcoin breakout. For a market driven by narratives and timing, this decentralized political memecoin checks both boxes. To learn more about MAGACOIN FINANCE, visit: Website: https://magacoinfinance.com Twitter/X: https://x.com/magacoinfinance Telegram: https://t.me/magacoinfinance",cryptopolitan,https://www.cryptopolitan.com/bitcoin-momentum-rebuilds-ton-and-sui-hit-technical-buy-zones/,"BTC|SUI|TON|TRADING|ALTCOIN","Press Release",cryptocompare
2025-07-12T20:40:20,"Q3 Bitcoin Mining Map Exposes Silent Surge in Russia, China, While US Dips Slightly","As the second quarter of 2025 wound down, the U.S. held onto its top spot for the highest share of Bitcoin hashrate—though it slipped slightly, down just 0.60% since May 27. Meanwhile, turning over into Q3, Russia turned up the dial, posting a 6.12% jump in its share since that same date in May. Hashrate",bitcoin.com,https://news.bitcoin.com/q3-bitcoin-mining-map-exposes-silent-surge-in-russia-china-while-us-dips-slightly/,"MINING|BTC|ASIA","Mining|Bitcoin (BTC)|Bitcoin Miners|mining",cryptocompare
