datetime,headline,summary,source,url,categories,tags,api_source
2025-08-01T00:58:16,"Trump Backs $23B Bitcoin Plan as BTC Dips Below $116K: Is $110K Next?","The Trump administration has renewed its commitment to building a Strategic Bitcoin Reserve despite scant mention in its latest official digital asset report. Bo Hines, head of digital assets at the White House, confirmed the plan is operational: “We have it, it’s been established.” Though exact holdings remain undisclosed, the U.S. government currently controls an estimated 198,000 BTC, worth over $23 billion, mostly from law enforcement seizures. IMPORTANT: Trump signed executive order for U.S Bitcoin STRATEGIC RESERVE.. All seized Bitcoins will not be sold & will be held as reserve asset.. Long-term this will play out well pic.twitter.com/TOFgbOii7M — Techno Vas (@techno_vas) July 31, 2025 Hines emphasized that Bitcoin holds “a class of its own,” noting that the infrastructure to manage these reserves will roll out “in short order.” This marks a major shift in U.S. digital asset policy—one that signals institutional confidence in Bitcoin’s long-term value as a sovereign asset. Alongside this, the White House urged regulatory collaboration between the SEC and CFTC to accelerate crypto adoption. SEC Launches Landmark Crypto Reforms More good news for the bulls, SEC Chairman Paul Atkins announced sweeping reforms to define and disclose cryptocurrencies. At the America First Policy Institute, Atkins called this a “once in a generation” opportunity to simplify token classification and make tokenized securities more accessible. This comes on the heels of the Trump crypto working group’s proposal for federal digital asset trading. With both political and regulatory backing, Bitcoin’s path to mainstream is getting clearer. Clarity will reduce institutional fear and increase adoption. Whale Accumulation vs. $9B BTC Sell-Off On-chain data reveals a tug-of-war between long-term holders and sudden large-scale sellers. According to Santiment, whales have acquired nearly 1% of the total BTC supply in just four months, including 30,000 BTC in the last 48 hours. Meanwhile, a Satoshi-era whale offloaded 80,000 BTC (worth $9B) via Galaxy Digital, triggering short-term volatility. Bitcoin Whales Bought 1% of Circulating BTC Supply in Past 4 Months ► https://t.co/aFoD71PL0A https://t.co/aFoD71PL0A — Decrypt (@DecryptMedia) July 31, 2025 Still, most BTC holders remain profitable—glassnode estimates that 97% of Bitcoin supply sits above cost basis, a bullish metric. Whale activity has also spilled into other assets like Ethereum, Solana, PEPE, and WIF. In July, SharpLink Gaming invested $780M in ETH, doubling down on crypto diversification. This combination of accumulation and profit-taking suggests a volatile but upward-biased Q3, with long-term conviction intact. Bitcoin Price Chart – Source: Tradingview Bitcoin Breaks Support – Is $110K Next? Bitcoin price action reflects the uncertainty. BTC/USD is at $115,775, below $116,872 horizontal support and the 50-SMA at $117,919. The triangle breakdown is confirmed by RSI at 33, and bearish momentum is in full swing. Recent candles are a spinning top followed by a big bearish engulfing candle. RSI divergence from price shows weakening bullishness Key support zones: $114,532, $112,726, $110,587 Technically, the failed triangle projects to $110,000 unless we see a quick bounce. Bitcoin Hyper Presale Over $6M as Price Rise Nears Bitcoin Hyper ($HYPER) , the first Bitcoin-native Layer 2 powered by the Solana Virtual Machine (SVM), has raised over $6 million in its public presale, with $6,098,717 out of a $7,004,929 target. The token is priced at $0.012475, with the next price tier expected to be announced soon. Designed to merge Bitcoin’s security with Solana’s speed, Bitcoin Hyper enables fast, low-cost smart contracts, dApps, and meme coin creation, all with seamless BTC bridging. The project is audited by Consult and engineered for scalability, trust, and simplicity. The golden cross of meme appeal and real utility has made Bitcoin Hyper a Layer 2 contender to watch in 2025. With staking, a streamlined presale, and a full rollout expected by Q1, $HYPER is gaining serious traction. The post Trump Backs $23B Bitcoin Plan as BTC Dips Below $116K: Is $110K Next? appeared first on Cryptonews .",cryptonews,https://cryptonews.com/news/trump-backs-23b-bitcoin-plan-as-btc-dips-below-116k-is-110k-next/,"BTC|TRADING|REGULATION|SOL|ETH","News|Bitcoin|Cryptocurrency",cryptocompare
2025-08-01T00:55:10,"Altcoin Season: Unveiling the Dominant Bitcoin Era and Its Impact on Your Crypto Portfolio","BitcoinWorld Altcoin Season: Unveiling the Dominant Bitcoin Era and Its Impact on Your Crypto Portfolio Are you wondering why your altcoin portfolio might be struggling while Bitcoin seems to be holding strong or even making gains? The answer often lies in understanding the broader market cycles, specifically whether we are in an Altcoin Season or a Bitcoin Season. Currently, the Altcoin Season Index, a crucial metric for cryptocurrency investors, stands at a revealing 35. This figure isn’t just a number; it’s a clear signal that the crypto market is firmly entrenched in what’s known as ‘Bitcoin Season’. But what exactly does this mean for your digital assets, and how should you navigate these market conditions? What Exactly is the Altcoin Season Index and Why Does it Matter? The Altcoin Season Index is a fascinating metric, meticulously tracked by leading cryptocurrency price data platform CoinMarketCap (CMC). At 00:30 UTC on August 1, it registered 35, a slight dip from the previous day’s figure. This seemingly small number carries significant weight, as it directly informs us about the prevailing market sentiment and asset performance. So, how is this index calculated? It’s quite straightforward, yet incredibly insightful: The index compares the performance of the top 100 cryptocurrencies by market capitalization (excluding stablecoins and wrapped tokens) against Bitcoin over the past 90 days. For the market to be officially in ‘Altcoin Season’, a staggering 75% or more of these top 100 altcoins must have outperformed Bitcoin within that 90-day window. Conversely, ‘Bitcoin Season’ is declared when 25% or fewer of these altcoins manage to outperform Bitcoin. The index itself ranges from 1 to 100, with higher numbers indicating a stronger altcoin performance relative to Bitcoin. Why does this matter to you? Understanding where we are in this cycle can significantly influence your investment strategy. It helps you decide whether it’s a time to potentially accumulate altcoins, hold onto Bitcoin, or even take a more defensive stance. It’s a compass in the often-volatile seas of cryptocurrency. Decoding the Current Bitcoin Season: What Does an Altcoin Season Index of 35 Signify? An Altcoin Season Index of 35 is a strong indicator that Bitcoin is currently dominating the market. In simple terms, for the past three months, a vast majority of the top altcoins have failed to keep pace with Bitcoin’s performance. This isn’t necessarily a negative sign for the market overall, but it certainly dictates a different approach for investors. During Bitcoin Season, we typically observe several key trends: Capital Inflow into Bitcoin: Investors, both retail and institutional, often prioritize Bitcoin during periods of uncertainty or as a perceived ‘safe haven’ asset within the crypto space. Altcoin Underperformance: While some individual altcoins might still see gains due to specific news or developments, the broader altcoin market tends to stagnate or even decline relative to Bitcoin. Reduced Risk Appetite: The overall market sentiment leans towards caution, with investors preferring the stability and established track record of Bitcoin over the higher volatility and risk associated with smaller altcoins. To better illustrate the differences, consider this comparison: Feature Bitcoin Season (Index Altcoin Season (Index > 75) Bitcoin Performance Strong gains, often leading the market Consolidation or moderate gains, allowing altcoins to catch up Altcoin Performance Underperforming Bitcoin, stagnant or declining Outperforming Bitcoin, often parabolic gains Investor Sentiment Cautious, risk-averse, focus on large caps Optimistic, risk-on, eager for high returns Capital Flow Into Bitcoin from altcoins or fiat From Bitcoin profits into altcoins Market Narrative Bitcoin’s store of value, institutional adoption Innovation, specific project narratives, DeFi, NFTs Navigating the Crypto Waters: Smart Strategies During Bitcoin Season Understanding that we are in Bitcoin Season is the first step; the next is adapting your investment strategy. This period calls for a more cautious yet strategic approach to your crypto portfolio. Here are some actionable insights: Prioritize Bitcoin Accumulation: If you believe in Bitcoin’s long-term potential, a Bitcoin Season can be an excellent time to accumulate more BTC, as it demonstrates its strength. Be Selective with Altcoins: Not all altcoins are created equal. Focus on projects with strong fundamentals, clear use cases, active development, and robust communities. Avoid speculative, hype-driven tokens that lack substance. This is a time for deep research, not chasing pumps. Dollar-Cost Averaging (DCA): Instead of trying to time the bottom, consider using DCA for your altcoin purchases. This involves investing a fixed amount at regular intervals, regardless of price, which can help mitigate risk during volatile periods. Risk Management is Key: During Bitcoin Season, altcoins can be particularly volatile. Avoid over-leveraging and ensure you have a clear exit strategy for each position. Diversify your portfolio beyond just altcoins. Patience is a Virtue: Market cycles take time to play out. Resist the urge to panic sell or make impulsive decisions. Focus on your long-term investment goals rather than short-term fluctuations. It’s important to remember that market conditions are dynamic. While the Altcoin Season Index gives us a snapshot, it’s not a static indicator. Market sentiment can shift, and new narratives can emerge, influencing the flow of capital. When Could We See Another Altcoin Season Emerge? The million-dollar question for many altcoin enthusiasts is: when will the next Altcoin Season arrive? While no one has a crystal ball, historical patterns and market dynamics offer some clues. Typically, an Altcoin Season tends to follow a period of strong Bitcoin dominance and subsequent consolidation. Here’s what usually needs to happen for the tides to turn: Bitcoin Dominance Cools Down: Often, after a significant rally, Bitcoin enters a period of consolidation or slower growth. This allows its dominance to potentially plateau or slightly decrease, freeing up capital. Capital Rotation: Profits generated from Bitcoin’s rally are often rotated into altcoins. Investors who made gains on Bitcoin look for higher-risk, higher-reward opportunities in the altcoin market. Emergence of New Narratives: Breakthroughs in specific sectors like Decentralized Finance (DeFi), Non-Fungible Tokens (NFTs), GameFi, or new layer-1 solutions can spark renewed interest and investment in related altcoins. Macroeconomic Factors: A generally positive global economic outlook and increased liquidity in traditional markets can also spill over into the crypto space, boosting risk appetite for altcoins. Watching for shifts in Bitcoin dominance charts, increasing trading volumes in altcoins, and the general market sentiment turning more ‘risk-on’ can be early indicators. However, attempting to perfectly time the market is notoriously difficult. A diversified approach and continuous research remain paramount. Conclusion: Navigating the Cycles with Knowledge The current Altcoin Season Index of 35 clearly indicates that we are in a Bitcoin Season. This isn’t a cause for alarm but rather a valuable piece of information for making informed investment decisions. Understanding the dynamics of the Altcoin Season Index and its counterpart, Bitcoin Season, empowers you to adjust your portfolio strategy, manage risk effectively, and potentially capitalize on prevailing market trends. Whether you’re prioritizing Bitcoin accumulation or carefully selecting high-potential altcoins, the key is to stay informed, conduct thorough research, and maintain a long-term perspective. The crypto market is cyclical, and while Bitcoin may be leading the charge now, understanding these cycles is your best defense and offense for future opportunities. Frequently Asked Questions (FAQs) Q1: What is Altcoin Season? Altcoin Season is a period in the cryptocurrency market when a significant majority (typically 75% or more) of the top 100 altcoins (cryptocurrencies other than Bitcoin) outperform Bitcoin over a 90-day period. It’s characterized by rapid price appreciation across various altcoin projects. Q2: How is the Altcoin Season Index calculated? The Altcoin Season Index, tracked by CoinMarketCap, assesses the performance of the top 100 cryptocurrencies (excluding stablecoins and wrapped tokens) against Bitcoin over the past 90 days. If over 75% outperform Bitcoin, it’s Altcoin Season. If 25% or fewer outperform Bitcoin, it’s Bitcoin Season. Q3: What does an Altcoin Season Index of 35 mean? An index of 35 indicates that we are currently in ‘Bitcoin Season’. This means that Bitcoin has outperformed the vast majority of altcoins (more than 75% of the top 100) over the last 90 days, suggesting capital is primarily flowing into Bitcoin. Q4: What should I do with my portfolio during Bitcoin Season? During Bitcoin Season, many investors consider accumulating Bitcoin, being highly selective with altcoin investments, focusing on strong fundamentals, utilizing dollar-cost averaging, and prioritizing risk management. It’s generally a time for caution regarding highly speculative altcoins. Q5: When can we expect the next Altcoin Season? Predicting the exact timing of the next Altcoin Season is challenging. Historically, it often follows a strong Bitcoin rally and subsequent consolidation, as capital rotates from Bitcoin profits into altcoins. New narratives, technological advancements, and a general increase in market risk appetite can also trigger it. Q6: Is the Altcoin Season Index always accurate? The Altcoin Season Index is a valuable tool and a strong indicator of prevailing market conditions based on historical performance. While it provides a clear snapshot, it’s not a crystal ball. Market dynamics can change rapidly, and investors should always combine this metric with their own research and risk assessment. If you found this article insightful, consider sharing it with your network! Help others understand the current crypto market dynamics by sharing on Twitter, Facebook, or LinkedIn. Your support helps us continue providing valuable insights into the world of digital assets. To learn more about the latest crypto market trends, explore our article on key developments shaping Bitcoin price action . This post Altcoin Season: Unveiling the Dominant Bitcoin Era and Its Impact on Your Crypto Portfolio first appeared on BitcoinWorld and is written by Editorial Team",bitcoinworld,https://bitcoinworld.co.in/altcoin-season-bitcoin-dominance-7/,"ALTCOIN|BTC|MARKET|TRADING|BUSINESS","Crypto News|altcoin season|ALTCOINS|BITCOIN|Crypto Market|CRYPTOCURRENCY",cryptocompare
2025-08-01T00:42:45,"Strategy Raises $4.2 Billion to Bolster Bitcoin Holdings","Strategy plans to raise $4.2 billion through preferred stock issuance. This funding is primarily aimed at bolstering Bitcoin acquisitions. Continue Reading: Strategy Raises $4.2 Billion to Bolster Bitcoin Holdings The post Strategy Raises $4.2 Billion to Bolster Bitcoin Holdings appeared first on COINTURK NEWS .",cointurken,https://en.coin-turk.com/strategy-raises-4-2-billion-to-bolster-bitcoin-holdings/,"BTC|BUSINESS","Bitcoin News",cryptocompare
2025-08-01T00:30:31,"Top cryptocurrency stocks to buy as the next Bitcoin halving approaches","Bitcoin halving reduces miner rewards every 210,000 blocks, reinforcing scarcity and impacting crypto stock strategies.",ambcrypto,https://ambcrypto.com/top-cryptocurrency-stocks-to-buy-as-the-next-bitcoin-halving-approaches/,"BTC|BUSINESS","News|News 1|Social|Trading View|ambcrypto",cryptocompare
