datetime,headline,summary,source,url,categories,tags,api_source
2025-07-21T21:59:27,"Strategy Plans New Stock Offering to Potentially Fund Bitcoin Purchases and Investor Dividends","🚀 Are You Chasing New Coins? Catch the newest crypto opportunities. Be the first to buy, be the first to win! Click here to discover new altcoins! Strategy, formerly known",coinotag,https://en.coinotag.com/strategy-plans-new-stock-offering-to-potentially-fund-bitcoin-purchases-and-investor-dividends/,"BUSINESS|BTC|ALTCOIN","News|BTC",cryptocompare
2025-07-21T21:54:59,"Strategy Reveals Another Stock Offering to Boost $71 Billion Bitcoin Stash","Bitcoin treasury firm Strategy (formerly MicroStrategy) is launching a new financial product as a way to raise money for BTC buys.",decrypt,https://decrypt.co/331103/strategy-reveals-another-stock-offering-boost-71-billion-bitcoin-stash,"BTC|BUSINESS|REGULATION|TREASURY","|Business",cryptocompare
2025-07-21T21:32:07,"Analyst Il Capo, Who Was Wrong in His Prediction of a Major Crash, Reveals the Only Altcoin He Didn’t Sell During This Period","One of the most controversial analysts in the cryptocurrency world, il Capo of Crypto, has spoken out again after the market experienced a significant rise. In his previous statements, il Capo had shared that he expected a decline and made extremely bearish statements. In his latest statement, il Capo addressed the concerns of investors who hadn't entered the market before the rally. The analyst argued that those who missed the rally weren't missing an opportunity, adding that there will always be opportunities in the market, even better ones than before. Related News: Whales Are Very Active Today: Here Are the Altcoins They Are Trading The analyst, who has been a bear since May, stated that he still believes a major decline is imminent. However, he added that he expects a major recovery wave in October and November following the decline. He claimed that Bitcoin had failed to register its first month of approval by falling below $115,000. Speaking specifically about Solana, the analyst said that the coin is testing its old resistance between $170-$200, and the main target is still $60 to $80. Finally, speaking about Ethena (ENA), the analyst stated that ENA is one of the few altcoins he hasn't sold. He noted that if the bearish scenario develops, ENA could fall to $0.20, but he would buy even more in that scenario. *This is not investment advice. Continue Reading: Analyst Il Capo, Who Was Wrong in His Prediction of a Major Crash, Reveals the Only Altcoin He Didn’t Sell During This Period",bitcoinsistemi,https://en.bitcoinsistemi.com/analyst-il-capo-who-was-wrong-in-his-prediction-of-a-major-crash-reveals-the-only-altcoin-he-didnt-sell-during-this-period/,"ALTCOIN|TRADING|ENA|MARKET|BTC","Altcoin|News",cryptocompare
2025-07-21T21:24:28,"Bitcoin Whale Activity May Signal Consolidation as Dominance Declines and Altcoins Gain Momentum","🚀 Are You Chasing New Coins? Catch the newest crypto opportunities. Be the first to buy, be the first to win! Click here to discover new altcoins! Bitcoin whales triggered",coinotag,https://en.coinotag.com/bitcoin-whale-activity-may-signal-consolidation-as-dominance-declines-and-altcoins-gain-momentum/,"BTC|ALTCOIN|ETH|FLOW|SOL","Bitcoin|Ethereum|News|BTC|ETH|FLOW|SOL|XRP",cryptocompare
2025-07-21T21:10:18,"Ethereum Bitcoin: Peter Schiff’s Bold Call to Action for Your Portfolio","BitcoinWorld Ethereum Bitcoin: Peter Schiff’s Bold Call to Action for Your Portfolio The world of cryptocurrency is no stranger to bold predictions and surprising takes, especially from figures known for their skepticism towards digital assets. One such voice, Peter Schiff, the staunch gold advocate and CEO of Euro Pacific Capital, recently dropped a bombshell on X, igniting a fresh debate within the crypto community. His advice? Consider an Ethereum Bitcoin trade – specifically, selling your Ether (ETH) to buy Bitcoin (BTC). This unexpected counsel from a long-time crypto critic has sent ripples through the market, prompting investors to re-evaluate their strategies and ponder the underlying reasons behind such a striking recommendation. Could there be a compelling argument for shifting from the second-largest cryptocurrency to the first? Why the Ethereum Bitcoin Debate Intensifies with Peter Schiff’s Advice? Peter Schiff is famously known for his unwavering belief in gold as the ultimate store of value and his consistent skepticism regarding cryptocurrencies. For years, he has dismissed Bitcoin and other digital assets as speculative bubbles, destined for collapse. This long-standing stance makes his recent commentary on an Ethereum Bitcoin swap particularly noteworthy and, for many, quite shocking. On X, Schiff stated, “As much as it pains me to say, selling Ether and buying Bitcoin with the proceeds is a better trade than holding Ether.” His reasoning, while concise, offers a crucial insight into his perspective. He added that “Ether has more acknowledged competition for the narrative of its use case.” This statement highlights a core difference in how Bitcoin and Ethereum are perceived, even by a critic like Schiff. Bitcoin, often dubbed “digital gold,” primarily serves as a decentralized store of value and a medium of exchange. Its narrative is relatively singular and well-established. Ethereum, on the other hand, powers a vast ecosystem of decentralized applications (dApps), NFTs, and decentralized finance (DeFi), constantly evolving and facing new competitors in the smart contract platform space. Schiff’s observation suggests that while he remains critical of all cryptocurrencies, he sees Bitcoin’s narrative as more robust and less susceptible to disruption compared to Ethereum’s multifaceted and competitive landscape. This doesn’t mean he has become a crypto evangelist; rather, it’s a strategic concession within his overall bearish outlook, implying that if one must hold crypto, Bitcoin might be the “less bad” option. This perspective adds a unique layer to the ongoing Ethereum Bitcoin discussion, urging investors to consider not just technological prowess but also narrative strength and competitive positioning. Understanding the Ethereum Bitcoin Landscape: A Comparison To fully grasp the implications of Peter Schiff’s advice, it’s essential to understand the fundamental differences and similarities between Bitcoin and Ethereum. While both are leading cryptocurrencies, their design, purpose, and ecosystems diverge significantly. This comparison is crucial for anyone considering an Ethereum Bitcoin portfolio adjustment. Here’s a simplified overview: Bitcoin (BTC): The Digital Gold Primary Purpose: Store of value, peer-to-peer digital cash. Technology: Simple blockchain, primarily for transactions. Supply: Capped at 21 million coins, creating scarcity. Narrative: Decentralized, censorship-resistant, inflation-hedge. Competition: Limited direct competition for its “digital gold” narrative. Ethereum (ETH): The World Computer Primary Purpose: Platform for smart contracts, dApps, DeFi, NFTs. Technology: Complex blockchain, Turing-complete, supports a vast ecosystem. Supply: No fixed cap, but supply changes with burning mechanisms (EIP-1559) and issuance. Narrative: Programmable money, Web3 foundation, innovation hub. Competition: Faces significant competition from other Layer 1 blockchains (e.g., Solana, Avalanche, Cardano) for dApp development and user adoption. Schiff’s point about “acknowledged competition” for Ethereum is valid. While Ethereum holds a dominant position in the smart contract space, it is constantly challenged by newer, often faster and cheaper, blockchains. This competition puts pressure on Ethereum to innovate and scale, leading to developments like the Merge and future sharding upgrades. Bitcoin, by contrast, faces less direct competition in its niche as a decentralized, scarce digital asset. Its narrative as a safe haven or a long-term store of value remains largely unchallenged by other cryptocurrencies, although it does compete with traditional assets like gold. This fundamental distinction forms the bedrock of Schiff’s surprising recommendation, suggesting that even a crypto skeptic recognizes the different risk profiles inherent in the Ethereum Bitcoin dynamic. Is an Ethereum Bitcoin Swap Right for You? Actionable Insights Peter Schiff’s advice to sell ETH and buy BTC is provocative, but is it a universally applicable strategy? The decision to execute an Ethereum Bitcoin swap depends heavily on individual investment goals, risk tolerance, and market outlook. It’s crucial to approach such a decision with careful consideration, not simply by following one expert’s (or skeptic’s) opinion. Potential Benefits of Selling ETH for BTC: Perceived Stability: Bitcoin is often seen as the more stable of the two, especially during market downturns, due to its longer history, larger market capitalization, and established “digital gold” narrative. Simpler Use Case: Bitcoin’s singular focus as a store of value might appeal to those seeking a less complex investment in the crypto space. Reduced Competition Risk: As Schiff noted, Bitcoin faces less direct competition for its core narrative compared to Ethereum, which constantly battles other smart contract platforms. Institutional Adoption: Bitcoin has historically seen more traditional institutional adoption (e.g., spot Bitcoin ETFs), which some investors view as a sign of maturity and stability. Potential Challenges and Risks of Selling ETH: Missing Ethereum’s Growth: Ethereum is a powerhouse of innovation, driving the DeFi, NFT, and Web3 revolutions. Selling ETH could mean missing out on future growth tied to these burgeoning sectors and upcoming network upgrades (like sharding). Yield Opportunities: Ethereum offers various yield-generating opportunities through staking (post-Merge) and DeFi protocols, which are generally not available with Bitcoin. Network Utility: ETH is not just an asset; it’s the gas fee for the entire Ethereum ecosystem. Its utility is deeply embedded in the functioning of decentralized applications. Future Scalability: Ethereum’s roadmap aims to significantly improve its scalability and efficiency, which could further cement its position as a leading smart contract platform. Actionable Insights for Your Portfolio: Assess Your Goals: Are you looking for long-term store of value, or do you want exposure to the broader decentralized application ecosystem? Diversification: Instead of an “either/or” approach, consider holding both Bitcoin and Ethereum as part of a diversified crypto portfolio. This allows you to benefit from both narratives. Risk Tolerance: Understand that all cryptocurrencies carry significant risk. Evaluate if shifting entirely to Bitcoin aligns with your comfort level for volatility. Research Beyond Headlines: Don’t make decisions based solely on a single comment. Dive deeper into the fundamentals, technology, and market trends of both assets. Consult a Professional: For personalized financial advice, always consult with a qualified financial advisor who can assess your specific situation. This article provides general information and is not financial advice. Navigating the Future of Ethereum Bitcoin Dynamics The ongoing dialogue surrounding Ethereum Bitcoin dynamics is a testament to the evolving nature of the cryptocurrency market. Peter Schiff’s recent comments, while controversial, serve as a potent reminder that even long-term skeptics are observing the nuanced differences between these two crypto giants. The future trajectory of both assets will be influenced by a myriad of factors, including technological advancements, regulatory clarity, institutional adoption, and macroeconomic conditions. For Ethereum, the success of its ongoing upgrades, particularly those aimed at scalability and efficiency, will be paramount. If Ethereum can effectively address its challenges related to transaction costs and speed, its utility as the foundational layer for Web3 could see unprecedented growth. This would strengthen its “use case narrative” against competitors. Bitcoin, on the other hand, continues to solidify its position as a digital store of value. Its halving cycles, increasing institutional interest, and growing acceptance as a legitimate asset class contribute to its perceived resilience. The narrative of Bitcoin as “sound money” or “digital gold” is becoming increasingly ingrained, potentially attracting more traditional investors seeking an alternative to fiat currencies or even physical gold. Ultimately, the choice between, or the allocation within, Ethereum Bitcoin in a portfolio comes down to individual conviction and understanding of the distinct roles each asset plays in the broader digital economy. The market is dynamic, and what holds true today may shift tomorrow. Continuous learning and adaptation are key for any investor navigating this exciting yet unpredictable landscape. In conclusion, Peter Schiff’s unexpected advice to sell Ether for Bitcoin highlights the nuanced perspectives even critics hold regarding the crypto market’s two titans. While Bitcoin is championed for its “digital gold” narrative and perceived stability, Ethereum’s vast ecosystem and ongoing innovation face the challenge of increasing competition. The decision to adjust your Ethereum Bitcoin holdings is a personal one, requiring careful consideration of your financial goals, risk tolerance, and a thorough understanding of each asset’s unique value proposition. Always conduct your own research and consider professional advice before making investment decisions in this volatile space. Frequently Asked Questions (FAQs) Q1: Who is Peter Schiff and why is his opinion on crypto significant? A1: Peter Schiff is a prominent American stockbroker, financial commentator, and staunch advocate for gold. He is widely known for his bearish views on the U.S. dollar and his consistent skepticism towards Bitcoin and other cryptocurrencies. His opinion is significant because he represents a traditional financial perspective, and any shift or nuance in his stance, even a critical one, garners attention from both traditional and crypto investors. Q2: What did Peter Schiff specifically say about selling ETH and buying BTC? A2: On X, Peter Schiff stated, “As much as it pains me to say, selling Ether and buying Bitcoin with the proceeds is a better trade than holding Ether.” He further explained that “Ether has more acknowledged competition for the narrative of its use case,” implying Bitcoin’s narrative is more robust. Q3: What does “acknowledged competition for the narrative of its use case” mean for Ethereum? A3: This phrase refers to the fact that while Ethereum is a leading smart contract platform, it faces strong competition from other Layer 1 blockchains like Solana, Avalanche, and Cardano, which also aim to host decentralized applications and DeFi. Bitcoin, primarily a store of value, has fewer direct competitors in its core use case. Q4: Is Peter Schiff’s advice considered financial advice? A4: No, Peter Schiff’s comments are his personal opinion and should not be considered financial advice. Investment decisions, especially in volatile markets like cryptocurrency, should always be based on individual research, risk assessment, and potentially consultation with a qualified financial advisor. Q5: Should I sell my Ethereum and buy Bitcoin based on this advice? A5: The decision to adjust your portfolio, including an Ethereum Bitcoin swap, is highly personal. It depends on your investment goals, risk tolerance, and market outlook. It is crucial to conduct your own thorough research into both assets and consider a diversified approach rather than acting solely on one opinion. Did you find this analysis of Peter Schiff’s surprising crypto advice insightful? Share this article with your friends and on social media to spark a conversation about the evolving dynamics of Ethereum Bitcoin and the future of cryptocurrency investments! To learn more about the latest explore our article on key developments shaping Bitcoin price action. This post Ethereum Bitcoin: Peter Schiff’s Bold Call to Action for Your Portfolio first appeared on BitcoinWorld and is written by Editorial Team",bitcoinworld,https://bitcoinworld.co.in/ethereum-bitcoin-schiff-advice/,"BTC|ETH|FIAT|MARKET|BUSINESS","Crypto News|#Peter Schiff|BITCOIN|Crypto Strategy|ETHEREUM|investment advice",cryptocompare
2025-07-21T21:01:17,"StablecoinX Plans Nasdaq Listing and $360M ENA Token Reserve Amid Evolving Stablecoin Regulation","🚀 Are You Chasing New Coins? Catch the newest crypto opportunities. Be the first to buy, be the first to win! Click here to discover new altcoins! StablecoinX is set",coinotag,https://en.coinotag.com/stablecoinx-plans-nasdaq-listing-and-360m-ena-token-reserve-amid-evolving-stablecoin-regulation/,"ENA|FIAT|REGULATION|BTC|USDC","News|BTC|ENA|USDC|USDT",cryptocompare
2025-07-21T21:00:52,"Altcoins are having a moment – Is Bitcoin losing control of the market?","A growing disconnect between BTC and altcoins could trigger volatility and liquidations.",ambcrypto,https://ambcrypto.com/altcoins-are-having-a-moment-is-bitcoin-losing-control-of-the-market/,"ALTCOIN|BTC|MARKET","Altcoin|Bitcoin|News|News 1|Social|Trading View|ambcrypto",cryptocompare
2025-07-21T20:53:06,"Strategy Aims to Raise Another $500M for Bitcoin Buys With New Preferred Series","Strategy (MSTR) has launched its latest fundraising vehicle for additional bitcoin (BTC) purchases. The STRC Preferred Stock ( nicknamed ""stretch"" by the company ) will have an initial dividend rate of 9%. The company is looking to sell 5 million shares at $100 each for a total of $500 million. STRC will join the company's other preferred series of shares — STRK, STRF and STRD — not to mention the common stock at-the-market program, through which MSTR raised $736 million just last week for more bitcoin acquisitions. Strategy, of course, is gorilla among corporate bitcoin holders with more than 600,000 coins worth about $72 billion. MSTR is little-changed in after hours trade.",coindesk,https://www.coindesk.com/markets/2025/07/21/strategy-aims-to-raise-another-500m-for-bitcoin-buys-with-new-preferred-series,"BTC|BUSINESS|MARKET|STRK","Markets|Strategy|Michael Saylor|Bitcoin|News",cryptocompare
2025-07-21T21:36:01,"Polymarket set to reenter US with $112M acquisition of QCEX derivitives exchange","Polymarket comes back to the United States more than two years after US regulators dropped investigations into the predictions market platform.",Cointelegraph,https://cointelegraph.com/news/polymarket-reenter-us-acquisition-qcex-exchange?utm_source=rss_feed&utm_medium=rss&utm_campaign=rss_partner_inbound,"","",finnhub
2025-07-21T21:08:45,"Altcoin Season Heats Up as Ethereum and XRP Surge","The crypto market is showing clear signs of an emerging altcoin season as capital increasingly shifts away from Bitcoin (BTC-USD) dominance toward a broader array of digital assets. Ethereum (NASDAQ:ETH-USD) and XRP (NASDAQ:XRP-USD) have led this movement with remarkable price gains, while other altcoins and meme tokens have also joined the rally. This article analyzes … Continue reading ""Altcoin Season Heats Up as Ethereum and XRP Surge""",Cryptocurrency News,https://cryptocurrencynews.com/market-news/altcoin-season-heats-up-as-ethereum-and-xrp-surge/,"","",finnhub
2025-07-21T20:56:25,"StablecoinX to go public via SPAC merger, raising $360M for ENA treasury","The new entity will manage a crypto corporate reserve powered by the ENA token, with investors including Pantera, Galaxy Digital and the Ethena Foundation.",Cointelegraph,https://cointelegraph.com/news/stablecoinx-spac-merger-ena-treasury-ethena?utm_source=rss_feed&utm_medium=rss&utm_campaign=rss_partner_inbound,"","",finnhub
