datetime,headline,summary,source,url,categories,tags,api_source
2025-07-10T00:20:49,"Bitcoin’s Triumphant Surge: Historic 150 Million Won Milestone Unleashed in Korea","The cryptocurrency world is abuzz with monumental news from the East! Bitcoin’s price has once again defied expectations, breaching the significant 150 million won (KRW) mark on South Korea’s leading exchange, Upbit. This isn’t just a number; it’s a powerful statement about Bitcoin’s enduring strength, the robust appetite of the Korean crypto market , and the increasing mainstream acceptance of digital assets . For many, this milestone represents not just financial gain, but a validation of the decentralized future that blockchain technology promises. Let’s dive deep into what this historic achievement means for investors, the market, and the broader financial landscape. What Does a Bitcoin Price of 150 Million Won Mean for Korea? The psychological impact of Bitcoin surpassing 150 million won cannot be overstated, particularly within the highly active South Korean investment community. This isn’t merely a local record; it signifies a new peak in a market known for its intense trading volumes and unique dynamics. When Bitcoin hits such a formidable figure, it triggers a ripple effect: Investor Confidence Boost: Existing holders see their portfolios swell, reinforcing their belief in Bitcoin’s long-term value proposition. New Investor Influx: The headline-grabbing number attracts new retail investors, eager not to miss out on what appears to be a parabolic ascent. This FOMO (Fear Of Missing Out) often fuels further price increases. Increased Market Liquidity: Higher prices and renewed interest typically lead to more trading activity, enhancing market depth and liquidity on platforms like Upbit. Validation for Digital Assets: For a country that has seen both booms and busts in crypto, reaching this new high solidifies Bitcoin’s position as a legitimate, albeit volatile, investment vehicle. It moves beyond speculative asset to a recognized store of value for many. This milestone also highlights the ‘Kimchi Premium’ phenomenon, where Bitcoin often trades at a higher price on South Korean exchanges compared to global averages. This premium reflects the strong domestic demand and capital controls, making the 150 million won mark even more impressive within its local context. Unpacking the Unique Dynamics of the Korean Crypto Market South Korea stands out as one of the most vibrant and influential Korean crypto markets globally. Its distinct characteristics play a crucial role in Bitcoin’s price movements and the overall adoption of digital assets : High Retail Participation: A significant portion of the Korean population, particularly younger demographics, actively participates in cryptocurrency trading. This grassroots interest drives considerable market activity. Technologically Savvy Population: South Korea’s advanced technological infrastructure and high internet penetration make it fertile ground for digital innovations like cryptocurrencies. Regulatory Landscape: The Korean government has been proactive in establishing regulations for the crypto sector, aiming to balance innovation with investor protection. While strict at times, this regulatory clarity has also lent a degree of legitimacy to the market. The ‘Kimchi Premium’ Explained: This persistent phenomenon, where cryptocurrencies trade at a premium in Korea compared to international markets, is a testament to strong domestic demand and limited arbitrage opportunities due to capital controls. When Bitcoin reaches 150 million won in Korea, it often means it’s trading significantly higher than its USD equivalent elsewhere. Understanding these unique dynamics is key to appreciating the full impact of Bitcoin’s recent surge. The market’s maturity and investor sophistication contribute to its resilience and rapid response to global trends. The Role of Upbit Exchange in Bitcoin’s Korean Triumph No discussion of Bitcoin’s performance in Korea is complete without acknowledging the pivotal role of the Upbit exchange . As the largest cryptocurrency exchange in South Korea by trading volume, Upbit is the primary gateway for millions of Korean investors to access the crypto market. Its dominance means that its price reflects the collective sentiment and trading activity of a significant portion of the nation’s crypto enthusiasts. Upbit offers a robust trading platform, a wide array of digital assets, and high liquidity, making it the preferred choice for both seasoned traders and newcomers. The platform’s ability to handle massive trading volumes efficiently is crucial during periods of rapid price appreciation, like Bitcoin’s climb to 150 million won . The seamless execution of trades on Upbit directly contributes to the market’s efficiency and investor confidence. Key Features of Upbit that Contribute to Market Health: Feature Impact on Market High Liquidity Ensures smooth trading, minimizes price slippage, especially during volatile periods. Wide Range of Assets Attracts diverse investors, offers more trading opportunities beyond Bitcoin. Strong Security Measures Builds trust among users, essential for protecting large sums of digital assets . User-Friendly Interface Lowers the barrier to entry for new investors, fostering broader adoption. The activity on the Upbit exchange is a powerful barometer for the health and direction of the entire Korean crypto market . When Bitcoin reaches new highs on Upbit, it’s a clear signal of strong domestic demand. Beyond Bitcoin: The Broader Impact on Digital Assets in Korea While Bitcoin often captures the headlines, its monumental surge to 150 million won has a significant ripple effect across the entire spectrum of digital assets . Historically, Bitcoin’s strong performance tends to pull the rest of the altcoin market higher, a phenomenon often referred to as ‘altcoin season’ or ‘trickle-down effect’. For the Korean market, this means: Increased Altcoin Interest: As Bitcoin’s price becomes less accessible for some new investors, or as existing investors seek higher potential returns, attention often shifts to other cryptocurrencies. Growth in Decentralized Finance (DeFi) and NFTs: The renewed interest in the broader crypto space encourages exploration of innovative sectors like DeFi, which offers decentralized financial services, and Non-Fungible Tokens (NFTs), which represent digital ownership. Innovation and Development: A thriving market provides incentives for developers and entrepreneurs to build new blockchain projects and applications, further solidifying Korea’s position as a hub for crypto innovation. Regulatory Scrutiny and Adaptation: With increased market activity and value, regulators may also intensify their focus on consumer protection and market integrity, leading to a more mature and regulated environment for all digital assets . The current bullish sentiment, largely driven by Bitcoin’s impressive Bitcoin price action, is fostering an environment where a wider array of blockchain-based projects can gain traction and adoption within the Korean crypto market . Navigating the Momentum: Challenges and Actionable Insights for Investors While the surge past 150 million won is cause for celebration, it’s crucial for investors to approach the market with a balanced perspective. The cryptocurrency market, by its very nature, is highly volatile. What goes up can also come down, sometimes dramatically. Here are some actionable insights: Do Your Own Research (DYOR): Before investing in any digital assets , thoroughly research the project, its technology, team, and market cap. Don’t rely solely on hype. Understand Risk Tolerance: Only invest what you can afford to lose. Bitcoin’s journey to 150 million won has been filled with significant corrections. Diversification: While Bitcoin is a strong performer, consider diversifying your portfolio across different cryptocurrencies or even traditional assets to mitigate risk. Long-Term vs. Short-Term: Decide if you are investing for short-term gains or long-term growth. Different strategies apply to each. Stay Informed: Keep abreast of global macroeconomic factors, regulatory changes, and technological developments that can impact the Bitcoin price and the broader Korean crypto market . For those considering entering the market or expanding their portfolios on the Upbit exchange , this period of high momentum offers both opportunities and heightened risks. Prudent decision-making and a clear strategy are paramount. The Road Ahead: What’s Next for Bitcoin and the Korean Market? The question on everyone’s mind is, “What’s next?” While no one can predict the future with certainty, several factors could influence Bitcoin’s trajectory beyond 150 million won and the overall health of the Korean crypto market : Global Macroeconomic Conditions: Inflation rates, interest rate decisions by central banks, and geopolitical events can all impact investor appetite for risk assets like Bitcoin. Institutional Adoption: Continued influx of institutional money through spot ETFs and corporate treasury allocations could provide significant buying pressure, pushing the Bitcoin price even higher. Technological Developments: Upgrades to the Bitcoin network or the broader blockchain ecosystem could enhance utility and drive demand for digital assets . Regulatory Clarity: Further clear and supportive regulations in major economies, including South Korea, could provide more confidence for both retail and institutional investors. Halving Cycles: Bitcoin’s programmatic supply reduction events (halvings) have historically preceded significant bull runs. The recent halving’s impact is still unfolding. The journey of Bitcoin has always been marked by volatility, but its resilience and growing acceptance are undeniable. The Korean crypto market , with its unique characteristics and enthusiastic participant base, will undoubtedly continue to play a crucial role in this global narrative. Conclusion: A New Era for Bitcoin in Korea Bitcoin’s ascent past the 150 million won mark on the Upbit exchange is more than just a fleeting headline; it’s a testament to the cryptocurrency’s growing maturity, its unwavering appeal, and the dynamic strength of the Korean crypto market . This historic achievement solidifies Bitcoin’s position as a premier digital asset and opens new discussions about its role in the global financial system. While the path ahead may be volatile, this milestone serves as a powerful reminder of the transformative potential of decentralized finance. It underscores the importance of staying informed, managing risk, and embracing the evolving landscape of digital currencies. To learn more about the latest crypto market trends, explore our article on key developments shaping Bitcoin price action.",bitcoinworld,https://bitcoinworld.co.in/bitcoin-price-korea-milestone/,"BTC|MARKET|TRADING|EXCHANGE|ASIA","Crypto News|#KOREA|#Upbit|BITCOIN|CRYPTOCURRENCY|Market Analysis",cryptocompare
2025-07-10T00:12:40,"Shiba Inu Shows Potential Recovery as Ethereum Accumulates and XRP Approaches Key Resistance Levels","XRP’s recent 10% rally has propelled it into a critical technical zone, signaling renewed bullish momentum and increased investor confidence. Shiba Inu’s breakout above its 26-day EMA offers fresh optimism",coinotag,https://en.coinotag.com/shiba-inu-shows-potential-recovery-as-ethereum-accumulates-and-xrp-approaches-key-resistance-levels/,"SHIB|ETH|XRP|TRADING|BTC","Ethereum|News|BTC|ETH|SHIB|XRP",cryptocompare
2025-07-10T00:10:52,"Spot Bitcoin ETF: SEC’s Crucial Acknowledgment Ignites Bitwise ETF Hopes","The world of digital assets is constantly evolving, and a recent development from the U.S. Securities and Exchange Commission (SEC) has sent ripples of anticipation across the crypto community. The SEC’s acknowledgment of an amendment from Bitwise concerning physical redemptions for its proposed Spot Bitcoin ETF and Ethereum ETFs is more than just bureaucratic paperwork; it’s a crucial signal that could shape the future of institutional crypto adoption. This move brings us closer to a new era where mainstream investors can access digital assets with greater ease and regulatory clarity. What Does it Mean When the SEC Acknowledges an Amendment? When the SEC acknowledges an amendment, it signifies that the regulatory body has officially received and begun reviewing updated filings from an applicant. In this case, Bitwise submitted an amendment detailing how its proposed spot Bitcoin and Ethereum ETFs would handle ‘physical redemptions.’ This isn’t an approval, but it’s a necessary procedural step that indicates the application is still active and being considered. For the crypto market, every such acknowledgment is scrutinized for hints about the SEC’s evolving stance on digital asset products, especially after a period of significant regulatory caution. Historically, the SEC has been hesitant to approve spot crypto ETFs, citing concerns around market manipulation, investor protection, and the nascent nature of the underlying assets. However, the landscape has been shifting, particularly following landmark court decisions and increased institutional interest. Bitwise, a prominent player in the crypto investment space, has been at the forefront of pushing for these products, continually refining their applications to meet regulatory expectations. This latest amendment suggests a proactive approach by Bitwise to address potential SEC concerns, particularly around the mechanics of ETF operations. The Game-Changer: Understanding Physical Redemptions One of the most significant aspects of Bitwise’s amendment is its focus on Physical Redemptions . To understand why this is a potential game-changer, let’s compare it with the more common ‘cash redemption’ model: Cash Redemption Model: In this model, when an investor wants to redeem their ETF shares, the issuer sells the underlying assets (e.g., Bitcoin) in the open market and gives the investor cash. This method can introduce tax complexities for the issuer and potentially impact the underlying asset’s price through selling pressure. Physical Redemption Model: Here, when an investor redeems ETF shares, they receive the actual underlying asset (e.g., Bitcoin or Ethereum) directly, rather than cash. This is often preferred by institutional investors and large market makers because it allows for more efficient arbitrage opportunities, potentially leading to tighter tracking between the ETF’s price and the underlying asset’s price. It also avoids certain tax events for the issuer that arise from selling assets. For the SEC, allowing physical redemptions could be seen as a step towards greater integration of crypto assets into traditional financial frameworks, albeit with careful oversight. It addresses concerns about how the ETF interacts with the spot market and could provide a more direct, transparent link to the underlying digital assets. This mechanism is crucial for market makers to efficiently create and redeem ETF shares, ensuring the ETF trades close to its net asset value (NAV) and maintaining market integrity. Cash vs. Physical Redemption in ETFs Feature Cash Redemption Physical Redemption Underlying Asset Exchange Issuer sells assets for cash; investor receives cash. Issuer directly transfers assets; investor receives assets. Tax Implications (for issuer) Potential capital gains/losses on asset sales. Generally no direct tax event on asset transfer. Arbitrage Efficiency Less direct, potential for slight tracking errors. More direct, better for precise arbitrage. Market Impact Can create selling pressure on underlying asset. Direct transfer, less direct market impact from redemption. Institutional Preference Less preferred for large-scale operations. Often preferred for operational efficiency. The Road Paved for a Spot Bitcoin ETF The journey towards a fully approved Spot Bitcoin ETF in the U.S. has been long and arduous, marked by numerous rejections and delays. However, 2024 has witnessed a breakthrough with the approval of several spot Bitcoin ETFs, transforming how investors can gain exposure to the world’s largest cryptocurrency. These approvals have been hailed as a watershed moment, bringing Bitcoin into the mainstream financial ecosystem and attracting significant institutional capital. The SEC’s current acknowledgment of Bitwise’s amendment builds on this momentum, signaling continued refinement and potential expansion of the existing framework. The introduction of spot Bitcoin ETFs has democratized access to Bitcoin, allowing investors to trade it through traditional brokerage accounts without the complexities of direct crypto ownership, such as setting up wallets or managing private keys. This has opened the floodgates for new capital, providing a regulated, accessible, and often more cost-effective way to invest in Bitcoin. The success of these initial products has likely encouraged further regulatory review and a deeper understanding of the mechanisms required for their smooth operation, including the nuanced details of redemption processes. What About the Spot Ethereum ETF? While Bitcoin has garnered much of the spotlight, the prospect of a Spot Ethereum ETF is also gaining significant traction. Ethereum, with its robust ecosystem of decentralized applications (dApps), NFTs, and DeFi, represents another critical pillar of the crypto economy. Many analysts believe that the approval of spot Bitcoin ETFs sets a precedent for Ethereum, as the underlying regulatory and market dynamics share many similarities. However, there are unique considerations for Ethereum, particularly concerning its transition to a Proof-of-Stake (PoS) consensus mechanism and its classification by the SEC. Bitwise’s amendment for both Bitcoin and Ethereum ETFs suggests a comprehensive strategy to address regulatory concerns for both major cryptocurrencies. The path for an Ethereum ETF might be slightly different due to its distinct features and ongoing regulatory discussions about whether ETH should be classified as a security or a commodity. Nevertheless, the SEC’s engagement with Bitwise’s Ethereum ETF amendment indicates that discussions are progressing, and the possibility of an ETH ETF joining its BTC counterpart in the near future remains high, offering investors diversified exposure to the top two digital assets. Bitwise ETFs: Pioneering the Next Wave of Crypto Investment Bitwise ETFs have consistently been at the forefront of bringing crypto assets into regulated financial products. From their early efforts in launching crypto index funds to their persistent pursuit of spot ETFs, Bitwise has demonstrated a commitment to bridging the gap between traditional finance and the digital asset space. Their strategic filings and amendments, like the one recently acknowledged by the SEC, highlight their dedication to meeting stringent regulatory requirements and innovating within the evolving crypto landscape. Bitwise’s proactive approach in proposing physical redemptions underscores their understanding of institutional needs and market efficiency. By addressing these intricate operational details, they aim to create ETF products that are not only compliant but also highly attractive to a broad range of investors, from retail participants seeking easy access to sophisticated institutional players looking for efficient arbitrage mechanisms. Their ongoing efforts are crucial in shaping the regulatory dialogue and setting benchmarks for future crypto-backed financial products. The Road Ahead: Challenges and Opportunities While the SEC’s acknowledgment is a positive step, the road to full approval for all aspects of these ETFs, especially those involving physical redemptions, still presents challenges. Regulatory scrutiny remains high, and the SEC will likely demand robust frameworks for custody, valuation, and market surveillance to protect investors. Furthermore, the inherent volatility of cryptocurrencies will continue to be a factor for both regulators and investors to consider. However, the opportunities are immense. The approval of more sophisticated ETF structures, such as those with physical redemption capabilities, could further legitimize digital assets as an asset class, attracting even more capital and fostering greater market liquidity. It could also spur innovation in related financial services and products, cementing cryptocurrencies’ place in the global financial system. For investors, it means more options, greater flexibility, and potentially lower costs for gaining exposure to this dynamic asset class. Conclusion: A Step Towards Maturation The U.S. SEC’s acknowledgment of Bitwise’s amendment for physical redemptions in its proposed spot Bitcoin and Ethereum ETFs marks another significant milestone in the journey of digital assets into mainstream finance. While not an outright approval, it signals continued engagement and a deeper dive into the operational mechanics that are crucial for robust, regulated ETF products. The focus on physical redemptions highlights a move towards greater efficiency and alignment with institutional preferences, potentially paving the way for more sophisticated and attractive investment vehicles. This development underscores the growing maturity of the cryptocurrency market and the persistent efforts of firms like Bitwise to innovate within regulatory boundaries. As the dialogue between innovators and regulators continues, the prospect of more accessible and diverse crypto investment products becomes increasingly real, promising a future where digital assets play an even more integral role in global portfolios. Keep a close watch on these developments, as they are shaping the financial landscape of tomorrow. To learn more about the latest crypto market trends, explore our article on key developments shaping Bitcoin and Ethereum institutional adoption.",bitcoinworld,https://bitcoinworld.co.in/sec-acknowledges-bitwise-etfs/,"REGULATION|BTC|MARKET|BUSINESS|ETH","Crypto News|BITCOIN|CRYPTOCURRENCY|ETFs|ETHEREUM|SEC",cryptocompare
2025-07-10T00:02:37,"Emirates and Crypto.com Explore Potential Bitcoin Payment Integration in Upcoming Digital Payment System","Emirates Airlines is set to integrate cryptocurrency payments through a new partnership with Crypto.com, marking a significant step in digital payment adoption within the aviation sector. This collaboration aims to",coinotag,https://en.coinotag.com/emirates-and-crypto-com-explore-potential-bitcoin-payment-integration-in-upcoming-digital-payment-system/,"BTC","News|BTC",cryptocompare
