datetime,headline,summary,source,url,categories,tags,api_source
2025-07-09T23:20:05,"Urgent: US FOMC Warns Tariffs Threaten Alarming Inflation Spike","The financial world, and especially the dynamic realm of cryptocurrencies, often hangs on every word from central banks. Recently, the U.S. Federal Reserve’s Federal Open Market Committee (FOMC) released the minutes from its June 2025 meeting, sending ripples across markets. For crypto investors , understanding these insights is paramount, as the Fed’s stance on monetary policy directly influences the broader economic landscape and, by extension, the performance of digital assets like Bitcoin . This latest report highlights a significant concern: the potential for tariffs to ignite an alarming surge in inflation . Let’s dive deep into what the FOMC discussed and what it means for your portfolio. Understanding the June 2025 FOMC Meeting Minutes The Federal Open Market Committee’s deliberations are always closely watched, providing crucial insights into the economic outlook and the future direction of monetary policy. The June 2025 minutes, as summarized by Bitcoin World, revealed several key takeaways that are essential for anyone tracking the markets: Unanimous Agreement on Current Rates: All members of the committee concurred that it was appropriate to maintain interest rates at their prevailing level. This decision signals a collective assessment that the current economic conditions, including employment and inflation trends, do not warrant an immediate change in borrowing costs. Hawkish Perspectives Emerge: A segment of the FOMC expressed a more hawkish stance. These members suggested that the current federal funds rate might not be significantly higher than the neutral rate—the theoretical rate that neither stimulates nor restricts economic growth. This viewpoint implies a belief that monetary policy may not be as restrictive as previously thought, potentially necessitating a longer period of higher rates to achieve desired economic outcomes. Dovish Openness to Future Cuts: Conversely, some members indicated a willingness to consider cutting rates as early as the July meeting, provided that incoming economic data aligns with their expectations. This data-dependent approach underscores the committee’s flexibility and responsiveness to evolving economic indicators, such as employment figures, consumer spending, and inflation readings. Broad Expectation of Rate Cuts This Year: A significant majority of members anticipated that a rate cut would become necessary at some point later in the year, given appropriate circumstances. This consensus suggests a general trajectory towards easing monetary policy, albeit with careful consideration of economic developments. Tariffs as an Inflationary Risk: Perhaps the most striking revelation was the widespread concern among most members that tariffs pose a substantial risk of stimulating inflation. This point is particularly critical for markets, as it introduces a new, external factor that could complicate the Fed’s efforts to manage price stability. The Great Debate: Future of Interest Rates and Economic Stability The discussions within the FOMC reveal a nuanced internal debate about the path forward for monetary policy. This isn’t a monolithic body; it’s a collection of diverse economic viewpoints trying to navigate complex data. The divergence between hawkish and dovish members highlights the challenges of balancing economic growth with price stability. Here’s a breakdown of the two main camps: Stance Key Beliefs Potential Implications Hawkish Members Believe current rates might not be restrictive enough; concerned about persistent inflation. May advocate for holding rates longer or even hiking if inflation accelerates. Higher borrowing costs for longer, potentially slower economic growth, stronger dollar. Dovish Members More focused on potential economic slowdown or disinflation; willing to cut rates sooner if data supports it. Emphasize risks to employment. Lower borrowing costs, potential economic stimulus, weaker dollar, potentially positive for risk assets. This internal tug-of-war is crucial for markets. The balance between these views will ultimately determine the timing and magnitude of any future rate adjustments. For crypto investors , understanding this dynamic is key, as shifts in interest rate expectations can trigger significant movements in asset prices. The Alarming Threat: How Tariffs Fuel Inflation The most pressing concern voiced by the FOMC is the inflationary potential of tariffs. But how exactly do these trade barriers lead to higher prices? Tariffs are taxes imposed on imported goods and services. When a country imposes tariffs, it makes foreign goods more expensive, aiming to make domestically produced goods more competitive or to raise revenue. The Mechanism of Tariff-Induced Inflation: Increased Import Costs: When tariffs are levied, the cost of importing goods rises. Importers typically pass these increased costs on to consumers in the form of higher retail prices. For example, if a tariff is placed on imported electronics, the price of those electronics in stores will likely go up. Reduced Competition: Tariffs can reduce the supply of foreign goods in the market, thereby decreasing competition. With fewer foreign options, domestic producers might face less pressure to keep their prices low, leading to overall price increases. Supply Chain Disruptions: Tariffs can disrupt established global supply chains, forcing companies to find alternative, often more expensive, sources for materials or components. These higher production costs are then passed down to the end consumer. Retaliatory Tariffs: When one country imposes tariffs, others often retaliate with their own tariffs on the first country’s exports. This can lead to a trade war, further increasing costs for businesses and consumers across multiple sectors. Challenge: Impact on Consumer Purchasing Power The direct consequence of tariff-driven inflation is a reduction in consumer purchasing power. As prices for everyday goods and services rise, each dollar buys less. This can erode savings, reduce discretionary spending, and put a strain on household budgets. For the broader economy, persistent inflation can lead to wage-price spirals, where workers demand higher wages to compensate for rising costs, which in turn leads businesses to raise prices further. This cycle can be difficult to break and poses a significant challenge to economic stability, impacting everything from housing costs to the price of your morning coffee. Navigating the Currents: What This Means for Bitcoin and Digital Assets The FOMC’s discussions, particularly on tariffs and inflation, have profound implications for the cryptocurrency market. Historically, Bitcoin has been touted as a potential hedge against inflation, often referred to as ‘digital gold.’ However, its performance during inflationary periods has been mixed, depending on the broader macroeconomic context. Bitcoin as an Inflation Hedge: The Debate The Narrative: Proponents argue that Bitcoin’s fixed supply (21 million coins) makes it inherently resistant to the inflationary pressures that can devalue fiat currencies, which can be printed in unlimited quantities by central banks. In times of rising prices, investors might seek refuge in scarce assets. The Reality: While Bitcoin shares some characteristics with traditional inflation hedges like gold, its relatively young age and high volatility mean it doesn’t always act as a reliable safe haven. During periods of aggressive monetary tightening (like rate hikes to combat inflation), risk assets, including cryptocurrencies, tend to suffer as liquidity tightens and investors seek safer, yield-bearing assets. Impact of Interest Rates on Crypto: The Fed’s stance on interest rates is a critical determinant for crypto market sentiment. Higher rates typically increase the cost of capital, making speculative investments less attractive and drawing funds away from riskier assets like cryptocurrencies towards safer, interest-bearing traditional investments. Conversely, the prospect of rate cuts, as discussed by some FOMC members, can signal looser monetary policy, potentially boosting liquidity and making risk assets more appealing. Challenge: Volatility and Macro Sensitivity The crypto market remains highly sensitive to macroeconomic indicators and central bank policy. News of potential inflation, or hawkish signals from the Fed, can lead to increased volatility. Crypto investors need to be aware that while the long-term narrative for digital assets may involve hedging against traditional financial system flaws, the short-to-medium term price action is heavily influenced by global economic health and monetary policy decisions. Empowering Your Portfolio: Actionable Insights for Crypto Investors Given the insights from the latest FOMC meeting and the looming threat of tariff-induced inflation , how should crypto investors position themselves? Staying informed and adopting a strategic approach is more critical than ever. Key Actions to Consider: Monitor Economic Data Closely: Pay close attention to upcoming inflation reports (CPI, PCE), employment figures, and GDP growth. These will be key in influencing the Fed’s decisions regarding interest rates and potential rate cuts. The data dependency of the FOMC means that economic releases will directly impact market sentiment. Understand the Inflation Narrative: While Bitcoin has long been considered an inflation hedge, its effectiveness can vary. Diversify your understanding beyond just this narrative. Consider how different inflation scenarios (e.g., supply-side vs. demand-side inflation) might affect various crypto assets. Assess Your Risk Tolerance: In an environment of economic uncertainty and potential inflation, volatility can increase. Re-evaluate your personal risk tolerance and ensure your portfolio allocation aligns with it. Avoid over-leveraging and maintain a healthy cash position for opportunities or to weather downturns. Diversify Your Crypto Holdings: Don’t put all your eggs in one basket. While Bitcoin is the market leader, consider a diversified portfolio that includes other major cryptocurrencies, stablecoins (for capital preservation), and perhaps even exposure to different sectors within crypto (e.g., DeFi, NFTs, Layer 2s) that might react differently to macro trends. Focus on Long-Term Fundamentals: While short-term price movements are influenced by macro news, the long-term value of many crypto projects lies in their underlying technology, utility, and adoption. Continue to research and invest in projects with strong fundamentals and real-world use cases. Stay Informed on Trade Policy: Given the FOMC’s specific concern about tariffs, keep an eye on global trade policies and geopolitical developments. Escalations in trade disputes could directly impact inflation and, subsequently, central bank policy. Conclusion: Staying Ahead in a Dynamic Market The U.S. Federal Reserve’s latest FOMC minutes serve as a critical reminder of the interconnectedness of global finance. The unanimous decision to hold interest rates , coupled with the internal debate on future cuts and the alarming warning about tariff-induced inflation , paints a complex picture for the economy. For Bitcoin and the broader crypto market, these macro shifts are not just background noise; they are fundamental drivers of sentiment and price action. By understanding the Fed’s concerns, particularly regarding tariffs and their inflationary potential, and by proactively adjusting your investment strategy, crypto investors can better navigate the turbulent waters ahead. Staying informed, adaptable, and focused on long-term value will be your greatest assets in this evolving landscape. To learn more about the latest crypto market trends, explore our article on key developments shaping Bitcoin price action.",bitcoinworld,https://bitcoinworld.co.in/fomc-tariffs-inflation-impact/,"MARKET|BTC|TRADING|BUSINESS|FIAT","Crypto News|BITCOIN|CRYPTOCURRENCY|FOMC|Inflation|monetary policy",cryptocompare
2025-07-09T23:00:33,"Last Crash Before The Surge: Why Bitcoin Is Set To Drop Below $107,000","A new analysis shows that Bitcoin (BTC) may be on the verge of a calculated price crash that could take it below $107,000 before igniting the next bullish rally. The cryptocurrency market structure currently reflects a short-term bearish correction within a broader bullish trend, supporting the likelihood of a potential surge to new all-time highs soon. Bitcoin Prepares For Final Dip Below $107,000 Crypto market expert, Tehi Thomas, in a recent TradingView post, suggested that Bitcoin’s current structure may be entering its final corrective phase. The analyst points to a potential price crash below the $107,000 level as part of a strategic play by smart money. Related Reading: Bitcoin To Repeat Parabolic Phase From 2017 And 2021? Here’s The Target The analyst shared a chart showing Bitcoin forming consecutive lower highs while its price presses downwards. Across these highs, the market is also respecting a descending trendline, a pattern which often indicates short-term bearish pressure. Notably, this trendline appears to be serving as a potential trap designed to engineer a liquidity grab and discount entry. Thomas notes that once the key zone and sell-side liquidity area around $107,800 is taken, Bitcoin’s price is expected to dip into a nearby Fair Value Gap (FVG), extending down to the $106,500-$106,200 region. This FVG overlaps with critical Fibonacci levels, particularly the 0.786 retracement near $106,200, strengthening the confluence for a potential reversal point. Thomas has highlighted this $106,200 level as a high-probability buy zone, where institutions may re-enter the market. Notably, the analyst’s anticipated price correction for Bitcoin is not seen as a breakdown of structure or market failure, but rather a calculated liquidity grab to fill inefficiencies left from the previous lag. As long as the price respects the $106,000 range and displays bullish order flow afterward, its projected correction is expected to complete the accumulation phase. All-Time Highs In Sight After Key Reversal Following Bitcoin’s projected sweep and fill of the FVG, the cryptocurrency is expected to form a reversal structure that could kick off the next major rally. Despite the projected crash below $107,000, Thomas asserts that Bitcoin’s overall macro trend remains bullish. Moreover, this short-term pullback is considered a setup for a much larger move toward a new all-time high. Related Reading: Bitcoin Price To See 52% Increase To $166,000, Analyst Reveals Tight Timeline Thomas’s chart marks the $110,500 zone as the final magnet and ATH target, with a significant layer of untapped liquidity above it. The analyst’s thesis is that once the sell-side pressure is exhausted and displacement confirms the shift in direction, Bitcoin could once again regain bullish momentum. Furthermore, the TradingView expert has pointed out that the FVG near $106,200 acts as both a liquidity magnet and a springboard, set to launch the flagship cryptocurrency into price discovery mode once again. Currently, Bitcoin is trading at $108,744, meaning a potential surge to the projected ATH level at $110,500 will represent a 1.61% increase. Featured image from Pixabay, chart from Tradingview.com",newsbtc,https://www.newsbtc.com/news/bitcoin/bitcoin-to-drop-below-107000/,"BTC|TRADING|MARKET|SPONSORED","Bitcoin|bitcoin|Bitcoin news|bitcoin price|btc|BTC news|btc price|btcusd|BTCUSDT|Descending Trendline|Fair Value Gap|Fibonacci Levels|FVG|Tehi Thomas",cryptocompare
2025-07-09T22:36:55,"Thumzup Explores Adding Dogecoin and Other Cryptocurrencies to Bitcoin Holdings","Thumzup, a publicly traded social media marketing tech company, is evaluating expanding its corporate treasury beyond Bitcoin to include cryptocurrencies like Dogecoin, Solana, XRP, Ethereum, and USDC. The Los Angeles-based",coinotag,https://en.coinotag.com/thumzup-explores-adding-dogecoin-and-other-cryptocurrencies-to-bitcoin-holdings/,"BTC|DOGE|ETH|REGULATION|SOL","News|BTC|DOGE",cryptocompare
2025-07-09T22:31:02,"Bitcoin Treasury Firm Thumzup Considering Dogecoin, XRP Buys as Trump Jr. Invests","Publicly traded Thumzup is considering whether it should stash more cryptocurrencies beyond Bitcoin, including Dogecoin, Solana, and XRP.",decrypt,https://decrypt.co/329427/bitcoin-treasury-firm-thumzup-considering-dogecoin-xrp-trump-jr-invests,"DOGE|BTC|XRP|REGULATION|BUSINESS","|dogecoin|Business",cryptocompare
2025-07-09T22:30:30,"Bitcoin Breakthrough: H100’s Bold Move Fuels Swedish Corporate Crypto Adoption","In a significant development echoing the growing trend of digital asset integration, H100, a prominent Swedish health-tech company, has once again made headlines with its latest strategic acquisition of Bitcoin. This move isn’t just another transaction; it underscores a deeper shift in how corporations view and manage their treasury assets. If you’ve been following the world of cryptocurrencies, you’ll know that Bitcoin corporate adoption is becoming an increasingly compelling narrative, and H100 is at the forefront of this fascinating evolution. What’s Driving H100’s Bitcoin Accumulation? The news from H100 outlines their purchase of an additional 46.93 BTC, bringing their total holdings to an impressive 294.5 BTC. This isn’t their first foray into the crypto market; Bitcoin World previously reported on H100’s substantial fundraising efforts, where they raised $54 million through stocks and convertible bonds specifically to finance Bitcoin purchases. But why is a health-tech company in Sweden making such a bold move into digital assets? Several factors are likely at play, reflecting a broader shift in corporate financial strategies: Inflation Hedge: In an era of unprecedented quantitative easing and rising inflation concerns globally, companies are seeking assets that can preserve or even grow purchasing power. Bitcoin, often dubbed ‘digital gold,’ is increasingly seen as a robust hedge against currency debasement. Diversification: Traditional treasury management typically involves cash, bonds, and short-term securities. Adding Bitcoin offers a non-correlated asset that can diversify a company’s balance sheet and potentially enhance returns. Technological Forward-Thinking: As a health-tech company, H100 operates at the cutting edge of innovation. Embracing Bitcoin aligns with their identity as a forward-looking entity, signaling their adaptability to new financial paradigms. Attracting Talent and Investors: For some, holding Bitcoin can make a company more attractive to a new generation of tech-savvy employees and investors who are increasingly comfortable with and invested in digital assets. The Strategic Imperative: H100 Bitcoin and Crypto Treasury Strategy H100’s approach is a prime example of a well-thought-out crypto treasury strategy . It’s not simply buying Bitcoin on a whim; it’s a calculated decision backed by significant capital raises. This strategic allocation reflects a growing belief among some corporate leaders that digital assets, particularly Bitcoin, have a legitimate place in a modern corporate balance sheet. Consider the following aspects of their strategy: Aspect H100’s Approach Significance Funding Mechanism Raised $54M via stocks/bonds specifically for BTC. Shows deliberate intent and investor confidence in their crypto vision. Incremental Buys Accumulating over time (46.93 BTC additional). Suggests a dollar-cost averaging strategy, mitigating volatility risk. Transparency Publicly announced holdings (294.5 BTC). Builds trust and sets a precedent for other companies. This systematic approach differentiates H100 from speculative retail investors, positioning them as a serious player in the institutional Bitcoin adoption space. The Swedish Company Bitcoin Narrative: A Global Trend? While MicroStrategy remains the poster child for corporate Bitcoin adoption, H100’s actions add another significant voice to the chorus. The fact that a Swedish company Bitcoin holding is making headlines highlights the global nature of this trend. It’s no longer just Silicon Valley tech giants; companies from diverse sectors and geographies are exploring Bitcoin as a viable treasury asset. Other notable examples include: MicroStrategy: Led by Michael Saylor, this business intelligence firm has amassed over 200,000 BTC, making it the largest corporate holder. Their strategy is explicitly to use Bitcoin as their primary treasury reserve asset. Tesla: While they have had a more volatile relationship with Bitcoin holdings, their initial purchase brought significant mainstream attention to corporate adoption. Block (formerly Square): Jack Dorsey’s company holds a substantial amount of Bitcoin, viewing it as a tool for economic empowerment and a long-term investment. H100’s decision strengthens the argument that Bitcoin is maturing into a legitimate asset class for corporations looking to innovate their financial strategies. It’s a testament to the increasing confidence in Bitcoin’s long-term value proposition and its potential to act as a hedge against macroeconomic uncertainties. Challenges and Opportunities in Institutional Bitcoin Adoption While the benefits are compelling, corporate Bitcoin adoption isn’t without its challenges. Volatility remains a primary concern, and companies must have a high tolerance for price swings. Regulatory uncertainty, particularly regarding accounting standards and tax implications, also poses hurdles. However, these challenges are often weighed against the potential opportunities: Potential for Significant Upside: Bitcoin’s historical performance suggests substantial growth potential over the long term. Innovation and Brand Image: Early adopters can position themselves as innovative and forward-thinking, appealing to a tech-savvy market. Reduced Counterparty Risk: Holding self-custodied Bitcoin can reduce reliance on traditional financial institutions, offering a degree of independence. H100’s continued investment signals that for some, the opportunities far outweigh the risks, particularly when managed through a disciplined strategy. What Does H100’s Bitcoin Strategy Mean for the Future? The consistent accumulation by companies like H100 suggests a growing conviction in Bitcoin’s role as a future-proof asset. Their latest purchase of 46.93 BTC is not just a number; it’s a signal. It indicates a sustained belief in Bitcoin’s value proposition and a willingness to commit significant capital to this emerging asset class. As more companies follow suit, whether for treasury management, payments, or investment, the overall market capitalization and stability of Bitcoin could see further enhancement. The narrative of institutional Bitcoin adoption is no longer just theoretical; it’s a tangible reality playing out across various industries and geographies. H100’s commitment serves as a powerful case study, demonstrating how a company can strategically integrate digital assets into its core financial operations. Conclusion: A New Era of Corporate Finance? H100’s latest Bitcoin acquisition is more than just a news item; it’s a beacon highlighting the evolving landscape of corporate finance. Their deliberate and significant investment in Bitcoin, funded through traditional financial instruments, showcases a powerful shift in treasury management. As the world continues to navigate economic uncertainties, the appeal of decentralized, inflation-resistant assets like Bitcoin will likely only grow. H100 is not just buying Bitcoin; they are investing in a future where digital assets play a fundamental role in global commerce and corporate strategy. This bold step by a Swedish health-tech company serves as a compelling testament to the unstoppable momentum of Bitcoin in the institutional world. To learn more about the latest Bitcoin trends, explore our article on key developments shaping Bitcoin institutional adoption.",bitcoinworld,https://bitcoinworld.co.in/h100-bitcoin-corporate-adoption/,"BTC|REGULATION|BUSINESS|MARKET|FIAT","Crypto News|BITCOIN|corporate adoption|CRYPTOCURRENCY|H100|SWEDEN",cryptocompare
2025-07-09T22:16:05,"Donald Trump Jr. May Increase Bitcoin Exposure Through $4 Million Investment in Thumzup","Donald Trump Jr. has made a significant $4 million investment in Thumzup, a corporate crypto holder expanding its portfolio beyond Bitcoin into prominent altcoins. Thumzup’s strategic move to incorporate Ethereum,",coinotag,https://en.coinotag.com/donald-trump-jr-may-increase-bitcoin-exposure-through-4-million-investment-in-thumzup/,"BTC|ETH|ALTCOIN","Bitcoin|Ethereum|News",cryptocompare
